title,author,supervisors,date,faculty,program,type,language,abstract,keywords
Freedom: Different Concepts or Different Values,"Taylor, Jacob G.P.","['Kalf, Wouter F.']",2019,Faculty of Humanities,Philosophy (MA) (60 EC),Master thesis,en,"This thesis makes the claim that the distinction made between positive and negative freedom (as well as between competing claims of freedom more generally) are not, and should not be about disagreements as to what ‘real’ or ‘true’ freedom is, but are instead expressions of which freedoms align with certain philosopher’s broader ideas of justice. What I believe this means is that it is wrong to claim that only a purely negative or positive concept of freedom is the only coherent concept of liberty, and that instead the disagreement and the distinctions made are in fact done so on disagreements about which freedoms are valuable and why. The overall value of instances of freedom is in turn derived from our theories of justice and the ethical commitments which comprise these theories. Therefore I argue, referring to the work of Carter, that a complete and coherent concept of freedom must be both value-neutral in that it does not give superiority to any particular ethical claims made in regards to freedom, and as value-free in that we do not define freedom as only those instances which are also just. It is because of this that I will defend an altered version of MacCallum’s triadic formulation of liberty, which I believe is most successful at encompassing what it is we mean when we’re talking about freedom, by presenting freedom as a relationship between agent, preventing condition - as well as a fulfilment condition that I have added - and an action or behaviour. In this way my altered version of MacCallum’s concept sets the foundations for what I will argue is a value-neutral and value-free concept of freedom, which gives a structure for us to make sense of all intelligible expressions of freedom and gives a neutral base from which to introduce other commitments and values to argue for certain types of freedom over others.","['freedom', 'value', 'value neutrality', 'MacCallum', 'liberty', 'Berlin', 'justice', 'distributive justice and freedom', 'negative freedom', 'positive freedom', 'Eric Nelson', 'Nozick', 'Rawls']"
De utopie van het midden: een representatieanalyse van de middenklasse in de moderne Nederlandse roman,"Vesters, Melchior","['Ieven, Bram']",2019,Faculty of Humanities,Neerlandistiek (MA),Master thesis,nl,"Dit onderzoek behandelt literatuur als representatie van sociale geschiedenis. Terwijl veel representatieonderzoek zich richt op ras of gender, staat nu klasse centraal: de hoofdvraag is hoe de middenklasse in de moderne Nederlandse roman wordt gerepresenteerd. De eerste subvraag betreft de analyse van klasse überhaupt. Door een historische terugblik op de marxistisch-ideologische hantering van dit concept te confronteren met moderne cognitief-semiotische inzichten betreffende representatie en identificatie, wordt duidelijk gemaakt dat klasse op niet-ideologische manier is te analyseren. De tweede subvraag betreft de operationalisering van het analyseren van klasse en (het concept) middenklasse in het bijzonder. Met inzet van sociologische en sociaalpsychologische inzichten wordt een relationele opvatting van klasse voorgesteld. In de literaire analyse (van romans van Dautzenberg, Hermsen, Treur en De Coster) wordt getoond hoe klassegerelateerde omstandigheden in relaties van personage een rol spelen alsook hoe deze omstandigheden in aspecten zoals (de omgang) met ruimte een rol spelen. Het resultaat is een aantal patronen bij middenklassepersonages betreffende niet alleen materiële condities, maar ook filosofische/ideologische voorkeuren en hun zelfopvattingen in relatie tot een collectief. In het algemeen is te stellen dat bij middenklassepersonages de ervaring van klasse geïndividualiseerd is, hetgeen evenwel niet wegneemt dat aan klasse gerelateerde omstandigheden in hun relaties doorwerken. Vervolgonderzoek kan de patronen aanvullen door zich te richten op de arbeidersklasse. Tevens kan het verband tussen representatie en identificatie verder worden onderzocht.","['Klasse', 'Representatieanalyse', 'Cognitieve semiotiek', 'Identificatie', 'A. Dautzenberg', 'J. Hermsen', 'S. de Coster', 'F. Treur', 'Sociale psychologie', 'Sociologie']"
The Conservative Campaign and the 1975 Referendum,"Obbens, Loes","['Rieger, Bernhard']",2019,Faculty of Humanities,Geschiedenis (BA),Bachelor thesis,en,,
Mrachnost' forever? Pessimism in Soviet cinema under Brezhnev,"Dijk, Ruben van","['Kern, Henk']",2019,Faculty of Humanities,Geschiedenis (BA),Bachelor thesis,en,,"['russia', 'brezhnev', 'film studies']"
"""What abou' de lô?"": Trauma in Afrikaans Anti-apartheid Poetry","Maessen, Francine","['Robbe, Ksenia']",2019,Faculty of Humanities,Literary Studies (MA),Master thesis,en,,"['Afrikaans literature', 'Afrikaans poetry', 'Trauma studies', 'Breyten Breytenbach', 'Adam Small', 'Ronelda S. Kamfer']"
Miaozong's Opening,"Arends, Julie","['Korsten, Frans Willem']",2019,Faculty of Humanities,Media Studies (MA),Master thesis,en,,"['Buddhism', 'Cixous', 'écriture féminine', 'interculturality', 'feminism', 'feminine libidinal economy', 'Zen']"
Relating to Future Generations,"Wolters, Angelieke","['Meijers, Tim']",2019,Faculty of Humanities,Wijsbegeerte (BA),Bachelor thesis,en,"Both relational egalitarianism and intergenerational justice are topics of growing importance in the philosophical literature. However, the principles that uphold both theories seem incompatible at first glance. It is therefore worthwhile to explore in how far relational egalitarian would be able to provide a satisfactory account of intergenerational justice. Or, if their principles are so irreconcilable that we must to choose to give up on either relational egalitarianism or intergenerational justice. To answer this question, I will first identify the central claims of relational egalitarianism. Secondly, I will formulate specific challenges that relational egalitarianism must overcome: the non-existence challenge, the non-identity challenge and the non-contemporarity challenge. These challenges will urge relational egalitarians to relinquish some of their claims, or broaden their terms. I will suggest three possible responses: the intergenerational community approach, the wide relational egalitarian approach and the threshold for respect.","['Intergenerational Justice', 'Relational Egalitarianism', 'Egalitarianism', 'Intergenerational Egalitarianism']"
Begrijpelijk taalgebruik tijdens de APB 2012-2015,"Frinking, Stan","['Leeuwen, Maarten van']",2019,Faculty of Humanities,Taalwetenschap (BA),Bachelor thesis,nl,"De Jargonbrigade van de Nationale Jeugdraad (NJR) reikt ieder jaar prijzen uit voor politici die tijdens de algemene politieke beschouwingen begrijpelijk taalgebruik hanteren en voor politici die onbegrijpelijk taalgebruik hanteren. Aangezien nergens een onderbouwing voor de analyses wordt gepubliceerd, heeft Linda den Hollander in haar bachelorscriptie (2017) de taak op zich genomen om met behulp van een stilistische analyse te bekijken of de prijzen op goede gronden gegeven zijn. Vanwege haar handmatige analysemethode en het gebrek aan tijd binnen de scriptieperiode, geeft ze zelf aan dat er veel aan haar analyse ontbreekt en dat de resultaten niet bindend zijn. De resultaten van haar onderzoek gaven dan ook geen significant verschil weer tussen de politicus die de prijs voor klare taal heeft ontvangen en de politicus die van de NJR de zwetsprijs kreeg uitgereikt. Deze scriptie heeft als doel een soortgelijke analyse uit te voeren als Den Hollander deed, maar in plaats van een handmatige stilistische analyse is het een analyse met een computertool. Hierdoor is het corpus aanzienlijk groter en wordt op meer stilistische verschijnselen getest. De onderzoeksvraag ""In hoeverre kan het taalgebruik van de winnaars van de Zwetsprijs en de Klaretaalprijs in de periode 2012-2015 als begrijpelijk of onbegrijpelijk worden gekarakteriseerd?"" wordt beantwoord door te testen op woord- en zinscomplexiteit en op referentiële en relationele coherentie (Pander Maat, 2009; Pander Maat e.a., 2014).","['Begrijpelijkheid', 'Taalkundige Stilistiek', 'Politiek Taalgebruik']"
Het reputatiemanagement van de Deli-Maatschappij,"Lingen, Pascal van","['Schrikker, Alicia']",2019,Faculty of Humanities,Geschiedenis (BA),Bachelor thesis,nl,,
When do authoritarian oppositions coalesce? A study of the Syrian opposition to Bashar al-Assad in 2011-2013,"Dek, Nienke","['Maat, Eelco van der']",2019,Faculty of Humanities,International Relations (MA),Master thesis,en,"This thesis analyses the potential reasons for the failure of a Syrian opposition coalition formation between the Syrian National Council and the National Bureau for the Forces of Democratic Change during the first years of the Arab Spring (2011-2013). Literature on opposition coalition formation often argues that oppositions are likely to coalesce in times of regime weakness, but the case of Syria provides a puzzling situation: whereas Syrian opposition parties have coalesced in the past during the Damascus Spring, they failed to successfully coalesce at the start of the Arab Spring. This thesis therefore analyses two alternative explanations for this failure: inter- and intra-opposition rivalry. By discussing both opposition coalition formation during the Damascus Spring and the start of the Arab Spring, as well as the extent to which elements of inter- and intra-opposition rivalry could be witnessed during the Arab Spring, the thesis attempts to provide an answer to the above mentioned puzzle. It finds that none of these theories can explain the failure of opposition coalition formation in Syria (2011-2013) on their own, as the failure can be explained by elements linked to both inter- and intra-opposition rivalry which fuelled each other. This interlinkage in the end made a successful opposition coalition formation highly difficult.",
"""Rijksvuil naar Nieuw-Guinea""","Antwerpen, Esmée van","['Ravensbergen, Sanne']",2019,Faculty of Humanities,Geschiedenis (BA),Bachelor thesis,nl,,"['politieke delinquenten', 'NSB', 'Nieuw-Guinea', 'reclassering', 'bestraffing', 'dekolonisatie', 'Nederlands-Indië', 'STPD', 'deportatie']"
Het Voortbestaan van Scientology: Scientology en Zijn Kritische Leden,"Breddels, Merel","['Van de Bilt, Eduard']",2019,Faculty of Humanities,Geschiedenis (BA),Bachelor thesis,nl,,"['Scientology', 'Ex-scientologen', 'Scientology Kritiek']"
"Moves, Metaphors and Their Interrelation in Abstracts of Climate Change Articles in High-Impact Scientific Journals","Astafyeva, Evgeniya","['Jeffery, Jill V.']",2019,Faculty of Humanities,Linguistics (MA),Master thesis,en,"Climate change is a scientific discipline that received extensive attention from both specialists and general public. This puts additional pressure on scientific writers in this domain to use language means successfully to render their ideas to such a wide readership. Manty studies have researched the use of rhetorical moves and metaphors in scientific writing, but never in climate change writing and never in interrelation. This thesis, therefore, aims at bridging this gap and studies rhetorical moves, metaphors and the ways they may be interrelated in abstracts of climate change research articles in high-impact journals Science Advances and Nature Climate Change. It has been found that many abstracts in the data favor the Introduction-Purpose-Product-Conclusion structure, and overall the Product move is obligatory for all abstracts. However, Science data showed more variation both in the use of moves and in the usage of metaphors. The results of this study could be a starting point for a more in-depth research in the area, as well as of use to those studying scientific discourse for academic or practical reasons.","['abstracts', 'rhetorical moves', 'metaphors', 'climate change']"
Mensen doen ertoe: Processen van dekolonisatie in de permanente tentoonstellingen van het Tropenmuseum,"Bakker, Didi","['Feenstra, N.H.']",2019,Faculty of Humanities,Kunstgeschiedenis (BA),Bachelor thesis,nl,,"['Dekolonisatie', 'Tropenmuseum', 'Inclusiviteit', 'Inclusie', 'Museum', 'Tentoonstellingen']"
De Militaire Revolutie onder vuur,"Osinga, Jelle","['Mostert, Tristan']",2019,Faculty of Humanities,Geschiedenis (BA),Bachelor thesis,nl,,"['Military History', 'Early Modern', 'Dutch East India Company', 'Colonial History']"
The Mask of Madness: Examining the Link Between Madness and Self-Expression in Contemporary Literature,"Stirler, Rebecca","['Liebregts, P.T.M.G.']",2019,Faculty of Humanities,Literary Studies (MA),Master thesis,en,,"['Madness', 'Gender', 'Gillian Flynn', 'Margaret Atwood', 'Virginia Woolf', 'Feminism', 'Contemporary literature']"
Football & Capital. The Mediation of Modern Football,"Hoogendoorn, Lucas Arnout","['Chouraqui, Frank']",2019,Faculty of Humanities,Wijsbegeerte (BA),Bachelor thesis,en,"What ontological changes does commercialization make to the relation of the crowd and the game played on the field? In chapter 1, I will use Johan Huizinga's ideas on sport and play from Homo Ludens to prove that before we can speak of any changes brought about by commercialization, this relation must be accounted for nondualistically. In chapter 2, I will use Gadamer’s non-dualistic ontology of play and spectator that he develops in Truth and Method to prove that the spectator opens a possibility for play to transform into art, where, when the transformation is fully realized, the relation between play and spectator becomes one of “aesthetic non-differentiation”. I will also show that the proof of such a transformation having taken place in the case of football, hinges on a “perception of a meaningful whole” on the part of the spectator. In chapter 3, I will prove the existence of such a perception, by looking at the language of 'justice' surrounding football and I will prove also that these utterances point to a blockage in the transformation. In chapter 4, I will find the source of this blockage in commodification of football and its transformation into a spectacle.","['Football', 'Capitalism', 'Gadamer', 'Huizinga', 'Play', 'Baudrillard', 'Mediation']"
Jan Hendrik Donker Curtius: Nederlands beleid bij de opening van Japan (1853-1855),"Hogenbirk, Joris","['Gommans, Jos']",2019,Faculty of Humanities,Geschiedenis (BA),Bachelor thesis,nl,,"['Donker Curtius', 'Nederlands-Japanse Relaties', 'Japan 19e eeuw', 'Deshima', 'Jan Hendrik Donker Curtius']"
The Unrealised Decartelisation of Japan: An Intermestic Approach,"Meinderts, Tom","['Schmidli, William Michael']",2019,Faculty of Humanities,North American Studies (MA),Master thesis,en,"After the surrender of Japan following WWII, the US occupied Japan for seven years until 1952 – while remaining in Okinawa until 1972. The aim of the occupation’s administration was to demilitarise and democratise Japan. One of the goals to achieve this aim was the decartelisation of Japan and the dissolution of the Zaibatsu. However, while the decartelisation of Japan was an early goal of the administration, the dissolution of the Zaibatsu was never fully realised. The occupation’s administration was concerned with New Deal liberalist reforms at the onset of the occupation. However, after the first two years of the occupation, the US shifted its decartelisation policy from economic reform to economic recovery in what has been dubbed as Japan’s reverse course. The origin of the reverse course has often been explained as a Cold War phenomenon. However, through archival research, this thesis shows that domestic factors such as the US domestic economic situation and the Republican victory in the 80th Congress significantly changed the course of the Zaibatsu dissolution. As such, these “intermestic” issues influenced the shift away from economic reform to economic recovery and the result of this can be seen in the Japanese economy to this day.","['Intermestic', 'Occupation of Japan', 'US Foreign Policy', 'Occupation Policy', 'Zaibatsu', 'Decartelization', '80th Congress']"
Swiping in English and Dutch: The Interaction between R-Pronouns and Modal Particles in Elliptical Questions,"Delbar, Natasja","['Griffiths, James']",2019,Faculty of Humanities,Engelse taal en cultuur (BA),Bachelor thesis,en,"This thesis examines two approaches to ellipsis in order to gain further insight into the behaviour of clausal ellipsis when targeting constituents. In their recent article, Ott and Struckmeier (2018) advocate the usefulness of German modal particles (MPs) as a test to show selective targeting in swiping, in contrast to the generally accepted unselective move-and-delete approach of ellipsis argued by Merchant (2001). This thesis adopts Ott and Struckmeier’s argument in order to determine whether the interaction between R-pronouns and MPs in clausal ellipsis in Dutch, also known as sweeping, results in evidence supporting selective targeting of constituents in the clause. This investigation was done via an acceptability judgment task, completed by 162 native speakers of Dutch and Flemish. Comparing acceptability scores of differing syntactic configurations shows that ellipsis does seem to target selectively, as MPs are demonstrated to be resistant to movement and are allowed as remnants in the ellipsis site. Further research into Dutch sweeping constructions thus seems to be advisable.","['ellipsis', 'sluicing', 'swiping', 'sweeping', 'acceptability judgment task']"
Gestolen goed gedijt niet,"Van de Kerke, Els","['Bussels, S.P.M.']",2019,Faculty of Humanities,Kunstgeschiedenis (BA),Bachelor thesis,nl,,"['Nederlands-Indie', 'Roofkunst', 'kolonialisme', 'Museum Volkenkunde', 'Leiden', 'Collecties']"
To what extent does China represent a threat to the soft power primacy of the US?,"Booth, Josh","['Nakamura, Mari']",2019,Faculty of Humanities,International Relations (MA),Master thesis,en,,
Realpolitik in the revisionary processes of the Armenian Genocide:The cases of Spain and Argentina,"Grossi, María","['Boom, B.E. van der']",2019,Faculty of Humanities,International Relations (MA),Master thesis,en,,"['Armenian genocide', 'recognition', 'ignorance', 'denial', 'Argentina', 'Spain', 'Realpolitik', 'power', 'interests']"
De weg naar EMU,"Trouw, Juraj","['Touwen, Jeroen']",2019,Faculty of Humanities,Geschiedenis (BA),Bachelor thesis,nl,"In deze scriptie wordt er aan de hand van literatuur en de jaarverslagen tussen 1991-1999 van de Europese Centrale Bank onderzocht wat de ontwikkelingen binnen de opzet van de EMU waren om fiscaal beleid van de lidstaten bij te sturen, en wat voor rol de intergouvernementele opzet daarbij had. Dit eindwerkstuk heeft aangetoond dat de intergouvernementele opzet van de Europese Monetaire Unie haar oorsprong vond in het politiek en economisch handelen van de deelnemende lidstaten. De EMU werd hierdoor belemmerd in de realisatie van de doelstellingen van het Verdrag van Maastricht, zelfs als daar strenge criteria aan verbonden waren. Gedurende de drie fases in het proces naar de monetaire unie zijn er (bijna) jaarlijks adviezen uitgebracht aan de lidstaten, die grotendeels genegeerd werden. Ik kan uit het gedane onderzoek enkel concluderen dat de intergouvernementele opzet van de EMU er in de periode 1991-1999 voor heeft gezorgd dat het niet in staat was om het fiscale beleid van de lidstaten voldoende bij te sturen, waardoor het er niet in slaagde om een duurzame monetaire unie te creëren.","['Europese Monetaire Unie', 'Europese Centrale Bank', 'Werner-rapport', 'Delors-rapport', 'Overheidsbegroting']"
Ending suffering: Overcoming the human condition by ending existence or by transcending it.,"Mariën, Maico","['Buben, Adam']",2019,Faculty of Humanities,Wijsbegeerte (BA),Bachelor thesis,en,,"['anti-natalism', 'transhumanism']"
De introductie van de oordeelsact in de logica. Het oordeelsbegrip bij Frege en Martin-Löf en het probleem van het logisch psychologisme,"Eeden, Simon van","['Schaar, Maria van der']",2019,Faculty of Humanities,Wijsbegeerte (BA),Bachelor thesis,nl,,"['oordeelsact', 'logica', 'Frege', 'Martin-Löf']"
The cube pattern with strong colour contrast on the ceiling of the Chapel of the Cardinal of Portugal,"Cao, Zongyue","['Crucq, A.K.C.']",2019,Faculty of Humanities,Arts and Culture (MA),Master thesis,en,"The Chapel of the Cardinal of Portugal is located in the basilica of San Miniato al Monte in Florence and it was built during the late fifteenth century with many fascinating ornamental factors. In this thesis, the author focuses on the ceiling design created by Luca della Robbia and especially pays attention to the cube pattern being used as ornament, trying to figure out the possible function of the application of this pattern including its representational meaning and its psychological function to the viewers.Both the tradition art-historian approaches like historical and anthropological approaches and the new psychological approach have been applied in this research.The author firstly discusses the possible origins of the cube pattern and the colour combination of this pattern, and it turns out that the cube pattern is a traditional ornament being always applied to the floor design instead of ceiling design, which made the case in the Cardinal's Chapel a quite special one. Next, the author discusses the function of the ceiling and dome designs in religious buildings in general to reach a conclusion of the question what the patrons and the designer expected the ceiling and the cube pattern to function.Then, the author applies the present psychological approaches to figure out the visual effects created by the cube pattern to the viewers and how viewers could react to such design.In the end, the conclusion could be reached that the cube pattern can definitely attract the viewers attention which gives more chance for the viewers to spend more time observing the ceiling design and finally to understand the motif of the ceiling design,but if it plays an intermediary role for the main motif still remains controversial.","['The Chapel of the Cardinal of Portugal', 'cube pattern', 'Luca della Robbia', 'ceiling design', 'Renaissance art']"
Pro-Gay Anti-Immigrant into the Mainstream,"De Hoog, Akke","['Shield, Andrew']",2019,Faculty of Humanities,History (MA),Master thesis,en,,"['Homonationalism', 'Populism', 'politics', 'Fortuyn', 'Sexuality', 'Immigration', 'Integration', 'Wilders']"
Over Jezus en Aeneas. Klassieke en christelijke elementen in Jacopo Sannazaro's De partu Virginis.,"Oomis, Anja Johanna Wilhelmina","['De Beer, Susanna']",2019,Faculty of Humanities,Griekse en Latijnse taal en cultuur (BA),Bachelor thesis,nl,"In zijn epos De partu Virginis uit 1526 beschrijft Jacopo Sannazaro de geboorte van Christus, maar in de vorm van een klassiek epos, inclusief verwijzingen naar klassieke goden en mythologie. In mijn scriptie onderzoek ik hoe hij in zijn werk christelijke en klassieke elementen heeft gecombineerd en zo probeer ik te achterhalen welk doel hij met deze combinatie beoogde. Hiertoe bestudeer ik de intertekstualiteit in De partu Virginis aan de hand van twee casestudy's, namelijk Sannazaro's zelfpresentatie als dichter en zijn beschrijving van Jezus. Daarnaast beschouw ik het werk kort in zijn historische en literaire context. Het blijkt dat Sannazaro de klassieke elementen in zijn werk inzet om zijn christelijke boodschap te ondersteunen: gebruik van de klassieken is toelaatbaar, mits die ondergeschikt blijven aan Christus. Hij zet klassieke teksten zodanig in dat de lezer ze allegorisch gaat begrijpen. Deze manier van schrijven en interpreteren past goed bij de Romeinse humanistische traditie van Sannazaro's tijd, in het bijzonder de ideeën van de humanist Egidio da Viterbo.","['klassiek', 'christelijk', 'Jezus', 'Latijnse epiek', 'christelijke epiek', 'Jacopo Sannazaro', 'De partu Virginis', 'humanisme in Rome', 'zelfpresentatie auteur']"
Strijd om de Spaarnestad,"Meessen, Max Jonathan Adriaan","['Ebben, Maurits']",2019,Faculty of Humanities,Geschiedenis (BA),Bachelor thesis,nl,,"['Haarlem', 'Belevingsgeschiedenis', 'Katholieken', 'Protestanten', 'Spanjaarden', 'Beleg', '1572-1573']"
