title,author,supervisors,date,faculty,program,type,language,abstract,keywords
"""¡No cejaremos hasta que se haga justicia!"": The responses of two Mexican presidents to the accusations of a state crime","Tjin, Cynthia","['Eduardo, Alves Viera']",2020,Faculty of Humanities,International Studies (BA),Bachelor thesis,en,"On the 26th of September in 2014, 43 students of the Ayotzinapa Normal school disappeared after being arrested by the local police of Iguala in Guerrero, a southern state in Mexico. While this incident is not an isolated case of disappearances in Mexico, Ayotzinapa gained international media attention due to the belief by the Mexican population that then-president Enrique Peña Nieto was involved in the incident. Independent investigations into the case have strengthened these accusations of a state crime, as they were able to gather evidence that contradict the government’s official version of the incident, which holds the Mayor of Iguala and the Drug Trafficking Organization Guerreros Unidos accountable. These contending versions have inhibited the resolving of the case, meaning that the population continues to demand for justice. Peña Nieto finished his term in 2018, leaving his successor, Andrés Manuel López Obrador, to bring justice for the students and managing the state crime accusations. This thesis explores how both presidents have addressed Ayotzinapa and the question of responsibility for it in their presidential discourses. Seeing as it was Peña Nieto who was in office when it happened, it is expected that he takes a different stance to the accusations, in comparison to López Obrador, who is not directly accused of committing the crime. Using the Critical Discourse Analysis framework, the results of this thesis demonstrate that the presidents take similar approaches when responding to the state crime accusations. However, their discourses differ when addressing structural problems that characterize the status-quo in Mexico, such as corruption, impunity and violence.","['Ayotzinapa', 'Mexico', 'State Crime', 'Critical Discourse Analysis', 'Presidential Discourse', 'Enrique Peña Nieto', 'Andrés Manuel López Obrador']"
Capitalism & Democracy in the Digital Age: Examining How the USA & Germany Enable & Disempower Surveillance Capitalism & Google,"Kelley, Jake","['Duzgun, Eren']",2020,Faculty of Humanities,International Relations (MA),Master thesis,en,"This thesis sets itself within this broader theoretical debate of discussing the relationship between capitalism and democracy. It investigates how capitalism has been able to gain unrivaled power within the global political economy, particularly over democracy, through further developing the separation between what is determined as the 'political' and the 'economic'. Furthermore, it concentrates on the implications of the significant structural changes caused by capitalism and its role in shaping the digitalization of our societies. In the process, the paper analyzes Shoshanna Zuboff's understanding of surveillance capitalism because it is the needed contemporary analytical assessment of how big tech and its surveillance operations produce various adverse outcomes in the global political economy. It primarily focuses on how surveillance capitalists utilize the ideology and mechanisms of capitalism while undermining democracy and increasing epistemological and material inequalities. In its many forms, surveillance capitalism undermines democracy and human rights and creates unequal power structures within our societies. These adverse developments are possible because of the specific historical conditions that allowed surveillance capitalism to thrive and become normative behavior. Existing political and economic structures enabled surveillance capitalists like Google, Facebook, and Amazon to become dominant hegemonic forces in the global political economy. These corporations undemocratically extract data from individuals' lives by coercing users to accept their terms and conditions, which can take days to fully understand the implications on their human rights, privacy, and freedoms (Zuboff, 2019). Surveillance capitalists then capitalize on their data by selling it for profit, using it to improve their services, or utilizing it to predict and manipulate future behavior in collaboration with other market actors (Zuboff, 2019). This represents the commodification of human behavior, personal information and digital social interactions. How actors like Google have been able to extract, commodify (or profit from) and manipulate individuals' behavior has severe implications for the individual human rights and foundational principles and values of democracy. All of this depicts a pattern of subordinating human behavior to the logic of capitalist markets for profit while putting at risk the freedom, autonomy, and self-determination of citizens in the market, politics, and everyday life. Democratic countries have enabled and undermined Google and other corporations that create unequal power structures and succeed in exploiting citizens. This thesis identifies and analyses how the United States and Germany have attempted to address Google's intrusive big data operations. Particularly, it focuses on how they have both undermined and protected democracy by addressing surveillance capitalism and its adverse outcomes.","['surveillance capitalism', 'democracy', 'inequality', 'big tech', 'human rights', 'big data', 'google', 'Germany', 'USA', 'historical materialism']"
"De functie van de Veelderhande, zeer genoeglijk om te lezen","Stieglis, Arlette","['Warnar, Geert']",2020,Faculty of Humanities,Nederlandse taal en cultuur (BA),Bachelor thesis,nl,,"['Veelderhande', 'functie', 'oudere letterkunde']"
"No Hate, No Fear, Immigrants and Refugees are Welcomed Here","Meler Sánchez, Sílvia","['Van Kessel, Looi']",2020,Faculty of Humanities,International Studies (BA),Bachelor thesis,en,,
Racial Dynamics in “Post-Racial” Society: an Analysis of White Saviors and Black Representation in American Film,"Tjin-Kon-Koen, Chelsea","['Steinbock, Eliza']",2020,Faculty of Humanities,Literary Studies (MA),Master thesis,en,,"['racism', 'American Film', 'representation', 'Black film', 'white savior film', 'American society', 'Racial dynamics']"
Yeke Kipchak Ulus,"Van Til, M.P. (Maurice)","['Gommans, J.L.L.']",2020,Faculty of Humanities,Geschiedenis (BA),Bachelor thesis,nl,,"['Kipchaks', 'Euraziatische rijken', 'Mongolen', 'Migratie', 'Mammelukken']"
Niche Diplomacy as a Soft Power Strategy for Small States,"Tunde, Eniola","['Nakamura, Mari']",2020,Faculty of Humanities,International Relations (MA),Master thesis,en,"Small states particularly those in the Global South, have often been relegated to being objects of international relations rather than actors. When discussed by most scholars, much focus is put on their ability to cooperate with big powers or form coalitions in order to achieve their goals. Only a few scholars discuss the ability of small states to independently hold power in international relations. Amongst those who do, only a small number go further than affirming that small states can exist independently in a world dominated by large power states. They often fall short in theorizing ways for small states to acquire and keep this independent power. By focusing on Fiji and its implementation of niche diplomacy, this thesis will argue that small states are not only capable of being independent actors of world politics, but that they can become leaders in a domain of international politics. Although niche diplomacy is a type of diplomacy often associated with middle powers who have the capacity of becoming big powers, this article will argue that it is in fact a strategy that can assist states who have the potential and capacity but not necessarily the window of opportunity needed to establish themselves as international powers.","['Alternative', 'Small states', 'Niche diplomacy', 'Strategy', 'Independent power']"
Popular Vote or Popular Talk? The Electoral College in the Current Political Debate,"Brouwer, Kjeld","['Fazzi, Dario']",2020,Faculty of Humanities,International Studies (BA),Bachelor thesis,en,,"['Electoral College', 'Electoral College Reform', 'Constitutional Reform', 'U.S. Politics']"
De Waarheid tijdens de Koude Oorlog: Een blik op de communistische militaire interventies in Oost Europa door de ogen van de Communistische Partij Nederland (CPN),"Bouwman, Max","['Van der Steen, Bart']",2020,Faculty of Humanities,Geschiedenis (BA),Bachelor thesis,nl,,"['communism', 'CPN', 'Cold War']"
"You win some, you lose some: Analyzing the win-win situation in the China-Pakistan Economic Corridor","Keereweer, Sascha","['Wang, Jue']",2020,Faculty of Humanities,International Studies (BA),Bachelor thesis,en,,"['Belt and Road Initiative', 'China-Pakistan Economic Corridor', 'Political economy', 'One Belt One Road Initiative', 'China', 'Pakistan']"
The legal significance of a high level of environmental protection in the EU,"Kralingen, Rominique van","['Etty, Thijs']",2020,Faculty of Humanities,International Relations (MA),Master thesis,en,"This research aims to find out what the legal significance is of the provision of a high level of environmental protection in the EU. To do so, the paper aims to assess if the ambition can be seen as a rule, a principle, or an ambition in primary and secondary law, and in case law. First, the development and wording of the provision in primary law is outlined. Next, the inclusion of the ambition in secondary law is discussed by examining 24 EU environmental laws. Third, case law is researched by looking at to how the Court of Justice of the European Union explains and uses the provision. From this information, it seems that a high level of protection can be categorized as a principle. Moreover, its legal significance lies in its ability to ensure that harmonization in the environmental field is possible by collectively agreeing to a high level of protection, while maintaining the flexibility for the EU legislature to assess and negotiate the exact level of protection that is necessary. Also, it is legally significant because it provides the CJEU with the power to correct manifest errors of assessment concerning the level of environmental protection by forming an integral part of the arguments used to annul certain EU laws.","['EU law', 'Environmental law', 'Environmental policy', 'High level of environmental protection']"
The Impact of Natural Gas on the International Relations of the Eastern Mediterranean,"Munte, Emil Ferdinand","['Englert, Sai']",2020,Faculty of Humanities,International Studies (BA),Bachelor thesis,en,"A discovery of natural resources in your back garden. A blessing or a curse for the relationship with your neighbours? It is precisely this question that this paper is concerned with. Discoveries of enormous natural gas fields in the Eastern Mediterranean are having a paradigm shifting effect on the international relations of the region. Hence, the research question that drives this thesis is the following. What will the impact of the natural gas be on the international relations of the states of the Eastern Mediterranean? This paper will show that natural gas in the Eastern Mediterranean has led to greater cooperation and regionalisation and will continue to do so in the future. However, this paper will also show the limitations of the beneficial effects of cooperation over natural resources. The relevancy of this topic stems from it alluding to an important question, whether natural resources are a blessing or a curse. For many countries the discovery of natural resources has led to great wealth and development. However, for many others it has been a burden leading to less development and growth or even weakening democracy. Resources and the competition over them can also lead to conflict and it is this realm of the international political consequences of the resources that this paper is focused on.","['Natural Gas', 'International Relations', 'Israel', 'Egypt', 'Turkey', 'International Relations Theory']"
Doopsgezinden en het Pachtersoproer te Harlingen in 1748,"Keizer, Laurens","['Boender, C.']",2020,Faculty of Humanities,Geschiedenis (BA),Bachelor thesis,nl,"In 1748 vond in de Republiek het Pachtersoproer plaats. Verspreid over de gewesten kwam de bevolking in opstand tegen de in hun ogen onrechtvaardige belastingheffing. In Harlingen sloeg deze woede snel om in een politieke beweging met een breed programma: herziening van het belastingstelsel, bestuurlijke hervormingen en inperking van de invloed van de regentenklasse, en een grotere rol voor Willem IV als stadhouder. Opmerkelijk is dat de Doopsgezinden in deze politieke beweging sterk oververtegenwoordigd waren. Hoe is dat te verklaren? Het belastingstelsel kende een grote impact op de koophandel en zeevaart, een industrie waarvan ruim een derde van de werknemers doopsgezind waren. Daarnaast was er gedurende de achttiende eeuw binnen de doopsgezinde gemeenschap sprake van een toenemende vrijzinnigheid: hierdoor trad de gemeenschap naar buiten en bemoeide zich steeds vaker met politieke ontwikkelingen. Daarnaast werd er toenadering gezocht tot de gereformeerde bevolking. Een groot deel van laatstgenoemde werd door de regentenklasse weerhouden van het vervullen van een politiek ambt. Een samenwerking tussen doopsgezinden en gereformeerden kon in de ogen van hen hier verandering in brengen.","['Pachtersoproer', 'Harlingen', '1748', 'Doopsgezinden', 'Politieke emancipatie']"
Small States and the EU: Methods and Perception of Influence,"Bullman, Jason","['Broad, Matthew']",2020,Faculty of Humanities,International Relations (MA),Master thesis,en,"Small states occupy a minor, yet important, aspect of the study of international relations. While large states and great powers are still accorded the lion’s share of agency in international politics and negotiations, scholars have long recognised that small states are not passive actors and can influence developments on the international stage despite their limited resources. This is accomplished mainly through a variety of strategies that small states apply on the international stage. The effectiveness of these strategies are subject to conditions in the wider international or institutional context, but are still the major avenue through which small state governments exercise agency outside of their national borders. These strategies have been closely examined by scholars, particularly in the context of the European Union, where the highly formalised institutional environment offers both obstacles and opportunities for small states to pursue their agendas at the supranational level. The case study of Ireland, a small state on the periphery of the EU, will be examined in order to determine how peripheral small state governments attempt to affect the development of EU policy. Irish attempts to influence EU foreign and security policy will be investigated, policies that have traditionally been dominated by analyses of large state actors. However, an increasing amount of scholarship argues that small states have the ability to affect the EU in this field as well. This thesis seeks to place the interaction between Ireland and the EU in the wider global context by examining the role a third party international organisation, the UN, has on Ireland’s influence at the EU.","['Small States', 'European Union', 'Influence', 'Security Policy', 'United Nations', 'Ireland']"
Ontwrichtende reflectie op de maatschappij door Yue Minjun Een onconventionele wijze om sociaal-politieke kwesties af te beelden,"Rhee, Philippa van der","['Westgeest, Helen']",2020,Faculty of Humanities,Kunstgeschiedenis (BA),Bachelor thesis,nl,,['Ontwrichtende reflectie op de maatschappij door Yue Minjun Een onconventionele wijze om sociaal-politieke kwesties af te beelden']
"On The (Un)Changing Nature and Quality of Species in Chirstina Rossetti's Goblin Market, Charles Kingsley's The Water Babies and Lewis Carroll's Alice's Adventures in Wonderland","Verhoog, Emma","['Newton, Michael']",2020,Faculty of Humanities,Engelse taal en cultuur (BA),Bachelor thesis,en,,"['Nature', 'Quality', 'Kingsley', 'Rossetti', 'Carroll', 'Water', 'Babies', 'Goblin', 'Market', 'Alice']"
The People’s Republic of China between a Community of Shared Future for Mankind and the Near Seas Strategy: Reflection or Divergence?,"Secchi, Alessandro","['Milevski, Lukas']",2020,Faculty of Humanities,International Relations (MA),Master thesis,en,"The rise of the People’s Republic of China and Beijing’s hegemonic aspirations pose a challenge to academic research, constituting an issue that is worth of interest and analysis for its implications on international relations. This work targets two elements in Chinese foreign politics: the Community of Shared Future for Mankind and the Near-Seas Strategy, each of which has a major role in Beijing’s relations with other countries. Moreover, this thesis proposes that the relation between the two elements is hitherto unexplored and warrants for further investigation, for these topics often recur in IR literature, but only independently. Therefore, it sets to understand the nature of such relation, through an analysis that is both numerical and qualitative – highlighting their meaning, components and implications – as well as an interpretation through the concept of Harmony. The analysis will show that documents and discourses concerning the Community of Shared Future for Mankind focus mostly on peaceful development and (win-win) cooperation, whereas the Near-Seas Strategy expresses and addresses Beijing’s concerns in the South Chinas Sea and towards the ongoing disputes with other countries in the area, namely Taiwan. Finally, the interpretation through the concept of Harmony will shed a light on their coherency towards the goal of a Harmonious society.","[""People's Republic of China"", 'The Rise of China', 'Chinese foreign policy', 'Community of Shared Future for Mankind', 'Near-Seas Strategy', 'South China Sea']"
"Covering Concentration Camps: A Study of American Newspaper Coverage of Concentration Camps Buchenwald, Dachau, Mauthausen in 1945-1946","Hüttner, Nienke","['Heere, Cees']",2020,Faculty of Humanities,International Studies (BA),Bachelor thesis,en,,
A Front Row Multilateralist. On German parliamentary justifications for a more assertive defence policy,"Provoost, Jonathan","['David, M.E.L.']",2020,Faculty of Humanities,International Relations (MA),Master thesis,en,,"['Germany', 'CSDP', 'Defense', 'Multilateralism', 'CFSP', 'EU', 'European Union', 'PESCO', 'Enhanced Forward Presence', 'NATO']"
The Foreigner Planted a Seed: Migration Discourse in The Artistic-Anthropological Projects of Leone Contini,"Wang, Yahui","['Shobeiri, Ali']",2020,Faculty of Humanities,Arts and Culture (MA),Master thesis,en,"As a result of globalization, ever-intensifying migration and rampant populism, the mediatic and governmental response to migrants is a damning one in many parts of Europe. This research investigates how the artistic-anthropological projects of Leone Contini craft a counter-discourse of migration. Dealing mostly but not exclusively with Chinese migrants in Italy, it explores how the invasive/native antithesis is constantly being deconstructed by the art, both in relation to both vegetation and humans. To do so, it uses a discourse analysis methodology to survey the use of language but also to show how artistic practices can create discourse. The deconstruction relies on an anthropological approach, where multi-sitedness, complexity, long-term processes and collaboration with the Others are seen as the necessary preconditions. The research concludes by showing how the hybrid, nomadic, unsettled subjectivity of the migrants contaminates the identity of all participants in a generative way.",
Who Holds the Shovel? Digging into Adaptive Capacities inside Sanctioned Iran,"Yrjönmäki, Sara","['Englert, Sai', 'Hakim, Shirin']",2020,Faculty of Humanities,International Studies (BA),Bachelor thesis,en,,"['Iran', 'sanctions', 'environmental justice', 'adaptive capacity', 'economic sanctions', 'United Nations', 'United States', 'community', 'environmental change', 'water']"
Een controversieel pact in ere hersteld: De rehabilitatie van het Molotov-Ribbentroppact onder Poetin,"Willemze, Joost","['Kern, J.H.C.']",2020,Faculty of Humanities,Russische Studies (BA),Bachelor thesis,nl,,"['Molotov-Ribbentroppact', 'Historisch revisionisme', 'Poetin', 'Rusland']"
Addressing the Queer Rights Movement in South Korea: Development & Opposition,"Soeter, Celine","['Veldkamp, Elmer']",2020,Faculty of Humanities,International Studies (BA),Bachelor thesis,en,,"['South Korea', 'Queer', 'LGBTQ']"
Dependency in a Multipolar World: Brazil’s Role in South-South Development Cooperation,"Sposta, Marcus","['Solheim, Håvar A.S.']",2020,Faculty of Humanities,International Studies (BA),Bachelor thesis,en,"South-South Development Cooperation (SSDC) has gained increasing attention since the turn of the century due to Southern development aid donors taking on a larger role than they used to have. These new donors use a different narrative to promote development cooperation compared to the hierarchical approach used by Northern countries. SSDC as promoted by Brazil emphasises a horizontal relationship between partners. In 2014 Brazil was considered by the Organisation for Economic Cooperation and Development to be the 6th largest non-traditional supplier of aid that is similar to official development aid and Brazil’s contribution to SSDC goes beyond this, e.g. through the provision of bureaucrats and expertise on social programs. This thesis tries to fill the gap in research about the possible effects of SSDC on the dependency of developing nations. The research question guiding this thesis is: what effect has South-South Development Cooperation had on Brazil’s dependency on Northern countries?","['development', 'dependency', 'Brazilian foreign affairs', 'international cooperation']"
"The image-text relations between the text and the animals, beasts and half-human hybrids in the margins of manuscript MMW 10 F 50","Schuttevaar, Eline","['Bussels, Stijn']",2020,Faculty of Humanities,Arts and Culture (MA),Master thesis,en,,"['book of hours', 'marginalia', 'animals', 'beasts', 'hybrids', 'Manuscript MMW 10 F 50', 'marginal art']"
Body Parts in Hamar,"Wit, Arende de","['Ameka, Felix K.']",2020,Faculty of Humanities,Linguistics (MA),Master thesis,en,"This thesis aims at providing a preliminary description of body part terms and their use in Hamar, a language of Ethiopia. Mainly based on elicited data from a native speaker, an overview is given of body part terms in Hamar. Several lexical and grammatical features of body part terms are discussed. It is explained why a body part partonomy could not be established. Going beyond the human body, animal body part terms and their relation to human body part terms are explored. The way in which Hamar denotes the ‘top’ and the ‘back’ of objects is based on anthropomorphic and zoomorphic models. It is argued that body part mapping in Hamar is mainly due to an analogy in shape/appearance, space/position and function. Hamar uses body part terms to express deictic orientation, similar to other African languages. In doing so, the language interacts with case markers and elevation deictics. Based on the four-stage model of Heine et al. (1991), it is argued that Hamar body parts have only partly been grammaticalized. Locational body part nouns usually appear as BODY PART NOUN-F.OBL-LOCATIONAL CASE MARKER and are part of a genitive construction.","['African languages', 'analogy', 'body part mapping', 'body part terms', 'grammaticalization', 'Hamar', 'lexical semantics', 'metaphor', 'partonomy', 'spatial relations']"
Failed Conditional Cash Transfers and the Promising Future,"Veldt, Marit van der","['Amann, E.']",2020,Faculty of Humanities,International Studies (BA),Bachelor thesis,en,,"['Latin America', 'Social Welfare', 'Conditional Cash Transfers']"
tar and ḫal in Hittite: a distinction between CVC and CV-VC spellings in native Hittite words,"Mens, Erik Egbert","['Kloekhorst, Alwin']",2020,Faculty of Humanities,Taalwetenschap (BA),Bachelor thesis,en,,"['Hittite', 'Cuneiform', 'Anatolian']"
Educação do campo e inclusão social,"Van der Wal, Jelle","['Amann, Edmund']",2020,Faculty of Humanities,Latin American Studies (MA),Master thesis,pt,,"['educação', 'assentamento', 'exclusão social', 'inclusão social', 'questão agrária', 'conscientização', 'reforma agrária', 'São Paulo']"
Krzysztof Wodiczko: A Therapy Session with Democracy,"Kroft, Zofia van der","['Westgeest, Helen']",2020,Faculty of Humanities,Kunstgeschiedenis (BA),Bachelor thesis,en,,"['Agonism', 'Humanism', 'Counter-monuments', 'Anti-monuments', 'Wodiczko', 'Caryatid', 'Activism', 'Female rights']"
