title,author,supervisors,date,faculty,program,type,language,abstract,keywords
"Koffie, ontbijtgranen en sigaretten. De redenen achter het opheffen van de Weather Underground Organization","Reintjes, Nick","['Steen, Bart van der']",2020,Faculty of Humanities,Geschiedenis (BA),Bachelor thesis,nl,,"['Weather', 'Underground', 'Organization', 'Terrorisme', 'Extremisme', 'New', 'Left', 'VS', 'Jaren', 'Zeventig']"
Mozambique: An identity in Crisis,"Brummelhuis, Rafael","['Stathopoulos, Athanasios', 'Gawthorpe, Andrew']",2020,Faculty of Humanities,International Studies (BA),Bachelor thesis,en,"After more than 400 years of European imperial powers influencing the region of Mozambique and exploiting its population and a 10 years independence war (1964-1974) Mozambique gained independence in 1975. But the country that FRELIMO inherited was a country with divisions along cultural, linguistic and rural, urban lines. The country lacked a national identity as well as a developed state with resilient and established institutions. The idea of self determination and national identity, in an increasingly globalised world, has become more prominent. This has led to different strategies to aid the creation of a national identity being employed by governments of newly independent African nations. Thus, with the help of academic articles as well as the two documentaries Kuxa Kanema and Treatment of Traitors, this thesis will look at the different strategies employed in the creation of national identity and the challenges in the case of Mozambique after it’s independence until the democratic era of Mozambique. This paper will take a multi-disciplinary approach analyzing the strategies used in the domain of media, politics, linguistics and culture.Therefore, arguing that the multicultural nature of Mozambique could be used to form a Mozambican identity based on duality.","['Identity', 'Multi Culturalism', 'Cold War']"
Losing Face and the 'ASEAN Way': Southeast Asian Culture and Regional Peace and Stability,"Siegel, Crystle","['Arps, Bernard']",2020,Faculty of Humanities,International Relations (MA),Master thesis,en,,"['Southeast Asia', 'ASEAN', 'peace', 'stability', 'noninterference', 'face', 'diplomacy', 'Myanmar', 'ASEAN Way', 'consensus']"
Omani Ibadism: Guide to a peace-seeking foreign policy?,"Hooghwinkel, Jasper","['Schonmann, N.']",2020,Faculty of Humanities,International Relations (MA),Master thesis,en,"Undoubtedly one of the much lesser known schools of Islam, Ibadism may also be considered one of the most secretive among the various Islamic sects. Solely to be found in Oman as official state religion, it sets the country apart from any other Arab Muslim state. The same can be said of the Sultanate’s unique foreign policy in the region. Often explained with reference to the alleged tolerance and peacefulness emanating from Ibadism, Oman’s ‘foreign policy of zero problems’ is unparalleled in the Arab world and beyond. A solid foundation for this supposed nexus between the country’s official religion and its peculiar foreign policy, however, remains lacking. On the basis of a social-constructivist role theory, this research paper investigates the soundness of this supposition. Involving a thematic analysis of Oman’s participation in UN General Assemblies over the years as well as a careful examination of its foreign policy in practice, this research paper assesses the role of Ibadism with reference to its main principles in accounting for Oman’s foreign policy behaviour. The conclusion is drawn that the ideational factor of religion in the form of Ibadism does serve as a convincing account by which to make sense of an overall trend in Oman’s distinctive foreign policy behaviour, namely Oman’s efforts at seeking peace with its regional counterparts.","['Oman', 'Ibadism', 'Foreign Policy', 'International Relations', 'Religion']"
A changing playing field: European interinstitutional relationships and the negotiating positions for climate conferences,"Vries, Hidde Adriaan de","['Broad, Matthew']",2020,Faculty of Humanities,International Relations (MA),Master thesis,en,,"['EU', 'COP', 'Climate', 'negotiations', 'Paris', 'Kyoto', 'Copenhagen', 'institutions', 'multi level governance']"
In vuur en vlam: de liefdesrelaties in de Roman van Heinric en Margriete van Limborch,"Hermelijn, Sylvana","['Warnar, Geert']",2020,Faculty of Humanities,Nederlandse taal en cultuur (BA),Bachelor thesis,nl,,
"Are They Shaving, Cutting or Shearing the Sheep? A Comparison between the English Lexicon and Pronunciation of Students in Monolingual and Bilingual Education in the Netherlands","Roelofs, Vera","['Smakman, Dick']",2020,Faculty of Humanities,Linguistics (MA),Master thesis,en,"In this research the English proficiency of two groups of students who attended the same secondary school in the Netherlands are compared. The first group of students followed a monolingual pre-university programme, while the other group attended a bilingual preuniversity stream. After an explanation about the differences between these two programmes and an exploration of earlier research into pronunciation and vocabulary acquisition, this study examined what the differences/similarities were between these two groups in terms of oral proficiency after five years of secondary education. Twenty students, ten of each programme, were asked to complete two tasks. For the first task they were asked to read out a text, and afterwards their pronunciation of pre-selected vowels and consonants was analyzed with the speech analysis program Praat. The second task required the students to first describe a painting by Breughel in their own words and then to describe five specific scenes on the painting. The results showed that there were slight differences between the oral proficiencies of monolingual and bilingual students and that both groups of students had not acquired a set of characteristics that all of them adhered to in terms of vowel and consonant pronunciation. A lot of variation existed between the two groups, even though the agreement was stronger in the bilingual group. When comparing both groups’ lexicon quantitatively, the bilingual group clearly expressed themselves more extensively in their second language than the monolingual group, but qualitatively speaking the bilingual students did not appear to be familiar with more lower-frequency words than the monolingual students.","['monolingual', 'bilingual', 'education', 'Netherlands', 'Praat', 'Speech', 'Lexicon']"
The Influence of Foreign Intervention on the Zanzibar Revolution,"De Haan, Shineni","['Athanasios, Stathopoulos']",2020,Faculty of Humanities,International Studies (BA),Bachelor thesis,en,,"['Cold War', 'East Africa', 'Zanzibar Revolution', 'foreign intervention', 'ideology']"
"Tegen deze misleidde horden zullen wij ons, zoo noodig, slechts verdedigen, strijden moeten wij tegen hunne leiders","Berg, Martijn Van den","['Bos, Dennis']",2020,Faculty of Humanities,Geschiedenis (BA),Bachelor thesis,nl,,
Controversy in Guatemala’s Informal Textile Economy,"Dossett, Rashid","['Solheim, Håvar']",2020,Faculty of Humanities,Latijns-Amerikastudies (BA),Master thesis,en,,"['Guatemala', 'Piracy', 'Central America', 'Latin America', 'Informal economy', 'Civil War', 'Textile', 'Politics', 'Globalisation']"
Post-Conflict Interventions in Impunity States,"De Luna, Lorenza","['Gijn, Erik van']",2020,Faculty of Humanities,International Studies (BA),Bachelor thesis,en,"Guatemala and El Salvador experienced instances of destructive political violence in the 1980s that affected the population and the judicial and political systems. Research has shown that international interventions in post-conflict countries have a positive influence in restructuring a long-lasting peace through legal empowerment and reduction of violence. This thesis aims to determine whether postconflict international involvement can be successful in establishing just legal and political systems in a context of culture of impunity. Building on existing literature and on UN reports, it answers the following research question: to what extent has the culture of impunity influenced the degree of success of the post-conflict UN interventions in Guatemala and El Salvador? In this context, culture of impunity is defined as a deep-rooted tradition of political injustice that manifests itself with the incapacity to prosecute perpetrators of atrocities. The analysis of historical facts and their comparison to the recommendations by the UN Commissions indicate that, despite the cultural-specific approach used, international interventions resulted partly successful in Guatemala, yet unsuccessful in El Salvador. The culture of impunity affected both countries in the implementation of recommendations, yet with divergent developments in the two cases. On this basis, it is highlighted the importance of avoiding generalisations when suggesting recommendations in post-conflict settings; considering that all countries have a different degree of responsiveness to international aid as well as unique socio-cultural and political features.","['political violence', 'international interventions', 'Truth Commissions', 'culture of impunity']"
Persoonlijk Porselein: Achttiende-eeuwse Haagse serviezen met sierinitiaal en de geschiedenis van gepersonaliseerd porselein,"Bos, Esther Marjolein","['Dencher, A.R.']",2020,Faculty of Humanities,Kunstgeschiedenis (BA),Bachelor thesis,nl,,"['porselein', 'achttiende eeuw', 'Den Haag']"
Power through Commerce: Discovering the Impact of the Atlantic Slave Trade on the Kingdom of Dahomey,"Van Drimmelen, Bart","['Van der Wal-Remy, A.M.']",2020,Faculty of Humanities,History (MA),Master thesis,en,"In this master thesis I argue that the Atlantic slave trade had considerable impact on the kingdom of Dahomey. This newly emerging trade network influenced all aspects of their society. The politically fragmented Slave Coast turned out to be vulnerable for the wealth of the slave trade. Endemic warfare caused fierce competition which resulted in stratocracies that tried to gain control over direct access to European merchants. Dahomey became a primary example of such a military-fiscal state. The continuous search for legitimization of power resulted in desire for wealth to strengthen their military. The execution of power through force became the guiding principle of this kingdom. The interaction with European trade organizations clearly show the dependency of Dahomey on slave trade. Acquiring direct access to the slave trade made the consolidation of Dahomey less complicated, although the Slave Coast would never become a peaceful region. Through guns and mercenaries this state managed to maintain control over the Slave Coast and with monetarization and state formation the famous king Agaja succeeded in creating a centralized empire. However, harmful depopulation and the loss of many lives made the acquired wealth came at a high price.","['Dahomey', 'Slavery', 'Atlantic', 'Slave', 'Trade']"
The Politics of Inclusion and Exclusion,"Kovács, Dóra","['Kessel, Looi van']",2020,Faculty of Humanities,International Studies (BA),Bachelor thesis,en,,"['Critical Discourse Analysis', 'Political Rhetoric', 'Othering', 'Pronoun Analysis']"
"The International Criminal Court's African Bias and the African Court of Justice and Human and Peoples' Rights: a replacement, an extra layer or strengthening Africa's judical system?","Vaals, Willemke van","['Thakur, Vineet']",2020,Faculty of Humanities,International Relations (MA),Master thesis,en,"This thesis analyses how the International Criminal Court’s (ICC) African bias has affected the judicial system in Africa at regional and international levels. First, the current literature on the ICC’s African bias and the African judicial system will be reviewed. Next, it will be analysed why the African Union (AU) and its Member States see the ICC as biased against Africa. Then it will be analysed what the AU’s judicial response is to the ICC’s African bias and how this response seeks to interpret international criminal law. Based on these reviews and analyses, this research concludes that the ICC’s African bias has affected the judicial system in Africa at regional and international levels by creating a continental human rights and criminal court that has jurisdiction over international criminal law. This research ends with the observation that the African Court on Justice and Human and Peoples’ Rights (ACJHPR) is created to replace the ICC as both Courts have jurisdiction over crimes against humanity, war crimes, genocide and the crime of aggression. However, the replacement of the ICC could create an extra layer between Africa and the ICC, once the relationship and hierarchy between the two Courts are established.","['International Criminal Court (ICC)', 'African bias', 'African Union (AU)', 'Malabo Protocol', ""African Court of Justice and Human and Peoples' Right (ACJHPR)""]"
"An unguent container as an Egyptian royal gift: The function and value of calcite-alabaster drop jar during the Late Bronze Age in Egypt, the Levant, and Cyprus","Crabbé, Audrey","['Müller, Miriam']",2020,Faculty of Humanities,Classics and Ancient Civilizations (research) (MA),Research master thesis,en,"The Late Bronze Age presents a peak in the cultural interactions between the different empires of the Eastern Mediterranean. Both bulk goods and small quantities of luxury products were exchanged between the kings and the local elite over long distances. In April 2019, one of these luxury products was discovered at the Cypriot site of Pyla-Kokkinokremos. This was an Egyptian calcite-alabaster drop jar incised with geometric and floral decorations. This master's thesis places this unique find in a broader context by undertaking a detailed comparative study of all the decorated calcite-alabaster drop jars discovered in Egypt, the Levant, and Cyprus. By doing this, the function, value, and role of the calcite-alabaster drop jar throughout the Eastern Mediterranean during the Late Bronze Age will be proposed. For all the calcite-alabaster drop jars discovered in Egypt, the Levant, and Cyprus, the shapes, decorations, find contexts, and associated finds will be described in detail. Furthermore, a closer look will be taken at the faience and bronze drop jars, the iconographical representations, textual sources, and results of the residue analyses of the preserved remains inside of several drop jars. In Egypt, drop-shaped ceramic vessels were starting from the First Intermediate period commonly used as storage jars. This drop shape was starting from the New Kingdom adopted for smaller vessels produced in more precious materials, such as calcite-alabaster, bronze, and faience. The find of these drop jars in a rich variety of contexts, not only in Egypt, but also throughout the Eastern Mediterranean, makes this group of objects exceptional. Eight calcite-alabaster drop jars were discovered in Egypt, originating from mainly royal and elite tombs buried with a variety of other precious objects. In addition to the calcite-alabaster drop jar discovered at the short-lived trading settlement of Pyla-Kokkinokremos, three calcite-alabaster drop jars were unearthed in the royal palace at Megiddo and in a rich tomb in the Kharji cave at Beirut. The finds of the drop jars in a variety of contexts throughout the Eastern Mediterranean constitute of compelling evidence for the function and value of the calcite-alabaster drop jar in Egypt, the Levant, and Cyprus, and its role in the diplomatic exchanges.","['Late Bronze Age', 'calcite-alabaster', 'unguent container', 'Egyptian drop jar']"
'GGZ-taal' verus 'huisarts-taal': een kwantitatieve en kwalitatieve analyse van het taalgebruik van de praktijkondersteuner huisartsenzorg geestelijke gezondheidszorg,"Noordam, Désanne","['Pilgram, Roosmaryn']",2020,Faculty of Humanities,Neerlandistiek (MA),Master thesis,nl,"This study examines the language use of practice nurses mental health in the Netherlands. More specifically, the language use of 11 practice nurses was investigated on manifestations of so-called ‘mental health care-language’, which is specialistic and contains terms related to mental disorders, and the preferred ‘general practitionerlanguage’, which is a more generalistic and neutral ‘type’ of language use. A total of 28 transcribed consultations were analyzed, applying a combined quantitative and qualitative research design. Firstly, the consultations were coded with the VR-CoDES-P (Del Piccolo et al., 2011). Findings showed the practice nurses responded mainly with non-explicit, space providing reactions, of which most with back-channels. In the second part of the study, the practice nurse’s language use was stylistically analyzed, using the ‘Checklist van Nederlandse Stijlmiddelen’ (Stukker & Verhagen, 2019) and the concept of alternative choices in formulation (Van Leeuwen, 2015). Results indicated, that in over one third of the consultations, the practice nurses spoke in ‘mental health care-language’. Instances in which the nurses spoke in this language ‘type’, were for mainly the result of the nurses merely mirroring the patient’s way of talking or reading out loud a medicine leaflet. Identifying manifestations of ‘general practitioner-language’ appeared to be less straightforward; it was found that the practice nurses used a wide variety of (neutral) formulations with which they rephrased the psychological complaints their patients voiced.","['practice nurses mental health', 'POH-GGZ', 'language use', 'VR-CoDES-P', 'stylistic analysis']"
An Incomplete Revolution in Burkina Faso?,"Radford, Albert","['Wilson Janssens, Catherina']",2020,Faculty of Humanities,International Studies (BA),Bachelor thesis,en,"Burkina Faso is a West African state that continues to experience political troubles that stem from previous colonial rule. For four years in the 1980s there was a possibility that Burkina Faso could develop into a country capable of benefiting the majority of the population. However, following the assassination of Thomas Sankara, this hope did not extend beyond the four years he was in power. The recent uprisings, starting in 2014, have re-ignited past hopes of what Burkina Faso could have been and what it could yet be. The philosophies and actions of Frantz Fanon and Thomas Sankara remain relevant in understanding the reasons why Burkina Faso has not experienced the benefits that independence should have brought. They are also reference points for understanding how a favourable society might come about for the Burkinabé. Political social movements alone have had short term successes with regards to potentially changing the political governance of this West African State. What is important for the future of Burkina Faso is turning these short-term political gains into long-term political reality. It seems that governments, social movements and musicians combined will continue to have the most impact upon the future of Burkinabé civil society.","['Sankara', 'Fanon', 'Independence', 'Social Movements', 'Music', 'Politics', 'Burkina Faso']"
“The mighty bull”: An Analysis on The Relationship Between the Apis Bull and the Ptolemaic Dynasty.,"Ramos Marques, Joao Pedro","['Kaper, Olaf']",2020,Faculty of Humanities,Classics and Ancient Civilizations (MA),Master thesis,en,,"['egypt', 'ptolemies', 'kingship', 'apis', 'bull cults', 'religion']"
Foregrounding Economic Relations: China’s Economic Diplomacy vis-à-vis the Philippines Amidst the South China Sea Sovereignty Disputes,"Moshuldayev, Sietske","[""d'Hooghe, I.M.A""]",2020,Faculty of Humanities,International Studies (BA),Bachelor thesis,en,,"['The People’s Republic of China', 'The Republic of the Philippines', 'South China Sea', 'Economic Diplomacy']"
"France Against ISIS: the Far Enemy, the Near One, and the Making of the French Counter-Terrorist Apparatus","Courtioux, Paul","['Berger, Maurits']",2020,Faculty of Humanities,International Studies (BA),Bachelor thesis,en,"Muslim terrorism and radicalization have been topics of increasing concern in the West since the beginning of the 21st century. The rise of the Islamic State, commonly referred to as ISIS, which experienced a rapid and unexpected development after 2014, increased these widespread concerns related to Muslim terrorism and radicalization. This thesis tackles these topics from the perspective of France, a country that has been hardly hit by ISIS since 2014. Thus, the aim of this paper is to analyze how the Islamic State, and Muslim terrorism more broadly, have influenced the making of the French counter-terrorist apparatus. This research provides a detailed overview and analysis of the concrete impact of these phenomena on the French counter-terrorist apparatus, and delves into the role played by key counter-terrorist actors through the preemptive and reactive measures that have been taken in order to counter the Islamic State. Further, this research looks at the implications of the dynamics existing between the Islamic State and France, and investigates the resulting limitations that affect France's counter-terrorist system, in terms of overall efficiency and, more importantly, regarding the respect of fundamental human rights. This paper suggests that further research should be conducted on this topic, in order to gain a proper understanding of the processes and dynamics that are at play in the elaboration of counter-terrorist measures aimed at providing appropriate answers to existing and upcoming threats.","['Terrorism', 'Islamism', 'Radicalization', 'Counter-terrorism', 'Islamic State', 'France', 'Foreign fighters', 'Security']"
The Cuban Liberalization Project,"Liezenberg, Roderick","['Sheppard, Randal']",2020,Faculty of Humanities,International Studies (BA),Bachelor thesis,en,,"['United States', 'Cuba', 'Political Liberalization', 'Economic Liberalization']"
Regulated Capitalism as a 'Stark Utopia': a Polanyian Analysis of the (Im)possibility of Market (Re)embeddedness Through the Financial Transaction Tax in the European Union's Political Economy,"Van Campenhout, Maarten Cornelis","['Duzgun, Eren']",2020,Faculty of Humanities,International Relations (MA),Master thesis,en,"After the financial crash of 2008 the intellectual thought of the Austrian-Hungarian scholar Karl Polanyi (1889-1964) has seen a resurgence in academic research to explain the origins of the crisis. His notions of the (dis)embeddedness of markets and the double movement have proven to be useful concepts in the analysis of the origins and effects of the financial crash of 2008. However, currently there is an intellectual debate going on between so called hard- and soft-Polanyian scholars on the understanding of the notion of (re)embedding the market. Soft-Polanyians believe in the possibility of embeddedness and see in this Polanyian idea a call for the social-democratic ideal. Hard-Polanyians on the other hand do not understand Polanyian thought in this way and argue that Polanyi has never believed in the possibility of (re)embedding the market, since attempts to do so can only backfire societally. In addition to an analysis of this ongoing debate Polanyi’s moral and ethical approach in the conceptualization of the economy will be addressed in this thesis, with special attention to the notions of market dependency and human livelihood. Ultimately, the different perspectives present in this discussion are used to make an assessment of the potential(s) of the imposition of the financial transaction tax as it is currently underway in the legislative process of the European Union.","['Karl Polanyi', 'Financial transaction tax (FTT)', 'European Union', 'Market embeddedness', 'Double movement', '(De)commodification', 'Regulation', 'Capitalism', 'James Tobin', 'Global Financial Crisis of 2008']"
The Battle for Democracy in Egypt: Understanding the Imbalance of Power in Post-Revolutionary Egypt,"Visser, Rens","['Henderson, Christian']",2020,Faculty of Humanities,International Relations (MA),Master thesis,en,"A review of the literature on the political landscape of post-revolutionary Egypt identifies a widening gap between the elite. Scholars highlight the dominance of the Egyptian military’s business empire, a combination of high-ranking government officials and big corporations that together forms the elite. In 2011, the people of Egypt successfully overthrew an authoritarian regime paving the way towards a democratic state and a relieve of economic injustice. To date, the people of Egypt still find themselves in positions defined by inequality of opportunity, why? Contributing to critical scholarship, this thesis builds upon various scholars to gain insights into the different mechanisms and social drivers that keep the elite in a position of dominance and identifies areas in which the public can acquire political power. Three spheres of power; politics, economics, and media, are explored to highlight the social relations that are often hidden in organizational structures. This research provides a new answer to the question why, and how, the elite maintains its dominant position in a state that desires democracy and civil liberty. The implementation of a combination of theories examines the class division and distribution of power to answer this thesis’ main research question: Through which means can the people of Egypt gain political, media and economic power to achieve democratic governance? The findings of this thesis provide a contextualized account of the division of power in Egypt and give attention to the mechanisms that shape the relationship between the elite and the people.","['Egypt', 'Elite', 'Class Division', 'Power', 'Political Participation', 'Democracy']"
