title,author,supervisors,date,faculty,program,type,language,abstract,keywords
Egyptians Abroad: The Role of Egyptians in the socio-political landscape of Assyria during the Neo-Assyrian Period,"Hoff, Jolieke van 't","['Haring, B.J.J.', 'Valk, J.']",2021,Faculty of Humanities,Classics and Ancient Civilizations (research) (MA),Research master thesis,en,,"['Egypt', 'Assyria', 'identity', 'ethnicity', 'Ancient Near East']"
Gevangenisstraffen bij de Romeinen: Vanuit het perspectief van Romeinse auteurs,"Luik, Selina van","['Janssen, K.P.S.']",2021,Faculty of Humanities,Geschiedenis (BA),Bachelor thesis,nl,,
Between Nationalism and Orientalism: The Fragmented Historiography of the Banu Ka'b,"Nissi, Hawra",['Jos Gommans'],2021,Faculty of Humanities,Geschiedenis (BA),Bachelor thesis,en,,"[""The Banu Ka'b"", 'Ahwaz', 'Iran', 'Khuzestan', 'Imperialism', 'Nationalism', 'Orientalism', 'Tribes']"
Decreasing Abortion Rights in Poland and the EU Response,"Andel, Bente van","['Gils, E.E.A. van']",2021,Faculty of Humanities,Geschiedenis (BA),Bachelor thesis,en,"European integration is under pressure. There is increasing disagreement between Member States (MS) on topics such as immigration, the European currency, sovereignty and for the first time since its foundation, a member state has left the European Union (EU). In these debates, it often comes down to the discussion on competences and sovereignty. Is the ultimate power for the sovereign state or for the supranational institutions? This thesis examines the overlapping competences between healthcare (national) and the protection of human rights (supranational). Based on the case study of abortion rights in Poland, it discusses which factors play a role in this debate and what the EU's response and competences are. According to the EU, access to abortion is part of basic sexual and reproductive rights of women and strict abortion laws violate this. However, the EU also recognises that healthcare arrangements, and thus abortion, lie with the sovereignty of MS, as agreed upon in the treaty. Thus, the EU has no legal ground to tackle the stricter abortion legislation. It does, however, hold the power of responsibility by persuading MS to adhere to women's sexual and reproductive rights. This thesis studied the critical junctures in time from the Polish accession in 2004, the Lisbon treaty in 2009, and the rise of the PiS party in 2015, and analysed the changing positions of Poland and the response of the EU. The results showed that given its sovereignty on healthcare, the EU has no legal basis to tackle Poland's stricter abortion laws. To influence this area beyond its competences, the EU increasingly condemns Poland for violating the Sexual and Reproductive Health and Rights (SRHS) agreements and sponsors projects that increase SRHR awareness and provide geographical access to SHRH services.","['Abortion', 'Poland', 'EU', 'Competences']"
CHINA VS. JAPANESE ANIME: THE BATTLE OF CONSUMPTION AND CULTURAL PROLIFERATION,"Soares Guevara, Hilda Cecilia","['Kharchenkova, S.']",2021,Faculty of Humanities,International Studies (BA),Bachelor thesis,en,,"['anime', 'China', 'Sino-Japanese relations', 'soft power']"
Wacht im Osten: Reacties op de uitbraak en het begin van de eerste wereldoorlog in de Königsberger Hartungsche Zeitung,"Scholma, Dylan",['R.S. Tazelaar'],2021,Faculty of Humanities,Geschiedenis (BA),Bachelor thesis,nl,,"['Königsberg', 'Eerste Wereldoorlog', 'oorlogsenthousiasme']"
Haz ruido: la performance 'Un violador en tu camino' en la lucha mundial contra la violencia de género,"Gieling, Didi Janne",['Dr. Nanne Timmer'],2021,Faculty of Humanities,Latijns-Amerikastudies (BA),Bachelor thesis,es,,"['violencia de género', 'feminicidio', 'sistema patriarcal', 'traducción cultural', 'Chile', ""'Un violador en tu camino'""]"
La Capacidad de Estado en la República Dominicana: La Regulación del Sector Eléctrico en el periodo post-Capitalización,"Iannuli, Federico",['Professor Patricio Silva'],2021,Faculty of Humanities,Latin American Studies (MA),Master thesis,es,"Esta investigación utiliza un modelo de medición de la Capacidad de Estado alternativo a los comúnmente usados, la capacidad de hacer cumplir los marcos regulatorios. El enfoque del tema es la medición de la Capacidad de Estado de la República Dominicana, aplicando un modelo, fruto de la reelaboración del trabajo de Queiroz Cunha, Pereira y de Ávila Gomide (2017), al Sector Eléctrico del estado caribeño desde su privatización y capitalización en la década de los 1990. Según el modelo considerado, los aspectos que serán medidos son la Especialización, la Autonomía, y la Cohesión de las instituciones reguladoras del sector. La Especialización es la preparación y la capacidad de los miembros y funcionarios de las instituciones, que tienen que ser elegidos por ser competentes; la Autonomía es la posibilidad de las instituciones de tomar e implementar decisiones en su campo sin la influencia de los gobiernos o de los otros actores; y la Cohesión es la capacidad de las instituciones para evitar redundancias y contradicciones.","['capacidad de estado', 'regulación', 'governance', 'instituciones reguladoras', 'sector eléctrico', 'República Dominicana', 'privatización', 'estado regulador']"
EL EMPODERAMIENTO DE LAS MUJERES ZAPATISTAS. ¿En camino hacia una vida sin violencia de género?,"Lombardo, Jennifer","['Valdivia Rivera, S.']",2021,Faculty of Humanities,Latin American Studies (MA),Master thesis,es,,
A Quite Revolutionary Independence: The Mau Mau Uprising and Kenyan Decolonisation,"Lovatelli, Chiara","['Williams, C.']",2021,Faculty of Humanities,International Studies (BA),Bachelor thesis,en,,"['Mau Mau', 'Kenya', 'Decolonisation']"
The Effects of Microfinance Programs for Poverty Alleviation in Relation to Income and Asset Building in Thailand and Indonesia,"Zon, Justin van","['Hadiprayitno, I.']",2021,Faculty of Humanities,International Studies (BA),Bachelor thesis,en,"“The idea of microfinance emerged around the 1970s as a revolutionary new way to alleviate poverty in developing countries. Microfinance delivers financial services – such as loans and saving services – to the poor, who are traditionally financially excluded from conventional financial institutions. However, the debate whether the efforts of MFIs have been successful is almost just as old as the concept itself, and the results remain ambiguous. This thesis aims to add to the extensive body of literature by providing an in-depth comparative case study of the experiences and effects of microfinance institutions (MFIs) in Thailand and Indonesia. The research is focused on poverty alleviation in two key areas, (i.) household income generation and (ii.) household asset building. The hypothesis is that although MFI provides great opportunities for people in lower-income classes to access credit, it has done little to practically alleviate poverty in Thailand and Indonesia. In the final analysis, this thesis will argue that this hypothesis is false, and argues that microfinance institutions in Thailand and Indonesia have been effective in increasing household income and therefore poverty alleviation. However, the effect of microfinance on asset building is ambiguous. Therefore, the study revealed that the effect of microfinance on asset building for poor households should be further studied.” Key words: microfinance; poverty alleviation; Village Fund program; Islamic microfinance; Thailand; Indonesia.","['Microfinance', 'poverty alleviation', 'Village Fund program', 'Islamic microfinance', 'Thailand', 'Indonesia.']"
Why Discourse and Attitudes Matter: an Analysis of Hungary’s Democratic Backsliding,"Kiss, Peter","['Dr van Gils, E.', 'Dr Broad, M.']",2021,Faculty of Humanities,Geschiedenis (BA),Bachelor thesis,en,,"['Hungary', 'democracy', 'democratic backsliding', 'illiberalism', 'discursive institutionalism']"
Reconquering the Ungoverned: How control over Mexico's ungoverned spaces will decide how the Mexican Drug War ends,"Neijzen, Ole","['Solheim, H.A.S.']",2021,Faculty of Humanities,International Studies (BA),Bachelor thesis,en,,"['Mexico', 'Mexican Drug War', 'public security', 'conflict', 'drug trafficking', 'Latin America', 'War on Drugs']"
Gender and Housing: Architectural Utopias in Post-Revolutionary Russia,"Tiedemann, Sophie",['Dr. Schellens'],2021,Faculty of Humanities,International Studies (BA),Bachelor thesis,en,,
The Impact of COVID-19: An Investigation of Discrimination Against the Chinese Indonesian Community,"van Beek, Stephan","['Arps, B']",2021,Faculty of Humanities,Asian Studies (60 EC) (MA),Master thesis,en,,
How much does interjection usage differ in Dutch and Japanese natural conversation?,"Rood, Matthieu","['Berlo, M.J van', 'Yoshioka, K.']",2021,Faculty of Humanities,Japanstudies (BA),Bachelor thesis,en,,"['Japanese', 'Dutch', 'Interjection', 'Interjections']"
Legal and economic deviations through the implementation of Article 17 of the Copyright in the Digital Single Market Directive,"Tsirakis, Christos","['Oster, Jan']",2021,Faculty of Humanities,Geschiedenis (BA),Bachelor thesis,en,,"['copyright law', 'copyright', 'digital market', 'CSDM', 'directive', 'EU', 'European Union', 'Article 17']"
Bilingual Intercultural Education in Guatemala: The structural barriers to implementing the EBI for indigenous communities in Guatemala since the peace agreements of 1996,"Kraft, Isabel",['Dr. Randal C. Sheppard'],2021,Faculty of Humanities,International Studies (BA),Bachelor thesis,en,,
Reconsidering the kkonminam: Documenting flowerboyhood in K-pop music videos,"Jans, Rafella","['Ceuster, K. de']",2021,Faculty of Humanities,Koreanstudies (BA),Bachelor thesis,en,,
The road to a European tank: Franco-German (non) cooperation on land armaments,"Pennekamp, Bram","['Cusumano, E.']",2021,Faculty of Humanities,International Relations (MA),Master thesis,en,,"['European', 'Defence Fund', 'Defence', 'land armaments', 'tank', 'France', 'Germany']"
‘[...] maar we vinden het meer dan ooit belangrijk dat iedereen begrijpt waarom we doen wat we doen.’: Een stijlanalyse van tekstkenmerken die een negatieve invloed hebben op de begrijpelijkheid van de toespraken uit persconferenties over het coronavirus in Nederland.,"Sluijs, Coen van der",['Henrike Jansen'],2021,Faculty of Humanities,Neerlandistiek (MA),Master thesis,nl,"Een paar dagen na de persconferentie van 28 september stonden er in het NRC twee oordelen over het taalgebruik van de persconferentie: ‘Moeilijke taal is rem op effectieve coronabestrijding’ (Altenburg & Punselie, 2020) en ‘Coronacrisis is nu ook een communicatiecrisis’ (Redactie NRC, 2020). Naar aanleiding onder andere deze media-oordelen, die negatief waren over de begrijpelijkheid van het taalgebruik in de toespraken van persconferenties over het coronavirus, is het begrip begrijpelijkheid geoperationaliseerd om de toespraken te analyseren. Een stilistische analyse op taalkundige grondslag is uitgevoerd op toespraken uit twee specifieke persconferenties: 19 mei en 28 september 2020. Verschillende media-oordelen verwezen specifiek naar 28 september, waardoor deze interessant is om te analyseren. Op de persconferentie van 19 mei is geen directe kritiek geleverd, maar bleek na de exploratieronde grotendeels hetzelfde woordaantal en dezelfde potentieel problematische stijlmiddelen te bevatten. Het doel van dit onderzoek is om aan te tonen dat de toespraken op stilistisch niveau aan begrijpelijkheid hadden kunnen toenemen. Dit doel wordt bereikt door het onderbouwen van de media-oordelen met wetenschappelijke inzichten. Dit zijn inzichten in de wijze waarop bepaalde formuleringskeuzes een negatieve bijdrage leveren aan de begrijpelijkheid van een tekst. In een stijlanalyse op taalkundige grondslag worden er op systematische wijze verbanden gelegd tussen stilistische middelen op microniveau en globale indrukken op macroniveau. De centrale vraag is hoe de toespraken uit de persconferenties over het coronavirus van 19 mei en 28 september begrijpelijker konden worden gemaakt, afgaande op wetenschappelijke inzichten over begrijpelijk taalgebruik. Om de begrijpelijkheid van de toespraken stilistisch te analyseren zijn vier tekstkenmerken opgesteld: 1) Zinscomplexiteit, 2) Samenhang, 3) Woordmoeilijkheid en 4) Concreet taalgebruik. Deze tekstaspecten zijn opgesteld door gebruik te maken van de media-oordelen over de persconferenties en relevante literatuur over begrijpelijkheid van tekstkenmerken in combinatie met een exploratieronde van de toespraken om na te gaan welke stijlmiddelen uit de literatuur relevant zijn om te analyseren. De stijlanalyse is volledig berust op een kwalitatieve analyse (het interpreteren van stijlmiddelen). Om de betrouwbaarheid en validiteit van het analyse zoveel mogelijk te waarborgen zijn er heldere criteria opgesteld om de stijlmiddelen op te sporen en te analyseren. Een kwantitatieve analyse bleek niet haalbaar te zijn vanwege het ontbreken van een betekenisvol extern vergelijkingspunt. Uit de analyse is gebleken dat de gezamenlijke inzet van de geobserveerde stilistische middelen die tot elk van deze tekstaspecten gerekend konden worden, voldoende aanwijzingen geven om te veronderstellen dat de toespraken uit de persconferenties van 19 mei en 28 september 2020 aan begrijpelijkheid konden toenemen. Op basis van wetenschappelijke inzichten over begrijpelijk taalgebruik en in vergelijking met denkbare formuleringsalternatieven is aannemelijk gemaakt dat bepaalde stijlmiddelen van de toespraken uit beide persconferenties minder begrijpelijk waren. Het is de gezamenlijke inzet van de geobserveerde stijlmiddelen die een negatieve invloed hebben op de begrijpelijkheid van de tekst zonder dat één categorie hiervoor verantwoordelijk kan worden gehouden.","['Begrijpelijkheid', 'persconferenties', 'corona']"
A stable Diversity of views on the EU: Among PRRPs in the Netherlands,"Wendt, Bas","['Scepanovic, V.']",2021,Faculty of Humanities,International Relations (MA),Master thesis,en,,"['European Union', 'PRRPs', 'Euroscepticism', 'The Netherlands']"
Understanding Refugees’ Conditions in Aegean Hotspots & The Infrastructure(s) that Exist to Support Them: The Case of Chios & VIAL,"Tezapsidis, Elias",['Dr. Brian Shaev'],2021,Faculty of Humanities,International Relations (MA),Master thesis,en,"The Syrian Refugee Crisis has, since it happened in 2015, reshaped the face of migration in the European continent, marking various responses to how refugees are perceived and how borders need to be enforced. EU states are expected to protect the geographical borders that fall under their jurisdiction, while simultaneously being confronted with a large influx of refugees. Investigating a refugee camp in VIAL, Chios through oral interviews conducted with workers who are employed there, this thesis will answer: what is the perception of the impact that refugees living in Chios have, and how is that manifested in border management discourse? To successfully do so, the responses of the workers will be analyzed, as a case study to understand refugees' conditions in Aegean hotspots. In doing so, it also explores what infrastructure is needed to help refugees transition towards becoming parts of the societies in which they have arrived: and even what sort of urban planning needs to be altered to make such an existence plausible. The role that various actors play in VIAL, Chios is presented, along with the limitations and pitfalls of what they can do for the populations residing there. Competing narratives on the migration debate are presented, as well as the ambivalent notions of “refugee integration” and “border management.”","['VIAL', 'Chios', 'Refugees', 'Refugee Camps', 'Refugee Integration', 'Local Policy Arena', 'Border Management', 'Urban Challenge']"
"Examining Neoliberalization’s Effects on Mental Health: Empirical Evidence from OECD countries, 1993-2018","Bartsch, Merle","['London, J.D.']",2021,Faculty of Humanities,International Relations (MA),Master thesis,en,"In both popular and academic discourse contemporary increases in the prevalence of mental health problems are attributed to neoliberalization. Yet, what neoliberalization entails is often poorly defined, either in highly abstract terms or in a reductionist manner. Its consequence is that the hypnotized association between neoliberalization and negative mental health outcomes remains empirically untested. This thesis advances the debate by contrasting measures of public mental health with measures of firm coordination, the marketization of which signifies neoliberalization within the Varieties of Capitalism framework. Employing statistically tested fuzzy-set Qualitative Comparative Analysis (fsQCA) it is demonstrated that neither causation nor correlation can be observed between neoliberalization and public mental health. Links between other kinds of politico-economic institutional reconfiguration and mental health outcomes could be established, however. Further academic inquiry is required to assess the specifics of these interactions.","['mental health', 'neoliberalization', 'Varieties of Capitalism']"
Out of This World: Dutch Astronomical Books in Tokugawa Japan,"Rietvelt, Lesley Joy","['Hoftijzer, P.G.', 'Dlabačová, A.']",2021,Faculty of Humanities,Media Studies (MA),Master thesis,en,,"['Japan', 'Tokugawa', 'VOC', 'books', 'boekgeschiedenis', 'book history', 'rangaku', '17th century', '18th century', 'astronomy', 'science', 'history', 'Edo', 'Deshima', 'exchange']"
The Cross-Linguistics Influence on the Realization of the Voice Onset Time of English L3 Stop Consonants by Simultaneous Bilingual Speakers,"Wouters, Jason","['Grijzenhout, J.']",2021,Faculty of Humanities,Engelse taal en cultuur (BA),Bachelor thesis,en,,"['cross-linguistic influence', 'voice onset time', '2L1', 'TLA', 'typology']"
"The Imperial Archipelago: Governors, Organisational Identity, and the Dutch East India Company, c. 1700-1750.","Visser, Lennart","['Schrikker, A.F.']",2021,Faculty of Humanities,History (research) (MA),Research master thesis,en,"The Dutch East India Company has been ascribed many faces and many colours during its existence, and these still echo throughout the public debate and national discourse. This thesis will contribute to new directions in the historiography of Dutch Empire by focusing on the Dutch East India Company governors and the narratives they communicated in the so-called 'Memories van Overgave', how these changed between 1700-1750, how these differed between three different regions: Bengal, Ambon, and Ceylon, and what the implications are for the organisational identity of the Dutch East India Company. In order to do so, this thesis employs a new analytical framework that positions the governor in the centre of two different relations: the relation he had to the institute he was a part of, and the relation he had with the proverbial 'other' he encountered. Everything combined, this will show the multi-faceted nature of the governors, the Dutch East India Company, and that the identity of the Dutch East India Company was not static, but flexible and ever-changing.","['Early Modern', 'Dutch East India Company', 'Global History', 'Colonial History', 'Memory Culture', 'Identity', 'Southeast Asia', 'Ceylon', 'Ambon', 'Bengal', 'Colonial Governors', 'Organisational Identity']"
The Increasing Competition of the Asian International Financial Centres: An analysis of the determinants building Shanghai and Seoul,"Broers, Nicole","['Shidiq, A.R.']",2021,Faculty of Humanities,International Relations (MA),Master thesis,en,"The Asian International Financial Centres (IFC) are growing in importance within the global economy. Increasingly they are becoming the control centres of financial flows and innovation. In particular, the aspiring IFCs of Shanghai and Seoul have remarkably increased in status and competitiveness. This research discusses a possible explanation for their increase in competitiveness. Both cities have large systemic differences from the well-established Western IFCs, as government control and policies have been predominant in the East-Asian region. Nevertheless, they are flourishing in the international financial system based on market mechanism. During the Asian Financial Crisis, Asian centres have undergone many changes and multiple government reform policies have been carried out to enhance the financial sectors. Within this research, the influence of the crisis and changes in the determining factors for competitiveness are scrutinized. The four main determinants constituting an IFC set the parameters for the two case studies of Shanghai and Seoul. The results suggest that the government focus on rapid technological and infrastructural developments have contributed the most to the increase in competitiveness. Moreover, these developments are a part of a shift towards high-end technology industries and services and the overarching government-driven transition towards a knowledge economy.","['Asia', 'Finance', 'Competition', 'Shanghai', 'Seoul']"
Heldenverering in de late Republiek en het vroege Koninkrijk der Nederlanden,"Moerwijk, Guido","['Groesen, M. van']",2021,Faculty of Humanities,Geschiedenis (BA),Bachelor thesis,nl,,
The role of fisheries in the negotiations towards the 1995 enlargement of the European Union,"Blankenstijn, Koen","['Broad, M.']",2021,Faculty of Humanities,International Relations (MA),Master thesis,en,,
Opium van het volk? Onderzoek naar de Amphioen Sociëteit 1745-1801,"tijssen, tycho",['Antunes C.A.P.'],2021,Faculty of Humanities,Geschiedenis (BA),Bachelor thesis,nl,,
Reconstructing Historical Performing Arts: Baba Bunkō’s Kōshaku and Jitsuroku,"Shore, Arlo","['Smits, I.B.']",2021,Faculty of Humanities,Japanstudies (BA),Bachelor thesis,en,,
The establishment of a mandatory Transparency Register: A discourse analysis of the key EU institutions on their understanding of the role of transparency in good governance.,"de Jonge, Leanne","['Scepanovic, V.']",2021,Faculty of Humanities,Geschiedenis (BA),Bachelor thesis,en,,
Oorlog om Hagestein (1419-1422). Het grijze gebied tussen publieke en private oorlogvoering in de late Middeleeuwen.,"Buizert, Jan Willem","['Hoppenbrouwers, P.C.M.']",2021,Faculty of Humanities,History (research) (MA),Research master thesis,nl,,"['Oorlog', 'Holland', 'Graven', 'Zeeland', 'Jan van Beieren', 'Frederik van Blankenheim', 'Utrecht', 'Sticht', 'Hagestein', 'vete', 'war', 'fued', 'vorsten', 'onderdanen', 'middeleeuwen', 'late middeleeuwen']"
Sailing to a New World: Water Symbolism in Melville's Moby-Dick and Twain's Adventures of Huckleberry Finn,"Bommel, Martijn van","['Polak, S.A.']",2021,Faculty of Humanities,Engelse taal en cultuur (BA),Bachelor thesis,en,,
After Ælfric: Tracing the Lexical Influence of Ælfric of Eynsham in Two Twelfth-Century English Texts,"Baalen, Amos van","['Porck, M.H.']",2021,Faculty of Humanities,Linguistics (research) (MA),Research master thesis,en,,"['Old English', 'Middle English', 'Twelfth Century', 'Ælfric of Eynsham', 'Historical Linguistics']"
Las Soldaderas: Battleground or Symbolism? The Importance of Female Soldiers in the Mexican Revolution (1910-1920),"Oudenes, Josca","['Bos, Dennis']",2021,Faculty of Humanities,History (MA),Master thesis,en,,"['Soldaderas', 'Mexican Revolution', 'female soldiers', 'Mexican History', 'Adelita', 'Symbolism']"
Het milieubewustzijn als stormvloedkering: De ontwikkeling van het milieubewustzijn tijdens de bouw van de Deltawerken,"Doekes, Roemer","['Touwen, L.J.']",2021,Faculty of Humanities,Geschiedenis (BA),Bachelor thesis,nl,,
“The following lynchings have taken place since our last record”: An analysis of African American media and their coverage of extrajudicial violence (1910-1919),"Aalst, Thijs-Jan van","['Pargas, D.A']",2021,Faculty of Humanities,Geschiedenis (BA),Bachelor thesis,en,,"['African American', 'newspapers', 'media', 'local', 'national', 'lynching', 'extrajudicial violence', 'Jesse Washington', 'Leo Frank']"
"Dissecting Digitization: An exploration of the methodologies, benefits, and pitfalls of the rapidly expanding world of digital history","Dickert, Rachel","['Stolte, C.M.']",2021,Faculty of Humanities,History (MA),Master thesis,en,,"['digitization', 'historical memory', 'preservation', 'Maori', 'New Zealand', 'Aotearoa', 'oral history', 'historiography', 'power dynamics', 'NZ', 'indigenous', 'colonialism']"
Een toren van Babel: Taal in de legers van de Revolutionairen en van Napoleon (1793-1815),"Lelij, Maarten",['S. Halink'],2021,Faculty of Humanities,Geschiedenis (BA),Bachelor thesis,nl,,
On the Quest for Nature in the Work of Esther Kokmeijer,"Palstra, Jasper",['Kitty Zijlmans'],2021,Faculty of Humanities,Arts and Culture (MA),Master thesis,en,,
Koken in Oorlogstijd: De Nederlandse eetcultuur gedurende de jaren 1940-1945,"Visser, Elly",['Prof. Dr. M.L.J.C. Schrover'],2021,Faculty of Humanities,History (MA),Master thesis,en,,
Een plaats in een wit herdenkingslandschap: Representatie van de Surinaams-Caribische gemeenschap in de Nederlandse herinnering aan de Tweede Wereldoorlog,"Camp, Sara van de",['Karwan Fatah-Black'],2021,Faculty of Humanities,History (MA),Master thesis,nl,,
EU-Caspian Energy Ties: An Analysis of the EU’s Relations with Azerbaijan and Turkmenistan in the light of the EU Energy Transition and Gas Diversification Strategy,"Korsman, Daphne",['Morena Skalamera'],2021,Faculty of Humanities,International Relations (MA),Master thesis,en,,"['gas', 'energy', 'Azerbaijan', 'Turkmenistan', 'transition']"
Anna Beek en Eugène-Henri Fricx. Een vergelijkende analyse van militaire nieuwskaarten uit de Spaanse Successieoorlog,"Vroomen, Oscar de",['Prof. dr. Michiel van Groesen'],2021,Faculty of Humanities,History (MA),Master thesis,nl,,"['Fricx', 'Beek', 'Nieuwskaarten', 'Spaanse Successieoorlog']"
