title,author,supervisors,date,faculty,program,type,language,abstract,keywords
The Aging of Translations: A Case Study on Retranslating Orwell’s 1984,"Buschman, Judith","['Reus, T.', 'Zeven, K.L.']",2021,Faculty of Humanities,Linguistics (MA),Master thesis,en,"The aging of retranslations has been getting more attention in the last few decades. Yet not much research has been conducted that can easily be replicated. In this study, the method by Van Poucke (2017) is used to find out if the first translation of 1984 by George Orwell has aged. 1984 was chosen because of the relevance that it still has and because it can add to the limited research that has been done on retranslating science fiction. Two Dutch translations were analysed, namely the first translation by Kool (1950) and the second and most recent translation by Davids (1984). The first chapter of the two translations was analysed to find out if lexical and stylistic aging could be found. Furthermore, the translations were analysed on the aging of technological concepts. Van Poucke’s method was used, because it is the leading method that operationalizes the research of aging. The findings show that lexical aging could not be determined in the first translation. For stylistic aging, much more evidence was found. After conducting this research, it can be concluded some evidence has been found that the first translation of 1984 has indeed aged and the aging of the first translation could have been a reason for retranslating the novel.","['retranslation', 'orwell', 'aging', 'translation']"
"""Doos waarop je 'n deksel doet"" or ""Hinde, een hert, een vrouwelijk hert""? Subtitling Movie Musicals Logocentrically or Musicocentrically","Dam, Marike van","['Dorst, A.G.']",2021,Faculty of Humanities,Linguistics (MA),Master thesis,en,"The research undertaken in this thesis was aimed at researching whether “logocentric” subtitles – literal, word-by-word translations – and “musicocentric” subtitles – translations that take rhyme, rhythm, singability, sense, and naturalness into account – of songs in English-language live action movie musicals would be appreciated equally by Dutch viewers. Because of the “gossiping effect” (Törnqvist, 1995) – which makes viewers react negatively to subtitles that do not show what they hear being said – the expectation was that viewers would appreciate logocentric subtitles more, as musicocentric subtitles would likely be deemed “wrong” by Dutch viewers with a command of the English language as they are not literal translations of the lyrics. The research used Franzon’s (2008) concepts of logocentric and musicocentric translation and Low’s (2003, 2005) “pentathlon principle” to create logocentric and musicocentric subtitles for excerpts from songs of four English-language live action movie musicals: Sweeney Todd: The Demon Barber of Fleet Street (Burton, 2007), Les Misérables (Hooper, 2012), The Sound of Music (Wise, 1965), and West Side Story (Robbins & Wise, 1961). These excerpts – two of which were subtitled logocentrically and two of which were subtitled musicocentrically – were then shown to a sample of 90 respondents through the use of a survey. The survey asked the respondents to report – for each excerpt – whether they thought the subtitles were good, and how they would rate the subtitles. The respondents overwhelmingly reported that the logocentric subtitles were good, and that the musicocentric subtitles were not good; they also rated the logocentric subtitles high, and the musicocentric subtitles low. Thus, the logocentric and musicocentric subtitles were not appreciated equally: the logocentric subtitles were appreciated more, an outcome the gossiping effect likely influenced. As logocentric subtitles appear to be more appreciated, and easier to create, an implication of this research could be that Dutch subtitlers should create logocentric subtitles for songs in English-language live action movie musicals.","['movie musical', 'subtitle', 'logocentric', 'musicocentric']"
Jihadi Brides Take Up Their Knives: The Changing Policy of ISIS on Women Participating in Islamic State Military Actions,"Sewalt, Yara","['Calculli, M.']",2021,Faculty of Humanities,International Studies (BA),Bachelor thesis,en,,
The Great American Novel: Writing National Identity,"Engelen, Gijs van","['Bilt, Eduard van de', 'Gaskill, Nicholas (Oxford University)']",2021,Faculty of Humanities,History (MA),Master thesis,en,"This thesis examines the tradition of the Great American Novel (GAN). Against current academic trends, this literary canon is not understood to safeguard conservative hegemonies. Here, it is rather studied as an ongoing discourse that has questioned ostensible certainties in American national identity throughout the twentieth century. A select number of GANs are shown to have survived in the canon for decades, and to share an even more select number of archetypes which the novels consistently problematise. The continued resonance of these narratives is argued to be indicative of inherent ambiguities that fester on in American identity as cultural unfinished business. An added relevance is the fact that those uncertainties cropped up precisely during periods when US nationalism seemed to peak, a pattern that forms a surprising, alternative cultural history. The term “Great American Novel” was coined in 1868 by John William DeForest, who called for realist American novels to equal European ones, and to present an imagined US community that overcame post-Civil War regional divisions. Ever since, the tradition has been alluring to American authors seeking to establish their cultural weight. Yet the canon as we know it today only took shape after the confidence-boosting outcome of the First World War, when critics and academics renounced the European, realist ideals of their predecessors in favour of “Romance”, a symbolical style which they claimed had always been the basis of literary American exceptionalism. Retroactively, The Scarlet Letter, Moby-Dick and Huckleberry Finn were canonised as the Romance-edifice, as if they had always been just that. Their archetypes, namely individualism, the American Dream and the frontier spirit, together became a national mythology of sorts, so successful was this invented tradition. Soon it was so familiar, that subsequent authors who sought to reflect on American identity could do so by alluding to those three ultimate GANs. The canon thus became an ongoing discourse, a cultural conversation in which a limited set of rules and clichés were contemplated as national roots. Authors from the Great Depression were the first to demonstrate this. They took the three tropes mentioned, and superimposed them onto topical stories of economic hardship. GANs from the era thus romanticised the canonical archetypes as the eternal foundations of American exceptionalism, precisely by linking their betrayal to contemporary, “un-American” injustices. The years following the Second World War, by contrast, saw such a boost to national confidence that they were named a “Golden Age.” Yet a new generation of authors showed its teeth by digging up GAN-archetypes and weaponizing them, especially those related to frontier-adventurism, against contemporary ideals of dull material comfort. Indeed, the canon’s role as underminer of cultural certainties became fixed in these years. Hence the nadir in GAN-output amid the blows to American superiority of the 1960s and 1970s: the eras of Vietnam and Watergate required no reminding of American problems. The Reaganist 1980s did, however. Especially black authors began to attack Americans’ sense of innocence regarding their history, by again returning to the GANs’ archetypes: taken as the roots of US exceptionalism, they were rewritten as shared traumas. Far from weakening the canon’s position, this attack on its traditions actually revitalised its function as ongoing discourse. Consequently, the 1990s saw more (critically acclaimed) GAN-attempts than any other decade. Within them, authors indicated how the end of the Cold War not only boosted American exceptionalism, but also left it without a signifying Other, and thus without direction and narrative. Again, cultural confidence in the wake of a victory in a major global conflict was being undermined by GANs’ exposing hidden ambivalences in national mythology. The GAN’s imagined community has always destabilised American certainties. The canon forms a surprising, alternative cultural history, in which anxieties invisible in other histories come to the fore, precisely when one would least expect them to. Understanding canons as mere conservative bastions is thus argued to be highly reductive, and damaging to their rich analytical promise in cultural analysis. NB: Dubbelscriptie t.b.v. de opleidingen MA Literary Studies en MA Geschiedenis","['Great American Novel', 'national identity', 'imagined communities', 'cultural history', 'literary canons', 'United States..']"
Are Black Americans Facing Genocide? A Study of Policing Practices in the United States,"Sadrizadeh, Sara","['Regilme, S.S.']",2021,Faculty of Humanities,International Relations (MA),Master thesis,en,"Police brutality in the United States has sparked a national outcry, as this year again far too many black people have fallen victim to police shootings. Though activists have been advocating for change and scholars have examined the current flawed system, they have not studied the black struggle from a contemporary genocide lens. This thesis examines American policing practices in lights of genocide, and it offers a brief history of policing practices and slavery, as well as discusses the various findings of African American Studies scholar. This thesis shows how after decades of slavery there are still genocidal tendencies in the police force, which is analysed through Stanton’s stages of genocide, as well as notions of indirect genocide. The findings indicate that policing practices pass the first six stages of Stanton, classification, symbolisation, discrimination, dehumanisation, organisation and polarisation. Though fortunately, not all stages have been realised, this thesis wishes to elucidate the deeply entrenched racial biases that are causing unbearable living situations for black Americans and to listen to those who have been silenced over the years.","['genocide', 'race', 'policy', 'police practices', 'Stanton', 'state violence']"
Dacia Traiana: Een onderzoek naar de gebeurtenissen tijdens en na de Dacische Oorlogen en de gevolgen die deze hadden op de Dacische provincie en bevolking,"Kenter, Mark","['Flohr, M.']",2021,Faculty of Humanities,Geschiedenis (BA),Bachelor thesis,nl,,"['Dacia', 'Trajanus: Dacische Oorlogen', 'Rome', 'Dio', 'Eutropius', 'Daciërs: Dacië']"
Counterinsurgency in Iraq: the Dutch and British Approaches compared,"Vermeer, Tim",['Dr. Andrew Gawthorpe'],2021,Faculty of Humanities,International Studies (BA),Bachelor thesis,en,,"['Counterinsurgency', 'Dutch Approach', 'British Approach']"
Between Myth and Adaptation: Achilles and Patroclus in Troy and The Song of Achilles,"Ravinetto, Chiara Luigina Dosithea",['Prof. dr. P.T.M.G. Liebregts'],2021,Faculty of Humanities,Engelse taal en cultuur (BA),Bachelor thesis,en,,"['Achilles', 'Patroclus', 'Adaptation']"
Of Dictators and Disasters: Examining authoritarian regimes’ obstruction of humanitarian aid following natural disasters,"Johnstone, Alistair","['Maat, E. Van der']",2021,Faculty of Humanities,International Relations (MA),Master thesis,en,"Natural disasters pose a unique threat to authoritarian regimes because they can bring existing failures within the structure of governance into sharp relief, thus legitimising the grievances of rebel groups and increasing the risk of civil conflict. Most regimes therefore attempt to ensure humanitarian aid is secured and distributed, to mitigate such damages. Why then, do some regimes obstruct or deny humanitarian aid if doing so may incur costs to the regime? This thesis solves this puzzle by investigating the cases of the Bhola Cyclone in East Pakistan in 1970 and Cyclone Nargis in Myanmar in 2008 and assessing whether each of four key factors were observable in either case. The four factors are: ethnic and ideological differences; a fear of foreign intervention; elite rivalry; and the exit strategy of the military dictator. This analysis leads to several interesting conclusions. First, ethnic or ideological differences are not enough motivation for a regime to incur the costs of obstructing aid. Second, regimes will deny or obstruct foreign aid if they believe doing so will lead to a decreased risk of civil conflict. Third, elite rivalry may manipulate the regime’s leadership into acting against its own best interests. Finally, authoritarian leaders will prioritise their own exit strategy over the need to prevent untold numbers of civilian deaths.","['authoritarian', 'natural disaster', 'humanitarian aid', 'selective violence', 'East Pakistan', 'Bhola cyclone', 'Myanmar', 'Cyclone Nargis', 'Elite Rivalry', 'Democratic transition']"
“The eyes of the abroad must be opened”: An analysis of the framing of the Treaty of Trianon to external audiences by interwar Hungarian intellectuals.,"Mihályi, Géza","['Broad, Matthew']",2021,Faculty of Humanities,International Relations (MA),Master thesis,en,,
"Scientific Secrecy in Frankenstein (1818), Strange Case of Dr Jekyll and Mr Hyde (1886), and The Invisible Man (1897)","Wesselius, Lotte","['Newton, M.S.']",2021,Faculty of Humanities,Engelse taal en cultuur (BA),Bachelor thesis,en,,
The Drug Crisis in the United States: How the Obama Administration Opposed the War on Drugs Campaign,"Rimkute, Morta","['Scott-Smith, Giles']",2021,Faculty of Humanities,International Studies (BA),Bachelor thesis,en,,
Pan-Arabism and Identity Politics: a between case study design of Iraq (1952-1977),"Iliopoulos, Alexandros",['Prof. Natermann'],2021,Faculty of Humanities,International Relations (MA),Master thesis,en,,
"Reification and its Musical Critique: In Adorno, Beethoven, and Schoenberg","Thommassen, Roman","['Uljée, R.', 'Jong, J. de']",2021,Faculty of Humanities,Philosophy (MA) (120 EC),Master thesis,en,,"['Adorno', 'Reification', 'Music', 'Beethoven', 'Schoenberg']"
"Us, We, Me, I: The Artifice of Identity and Film in Persona, 3 Women, and Mulholland Drive","Zararsiz, Melda","['Newton, M.S.']",2021,Faculty of Humanities,Literary Studies (MA),Master thesis,en,,
BEYOND THE BIOPOLITICS OF REPRODUCTION: An Analysis of the Abortion Rights Movement and the Feminist Struggle for Sexual and Reproductive Rights in Argentina,"Estrada Londoño, Julia","['Isla Monsalve, P.A.']",2021,Faculty of Humanities,Latin American Studies (MA),Master thesis,en,,"['Abortion', 'Sexual and reproductive rights', 'Feminist activism', 'Biopolitics', 'Argentina']"
The Qumran Pešarim: Function and Interpretative Authority,"Rasche, Lea","['Valk, J.', 'Folmer, M. L.']",2021,Faculty of Humanities,Classics and Ancient Civilizations (research) (MA),Research master thesis,en,,
Hedging and Regional Order Contestation: Understanding Southeast Asian hedging in the South China Sea,"Leong, Nicole","['Chang, V.K.']",2021,Faculty of Humanities,International Relations (MA),Master thesis,en,,
“Silence Was Approval”: Or: How I Stopped Worrying about the United States Governmental Use of State-Private Networks and LOVE the World AntiCommunist League,"Bleukens, Thomas",['G.P. Scott-Smith'],2021,Faculty of Humanities,North American Studies (MA),Master thesis,en,,
An American Peculiarity: The Normalization of Non-Voting in America,"Cebalo, Anton","['Dr. W.M. Schmidli, W.M.']",2021,Faculty of Humanities,History (research) (MA),Research master thesis,en,,"['Political Culture', 'Voting', 'United States', 'Depoliticization', 'Social History', 'Public Trust', 'Political Efficacy', 'Democracy']"
COSTA RICAN WOMEN’S MOVEMENTS: AGAINST OR WITH THE STATE? Evaluation of the state actions against gender-based violence in Costa Rica in the last decade.,"Wingerde, Gina van",['N. Rodriguez Idarraga'],2021,Faculty of Humanities,International Relations (MA),Master thesis,en,,
Gods and refugees: Framing newcomers in Greek tragedy,"Korte, Inez de","['Rademaker, A.M.']",2021,Faculty of Humanities,Classics and Ancient Civilizations (MA),Master thesis,en,,"['tragedy', 'Aeschylus', 'Sophocles', 'Euripides', 'suppliants', 'framing']"
Diversifying notions of dōjin culture: A case study on Tōhō Project and its derivative fan music,"Hoekstra, Lisa","['Crandol, M.E.']",2021,Faculty of Humanities,Asian Studies (60 EC) (MA),Master thesis,en,,"['participatory culture', 'fanworks', 'dōjin music']"
The Georgian Memory of Stalin: Inights in how Stalin is remembered in modern Georgia,"Zwart, Wietse","['Bader, M']",2021,Faculty of Humanities,International Studies (BA),Bachelor thesis,en,,"['Georgia', 'Stalin', 'Memory', 'Memory Studies', 'Caucasus', 'Soviet', 'Soviet Union']"
"'Liever Fransch als Prins' De Franse Revolutie door de ogen van Nederlandse kranten, pamfletten en geschiedschrijvers","Fleurkens, Jaap",['Prof.Dr. J.F.J. Duindam'],2021,Faculty of Humanities,Geschiedenis (BA),Bachelor thesis,nl,,
Sexual Harassment in Post-Uprising Egypt: An Analysis of the Regimes of President Morsi and President Sisi.,"Hannan, Esmé","['Calculli, M.']",2021,Faculty of Humanities,International Studies (BA),Bachelor thesis,en,,
THE DYNAMICS BETWEEN SECURITY GOVERNANCE AND THE ECONOMY: Towards a Concept of Rentier Governmentality in the Gulf,"Cats, Emma","['Henderson, C.J.V.']",2021,Faculty of Humanities,International Relations (MA),Master thesis,en,,"['Governmentality', 'security', 'governance', 'economy', 'rentierism', 'Gulf', 'UAE']"
On Recalling Trauma and Turmoil: Reading Kurt Vonnegut's Slaughterhouse-Five and Ian McEwan's Atonement as Narratives of Trauma,"Renssen, Sten","['Van Dijkhuizen, J.F.']",2021,Faculty of Humanities,Engelse taal en cultuur (BA),Bachelor thesis,en,,"['narrative fragmentation', 'trauma theory', 'coping', 'imagination', 'isolation']"
"The Dutch East India Company and the Rice Economy of Java, 1743-1800","Wahyu Pratiwi, Yuanita","['Bes, L.P.J.']",2021,Faculty of Humanities,History (MA),Master thesis,en,"Even though the Dutch East India Company (VOC) came to Asia for Asian luxury products, in Java, their main drive was a bulk, rice, which was used as the operational cost for its empire in Asia. After a series of wars in the past century, in 1743, the VOC managed to establish control over the majority of rice producing area in Java. This responsibility oftentimes set the VOC as the ultimate cause of the deteriorating of the once flourishing rice economy of Java. However, the accusation experienced strong challenges from the established studies telling about prosperity in the second half of 18th century Java and VOC’s minimal intervention to the island’s rice economy. This thesis examined the contradiction through an exploration towards VOC’s trading document such as the general ledger, correspondence, and reports. In the end it argues that however thin was VOC’s influence to the system, the impact was devastating for Java’s rice economy. Since 1743, VOC asked for 5000 koyangs rice, which was more than a half of Java’s total surplus from a particular region named pasisir which made only 35% of the total rice producing area in Java. This thesis also argued that in the second half of 18th century, different parts of Java experienced different states of economy. The hinterland, under the ex-Mataram states was prosperous because they did not have to bear the 5000 koyangs annual obligatory delivery, while in pasisir, workload increased without proper compensation. This phenomenon in pasisir led to the rapid growth of population, rapid deforestation for constructing rice field, for a mere stagnant surplus. The obligatory delivery cut a considerable income of the pasisir’s rice farmer, left them with no relaxation on their budget that initially could make room for innovation and technological advancement, which were why, in the 18th century pasisir rice farmer re-practiced frugal extensification as what their ancestor did eight century ago.","['VOC', 'rice', 'rice economy', 'food policy', 'Java', 'pasisir']"
The Decision of Rebels in West Africa to resort to Sub-National Terrorism against Civilians,"Beijer, Maaike",['Dr. Eelco van der Maat'],2021,Faculty of Humanities,International Relations (MA),Master thesis,en,,"['Terrorism', 'Sub-National Terrorism', 'Regionalism', 'West-Africa', 'Rebel Organizations', 'Violence', 'Violence against Civilians', 'Marginalization']"
Nasser en de Suezcrisis: De invloed van de Suezcrisis op Nasser als leider binnen de dekoloniserende wereld,"Houting, Jonathan den","['Stolte, C.M.']",2021,Faculty of Humanities,Geschiedenis (BA),Bachelor thesis,nl,,"['Nasser', 'Suezcrisis', 'Egypte', 'Koude Oorlog', 'dekolonisatie', 'dekoloniserende wereld']"
A Study in Masculinity: Deconstructing Masculinity in Sir Arthur Conan Doyle's Sherlock Holmes and the BBC's Sherlock,"Wolff, Lisanne de","['Newton, M.S.']",2021,Faculty of Humanities,Engelse taal en cultuur (BA),Bachelor thesis,en,,
Explaining Trump’s Foreign Policy: Jacksonianism Versus Neoclassical Realism,"Kleijn, Sanne",['Dr. Andrew J. Gawthorpe'],2021,Faculty of Humanities,International Relations (MA),Master thesis,en,,
'False Profits': Futurology and Futurity in Contemporary Crisis Fiction,"Burrow, Gabriel",['Maria Boletsi'],2021,Faculty of Humanities,Literary Studies (MA),Master thesis,en,,"['Crisis', 'Fiction', 'Futurology', 'Futurity', 'Don DeLillo', 'Nathaniel Rich', 'Prediction', 'Risk', 'Uncertainty']"
Revolution in the Dutch Republic and resoluties in Batavia: A quantitative approach to the perspective of the VOC in Batavia between 1790-1806,"Idema, Michiel","['Bloembergen, M.']",2021,Faculty of Humanities,History (MA),Master thesis,en,,"['Hoge Regering', 'archival events', 'VOC', 'decline Dutch East India Company']"
The Owls in Hieronymus Bosch's Paintings: An Approach to the Painter's Workshop,"Lopes Fernandes, Julio Wilson","['Boers-Goosens, M.E.W.']",2021,Faculty of Humanities,Arts and Culture (MA),Master thesis,en,,"['Hieronymus Bosch', 'Jheronimus Bosch', 'Workshop', 'Owls', 'Paintings']"
A11Y 4 All? Evaluating the web accessibility of the British Museum and the National Galleries of Scotland.,"Vergers, Romeo","['Wild, K. de']",2021,Faculty of Humanities,Arts and Culture (MA),Master thesis,en,,"['Accessibility', 'Web Accessibility', 'British Museum', 'National Galleries of Scotland']"
Een geschiedenis van Suriname geschreven door twee negentiende-eeuwse buitenstaanders: Hoe maatschappelijke ontwikkelingen en persoonlijke opvattingen doorspelen in de door Maria Vlier en Julien Wolbers geschreven grondlegging van de Surinaamse geschiedenis,"IJtsma, Fenna","['Janse, M.J.']",2021,Faculty of Humanities,History (MA),Master thesis,nl,,"['Maria Vlier', 'Julien Wolbers', 'Suriname', 'Geschiedschrijving', 'Kolonialisme', 'Koloniale kennis', 'Historiografie', 'Slavernij', '1863']"
"The Impact of The Private Sector and Public Private Partnerships on Healthcare Systems in Mombasa, Kenya - A Potential Solution to the African Healthcare Crisis?","Whitlock, Robert",['Dr. S. Bellucci'],2021,Faculty of Humanities,International Studies (BA),Bachelor thesis,en,"In 2015, all UN member states adopted the 2030 agenda for sustainable development. In this agenda, a blueprint was created which outlined a pathway for planetary peace and prosperity consisting of 17 goals named the Sustainable Development Goals (SDGs). SDG three (3), Good Health and Wellbeing, seeks to “Ensure healthy lives and promote wellbeing for all ages”. The SDGs are of global relevance, however nowhere more so than the emerging markets where they are used by countless international organizations, development finance institutes, NGO’s, and more, to justify and measure the success of investments, programs, and projects, at the human level. One widely discussed and key barrier between SDGs being achieved and the current position, is the availability of the capital and technical skills required to fund and build hospitals, solar farms, water treatment plants, and the myriad of other large-scale infrastructure upon which the health and wellbeing of a nation rests. This issue has been dubbed the infrastructure deficit, and according to the UN, reducing both the technical shortfalls and the USD 67.9 billion per annum financial shortfall which underly it is key to securing Africa’s long term sustainable growth. Using a case study approach focussed on two counties in Kenya, this paper evaluates a potential solution to Africa's infrastructure problem in the form of Public Private Partnerships (PPPs).","['Health', 'Africa', 'Blended Finance']"
