title,author,supervisors,date,faculty,program,type,language,abstract,keywords
Constructieve journalistiek als leidraad voor Omroep West: Hoe journalisten van een regionale omroep constructieve journalistiek toepassen op hun eigen werk,"IJtsma, Fenna","['Van Hout, Tom']",2019,Faculty of Humanities,Media Studies (MA),Master thesis,nl,"Nieuwsmedia staan onder druk en verandering moet er komen in de vorm van constructieve journalistiek vinden voorstanders van deze stroming (Gyldensted 2015; Haagerup 2014). Constructieve journalistiek gaat in op de vraag ‘wat nu?’, het besteedt meer aandacht aan achtergrondinformatie, heeft als doel accurater te zijn door zowel oog te hebben voor negatieve aspecten als positieve aspecten in de samenleving en het kijkt naar mogelijke oplossingen (Meier 2018). Steeds meer nieuwsorganisaties experimenteren met constructieve journalistiek. Zo ook de Nederlandse regionale nieuwsorganisatie Omroep West, die in september 2017 begon met een transitie naar constructieve journalistiek. In deze afstudeerscriptie is aan de hand van reconstructie-interviews met tien journalisten van Omroep West een antwoord geformuleerd op de volgende hoofdvraag: Hoe passen journalisten van een regionale omroep naar eigen zeggen constructieve journalistiek toe op hun werk? De bevindingen van dit onderzoek wijzen uit dat journalisten van Omroep West constructieve journalistiek vooral associëren met de service-rol en de civic-rol, twee van de zes journalistieke rollen die zijn opgesteld door Mellado (2015). Dit bleek uit het feit dat de journalisten vaak het contact met het publiek zagen als constructieve invalshoek van de eigen productie. Dit contact met het publiek past bij een regionale omroep, aangezien die onder andere als doelstelling heeft om verbinding te brengen in de samenleving. Dit kan een verklaring zijn dat journalisten juist dit aspect van constructieve journalistiek (zoals dit begrip is opgevat door de journalisten) vaak benadrukten. De journalisten zagen constructieve journalistiek vooral als een tool die gebruikt kan worden als een productie zich hiervoor leent. In dat opzicht is het aannemelijk dat journalisten die aspecten eruit hebben gehaald die zij geschikt achtten voor hun functie als regionaal journalist. Naast het publieksgerichte aspect van constructieve journalistiek werd vooral het positieve aspect van de stroming verwerkt in de producties. In totaal zijn er op basis van de bevindingen zes werkwijzen opgesteld waarmee journalisten constructieve journalistiek hebben toegepast in hun werk: 1. Producties maken naar aanleiding van een vraag uit het publiek; 2. Burgers in contact brengen met deskundigen; 3. Openstaan voor positieve geluiden; 4. Een vertelstructuur bepalen waardoor positieve aspecten meer de nadruk krijgen; 5. Gedegen en kritisch onderzoek doen naar bestaande praktijkvoorbeelden; 6. Ingaan op mogelijke oplossingen. Elke werkwijze vervult een of meer constructieve doelstellingen. Ook vervullen de meeste werkwijzen een of meer van de drie doelstellingen die passen bij een regionale omroep: informeren, controleren en binden (De Jong & Koetsenruijter 2019).","['Constructieve journalistiek', 'Regionale journalistiek', 'Constructieve werkwijzen', 'Ulrik Haagerup', 'Cathrine Gyldensted', 'Hogeschool Windesheim', 'Omroep West', 'Vraaggestuurde journalistiek']"
"Simple Men, Twisted Women: the Gendered Struggle for Power in Rebecca and My Cousin Rachel","Hoogenboom, Geertje","['Newton, M.S.']",2019,Faculty of Humanities,Engelse taal en cultuur (BA),Bachelor thesis,en,,"['literature', 'Daphne du Maurier', 'Gender', 'Rebecca', 'My Cousin Rachel', 'Freud']"
"'Dye leeuwe is los geworden', de conflictbeheersing tussen handelaren uit Holland, Zeeland en Pruisen tussen 1433-1482.","Liemburg, Jelte","['Sicking, Louis']",2019,Faculty of Humanities,History (MA),Master thesis,nl,,"['Hanze', 'Holland', 'Zeeland', 'Pruisen', 'Conflicten']"
'The memory is the message' - Media als katalysator van en reflectiemiddel voor herinneringen in het late proza van Cees Nooteboom,"Kafoe, Jorrit","['Beek, Esther op de']",2019,Faculty of Humanities,Neerlandistiek (MA),Master thesis,nl,,"['Nooteboom', 'media studies', 'memory studies', 'herinnering', 'herinneringsthematiek']"
Adapting to a Changing World: The Case of the Arctic Council,"Valsson, Andri Yrkill","['Gerrits, A.W.M.']",2019,Faculty of Humanities,International Relations (MA),Master thesis,en,"This thesis tests the case of the Arctic Council, the leading international organization focused exclusively on the northernmost region on earth, against Liberalism and other theories of International Relations. Established in 1996 and including former Cold War opponents Russia and the United States among its signatories, the Council’s existence as a platform for cooperation so soon after the Cold War highlights its global and historical significance. By looking at the core of the Arctic Council, this thesis highlights its development as an international organization and aims to underline how military confrontations have been kept to a minimum. Since its establishment, the Council has faced a multitude of challenges as an international organization where the environmental change has facilitated access to more natural resources in the Arctic, catching the attention of other states and organizations who wish to exploit these changes to their own benefit. This thesis concludes that the Arctic Council has developed into a more structured international organization and can be evaluated to be a successful one. This research suggests the cooperation between the Arctic states within the Arctic Council can be a preventing factor for military confrontation from escalating in the region. The Council is argued to have acted within its geostrategic framework, been successful in what it was established to do and adapted to a changing landscape in the region at the same time. To stay within their stated mission and act within their geostrategic framework to reduce military tension is argued the lesson to be learned for other international organizations from the case of the Arctic Council.","['Arctic Council', 'International Relations', 'International Organization']"
Generational Influences and Patterns in the Making of Americans in Willa Cather's O Pioneers! and My Ántonia,"Nauss, Sarah","['Kardux, J.C.']",2019,Faculty of Humanities,Literary Studies (MA),Master thesis,en,,"['Cather', 'Immigration', 'Turner', 'Bourne', 'Hansen', 'Handlin', 'Pioneer']"
The challenge of how to reconcile European fiscal discipline and social democracy; a case study of the Sozialdemokratische Partei Deutschlands (SPD) and its stance on the Stability and Growth Pact (SGP),"Oostman, Charlotte Anne","['Oude Nijhuis, Dennie']",2019,Faculty of Humanities,International Relations (MA),Master thesis,en,,"['Germany', 'Social Democracy', 'European fiscal policy']"
"Mario Equicola, Isabella d'Este e il fenomeno della lingua cortigiana","Kreuze, Wouter","['Di Felice, Claudio']",2019,Faculty of Humanities,Italiaanse taal en cultuur (BA),Bachelor thesis,it,"Attraverso i secoli, la lingua italiana si è manifestata in tante forme diverse. Da variazio¬ni ben documentate come l’italiano standard fino a quelle storiche appena conosciute. Appartengono ad una problematica del tutto diversa tutte le questioni di carattere pratico e teorico che hanno a che fare con il fenomeno conosciuto come la lingua cortigiana. Non è facile definire questa manifestazione quattro- cinquecentesca della lingua italiana. Non si tratta di ostacoli di natura prevalentemente pratica, come quelli che si possono incontrare durante lo studio dei tratti dialettali dei ceti sociali più bassi. La lingua cortigiana, se infatti si può denominarla ‘lingua’, lo è stata perché usata particolarmente dalle persone più prestigiose della società: cortigiani, umanisti, duchi, marchesi e prìncipi. Il problema di questo fenomeno affascinante, il cui nome è noto a tanti ma la cui natura non è facile definire, ricorre già al momento di indicare la sua essenza. È difficile elencare le parole che fanno parte del suo vocabolario. Nel corso di questo saggio relativamente breve non sarà possibile risolvere tutte le ambiguità appartenenti alla lingua cortigiana, ma sarà nostro scopo gettare almeno un po’ di luce su questa questione intrigante.","['Equicola', ""Isabella d'Este"", 'Lingua cortigiana', 'Libro de natura de amore', 'Mantova']"
"Geswinc, Geswell ond Wyrmas: Understanding Cancer in Anglo-Saxon England","Bossenbroek, Berber","['Porck, M.H.']",2019,Faculty of Humanities,Engelse taal en cultuur (BA),Bachelor thesis,en,,"['Anglo-Saxon', 'Old English', 'Medical humanities', 'Cancer', ""Bald's Leechbook""]"
De Romeinse verdediging van Mauritania,"Boekel, Steven","['Zangenberg, Jürgen']",2019,Faculty of Humanities,Geschiedenis (BA),Bachelor thesis,nl,,"['Romeinen', 'Leger', 'Noord-Afrika', 'Klimaat', 'Nomaden']"
De lange arm vanuit Teheran,"Hendrikse, Joost","['Bouras, Nadia']",2019,Faculty of Humanities,Geschiedenis (BA),Bachelor thesis,nl,,"['Iran', 'Iraanse intimidatie', 'Transnationialisme', 'Iraniërs in Nederland']"
The Problematic Morality of Oscar Wilde’s The Picture of Dorian Gray,"Slegte, Anouk de","['Newton, M.S.']",2019,Faculty of Humanities,Engelse taal en cultuur (BA),Bachelor thesis,en,,['Dorian Gray Oscar Wilde morality']
In oorlog met het katholieke compromis. Katholieke studenten tijdens het interbellum en de verhouding tot de Doorbraak,"Beentjes, Simon","['Trigt, P.W. van']",2019,Faculty of Humanities,History (MA),Master thesis,nl,"Toen Nieuw Links zich eind jaren zestig in de Partij van de Arbeid manifesteerde, moesten katholieke partijbestuurders als Joan Willems en Geert Ruygers dit ontgelden. De katholieke medeoprichters van de Partij van de Arbeid verdwenen uit het partijbestuur en daarna langzaam ook uit het collectief geheugen van de sociaaldemocratische partij. Ook in de historiografie van het Nederland katholicisme zijn politici als Willems en Ruygers nooit goed uitgelicht. Dat is een gemis, omdat de vooroorlogse geschiedenis van deze eerste katholieken in de PvdA inzicht geeft in elitevorming in de katholieke gemeenschap tussen de wereldoorlogen. Omdat de katholieke studentenbeweging geen aansprekend kader bood, zochten studenten als Willems en Ruygers buiten kerkelijke autoriteiten om naar manieren om hun idealen te verbreden en verdiepen. De radicaal-katholieke standpunten die deze idealistische studenten hierbij ontwikkelden, brachten hen in botsing met de leiding van de RKSP en het grootste gedeelte van de clerus. Uit deze groep idealistische studenten zouden zowel fascisten, PvdA’ers als KVP’ers voortkomen. Doordat het radicaal-katholieke gedachtegoed van de idealistische studenten later is bestempeld als ‘proto-fascisme’, was het voor de PvdA lange tijd een minder geliefd hoofdstuk in hun ontstaansgeschiedenis. Dit onderzoek herziet de kwalificatie proto-fascisme om het idealisme van de studenten in de bredere context van het lekenapostolaat en de Katholieke Actie te beschouwen.","['Doorbraak', 'Katholieke kerk', 'Interbellum', 'Studenten']"
Bilbo le hobbit - Daarheen en Weer Terug: A Comparative Analysis of the Dutch and French Translation of Tolkien's Work of Fiction,"Otten, Celine","['Dorst, A.G.']",2019,Faculty of Humanities,Engelse taal en cultuur (BA),Bachelor thesis,en,"This study will focus on translation between English and the Germanic language Dutch as well as English and the Romance language French by comparing the Dutch (1960) and French (1969) translation of J. R. R. Tolkien’s fictional work The Hobbit (1937). Earlier works within the field of translation were mainly concerned with linguistic approaches, attempting to construct taxonomies of the observed changes (e.g., Vinay and Darbelnet, 1958; Catford, 1965). Later scholars took a broader approach by increasingly taking culture and context into more consideration (e.g., Snell-Hornby, 1990; Nord 2005), but linguistic taxonomies have remained a useful framework for discussing translations. Tolkien’s work is presented as an interesting case within the field of translation, as the language he uses appears to be more challenging for translating into Romance Languages (Turner, 2006). Although genetically further away from French, the English language displays features belonging to both the Germanic and Romance languages. The aim of this study is thus to establish any potential structural differences between the Dutch and French translation of the English original text The Hobbit (1937). Tolkien’s use of language and avoidance of specific cultural references create the expectation that the Dutch translation will be closer to the English original compared to the French translation. This expectation was tested within the linguistic framework by applying Vinay and Darbelnet’s (1958) taxonomy of translation procedures and examining word order in Chapter XVI of Tolkien’s work of fiction. The results show that the Dutch and French translation are both quite literal and more similar than the literature would suggest. The French translation, however, is more inclined to use modulations when not translating literally. An analysis of word order illustrated that most changes were made out of necessity. This research shows that linguistic approaches can still be useful for looking at translations.","['translation studies', 'translation procedures', 'Germanic languages', 'Romance languages', 'J. R. R. Tolkien', ""'literal' versus 'free' translation""]"
Provo in de Provincie: interactie tussen Provo's binnen en buiten Amsterdam,"Mulder, Rafael","['Steen, Bart van der']",2019,Faculty of Humanities,History (MA),Master thesis,nl,"Dit onderzoek richt zich op het interstedelijke aspect van de Provo-beweging, tussen 1965 en 1967. Het historisch beeld van Provo gaat vooral over Amsterdam. Door heel Nederland ontstonden echter Provo-groepen, van redelijk geslaagd tot minder geslaagd. Dit onderzoek gaat grotendeels over Provo’s buiten Amsterdam die weinig teweegbrachten met hun acties. Hierdoor wordt duidelijk met welke interactie de groep actief werd in en buiten Amsterdam en waarom de groep elders niet bereikte wat ze wilde bereiken. Dit onderzoek maakt aan de hand van Provo in Amsterdam, Groningen, Rotterdam en Maastricht duidelijk door welke elementen de Provo-groepen elders zich lieten inspireren door Provo Amsterdam, maar ook op welke elementen ze kritiek hadden, wat hun acties inhielden, hoe ze op hun eigen beweging reflecteerden en hoe hun zelfbeeld zich verhield tot de daadwerkelijke ontwikkeling van de groep. Provo in Groningen en Rotterdam mislukte, in tegenstelling tot Provo in Maastricht. Groningse en Rotterdamse Provo’s hadden geen zicht op wat in Amsterdam precies gebeurde, omdat die groepen niet over de goede informatiebronnen beschikten. Het ontbrak in Groningen en Rotterdam om verschillende redenen aan kennis en ervaring. Dit had te maken met de Provo’s in Amsterdam en de lokale Provo’s. Vanuit Maastricht deed een Provo-groep precieze kennis en ervaring op in Amsterdam, waardoor er meer deskundigheid was bij die groep in Maastricht. De andere Provo-groep in Maastricht, de groep van Ontbijt op Bed, profileerde zich ondanks de kennis vanuit Amsterdam juist als een volledig losstaande groep. Ze werden geassocieerd met Provo, maar waren meer een meer zelfstandige groep dan de Provo’s in Groningen en Rotterdam.",
Living in a Man’s World: Women’s Voices in William Shakespeare’s Henry VI Trilogy,"Roos, Janine","['Fikkers, L.E.M.']",2019,Faculty of Humanities,Engelse taal en cultuur (BA),Bachelor thesis,en,,"['Shakespeare', 'Henry VI', 'Literature', 'Women']"
The Dutch Diminutive: A Foot-Based Approach,"Dik, Hugo","['Botma, Bert', 'Grijzenhout, Janet']",2019,Faculty of Humanities,Engelse taal en cultuur (BA),Bachelor thesis,en,,"['Diminutive', 'foot', 'prosodic structure']"
VOT in Dutch-English Spontaneous Speech: Inter-Language Interference in Monolingual and Bilingual Modes,"Alberts, Elise","['Grijzenhout, Janet']",2019,Faculty of Humanities,Engelse taal en cultuur (BA),Bachelor thesis,en,"This study examines the voice onset time (VOT) in voiced and voiceless plosives of Dutch late-language learners of English. Dutch contrasts prevoicing with short-lag VOT, while English has a short-lag and long lag VOT contrast, making them an interesting language pair to look at for bilingual research. In order to find naturalistic VOT values, the data used for this study was found by analysing five speakers as case studies on YouTube. The data was collected in Dutch, English and code-switched sentences. Although there were individual differences, some speakers managed to produce native-like English VOT values for both the voiceless and the voiced plosives. In code-switched utterances, the VOT values for the voiceless plosives were slightly higher than the Dutch values, while the voiced plosives were still produced with prevoicing. Some speakers were thus able to maintain separate categories in both languages, although there was more L1 interference in code-switched contexts. The data also showed that the velar and alveolar plosives followed by a sonorant consonant in English and code-switched contexts contained higher VOT means than those followed by a vowel, suggesting that these are easier to acquire for an L2 learner.","['VOT', 'Bilingualism', 'Plosives', 'Code-switching', 'Dutch-English']"
Bridging Divergent Ideas of Grand Strategy,"Akker, Jasper","['Milevski, L.']",2019,Faculty of Humanities,International Relations (MA),Master thesis,en,,"['Grand Strategy', 'United States', 'European Union']"
Political Rhetoric: Similarities & Differences Between Nationalist Politicians & Terrorist Groups,"Silva Paiva, Camila","['Foster, A.']",2019,Faculty of Humanities,Engelse taal en cultuur (BA),Bachelor thesis,en,,"['political rhetoric nationalism terrorism trump isis', 'applied linguistics']"
Rebel-to-party transformations: circumstances for electoral success,"Deterd Oude Weme, Manon","['Sheppard, Randal']",2019,Faculty of Humanities,International Relations (MA),Master thesis,en,,"['rebel-to-party transformations', 'electoral success', 'FARC', 'Colombia']"
En Busca de la Naturaleza : La Representación del Medio Natural en Cuatro Cuentos de J.R. Ribeyro,"Bakker, Léon Matthijs","['Churampi Ramírez, A.I.']",2019,Faculty of Humanities,Latijns-Amerikastudies (BA),Master thesis,es,"En la cultura peruana, la posición de la Naturaleza conoce una historia curiosa. En la cultura de la población precolombina del Perú, la de la civilización incaica, la Naturaleza ocupaba un puesto prominente. Esta prominencia llevó a una adoración de la Naturaleza que se extendió hasta los tiempos modernos, reflejada entre otros en la literatura del Perú republicano. Como reflejo de la sociedad, donde hasta bien entrado el siglo XX el medio natural gozaba de un estatus privilegiado, el medio natural llegó a ser un elemento integral de la literatura peruana. Una quiebra radical al respecto se realizó a partir del año 1920. Una migración masiva desde el campo hacia la urbe hizo crecer exponencialmente la urbe peruana, causando la desaparición de la Naturaleza de la escena callejera peruana y la pérdida de la imagen arcádica que había caracterizado Lima desde tiempos remotos. Durante los años 50, la década cumbre de esta migración rural-urbana, una generación de escritores denominada la Generación del 50 se comprometió a la tarea de describir la nueva realidad urbana. Esta tesis estudia la representación de la Naturaleza en cuatro cuentos de Julio Ramón Ribeyro, uno de los representantes principales de dicha generación, e investiga el papel de su presencia y ausencia en esta nueva realidad social, una nueva realidad descrita por Jorge Enrique Adoum como “la prisión colectiva, la fosa común, lo real espantoso de nuestros países”.","['Julio Ramón Ribeyro', 'Naturaleza', 'Medio Natural', 'Lo Real Espantoso', 'Generación del 50', 'Realismo Urbano']"
From word to workplace. An exploratory research on language style and employee engagement.,"Rietveld, Martijn Jasper","['Jungslager, Francisca']",2019,Faculty of Humanities,Linguistics (MA),Master thesis,en,,
From 'Proud Monkey' to Israelite: Tracing Kendrick Lamar's Black Consciousness,"Koreman, Romy","['Boletsi, Maria']",2019,Faculty of Humanities,Media Studies (MA),Master thesis,en,,"['double consciousness', 'hip-hop', 'African American culture', 'black subjectivity', 'Kendrick Lamar']"
Will China's Economy Continue to Grow? A Historical Assessment of China's Economic Reform and a Perspective on its Future,"Foaden, Hannah","['Fynn-Paul, Jeffrey']",2019,Faculty of Humanities,International Relations (MA),Master thesis,en,"This thesis examines China’s economic reform since early 1979 and the sustainability of the economic growth it has produced. 40 years ago, the Communist Party of China (CPC) initiated economic reforms. The reform took place in two phases. The objective of the first was to establish a dual-track economy, in which the institutions of the planned economy would come to coexist with forces and principles common to a market economy. The second phase aimed to implement a socialist market economy: the government would maintain its control over the macroeconomic environment, certain sectors and SOEs, but the market would be the coordinating mechanism. This thesis argues that during 40 years of reform, the economy has neither been generally planned and controlled, nor generally liberalised and open. Additionally, while this mixed economy has fuelled China’s spectacular economic growth, it has insufficiently changed the business environment and the role of the government in the economy, because of which concerns are now being raised over the durability and sustainability of China’s growth. This thesis finds that advancing economic growth depends on China’s ability to further reform the business environment and the role of the government but might prove difficult, as such economic policy changes require social and political reform.",
Mensbeeld en burn-out: Filosofische psychologie van vervreemding in organisaties,"Groen, Lieke","['Sleutels, Jan']",2019,Faculty of Humanities,Philosophy (MA) (120 EC),Master thesis,nl,,"['burn-out', 'vervreemding', 'organisaties', 'homo economicus', 'mensbeeld']"
"The establishment of the Historical Archive Office of the Dodecanese Islands, 1947-1967","Papanikolaou, Maria","['Brood, Paul']",2019,Faculty of Humanities,History (MA),Master thesis,en,"The aim of this study is to examine to what extent the process of the nationalization of the former Italian governed Dodecanese Islands by the Greek state was reflected within the establishment of the Historical Archive Office (Istoriko Arxeio Dodekanisou) during the period 1947-1967 and what impact the Historical Archive Office had on the local community. The main argument of the study is that the IAD was established as a national Greek archive, thus documenting the Greek consciousness of the Greek Orthodox population of the Islands, however, excluding and silencing the narratives of the ethnic and religious minorities of the Islands, mainly Jewish, Muslim and Catholic communities, as well as obscured stories of the Greek Orthodox people and the local histories of the Islands. The motivations of the founders of the IAD, the beliefs and the identities of the archivists, the archival policies and practices, are employed as the main tools of analysis of this study. The research concludes with a summary of the study, its limitations as well as recommendations for further research.","['Dodecanese Islands', 'Rhodes', 'National Archives', 'Archives History', 'National Identity and Memory', 'General State Archives of Greece', 'Archivilization', 'Emmanouil Protopsaltis', 'Greek Archives', 'Italian Carabinieri Archive']"
Digitization Initiatives For Preservation & Access : The Transkribus Project As a Stepping Stone For a New Archival Era,"Liakos, Filotas","['Brood, Paul']",2019,Faculty of Humanities,History (MA),Master thesis,en,,"['Transkribus', 'Digitization', 'Preservation', 'Access', 'Digitization Initiatives', 'Digital Archives']"
