title,author,supervisors,date,faculty,program,type,language,abstract,keywords
De Bar Kosiba-strijders in de voetsporen van de Zeloten,"Hetten, Marinde van","['Gzella, Holger']",2019,Faculty of Humanities,Oude culturen van de mediterrane wereld (Bachelor),Bachelor thesis,nl,,"['Zeloten', 'Bar Kosiba', 'Eerste Joodse Opstand']"
Securitization of Migration: A discourse analysis of the European Parliament’s migration-security nexus,"Möttönen, Roosa","['Scepanovic, Vera']",2019,Faculty of Humanities,International Studies (BA),Bachelor thesis,en,,"['Discourse analysis', 'Migration', 'Securitization', 'European Union']"
WHO CARES FOR LIBYAN SOVEREIGNTY? International and Local Drivers of Post-2011 Reconstruction of Libyan Statehood,"Al-Shadeedi, Al-Hamzeh","['Calculli, Marina']",2019,Faculty of Humanities,Middle Eastern Studies (MA),Master thesis,en,"The exposure of Libya’s political fragmentation and societal disintegration after 2011 was picked up by academics, journalists, and policy researchers who have written on that aspect of the Libyan reality more than any other. Libya is perceived as a fragile state with hundreds of armed groups, multiple claims of governance and tens of warring tribes. Both local and international actors have contributed to this image, but this thesis attempts to argue that there is more than the fragile and disorganized state discourse to describe Libya. The fact that Libyan unity, sovereignty, and independence have survived this extreme level of fragmentation is a question that deserves to be investigated. Thus, through the use of wide range of theories, academic and policy papers, news articles, survey data, and political agreements reports, this thesis aims to answer why and how Libya managed to preserve its status as a state in such an environment. It treats the question as a question of sovereignty by arguing that the traditional definition of sovereignty limits our ability to comprehend the state issue in Libya fully. By focusing on different aspects of sovereignty and by selecting broader definitions of the concept, this thesis argues that Libya’s unity and sovereignty have been preserved so far because international and local actors benefit from this arrangement even though they may be (in)directly contributing to fragmentation in the country. The international community is not willing to let states fall-apart, and the Libyan people do not seem to favor division and separation movements. Local state and non-state actors realize this arrangement, and they have not challenged thus far.","['Libya', 'Statehood', 'Sovereignty']"
"Conflicts, Dialogues, and Mutual Constitutions: Filial Piety of Sons and Daughters in Buddhist and Confucian Thoughts and Practices in Medieval and Late Imperial China","Meijer, Lauren","['Lin, Fan']",2019,Faculty of Humanities,Chinastudies (BA),Bachelor thesis,en,,
Chinese Media’s Discourse on the Arrest of Huawei’s Meng Wanzhou: the Politicization of Tech,"Horst, Mischa van der","['Schneider, Florian']",2019,Faculty of Humanities,Asian Studies (60 EC) (MA),Master thesis,en,,"['Huawei', 'Discourse analysis', 'Meng Wanzhou', 'Global Times', ""People's Daily"", 'Xinhua', 'Victimization', 'Chinese media', 'Information technology', '5G']"
A Cross-Cultural Analysis of Rape Culture in the Indian and U.S. Media,"Coenraad, Elvira Audrey","['Sengupta, Roshni']",2019,Faculty of Humanities,International Studies (BA),Bachelor thesis,en,,"['social media', 'rape culture', 'india', 'united states', 'effects', 'objectification']"
The Manifesto of 1958: A Statement to the World on Behalf of Confucianism,"Simionato, Alice","['Els, Paul van']",2019,Faculty of Humanities,Asian Studies (research) (MA),Research master thesis,en,"With the rapid proliferation of New Confucian studies since the mid 1980s, it has become an unquestioned dogma that one particular event at the beginning of 1958 marks a watershed in the movement’s development. This event is the publication of the Manifesto that Mou Zongsan 牟宗三, Tang Junyi唐君毅, Xu Fuguan 徐復觀, and Zhang Junmai 张君劢 co-signed and published almost simultaneously in the two journals Minzhu pinglun民評論 (Democratic Tribune) and Zaisheng再生(National Renaissance) with the title “为中国文化敬告世界人士宣言─我们对中国学术研究及中国文化与世界文前途之共同认识” (Wei Zhongguo wenhua jinggao shijie renshi xuanyan –women dui Zhongguo xueshu yanjiu ji Zhongguo wenhua yu shijiewen qiantu zhi gongtong renshi; translated in English as “A Manifesto on the Reappraisal of Chinese Culture – our Joint Understanding of the Sinological Study relating to World Cultural Outlook.”). Its main purpose is to benefit Western intellectuals in 'aiding them to appreciate Chinese culture'. In order to do so, the authors employ a strategic terminology, which allows them to build a consistent cross-cultural dialogue between Western and Chinese philosophy by means of an unprecedented discourse on 'Chinese Rationalism' (中国心性之学 Zhongguo xinxing zhi xue). Interestingly, the latter is described by the authors as “the essence of Chinese Culture” and, beside its comparative value, it represents the most comprehensive configuration of Confucianism in the context of 20th century. Academic interest in Chinese Studies and Chinese Philosophy should take into account the articulation of Chinese Rationalism in the Manifesto of 1958 as representing a paradigm of post-comparative dialogue that exemplifies the underlying philosophical continuity beyond consistently different traditions of thought.","['Confucianism', 'Rationalism', 'Comparative Philosophy', 'Manifesto', 'New Confucianism']"
البحث والبيان فيما وجدت في أحد مخطوطات القرآن,"Ince, Baris","['Putten, Marijn van', 'Bruning, Jelle']",2019,Faculty of Humanities,Midden-Oostenstudies (BA),Bachelor thesis,en,,"['Quran', ""Qira'at"", 'Recitation', 'Arabe 330b', 'Quranic Manuscripts', 'Al-Dani', 'Ibn Mujahid', 'Van Putten']"
How can the GOS Approach be improved upon and applied to the discourse on WLB and upward mobility in organizations in Japan?,"Welling, Vicky","['Beekman, Yorum']",2019,Faculty of Humanities,Japanstudies (BA),Bachelor thesis,en,,"['GOS', 'CA', 'Discourse Theory', 'Womenomics']"
Media tsars: Russian disinformation and strategic narratives in Slovak online media,"Netopilova, Petra","['Frear, Matthew']",2019,Faculty of Humanities,Russische Studies (BA),Bachelor thesis,en,,"['Russia', 'disinformation', 'Slovakia', 'media', 'EU', 'election', 'strategic narratives']"
The European Union and Cybersecurity; How ENISA Contributes to a more Politically Integrated Union,"Kleinendorst, Sarah","['Broad, Matthew']",2019,Faculty of Humanities,International Studies (BA),Bachelor thesis,en,,"['ENISA', 'Cybersecurity', 'CFSP', 'European Union']"
Finally doing their own thing? A research on the motivations for the proposed script change in Kazakhstan,"Miltenburg, Fabienne","['Frear, Matthew']",2019,Faculty of Humanities,International Studies (BA),Bachelor thesis,en,,"['Kazakhstan', 'script', 'Cyrillic', 'national identity', 'script change', 'Latinization']"
The Blasphemy Law in Indonesia,"Sprenkeling, Ruth Sara","['Kaptein, N.J.G.']",2019,Faculty of Humanities,South and Southeast Asian Studies (BA),Bachelor thesis,en,,
Kitāb Fakhr al-sūdān ʿalā al-bidān: A description of the Blacks in the works of Al-Jāḥiẓ,"Elmi, Sadia","['Bruning, Jelle']",2019,Faculty of Humanities,Midden-Oostenstudies (BA),Bachelor thesis,en,,"['Africans', 'Arab literature']"
The Availability of Medical Care During the Song Dynasty 960 - 1279,"Li, Angela","['Lin, Fan']",2019,Faculty of Humanities,Chinastudies (BA),Bachelor thesis,en,,"['China', 'Medicine', 'Health care', 'Song Dynasty', 'Huizong', 'Shaman', 'Medical governance']"
"Influencers, Informers, Watchdogs and Bridge-builders: The Many Faces of Japanese Foreign Policy Think Tanks","Van Aalst, Annette","['Wakefield, Bryce']",2019,Faculty of Humanities,Asian Studies (120 EC) (MA),Master thesis,en,,
The Visegrád Group - Eastern Partnership Cooperation with Ukraine and Georgia,"Demange, Lukas","['Broad, Matthew']",2019,Faculty of Humanities,International Studies (BA),Bachelor thesis,en,,"['Visegrad Group', 'V4', 'Visegrad Fund', 'Eastern Partnership', 'EU Neighbourhood policy', 'V4EaP', 'Ukraine', 'Georgia']"
The United Nations Humanitarian Response in Syria,"Kool, Lisa Dorith","['Henderson, Christian']",2019,Faculty of Humanities,Middle Eastern Studies (MA),Master thesis,en,"Gaining access remainsone ofthe main impediments to the United Nations humanitarian response in Syria. Since 2011, the Syrian government has systematically blocked the United Nations from accessing populations in opposition-held areas. In theory, the Humanitarian Principles Neutrality and Independence provide the framework for gaining impartial access to conflict settings. Ironically, however, in practice the need to gain access has pushed the United Nations to compromise the Humanitarian Principles and comply to President Assad’s demands. While the United Nations’ compromises enable it to access at least government approved areas, these compromises have also facilitated Assad’s siege warfare tactic, population displacements and thereby re-shaped Syria’s socio-political landscape. Analysis of the Syrian conflict often focuses on President Assad’s role in perpetuating violence. Yet, the United Nations’ aid operation plays a similarly crucial role in shaping the dynamic and political outcome of the Syrian conflict. This paper therefore asks; To what extent has the United Nations adhered to the Humanitarian Principles Neutrality and Independence in its operations in the Syrian conflict between 2011 and 2017 and what are the implications?","['United Nations', 'Syria', 'Humanitarian Response', 'Siege', 'Forced Displacement', 'War Economy']"
Transcending Destiny in the Liezi 列子,"Lindenmann, Tanja","['Els, Paul van']",2019,Faculty of Humanities,Asian Studies (60 EC) (MA),Master thesis,en,"The Liezi is often regarded as the most important Daoist document after the Laozi and the Zhuangzi (both dating from the Warring States period; 475-221 BCE), yet the existing academic literature leaves a large gap on the philosophical significance of the Liezi, mainly because it is widely considered a forgery of the fourth or fifth century. Philosophically, the Liezi applies Daoist principles to human destiny by example of the Daoist sage, who despite his humanness, is said to be invulnerable. This is contrasted with ordinary people, who perceive their life as a series of fortunate and/or unfortunate events that either were happening as a result of their free will or were determined by forces beyond human control. Whereas for ordinary people free will and determinism are two separate entities, sages unify the manifestations of both concepts within themselves, realizing free will and determinism to be the same but two viewpoints on life which arise naturally due to the duality of existence. By examining the interrelationship between destiny and the sage based on its Daoist metaphysics, this study on the Liezi shows how the seemingly paradoxical relation between free will and determinism is reconciled in personal freedom and happiness through Daoist self-cultivation.","['Liezi', 'Destiny', 'Daoism', 'Xuanxue', 'Neo-Daoism', 'Philosophy', 'China']"
From Constitution to Reality: Main Difficulties in the Promotion of Indigenous Languages in Bolivia,"Sebel, Gaby","['Valdivia Rivera, Soledad']",2019,Faculty of Humanities,International Studies (BA),Bachelor thesis,en,,"['Latin America', 'Bolivia', 'Indigenous languages', 'Language policy', 'Constitution']"
The Heart of the Superflat Spectacle: A Study on Anime Adaptation of Natsume Soseki's Kokoro,"Liang, Junchuan","['Mes, Thomas']",2019,Faculty of Humanities,International Studies (BA),Bachelor thesis,en,"In post-Showa Japan, the expansion of literature into popular media forms, such as anime and manga, has accelerated due to development of media technology and, more importantly, rapid marketization. This phenomenon raises the questions of how exactly literature paves its path into the world of anime, and what is the sociocultural significance of this phenomenon in the context of contemporary (i.e. post-Showa) Japan. This thesis investigates Natsume Soseki’s Kokoro and its anime adaptation in 2009, episodes 7 and 8 in the anime series Aoi Bungaku (青い文学 meaning “blue literature”), to search for the connection between literature, popular culture and Japanese modernity. In the light of the methodology borrowed from contemporary adaptation studies, this thesis tries to answer two questions: 1) how is Natsume Soseki’s Kokoro adapted in Aoi Bungaku; 2) how can we interpret this adaptation in terms of changing Japanese society? Based on visual analysis of this adaptation, this thesis argues that the so-called contemporary Japanese visual “post-modernity” (for example, the “superflat” theory proposed by Takashi Murakami and Hiroki Azuma) is never a break from neither Meiji nor Western “modernity”. Rather, this “post-modernity” is built upon Meiji “modernity” with technological advancement and market expansion. The essence shared by this “modernity” and “post-modernity” is the capitalist mode of production.",
Politisering van de Zuid-Koreaanse Nationale Inlichtingendienst: De beïnvloeding van de Zuid-Koreaanse presidentiële verkiezingen van 2012 door de NIS,"Koopmans, Eljakin Azaz Timothea Justa","['Breuker, Remco']",2019,Faculty of Humanities,Koreastudies (BA),Bachelor thesis,nl,,"['Inlichtingendienst', 'Democratisering', 'Hervormingen', 'Zuid-Korea']"
How did British colonialism influence the perception and representation of same-sex intimacies in Indian society?,"Kemp, Simon","['Wickramasinghe, Nira']",2019,Faculty of Humanities,Asian Studies (60 EC) (MA),Master thesis,en,,"['India', 'South Asia', 'Colonialism', 'Sexuality', 'Imperialism', 'Homosexuality', 'Same-sex', 'Hindutva', 'Masculinity']"
Biggest devotee of the Dutch intellect and culture: Shiba Kōkan's perception of Dutch painting and the Dutch portrayal,"Hoendervangers, Ilja","['Müller, Doreen']",2019,Faculty of Humanities,Japanstudies (BA),Bachelor thesis,en,,['Shiba Kōkan ranga rangaku Edo Japan Art history']
Underground en Ballingschap in de Chinese poëzie: De verhouding tussen de Duistere Dichters en de mainstream.,"Meertens, Floris","['Crevel, Maghiel van']",2019,Faculty of Humanities,Chinastudies (BA),Bachelor thesis,nl,,"['Duistere Dichters', 'Bei Dao', 'Yang Lian', 'Culturele Revolutie', 'Chinese poëzie', '4 Juni 1989']"
"My priority is Power, Mubarak's brand of Neoliberalism","Arazim, Pavel","['Henderson, Christian']",2019,Faculty of Humanities,International Studies (BA),Bachelor thesis,en,,"['Egypt', 'Neoliberalism', 'Mubarak']"
FROM ZERO TO HERO: THE NORMALIZATION OF PLASTIC SURGERY IN SOUTH KOREAN TV SHOWS,"Smellink, Emma","['Veldkamp, Elmer']",2019,Faculty of Humanities,Koreastudies (BA),Bachelor thesis,en,,"['cosmetic surgery', 'South Korea', 'plastic surgery', 'normalization']"
De introductie van het partnerschapsbeleid in de districten van Shibuya en Setagaya,"Santbrink, Marina van","['Veere, H. (Henny) van der']",2019,Faculty of Humanities,Japanstudies (BA),Bachelor thesis,nl,,['Partnerschapsbeleid']
UNHCR and the Politics of Syrian Refugee Repatriation in Lebanon,"Braanker, Joëlle den","['Calculli, Marina']",2019,Faculty of Humanities,Middle Eastern Studies (MA),Master thesis,en,"Under the circumstances of a protracted war situation, failures to establish a political solution and no meaningful dialogue on the current security situation in Syria, refugee repatriation and reconstruction dilemmas have become the new subject of matter for Syrian refugee host countries, both European and neighboring, and Syrian government-supporting actors, including Russia and Lebanon’s Hezbollah. Since 2017, several actors in Lebanon actively facilitate and promote the repatriation of Syrians refugees. UNHCR stated that the requirements under international law for the United Nations to organise or encourage voluntary repatriation are not yet in place in Syria. However, UNHCR officers do meet with the returning refugees and are present at all current departure points of the returns facilitated by the Lebanese General Security based on the believe that people’s voluntary choice to return must be respected. This study examines the role of UNHCR in the Syrian repatriation process in Lebanon in order to understand how non-state actors operate vis-à-vis sovereign states and to give insight into the role of international organizations in world politics. The thesis is partly based on field research in Lebanon.","['UNHCR', 'Refugee repatriation', 'Syrian refugees', 'Lebanon']"
Populism on the Rise and Xenophobia: A Contemporary Analysis of Populist Rhetoric in Italy and Poland,"Dell'Aquia, Stephanie","['Ieven, Bram']",2019,Faculty of Humanities,International Studies (BA),Bachelor thesis,en,,"['Populism', 'Xenophobia', 'Populist Rhetoric', 'Italy', 'Poland']"
Professionalization of the Diplomatic Corps: the importance of ideas in the development of Chinese diplomacy during the early 20th century,"Lijn, Koen van der","['Teh, Limin']",2019,Faculty of Humanities,Chinastudies (BA),Bachelor thesis,en,,"['International Relations', 'Diplomacy', 'Chinastudies', 'Republican China']"
"Yuan Shikai's ""Presidential Campaign""","Beeltje, Philip","['Teh, Limin']",2019,Faculty of Humanities,Chinastudies (BA),Bachelor thesis,en,,
South Korean Welfare System - a study of women's empowerment through social welfare policies,"Hu, Selina","['Elmer, Veldkamp']",2019,Faculty of Humanities,International Studies (BA),Bachelor thesis,en,,"['welfare', 'empowerment', 'social policies', 'South Korea', 'emancipation', 'women']"
To what extent is China’s presence in Algeria neo-colonialist in nature or cohering in a wider economic development strategy?,"Bensaadi, Linda","['Wang, Jue']",2019,Faculty of Humanities,Chinastudies (BA),Bachelor thesis,en,"The question of the negative Chinese impact in African countries needs to be discussed in wider terms than positive or negative. Indeed, Chinese investment and behavior in Africa have been questioned, as for instance about the trade imbalance in China’s favor, its impact on domestic markets and industrialization process and also the impact of its high competitiveness, which are seen as hurting African economies. Chinese goods dumped in African countries are highly price-competitive manufactured goods, and most of African economies have an underdeveloped industrial sector, therefore limiting their development and the possibility to compete on their domestic market. International trade should be based on the establishment of an order of equality and not the one of exploitation. A first superficial glance on Sino Algerian relations might give a negative, or pessimistic view of the relationship, yet a deeper analysis and the incorporation of an understanding of the Algerian officials’ behavior will allow for a more nuanced approach of the relationship.","['China', 'Africa', 'Global political economy', 'North Africa', 'Algeria', 'neo colonialsm', 'investment', 'trade', 'technological transfer']"
Sarcasm and Irony Portrayed in Japanese and English,"Davidesko, Yonit","['Uegaki, Wataru']",2019,Faculty of Humanities,Japanstudies (BA),Bachelor thesis,en,,
"The Relationship Between Western Europe and the Balkans: Past, Present and Future.","Mortiers, Eliane","['Weyenberg, A.L.B. van']",2019,Faculty of Humanities,International Studies (BA),Bachelor thesis,en,"The thesis analyses the effect of the ‘balkanism’ discourse, and the associated representations, on the relationship between Western Europe and the Balkans in late modern and contemporary history. The ‘balkanism’ discourse has been present for a long time and has strongly influenced Western European perceptions of the Balkan region in the 19th and 20th century. Due to the discourse, a certain distance had been created between the EU and the Balkans, in which the former named the latter the ‘other’ – mainly to indicate a cultural difference. The discourse and denigrating perceptions of the region, shaped over time, seem to be the main reason for the poor relationship between the EU and the Balkans in these two centuries. However, since the start of the 21st century, the EU has started to engage more with the region. In 2003, the first steps were taken to create stability and security in the EU and its neighbourhood by starting the integration process of the Western Balkans – that is, the remaining Balkan countries outside of the EU. The process includes several engagement and integration initiatives, compulsory accession criteria and (reform) programs in fields such as politics, economy and culture. Yet, the success of the integration process still remains to be seen. Apart from other issues related to the citizens’ opinions, the EU itself and the Balkan region, the historical perceptions still seem to influence this process as well. Hence, the effect of the ‘balkanism’ discourse and the associated representations seems to be significant, due to the fact that the discourse can be considered the key reason for the poor relationship of the past, and because it may still be affecting the relationship today.","['Western Europe', 'Balkans', 'Complicated Relationship', 'Balkanism', 'Yugoslav Wars', 'European Union', 'History', 'Present', 'Future', 'Initiatives', 'Exclusion versus Inclusion', 'Representations and Discourse']"
Onderwijs of Boven Wijs: De rol van onderwijs in de Lüshi Chunqiu en de Xunzi,"Tol, Xaveer van","['Els, Paul van']",2019,Faculty of Humanities,Chinastudies (BA),Bachelor thesis,nl,,"['onderwijs', 'Chinese filosofie', 'educatie', 'leraren', 'Lüshi Chunqiu', 'Xunzi']"
The Repercussions of the 1980s Sino-Tibetan Negotiations on the Tibetan Community,"Tengo, Rinchen Maha","['Black, Lindsay']",2019,Faculty of Humanities,Asian Studies (60 EC) (MA),Master thesis,en,"1959 heralded an exodus of approximately one hundred thousand Tibetans who followed their leader, the Dalai Lama, into exile in India, following a failed uprising against the Chinese rule. Until 1978, there was no contact between the exile Tibetans and the Chinese government. During the 1980s, four rounds of talks were held between China and Tibet, which were eventually unfruitful. This thesis will explore the long term effects of these talks on the Tibetan diaspora, and analyse how the lack of agreement between the Tibetan and Chinese negotiating teams has led to the formation of two main political factions - one claiming Tibet’s right of independence and complete separation from the People’s Republic of China (PRC), and another group advocating for greater power and more rights for Tibetans within the framework of the Chinese political system. This study contributes to the existing literature by delving into the archives and by providing insights from prominent Tibetans on the negotiations. It reveals that China’s main demand during the negotiations was the return of the Dalai Lama to the PRC, while the Tibetan side urged for the formation of a unified region of all the occupied Tibetan regions and increased freedom and rights for autonomy. It explores how the two parties were on different directions and had different leverages for the negotiations. The study concludes that there had never been any real attempts from the Chinese side to negotiate with the Tibetans. The Tibetan delegations, however, raised false hope among the Tibetan people, both inside and outside of Tibet.","['Sino-Tibet Negotiations', 'Repercussions', 'Genuine Autonomy', 'Middle Way Approach']"
Psalm 22; visies op de literaire structuur,"Hooff, Laura van den","['Baasten, M.F.J.']",2019,Faculty of Humanities,Oude culturen van de mediterrane wereld (Bachelor),Bachelor thesis,nl,,"['Psalm 22', 'Bible', 'Old Testament', 'Psalmen', 'structuur']"
Pipeline Politics: An analysis of the EU’s actorness in the case of the Southern Gas Corridor,"Korsman, Daphne","['Scepanovic, Vera']",2019,Faculty of Humanities,International Studies (BA),Bachelor thesis,en,"The purpose of this thesis is to answer the question ‘to what extent can the EU act geopolitically in the context of energy security and should it?’ through the case study of the Southern Gas Corridor. The academic debate on the EU’s actorness in international politics has been ongoing and the unique structure of the EU seems to still puzzle scholars. This has especially been the case in the field of energy policy, as energy is a strategic and public good and thus subject to a geopolitical dimension. By analyzing previous research in the field of EU energy policy, four possible answers to the research question were found. These are that the EU can or cannot and that the EU should or should not act geopolitically in the context of energy security. The four answers make up the spine of this thesis and guides the research into finding that the EU can act geopolitically to a certain extent, but still lacks full-fletched policy tools due to the nature of the energy policy area, and should act geopolitically to advance its strategic energy security agenda. The EU is essentially no less geopolitical than other actors but attempts to hide this within its rule-based regulatory framework.","['European Union', 'Power', 'Energy Security', 'Energy Policy', 'The Southern Gas Corridor']"
De rebelse en jonge post-1980 generatie in China,"Ye, Tian","['Crevel, Maghiel van']",2019,Faculty of Humanities,Chinastudies (BA),Bachelor thesis,nl,,"['Chinese literatuur', 'Post-1980']"
