title,author,supervisors,date,faculty,program,type,language,abstract,keywords
Prosocial Giving Behaviour of Gifted and Non-Gifted Adolescents: The Role of Empathy and Self- Concept,"Ridder, Naomi De",['Kiki Zanolie'],2022,Faculty of Social & Behavioural Sciences,Psychology (MSc),Master thesis,en,"This study examined how empathy and self-concept influence giving to friends, fathers, mothers, disliked people, and strangers in gifted and non-gifted adolescents. Adolescents (N = 141, ages 9 – 12 years) from both gifted and non-gifted education played a Dictator Game in which they divided coins between themselves and one of five other targets. The Dutch versions of the Self-Perception Profile for Children and the Interpersonal Reactivity index were used to measure global self-concept, social acceptance (measures of self-concept), perspective-taking, and empathic concern (measures of empathy), respectively. The Raven Standard Progressive Matrices task was used as a measure of intelligence. We found that the number of coins that adolescents donated during the Dictator Game differed significantly between the targets (F(3, 464) = 120.32, p < .001, η 2 partial = .47). Adolescents donated most coins to their friends, father, and mother, less to an unknown person, and least to a disliked person. The number of coins adolescents gave away to the different targets did not differ significantly for gifted and non- gifted adolescents (F(3, 464) = 0.92, p = .437, η 2 partial = .01). Non-gifted adolescents showed higher levels of global self-concept and social acceptance than gifted adolescents, but they did not differ in perspective-taking and empathic concern. We found that global self-concept, social acceptance, empathic concern, and perspective-taking did not significantly mediate the relationship between giftedness and mean giving behaviour. Empathy and self-concept did not predict how many coins adolescents gave away in total. However, higher levels of perspective- taking were associated with more giving behaviour towards a disliked person (r = .18, p < .05). Overall, our findings suggest that gifted and non-gifted adolescents show similar levels of context-dependent giving behaviour, and that this is not influenced by empathy or self-concept.",
Vergelijking van meetinstrumenten voor metacognitie in relatie tot sociale cognitie bij kinderen tussen de 6 en 16 jaar met en zonder Autismespectrumstoornis,"Wijnands, Luca","['Plak, R.D.']",2022,Faculty of Social & Behavioural Sciences,Education and Child Studies (MSc),Master thesis,nl,,
Gender Differences in the Relationship Between Childhood Emotional Abuse and Perpetration of Psychological Partner Violence,"Nolst Trenité, Maud",['Aischa Reinken'],2022,Faculty of Social & Behavioural Sciences,Psychologie (BSc),Bachelor thesis,en,,
De opwaartse herstelspiraal onder werknemers: Het effect van sociale steun van collega’s op sportdeelname in de vrije tijd en de invloed van burn-outklachten op deze relatie.,"Voort, Jolein van der","['Vries, J. D. de']",2022,Faculty of Social & Behavioural Sciences,Psychologie (BSc),Bachelor thesis,nl,"Dit onderzoek had als doel de opwaartse herstelspiraal onder werknemers te onderzoeken, waarin positieve werkervaringen kunnen zorgen voor een hogere deelname aan herstelactiviteiten in de vrije tijd. Er wordt gekeken of de energiebron op het werk, steun van collega’s, leidt tot een hogere mate van herstelactiviteiten in de vrije tijd, sportdeelname (sportdoor en sportintensiteit), via vertrouwen in eigen kunnen. Ook wordt er gekeken of deze relatie zwakker is voor mensen die meer burn-outklachten ervaren. Om de hypotheses te testen hebben werknemers drie weken lang wekelijks een vragenlijst ingevuld (N=131). Ook zijn demografische gegevens, stabiele gevoelens en gedragingen, zoals burn-out, eenmalig bevraagd aan de deelnemers. Hiërarchische regressie analyses zijn uitgevoerd om de data te analyseren. Uit het onderzoek is gebleken dat er een significante positieve directe relatie is tussen de steun van collega’s en de sportduur in de vrije tijd. Echter zorgt steun van collega’s via vertrouwen in eigen kunnen niet voor een langere sportduur. Bovendien is er niet aangetoond dat de voorgestelde indirecte relatie zwakker is voor mensen die meer burn-outklachten ervaren. Er is in dit onderzoek dus gedeeltelijk bewijs gevonden voor de opwaartse herstelspiraal, maar vertrouwen in eigen kunnen blijkt hier geen rol in te spelen. In toekomstig onderzoek zou er gekeken worden wat de relatie tussen steun van collega’s en sportduur dan wel verklaard.",
Influence of Strategy on Motor Performance and Retention: How internal and external focus of attention influences motor learning on a computer-based task,"Suchecki, Damian","['Ketel, J.E. van']",2022,Faculty of Social & Behavioural Sciences,Psychologie (BSc),Bachelor thesis,en,"Aim: The impact of foci of attention during performance and learning has been shown in many studies. An external focus of attention seems to be a more effective instructional method than an internal focus (Wulf, 2013). However, most of these studies happen in a physical environment, and few focus on a computer-based environment. Since there is a growing number of instances where complex motor skills are needed in computerized environments (e.g., Laparoscopic surgeries), there is a growing need for more effective training instructions. This 2-day study investigated if an external focus yields better performance and retention on a complex motor computer task compared to an internal focus. Methods: A sample size of N=14 (Nexternal=6, Ninternal=8, Mage=23, SD=3, with an age range of 19-28) was used. Two paired sample t-tests were used to investigate if there is an improvement within both conditions, and 2 Mann-Whitney U tests to analyze the difference between the conditions on motor performance and on retention. Focus questions were asked between blocks of trials. Results: There was improvement within both conditions, but there was no difference between both conditions on motor performance and retention. Furthermore, participants’ adherence to the instructions was mixed. Conclusion: Non-adherence might have influenced the results. In the future, removing the conditions and its instructions to investigate the focus of attention in a more natural manner as well as using different equipment resembling what is used in the professional field should be considered. Keywords: Motor Learning, Focus of Attention, Motor Performance, Computer-based Task","['Motor Learning', 'Focus of Attention', 'Motor Performance', 'Computer-based Task']"
Rooting out Inequality,"Mulder, Sanne",['Elsa Charlety'],2022,Faculty of Social & Behavioural Sciences,Cultural Anthropology and Development Sociology (BSc),Bachelor thesis,en,,
The Effect of Activism and Sexist Discrimination on Depression and Anxiety Symptoms in Female Students,"Helman, Mattan",['Dr. Niki Antypa'],2022,Faculty of Social & Behavioural Sciences,Psychologie (BSc),Bachelor thesis,en,"Sexist discrimination is a social issue that has a negative impact on the mental health of females. Some studies have suggested that activism may be an adaptive coping strategy in facing discrimination. The objectives of the current study were to explore activism as a protective factor against the effects of sexist discrimination on depression and anxiety symptoms in female students. The study used data of 189 Leiden University female students who completed a survey with the following scales: Sexist Discrimination, Conventional Activism (CA), High-Risk Activism and Loneliness. Two hierarchical regression analyses and two moderation analyses were conducted on the mental health outcomes: anxiety and depressive symptoms. Results showed that experiencing sexist discrimination was positively correlated to depression and anxiety symptoms. However, CA was not related to depression and anxiety. In addition, CA was not found as a moderator in the relationship between sexist discrimination and the mental health outcomes. This may be explained by the assumption that activism serves as an adaptive coping strategy in certain social groups only when it matches specific discrimination. The current study is a reminder of the impact of sexist discrimination on female students' mental health and emphasizes the importance of addressing it in society and therapy. The current study does not support that activism protects the mental health of female students in facing sexist discrimination. However, the research of activism as a coping strategy is only in its beginning stages and future research is needed.",
Persistentie van gedragsproblemen bij mensen met een verstandelijke beperking en een intensieve zorgvraag: Een exploratief en longitudinaal onderzoek binnen het SCORE-onderzoek,"Buisman, Ivanka",['Y. Dijkxhoorn'],2022,Faculty of Social & Behavioural Sciences,Education and Child Studies (MSc),Master thesis,nl,,
The verbal transmission of social anxiety from parents to adolescents,"Bailey, Liam","['Aktar, E.']",2022,Faculty of Social & Behavioural Sciences,Psychologie (BSc),Bachelor thesis,en,"The development of social anxiety, which is highly prevalent and persistent in adolescents, heavily depends on predisposing factors, such as behavioral inhibition, and environmental influences, such as parenting, particularly via verbal learning. This study investigated whether social fears can be verbally transmitted from parents to their adolescent children (N = 72, M = 11.67 years; 54.5% girls) by exploring whether standardized threat information about a stranger leads to higher fear beliefs in contrast to safety information about another stranger, and whether behavioral inhibition has a moderating role by exacerbating this verbal transmission of fear. The adolescents were provided with this information before performing a social interaction task with each of two strangers acting as judges, who were unaware whether they were paired with threat or safety information. Behavioral inhibition scores were assessed via parent and child reports prior to the verbal threat or safety information transfer, while fear beliefs were reported by the adolescents after the social task. In line with previous literature, adolescents reported higher fear beliefs for the strangers associated with threat information than for those associated with safety information. No significant moderation by behavioral inhibition was found, though parentally reported child behavioral inhibition positively predicted overall fear beliefs. Conclusively, social fears may be verbally transmitted from parents to adolescents via threat or safety information affecting fear beliefs. Limitations are discussed and further research to ascertain the full scope of this effect and implications is encouraged.",
Trust in Automation: The Impact of Experience on Development of Trust in Level 2 (Partial Automation) vehicles,"Cupic, Katarina",['Dr. Francesco Walker'],2022,Faculty of Social & Behavioural Sciences,Psychologie (BSc),Bachelor thesis,en,"Car manufacturers are increasingly investing in developing automated (self-driving) technology to reduce the number of fatalities caused by human errors and increase safety on roads. Research has shown that safe and effective human-automation interactions largely depend on trust in such a technology. To prevent danger on roads, aligning the driver's trust with the actual reliability of the vehicle is vital. In this study, we used two different dashcam videos to examine the evolution of drivers' self-reported trust in a driving simulator from before having experienced, immediately after having experienced, and approximately 5-7 days after having experienced a Level 2 (partial automation) vehicle. Furthermore, we investigated whether the order of videos watched impacted self-reported trust scores. We expected both dashcam videos to be comparable. Moreover, we expected self-reported trust to decrease from pre- to post-test and further at the follow-up. Contrary to our expectations, we found a significant increase in self-reported trust from pre- to post-test. Moreover, we found that the direction in which trust evolves is dependent on the order in which the videos were watched.",
Do Individual Differences in Visual Mental Imagery Enhance Grapheme-Colour Synaesthesia Training?,"Nesbit, Emma",['Nicholas Root'],2022,Faculty of Social & Behavioural Sciences,Psychologie (BSc),Bachelor thesis,en,"Grapheme-colour synaesthesia describes a condition in which individuals experience specific colours, after having visually perceived achromatic letters. Having synaesthesia has been linked to certain cognitive enhancements, such as improved memory. Interestingly, synaesthesia training makes it possible for non-synaesthetes to acquire synaesthesia-like experiences, and there is some evidence that non-synaesthetes with better visuo-perceptual abilities might be easier to train. This study investigates whether individual differences in visual mental imagery influence the speed of learning in synaesthesia training. To this end, visual mental imagery was assessed in a sample of non-synaesthetes using two self-report questionnaires and a behavioural measure, the Animal Tails Task (ATT). The ATT is significantly correlated with the consistency of letter-colour choices both before and after synaesthesia training. However, the ATT did not significantly predict the size of the beneficial effect of acquired synaesthesia on the learning of a new language (Arabic letter-pronunciation pairings). In conclusion, individual differences in visual mental imagery influence the speed of synaesthesia training itself, but do not appear to influence the downstream benefits of synaesthesia training. These findings not only have implications for future synaesthesia training studies, but also for research on the link between synaesthesia, perception and memory.","['grapheme-colour synaesthesia, visual mental imagery, synaesthesia training']"
The Effectiveness of Flexibility-Persistence and Reward-Avoidance Sensitivity Trait Biases in Predicting Impulsivity-Compulsivity,"Meij, Pieter van der","['Prochazkova, L.']",2022,Faculty of Social & Behavioural Sciences,Psychologie (BSc),Bachelor thesis,en,"The traditional approach to research and diagnosis in psychiatry has been to focus on one specific diagnostic criterium at a time (DSM-5). Recent criticism suggests a transdiagnostic method that focuses more on underlying behavioral and cognitive traits to predict vulnerability to disorders such as OCD, ADHD, and eating disorders. Among these traits are impulsivity and compulsivity. According to the traditional model, impulsivity and compulsivity exist as a spectrum that is thought to be influenced by reward and avoidance sensitivity. In addition, this work proposes the use of the Metacontrol State Model (Hommel, 2015) in order to explore the Impulsivity-Compulsivity spectrum at the hand of flexibility and persistence. This study aims to explore to what extent reward-avoidance sensitivity and flexibility-persistence can account for Impulsivity-Compulsivity. 41 participants partook in this study that measured Impulsivity-Compulsivity using the S-UPPS, flexibility-persistence using the Stroop task and the AUT, and reward-avoidance sensitivity as per the MID. A multiple linear regression analysis found that trait biases towards the Metacontrol states flexibility-persistence positively predicted the Impulsivity-Compulsivity spectrum. Additionally, reward sensitivity negatively predicted impulsivity, the opposite of what was theorized. This relationship is explored with the help of more recent research, which suggests that the traditional model of reward-avoidance sensitivity oversimplifies Impulsivity-Compulsivity. However, results were found to be inconsistent. Thus, this work suggests that the relationship between reward-avoidance sensitivity and the Impulsivity-Compulsivity spectrum is further explored. In addition, this work provides preliminary evidence in favor of the Metacontrol State Model as a transdiagnostic tool.","['Impulsivity', 'Compulsivity', 'Flexibility', 'Persistence', 'Reward Sensitivity', 'Avoidance Sensitivity', 'Metacontrol State Model']"
"Pruritus and Attentional Bias: The effect of gender, depression and anxiety on attentional bias in a population afflicted by chronic itch","Vivier, Kerry-Anne","['Becker, J']",2022,Faculty of Social & Behavioural Sciences,Psychologie (BSc),Bachelor thesis,en,"This project investigated if there was any association between attentional bias (AB) towards itch-related stimuli and depression and anxiety scores in patients with chronic itch compared to healthy controls. This study also explored if gender had an influence on any of these variables. An orientation dot-probe task with pictures adjusted to chronic itch was used as a measurement of AB. 16 pairings of a neutral image and an itch-related image which were displayed on screen for 500ms, either image was then replaced by two dots in either a horizontal or vertical orientation. Participants responded as quickly as possible to the orientation of the dots. The average reaction times were used to calculate an AB index for each participant. There were 6 participants in total: 5 with chronic itch and 1 healthy control. Patients with chronic itch were diagnosed with either psoriasis or atopic dermatitis(eczema). Participants also completed questionnaires including the DASS-21. Results showed that patients did not have higher levels of depression and anxiety symptomatology compared to the healthy control. There was no significant effect of group on AB indexes; the reaction times were not faster in patients with chronic itch compared to the healthy control. There was no significant effect of gender on depression and anxiety scores, or on AB. Future research is suggested to improve psychometric properties of AB paradigms. Likewise, this project calls for increased research into treatment possibilities for chronic itch, not only for somatic symptoms but for the emotional, cognitive, and behavioural consequences of these conditions.","['attention', 'attentional bias', 'depression', 'anxiety', 'pruritus', 'chronic itch', 'ezcema', 'psoriasis']"
How do stereotypes mediate the relationship between ideology and antisocial behaviour towards the out-group?,"Rovers, Sterre","['Pliskin, R.']",2022,Faculty of Social & Behavioural Sciences,Psychologie (BSc),Bachelor thesis,en,"Political ideology has been at the center of social psychology research over the years. Researchers are trying to find out whether rightists and leftists have fundamental differences, or whether this can be attributed to context. I am researching if the relationship between ideology and anti-social behaviour towards the out-group is mediated by stereotypes about morality, warmth, competence, and aggression of that out-group. Research has confirmed higher support for aggressive measures by rightists over leftists. Therefore, I argued that there will be a difference in anti-social behaviour/tendencies between rightists and leftists. Furthermore, research regarding stereotypes also shows how these affect behaviour. Thus I hypothesised that both leftists and rightists will engage in anti-social behaviour when holding a negative stereotype about the target group. This was tested using an online-based experiment, where participants were asked to play two economic games (Joy of Destruction and Attacker-Defender game) and fill out a questionnaire. First, two logistic regression analyses were performed to test whether there are anti-social behaviour differences towards the out-group depending on ideology. This was significant. Second, several mediation analyses were performed to see whether the relationship between ideology and anti-social behaviour is mediated by stereotypes. Some of these mediation analyses were found to be significant, showing that anti-social behaviour can vary depending on ideology through stereotypes as a mediating variable.",
Racial Bias Online: The Effect of Emotion and Facial Cues on our Judgements.,"Achenbach, Ljudmila","['Varma, S.']",2022,Faculty of Social & Behavioural Sciences,Psychologie (BSc),Bachelor thesis,en,"New forms of explicit racism find their way on social media platforms, such as Facebook or Twitter, through hate speech and social exclusion. This study looks at mechanisms behind social judgment online and the influence of race and emotion. An online experiment was designed to test whether Black faces are rated as less friendly compared to White (hypothesis 1) and whether positive Tweets lead to a higher friendliness rating compared to negative or neutral (hypothesis 2). Further, an interaction effect between race and emotionality on friendliness judgment was assessed assuming that the difference between friendliness rating of Black and White faces depends on the emotionality of the Tweet (hypothesis 3). Finally, a questionnaire was administered to test for cultural diversity awareness (CDA), assuming heightened CDA is connected to less racial bias (hypothesis 4). Findings indicate that there is a significant effect of race on friendliness decision, but contrasting hypothesis 1 it was revealed that Black faces were instead rated as more friendly. The effect of emotionality was found significant, indicating that positive Tweets lead to higher friendliness ratings. The interaction effect was non-significant and no difference in friendliness judgment between the two races across the emotionality categories was found. Lastly, a significant negative correlation was found between CDA and racial bias, suggesting a positive influence of CDA. The findings give an important indication for the role racial biases and emotionality play in judgment formation.","['emotions', 'judgement', 'racial bias', 'cultural diversity awareness', 'online judgements', 'friendliness decisions']"
"Nice Shirts or Nice Smiles, What Females Find Attractive","O'Brien, Mark Mr","['Samara, I.']",2022,Faculty of Social & Behavioural Sciences,Psychologie (BSc),Bachelor thesis,en,,
"Trust and Cooperation on the Political Spectrum: A context- and content-free investigation into the influence of ideological belief onn cooperation, with trust as a mediating factor","Muller, Bonno","['Pliskin, R.']",2022,Faculty of Social & Behavioural Sciences,Psychologie (BSc),Bachelor thesis,en,,
Relationship between Attentional Control and Poor Sleep Quality: Mediation via Rumination,"Grozdanovska, Mila","['Aksungur, S.U.']",2022,Faculty of Social & Behavioural Sciences,Psychologie (BSc),Bachelor thesis,en,"Previous research suggests an association between attentional control and rumination, supported by the impaired disengagement hypothesis. According to the impaired disengagement hypothesis, individuals with low attentional control are more likely to experience increased rumination due to difficulties in disengaging from negative thoughts. A relationship between rumination and poor sleep quality has also been previously investigated and the findings are in line with the concept of perseverative cognition. As illustrated by the concept of perseverative cognition, rumination has been associated with poor sleep quality because the cognitive arousal that accompanies rumination may lead to physiological arousal resulting in unsuitable conditions for quality sleep. However, the potential mediating role of rumination in the relationship between attentional control and sleep quality has not yet been fully elucidated. The primary aim of the current study was to investigate whether rumination significantly mediates the relationship between attentional control and sleep quality. I expected increased rumination to mediate the relationship between low attentional control and poor subjective sleep quality. 69 healthy university students completed questionnaires including measures of attentional control, rumination, and sleep quality. A mediation analysis and a bootstrap was employed to test the significance of the indirect effects. Results showed that rumination fully mediated that effects of attentional control on sleep quality. A bootstrap analysis confirmed the significance of the mediation model. Targeting attentional control and rumination may prove beneficial in treatments for poor sleep quality. Interventions such as mindfulness-based therapy have been successful in reducing rumination, whereas attentional training technique has shown promising results in improving attentional control.","['mediation', 'attentional control', 'rumination', 'sleep quality']"
