title,author,supervisors,date,faculty,program,type,language,abstract,keywords
Perceptions of Punctuation: a study into the interpretation of punctuation by native and non-native speakers of English in WhatsApp,"Pleij, Ben","['Smakman, Dick']",2019,Faculty of Humanities,Linguistics (MA),Master thesis,en,"Computer-Mediated-Communication is bereft of any intonation markers usually found in face-to-face conversations. As a result, how a sender meant to send out a message versus how their addressee reads it sometimes differ. This can lead to uncooperative and confusing online communication. This paper set out to examine if (and what) effects different punctuation types have on the interpretation of meaning in WhatsApp communication, and whether one’s age or native language influences the perception of these markers. The punctuation types were the exclamation mark, ellipsis, periods, and no punctuation. Unlike previous studies conducted on this topic which focussed only on students, this study was conducted among 123 respondents from a wide variety of ages and countries. Through an online survey, participants were asked for their opinions and thoughts to different types of punctuation used in recurring but otherwise identical messages. Results indicated that different punctuation types elicit strong and differing views, based on what punctuation type is used, and that these types influence their feelings towards the message as well as to the personal state of their interlocutor. The most significant findings were found for ellipsis points and messages lacking any punctuation: ellipses can lead to very negative interpretations in respondents, and a lack of punctuation can lead to respondents feeling sidelined. Interpretations of certain punctuation types are influenced by a reader’s age and native language. Using Yus’ theory of a phatic internet and cyber literacy, this paper posits that the reason respondents assign these meanings to different types of punctuation is to avoid misunderstandings, form identities, and stay on good terms with people in a world in which most daily conversation happens online.","['cyberpragmatics', 'pragmatics', 'sociolinguistics', 'english', 'whatsapp', 'punctuation', 'computer mediated communication', 'cmc', 'phatic internet', 'ellipsis']"
David Beck in Sweden; Donating portraits as a diplomatic tool; the role of the portrait painter David Beck as an accidental agent of Christina of Sweden in the first half of the 17th century.,"Van der Zwart, Juliette","['Roding, Juliette']",2019,Faculty of Humanities,Arts and Culture (MA),Master thesis,en,"In the 17th century, Sweden and the Dutch Republic maintained a strong trade alliance, which was partly due to the activities of Dutch entrepreneur Louis de Geer (1587-1652). De Geer had earned a fortune from the Thirty Years’ War (1618-1648) by manufacturing cannons at an unprecedented scale for King Gustav II Adolf of Sweden (1594-1632). Furthermore, Gustav’s daughter, Queen Christina Maria Alexandra (1626-1689), maintained a good relationship with De Geer. Christina was ambitious at an early age and acquired an extensive collection of books, manuscripts, objects and works of art. In order to reach this goal, Christina engaged various Dutch painters, scientists and agents, who were often art dealers with a large network. Michel Le Blon suggested the young and talented David Beck (1621-1656), who was a student of the well-known Anthony van Dyck (15991641). From 1647 until Beck’s death in 1656, Queen Christina of Sweden engaged the Dutch portrait painter. During this period, Beck painted portraits of various Swedish diplomats such as Chancellor Axel Oxenstierna (1583-1654) and portraits of Christina herself. As a political strategy, Christina assigned Beck to distribute and donate a specific portrait of herself to European sovereigns. Theretofore, Beck travelled throughout Europe and visited Gutter, Amsterdam, Rome and Paris. The activities of Beck give the impression that he was involved in diplomatic strategies, and if so, could one say that the portrait painter was an agent? For example, what messages are embodied in the portraits that Beck painted of Christina? Is it to say that his paintings were used as a diplomatic weapon? Was Beck himself a diplomatic asset, and were Beck’s artistic activities closely connected to the task to propagate the image of Christina of Sweden? Is it trustworthy to say that he adapted well to the diplomatic world since many sovereigns loved his courtesy and attitude","['Agent', 'Early modern collecting', 'art collection', 'painter', 'David Beck', 'Christina of Sweden', 'Sweden']"
"Attacking the Ego: Discovering the Uncanny in Frankenstein, The Strange Case of Dr. Jekyll and Mr. Hyde, and Dracula","Koopen, Daan","['Leeuwen, Evert-Jan van']",2019,Faculty of Humanities,Engelse taal en cultuur (BA),Bachelor thesis,en,,"['Uncanny', 'Frankenstein', 'Freud', 'Lacan', 'Dracula']"
Gender Transactionalism and the Inadequacy of Implicit Bias to Account for Structural and Persistent Gender Inequality in the Dutch Labour Market,"Vries, L.E.W. de","['Sleutels, J.J.M.', 'Heuvel, N.A.E. van den']",2019,Faculty of Humanities,Philosophy (MA) (120 EC),Master thesis,en,"Over the past decade, the Netherlands has performed evidently worse in terms of gender inequality in its labour market compared to other European countries. The psychological model of implicit bias, gaining popularity within the academic world as well as public discourses, is thought to account for such structural and persistent gender inequality. According to the implicit bias model, people harbour mental associations with the words ‘female’ and ‘male’, eliciting subtle forms of discrimination, with gender inequality as a consequence. It is my contention that the model of implicit bias is inadequate in order to account for structural and persistent gender inequality in the Dutch labour market. I will argue that the implicit bias model is inherently based on a dualistic ontoepistemological framework that is problematic from a feminist philosophical perspective. Grounding my arguments in the theories of the feminist philosophers Simone de Beauvoir, Donna Haraway, Judith Butler, and Linda Martín Alcoff, I will show that theories of implicit bias overlook that (1) gender knowledge cannot be viewed independently from its producer and that (2) there is no reality of gender outside of the discursive. Based on the onto-epistemological findings on gender production, established throughout my thesis, I will introduce a non-dualistic framework from which gender inequality in the Dutch labour market can and should be studied, which I refer to as gender transactionalism. In this transactionalist model, gender inequality in the Dutch labour market is understood as the continuous transaction between unequal gender knowledges and the performativity of these genders as visible within our everyday lives. Implications of the findings and recommendations for future research will be discussed.","['gender', 'gender inequality', 'gender transactionalism', 'feminist philosophy', 'Dutch labor market', 'implicit bias', 'dualism']"
"Drihtne gecoren, snotor and soðfæst: The Ideal Anglo-Saxon Counsellor in the Old English 'Daniel'","Vermeij, Jan Kees","['Porck, M.H.']",2019,Faculty of Humanities,Literary Studies (MA),Master thesis,en,,"['Old English biblical poetry', 'Daniel', 'Anglo-Saxon counsellorship', 'Nebuchadnezzar', 'Wulfstan', 'Ælfric', 'witan']"
De beste scriptie ooit geschreven! Een onderzoek naar puffery: strategisch manoeuvreren met leugens in reclame,"Wolfhagen, Suzan","['Boogaart, Ronny']",2019,Faculty of Humanities,Taalwetenschap (BA),Bachelor thesis,nl,,"['reclame', 'strategisch manoeuvreren', 'puffery']"
A Battle Against Patriarchal Oppression: Acquiring Personal Autonomy Through the Rebellious Self in The Yellow Wallpaper and The House of Mirth,"Wit, Eva de","['Polak, Sara']",2019,Faculty of Humanities,Engelse taal en cultuur (BA),Bachelor thesis,en,,"['rebellious self', 'obedient self', 'personal autonomy', 'gothic imagery', 'gender roles', 'american victorian era']"
The relation between cultural policy and artists’ recognition: A case study of Karel Appel,"Morschl, Juliette","['Zwijnenberg, R.']",2019,Faculty of Humanities,Arts and Culture (MA),Master thesis,en,,"['CoBrA', 'Karel Appel', 'French cultural policy', 'Artist recognition']"
In Stitches: embodied spectatorship and embroidered photographs,"Doney, Ish","['Westgeest, Helen']",2019,Faculty of Humanities,Media Studies (MA),Master thesis,en,,"['photography', 'embroidery', 'embodiment', 'materiality', 'affect', 'digital reproduction']"
United Nations Peacekeeping Operations and durable peace after a civil war: A structured focussed comparison of ONUB in Burundi and UNAMSIL in Sierra Leone,"Hoekstra, Marissa","['Bruijn, M.E. de']",2019,Faculty of Humanities,International Relations (MA),Master thesis,en,,"['UNPKO', 'Burundi', 'Sierra Leone', 'ONUB', 'UNAMSIL', 'United Nations', 'Peacekeeping']"
The Racial and Cultural Other in Animation: The Mexican Portrayals of The Book of Life and Coco as Case Studies of Contemporary Representational Politics,"Raaijmakers, Thijs","['Kardux, J.C.']",2019,Faculty of Humanities,Literary Studies (MA),Master thesis,en,"Due to an increasing public push for multiculturalism in mainstream media, films have (at least since the 1990s) been attempting to give a more positive representation of what is deemed to be a racial and cultural Other from the target audience’s perspective, and animation films are no exception. Case in point, while the two animated films discussed in this study, The Book of Life (2014) and Coco (2017), are made by different studios, they share a general goal of trying to give such a representation of a racial and cultural Other for a Western target audience. This goal makes these films some of the latest examples in a long trend of American animation aiming to broaden their representation of minority cultures and ethnicities, in response to pressure from various social movements in the 1990s (Palmer 2, 4). Consequently, such animation has increasingly received academic reading, with scholars studying the medium’s role in the representation of racial and cultural Others and multiculturalism in general. This study will add to this budding field by analyzing two contemporary iterations of this representational trend.","['Animation Films', 'The Book of Life', 'Coco', 'Jorge R. Gutierrez', 'Pixar', 'Multiculturalism', 'Representation', 'Mexican culture']"
Power and Resistance in Hamid's The Reluctant Fundamentalist,"Lensink, Monica","['Kardux, Joke']",2019,Faculty of Humanities,North American Studies (MA),Master thesis,en,,"['The Reluctant Fundamentalist', 'Mohsin Hamid', 'Structures of Power', 'Global Capitalism']"
Dracula’s Archetypical Transformation Process: Multiple Characters but a Single Vampire.,"Peebles, Christopher","['Horsman, Yasco']",2019,Faculty of Humanities,Media Studies (MA),Master thesis,en,,"['Jungian archetype', 'narratology', 'Dracula', 'film']"
Groninger Museum: from a contentious building to a landmark of the city,"Sharma, Tripti","['Roding, J.G. (Juliette)']",2019,Faculty of Humanities,Arts and Culture (MA),Master thesis,en,,"['Museum', 'architecture', 'contact zone']"
What are the CFA neo-colonial conditions undermining economic sovereignty and development in the Franc zone?,"Bagnoli, Luisa","['Regilme, Salvador']",2019,Faculty of Humanities,International Relations (MA),Master thesis,en,,['CFA-Franc-zone-neocolonialism-decoloniality']
“We Are Going”: Riding Johannesburg’s BRT to Social and Spatial Justice?,"Nijhof, Lea","['Wels, Harry']",2019,Faculty of Humanities,African Studies (MA),Master thesis,en,"The legacy of apartheid and new forms of separation mean that Johannesburg remains spatially segregated, unconnected and consequently unjust. It was for these reasons that African National Congress (ANC) mayor Parks Tau introduced the ‘Corridors of Freedom’ (CoF) initiative in 2013. This aimed to create three development corridors, in which different areas of the city are connected by means of transport corridors which are themselves connected to intersections that will be transformed into areas for mixed-use development. The transport corridors consisting of the Rea Vaya Bus Rapid Transit (BRT) system are aimed at reconnecting different parts of Johannesburg and to ease people’s access to jobs, facilities and recreational opportunities by means of an affordable, fast, safe and convenient transport system. However, due to a change in Johannesburg’s political administration in 2016, and opposing interests of different stakeholders such as the taxi industry, the future of the corridors seems to have become uncertain. Nevertheless, although slowed down, various parts of the Rea Vaya BRT system are still going to be constructed. This thesis contributes to the debate on the effects of transport development on people’s social and spatial justice. It examines in what ways the policies and practices of the BRT impact commuters in terms of social and spatial justice by comparing the objectives of the City with the experiences of commuters. I gained insights into their practices by means of interviewing them while riding on the BRT with them. The thesis argues that while the policies intend to enhance the social and spatial justice within the city, in practice, although people are generally positive about the BRT, there are practical issues that prevent people from making full use of the city.","['Johannesburg', 'BRT', 'Rea Vaya', 'transit corridors', 'TOD corridors', 'social and spatial justice', ""'right to the city' (RTC)""]"
Return or Remain? The National Museum of Ethnology in Leiden and the restitution case of the Singhasari statues from Java,"Tolenaar, Robin","['Damme, W.J.L.M. van']",2019,Faculty of Humanities,Arts and Culture (MA),Master thesis,en,,"['colonial', 'indonesia', 'looted art', 'colonial art', 'restitution']"
The Spectacle and its implosion in today's society : the Italian case of Blob,"Quarto, Laura","['Horsman, Yasco']",2019,Faculty of Humanities,Media Studies (MA),Master thesis,en,,"['society of the spectacle', 'integrated spectacle', 'Italy', 'television', 'Blob', 'social media']"
Van 'Ze weten er niets van' tot 'Ze moesten eens weten': berichtgeving en beeldvorming versus beleving van de dekolonisatiestrijd in Nederlannds-Indië,"Bosman, Sarissa","['Brocades Zaalberg, Thijs']",2019,Faculty of Humanities,Geschiedenis (BA),Bachelor thesis,nl,,"['Dekolonisatie Nederlands-Indië', 'berichtgeving', 'beeldvorming']"
Whose culture is worth protecting? Cultural cleansing: a case study of the Islamic State,"Gobbi, Maria","['Schonmann, Noa']",2019,Faculty of Humanities,International Relations (MA),Master thesis,en,,"['Cultural heritage', 'Islamic State', 'Syria', 'Iraq', 'Cultural cleansing', 'Cultural genocide']"
"The Impassable Gulf Which Divides Us: Ethnic and Civic Nationalism in the Confederate States of America, 1860-1865","Leur, Evan van de","['Bilt, Eduard van de']",2019,Faculty of Humanities,History (MA),Master thesis,en,,"['Confederacy', 'Ethnic nationalism', 'Civic nationalism', 'American Civil War']"
Equivocatie in de politiek,"Montijn, Cato","['Jansen, Henrike']",2019,Faculty of Humanities,Neerlandistiek (MA),Master thesis,nl,"In dit scriptieonderzoek is een analyse-instrument opgesteld voor het taalkundige fenomeen equivocatie. Het doel van dit onderzoek was tweeledig: er is (1) een analyse-instrument voor equivocatie ontwikkeld, dat (2) is toegepast op het discours van de jonge Nederlandse politicus Thierry Baudet. De hoofdvraag die in dit onderzoek centraal stond, was: Hoe is een deductief analyse-instrument voor equivocatie op te stellen en wat kan er aan de hand van dit instrument worden vastgesteld over het discours van politicus Thierry Baudet? Dit onderzoek is een abductief onderzoek: met bevindingen uit het empirische materiaal is de theorie over equivocatie aangevuld en is het analyse-instrument verder aangescherpt (Alvesson & Sköldberg, 2000; Peirce, 1923). Equivocatie is de taalhandeling van het ontwijkend communiceren. De taalhandeling komt voor in communicatieve conflictsituaties, ook wel avoidance-avoidance conflict situations genoemd. Die conflictsituaties doen zich voor wanneer alle reacties op een vraag of stelling een negatieve uitkomst hebben voor de spreker of voor zijn omgeving (bijvoorbeeld wanneer de spreker moet kiezen tussen liegen of iemand kwetsen met de waarheid). In zulke situaties biedt equivocatie uitkomst (Bavelas, Black, Bryson, & Mullett, 1988; Bavelas, Black, Chovil, & Mullett, 1990a). Om vast te stellen of er sprake is van equivocatie, formuleren Bavelas et al. (1988) vier criteria: (1) de boodschap moet de eigen mening van de zender, (2) de inhoud van de boodschap moet helder zijn, (3) er moet duidelijk zijn wie de ontvanger van de boodschap is en (4) de boodschap moet aansluiten op de context. In politieke situaties komt equivocatie vaker voor dan in alledaagse situaties. Dat komt doordat politici vaak in de media verschijnen, rekening moeten houden met hun potentiële electoraat (zij moeten hun boodschappen zo voorzichtig mogelijk verwoorden om een zo breed mogelijk publiek aan te spreken (Bavelas et al., 1988)) en niet alleen namens zichzelf spreken, maar ook namens hun partij. Politici doen hun best hun gezicht te beschermen en om een gewenst beeld van zichzelf te construeren in de media – het principe van face-work (Goffman, 1967b) hangt samen met deze mediatisering (Cushion & Thomas, 2013; De Leeuw & Van Wichelen, 2005; Wodak & Krzyżanowski, 2017). Politici doen vaker dan gewone burgers hun best om commitment aan hun uitspraken te verzwakken, zonder daarbij onoprecht of vaag te lijken. Equivocatie is een strategie die voor dat doeleinde uitkomst biedt. Equivocatie maakt namelijk calculated ambivalence mogelijk – het verpakken van een dubbele boodschap in een taaluiting (Hatakka, Niemi, & Välimäki, 2017; Wodak & Engel, 2013). De praktische toepassing van calculated ambivalence noemen Bull & Simon-Vandenbergen (2014) doublespeak. Het analyseren van (mogelijk) equivocatief discours biedt de mogelijkheid te bekijken wat de onderliggende betekenis van de geuite woorden zou kunnen zijn (Bull & Simon-Vandenbergen, 2014). In het analyse-instrument dat in dit onderzoek is opgesteld, zijn verschillende technieken gebundeld die Bull & Simon-Vandenbergen (2014) en Hatakka, Niemi & 4 Välimäki (2017) hebben afgeleid uit deductieve discoursanalyses. Het instrument bestaat uit vier categorieën met bijbehorende strategieën: 1. Onderwerp ontwijken – 1.1. Ontkenning, 1.2. Antwoorden vermijden, 1.3. Ophef bagatelliseren 2. Aandacht afleiden – 2.1. Vergelijkingen maken, 2.2. Disconnectie benadrukken 3. Rechtvaardigen – 3.1. Verzachtende omstandigheden aandragen, 3.2. Afstand nemen in woord, 3.3. Afstand nemen in daad, 3.4. Excuses zonder volledige verantwoordelijkheid 4. Ethos en Pathos – 4.1. Ad hominem, 4.2. Slachtofferschap claimen, 4.3. Provocatief taalgebruik Dit instrument is toegepast op het discours van politicus Thierry Baudet. Eerst is, aan de hand van de eisen voor duidelijke communicatie van Bavelas et al. (1988), vastgesteld welke beweringen van Baudet als equivocatief kunnen worden aangemerkt. In het onderzoekscorpus, dat bestaat uit zeven verschillende fragmenten waarin Baudet zich in een conflictsituatie bevindt, is hij 268 keer aan het woord. Hij maakt in 165 van die gevallen gebruik van equivocatie. Het analyse-instrument voor equivocatie blijkt redelijk geschikt om het discours van Baudet te analyseren. Zo blijkt uit de analyse dat hij vaak zijn uitingen legitimeert door verzachtende omstandigheden aan te dragen, de aandacht afleidt van het onderwerp of de aanval opent op het ethos van zijn tegenstander. Tijdens de analyse is het instrument, met de bevindingen uit de empirie, verder aangescherpt. De strategieën kunnen worden verdeeld in twee hoofdcategorieën, die beide een belangrijk doel van de spreker weergeven: (1) Rechtvaardigen, waaronder de strategieën Ontkenning, Verzachtende omstandigheden aandragen (met alle bijbehorende substrategieën), Afstand nemen in woord en Excuses zonder volledige verantwoordelijkheid vallen en (2) Aandacht afleiden, waaronder de strategieën Ophef bagatelliseren, Antwoorden vermijden (met alle bijbehorende substrategieën), Vergelijkingen maken, Disconnectie benadrukken en Ethos en Pathos (met alle bijbehorende substrategieën) vallen. Verder blijkt dat twee strategieën meer gespecificeerd konden worden. De strategie Antwoorden vermijden is uitgebreid met substrategieën Legitimeren met bewijzen, Meer uitleg geven, Verkeerd begrepen en Context benadrukken. De strategie Verzachtende omstandigheden aandragen is gespecificeerd met substrategieën Claim van duidelijkheid, Claim van onwetendheid en Ander onderwerp aansnijden. Dit onderzoek draagt bij aan een stevigere conceptuele en methodische basis voor het onderzoek naar equivocatie. Om dat onderzoek nog verder aan te vullen, zijn meer analyses nodig. Niet alleen van het discours van (extreem)rechtse politici, maar ook van meer gematigde en (extreem)linkse politici. Een andere belangrijke bijdrage aan het onderzoeksgebied kan worden gevormd door de analyse van het discours van de opponenten van de politici die equivocatief taalgebruik hanteren – hoe gaan zij daarmee om en hoe kunnen zij equivocatie herkennen en adresseren? Ten laatste zou het goed zijn het onderzoeksgebied aan te vullen vanuit andere disciplines, zoals de sociologie, antropologie of de psychologie. Zo kan een completer beeld van het fenomeen equivocatie ontstaan.","['equivocatie', 'calculated ambivalence', 'doublespeak', 'baudet', 'analyse-instrument', 'politiek', 'ontwijkend taalgebruik', 'antwoorden vermijden', 'retorica', 'taalhandelingen']"
The Gildemeesters: A family's strategies for commercial success and upwards social mobility during the 18th century,"Wesseling, Leonoor Inger","['Antunes, Catia']",2019,Faculty of Humanities,History (MA),Master thesis,en,,"['Economic History', 'Business History', 'Biography', 'Theory of Entrepreneurship', 'Lisbon', 'Diamond trade', 'Consul', 'Marquis of Pombal', 'Portugal', 'History of the Family']"
Draaiboek van het draagbaar vuurwapen Een geschiedenis van het Nederlandse beleid over handvuurwapens in de jaren ‘30,"Schouten, Robin","['Schoenmaker, Ben']",2019,Faculty of Humanities,Geschiedenis (BA),Bachelor thesis,nl,,"['M.95', 'handvuurwapen', 'bewapening', 'Tweede Wereldoorlog', 'Nederland']"
US-Russia Relations in the UNSC through the Lens of the Syrian Conflict,"Van Kooten, Camilla","['David, Maxine']",2019,Faculty of Humanities,International Relations (MA),Master thesis,en,"On April 7, 2018, a rebel-held town in Eastern Ghouta, near Damascus, was attacked. The Douma attack is just one example of the many violent outbursts in the Syrian conflict. The civil war that started in 2011 slowly unfolded into a larger regional and international conflict. The complexity of alliances in the Syrian conflict might be a reason of the long-lasting hostilities that still continue today. This thesis investigated the role of two main actors in the Syrian conflict: the United States and Russia. This study aimed to answer the following research question: how are the US-Russian relations in the UNSC on the Syrian conflict from March 2011-June 2018? In a heightened atmosphere in international relations, it is important to find out if more room for cooperation between the two countries exists within the UNSC framework. A document analysis of the UNSC meeting records, presidential statements and (draft) resolutions from 2011-2018 has been conducted. The contribution of this study lies in the systematic analysis of the UNSC minutes on the Syrian conflict which enables the author to draw conclusions over the entirety of the war. By looking at three main categories – the use of chemical weapons, humanitarian assistance, and the political peace process – this thesis found out that the US and Russia seem to agree on a broader level, but that filling in the details proves to be problematic.","['UNSC', 'Security Council', 'US-Russia relations', 'Russia', 'United States', 'Syria', 'Syrian conflict']"
Liever swart vor menschen als vor Gott,"Keizer, Roel","['Duindam, Jeroen']",2019,Faculty of Humanities,History (MA),Master thesis,nl,,['Twente Sweder Schele']
That hour is almost upon us: Metaphors in climate policy speeches at the UNFCCC climate conferences,"Deijl, Emma van der","['Ameka, Felix']",2019,Faculty of Humanities,Linguistics (research) (MA),Research master thesis,en,"This thesis analyzed a corpus of speeches of world leaders held at the COP conferences to the UNFCCC in the years 2013 until 2017, using a combination of the tool presented by Steen et al. (2010) for linguistic metaphor analysis, the MIPVU, and qualitative thematic analysis as described by Braun and Clarke (2006). The metaphors and themes found reflect a dichotomous discourse: from their speeches emerges either a scenario of great danger and threat or a scenario of a harmonious transition, allowing for the continuation of existing norms. Neither seem to incite a good incentive for action. This impacted/non-impacted dichotomy fit in a target approach of the climate change problem, with the two-degree line being the concrete realization of this target. The danger lies on the other side of this line, where climate change becomes a threat. Removing this threat will allow the world to return to a stable and balanced norm, which will be achieved through a quiet transition to a clean energy economy and sustainable development.","['metaphor', 'climate change', 'speeches', 'rhetoric', 'discourse analysis', 'international policy']"
