title,author,supervisors,date,faculty,program,type,language,abstract,keywords
Past and Present Experiences of Counterterrorism: the Italian Case,"Mura, Francesco",['Prof.dr. I.G.B.M. Duijvesteijn'],2021,Faculty of Humanities,International Relations (MA),Master thesis,en,,"['Terrorism', 'Counterterrorism', 'Italy', '9/11']"
"De Apocalyps, de Mongolen en de franciscaanse missies van de dertiende eeuw: Het verschil in gebruik van Pseudo-Methodiaans gedachtegoed door de franciscaanse ontdekkingsreizigers en de gevestigde kroniekschrijvers in West-Europa","Vijselaar, Wide","['Sicking, L.H.J.']",2021,Faculty of Humanities,Geschiedenis (BA),Bachelor thesis,nl,,"['Willem van Rubroeck', 'Rubroeck', 'Johannes van Pian del Carpine', 'Carpine', 'Apocalyps', 'Apocalypse', 'Pseudo-Methodius', 'Franciscaanse Orde', 'Mongolen', 'reisverslag', 'franciscanen']"
"Vloeken in de kerk: Het politieke discours over de multiculturele samenleving in Nederland, 1983-2020","van der Meiden, Thomas",['Nadia Bouras'],2021,Faculty of Humanities,Geschiedenis (BA),Bachelor thesis,nl,,"['Migratie', 'integratie', 'discours', 'politiek']"
"De Heimelijke Tegenstanders: Een onderzoek naar de politieke invloed van Amsterdamse belanghebbenden in de negentiende eeuw omtrent de afschaffing van de slavernij, 1840-1863.","Droppert, Jasmijn",['Maartje Janse'],2021,Faculty of Humanities,Geschiedenis (BA),Bachelor thesis,nl,,"['Slaveneigenaren', 'Amsterdam', 'Suriname', 'slavernij', 'adressen']"
Assess the Democidal acts of Violence Conducted by the Israeli Defence Forces During the Great March of Return,"Abul-Essad, Ibrahim","['Englert, S.P']",2021,Faculty of Humanities,Middle Eastern Studies (MA),Master thesis,en,,"['Children', 'Democide', 'Gaza', 'Great March of Return', 'Hamas', 'Israel Defence Force', 'Journalists', 'Paramedics', 'Operation Protective Edge', 'Separation fence']"
"A Return to Nationalism: A Framing Analysis of the 1920 Democratic and Republican Presidential Candidates’ Narrative on the Central Issues of Wilsonian Progressivism, Internationalism, and Ethnoracial Relations","Malegiannakis, Francesca","['Pargas, D.A.']",2021,Faculty of Humanities,History (MA),Master thesis,en,,"['Framing', 'Woodrow Wilson', 'Presidential elections', 'Discourse analysis', 'Progressivism', 'Warren Harding', 'racism', 'racial relations']"
Daughter of Time: Postmodernist critique as an antidote to post-truth politics,"Doorn, Robin van","['Kasten, M.J.A.']",2021,Faculty of Humanities,Media Studies (MA),Master thesis,en,,"['post-truth', 'post-truth politics', 'postmodernism', 'historiographic metafiction', 'Donald Trump', 'Nigel Farage', 'manipulation', 'truth', 'Hutcheon', 'McIntyre', 'Tey']"
Waardering voor de Bloederigste Dag: Historiografisch onderzoek naar de slag bij Antietam,"Marks, Wijnand","['Schoenmaker, B']",2021,Faculty of Humanities,Geschiedenis (BA),Bachelor thesis,nl,,
Art: A Strange Political Tool,"de Meel, Robert",['Frank Chouraqui'],2021,Faculty of Humanities,Philosophy (MA) (60 EC),Master thesis,en,,"['Aesthetics', 'Politics', 'Art', 'Kant', 'Noë', 'Merleau-Ponty']"
"The Core Drivers and Enabling Factors of Boko Haram’s Success in Nigeria: What are the Core Drivers and Enabling Factors of Boko Haram’s Success in Nigeria, Defined as Challenging the Monopoly of Violence and thus Legitimacy of the Nigerian Government?","Melo, Daniel","['Stathopoulos, A.']",2021,Faculty of Humanities,International Studies (BA),Bachelor thesis,en,,
The relation between third person pronouns and demonstratives in Siona,"Claassen, Simon","['Bruil, M.']",2021,Faculty of Humanities,Linguistics (MA),Master thesis,en,,"['Ecuadorian Siona', 'personal pronouns', 'demonstrative pronouns']"
Fusies en samenwerkingen: Blijft nabijheid in de regionale journalistiek behouden?,"Lee, Simone van der","['Jong, J.C. de']",2021,Faculty of Humanities,Media Studies (MA),Master thesis,nl,"In deze scriptie is onderzoek gedaan naar het effect van de intensivering van de samenwerking met provinciale omroep NH Nieuws op de mate waarin nabijheid aanwezig is gebleven in de berichtgeving van regionale omroep Weeff. De Stichting Nederlandse Lokale Publieke Omroepen (NLPO) houdt zich momenteel bezig met het professionaliseren van lokale omroepen in Nederland om ervoor te zorgen dat lokale omroepen hun functie goed kunnen uitvoeren. Het komt daardoor steeds vaker voor dat lokale omroepen samengaan met andere lokale omroepen, of in dit specifieke geval de samenwerking opzoeken met een provinciale omroep. Hoewel kleinere omroepen op deze manier gebruik kunnen maken van de financiële mogelijkheden en de professionele kennis van een grotere omroep, vraagt men zich ook regelmatig af in hoeverre dit niet ten koste zou kunnen gaan van het lokale karakter van een dergelijke omroep. In deze scriptie wordt daarom de volgende hoofdvraag beantwoord: Op welke manieren is de rol van de nieuwswaarde ‘nabijheid’ in de online berichtgeving van streekomroep Weeff veranderd sinds de start van de intensieve samenwerking met provinciale omroep NH Nieuws? Dit is onderzocht aan de hand van een kwantitatieve inhoudsanalyse waarin een corpus van nieuwsberichten van regionale omroep Weeff voor de start van de intensivering van de samenwerking met NH Nieuws is vergeleken met een corpus van nieuwsberichten van de gemeenschappelijke nieuwsredactie van Weeff en NH Nieuws na de start van de intensivering van de samenwerking. Aan de hand van literatuur over dit onderwerp is een codeboek opgesteld aan de hand waarvan er in de nieuwsberichten naar bepaalde kenmerken van nabijheid gezocht kon worden. Zo is er onderscheid gemaakt tussen geografische, culturele, sociale en emotionele nabijheid. Naast de inhoudsanalyse zijn er twee interviews gehouden met betrokkenen bij Weeff en NH Nieuws. Op deze manier konden de resultaten uit de inhoudsanalyse verder in context worden geplaatst. Uit de inhoudsanalyse bleek dat er geen sprake was van een situatie waarbij er in zijn geheel sprake was van een sterke toe- of afname van nabijheid in één van de corpussen. Wel bleek dat bepaalde vormen van nabijheid sterker aanwezig waren in een bepaald corpus. Zo is er in het recente corpus meer aandacht besteed aan lokale geschiedenis en het uitlichten van lokale personen, bedrijven en verenigingen waarmee een bepaalde trots op de regio wordt aangeduid. Daarnaast worden er in dit corpus vaker mensen geciteerd, waarbij er meer aandacht aan hun gevoelens wordt besteed. In het oude corpus wordt meer aandacht besteed aan lokale sportverslaggeving en worden er vaker kleine lokale activiteiten onder de aandacht gebracht. Daarnaast is er een sterker wij-gevoel in dit corpus aanwezig en lijkt er vaker een bepaalde voorkennis van de lezer te worden verwacht in de berichtgeving. De interviews bevestigen ten dele dat deze verschillen voortkomen uit bewuste keuzes van de betrokken journalisten. Zo vindt de huidige nieuwsredactie diepgang en het menselijk maken van journalistiek belangrijk, terwijl er in de vroegere redactie juist veel waarde werd gehecht aan het kleine en lokale nieuws. Op basis van deze resultaten kan gesteld worden dat een intensieve samenwerking met een provinciale omroep niet zo’n sterk negatief effect op de mate van nabijheid in de berichtgeving hoeft te hebben als oorspronkelijk werd verwacht. De samenwerking lijkt er voornamelijk voor gezorgd te hebben dat nabijheid op een andere manier zichtbaar is geworden in de recente berichtgeving dan oorspronkelijk het geval was.","['nabijheid', 'lokale journalistiek', 'regionale journalistiek', 'streekomroep', 'NH Nieuws', 'Weeff', 'kwantitatieve inhoudsanalyse']"
"The Core Drivers and Enabling Factors of Boko Haram’s Success in Nigeria. What are the Core Drivers and Enabling Factors of Boko Haram’s Success in Nigeria, Defined as Challenging the Monopoly of Violence and thus Legitimacy of the Nigerian Government?","Melo, Daniel A",['Athanasios Staphopolous'],2021,Faculty of Humanities,International Studies (BA),Bachelor thesis,en,,"['Boko Haram', 'Nigeria', 'Monopoly of violence', 'poor governance', 'security']"
Islam in relation to the state: discussions on the Indonesian Constitution from 1999 to 2002,"Teeuwen, Cas",['B. Arps'],2021,Faculty of Humanities,International Studies (BA),Bachelor thesis,en,,"['constitutional reform', 'islam', 'post-suharto era']"
DISCONNECTION AND CULTURAL IDENTIFICATION IN NADEEM ASLAM’S MAPS FOR LOST LOVERS AND THE WASTED VIGIL,"Sürücü, Ümmü Gülsüm","['Kardux, J.C.']",2021,Faculty of Humanities,Literary Studies (MA),Master thesis,en,,
“The Bible is a flat-Earth book”: An Extended Pragma-Dialectical Analysis of Audience Adaptation in the Flat-Earth Conspiracy Theory,"Maruri-Ramos, Catalina",['R. Pilgram'],2021,Faculty of Humanities,Linguistics (MA),Master thesis,en,"One of the conspiracy theories that has increased in popularity during the last couple of years is about the Earth being flat. YouTube and the internet have played an important role in the wide spreading of the idea. Based on the apparent mistrust by flat Earthers of certain authorities, two types of fallacies seem predominant within the flat-Earth argumentative discourse: the argumentum ad hominem (argument against the person) and argumentum ad verecundiam (argument from authority). The aim of this thesis is to analyse the flat Earthers’ argumentative discourse through the lens of pragma-dialectics and observe which arguments tend to occur in light of the two authority-based fallacies. Audience adaptation is an equally important aspect to consider when analysing the strategic maneuvering of arguers in discussions. Unlike presentational design and topical potential, audience adaptation remains more open for expansion. It is also the aim of this thesis to expand on audience demand by including interdisciplinary behavioural studies. This is to understand the general attitudes and characteristics of flat Earthers and their audiences. In sum, the analysis is about how flat Earthers take into account their different audiences to maneuver strategically in the discussion by means of the authority-based fallacies. It could be observed that the fallacies of ad hominem, ad verecundiam (and its populistic variant ad populum) were advanced in strategically different ways. From appealing to God, the Bible, scientific referents, to even their own logical understanding of the world. Flat Earthers employed each of these strategies to both defend and attack standpoints while attempting to comply to their audiences. With these strategies, it could be identified that the main audiences flat Earthers wanted to adapt to were religious people. More specifically, Christian individuals with or without a conspiracy ideation who consider the government, NASA and anyone related to these as untrustworthy and dishonest. Other targeted audiences could include potential flat Earthers who may distrust established authorities and/or are Christian.","['Flat-Earth', 'pragma-dialectics', 'fallacies', 'ad hominem', 'ad verecundiam', 'audience adaptation', 'strategic maneuvering', 'expertise-based argumentation', 'critical questions']"
The Rights to Amman: An exploration of the relationship between a city and its inhabitants,"Deinsberger, Hannah",['Dr. Christian Henderson'],2021,Faculty of Humanities,Middle Eastern Studies (research) (MA),Research master thesis,en,,
BA Thesis - Radicalisation in the Diaspora: An Analysis of Radicalisation Amongst Second-Generation Dutch-Turkish citizens and the case of Yilmaz,"Tam, Ozum","['Ieven, B.K.']",2021,Faculty of Humanities,International Studies (BA),Bachelor thesis,en,,
Wahrheit und Lüge in Schillers Kabale und Liebe,"Qaderi, Amena","['Müller, J.M.']",2021,Faculty of Humanities,Duitse taal en cultuur (BA),Bachelor thesis,de,,
Chinese COVID-19 Propaganda: To what extent is state propaganda with regard to COVID-19 comparable to state propaganda published between 1949 and 1989?,"Smeets, Demi",['Prof. dr. H.G.D.G. De Weerdt'],2021,Faculty of Humanities,Asian Studies (60 EC) (MA),Master thesis,en,,"['china', 'propaganda', 'chinese propaganda', 'cultural revolution', 'four modernizations', 'coronavirus', 'covid-19']"
"Lyckpredicatiën, dansspelen en andere superstitiën: Cultuurgeschiedenis van de dood in de gereformeerde Nederlanden tussen 1571-1700","Offermans, Lara","['Krijger, T.E.M.']",2021,Faculty of Humanities,Religiewetenschappen (BA),Bachelor thesis,nl,,"['Dood', 'Gereformeerde Kerk', 'Acta']"
Chinese Old Tales Retold Fiction in Hong Kong since the 1960s,"Wang, Jiayi","['van Crevel, M.']",2021,Faculty of Humanities,Asian Studies (research) (MA),Research master thesis,en,,"['Hong Kong', 'Old Tales Retold fiction', 'Hong Kong literature']"
Education about the Dark Pages of Dutch History: An Analysis of Secondary Education Learning Materials,"Baseler, Laura Felicia","['Arps, B.']",2021,Faculty of Humanities,Asian Studies (60 EC) (MA),Master thesis,en,"History education has often been a topic of discussion and debate in the Netherlands. Many have argued that the dark pages of Dutch history are not sufficiently brought to attention in history education and learning materials. This thesis aims to find out how Dutch colonial history is represented in Dutch secondary education learning materials. Through an analysis of several high school history textbooks, it became clear that there are quite a few issues when it comes to the representations of Dutch colonial history. In short, the books pay too little attention to the topic, contain Eurocentric and one-sided narratives, biased language use and they rarely engage in current public debates around colonial history. A questionnaire was also conducted among high school students to discover how extensive their knowledge on Dutch colonialism is, and to get an insight on their opinions and perspectives regarding that history. The questionairre revealed that there are significant gaps in the students’ knowledge about Dutch colonialism. While the newer editions of the textbooks showed some improvements, the learning materials still have a long way to go.","['Colonial history', 'History education', 'The Netherlands', 'Indonesia', 'Colonialism', 'Dutch East Indies']"
Improving Tarwewijk: On urban renewal and urban regeneration in an impoverishing neighbourhood between 1982 and 1999,"Bavelaar, Emiel",['Dennis Bos'],2021,Faculty of Humanities,History (MA),Master thesis,en,,['tarwewijk millinxbuurt charlois urban renewal regeneration impoverished neighbourhood']
"Yemeni Women activists and the Security Council: A Discourse Analysis from a Women, Peace and Security lens","Göth, Tamara","['David, M.E.L.']",2021,Faculty of Humanities,International Relations (MA),Master thesis,en,"In 2020, the Women, Peace and Security (WPS) agenda celebrated its 20th anniversary. But amidst a global pushback on women´s rights and the continuation of violence and conflict, the realization of the agenda seems a far dream. In Yemen, women played leading roles in the 2011 uprising and the National Dialogue Conference in 2013-2014. Yet, they have increasingly been excluded from Yemen’s political processes and peace efforts. This thesis centers the voices of five Yemeni women, who briefed the United Nations Security Council on the situation in Yemen between 2017 and 2020. Using a postcolonial feminist lens, this thesis investigates how the statements of these women activists and those of the United Kingdom and the United States of America in UN Security Council meetings on Yemen compare, and how these discourses in turn relate to the Women, Peace and Security agenda. In particular, by building on the analytical framework of Laura Shepherd (2008), the thesis analyzes the conceptualizations of gender, security, violence and the international sphere in the discourse. This dissertation argues that – despite their commitments to the WPS agenda – the UK and the US fail to take into account the gendered dimensions of the conflict in Yemen and to recognize the intersectional security threats women in Yemen face. As both states largely fail to engage with the opinions and recommendations of Women Civil Society Briefers from Yemen, they also fall short in reflecting on their own contributions to the continuing conflict in Yemen.","['Women, Peace and Security', 'Yemen', 'Discourse Analysis', 'Gender', 'Security Council']"
Strategic Planning for Sustainable Transport: An analysis of the mechanisms behind public policies for sustainable transport and infrastructure in Costa Rica,"Tang, Simon van der","['Solheim, H. A. S.']",2021,Faculty of Humanities,Latin American Studies (MA),Master thesis,en,"Costa Rica has set ambitious goals regarding climate issues. It strives to be carbon neutral in 2021, and aims to completely decarbonize their economy by 2050. The state of the transport and infrastructure in Costa Rica are therefore a thorn in the side for both civil society and policymakers. In light of the issues in this sector the government has formulated several policies with the goal to transform the transport sector, creating a clean, efficient and safe system of transport and infrastructure. Some of these policies will be discussed in this thesis, namely the Plan de Descarbonización 2018-2050, the Plan Integral de Movilidad Urbana Sostenible, and the Plan Nacional de Transporte 2011-2035. The focus of this thesis will be on the mechanisms behind these policies. As such, some key questions that will be addressed are: how is the policymaking process designed? Who are the actors in this process? What institutions are involved and how is coordination shaped? Where lie the biggest challenges in the implementation of these policies? As it currently is, the transport sector suffers from high degrees of fragmentation, with many institutions involved and no clear leadership. It is a very interesting subject for study, as these mechanisms are the foundations on which the implementation of the policy builds. Without proper understanding of the interactions and challenges that one is faced with in this sector, effective implementation of the policies, and therefore the reaching of the climate goals becomes less feasible. . The facilitation of the implementation of the plans through institutional transformation is argued to be the absolute priority for the achievement of the goals and objectives as proposed in the policies that will be discussed in this thesis. The expectation is that the Costa Rican public administration for the transport sector will require a comprehensive reform, and as it stands it lacks the capacity to push for such reform. In the first chapter of this thesis the conceptual and theoretical basis for the analysis of the transport sector will be laid. Here the concepts of the public policy process in Latin America, Neo-institutionalism, and Public-Private Partnerships will be discussed and put into perspective of how they can be used to analyse the Costa Rican transport and infrastructure sector. The second chapter will offer the contextualization of the topic of study. The chapter is organised chronologically and starts with the economic crisis of the 1980s in Costa Rica. The chapter then continues to address the state reform during the 1980s and 1990s, followed by the developments of the past twenty years. It concludes with a brief overview of the current situation and policies in the transport and infrastructure sector. The third and final chapter’s focus will be the analysis of the policies discussed using the concepts as discussed in the first chapter, looking into the mechanisms behind these policies and the actors involved in the process. The chapter starts with an analysis of the policy process, followed by an analysis of the role and functioning of the institutions involved. The chapter concludes with a discussion on the use of public-private partnerships and the challenges the public administration if faced with regarding coordination between the sectors.","['Public Policy', 'Latin America', 'Costa Rica', 'Transport sector', 'Infrastructure sector', 'Institutions', 'Institutionalism', 'Public-Private Partnerships', 'Sustainable transport', 'Sustainability', 'Policy process', 'Policy-making']"
Power & Influence: Determining the impact of the Party for Freedom (PVV) on Dutch Immigration and Integration politics and policy (2010-2017).,"Osinga, Jelle","['Shaev, B.']",2021,Faculty of Humanities,International Relations (MA),Master thesis,en,,"['Influence', 'Power', 'Politics', 'Populism', 'Far Right']"
An Indecent Partnership: IUCN and Shell: An Analysis of how a Leading International Environmental Organisation is Greenwashing one of the Biggest Polluters in the World,"Roever, Charlotte","['Black, L.O.']",2021,Faculty of Humanities,International Relations (MA),Master thesis,en,"Partnerships of international environmental organisations (IEOs) and polluters can have positive outcomes for the environment, but they can also result in an organisation greenwashing a polluting company. The International Union for the Conservation of Nature (IUCN), a leading IEO, is partnering with the oil giant Royal Dutch Shell, one of the biggest polluters worldwide. This study aims to determine whether the partnership makes a positive contribution to the environment or if the opposite is the case and IUCN is greenwashing Shell. Specifically it investigates the effectiveness of an IUCN–Shell project in the Niger Delta, which aims to improve Shell’s sustainability record in the area. As a result of the project, two reports were published which give recommendations on how to reach this aim. These reports are the substance of this study’s methodology, with a number of hypotheses testing their integrity, whether they had a positive effect and whether the absence of positive effects was criticized by IUCN. Methods which test the hypotheses are a summative content analysis, evaluating the content – and process-tracing, assessing the effects of the reports. The results showed that IUCN is greenwashing Shell, as the reports are biased, not transparent and the authors not independent. Furthermore, there was determined only a minor process and a lack of criticism by IUCN to Shell’s poor behaviour. The outcome of the study questions not only the legitimacy of IUCN as an IEO but also the overall system of global environmental governance in which these organisations operate and are entrusted with effecting a meaningful impact for the environment.","['IUCN', 'Shell', 'Greenwashing', 'International Environmental Organisation', 'Niger Delta', 'Oil Pollution']"
"Verval, stagnatie en herstel: Een onderzoek naar de ontwikkelingen van de vrije koophandel tussen Nederland en Nederlands-Indië van 1806 tot 1824.","Angenent, Thomas",['Dr. A.M.C. van Dissel'],2021,Faculty of Humanities,History (MA),Master thesis,nl,,"['Maritieme geschiedenis', 'Nederlandsche Handel-Maatschappij', 'Nederlands-Indië', 'Particuliere scheepvaart', 'Koopvaart']"
To what extent does Ypi’s defence of a global theory of justice in migration succeed?,"Young Afat, Vito",['Dr. Wouter Kalf'],2021,Faculty of Humanities,Philosophy (MA) (60 EC),Master thesis,en,,"['Philosophy', 'Migration theories', 'Justice in migration']"
'Shipping' China: An Alternative Approach to Transnational Propaganda Practices in Chinese Film,"van Vuren, Mitchell",['F.W.A. Korsten'],2021,Faculty of Humanities,Literary Studies (research) (MA),Research master thesis,en,,"['propaganda', 'Chinese film', 'film history', 'multi-coded narratives', 'transnational affective communities', 'tianxia']"
China's Economic Diplomacy in East-Asia: What drives China’s economic diplomacy in the case of political disputes in East-Asia?,"Kosterink, Maurice","['Black, L.O.']",2021,Faculty of Humanities,International Relations (MA),Master thesis,en,"In recent years, China's economic diplomacy has received more attention in the field of International Relations. Some scholars argue that China uses its economic diplomacy in a coercive way, while other scholars argue against this notion. This thesis discusses China's economic diplomacy with its research question: ""What drives China’s economic diplomacy in the case of political disputes in East-Asia?"". The thesis examines two disputes between China and its neighbouring countries, Japan and South Korea, in order to research how China employs its economic power. The research is based on three factors that influence how China creates its economic diplomacy; national sentiment, history of the bilateral relations, and bilateral trade. Using process-tracing, the thesis examines these three factors of the THAAD dispute with South Korea and the Senkaku/Diaoyu Islands dispute with Japan. The aim of the thesis is to demonstrate that, while national sentiment, previous bilateral relations, and bilateral trade influence China's economic diplomacy, these factors do not influence China’s decision-making equally. The thesis concludes that national sentiment influences the Chinese government the most to use its economic diplomacy coercively.","['China', 'East-Asia', 'South Korea', 'Japan', 'Economic Diplomacy']"
UN COUNTRY-SPECIFIC PEACEBUILDING AND DEVELOPMENT PROGRAMMES: Opening the door for NGO inclusion in the global South?,"Warnders, Veerle","[""O'Malley, A. M.""]",2021,Faculty of Humanities,International Relations (MA),Master thesis,en,,"['United Nations', 'NGOs', 'Civil Society', 'Peacebuilding and Development Programmes']"
Is China Done Feeding Its Carrots? A Case Study Analysis of Chinese Foreign Policy in the South China Sea through Liberalism and Realism,"Voges, Frédéric",['Stacey Links'],2021,Faculty of Humanities,International Studies (BA),Bachelor thesis,en,,
Cyborgs vs Humans in Westworld (2016-) A Transhuman Nightmare or the Advancement of Posthumanism?,"Martin Gracia, Izarbe","['Leeuwen, E.J. van']",2021,Faculty of Humanities,Literary Studies (MA),Master thesis,en,,
