title,author,supervisors,date,faculty,program,type,language,abstract,keywords
Can Scarcity be Fruitful? Effects of Past and Present Scarcity on Cognition,"Üstün, Damla",['Dr. H.A.H. Ruigendijk'],2022,Faculty of Social & Behavioural Sciences,Psychology (MSc),Master thesis,en,"Considering the many children around the world that live in financially scarce conditions, it is of importance to know the consequences with regard to cognition. Life history theory suggests people growing up in these scarce circumstances might develop different ways of adapting to this environment. This study looks at the influence of childhood financial scarcity on cognitive performance, when a current mindset of financial scarcity is activated. Specifically, this research is focused on determining performance on inhibition and cognitive switching tasks for people with different scarcity backgrounds and mindsets. In order to test this, people were questioned about their childhood. Then, half of the participants was instructed to recall a scarcity-related memory, while others recalled a neutral memory. Finally participants were presented with a cognitive task, which measured either inhibition or cognitive switching. It was expected that in a current scarcity mindset, people that had a scarcity background would perform lower on inhibition, but higher on switching. According to the results, neither childhood scarcity, current scarcity mindset, nor the combination of the two, were significant predictors of performance on the cognitive tasks. On these grounds, further research is needed to determine the relation between scarcity and cognition.","['scarcity', 'cognition', 'switching', 'inhibition', 'life history theory']"
"Many Loves: An anthropological exploration of the values and narratives of consensual non-monogamists on love, sex, and relationality","Legein, Mowgli","['Postma, M.']",2022,Faculty of Social & Behavioural Sciences,Cultural Anthropology and Development Sociology (MSc),Master thesis,en,"This article explores the multiplicity of experiences and perspectives of people practicing consensual non-monogamy (CNM) and questions how their values about love, intimacy, relationality, and sexuality relate to their practice of CNM. To gain these insights, I used experimental ethnographic methods such as autoethnography, film, and in-depth unstructured interviewing, alongside a theoretical framework based on Foucault’s view on sexuality and the concept of mononormativity combined with the wider contextualizing academic discussion surrounding CNM. This resulted in argumentation that centers around the idea that the discourse and narratives surrounding love sex and relationality one adheres to, relate not only to various practical approaches to CNM but also to one’s sense of identity and morality within it. First, I explored sexually nonexclusive relationships or open relationships, in the context of the youth hook-up culture, and then in married couples exploring swinging and BDSM non- monogamously. I argued that both of these relationships’ structures depended on a mononormative separation of romantic love and sexuality, while for the first group this separation was implicit and extradyadic sexuality went unspoken, the second group created this dissociation voluntarily and critically as they presented sex as a form of play and claimed to take advantage of the conventional structure of marriage. After this, I focused on polyamory i.e., romantic CNM, and its use of language to label feelings, relationships, and social phenomena to change the way polyamorists relate and communicate. Which impacted not only polyamorists’ philosophy of relationality but also causes a reorganization of their lives and their sense of identity. However, as this sanitized holistic vision of love is essentialized into a relational identity, it still carries underlying mononormative tendencies.",
De relatie tussen symptomen van de verschillende PTSS-clusters van moeders en hyperactiviteits- en aandachtsproblemen van hun jonge kinderen na huiselijk geweld,"Aarts, Eline","['Asdonk, S. van der']",2022,Faculty of Social & Behavioural Sciences,Education and Child Studies (MSc),Master thesis,nl,"There is still a lot unknown about the impact of complex trauma on parents and their young children, especially after interparental violence. When this knowledge is expanded, interventions can be designed accordingly to treat the effects and prevent impact of trauma for future generations. The goal of this study was to examine the effects of different trauma-related symptoms of mothers on a specific domain of problems their young children might be facing after interparental violence. The main question was: ‘How are symptoms from the four different posttraumatic stress disorder (PTSD) symptom clusters of mothers related to the attention and hyperactivity symptoms of their children after experiencing interparental violence?’ To answer this question, surveys were issued to fourteen women victimized by interparental violence living in Dutch women’s shelters. They reported on their PTSD symptoms and the attention and hyperactivity symptoms of their youngest child, aged between one and six years old (M = 3 years and 6 months, SD = 1 year and 9 months). Social workers of most of the children also completed questionnaires on the attention and hyperactivity symptoms of the child. It was found that the PTSD symptoms of re-experiencing, avoidance and hyperarousal, as well as the overall severity of PTSD symptoms, were not significantly related to the attention and hyperactivity symptoms of the child. Small but unsignificant differences were found between the different PTSD symptom clusters. It is recommended to direct future research to the impact of the different trauma-related symptoms of parents after domestic violence on specific child outcomes. When these relations are understood more thoroughly, interventions can be deployed where help is needed most and intergenerational transmission of the effects of complex trauma will be challenged.","['PTSS, aandachts- en hyperactiviteitsproblemen, ADHD, huiselijk geweld, vrouwenopvang, trauma, complex trauma']"
"Het verband tussen masculiniteitsopvattingen, internaliserend probleemgedrag en homofobie, gemedieerd door alexithemie","Wolken, Sabien","['Vedder, P.']",2022,Faculty of Social & Behavioural Sciences,Education and Child Studies (MSc),Master thesis,nl,,
"Angelman Syndroom en Prader-Willi Syndroom: een overzicht, gecombineerd met praktische kennis voor zorgverleners: De zorgbehoeften onderzocht en besproken in de context van het AAIDD-Model.","Nees, Lonneke","['Dijkxhoorn, Y.M.', 'Plak, R.D.']",2022,Faculty of Social & Behavioural Sciences,Education and Child Studies (MSc),Master thesis,nl,"Aim: The aim of this thesis is to contribute to the orthopedagogical knowledge on Angelman Syndrome (AS) and Prader-Willi Syndrome (PWS), to create a useful framework for identifying support needs and to obtain more structure and uniformity in existing knowledge. This is done on the basis of two research questions: 1) What are the characteristics (genotype and phenotype) of the Angelman Syndrome and the Prader-Willi Syndrome? 2) Is it known from literature whether people with AS or PWS have an intensive need for care? Is a distinction noticeable between the group from the literature and the group of clients with AS, who all have an intensive care demand, in the SCORE research? Method: For the first research question, extensive literature research at meta level was performed. In addition, the literature has been analyzed on the basis of the domains of the AAIDD-model. A multiple case study was conducted for the second research question. Of the 225 clients, 2 were clients with AS and there were no clients with PWS. The results of the BSID-III, CI, VABS, DBC-A and the SMS have been analyzed. Results: People with AS have a profound intellectual disability. There is a severe disorder in every domain of the VABS. There is little to no participation in society. People with AS often have sleep disturbances, seizures, ataxia, and motor development delays. The living environment differs for each client. People with PWS have a mild intellectual disability with an average IQ between 60-70 but in addition also have severe medical and physical challenges. Conclusion: People with AS have an intensive need for care due to their low functioning level. More research is needed on the health care needs of people with PWS to conclude whether they have intensive care needs.","['Angelman Syndrome, Prader-Willi Syndrome, Intensive care, Characteristics, Intellectual disability']"
Is (glim)lachen een universele taal? Tonen gorilla’s een playface na het zien van een playface bij een soortgenoot,"Ramler, Daphne","['Zijlstra, T.']",2022,Faculty of Social & Behavioural Sciences,Psychologie (BSc),Bachelor thesis,nl,,
Na-apen: Wordt een speelgezicht gespiegeld door gorilla's,"Amiel, Noa","['Zijlstra, T.']",2022,Faculty of Social & Behavioural Sciences,Psychologie (BSc),Bachelor thesis,nl,,
De betrouwbaarheid van wetenschappelijke bevindingen onderzoeken aan de hand van een multiverse analyse Hoe robuust is het effect van zelfbescherming op de bereidheid om te verontschuldigen?,"Meijer, Kevin","['Heyman, T.']",2022,Faculty of Social & Behavioural Sciences,Psychologie (BSc),Bachelor thesis,nl,,
The Effects of Parental Verbal Expressions of Threat vs. Safety on Child Avoidance Behavior Child Social Anxiety Level as Moderating Factor,"Hagmayer, Luisa","['Aktar, E.']",2022,Faculty of Social & Behavioural Sciences,Psychologie (BSc),Bachelor thesis,en,,
A Follow Up Study on Trust in Automation: How Situational Trust in Level 2 (Partial Automation) Vehicles Changes with Experience in Driving Simulators,"Gülersoylular, Selin","['Walker, F.']",2022,Faculty of Social & Behavioural Sciences,Psychologie (BSc),Bachelor thesis,en,,
Transcutaneous Vagus Nerve Stimulation in Humans and its influence on Alpha Oscillations,"Lenters, Maddelon","['Sturm, F.']",2022,Faculty of Social & Behavioural Sciences,Psychologie (BSc),Bachelor thesis,en,,
Psychedelic use and spiritual bypassing,"Christofides, Panayiotis",['H. Beykoylu'],2022,Faculty of Social & Behavioural Sciences,Psychologie (BSc),Bachelor thesis,en,,
Screen-Based Virtual Reality Exposure Therapy: The Effect of Audience Size and Audience Appearance on Anxiety Levels During a Public Speaking Task,"Dahrendorf, Celia",['E. Fasya'],2022,Faculty of Social & Behavioural Sciences,Psychologie (BSc),Bachelor thesis,en,,
Entrepreneurial Pursuit of Growth and the Influence of Holding Subjective Norms Regarding Work-Life Balance on Engagement Levels with Work-Life Balance Crafting.,"Berg, Amber van den","['Hilbert, L.', 'Prasastyoga B.']",2022,Faculty of Social & Behavioural Sciences,Psychologie (BSc),Bachelor thesis,en,,
The Effect Of Religion And Spirituality On Depressive Symptoms During The COVID-19 Pandemic,"Kopper, Vanessa","['Moreira Joao, A.']",2022,Faculty of Social & Behavioural Sciences,Psychologie (BSc),Bachelor thesis,en,,
"Aloha Beachclub 2022 Onderhandelingen met leider, het effect van sociaal motief en genderverschillen","Valentijn, Daan","['Steinel, W.']",2022,Faculty of Social & Behavioural Sciences,Psychologie (BSc),Bachelor thesis,en,,
The Effect of Attachment Style and Self-respect on the Psychological Well-being of Sexual Minorities: a Mediation and Correlational Analysis,"Margariti, Alexandra","['Reinken, A.K.']",2022,Faculty of Social & Behavioural Sciences,Psychologie (BSc),Bachelor thesis,en,,
"The Role of Stereotypes, Social Motive and Power Distribution Within Mixed-gender Group Negotiations","Boermans, Anouk","['Steinel, W.']",2022,Faculty of Social & Behavioural Sciences,Psychologie (BSc),Bachelor thesis,en,,
The effect of multidisciplinary treatment multidisciplinary treatment on on the use of the use of functional behavioral functional behavioral copingcoping strategies bystrategies by chronic low back chronic low back pain patientspain patients,"Helm, Frederike van der","['Opstal, T. van']",2022,Faculty of Social & Behavioural Sciences,Psychologie (BSc),Bachelor thesis,en,,
"Does emotional stress affect movement patterns of the trunk, pelvis and/or low back during forward bending?","Vermeulen, Laura",['T.P. Doorson'],2022,Faculty of Social & Behavioural Sciences,Psychologie (BSc),Bachelor thesis,en,,
Federalism and Conditional Cash Transfer Programs,"Schalken, Dagmar","['Van Reuler, A. A. H. E.']",2022,Faculty of Social & Behavioural Sciences,Politicologie (BSc),Bachelor thesis,en,"While much research has been done on how conditional cash transfers (CCTs) affect development outcomes, little is known about the input-side of conditional cash transfers. What affects their design, development, and diffusion? Analysing conditional cash transfers in the federal countries of Brazil, India, and Ethiopia the purpose of this research has been to explore whether federal structures impact conditional cash transfers. The three mechanisms of credit-claiming, national emulation and lesson-drawing have been derived from the existing literature and applied to CCTs. Conducting theoretically guided case study analyses it was found that of the three theoretical expectations, only national emulation formed a pattern across the cases. However, the explorative design of this thesis allowed for other findings to emerge. Such as the discrepancy between CCT-designs and federalism as written down in the constitution. Also, it was found that IOs and NGOs contribute more to improving the quality of services under CCTs than changing the design of CCTs. This thesis has been a first step in the research on federalism and CCTs. Further research is highly recommended to include more cases, as well as some unitary cases and a re-conceptualization of CCT-reform.","['Federalism, Public Policy, Cash Transfer, Development, Global South']"
Democratisation in Unrecognised States: A Quantitative Approach,"Koning, Thomas","['Fliervoet, F.E.M.']",2022,Faculty of Social & Behavioural Sciences,Politicologie (BSc),Bachelor thesis,en,,"['Democratisation', 'Unrecognised States', 'Democratization', 'Unrecognized States', 'Quantitative Research', 'Quasi-states', 'de facto states']"
Good Governance and Economic Growth: Evidence from Southern Europe,"Segnana, Giovanna",['Jonathan Philips'],2022,Faculty of Social & Behavioural Sciences,Politicologie (BSc),Bachelor thesis,en,,
Immigration and Threat Perceptions: The Boogeyman of Modern European Politics,"Halmai, Joel",['Joshua Robison'],2022,Faculty of Social & Behavioural Sciences,Politicologie (BSc),Bachelor thesis,en,,
The Failure to Create a Burmese Developmental State: A Comparative Case Study of Myanmar and the Asian Tiger Economies,"Savage, Marcus",['Kevin Koehler'],2022,Faculty of Social & Behavioural Sciences,Politicologie (BSc),Bachelor thesis,en,,
Being observed while eating changes perceived portion size Or does it? A multiverse analysis,"Berkhof, Pepijn van den","['Heyman, T.D.P.']",2022,Faculty of Social & Behavioural Sciences,Psychologie (BSc),Bachelor thesis,en,,
DE INVLOED VAN EEN ADVIES OP DE FYSIEKE ACTIVTITEIT VAN KANKERPATIËNTEN : EEN MULTIVERSE ANALYSE,"Greefhorst, Merel","['Heyman, T.D.P.']",2022,Faculty of Social & Behavioural Sciences,Psychologie (BSc),Bachelor thesis,nl,,
“Who wastes less food?” How environmental knowledge influences food waste intentions: A cross-national study in Belgium and the United States of America,"Serlie, Fleur","['Brizi, A.']",2022,Faculty of Social & Behavioural Sciences,Psychologie (BSc),Bachelor thesis,en,,
Decolonising Faculty: Perceptions and Practices of Decolonial Transformation in Dutch Higher Education,"Cooney, Imogen",['Andrew Littlejohn'],2022,Faculty of Social & Behavioural Sciences,Cultural Anthropology and Development Sociology (MSc),Master thesis,en,,"['decolonisation', 'higher education', 'academic identity']"
Investigating the Relationship between Covid Status and Depressive Symptoms During the COVID-19 Pandemic: A Focus on the Role of Extraversion,"Alladin, Yasmine","['João, A.M.']",2022,Faculty of Social & Behavioural Sciences,Psychologie (BSc),Bachelor thesis,en,"Observed globally, the COVID-19 pandemic has generated a mental health decline. The pandemic has affected the general public, individuals that have been quarantined and individuals who have been infected with COVID-19. Currently, only a few available studies compare pandemic-onset depressive symptoms between these groups. Additionally, it is not yet known how a dominant position on the personality continuum of introversion/extraversion influences individuals’ experiences of depressive symptoms. Thus, the present study investigates differences between covid groups, as well as differences between individuals with dominant introverted versus extraverted traits. The findings will contribute to the construction of a global response in the observed mental health decline. The study is carried out through a cross-sectional online questionnaire (N = 150), in a group of adults between 18 and 30 years old. Individuals’ differences in positions on the introversion/extraversion continuum are measured using the HEXACO- PI-R. The mean PHQ-9 and HADS depression scores were observed to be 14.95/10.25 (healthy), 18.35/11.94 (quarantined), 15.64/10.25 (infected) and 15.76/11.55 (quarantined + infected) in the respective groups. No difference between covid status groups on the depression scores was found. Within the whole sample, in the healthy and quarantined + infected groups (p < 0.001), and in the PHQ-9 measured infected group (p = 0.045), significant negative relationships between extraversion and depressive symptom scores were found. These findings are limited due to small sample sizes, the cross-sectional design and the use of convenience sampling. Further studies should include larger sample sizes and make use of a longitudinal design and probability sampling.","['COVID-19', 'Covid status', 'depression', 'extraversion', 'personality']"
‘Thuisvoelen’: Making Sense of Contestations of Belonging in Dutch-Moroccan Citizens in the Netherlands,"El Baroudi, Salima","['Jansen, J.']",2022,Faculty of Social & Behavioural Sciences,Cultural Anthropology and Development Sociology (BSc),Bachelor thesis,en,,
"Speaking of Spirits (âtayôhkêwin) A multimodal inquiry into Indigenous ways of being, doing, knowing and speaking on Turtle Island","Riemens, Eva","['De Musso, Federico']",2022,Faculty of Social & Behavioural Sciences,Cultural Anthropology and Development Sociology (MSc),Master thesis,en,,
"Parkour in Lisbon: An Ethnographic Exploration of Space, Place and Insider Research","Condon, Max","['Fogarty-Valenzuela, Benjamin']",2022,Faculty of Social & Behavioural Sciences,Cultural Anthropology and Development Sociology (MSc),Master thesis,en,,
Drag Kings and Creatures: On The Exploration Of One’s Gender Identity And One’s Self-Development,"Bozuwa, Sarah","['Hölsgens, Sander']",2022,Faculty of Social & Behavioural Sciences,Cultural Anthropology and Development Sociology (MSc),Master thesis,en,,
The power of education for national identity formation and reconciliation in a multi-ethnic Kosovo,"Vettiyadan, Irene",['Arlinda Rrustemi'],2022,Faculty of Social & Behavioural Sciences,Politicologie (BSc),Bachelor thesis,en,,
Additional Protocol II of the Geneva Conventions: The vanishing point of international law? Protecting civilians in non-international armed conflicts,"Rozijn, Jorena",['Muge Kinacioglu'],2022,Faculty of Social & Behavioural Sciences,Politicologie (BSc),Bachelor thesis,en,,
Does Novelty Promote Fear Extinction,"Koster, Jiska","['Schomaker, J.']",2022,Faculty of Social & Behavioural Sciences,Psychologie (BSc),Bachelor thesis,en,"Anxiety disorders are highly prevalent mental disorders. Treatment of these disorders, such as exposure-based treatment, is commonly derived from the principle of fear conditioning and fear extinction. In the current study the element of novelty was introduced into the process of extinction to explore how to promote fear extinction, as with standard extinction fear frequently returns over time. Extinction by means of novelty was studied in 32 human subjects using a within-subjects design. First, the participants underwent fear conditioning, in which conditioned stimuli (sounds) were paired with fearful images. This phase was directly followed by an extinction phase with a novelty-facilitated, familiar and standard extinction condition. After a time gap of a minimum of 12 to a maximum of 36 hours responses to the conditioned stimuli were tested again. Pupil size measurements and subjective arousal ratings during this post-extinction phase did not indicate an effect for novelty-facilitated extinction on the extent of fear, this may be the result of potential weak conditioning in the current study. The results of this study express the need for more research to understand the effect of novelty on fear extinction. This could contribute to future implementation of novelty in treatment of anxiety disorders.","['fear conditioning', 'fear extinction', 'novelty', 'pupil-size']"
Can Do vs. Have to? The impact of Gender and Social Mobility on Power Construal,"Ballering, David Marinus","['Scheepers, D.T.']",2022,Faculty of Social & Behavioural Sciences,Psychologie (BSc),Bachelor thesis,en,"Social Power is the relative control over the outcome of oneself and others (Fiske & Berdahl, 2007). Power can be interpreted differently, which in turn can have a big impact on the power holders and on the ones who experience the expressed power (Keltner et. al., 2003). The literature distinguishes between power as opportunity and power as responsibility (De Wit et al., 2017). Moreover, stereo- typical gender differences especially affect women as they keep them from reaching leadership pos- itions (Tabassum & Nayak, 2021). However, not only gender affects behavior, also our socio-eco- nomic status can influences a life significantly. The change in socio-economic status is called social mobility (Reforms, 2010). A restricted social mobility seem to keep individuals from reaching lead- ership positions (Brown, 2013). Self-reports on power construal were collected with overall n= 227 respondents to find out about the possible differences in how men and women interpret power. The results show that self-identified females do interpret power more as responsibility than self-identi- fied males do. Both self-identified genders did not differ on construing power as opportunity. Fur- thermore, the study showed that social mobility has no effect on how power is interpreted. Never- theless, the current SES of an individual seems to have a small effect on how power is perceived. The current study highlights the importance of understanding the relationship between gender, so- cial mobility, and power construal and the necessity for further research.","['Power', 'Gender', 'Power construal', 'Opportunity', 'Responsibility', 'Social mobility', 'SES']"
Direct Anger and Averted Fear: Investigating Attentional Bias in a Dot-Probe Task,"Kap, Yasemin","['Zijlstra, T.']",2022,Faculty of Social & Behavioural Sciences,Psychology (MSc),Master thesis,en,"Emotions and emotional expressions are an integral part of human society. This study aims to add to our knowledge concerning whether people have an attentional bias toward a face expressing an emotion, depending on the gaze direction of the face. The saliency of emotional expressions has previously been researched. However, the dot-probe task has so far not been used to investigate whether people have an attentional bias toward a certain emotion depending on its gaze direction. We used the dot-probe task to measure an attentional bias between (1) angry faces with direct gazes and angry faces with averted gazes and (2) fearful faces with direct gazes and fearful faces with averted gazes. We hypothesized that (1) people have an attentional bias toward angry faces with a direct gaze when compared to angry faces with an averted gaze and (2) people have an attentional bias toward fearful faces with an averted gaze when compared to fearful faces with a direct gaze. Our study did not yield significant results. However, age was found to be a significant factor and a major limitation of our study was a narrow age range with only 7 participants over the age of 30. We conclude with describing the limitations of our study and providing recommendations for future studies.","['dot-probe, attentional bias, emotion, gaze direction']"
De relatie tussen emotieherkenning en externaliserend probleemgedrag bij kinderen,"Berg, Michelle van den","['Plak, R.D.']",2022,Faculty of Social & Behavioural Sciences,Education and Child Studies (MSc),Master thesis,nl,,
What depression symptoms matter to stakeholders of ecological momentary assessment studies?,"Giba, Ágoston","['Fried, E.']",2022,Faculty of Social & Behavioural Sciences,Psychology (MSc),Master thesis,en,,
