title,author,supervisors,date,faculty,program,type,language,abstract,keywords
Japan’s Response to China’s Belt and Road Initiative: The Role of the Private Sector diplomacy and Governance Values in Sino-Japanese Rivalry,"Chang, Yi-Yu","['Chang, V.K.L.']",2021,Faculty of Humanities,Chinastudies (BA),Bachelor thesis,en,"The financial crisis of 2007-2008 had a great negative impact on the world. It also revealed how much the global economy is dependent on financial centres in the West. In the wake of the crisis in 2010, the Asian Development Bank (ADB) assessed that the Asian region had a huge infrastructure gap of trillions in US dollars which needed to be filled. According to a report of the ADB, increasing infrastructure in Asia and fixing this gap would decrease the Asian region’s reliance on the Western economy and reduce the risk of a worldwide financial crisis reoccurring. China and Japan have hugely increased their efforts to address the need for infrastructure in the last decade, in both a competitive and cooperative manner. The Belt and Road Initiative (BRI) and Asian Infrastructure Investment Bank (AIIB) are two initiatives which were announced in 2013 by the same Chinese leadership and are focused on the building of infrastructure. Japan has responded to these initiatives in a very ambiguous manner. On the one hand, Japan launched the Partnership for Quality Infrastructure (PQI) in 2015, just before the AIIB was officially signed, as an infrastructure-funding initiative which has competed with the BRI. On the other hand, Japan still started “conditional engagement” with China on 52 BRI projects despite Japan’s initial doubts about the ability for proper governance and lending practices. This thesis will examine both the cooperative response and the competitive response of Japan towards the BRI and AIIB. To analyse the cooperative element, it will use Brooks’ modern liberalist theory, which argues that Multinational Corporations (MNCs) and International Production Networks (IPNs) have become the more influential part of economic interdependence, and has mostly replaced the factor of interstate trade. From Brooks’ modernized liberalist perspective, this thesis argues that the Keidanren, one of Japan’s business federations has played a significant role in the road to cooperation between China and Japan on BRI projects. To analyse the competitive element, this thesis will use Nabers’ discursive approach and apply it to competition between China’s BRI/AIIB, and Japan’s Asian Development Bank (ADB) and PQI. It will focus on the standards and values portrayed by both countries’ initiatives, and it argues that they are converging, which is producing a fertile ground for increasing and deepening cooperation between China and Japan on infrastructure projects in third countries.","['Belt and Road Initiative', 'Partnership for Quality Infrastucuture', 'Private Sector Diplomacy', 'Keidanren', 'Sino-Japanese relations']"
"Empire of Signs: Transnational Views of Imperial Japan in Shanghai during Emperor Showa’s Enthronement Ceremony, 1928","Yang, Yuanqi",['Ethan. Mark'],2021,Faculty of Humanities,Asian Studies (60 EC) (MA),Master thesis,en,,
The Effect of the Patriarchy in South Korea and Japan on Current Attitudes Toward the Comfort Women Issue,"Phan Van, Hang","['Jang, S.Y.']",2021,Faculty of Humanities,Koreanstudies (BA),Bachelor thesis,en,,
The Nothern Triangle's Security Gap: Are hybrid institutions key to filling it?,"Nuvelstijn, Jolijn","['Solheim, H.A.S.', 'Silva, P.']",2021,Faculty of Humanities,International Studies (BA),Bachelor thesis,en,,
How the Dutch government and the China Strategy address challenges in the Chinese business environment,"Hartgers, Marijke","['Ferchen, M.G.', 'Wang, J']",2021,Faculty of Humanities,Asian Studies (60 EC) (MA),Master thesis,en,,"['Dutch-Sino bilateral relationship', 'China strategy', 'Dutch policy', 'Chinese business environment']"
Taste and Smell: The Visualization of the Senses in Indonesian Culinary Photography,"Arps, Deirdre",,2021,Faculty of Humanities,Media Studies (MA),Master thesis,en,,"['Photography', 'Indonesia', 'food identity', 'taste', 'smell']"
Hip to be Square: Charles Rennie Mackintosh' gebruik van het vierkant als decoratie,"Westercappel, Nancy",['H.F. Westgeest'],2021,Faculty of Humanities,Kunstgeschiedenis (BA),Bachelor thesis,nl,"In de ontwerpen van Charles Rennie Mackintosh van omstreeks 1900, zien we het vierkant steeds vaker voorkomen als motief in de decoratie van zijn interieurs en objecten. In Hill House (1902-4) is deze toepassing op zijn hoogtepunt. Met zijn innovatieve ontwerpen ontwikkelde Mackintosh ontwikkelde zich tot het gezicht van de Glasgowse stijl. Zijn vroege interieurs zijn beïnvloed door een aantal voorgangers, waaronder de witte interieurs in de schilderkunst van de negentiende eeuw en de invloedrijke interieurontwerpen van Godwin die voortkwamen uit de invloed van Japanse esthetiek. Ook heeft Mackintosh op meer directe wijze invloed uit Japanse kunst en cultuur ondergaan binnen zijn netwerk, onder andere door zijn contact met Hermann Muthesius. Zijn samenwerking met leden van de Wiener Secession heeft een impuls gegeven aan de Weense kunstenaars. Het contact met Joseph Hoffmann zorgde voor een stimulans in Mackintosh’ ontwikkeling, wat uiteindelijk heeft geresulteerd in de geometrische decoraties van Hill House.","['Mackintosh', 'geometrische decoratie', 'Japan', 'witte interieurs', 'Josef Hoffmann']"
Bhutanese Identity: how different identities become one,"Jager, Dagmar Irene de","['Verhagen, P.C.']",2021,Faculty of Humanities,Asian Studies (60 EC) (MA),Master thesis,en,,"['Bhutan', 'identity', 'language', 'religion', 'culture', 'tradition']"
Short Traditional and Long Simplified: the Paradox of Contemporary Traditional Taiwanese Characters that Consist of Fewer Strokes than their Equivalent Simplified Forms,"Messchendorp, Edwin","['Sybesma, R.P.E.']",2021,Faculty of Humanities,Asian Studies (60 EC) (MA),Master thesis,en,,"['Traditional Chinese Characters', 'Simplified Chinese Characters', 'Simplification', 'Taiwanese Characters']"
The representation of Sŏn'gun ideology in the North Korean propaganda posters,"Hoorn, Jelena",['R.E. Breuker'],2021,Faculty of Humanities,Asian Studies (60 EC) (MA),Master thesis,en,,"['North Korea', 'Posters', 'Propaganda', ""Sŏn'gun ideology""]"
"Pro-Women Laws, Changing Gender Roles and the Growth of Men's Rights Groups in India","Voppen, Yvet",['Nankyung Choi'],2021,Faculty of Humanities,International Studies (BA),Bachelor thesis,en,,"['Gender', 'India', 'Politics', 'Masculinity']"
The Perfect Ambassador: The profile and code of conduct of the medieval ambassador in Lucas de Penna’s De legationibus (1348-?) and Bernard de Rosier’s Ambaxiatorum brevilogus (1436),"Tuinstra, Naomi","['Napolitano, D.P.H.']",2021,Faculty of Humanities,History (MA),Master thesis,en,,"['Medieval diplomacy', 'didactical literature', 'ambassadorial instruction books', 'profile and code of conduct']"
Securitization of Xinjiang: The Case of the Belt and Road Initiative,"Student, X.","['Links, S']",2021,Faculty of Humanities,International Studies (BA),Bachelor thesis,en,,"['Xinjiang', 'Securitization']"
The Representation of the Woman Writer and the Male Gaze in Three Biopics,"Busschbach, Ingrid Francisca van","['Newton, M.S.']",2021,Faculty of Humanities,Engelse taal en cultuur (BA),Bachelor thesis,en,,"['male gaze', 'Laura Mulvey', 'woman writer', 'female writer', 'biopic', 'film']"
Persvrijheid in Venezuela: Een onderzoek naar de journalistieke praktijk onder de regering van Maduro,"Rombouts, Anne","['Burger, P.B.']",2021,Faculty of Humanities,Media Studies (MA),Master thesis,nl,,
Vampires and Socio-Political Anxieties: A Comparative Analysis of Bram Stoker’s Dracula and Stephen King’s ’Salem’s Lot,"Pohlig, Eva","['Leeuwen, E.J. van', 'Dijkhuizen, J.F. van']",2021,Faculty of Humanities,Engelse taal en cultuur (BA),Bachelor thesis,en,,"['Vampiers', 'Dracula', ""'Salem's Lot"", 'Socio-Political Anxieties', 'Bram Stoker', 'Stephen King']"
"A Cynic, Christian or Charlatan? An analysis of the different identities of Peregrinus Proteus in Lucian’s De Morte Peregrini","Monster, Olivia","['Berg, R.M. van den']",2021,Faculty of Humanities,Classics and Ancient Civilizations (MA),Master thesis,en,,"['Lucian', 'De Morte Peregrini', 'Peregrinus Proteus', 'Cynicism', 'Christianity']"
The role of non-governmental organizations in the integration and non-discrimination of refugees in the Brazilian labor market,"Silva Paiva, Camila",['Dr. Valdivia Rivera'],2021,Faculty of Humanities,Latin American Studies (MA),Master thesis,en,"Since 2010, Brazil has been receiving an increase in the numbers of refugees. It is presumed that the protagonist in assisting the integration of refugees are the NGOs and not the state. NGOs are known for providing aid, social services and advocacy for groups and minorities that are marginalized. Currently, there are approximately 100 NGOs supporting and representing refugees in Brazil; it is the largest refugee support network in Latin America. This study seeks to answer the question with respect to which measures have NGOs adopted to assist the integration and non-discrimination of refugees in the Brazilian labor market and whether such measures reach beyond NGOs role as a support structure by replacing the role of the state and its responsibility to provide refugees of their (human) rights. To answer this research question, eight NGOs and three professionals in the area were interviewed during a field research that took place between July and November 2020. The research shows that the NGOs have taken two categories of measures as a means to address both the refugees, and the host society and private sector with the purpose of enhancing the effect and reachability of their role in the integration and non-discrimination of refugees in the Brazilian labor market. This research found that the NGOs and the public intuitions have a vast network in respect of refugees; however, it can also vary between states. It further found that there are two different opinions among the NGOs regarding their relationship with the state.",['Refugees Brazil Integration Labor Market Discrimination']
TRAIANO OPTIMO PRINCIPI: Een onderzoek naar de dativus in de keizernaam op munten van Trajanus en Hadrianus,"Snoeij, Wieke","['Claes, L.M.G.F.E.']",2021,Faculty of Humanities,Geschiedenis (BA),Bachelor thesis,nl,"Gedurende een groot deel van de regering van Trajanus en het begin van de regering van Hadrianus verschijnt de keizernaam op de keizerlijke muntslag niet in de nominativus, wat voor die tijd gebruikelijk was, maar in de dativus. Dit suggereert dat de munt niet door de keizer, maar voor de keizer werd geslagen. Dit leidt tot de vraag wie of wat de autoriteit achter deze munten was. In mijn scriptie heb ik deze vraag beantwoord door deze dativusmuntslag in kaart te brengen, waardoor aan het licht kwam dat de letters S P Q R (Senatus Populusque Romanus), de senaat en het volk van Rome, bijna exclusief op de dativusmuntslag van Trajanus aanwezig waren. Dit leidde tot de conclusie dat met de dativusmuntslag werd beoogd de boodschap te verspreiden dat Trajanus een goede keizer was die rekening hield met het volk en de senaat. Vervolgens heb ik gekeken wie of wat de autoriteit achter deze munten kon zijn, waarbij ik de conclusie heb getrokken dat het een soort evenwicht is, met soms de keizer die meer invloed had en soms de senaat of de muntmagistraten. Dit was afhankelijk van de aan/-afwezigheid van de keizer en de positie van individuele magistraten. De dativusmuntslag van Hadrianus heeft een andere oorzaak, omdat die in het begin de muntslag van Trajanus imiteerde, waarbij zowel zijn keizertitels als de dativus werd overgenomen. Hier is de autoriteitsvraag moeilijker te beantwoorden, maar de afwezigheid van Hadrianus ten tijde van deze muntslag suggereert een autoriteit van senaat en van muntmagistraten.","['Trajanus', 'Hadrianus', 'keizerlijke muntslag', 'dativus', 'senaat: muntmagistraten']"
A Change of Dominant in Rushdie's Recent Fiction: An Analysis of The Golden House and Quichotte,"Bavelaar, Tom","['Liebregts, P.T.M.G.', 'Newton, M.S.']",2021,Faculty of Humanities,Literary Studies (MA),Master thesis,en,,"['Rushdie', 'postmodernism', 'Quichotte', 'Golden House', 'metamodernism', 'post-postmodernism', 'Ding an sich', 'reality', 'truth']"
Nostalgia in Ladakh: Reproducing the past in the present,"Kaur, Sidak","['Wickramasinghe, Nira']",2021,Faculty of Humanities,Asian Studies (60 EC) (MA),Master thesis,en,,"['nostalgia', 'cultural reproduction', 'memory', 'identity', 'local agency', 'cultural transmission', 'regional histories', 'local histories', 'area studies', 'memory studies', 'social and cultural anthropology']"
The Energy Dragon: a Comparison between China's Efforts to Green its Domestic Power Sector and Chinese OFDI in Energy,"Di Teodoro, Giulia","[""Dr. Ingrid M. A. d'Hooghe""]",2021,Faculty of Humanities,International Studies (BA),Bachelor thesis,en,"The present research analyzes, compares and discusses China’s efforts to green its domestic power sector and Chinese outward foreign direct investment (OFDI) in energy between 2013 and 2018. Chinese policies, regulations and guidelines concerning both are considered. Both quantitative data and qualitative data is included in the discussion. Green economics and green development are the lens through which the findings have been observed and interpreted. The ultimate result of the research is that, even though the power mix of Chinese OFDI in energy in 2018 had a higher percentage of renewable energy than China’s domestic power mix (37% versus 12%), the policies regulating China’s power sector are tailored to make it green, namely by reducing the consumption and production of fossil energy and greenhouse gas (GHG) emissions, and increasing the share of renewable energy in China’s total energy mix. On the other hand, guidelines concerning the environmental dimension of Chinese OFDI do not make any concrete and enforceable efforts to green investments. Only the policies aimed at encouraging OFDI in renewable energy seem to have the effect of greening Chinese OFDI in energy.","[""People's Republic of China"", 'outward foreign direct investment', 'energy', 'green energy', 'green economics.']"
'Geen onbenullig leerstuk' Over de taalopvattingen van Prodicus en Plato,"Visser, Hilde","['Berg, R.M. van den']",2021,Faculty of Humanities,Griekse en Latijnse taal en cultuur (BA),Bachelor thesis,nl,,"['Plato', 'Prodicus', 'taalopvattingen', 'taal']"
Displaying Dysfunctionality: How Interactive Narratives Can Aid in the Representation of a Schizophrenic Disorder,"Lammertink, Simone","['Houwen, J.J.M.']",2021,Faculty of Humanities,Media Studies (MA),Master thesis,en,,
Japanese rap tactics,"Kuivenhoven, Samuel","['Berlo, M. J. van']",2021,Faculty of Humanities,Japanstudies (BA),Bachelor thesis,en,,
The Affective Sign: Form and Affect in the Cinema of Béla Tarr,"Henselmans, Jakob",['Ernst van Alphen'],2021,Faculty of Humanities,Film- en literatuurwetenschap (BA),Bachelor thesis,en,,"['Form', 'affect studies', 'Béla Tarr', 'Eugenie Brinkema', 'Jacques Rancière', 'formalism', 'semiotics']"
"Beauty, Nationalism and History: The Reality of Historical TV Dramas: A Case Study on Disneyfication, Disneyization and Nationalism in The Korean Historical TV Drama Mr. Sunshine","Troost, Gabriela","['Jang, S.Y.']",2021,Faculty of Humanities,Asian Studies (60 EC) (MA),Master thesis,en,,"['history', 'heritage', 'south korea', 'korea', 'TV drama', 'costume drama', 'historical drama', 'nationalism', 'disneyization', 'disneyfication']"
The Relation of the State and the Indigenous Movement in Colombia: Between the Position of the Indio Permitido and Violent Repression,"Milani, Olivia Anna Charlotte","['Valdivia Rivera, S.']",2021,Faculty of Humanities,International Studies (BA),Bachelor thesis,en,,
Fossil Fuels in the Age of Energy Transition: How GCC Countries Are Engulfed in New Dynamics,"Aliyari, Nikki","['Forough, M.']",2021,Faculty of Humanities,Middle Eastern Studies (MA),Master thesis,en,,
De Invloed van de Kim-Trump ontmoetingen van 2018 en 2019 op Shinzo Abe’s Noord Korea beleid,"Goudsblom, Pepijn","['Saori, S.']",2021,Faculty of Humanities,Japanstudies (BA),Bachelor thesis,nl,,"['Shinzo Abe', 'Japans North Korea Policy', 'Kim & Trump']"
Reinventing Hinduism: The Hindutva Discourse on (Re)conversion,"Bethlehem, Marijn","['Gupta, R.']",2021,Faculty of Humanities,Asian Studies (60 EC) (MA),Master thesis,en,,"['Hinduism', 'Hindutva', 'Nationalism', 'India', 'Conversion', 'Reconversion', 'Asian studies', 'Religious studies', 'Critical Discourse Analysis']"
Im Osten Nichts Neues: A perspective on a potential alliance between the Russian Federation and the Chinese Republic,"Pierandrea, Papa",['A.M.M. Rogstad'],2021,Faculty of Humanities,International Studies (BA),Bachelor thesis,en,,
"Avengers Explored: Iron man and Captain America : a study in transmedia, additive comprehension and additive mystery","Snepvangers, Olivier","['--, --']",2021,Faculty of Humanities,Media Studies (MA),Master thesis,en,,"['MCU', 'Transmedia Storytelling', 'Additive Comprehension', 'Additive Mystery']"
Yellow Power: Understanding Asian American in the Third World Liberation Front Strike in Berkeley,"Wu, Xialei",['William Michael Schmidli'],2021,Faculty of Humanities,North American Studies (MA),Master thesis,en,,"['Asian American activism', 'self-determination', 'TWLF strike in U.C. Berkeley', 'yellow identity']"
Sustainability in the Japanese Coffee Market: What is motivating large Japanese companies to bet on sustainability?,"Rijnties, Mark",['S. Shibata'],2021,Faculty of Humanities,Asian Studies (60 EC) (MA),Master thesis,en,,"['coffee', 'sustainability', 'japan']"
Detached Compassion: A Buddhist Alternative to Biased Empathy,"Dijkstra, Zonne","['Harris, S.E.']",2021,Faculty of Humanities,Filosofie (BA),Bachelor thesis,en,,
How Art Can Contribute to Our Understanding of Rape? Rape Images of La Primavera (1480) and Caroline (2012),"Ustay, Ipek","['Fedorova, K.']",2021,Faculty of Humanities,Kunstgeschiedenis (BA),Bachelor thesis,en,,
To what extent is the introduction of the European Public Prosecutor's Office a step forward for the process of integration in the European Union?,"Lucà, Arianna",['Dr. J.S.Oster'],2021,Faculty of Humanities,International Relations (MA),Master thesis,en,,
"The development of the female gender role in animated Disney princess films: Sleeping Beauty (1959), Pocahontas (1995) and Moana (2016)","Terpos, Nikita","['Leeuwen, E.J. van']",2021,Faculty of Humanities,Engelse taal en cultuur (BA),Bachelor thesis,en,,"['Disney', 'female', 'feminism', 'film', 'female role']"
Charting a new course or running aground? A systematic evaluation of Aaron James’ theory of fairness in trade,"Spruit, Nico","['Verbeek, B.J.E.']",2021,Faculty of Humanities,Philosophy (MA) (60 EC),Master thesis,en,,"['Distributive justice', 'fairness in trade', 'Aaron James', 'cosmopolitanism']"
EU Enlargement in far-right Eurosceptic discourse: A comparative analysis of the positions of the French Rassemblement National and the Dutch Partij voor de Vrijheid on EU Enlargement,"Oosterom, Elise",['Dr. D.M. Oude Nijhuis'],2021,Faculty of Humanities,International Relations (MA),Master thesis,en,,"['European Union', 'Enlargement', 'Euroscepticism', 'far-right political parties', 'Turkey']"
"The Construction and Conceptualisation of the Citizenship Boundaries: The development of the criteria for membership and entry of the Dutch Nation-state, 1880-1914","Köbben, Luc",['L. Lucassen'],2021,Faculty of Humanities,History (MA),Master thesis,en,"This thesis seeks to investigate the construction and the conceptualisation of the Dutch citizenship boundaries in the period 1880-1914. These boundaries are analysed by focusing on nationality, naturalisation, and expulsion policy, that determined the criteria for membership and entry. As a result of the rise of nation-states, citizenship was transformed into a crucial marker of identification, not only determining criteria of membership and entry, but also that of residence and work. This transformation began at the end of the nineteenth century. The primary sources consist of parliamentary debates, and correspondence between parliament and government, which illuminate the development of policy and the conceptualisation of citizenship. These sources were selected through query analysis. Furthermore, a selection of expulsion orders was collected to investigate the relatively unknown practice of expulsion policy. Both the criteria of membership and entry became more strict and demarcated. Immigrants and their offspring became largely excluded from citizenship through a new nationality law, and an increasing amount of ‘unwanted’ and lower-class aliens was controlled and expelled. A relational approach illuminated that state and society constructed the citizenship boundaries in interaction, and that the citizenship boundaries were constructed in relation to that of other countries, most notably Germany. The development of the citizenship boundaries at the end of the nineteenth century is analysed in detail, which had important influences on issues of membership and entry in later periods.","['Citizenship', 'Dutch national identity', 'Naturalisation', 'Expulsion']"
Bumpy Rides: A stakeholder approach to regulatory showdowns between incumbent corporations and platform challengers: evidence from Uber Challenges of the taxi industry,"Vlierhuis, Pieter",['Dr. Jonathan London'],2021,Faculty of Humanities,International Relations (MA),Master thesis,en,,"['Regulatory Politics', 'Platform Companies', 'Political Economy', 'Regulatory Capture', 'Platform Power']"
The Evolution of the Divinatory Professions in First Millennium BCE Mesopotamia,"Jacob, Alison M.",['Natalie May'],2021,Faculty of Humanities,Classics and Ancient Civilizations (MA),Master thesis,en,"This paper explores the evolution of the profession ṭupšar Enūma Anu Enlil and the connection to the decline in the presence of the profession of the ‘haruspex’ or bārû. The focus of the discussion lies during the late Neo-Assyrian period to the Arsacid period and the end of cuneiform documentation (674 BCE -75 AD). The extant cuneiform record of the bārû and ṭupšar Enūma Anu Enlil were used to exemplify scribal development and the melding of divinatory traditions. Social network analysis was employed to show how Neo-Assyrian divinatory scholars in the court of Nineveh interacted with each other. Furthermore, social network establishes how they interacted at court and what they advised on and to whom. Secondly, the evidence of Neo-Babylonian and Late-Babylonian scholars using the titles of bārû and ṭupšar Enūma Anu Enlil and their text corpus were compared. This was assessed to determine the change and shift of the evolution of the divinatory disciplines. It was determined that the different facets of divination were combined by scholars during the first millennium and celestial divination, replacing extispicy as the preferred method of divination. The aim was to show how transmission analysis can facilitate the perception of the decline and emergence of scholarly titles. The intent was to uncover community interaction and the criteria for the evolution of the divinatory profession. By the end of cuneiform documentation many of the practices of the bārû were combined into the practice of the ṭupšar Enūma Anu Enlil, however this varied between different cities in both the title and the mode of scholarly interpretation.","['Divinatory professions', 'ṭupšar Enūma Anu Enlil', 'bārû']"
Indonesian Foreign Fighters: Is denied repatriation the right option?,"Pagani, Zoe Ms",['Irene Hadiprayitno'],2021,Faculty of Humanities,International Studies (BA),Bachelor thesis,en,,"['Indonesia', 'Foreign Fighters', 'Foreign Fighter Returnees', 'ISIS']"
Stuck in the in-between: Eritrean refugees stuck in the limbo of the Sudanese and Ethiopian refugee camps and the asylum seekers centres of the Netherlands,"Doorn, Job van",['M.C. Wilson Janssens'],2021,Faculty of Humanities,International Studies (BA),Bachelor thesis,en,"Large numbers of Eritrean refugees find themselves in situations of limbo at multiple stops in their journeys to flee the repressive environment of Eritrea. The situations of limbo have been analyzed by drawing from theories of mobility and liminality. First, the situations in the refugee camps and the AZCs have been analyzed through a spatial and a temporal dimension of liminality. Secondly, the situations of limbo have been analyzed as connected to theories of mobility, and especially immobility by investigating what influences migratory routes. In the refugee camps of Northern Ethiopia and The Sudan, Eritrean refugees find themselves pushed to the edges of society, unable to participate. Similarly, the Eritrean refugees that are resettled to the Netherlands, find themselves in the same kind of in-betweenness in the Dutch asylum seekers centres (AZCs), waiting for approval while being prevented from participating in Dutch society. Furthermore, in this paper it has been argued that the Eritrean refugees are kept in limbo, in remote locations from as a result of the policies that an international mobility regime, in the form of the European Union that interacts with the African states with the goal of hindering border-crossing mobility. Within nations too, the mobility of the refugees in limbo are extremely restricted, being confined to the camps and the AZCs.","['Liminality', 'Mobility', 'Mobility regimes', 'Eritrean refugees']"
