title,author,supervisors,date,faculty,program,type,language,abstract,keywords
"‘Europe is not for me!’ Exploring the relationship of mobility and entrepreneurship in Bole Michael in Addis Ababa, Ethiopia","Mohamed, Habon","['Mous, M.P.G.M.']",2020,Faculty of Humanities,African Studies (MA),Master thesis,en,"This research presents and analyses how Bole Michael, Addis Ababa functions in Somali mobility and the role of Somali entrepreneurship in this area. Moreover, it aims to avoid going along with popular notions and conventional theories on Somalis and entrepreneurs. Henceforth, this research uses literature that fits the context of Somalis in Addis Ababa, Ethiopia. Furthermore, this study shows that Somalis in Bole Michael do not identify as refugees, which contradicts the simplified paradigm illustrated by existing literature on Somalis in Bole Michael. Nevertheless, it reveals that Bole Michael functions as a transit hub for various Somali migrants moving through Bole Michael to Europe and North America. Additionally, Somali enterprises in Bole Michael are service-based and offer services that assist the journey undertaken by migrants, such as; guesthouses, money transfer operators and restaurants. Accordingly, this research argues that Somali businesses sustain and stimulate international Somali mobility. This thesis concludes with suggestions for further research that studies the stimulating effect of money transfer companies on illegal migration among Somali youth.","['Ethiopia', 'Somali', 'Entrepreneurship', 'Mobility', 'Community.']"
Korean verbs of perception,"Ravenhorst, Jeroen van","['Ameka, Felix K.']",2020,Faculty of Humanities,Taalwetenschap (BA),Bachelor thesis,en,"This thesis is a descriptive account of the form, function, and meaning of Korean verbs of perception in the modalities of SIGHT, HEARING, TOUCH, FEEL, TASTE and SMELL. I categorize the perception verbs by means of Viberg’s (1983) dynamic system of perception events, distinguishing ACTIVITIES, EXPERIENCES and STATES for each of the six modalities. Focussing on experiencer-based expressions, I find that Korean verbs of SIGHT, HEARING, FEEL, and SMELL do not lexically distinguish between an ACTIVITY and an EXPERIENCE. Stimulus-based verbs derive from experiencer-based basic verbs by means of middle marking. I also find that Korean obligatorily requires a perceived stimulus rather than a source in the domains of HEARING, FEEL, TASTE, and SMELL. Furthermore, an introductory review of the literature on intrafield ‘polysemy’ reveals inconsistencies in the hierarchical models of perception verbs. I put forward a new model that unifies earlier proposals and includes the extensions from SIGHT to TASTE and FEEL to TASTE found in Korean. Examples were retrieved from the highly contemporary VLIVE (2020) spoken corpus as well as various non-spoken corpora, accessed through the online NAVER Korean-English Dictionary (2020).","['perception verb', 'lexical semantics', 'polysemy', 'typology', 'hierarchy', 'sensory modalities', 'Korean']"
Specialized Language in AVT: The translation of medical terminology in the Dutch subtitles of Grey’s Anatomy,"Ploeg, Hilde van der","['Valdez, S.']",2020,Faculty of Humanities,Linguistics (MA),Master thesis,en,"This thesis analyzes the techniques applied to translate medical terminology in the Dutch subtitles of three episodes of the American medical TV series Grey’s Anatomy (2005-present, Rhimes). The model for analysis is based on the taxonomy of Molina and Hurtado (2002), which distinguishes between fifteen different translation techniques. It was found that, as expected, established equivalents are used most commonly, and that most of these established equivalents are literal translations. This can be explained by three factors: medical concepts and culture are similar in English and Dutch, they have both been strongly influenced by Greek and Latin, and Dutch has been influenced by English as the current lingua franca of medicine. The latter was also supported by the high number of borrowings from English found in the Dutch subtitles. Moreover, it was found that generalization, reduction and amplification are commonly used techniques. These techniques can be part of simplification and explicitation strategies, which confirms the hypothesis that medical texts for a lay audience are de-terminologized. Lastly, the relatively high number of inadequate equivalents has led to a twofold recommendation: the development of specialized AVT training and the compilation of term bases.","['AVT', 'medical terminology', 'subtitling', 'translation', 'de-terminologization']"
"The normative dimension of the EU’s trade policy: High expectations, questionable outcomes?","Hoff, Jochem","['Scepanovic, Vera']",2020,Faculty of Humanities,International Relations (MA),Master thesis,en,"In recent years, the European Commission’s trade policy strategy shifted from the multilateral system towards a more bilateral approach with the new generation FTAs. Furthermore, the strategy shifted the underlying incentives for trade from solely economic interests towards an approach that embraced more normative goals, for example standards for environmental and labor market issues. Within the literature, the debate regarding the nature of the EU’s trade policy contemplates this dilemma and seeks to clarify how Trade and Sustainable Development chapters function within trade policy. The dilemma is what has been described within the literature as the norms versus interests debate. Within this debate, the concepts of Normative Power Europe and Market Power Europe play a central role in defining the identity of the EU’s power. Both concepts have been incorporated within studies into the role of norms and economic incentives within the EU’s foreign policy. A large share of these studies agrees that within trade policy, norms are subordinate to economic incentives. The push for a more normative agenda, however, is gaining traction within the EU and has led to more attention from various actors for normative arguments. In recent years, the mobilization of actors and institutional changes in the process have given more weight to the normative argument. This thesis is thus researching how a more recent agreement has been influenced by this process: the EU-Vietnam free trade agreement. In this case study, it will become evident that the extent to which norms are being incorporated in FTAs and the degree of effectiveness of their enforcement is rather absent. The EP and NGOs voiced concerns regarding human and labor rights at various stages during the process. This led to the Commission developing alternate initiatives to address human rights issues within Vietnam, such as a roadmap within which the Vietnamese committed to ratify conventions of the International Labour Organisation. However, the roadmap is not enforceable through the FTA and other enforcement tools remain relatively weak within the eventual agreement. The conclusion can be drawn that there have been attempts to influence the Commission’s normative agenda through various institutional channels. These attempts at influencing the process might have set a precedent for future FTAs that might become more effective compared to this case.","['EU', 'Trade Policy', 'Vietnam', 'Normative Power Europe', 'Market Power Europe', 'Trade and Sustainable Development']"
Changing Perceptions in a Changing Society: Jane Austen in Revolution and War,"Beek, T.A.M. van","['Newton, M.S.']",2020,Faculty of Humanities,Engelse taal en cultuur (BA),Bachelor thesis,en,,"['Jane Austen', 'French Revolution', 'Revolutionary and Napoleonic Wars', 'Radicalism', 'Conservatism']"
A Divided Island: The Ethnic Conflict Between Turkish and Greek Cypriots,"Azarkan, Ayoub","['Lukac, Morana']",2020,Faculty of Humanities,International Studies (BA),Bachelor thesis,en,,"['ethnic conflict', 'nationalism', 'The Cyprus Conflict', 'Turkish Cypriots', 'Greek Cypriots', 'Cyprus']"
Demystifying Chinese Foreign Policy: A Confucian Approach to International Relations,"Hu, Nian Dong","['Wang, Jue']",2020,Faculty of Humanities,International Studies (BA),Bachelor thesis,en,,"['China', 'foreign policy', 'Confucianism', 'rising power', 'Middle East']"
Teargas and Turmoil: The Hong Kong Perspective on Protest Responses,"Lam, Mansi","['Ghiasy, Richard']",2020,Faculty of Humanities,International Studies (BA),Bachelor thesis,en,,"['Hong Kong', 'protests', 'legitimacy', 'public opinion']"
De representatie van de elite vrouw in de islamitische kunst,"Bieman, Flora den","['Damme, W.J.L.M. van']",2020,Faculty of Humanities,Kunstgeschiedenis (BA),Bachelor thesis,nl,,"['Iran', 'islamitische kunst', 'vrouw', 'representatie', 'schilderkunst', 'tekenkunst']"
Power Projection through Protection: Russia’s Middle East Policy as a Repetition of its Central Asian Security Imperialism,"Buuren, Sterre van","['Skalamera, Morena']",2020,Faculty of Humanities,International Studies (BA),Bachelor thesis,en,,"['Russia', 'Middle East', 'Central Asia', 'Russian Foreign Policy', 'Syria', 'Security']"
Socio-Political Anxieties in Dystopian Novels at the Outset and Close of the 20th Century: The Case of The Iron Heel and The Handmaid’s Tale,"Bouzid, Nasr","['Leeuwen, Evert Jan van']",2020,Faculty of Humanities,Engelse taal en cultuur (BA),Bachelor thesis,en,,"['Dystopia', 'The Iron Heel', ""The Handmaid's Tale"", 'Popularity', 'Dystopian genre', '20th Century']"
SINO-TURKISH COOPERATION - IMPACT ON THE TURKISH ENERGY AND TRANSPORT SECTOR,"Schwartz, Juri","['Immerzeel, Mat']",2020,Faculty of Humanities,International Studies (BA),Bachelor thesis,en,,"['China', 'Turkey', 'Energy', 'Transport', 'Sustainability']"
Op weg naar een deugdzame democratie: Een analyse van democratische deugden als aanvulling op de normatieve gebreken van de moderne liberale democratische samenleving,"Louer, Bibiana Helena","['Haas, Frans de']",2020,Faculty of Humanities,Wijsbegeerte (BA),Bachelor thesis,nl,"In “The Dialectics of Secularization: On Reason and Religion” (2006) wordt de discussie tussen Jürgen Habermas en de Paus Benedictus XVI weergegeven, waarin zij naar gemeenschappelijke grond zoeken in hun betrokkenheid met het welzijn van de geseculariseerde liberale Westerse democratische samenleving. Voortbouwend op deze betekenisvolle dialoog breng ik Habermas opnieuw in gesprek met de “belichaming van Katholieke orthodoxie”, deze keer in de persoon van Thomas Aquinas. Het doel van mijn onderzoek is het beantwoorden van de vraag: In hoeverre kan een democratische deugdenleer die gebaseerd is op de Christelijke filosofie van Aquino als aanvulling dienen voor de normatieve gebreken van de moderne seculiere liberale democratische samenleving? Deze vraag beantwoord ik voornamelijk aan de hand van Aquino’s verhandelingen over het koningschap en over de wet, enkele essays van Habermas, het debat tussen Habermas en Benedictus XVI en Jennifer Herdt’s analyse van democratische deugden. Overeenkomstig met Aquino’s waarschuwingen voor tirannie beweert Habermas dat de liberale democratie middels doorgevoerde secularisering onder de heerschappij van het decisionistische model van een verzelfstandigde marktwerking is beland. Dit culmineert volgens hem in een maatschappij waarin de technische rationaliteit in naam van waardevrijheid haar eigen waardesysteem dicteert. Habermas roept daarom op tot de toepassing van politieke deugden als geneesmiddel voor de afbrekende maatschappelijke eenheid. Jennifer Herdt biedt hier een praktische invulling voor in de vorm van democratische deugden, die gebaseerd zijn op Thomistische deugdenleer. Hoewel Aquino geen voorstander was van democratie, hoeft dat volgens Habermas en Herdt niet te betekenen dat zijn gedachtegoed onbruikbaar is binnen de seculiere democratie. Zowel Christelijke als niet-Christelijke burgers kunnen vergelijkbare (burger)deugden inzetten om gemeenschappelijke doeleinden na te streven, zonder elkaars interpretaties van het gemeenschappelijk goede te devalueren. Zodoende kan het gebruik van hun gedeelde normatieve erfgoed democratie bevorderen en normatieve stabiliteit in een pluralistische samenleving in stand houden. Dit verzoek tot civiele samenwerking vormt een eerste stap richting de herwaardering van deugden en een herstel van een gefragmenteerde samenleving.","['Aquinas', 'Habermas', 'Benedictus XVI', 'monarchie', 'liberale democratie', 'Christendom', 'deugden', 'deugdenleer', 'burgerdeugden', 'technocratie']"
A Critical Assessment of Habermas's View on the Tension between the Rule of Law and Popular Sovereignty,"Velde, Rosa van der","['Fossen, Thomas']",2020,Faculty of Humanities,Philosophy (MA) (120 EC),Master thesis,en,,"['Habermas', 'Philosophy of Law', 'Rule of law', 'Popular sovereignty']"
Pascua Lama: The Evolution of the Chilean Environmental Regime through the Lens of the Ecological Modernization Theory,"Posthuma, Jelle","['Churampi, A.I.']",2020,Faculty of Humanities,International Studies (BA),Bachelor thesis,en,,
The Kataëb Party: A Certain Conception of Lebanon,"Uzgen, Raphaël","['Immerzeel, M.']",2020,Faculty of Humanities,International Studies (BA),Bachelor thesis,en,,
‘Om het leven te verlenghen’: Books of Secrets in the Northern Netherlands,"Walvius, Lotte","['Hoftijzer, P.G.']",2020,Faculty of Humanities,Media Studies (MA),Master thesis,en,,"['Books of Secrets', 'Natural Magic', 'Recipes', 'Seventeenth Century', 'Dutch Republic', 'Secreetboeken']"
"Phonetic transfer of diphthongisation of [eː], [oː], and [øː] in Dutch Learners of L2 German","Fuhrmann, Elisa Geertruida","['Smakman, Dick']",2020,Faculty of Humanities,Linguistics (MA),Master thesis,en,"This thesis examines to what extent the long midvowels [eː], [oː], and [øː] are diphthongised in L1 Dutch and whether phonetic transfer of these diphthongisation patterns from L1 Dutch to L2 German occurs. In order to collect data to answer the research questions, two recorded scripts, one in L1 Dutch and one in L2 German, from 29 participants between 18 and 25 years old are analysed. The script involves 15 words, five per phoneme, in both languages. These phonemes are measured for their vowel duration and the corresponding formant values for F1 and F2 at 25% and 75% of the vowel duration. In doing so, figures are constructed signifying a line of diphthongisation for each phoneme. Additionally, the data are analysed per word and per participant, and are compared to the average results of all participants together. The results suggest that the phonemes [eː], [oː], and [øː] are diphthongised in L1 Dutch and that phonetic transfer occurs as predicted by Flege’s (1988, 1990, 1991, 2007) Speech Learning Model.","['diphthongisation', 'L1 Dutch', 'L2 German', 'phonetic transfer', 'long midvowels', 'formants', 'F1', 'F2', 'vowel duration', 'audio files', 'speech learning model', 'sociophonetics']"
A new Global South Perspective to Peacebuilding,"Fakkel, Chiara","['Gawthorpe, A.J.']",2020,Faculty of Humanities,International Relations (MA),Master thesis,en,"In the past couple of decades, the shared belief in peacebuilding has eroded. The failure from Western countries to deliver peace has led to a lot of criticism towards Western peacebuilding missions. The criticism was aimed at the fact that most Western peacebuilding approaches only focus on the implementation of liberal values. Whereas these values have proven to be successful in Western countries, the implementation of these values will not automatically create a peaceful situation in other countries. Therefore, more countries from the global South have expressed their interest in establishing a new and innovative peacebuilding approach which can be applied to non-Western countries. This thesis will therefore focus on the differences between peacebuilding approaches from the Global South and the Western peacebuilding approach. By looking at different International Relations (IR) theories related to peacebuilding and by analysing peacebuilding mission from the US, The Netherlands and South Africa, this thesis will contribute to exploring the differences between both approaches to peacebuilding and understanding what is the cause of these differences. The origin of these different peacebuilding approaches can be found in the different political and historical context of the countries, which has led to the establishment of Western ideology and a Pan-African ideology in their peacebuilding approaches.",['A comparison of the South African peacebuilding approach and the Western peacebuilding approach']
"Esoteric and ritual practices in the Liberian Civil War, c.1989-2003","Hietbrink, Pam","['Nkwi, Walter Gam']",2020,Faculty of Humanities,Afrikaanse talen en culturen (BA),Bachelor thesis,en,,
Addressing Sexual Violence in the Post-War Context: An Unfinished Agenda,"Camara, Rachel Linda","['Links, Stacey']",2020,Faculty of Humanities,International Studies (BA),Bachelor thesis,en,"Previous academic research has operated in a paradigm whereby women, the raped, are pitted against men, the aggressor, meanwhile this research is slightly more complex. This thesis aims to investigate if the victim's rights are honoured, not just in practice but most importantly in reality - is justice truly received? The paper seeks to reveal this through feminist literature in understanding justice. Two particularly interesting cases to which gender-based atrocities took place, were the Japanese Imperial Army’s sexual slavery and prostitution of Korean women in The Second World War (hereafter, WWII) and Jean-Pierre Bemba Gombo of the Democratic Republic of Congo (hereafter DRC) involvement in war crimes having taken place during the Second Congo War in 2002. Both cases pursued different justice mechanisms. The case of Japan-Korea adopted a reconciliation process they having only recently confronted their war past, while Bemba faced the International Criminal Court being trailed for crimes against humanity. The dominant narrative dealing with sexual crimes in the post-war era are present in both cases of Japan-Korea and Congo, and employ similar motifs where the prosecution rests after charging those accused. Without carrying out further inquests to support and determine justice for the victims and further their integration within society. This begs the question: Who actually benefits from the current justice system? To what extent do these opposing techniques ultimately provide justice for the victims and in changing the justice system? And what are the factors prohibiting justice? These sub-questions are important as they break down and help answer the broader research question of: To What Extent do Current Post-Conflict Justice Mechanisms Provide Justice for Victims of Sexual Violence During Armed Conflict in the Cases of The DRC and Japan-Korea?","['Sexual violence', 'Rape as a weapon of War', 'Japan', 'Justice mechanisms', 'Post-conflict justice', 'Feminist alternatives', 'Bemba case', 'Democratic Republic of Congo', 'Democratic Republic of Korea', '""Comfort women\'']"
US Foreign Policy Change Towards Hong Kong and the Hong Kong Human Rights and Democracy Act,"Martin, Xiaoxue","[""d'Hooghe, Ingrid""]",2020,Faculty of Humanities,International Relations (MA),Master thesis,en,"This thesis uses Hermann’s (1990) model of foreign policy change to analyse the research question: Why was the Hong Kong Human Rights and Democracy Act only adopted into public law in November 2019, despite its introduction into US legislation years earlier in 2014? Through tracking the progress of the Hong Kong Human Rights and Democracy Act (HKHRDA) from its introduction in 2014 to its final signing into law in 2019, it has shown that bureaucratic advocacy and external shocks were the primary change agents driving the foreign policy change. Previous versions of the bill failed to pass the final stages of the decision-making process. However, in 2019, changes in the international context were crucial to the passing of the bill. That year, the external shock of the Hong Kong protests escalated to such an extent that Congressional legislators felt compelled to unite and take action. Rising geopolitical tensions between China and the United States also affected domestic American politics, contributing to the growing bipartisan Congressional support for a stronger stance against China on the issue of Hong Kong and pass the HKHRDA into law, despite resistance from the Trump administration. The symbolic value of the law was greater than its actual changes to US legislation, as it did not grant the government new instruments of statecraft it did not already possess. Still, the law was a clear show of Congressional support for the pro-democracy activists in Hong Kong, and a political statement against the central Chinese and Hong Kong government’s policies in the city. This was instrumental in pushing the administration to change its approach towards HK, and with the HKHRDA, US HK policy became submerged in its American foreign policy towards China.","['Hong Kong', 'United States', 'Foreign policy change', 'Human Rights', 'China']"
China in Nigeria: beyond a conventional narrative of neo-colonialism,"Gils, Amber van","['Williams, Corey L.']",2020,Faculty of Humanities,International Studies (BA),Bachelor thesis,en,,"['South-South cooperation', 'China-Nigeria relations', 'Neo-colonialism', 'China in Africa']"
Bachelor Thesis: The Utopia of the Republic of Albasheer: The Power of Humor in Present-Time Iraqi Political Culture,"A'mema, Fee","['Omari, Haneen']",2020,Faculty of Humanities,International Studies (BA),Bachelor thesis,en,,"['Humor', 'Iraq', 'Albasheer Show', 'Corruption', 'Power of Humor', 'Political Corruption', 'Alternative Media']"
"Aeneas Uxorius: Genre en gender inversie in Catullus, Propertius en Vergilius","Baars, Birgit","['Wessels, A.B.']",2020,Faculty of Humanities,Griekse en Latijnse taal en cultuur (BA),Bachelor thesis,nl,"In boek 4 van Vergilius' Aeneis wordt Aeneas door Mercurius 'uxorius' genoemd, de slaaf van zijn echtgenote (Dido). In moderne termen zou dit gender inversie genoemd worden, het toedichten van traditioneel met vrouwen geassocieerde kenmerken, zoals gedrag en karaktereigenschappen, aan mannen en vice versa. Gender inversie staat centraal in niet-epische genres, en komt met name terug in het werk van Catullus en in de Romeinse liefdeselegie. Waarom wordt Aeneas, de voorvader van de Romeinen, door wie Augustus’ goddelijke afkomst wordt verankerd, onderdanig en feminien weergegeven? Aan de hand van exemplarische gedichten van Catullus en Propertius wordt onderzocht hoe gender inversie binnen een heldenverhaal past. Tevens wordt het vraagstuk behandeld in hoeverre Vergilius andere genres, zoals lyriek en elegie, heeft willen adresseren in zijn epos: in hoeverre is gender inversie gebonden aan een bepaald genre, en duidt de uitwisseling van genderrollen in Vergilius’ Aeneis op genre-onderhandeling?","['Gendertheorie', 'Gender inversie', 'Aeneis', 'Propertius', 'Catullus', 'Genre-onderhandeling']"
NECROPOLITICS OF MIGRATION: AN ANALYSIS OF BOLSONARO’S PRONOUNCEMENTS AND THEIR INFLUENCE ON MIGRANTS’ LIVES IN BRAZIL,"Zerbini de Carvalho Martins, Cecilia","['Alves Vieira, Eduardo']",2020,Faculty of Humanities,International Studies (BA),Bachelor thesis,en,,"['Necropolitics', 'Migration', 'Critical Discourse Analysis', 'Bolsonaro', 'Brazil']"
"Pardon, mag ik u overtuigen alstublieft? Het gebruik van beleefdheidsstrategieën als strategische manoeuvres bij de verdediging van positief evaluatieve standpunten over ‘-schaamte’-onderwerpen","Vorwald, Anne","['Pilgram, Roosmaryn']",2020,Faculty of Humanities,Nederlandse taal en cultuur (BA),Bachelor thesis,nl,,"['-schaamte', 'strategisch manoeuvreren', 'beleefdheidstheorie']"
"Foreign influences on Transylvania’s political elite, 1559-1602","Tamus, Elvira Viktória","['Rosu, Felicia']",2020,Faculty of Humanities,History (MA),Master thesis,en,,"['Transylvania', 'political elite', 'religious exiles', 'Antitrinitarians', 'academic peregrination', 'Jesuits', 'humanism', ""Fifteen Years' War"", 'Early Modern Central Europe']"
Vysjinski als protagonist in het Moskouse theaterstuk,"Hermans, Wim","['Kern, J.H.C']",2020,Faculty of Humanities,Geschiedenis (BA),Bachelor thesis,nl,,"['Showprocessen', 'Grote Terreur', 'Vysjinski', 'Openbaar aanklager']"
Banning the Bag: The Effectiveness of the Plastic Bag Ban in Kenya,"Looze, Annemiek de","['Smith, Karen']",2020,Faculty of Humanities,International Studies (BA),Bachelor thesis,en,"Plastic carrier bags are a big source of plastic pollution all around the world. To combat environmental degradation, Kenya has adopted a ban on plastic bags in 2017. This action has made Kenya join the forefront of global environmental policy with regards to plastic pollution. Despite the accompanied strict penalties, the Kenyan ban on plastic bags is globally regarded as an environmental success story. Nonetheless, there are various other positive and negative effects of the ban. This thesis examines the social, environmental, and economic effects of the plastic bag ban in Kenya to determine how effective the 2017 ban has been. These three factors are intertwined and affect one another, sometimes leading to indirect negative side effects of an initial positive consequence. Taking all of the effects of the ban into account, this thesis concludes that although the environmental intentions behind the ban were to reach sustainable development in Kenya, there have been many negative consequences of the ban that have lowered its success.","['Environmental policy', 'Political economy', 'Plastic pollution', 'Kenya']"
