title,author,supervisors,date,faculty,program,type,language,abstract,keywords
Boys vs. Girls: A Meta-Analysis Investigating Sex Differences in Self-Regulation and EmotionRegulation,"Fiorentino, Chiara","['Wierenga, L.']",2022,Faculty of Social & Behavioural Sciences,Psychologie (BSc),Bachelor thesis,en,"The aim of this quantitative meta-analysis was to investigate sex differences in self-regulation and emotion regulation. The reason for investigating these variables is due to the fact that there is a gender gap in academic achievements (Driessen & Van Langen, 2013). Self-regulation is related to academic achievements because it is the ability to regulate one’s behavior according to the demands of one’s environment (Perry et al., 2017). Emotion regulation is also examined in this meta-analysis because previous research has suggested that the way one approaches their academics in terms of emotions can determine how one self-regulates, thus possibly affecting academic achievements (Boekaerts, 2011). The meta-analysis was conducted by collecting all relevant studies from the past 10 years through two separate literature searches for both self and emotion-regulation in the database Web of Science. Participants were ages four to 25. Results showed a significant difference between boys and girls in self-regulation and emotion-regulation. Boys were found to be at a disadvantage for both self and emotion-regulation. Considering that there are significant sex differences in self and emotion-regulation, these factors could be contributing to the current gender gap in education. However, no causal relationships could be established in this meta-analysis.",
Sex difference in Self-regulation and Risk Taking of children and youth: A meta-analysis,"Schwäricke, Kira","['Wierenga, L.']",2022,Faculty of Social & Behavioural Sciences,Psychologie (BSc),Bachelor thesis,en,"Self-regulation and risk taking are among the most thoroughly researched cognitive variables that show sex differences in school settings. For the past decades, girls have been academically outperforming their male counterparts on a global scale. Differences in self-regulation and risk taking could explain the gap in school performance between boys and girls. Thorough research into sex differences in these variables may provide insight that could minimize this gap in school performance. This meta-analysis explores the link between sex differences in school performance and sex differences in self-regulation and risk taking. Additionally, the development of self-regulation and risk taking was examined for each sex. This meta-analysis compares the results of 22 articles for self-regulation and 19 articles for risk taking. Results showed that there is a significant difference in self-regulation with SMD= -.11, 95%-CI [-0.19, -0.03] p = 0.006, and in risk taking with SMD= .19, 95%-CI [0.09, 0.30] p < 0.000. A significant maturation effect was found for risk taking, with SMD= .19, 95%-CI= [0.09, 0.30], p < .000, but not for self-regulation.","['child, adolescent, youth, risk taking, risk seeking, self-regulation, self-discipline, sex, gender']"
Closing the gap: On socioeconomic status influencing the results of educational assessment methods,"Wulff, Remond","['Vandenbroucke, A.R.E.']",2022,Faculty of Social & Behavioural Sciences,Psychologie (BSc),Bachelor thesis,en,"As children start school, more and more emphasis is placed on their academic performance, their cognitive capabilities, and their intelligence. Current forms of intelligence testing – static testing and assessment – have been heavily scrutinised for being biased due to for example the influence of socioeconomic status (SES), leading to unequal educational outcomes. Therefore, different forms of testing – dynamic testing and assessment – are being investigated, with this study focusing on a new form of the Dynamic Screener (DS). This study aimed to investigate the effectiveness of the DS to increase children’s test performance. A second aim of this study was to determine the predictive value of SES for learning potential and DS outcomes. Participants included 52 children (mean age = 13.14) in the first year of secondary school. The study employed a single-session experimental test-training-test design. Half of the children (n= 27) received a graduated prompts training between the pre-test and post-test, while the other half (n= 25) were the control group and did not receive the training. Five different tests were administered, including a test for working memory, mathematics, language, planning, and inductive reasoning. No significant results were found for trained participants’ performance in comparison with the control group on any of the subtests. Furthermore, no significant difference was found for the predictive value of SES for learning potential, nor for results on pre- versus post-test for the training group. Overall, no definitive conclusions on the effectiveness of the DS, nor on the predictive value of SES for learning potential and DS outcomes, can be drawn from the current study. Future research is needed to determine whether these results are due to the small sample size or are inherent to the DS.","['Dynamic Testing', 'Dynamic Screener', 'Dynamic Assessment', 'Static Testing', 'Static Assessment', 'SES', 'Socioeconomic status', 'educational assessment', 'cognitive capabilities', 'intelligence', 'intelligence testing']"
Varenkamp-Michelle-s2212498-BA thesis-B37-2022,"Varenkamp, Michelle",['Dr. F de Vos'],2022,Faculty of Social & Behavioural Sciences,Psychologie (BSc),Bachelor thesis,nl,,"['Alzheimer', 'RS-fMRI', 'accuratesse']"
Does anxiety mediate the association between attentional bias and pruritus?,"Patera, Elissavet","['Becker, J.']",2022,Faculty of Social & Behavioural Sciences,Psychologie (BSc),Bachelor thesis,en,"Itch or pruritus attains an innate defence mechanism of the body, serving as an alarm response to damage or harm. A selection of past research indicated that individuals experiencing pruritic symptoms due to a dermatological condition, express selective attentional focus (attentional bias) towards itch. The alarming effect of a pruritic sensation, is potentially pursued by a fear response, which metamorphizes into anxiety. It is often suggested that heightened anxiety follows selective attention to the intimidating, theoretically provoking, stimulus. Anxiety aggravates itch, resulting in a vicious cycle, feasibly by potentiating itch-related anxiety. The rationale of this research lies in unravelling the impact of the psychopathological trait of anxiety, behind both attentional bias and pruritus. It is hypothesized that patients with chronic itch who experience heightened anxiety, report more attentional bias towards itch-related stimuli compared to less anxious patients with chronic itch. The sample consisted of 5 participants with chronic itch symptomatology that were assessed on a spatial cueing task. The statistical assessment was comprised of a mediation analysis. Our results were not in line with our hypothesis. In other words, a non-significant relationship was found between attentional bias and itch, attentional bias, and anxiety as well amongst anxiety and itch. Furthermore, we conclude that either our results do in fact reflect the reality of an inexistent relationship or that specific parameters of the methodology resulted in non-significant findings. Future implications are directed towards a more appropriate population sample and the careful consideration of exclusion criteria from the study.","['Pruritus, itch, attentional bias, anxiety, attentional bias towards itch, mediation']"
"COVID-19 vaccinaties: Hoe morele overtuigingen tot gepolariseerde relaties leiden. Een survey onderzoek naar de samenhang tussen morele overtuigingen, sociale afstand, boosheid en attitudesterkte.","van den Beemt, Michelle",['Dr. Coen Wirtz'],2022,Faculty of Social & Behavioural Sciences,Psychologie (BSc),Bachelor thesis,nl,"Deze studie (N = 187) onderzocht middels een survey in hoeverre morele overtuiging leidt tot sociale afstand van mensen met een tegengestelde morele overtuiging op gebied van vaccineren tegen COVID-19. Er is onderzocht of boosheid en attitudesterkte een mediërende rol spelen bij deze relatie. De resultaten laten geen relatie zien tussen morele overtuiging en sociale afstand, maar suggereren wel een indicatie voor het vinden van een relatie bij gebruik van een andere schaal voor sociale afstand. Op basis van bestaande literatuur werd deze relatie wel verwacht. Er is geen mediërende rol van boosheid gevonden op de relatie tussen morele overtuiging en sociale afstand. Ook deze rol werd verwacht naar aanleiding van eerder onderzoek. Er is daarentegen wel een mediërende rol van attitudesterkte gevonden op de relatie tussen morele overtuiging en sociale afstand. Dit komt overeen met de verwachtingen naar aanleiding van bestaande literatuur. Dit onderzoek zorgt voor beter inzicht in de universaliteit van de relatie tussen moraliseren en polarisatie en voor waarom vaccineren tegen COVID-19 een onderwerp is dat snel polariseert.",
De therapeutische relatie in de interculturele context: De invloed van een cultuurverschil in de dimensie individualisme op de therapeutische relatie,"Brinkmann, Eva","['Henkelmann, J.R.']",2022,Faculty of Social & Behavioural Sciences,Psychologie (BSc),Bachelor thesis,nl,"Een belangrijk aspect van psychotherapie, die de resultaten ervan kan beïnvloeden, is de therapeutische relatie. Door een toename in multiculturalisme, vindt psychotherapie vaker in een interculturele context plaats en kunnen er complicaties ontstaan. Dit exploratieve onderzoek kijkt naar de interculturele therapeutische relatie. Er wordt specifiek onderzoek gedaan naar de invloed van een cultuurverschil in individualisme en collectivisme, tussen de cliënt en therapeut, op zowel de kwaliteit van de algehele relatie en ‘de werkwijzeconsensus’. De werkwijzeconsensus is de overeenkomstigheid tussen de cliënt en therapeut in de gewenste werkwijze tijdens de therapie. Therapeutische relaties met en zonder cultuurverschillen zijn met elkaar vergeleken. Hiervoor is een culturele afstand index bedacht, die het culturele verschil tussen cliënt en therapeut kwantificeerbaar maakt. Dit is onderzocht middels een (Engelstalige) vragenlijst bestaande uit: de cliëntversie van de ‘California Psychotherapy Alliance Scales’ (CALPAS-P) aangevuld met eigen vragen. De steekproef bestaat uit 101 respondenten tussen de 18 en 65 jaar, die ambulante zorg in de vorm van psychotherapie gebruik(t)en, en de benodigde vragen beantwoord hebben. De resultaten gaan tegen de verwachtingen in en geen van de nulhypothesen konden verworpen worden. Er zijn dan ook op basis van dit onderzoek geen duidelijke conclusies te trekken over de invloed van culturele afstand (in de dimensie individualisme-collectivisme), op zowel de kwaliteit van de therapeutische relatie als op de werkwijzeconsensus. De resultaten zijn te betwijfelen en vervolgonderzoek is dan ook nodig. Tot slot moet benoemd worden, dat dit onderzoek van correlationele aard is.","['therapeutische relatie', 'interculturele context', 'culturele afstand', 'individualisme-collectivisme']"
The effect of multidisciplinary treatment on dysfunctional behavioural coping in chronic low back pain patients,"Hartog, Melissa","['Van Opstal, T']",2022,Faculty of Social & Behavioural Sciences,Psychologie (BSc),Bachelor thesis,en,,
Het effect van huidige financiële onzekerheid op temporal discounting in de volwassenheid na jeugdarmoede,"Kandhai, Kavita","['Ruigendijk, H.A.H.']",2022,Faculty of Social & Behavioural Sciences,Psychologie (BSc),Bachelor thesis,nl,,
Lichamelijke activiteit en depressieve klachten: hoe zelfvertrouwen een rol speelt. Een empirisch onderzoek naar het effect van de interactie tussen zelfvertrouwen en sporten op depressieve klachten.,"Keessen, Joanna","['Debidin, T.']",2022,Faculty of Social & Behavioural Sciences,Psychologie (BSc),Bachelor thesis,nl,"Depressie is in de huidige maatschappij een veelvoorkomend probleem, die zich vooral onder adolescenten en vrouwen afspeelt. Ondanks de al hoge cijfers van mensen met een depressie, is het werkelijke aantal met depressieve klachten nog vele malen hoger. Een bruikbare interventie hiertegen zou beweging kunnen zijn. Volgens eerder onderzoek zijn factoren die mogelijk nog meespelen zelfvertrouwen en type sport. Vandaar dat in deze studie door middel van vragenlijsten onderzocht werd of de relatie tussen fysieke activiteit en depressieve klachten gemodereerd kan worden door zelfvertrouwen. Ook de relatie tussen type sport en depressieve klachten werd onderzocht. Respondenten (n = 139) tussen de 16 en 61 jaar werden gevraagd naar hun fysieke activiteit (GPAQ), depressieve klachten (PHQ-9) en zelfvertrouwen (SES). Twee multipele regressies zijn uitgevoerd, waarbij er geen significant interactie-effect van zelfvertrouwen op de relatie tussen fysieke activiteit en depressieve klachten werd gevonden (p = .780). Ook is er geen significant verschil gevonden van type sport op depressieve klachten (p = .464). Het effect dat wel significant was, is de relatie van zelfvertrouwen en depressieve klachten (p < .001), wat suggereert dat zelfvertrouwen een belangrijke voorspeller van depressieve klachten is. Een verklaring voor het verkrijgen van niet significante effecten is de selecte steekproef, waardoor de verkregen data verstoord werd. De gevonden resultaten kunnen om deze reden niet gegeneraliseerd worden en moeten bescheiden geïnterpreteerd worden. Vervolgonderzoek kan zich richten op longitudinaal onderzoek op de relatie tussen fysieke activiteit en depressieve klachten met bijbehorende factoren en zal de limitaties van huidig onderzoek moeten corrigeren.","['Fysieke activiteit', 'depressieve klachten', 'zelfvertrouwen', 'type sport']"
Hebben Keuzes die Gemaakt Worden Binnen Onderzoek Invloed op het Resultaat? De Betrouwbaarheid van Emotioneel Bewustzijn als Voorspeller voor Psychopathologie via een Multiverse Analyse,"Haan, Angelle-Lila de","['Heyman, T.D.P.']",2022,Faculty of Social & Behavioural Sciences,Psychologie (BSc),Bachelor thesis,nl,"De betrouwbaarheid van onderzoek is van belang voor de geloofwaardigheid van een resultaat en voor wetenschap als geheel. Transparantie draagt bij aan de betrouwbaarheid van onderzoek. Hierbij is het van belang dat onderzoekers onder andere transparant zijn over analyses en data. Transparantie kan vergroot worden door een multiverse analyse uit te voeren. Bij een multiverse analyse worden de mogelijke combinaties van keuzes, die gemaakt kunnen worden binnen onderzoek, geanalyseerd. In dit bachelorproject is er een reproductie en multiverse analyse gedaan van het onderzoek van Weissman et al. (2020). Hierbij wordt de betrouwbaarheid en de robuustheid van het resultaat onderzocht. Weissman et al. (2020) hebben een relatie gevonden tussen emotioneel bewustzijn en psychopathologie. Bij de reproductie wordt er een ander resultaat gevonden dan Weissman et al. (2020). Dit resultaat laat verder wel een relatie zien tussen emotioneel bewustzijn en psychopathologie. Het onderzoek is niet volledig reproduceerbaar door het gebrek aan transparantie en beschikbare data. De multiverse analyse laat zien dat emotioneel bewustzijn een robuuste voorspeller is voor algemene symptomen van psychopathologie. Echter, blijkt er dat emotioneel bewustzijn wel gecorreleerd is met internaliserende psychopathologie, maar niet met externaliserende psychopathologie. Uit dit bachelorproject blijkt dat transparantie van belang is voor de betrouwbaarheid van onderzoek en de reproduceerbaarheid. Hierbij gaat het over transparantie over de analyses die zijn uitgevoerd en het beschikbaar stellen van ruwe data en syntax. Verder blijkt dat een multiverse analyse inzicht kan geven over de robuustheid van resultaat, maar hierbij ook het theoretisch kader kan verfijnen voor toekomstig onderzoek.","['multiverse analyse', 'reproductie', 'betrouwbaarheid', 'transparantie', 'emotioneel bewustzijn', 'psychopathologie']"
Mannelijke versus vrouwelijke leiders: In hoeverre heeft gender invloed op de (collectieve en individualistische) uitkomsten van groepsonderhandelingen,"Adorf, Sterre",['Dr. Wolfgang Steinel'],2022,Faculty of Social & Behavioural Sciences,Psychologie (BSc),Bachelor thesis,nl,,
Developing an algorithm to estimate the prevalence of replications in psychology,"San Giorgi, Domenico","[""Veer, A. van 't""]",2022,Faculty of Social & Behavioural Sciences,Psychologie (BSc),Bachelor thesis,en,"In the past decade, the importance of replication studies has gained attention in the field of psychology. This led to an increased interest in estimating the rate of replication studies in the field. We explore an alternative approach to estimating the prevalence of replication studies. We constructed a code that counts the occurrences of search terms. To determine which search terms are useful for estimating a replication rate, we used this code on a dataset of 325 publications that were manually coded on whether they were considered replication studies. We were also able to use the word counts to investigate the replication rates per search term, and the role that the frequency of these search terms plays. We found that looking at the frequency of search terms does not help finding replication studies more accurately. However, a single occurrence of a reference, combined with the term “replicat*”, does give a more accurate search when looking for replication studies. In addition, the terms “note”, “reapprais*”, “revis*” and “verif*” seem beneficial to include in a search profile, but our sample data for these terms was too small to be conclusive. To accommodate future research on this topic, we present a search profile and provide a code that can be used in R to determine which search terms can contribute to finding replication studies accurately.",
Do Clothing and Facial Expressions Moderate The Relationship Between Personality Traits and Attractiveness Judgments,"Ozturk, Ada","['Samara, I.']",2022,Faculty of Social & Behavioural Sciences,Psychologie (BSc),Bachelor thesis,en,"Physically attractive people are rated more favorably by others and even have higher personal and professional life success. It has been shown that clothing style and smiling influence attractiveness in previous research; but how about our personality traits? Crucially, our personality traits might also influence our judgements about attractiveness. Our personality traits, especially extraversion and agreeableness, may be effective on whom we find attractive and may explain the reason behind it. The present thesis aims to examine whether clothing and the facial expressions of the other person can moderate the relationship between our personality traits and judgements about attractiveness. It also aims to bring insight into when we feel ourselves attractive, and the role of the other person in the interaction. Thirty-one (N = 31) participants were recruited to examine the moderation. Participants were presented with videos of models, in two different conditions for clothing: provocatively dressed vs. conservatively and three different conditions for the facial expressions; smile, coy smile vs. neutral expression. Participants were then asked to rate the attractiveness of the person that they saw in the video and how attractive that person would find them in return. They are then asked to fill out questionnaires including the MINI-IPIP to measure extraversion and agreeableness. Moderation analyses showed that neither the clothing type, nor the facial expression of the people they are interacting with did not moderate the relationship between the personality traits and ratings of attractiveness. These findings are explained in the context of moderation models, and future research is discussed.","['clothing', 'facial expressions', 'personality traits', 'extraversion', 'agreeableness', 'attractiveness']"
"Intuitively Placed Pitch: Relationship between Sight-reading and Movement Sonification Systems, and Preference for Pitch Placement in these Systems","Evijärvi, Leo",['Marijn Coers'],2022,Faculty of Social & Behavioural Sciences,Psychologie (BSc),Bachelor thesis,en,"Background Auditory movement sonification based therapies have been found to show promising result in helping people who are suffering from upper body motor impairments. The existing literature describes parameter mapping and musically informed mapping strategies as possible sonification strategies in the design of rehabilitation instrument. The present study investigated the relationship between the level of sheet music reading ability and the intuitive preference for one of the sonification systems. Furthermore, we investigated whether people have intuitive preference for vertically placed pitch over horizontally placed pitch in these sonification systems. Methods A final sample consisted of 163 participants who took part in an online survey where they evaluated video clips using different sonification styles and answered 5 questionnaires. Results & Conclusion Whilst we found that people prefer sonification systems that place pitch on vertical axis (M=21.58, SD=3.92) over systems that place pitch on horizontal axis (M=18.43, SD=4.29), t(162)=9.904, p<.001, we did not find any relation between level of sheet music reading ability and intuitive preference for one of the sonification systems nor with level of sheet music reading ability and intuitive preference for vertically placed pitch. This finding may facilitate the design of the movement sonification systems such as therapeutic musical instruments when choosing appropriate parameters.","['movement sonification, parameter mapping, musically informed mapping, pitch placement']"
"De mentale gezondheid en mindfulness van jongeren voor- , tijdens- en na de COVID-19 pandemie in Nederland: Een cross-sectioneel onderzoek","Hoek, Gabriëlle","['Koppert, T.']",2022,Faculty of Social & Behavioural Sciences,Psychologie (BSc),Bachelor thesis,nl,"Abstract Introduction. The purpose of this paper is to find out what the influence of the corona pandemic is on the mental health of the youth in comparison with adults and if mindfulness helps. Methods. A questionnaire has been administered before the pandemic in 2018, during the pandemic in 2020 and 2021 and after the pandemic in 2022. The questionnaire, that contains the SF-36 and the FIT-18, has been administered to the youth and adolescents. The data has been used to perform ANOVA’s and regressions analyses to research the hypotheses. Results. The mental health of the youth was lower during than before the pandemic and was lower during the pandemic than in comparison with the adults. After the pandemic the youth recovered faster. The mental health was not lower for people with a low mindfulness in comparison with high mindfulness, also not for the youth. Mental health was not lower during the pandemic in comparison with after the pandemic, also not for people with low mindfulness. Discussion. The youth had it mentally heavier than adults during the pandemic but recovered faster. Mindfulness does not only work during stressful periods but always. Mindfulness works for everyone not only for the youth or adults.","['Corona', 'jongeren', 'mindfulness', 'mentale gezondheid']"
Sex differences in self-esteem: Meta-analysis on primary and secondary educated children,"Kim, You Mi","['Wierenga, L.M.']",2022,Faculty of Social & Behavioural Sciences,Psychologie (BSc),Bachelor thesis,en,,
Replicatie van het Ontkoppelingseffect van Ambiguïteit in Inaction Inertia,"Aa, Isabella","['Putten, M. van']",2022,Faculty of Social & Behavioural Sciences,Psychologie (BSc),Bachelor thesis,nl,,
"Maladaptive perfectionism and Imposter Syndrome in University Students: Do they potentially lead to depression, anxiety and stress?","Bozok, Ali Yigit",['Umay Aksungur'],2022,Faculty of Social & Behavioural Sciences,Psychologie (BSc),Bachelor thesis,en,"Current research considers maladaptive perfectionism and the pursuit for unrealistic standards as indicators of psychological distress, namely depression, anxiety and stress. However, the gap in current research suggests that there is not sufficient insight on how maladaptive perfectionism can be fortified by the occurrence of imposter syndrome, a closely related phenomena that may lead to feelings of inadequacy and incompetence. Both perfectionism and imposterism are based on unrealistically high or hard to attain expectations of oneself. This study examined whether maladaptive perfectionism and imposter syndrome together potentially lead to depression, anxiety and stress in university students. With a sample of 69 Leiden University students, analysis has shown that the expected relationship was significant for all three dependent variables: depression (F(2,66) = 14.796, p < 0.001), anxiety (F(2,66) = 12.403, p < 0.001) and stress (F(2,66) = 21.906, p < 0.001). One of the possible shortcomings of this study could have been that it did not factor out the possibility of Covid-19 related psychological distress. Hence, the possibility of external factors unrelated to this study, such as the potential contribution of Covid-19 stress uncontrolled for in this study, may not have been singled out, subtly strengthening the correlation between the variables. Nonetheless, this study sheds light on how maladaptive perfectionism and imposter syndrome act together on the mental health of university students, bringing forward an insight that can be used in clinical practice and replicated for different samples in future research.","['Maladaptive perfectionism, imposter syndrome, depression, anxiety, stress']"
