title,author,supervisors,date,faculty,program,type,language,abstract,keywords
The Japanese Intelligence Community: Eastern Practices Seen Through Western Eyes,"Rense, Sheryl","['Veere, H. (Henny) van der']",2019,Faculty of Humanities,International Studies (BA),Bachelor thesis,en,"The main aim of this thesis was to take a critical stance towards the Intelligence Cycle as the foremost model on intelligence processes. The research question was: To what extent can the Intelligence Cycle, as a model of analysis, account for non-Western intelligence organisational structures, such as the Japanese intelligence community? The conclusion of the thesis is that the Intelligence Cycle cannot fully account for non-Western intelligence organisational structures, and specifically that of Japan. This is because of several assumptions that emerged when applying the Intelligence Cycle to Japan: First, that foreign and domestic security scopes cannot be consolidated into one organisation, ignoring the Japanese practice of 'amakudari'. Second, the assumption of inevitable competition between similar intelligence organisations. Third, the lack of a modernised intelligence arsenal. Lastly, the assumption that Japanese intelligence personnel is not trained appropriately, ignoring the practice of 'amakudari' and 'tenkin'.","['intelligence', 'Japanese intelligence community', 'Intelligence Cycle', 'Asian security', 'amakudari', 'tenkin']"
The third reverse wave of democratisation in Hungary and Poland,"Besselink, Jorieke","['Augusteijn, J.']",2019,Faculty of Humanities,International Studies (BA),Bachelor thesis,en,,"['Democratisation', 'Hungary', 'Poland', 'Huntington', 'Waves']"
The Bumpy Road towards Sustainable Development in Ecuador,"Vonk, Bente Maria Susannah","['Rivera, Soledad Valdivia']",2019,Faculty of Humanities,International Studies (BA),Bachelor thesis,en,,
Het beeld van dochters in de Lienüzhuan van Liu Xiang,"Pouw Kraan, Chuan Cai van der","['Els, Paul van']",2019,Faculty of Humanities,Chinastudies (BA),Bachelor thesis,nl,,
Semantic Differences and Similarities of komu and into,"Binnekamp, Britt","['Uegaki, Wataru']",2019,Faculty of Humanities,Japanstudies (BA),Bachelor thesis,en,,
Localities and the e-Governance of Integration in Japan,"Vink, Thomas","['Shibata, Saori']",2019,Faculty of Humanities,Asian Studies (60 EC) (MA),Master thesis,en,,"['e-Governance', 'Foreign Residents', 'Japan', 'Integration', 'Local Governance']"
Evaluaties van het Saiban-in systeem,"Iest, Ids van der","['Veere, H. (Henny) van der']",2019,Faculty of Humanities,Japanstudies (BA),Bachelor thesis,nl,,"['Saiban', 'Saiban-in seido', 'Japan', 'Law', 'Evaluatie', 'Jury', 'Saiban-in', 'Rechtssociologie']"
Cultural Diplomacy and the Return of Cultural Objects to Former Colonies: Belgium - Zaïre 1976 and France - Algeria 1969,"Rümelin, Esther","['Ieven, Bram Koen']",2019,Faculty of Humanities,International Studies (BA),Bachelor thesis,en,,"['Return', 'Restitution', 'Cultural Diplomacy', 'Cultural Heritage', 'Colonialism']"
Sacred charms and fashionable accessories – The different functions of omamori in 21st century Japan,"Pols, Vincent","['Smits, Ivo']",2019,Faculty of Humanities,Asian Studies (60 EC) (MA),Master thesis,en,,"['omamori', 'buddhism', 'cuteness', 'Japanese religion', 'amulets']"
"Why did ISIS use sexual and gender based violence against Yezidi girls and women: Obligation, Patriarchy, or Just a Tool of War?","Zaim, Yonca","['Calculli, Marina']",2019,Faculty of Humanities,Middle Eastern Studies (MA),Master thesis,en,"Five years have passed since the attack on Sinjar, and no one could have predicted the outcome we have witnessed. With the dismantling of ISIS, a myriad of consequences built over the years has come crashing down to the contemporary political climate. The quell of ISIS as a land-owning non-state actor may be seen as a victory, yet, the slow process of piecing together what truly happened behind the closed veil of the so-called Caliphate is the true feat. Among all of the unknown also lies the troublesome subject of sexual and gender based violence (SGBV). It is no secret that gender based violence played a prominent part in the so-called Islamic State’s reign to power, but the question remains; Why did ISIS use sexual and gender based violence against Yezidi girls and Women? There are three hypotheses that this thesis will test to understand ISIS’ use of rape against Yezidi girls and women: a) tool of war, b) patriarchy and c) religion. By analysing the rationale behind these three hypotheses this thesis will contribute to a more systematic understanding of ISIS’ modus operandi.","['Sexual and Gender Based Violence', 'Yezidi', 'Tool of War', 'Patriarchy', 'Religion', 'ISIS']"
Catching Pokémon Globally: Localization Practices in Japanese Video Games and Anime,"Schleijpen, Max","['Smits, Ivo']",2019,Faculty of Humanities,Asian Studies (60 EC) (MA),Master thesis,en,,"['localization', 'Japan', 'Pokémon', 'video games', 'anime', 'United States']"
China’s Changing Masculinity and the Influence of the Media,"Visser, Jonathan Jens","['Landsberger, Stefan R.']",2019,Faculty of Humanities,International Studies (BA),Bachelor thesis,en,"This paper investigates masculinity in Chinese media. Specifically, it was written to address “To what extent is the changing of masculinity in the Chinese media an indication of a changing of masculinity in wider society?” To achieve this, the paper will first lay out an overview over how Chinese masculinity has changed over the centuries and the last decades. In order to more easily assess issues regarding masculinity, it will borrow the wén-wǔ distinction introduced by Kam Louie. Then it will address the current relationship between the Chinese (state-) media and masculinity in China. The third part will focus on idols and beauty boys, two forms of masculinity that are criticised often by conservative voices. It will also include a discussion on how much women are involved in the changing masculine ideals. Consequently, this paper will analyse two media productions to see how they portray masculinity, what effects this would have, and how this is related to the literature discussed in this paper. And finally, this paper will conclude that rather than just a shift in masculinity, there is also an entrenchment of older masculine ideals taking place.","['Masculinity', 'China', 'Media']"
Challenges and Opportunities for Ecotourism on Jeju Island: Lessons Learnt From Maha and Yeraedong Village,"Marel, Pieter van der","['Veldkamp, Elmer']",2019,Faculty of Humanities,International Studies (BA),Bachelor thesis,en,,"['Ecotourism', 'Jeju Island', 'Sustainability']"
A True Acholi: Pressures on Acholi Women to Westernize - an Analysis of Okot p’Bitek’s Song of Lawino,"Hogewerf, Ilse","['Williams, Corey']",2019,Faculty of Humanities,International Studies (BA),Bachelor thesis,en,,"['Acholi', 'Poetry', ""p'Bitek"", 'Westernization']"
FROM TRANSGRESSION TO ENDORSEMENT: COMBATANT WOMEN BETWEEN ISRAEL AND PALESTINE,"Alessio, Miriam","['Schonmann, Noa']",2019,Faculty of Humanities,Middle Eastern Studies (MA),Master thesis,en,,"['gender', 'Israeli-Palestinian conflict', 'combatant women']"
Thai Traditional Tattooing - Global and Local,"Kasman, Evi","['Henley, David']",2019,Faculty of Humanities,South and Southeast Asian Studies (BA),Bachelor thesis,en,,"['Thailand', 'Tattooing', 'Sak Yant', 'Netherlands', 'Globalization']"
"Notions of ""xiangtu cinema"" in Kaili Blues","Haag, L.C.","['Keijser, A.S.']",2019,Faculty of Humanities,Asian Studies (60 EC) (MA),Master thesis,en,,"['China', 'Cinema', 'Bi Gan']"
Archetype Reiterated; ‘Evil Stepmothers’ in K’ongchwi P’atchwi and Aschenputtel,"Dodds, Mary Elizabeth","['Park, Jin Hee']",2019,Faculty of Humanities,Koreastudies (BA),Bachelor thesis,en,"This thesis examines the way in which the fairy-tale Stepmother is portrayed in two versions of the Korean ‘Cinderella Story’ of K’ongchwi P’atchwi, and the German Aschenputtel by Jacob and Wilhelm Grimm. Its aim is to study the power structures, and the social and psychological patterns which create the ‘Evil’ of the Stepmothers in these versions of the ‘Cinderella Story’. This thesis is an attempt to shed some light on the cultural influences which have led to the creation of similar and yet different ‘Evil Stepmothers’, by using an ‘Integrated Approach’ which draws on the Archetypal and Post-modern schools of literary analysis. This approach plays to the strengths of both pre-existing approaches whilst giving a more complete analysis than either would have generated if used in isolation. The thesis concludes that the Stepmothers in the studied versions all have the same function: that of exemplifying the undesirable consequences of the abuse of power and, the ways in which undesirable dark side of the human psyche can manifest itself if one lets it do so. However, despite this shared function, the exact details of the Stepmother’s behaviors as well as other differences between the stories reflect the cultures in which they were created. In this way the abuse of power and the dark side of the human psyche are brought home to readers from different cultures through differing iterations of the Stepmother Archetype.","['Literary analysis', 't’onghap chŏpgŭn bŏp', 'Integrated approach', '(Evil) Stepmother', 'Archetypal and Post-Modernist Criticism', 'Cultural Contextual Analysis', 'Fairytales', 'Comparative Study', 'Korea', 'Aschenputtel and K’ongchwi P’atchwi']"
Views on the U.S. Election in China: How the Xinhua News Agency portrays the 2016 U.S. Presidential Election,"Lokker, Bart","['Sybesma, Rint']",2019,Faculty of Humanities,Asian Studies (60 EC) (MA),Master thesis,en,,"['China', 'Xinhua', 'Media', 'Frame', 'Framing', 'Discourse', 'Election', 'Politics', 'U.S.', 'United States']"
Elderly Care: A Challenge for China,"Ma, Dongqi","['Burgos Martinez, Elena']",2019,Faculty of Humanities,Asian Studies (60 EC) (MA),Master thesis,en,,"['China', 'elderly care']"
"The Credibility of Transnational, English-Language News Media in the Middle East: from the Al Jazeera Effect, to the PressTV and the TRT World Effect?","Borghols, Thomas","['Schonmann, Noa']",2019,Faculty of Humanities,Middle Eastern Studies (MA),Master thesis,en,"Since its foundation in 1996, Al Jazeera and its English subsidiary Al Jazeera English, established in 2006, have revolutionized the Middle Eastern news media landscape by critically reporting on events in the immediate region and by emphasizing the experiences of people from the Global South. This lead to the coining of the term ‘the Al Jazeera effect’ by Philip Seib. However, the only directive issued by its main sponsor, the Qatari government, is that it should not put the monarchy in a negative light. While different countries in the Middle East have begun following Qatar’s footsteps by establishing English-language news media of their own, an issue that is materializing in parallel is the worldwide declining trust in the news media. As various news networks around the globe are seeing their credibility—the quality of being trusted—questioned, this thesis ties these two developments together by asking how Al Jazeera English, as well as two of its English-language competitors in the region, being PressTV from Iran and TRT World from Turkey, go about establishing their credibility. More particularly, how do these three networks fare when they report on a conflict in their proverbial backyard, the Syrian Civil War, the outcome of which concerns Qatar, Iran, and Turkey alike? By borrowing from the existing scholarly literature on the analysis of news media credibility, this thesis looks at YouTube material on the Syrian Civil War in the first five months of 2019 from the flagship current affairs discussion program on each network, Inside Story on Al Jazeera English, The Debate on PressTV, and The Newsmakers on TRT World in order to demonstrate whether the latter two networks cater for their own ‘effect’ in the Middle Eastern news media arena. Moreover, this thesis hopes to expand our understanding of how we should view the three news outlets: as critical watchdogs of political institutions, or as mouthpieces for their respective governments.","['News media', 'Credibility', 'Framing', 'Syrian Civil War', 'Al Jazeera English', 'PressTV', 'TRT World']"
Sultan Abdülhamid II in de televisieserie 'Payitaht Abdülhamid',"Oylum, Ela Didem","['Theunissen, H.P.A.']",2019,Faculty of Humanities,Midden-Oostenstudies (BA),Bachelor thesis,nl,,
Beyond Hikikomori: the problem of proper conduct in contemporary Japan.,"Oosten, Ronald Hendrik Marinus van","['Mes, Thomas']",2019,Faculty of Humanities,Japanstudies (BA),Bachelor thesis,en,,"['Hikikomori', 'Representation', 'Otaku', 'Society']"
"Semantic and Pragmatic Function Analysis of Sentence-Final Particle Combinations: the Cases of Japanese ""yone"" and Cantonese ""gaa3-wo3""","Chau, Yik-Ling","['Uegaki, W.']",2019,Faculty of Humanities,Asian Studies (60 EC) (MA),Master thesis,en,,"['sentence-final particles', 'Japanese', 'Cantonese']"
Refashioning Approaches to Shunga: Overcoming Institutional Marginalization,"Coldesina, Manuela","['Müller, Doreen']",2019,Faculty of Humanities,Asian Studies (60 EC) (MA),Master thesis,en,"Sexually explicit shunga of the Edo period have long been subjected to censorship and suppressive official attitudes. In the Meiji era, due to crypto-colonial pressures, censorship grew more stringent and persists until today. Even academic shunga publications long remained censored and their study has been marginalized within ukiyo-e research, both in Japan and abroad. With the liberalization of shunga publication in Japan, scholarship began closing the gaps in the field, shifting from aestheticizing to more critical approaches. However, despite the interconnectedness of shunga with ukiyo-e imagery, museum institutions have lagged behind in their inclusion. Thus, marginalizing and self-censoring institutional attitudes still persist, despite changing social ones, constructing a disjuncture between scholarly and institutional discourses on shunga. This thesis presents the 2013 British Museum exhibition and its 2015-2016 reshowing in Japan, which resulted from the international collaborative efforts of researchers and practitioners, as a model for overcoming institutional self-censorship and marginalization of shunga. Thus showing a way forward towards the inclusion of the sexually explicit genre.","['Shunga', 'Erotic art', 'Censorship', 'Crypto-colonialism', 'Japanese prints', 'Self-censorship']"
Tackling the Toxic Legacy of Uranium Mining; a Tale of Navajo Activism,"Donnio, Romane","['Fazzi, Dario']",2019,Faculty of Humanities,International Studies (BA),Bachelor thesis,en,"This thesis tells the tale of the toxic legacy of uranium mining, which has been casting a shadow over the lives of the Navajo people for over seven decades. Due to the rising tension between the United States and the Soviet Union during the Cold War, a nuclear arms race developed. In the United States, the government’s interest in uranium became a matter of top priority, which resulted in a mining boom. At first, the mining boom seemed like a blessing since it created many jobs. Especially for the Navajo people, a Native American tribe indigenous to the southwestern United States where uranium could be found in abundance. However, the initial excitement about these work opportunities was soon to be overshadowed by the toxicity of the work environment. For more than a decade, Navajo miners worked in this environment without any proper protection from the life threatening effects of uranium. And only in the 1960s, when the years of unprotected mining started taking its toll, was it that the Navajo people started to become aware of these dangers. What followed were three decades of organizing and activism on the part of the Navajo people, which eventually led to the passing of the Radiation Exposure Compensation Act (RECA) in 1990. Though this was a crucial moment for Navajo anti-uranium activism, it does not necessarily mean that the story of Navajo activism ends here. Nevertheless, little scientific work has been dedicated to the development of the story after 1990. Therefore, this thesis will shift the focus towards the direction that Navajo advocacy against the toxic legacy of uranium mining has taken after the Radiation Exposure Compensation Act was passed. Such post-1990 types of activism mainly focus on three concepts; compensation, cleanup and remembrance. When it comes to compensation, the main goal is the inclusion of post-1971 uranium workers for compensation under RECA. Current eligibility criteria exclude those employed as uranium miners after 1971, which is when the United States government stopped being the sole purchaser of uranium ore. However, those in favor of amending the Act to include post-71 workers are arguing that this date only signified the end of government liability, but not the end of the inadequacy of radiation standards. Another cause for activism is the immense impact that the uranium industry has had on the environment. Many abandoned uranium mines exist on Navajo lands and environmental issues range far beyond the impact of these mines alone. Additionally, President Trump’s 2017 Executive Order on Promoting Energy Independence and Economic Growth has fueled fears of uranium mining returning to Navajo lands. In response, the Navajo people are trying to remind the nation of the disastrous impact of the industry and the toxic legacy that it has left behind. The possibility of uranium mining returning to Navajo lands, the exclusion of post-71 workers and the continued risks due to environmental contamination are all part of the toxic legacy against which the Navajo people are still fighting today. The telling of the tale of the Navajo people and the toxic legacy of uranium mining as done in this research sheds light on the historic and current relevance of recognizing the impact of uranium mining and the need for solutions.","['Navajo', 'Native American', 'Uranium', 'Uranium mining', 'Activism', 'Radiation Exposure Compensation Act', 'Cleanup', 'Compensationation', 'Remembrance']"
The Discursive Role of Digital Silk Road in Chinese-Pakistani Relations,"Skjelby, Rasmus","['Forough, Mohammadbagher']",2019,Faculty of Humanities,International Studies (BA),Bachelor thesis,en,,"['Digital Silk Road', 'Critical discourse analysis', 'Chinese-Pakistani relations']"
Propaganda in de Japanse Populaire Media (1936-1945),"Vervaart, Roosemiek","['Mark, Ethan']",2019,Faculty of Humanities,Japanstudies (BA),Bachelor thesis,nl,,"['Japanstudies', 'Propaganda', '1936-1945']"
AliExpress as a source of China’s soft power,"Swaanen, Benedicte","['Kharchenkova, Svetlana']",2019,Faculty of Humanities,International Studies (BA),Bachelor thesis,en,,
"Returning Home: Three case studies of the representation of home in recluse paintings by Zhao Mengfu, Ni Zan and Shen Zhou","Dam, Franka","['Lin, Fan']",2019,Faculty of Humanities,Chinastudies (BA),Bachelor thesis,en,,"['Recluse painting', 'Reclusion', 'Zhao Mengfu', 'Ni Zan', 'Shen Zhou', 'Home']"
Identity formation in Indonesia: Influences on traditional beauty ideals,"Leeuwen, Shannon van","['Suryadi, Surya']",2019,Faculty of Humanities,South and Southeast Asian Studies (BA),Bachelor thesis,en,,"['Indonesia', 'beauty', 'appearance', 'culture', 'colonialism', 'religion']"
De ‘Kopenhagenschaal’ en de werken van al-Būnī,"Biesbroek, Amber-Lea","['Bruning, Jelle']",2019,Faculty of Humanities,Midden-Oostenstudies (BA),Bachelor thesis,nl,,
Mothers in Law and Cinema An analysis of women’s,"mehrinejad, Sara","['Omari, Haneen']",2019,Faculty of Humanities,International Studies (BA),Bachelor thesis,en,,"['women rights', 'cinema', 'Iranian Cinema', 'Iran']"
Beijing Punk: een analyse van Chun Sue's Beijing Doll,"Vis, Pieta","['Crevel, Maghiel van']",2019,Faculty of Humanities,Chinastudies (BA),Bachelor thesis,nl,,"['Literatuur', 'Beijing', 'Chun Sue', 'Beijing Doll']"
"Power Politics in the Malian Conflict: Considering the roles of ECOWAS, the UN, and France","Brattinga, Elliott","['Smith, Karen']",2019,Faculty of Humanities,International Studies (BA),Bachelor thesis,en,"This study aims to show why Africa, specifically the Economic Community of West African States (ECOWAS) in this case study, seems to lack agency regarding the control of their internal security issues. The Malian conflict, which started in 2012, saw the activation of the African-led International Support Mission to Mali (AFISMA) as well as a French military intervention called Operation Serval. However, in July 2013 AFISMA was superseded by a UN-led military operation while the French mission remained functional. This case study reflects the issue regarding the lack of African agency. By using an analytical framework of power in international politics, this study seeks to understand this dynamic as it pertains to the case study. The findings show that France, via a Realist understanding, is the primary power in the conflict out to seek its own security. Simultaneously, African agency is not realisable due to the inherent inferiority of African institutions compared to the UN and France.","['ECOWAS', 'the United Nations', 'France', 'Power', 'Realism', 'Liberalism', 'the UN', 'AFISMA', 'MINUSMA']"
Liefdesschandalen van Japanse idolen,"Goossens, Lana","['Winkel, Guita']",2019,Faculty of Humanities,Japanstudies (BA),Bachelor thesis,nl,,"['idols', 'japan', 'schandalen']"
"THE UNITED STATES’ RELATIONS WITH THE WEIMAR REPUBLIC, 1921-1924","Caiati, Sophia","['Schmidli, William Michae']",2019,Faculty of Humanities,International Studies (BA),Bachelor thesis,en,,"['Weimar Republic', 'United States', 'Foreign Relations']"
Scriptie 2018/2019,"Huussen, Daphne","['Zangenberg, Jürgen']",2019,Faculty of Humanities,Oude culturen van de mediterrane wereld (Bachelor),Bachelor thesis,nl,,"['scriptie', 'identiteitsuitdrukking', 'joden', 'christenen', 'Byzantijns', 'Galilea', 'mozaïeken']"
"Challenging Meiji Religious Policy: The Formation of the Concept of Religion and Institutional Criticism in the time of the Ministry of Doctrine, 1872-1877.","Letzer, Tristan","['Veere, H. (Henny) van der']",2019,Faculty of Humanities,Religiewetenschappen (BA),Bachelor thesis,en,,"['Meiji', 'Religious Policy', 'Modern Japan', 'Kyōbushō', 'Meiji Restoration']"
Een Hollander in Japan: De invloed van externe factoren op Bert Rölings dissent tijdens het Tribunaal van Tokio.,"Meens, Bram Indalo","['Mark, Ethan']",2019,Faculty of Humanities,Japanstudies (BA),Bachelor thesis,nl,"Röling was de Nederlandse afgevaardigde aan het Tribunaal van Tokio. Hij is opmerkelijk omdat hij als enige rechter in zijn afwijkend vonnis (hierna: dissent) per beklaagde uiteenzette wat hij een gepaste strafmaat vond, en omdat hij zeer kritisch was over punten waar de andere rechters niet over na (wilden) denken. Hoewel Röling dankzij de hernieuwde aandacht voor het tribunaal ook weer in de belangstelling staat is er nog niet onderzocht hoe en waarom juist Röling tot zijn dissent kwam. In dit onderzoek wordt uiteengezet wat de hoofdfactoren uit het sociaal milieu en persoonlijke leven van Bert Röling waren die ervoor gezorgd hebben dat hij een dissent besloot te publiceren, en hoe die factoren zijn dissent hebben beïnvloed. Deze factoren zijn een neiging tot het niet respecteren van de gevestigde orde; en het feit dat hij door zijn nieuwsgierigheid, zorgvuldigheid en ruimdenkendheid over stereotypes heen kon stappen. Hierdoor kwam hij ook in contact met Japanners die zijn dissent verder beïnvloedden.","['Tokyo Trial', 'Röling', 'dissent', 'Tweede Wereldoorlog', 'Recht']"
De gemengde rituele en juridische aard van de beproeving in Numeri 5: 11-31,"Wijsman, Lotte","['Gzella, Holger']",2019,Faculty of Humanities,Oude culturen van de mediterrane wereld (Bachelor),Bachelor thesis,nl,,"['Numeri', 'Oude Testament']"
Shallow Waves in Japan’s South China Sea Policy,"Perfors, Joep","['Black, Lindsay']",2019,Faculty of Humanities,Japanstudies (BA),Bachelor thesis,en,,"['Japan', 'Politics', 'International Relations', 'South China Sea', 'Policy']"
The effects of the hukou household registration system and institutional discrimination on income inequality for rural-to-urban migrant labour without local hukou status in Chinese cities,"Verkerk, Sven","['Kharchenkova, S.S.']",2019,Faculty of Humanities,International Studies (BA),Bachelor thesis,en,,"['hukou household registration system', 'migrant labour', 'China', 'institutional discrimination']"
Yin en yang als medicijn: Is er een verband tussen de Huangdi Neijing en de Laozi en Zhuangzi in het gebruik van yin en yang?,"De Wit, Aimée","['Els, Paul van']",2019,Faculty of Humanities,Chinastudies (BA),Bachelor thesis,nl,,"['yin', 'yang', 'huangdi neijing', 'laozi', 'zhuangzi', 'bachelor thesis']"
Tourism for Sustainable Host-Community Development: Costa Rica an Example to the world?,"Ramos, Wendy","['Aguiar, José Carlos G.']",2019,Faculty of Humanities,Latijns-Amerikastudies (BA),Bachelor thesis,en,,"['Tourism', 'Latin America', 'Costa Rica', 'Community development', 'Sustainable Development Goals', 'Mass Tourism', 'Host community development', 'SDGs', 'Cultural Challanges', 'Intercultural Relations']"
