title,author,supervisors,date,faculty,program,type,language,abstract,keywords
Evolução do Código Penal Brasileiro em Relação à Violência de Gênero: Análise das Políticas Públicas contra o Feminicídio no Estado do Espírito Santo,"Dumas Carvalho van der Velde, Yohana","['Isla Monsalve, P.A.']",2019,Faculty of Humanities,Latijns-Amerikastudies (BA),Master thesis,pt,"A violência de gênero é considerada resultado de um sistema discriminatório estrutural e institucional onde a relação de dominação e subordinação foi consolidada ao longo dos anos nas relações entre homens e mulheres. Ademais, antes das décadas de 1960 e 1970, a participação da mulher nos processos sociais, suas idéias e representações além dos problemas que enfrentavam no seu cotidiano não eram considerados problemas sociais nem mesmo políticos. Porém, o papel das feministas (no âmbito mundial) na luta em defesa dos direitos humanos das mulheres e no combate à violência de gênero foi essencial para que a realidade de muitas mulheres no mundo ganhasse notoriedade e que as autoridades competentes assumissem a responsabilidade de garantir o direito à vida sem violência às mulheres. No contexto brasileiro, a ocorrência de casos de violência contra a mulher e de feminicídio envolvem números alarmantes no país. Ademais, o fator cultural e a relação de poder e dominação presente na maioria das relações interpessoais entre o homem e a mulher na sociedade brasileira, contribuem para a permanência e para o aumento desses tipos de violência. Haja vista que um dos fatores que podem explicar essa situação alarmante é que a sociedade brasileira, marcada pela ideologia patriarcal onde a mulher é subordinada ao homem, reforça o papel que ambas as partes assumem. O feminicídio, é considerado um crime que tem como base o ódio contra as mulheres (misoginia), e ocorre, muitas vezes no contexto de violência doméstica e familiar. Não obstante, foi durante os anos de 2006 e 2015, que o Código Penal brasileiro foi modificado a fim de combater a violência de gênero e o feminicídio.O objetivo dessa pesquisa é analisar os efeitos da evolução legislativa do CPB no marco das políticas públicas de prevenção e combate à violência de gênero e feminicídio no estado do Espírito Santo. E as perguntas centrais que guiaram essa pesquisa foram: em que medida os avanços do Código Penal brasileiro e as políticas públicas adotadas pelo governo do Espírito Santo (ES) estão contribuindo para a diminuição de casos de violência de gênero e de feminicídio? Assim mesmo e mais especificamente, interessa saber que tipos de políticas públicas o governo do ES adotou durante 2006 a 2017 para combater o feminício. Além das perguntas descritas, se parte da hipótese de que apesar das mudanças no Código Penal brasileiro e das políticas públicas adotadas pelo governo do ES para combater a violência de gênero, sendo todas elas importantes, não seriam suficientes para eliminar consideravelmente os casos de violência contra a mulher.","['Violência de gênero', 'Feminicídio', 'Violência contra mulheres', 'Feminicídio no Espírito Santo', 'Código Penal brasileiro', 'Lei Maria da Penha', 'Políticas públicas de gênero', 'Violência doméstica e familiar', 'Combate à violência de gênero no Brasil']"
Strategisch manoeuvreren met het topisch potentieel in filmrecensies,"Stout, Roosmarijn","['Jungslager, Francisca']",2019,Faculty of Humanities,Taalwetenschap (BA),Bachelor thesis,nl,,
The relevance of Marx and Social Economic Policy in Addressing the Socioeconomic Disparities Emerging from the Fourth Industrial Revolution.,"Drie, Oscar Roman James van","['Gerrits, A.W.M.']",2019,Faculty of Humanities,International Relations (MA),Master thesis,en,"The fourth industrial revolution (4IR) is seen as the fourth time that a series of technological innovations will revolutionise the production and movement of goods. The prospect of a 4IR also sprouted a debate surrounding the socioeconomic implications that may come with these technological innovations. The 4IR could have grave consequences for low-skilled labourers. For example, the automation of production may result in a predicament where human labour can no longer compete with machines, which may decrease demand for low-skilled labour or make it redundant. As a result, in highly developed countries growing job insecurities may accelerate the growth of a “new dangerous class” called the precariat. This class could put pressure the political foundations of capitalist democratic societies. Moreover, in developing countries, automation of production may result in companies deciding to relocate their production back to highly developed countries where most of their consumers are based. As a consequence, developing countries can no longer depend on their comparative advantage of having an abundance of cheap labour. Hence, one can argue that the development strategy of development by way of industrialisation may become unworkable. In short, the 4IR may increase the gap between rich and poor, decrease social mobility and increased labour insecurity; all of which resonate with some of the contradictions that Karl Marx thought were endemic to the capitalist economy. This thesis will investigate this predicament through an analysis of the socioeconomic effects emerging from the 4IR and relating this to Marx’s critique of capitalism. The thesis aims to add to existing literature on Marx by considering the relevance of Marx in the 21st century.","['Marx', 'Karl', 'Economic inequality', 'Low-skilled labour', 'Labour redundancy', 'Technological innovation', 'Fourth Industrial Revolution', 'Industry 4.0', 'Geographical labour advantage', '4IR']"
Samenwerken of tegenwerken? Een studie naar de politisering van inlichtingen over Indonesië door Nederland in de aanloop naar de bezetting van Indonesië (1942-1945),"Arkel, André van","['Brocades Zaalberg, Thijs']",2019,Faculty of Humanities,Geschiedenis (BA),Bachelor thesis,nl,"Na de capitulatie van Japan was het zaak Indonesië weer te bezetten. Nederland was zelf niet in staat om dit te doen en was afhankelijk van Groot-Brittannië die tevens de verantwoordelijkheid over Indonesië had gekregen. Nederland had er baat bij als Groot-Brittannië Indonesië zo snel mogelijk zou bezetten. Dit was voor Nederland belangrijk, want dan konden er zo snel mogelijk inkomsten in Indonesië voor de wederopbouw van Nederland gegenereerd worden en kon de op 17 augustus 1945 uitgeroepen Republik Indonesia zo snel mogelijk tegengewerkt worden. Nederland probeerde het beeld van Groot-Brittannië over Indonesië actief te beïnvloeden zodat de bezetting van Indonesië zo snel mogelijk zou plaatsvinden. Het manipuleren, achterhouden of fabriceren van inlichtingen binnen een inlichtingenuitwisseling om een politiek doel te behalen noemt men het 'politiseren van inlichtingen'. Nederland heeft het beeld dat Groot-Brittannië over Indonesië had actief beïnvloed door inlichtingen over Indonesië te politiseren. In dit BA-eindwerk word er gekeken naar de politisering van inlichtingen op het gebied van de houding van de Indonesische bevolking ten opzichte van de Nederlanders en het beeld dat Groot-Brittannië had van de sterkte van de Republiek. Deze BA-scriptie gaat in op de staat van inlichtingen tijdens de Tweede Wereldoorlog, de motieven van Nederland om inlichtingen te politiseren en de politisering van inlichtingen op de twee bovengenoemde onderwerpen.","['Indonesië', 'Inlichtingen', 'Groot-Britannië', 'Nederland', 'Politisering', 'International Intelligence Co-operation', 'International Intelligence Liaison', 'Indonesische Onafhankelijkheidsoorlog', 'Netherlands Indies Forces Intelligence Service']"
R2P and the 2011 Libya Intervention A Critical Discourse Analysis of Russia and China,"Hamilton, Charles Emil Alexander","['Forough, Mohammadbagher']",2019,Faculty of Humanities,International Relations (MA),Master thesis,en,,"['Libya', 'China', 'Russia', 'Responsibility to Protect', 'R2P', 'NATO']"
Retaining Style in Subtitles for Children: A Functional and Stylistic Approach to Subtitling The Gruffalo,"Walrave, Maureen","['Bovelander, Maud']",2019,Faculty of Humanities,Linguistics (MA),Master thesis,en,"Recent years have shown an increase of research into audiovisual translation, but the field of audiovisual translation for children remains severely understudied. Academically, this field is understudied because of the low prestige of subtitling in general and children as the audience in particular (O’Connell, 2003). In practice, subtitles for children are uncommon, because children’s programs are often dubbed (O’Connell, 1999). Rhyme for children is not considered a ‘serious’ area of translation in any medium (Nasi, 2012), but combined with subtitles this field has barely received any academic attention. However, scholars in the field of literary translation argue that style and content together form the meaning of a text and therefore style is important to maintain in translation (Boase-Beier, 2014). Consequently, the purpose of this thesis was to identify the stylistic features present in the English original and Dutch translation of the children’s illustrated book The Gruffalo, before creating new, style-centered subtitles to accompany the movie of the same name. A functional analysis based on Nord (2005) showed that the functions of the texts were to entertain children and teach them new elements of language. A linguistic and stylistic analysis after Leech & Short’s checklist (2007) showed that the most important stylistic features in the book and its translation were rhyme, rhythm and repetition. To recreate the functions in translation, the stylistic features needed to be transferred into Dutch. Style-centered subtitles were created in the form of an annotated translation, but it proved difficult to forget about subtitling’s vulnerability: that the audience can hear the original and see the translation at the same time. Nevertheless, I will argue that it is possible to create style-centered subtitles for children, as the annotated translation does contain rhyme, rhythm and repetition.","['subtitling rhyme', 'subtitles for children', 'retranslation']"
"A Man's Man's Man's World: Music, Misery and Masculinity in the Work of Nick Hornby","Walraven, Lisa","['Korsten, Frans Willem']",2019,Faculty of Humanities,Media Studies (MA),Master thesis,en,,['Nick Hornby Feminism Ladlit Music Masculinity Crisis']
Post-Hegemonic Regionalism in Latin America: the role of idealism in the regional projects of UNASUR and ALBA during the Pink Tide,"Mijnlieff, Selene","['Rivera, Soledad Valdivia']",2019,Faculty of Humanities,International Relations (MA),Master thesis,en,,"['Latin American Regionalism', 'Idealism']"
The Sexuality of the Three States Women’s Sexuality in Thirteenth-Century English Texts,"Verhagen, Odile","['Murchison, Krista A.']",2019,Faculty of Humanities,Engelse taal en cultuur (BA),Bachelor thesis,en,,"['Virginity', 'Lesbianism', 'Early Middle Ages']"
"A Critical Study of “Chinese Painting” in Europe, Japan and China (1882-1937)","Lińska, Lidia","['Lin, Fan']",2019,Faculty of Humanities,South and Southeast Asian Studies (BA),Bachelor thesis,en,,"['art', 'chinese', 'painting', 'historiography']"
"#MeTwo: dubbele loyaliteit, dubbel verwijt","Laarhuis, Maureen","['Schrover, M.L.J.C. (Marlou)']",2019,Faculty of Humanities,Geschiedenis (BA),Bachelor thesis,nl,,"['migratie', 'voetbal', 'loyaliteit']"
Disconnected: Why Social Networking Sites have not democratized Zimbabwe's socio-political society,"Rozemeijer, Linde","['De Bruijn, Mirjam']",2019,Faculty of Humanities,African Studies (MA),Master thesis,en,"Academic research on the influence of Social Networking Sites on democratization-processes in autocratic regimes in Africa is often centered on the bottom-up, citizen-driven possibilities of social media, arguing that these factors enforce processes of mobilization and free information-access, ultimately resulting in a form of democratization. Drawing conclusions from the Arab Spring, the prediction was made that Zimbabwe could follow the same course of action. So far however, decisive democratic change there has not yet been observed. This study brings forward the argument that the absence of this democratic change can be explained through the presence of four conditions, namely a digital divide, the particulars of Zimbabwean political society, the online/offline-aspect in Zimbabwean socio-politics and the Zimbabwean media-landscape. Building on primary data and secondary literature, this thesis aims to bring nuance to the discussion concerning the interplay between communication-technologies and socio-political developments, in the specific case of Zimbabwe but also in a larger African- and global context.","['Social Media', 'SNS', 'democratizationprocesses', 'democratic change']"
"La lucha por la colonia Juárez, análisis de la resistencia de los habitantes en contra de la gentrificación en la colonia Juárez","Rietveld, Lisa","['Aguiar, G.', 'Carlos, José']",2019,Faculty of Humanities,Latijns-Amerikastudies (BA),Master thesis,es,,"['Gentrification', 'Right to the City', 'Mexico City', 'Urban Movements']"
De verspreiding van de productiviteitsgedachte: Een historisch onderzoek naar de mate van invloed van de Contactgroep Opvoering Productiviteit op de agrarische sector,"Hulst, Iris van der","['Scott-Smith, Giles']",2019,Faculty of Humanities,Geschiedenis (BA),Bachelor thesis,nl,,"['Marshall Plan', 'Contactgroep Opvoering Productiviteit']"
Merleau-Ponty and Feminist Philosophy: a possible contribution to feminist philosophy through Merleau-Ponty’s political thought,"Pouw, Suzanna","['Chouraqui, Frank']",2019,Faculty of Humanities,Wijsbegeerte (BA),Bachelor thesis,en,,"['Feminism', 'Phenomenology', 'Merleau-Ponty', 'Essentialism', 'Politics', 'Ethics']"
"Europa of de wereld? De buitenlandse politiek van Groot-Brittannië en Frankrijk tijdens de Oostenrijkse Successieoorlog, 1740-1748","Jong, Ilse de","['Nimwegen, Olaf van']",2019,Faculty of Humanities,Geschiedenis (BA),Bachelor thesis,nl,,"['Oostenrijkse Successieoorlog', 'Austrian War of Succession', 'Buitenlandse politiek Groot-Brittannië', 'Buitenlandse politiek Frankrijk', 'British foreign policy', 'French foreign policy']"
Considering Rawls's Political Move: A Critical Analysis of Political Liberalism and Its Critics,"Price, Dominic","['Meijers, Tim']",2019,Faculty of Humanities,Philosophy (MA) (60 EC),Master thesis,en,"This thesis critically analyses the success of John Rawls’s political liberalism, which recast his theory of justice from a comprehensive doctrine to a political conception. This analysis into Rawlsian political liberalism involves an examination of the way in which political liberals have responded to the objections raised by critics of the theory. Through analysing the problem of asymmetry in political liberalism, this thesis argues that political liberalism is only able to remain viable on the basis of the notion of reasonableness, which characterises the group of highly idealised, reasonable citizens. These citizens are immensely important to political liberalism, since they have the role of deliberating on and justifying the political conception of justice. In order for political liberalism to remain a tenable account of how agreement can be reached on the principles of justice, the idea of reasonableness requires justification. Political liberals attempt to accomplish this by appealing to the public political culture, and the shared political ideas found within it, which all democratically-aligned citizens will endorse. This thesis also argues that such a claim cannot be made, since the political ideas are subject to interpretation and thus not shared. It is also illustrated that political liberals cannot ground their theory in the support of committed democrats, since disagreement over the ideas of democracy and reasonableness are likely. After concluding that political liberalism cannot be defended, the last chapter of this thesis focuses upon a perfectionist liberalism, which Rawls argues must be rejected. This thesis argues that, on the contrary, perfectionist liberalism may be able to overcome the problems that political liberals associate with it.","['Political liberalism', 'Rawls', 'Asymmetry', 'Reasonable Disagreement']"
"Dutch Resistance exhibited: A study on narrative and identity in three Dutch Resistance memorial museums: Fries Verzetsmuseum, Verzetsmuseum Amsterdam and Verzetsmuseum Zuid-Holland","Veen, Olga van der","['Bertens, Laura']",2019,Faculty of Humanities,Arts and Culture (MA),Master thesis,en,,"['resistance', 'museums', 'identity', 'memorial']"
Explicit knowledge about implicit errors in L1 and L2 Dutch. An analysis of L1 and L2 accuracy.,"Goeijen, Anne Marije de","['Jong, Nivja de']",2019,Faculty of Humanities,Linguistics (research) (MA),Research master thesis,en,"This thesis investigates implicit accuracy, which is considered the ability to use structures and rules that have become internalized and can thus be uttered easily, and explicit accuracy, defined as the presence of linguistic items learnt by the L2 speaker that have not yet been transferred in implicit accuracy. To investigate in what respect L1, beginning L2 and advanced L2 speakers of Dutch differ in terms of implicit accuracy, spontaneous speech was elicited by two speech tasks. Speech performances were transcribed and coded for accuracy. Types of errors were marked and by use of five measures, implicit accuracy was investigated. Two MANOVAs were run to examine how L1 and L2 accuracy differs and how lower and higher proficient L2 accuracy differs. Significant differences with respect to error density and error type density were found. Correction of error was not found to differ significantly across groups of speakers. The qualitative analysis delved into explicit accuracy, which was examined by stimulated recall sessions: participants were asked to listen carefully to their own speech and to comment on errors, hesitations and the overall process of speaking. These comments were categorized by the researcher. Chi square analyses revealed that as proficiency increases, participants report less on lexical problems but more on affined aspects as task-related issues. L1 speakers specifically report mainly on issues of focus and temporal planning. This study confirms that both implicit and explicit accuracy differs across L1 and L2 speakers and across lower and higher proficient L2 speakers.","['accuracy', 'CAF', 'stimulated recall', 'L2 proficiency']"
De Algerijnse onafhankelijkheidsoorlog: een herinnering die zijn plek moeilijk vindt.,"Pedemonte, Jesse","['Storm, Eric']",2019,Faculty of Humanities,Geschiedenis (BA),Bachelor thesis,nl,,"['Algerijnse onafhankelijkheidsoorlog', 'herinnering', 'marteling']"
Effective Trolling: A Comparative Case Study,"Hak, Giotto Valentino Ainsley","['Jeffery, Jill']",2019,Faculty of Humanities,Linguistics (MA),Master thesis,en,"This paper investigates the effects of various forms of trolling. This investigation was conducted by means of a multiple case study, contrasting a real-life trolling campaign that spread the phrase “It’s Okay To Be White” across several university campuses against an instance of online flaming against an individual. Both the campaign and the flaming had originated from the website 4chan. These two cases will be contrasted in term of effectiveness by means of the responses to the trolling and flaming respectively. These responses were hierarchically classified by applying Baker’s (2001) six forms of responding to flaming in terms of progressively increasing aggression towards the person or message they were directed towards. From the comparison of these cases, it appeared that while the It’s Okay To Be White-campaign (henceforth abbreviated as the IOTBW-campaign) did manage to garner more attention through the traditional media, the responses to the case of online flaming had been far more explicit as well as aggressive and thereby more effective. The implication this has for trolling is that while a large number of views and responses are certainly a requirement for the success of trolling, it does not signify effective trolling. Rather, the quality of the responses (aggressive and emotionally loaded language) is a more adequate determiner for effectiveness in trolling. Future research might look into quantitative analyses of aggressive responses to trolling and flaming alike.","['Flaming', 'Online', 'Offline', 'Trolling']"
Poison in Rhodesia,"Wittenberg, Colm","['Gewald, J.B.']",2019,Faculty of Humanities,African Studies (MA),Master thesis,en,"In the final stages of the Rhodesian Bush War (1975-1980), the white minority government and its Security Forces found themselves on the losing side. In an attempt to combat the flood of guerrillas entering the country, the Rhodesians turned to chemical and biological weapons (CBWs). From 1976 onwards a secret program within the Rhodesian army created, experimented with, and deployed poisons. Water sources were contaminated and doctored clothes and food were entered in the guerrillas’ supply lines. Expanding on existing knowledge about both the war and the CBW program, this thesis takes a closer look at the role poisons played in this conflict. The main purpose of these weapons was to kill guerrillas, for which they were very effective; sometimes even more effective than the standard anti-insurgency strategies the Rhodesians used. The use of poisons also changed the relationship between guerrillas and civilians. The Rhodesians often used civilians to provide the guerrillas with the poisoned goods. When these men or women were discovered, the guerrillas would retaliate. In the early stages of the program this drove a wedge between civilians and guerrillas. According to some scholars this was a serendipitous effect, according to others it was a calculated move in the battle for the hearts and minds of the rural African population. This thesis argues that the Rhodesian’s use of CBWs has helped the guerrillas in gaining legitimacy. Because of the strong connection between poison and witchcraft, the guerrillas were not merely targeted by chemical substances, they were targeted by witches. Because of that, the guerrillas could assume the role of witch-hunter in the eyes of the rural black population. Hunting witches was normally done by Mhondoro, ancestral spirits who control and watch over a piece of land. With the help of spirit mediums and by hunting witches, the guerrillas became living manifestations of Mhondoro spirits, gaining legitimacy over the land in the process. Conquering strangers became familiar liberators.",
Ars Mercatorum. The Role of Art in the Development of Corporate Identity and the Emergence of the Corporate Art Collector,"Goodett, Nathalie","['Damme van, Wilfried']",2019,Faculty of Humanities,Arts and Culture (MA),Master thesis,en,,
"VAPOUR, LIQUID, SOLID: Investigating a tryptic in water by Olafur Eliasson as mediator between man and his environment","Kruijswijk, Misha","['Westgeest, Helen']",2019,Faculty of Humanities,Arts and Culture (MA),Master thesis,en,,"['Olafur Eliasson', 'Contemporary Art', 'Anthropocene', 'Environment', 'Water', 'Process Art', 'Time', 'Landscape', 'Alchemy', 'Systems Theory']"
Colombian Students for Change: the Construction of a Collective Identity and how this shaped MANE's role in Colombian Politics,"Berruti, Claudia","['Valdivia Rivera, Soledad']",2019,Faculty of Humanities,Latijns-Amerikastudies (BA),Master thesis,en,,"['collective identity', 'social movement', 'student movement', 'MANE', 'Colombia', 'Latin America', 'new social movement', 'neoliberalism']"
"A neoliberal institutionalist approach of Brazilian foreign relations with Guinea-Bissau, Cape-Verde and Sao Tome and Principe","Poncet, Jacqueline","['Amann, Edmund']",2019,Faculty of Humanities,International Relations (MA),Master thesis,en,,"['Brazil', 'Guinea Bissau', 'Cape Verde', 'Sao Tome and Principe', 'Neoliberalism', 'South South relations']"
