title,author,supervisors,date,faculty,program,type,language,abstract,keywords
Transmission of postnatal and chronic depression from mothers to children in young adulthood: The role of family functioning and social support,"Safazadeh, Soraya","['Aktar, E.', 'Elzinga, B.M.', 'Halligan, S.']",2017,Faculty of Social & Behavioural Sciences,Psychology (research) (MSc),Research master thesis,en,,
"De relatie tussen SES en schoolbetrokkenheid, en de mediërende rol van pestslachtofferschap","Bugur, Cagla","['Geel, M. van', 'Goemans, A.']",2017,Faculty of Social & Behavioural Sciences,Pedagogische wetenschappen (BSc),Bachelor thesis,nl,,
Investigating the effect of a coup d'état on inequality: examining civic-military relations,"Royall, Alexander R.M.","['Coppenolle, B.K.S. van']",2017,Faculty of Social & Behavioural Sciences,Politicologie (BSc),Bachelor thesis,en,,
A longitudinal study on poor sleep quality as a predictor of depressive symptomatology,"Trapman, Jeroen","['Antypa, N.', 'Krause-Utz, A.D.']",2017,Faculty of Social & Behavioural Sciences,Psychologie (BSc),Bachelor thesis,en,,
Sleep quality and depressive symptom severity: The role of cognitive emotion regulation strategies,"Arslan, Melike","['Antypa, N.', 'Krause-Utz, A.D.']",2017,Faculty of Social & Behavioural Sciences,Psychologie (BSc),Bachelor thesis,en,,
Investigating the relationship between job satisfaction and job performance: From the managers’ perspective,"Dijkstra, Manouk","['Molenmaker, W.E.', 'Dijk, E. van']",2017,Faculty of Social & Behavioural Sciences,Psychology (MSc),Master thesis,en,,"['Job satisfaction', 'Job performance', 'Happy productive worker hypothesis']"
Stalins tragedie: Operatie Barbarossa: Hoe Stalin de Sovjetunie aan de rand van de afgrond bracht,"Doornenbal, J.D.","['Bakker, F.E.']",2017,Faculty of Social & Behavioural Sciences,Politicologie (BSc),Bachelor thesis,nl,,
"Foucault's discipline, toezicht en straf (1975), van discipline- naar controlemaatschappij: De spectaculaire, normaliserende, circulerende en (on)zichtbare elementen van nieuwe vormen van media","Barten, Sarah","['Bähre, E.', 'Boog, I.']",2017,Faculty of Social & Behavioural Sciences,Cultural Anthropology and Development Sociology (BSc),Bachelor thesis,nl,,
"Small states under pressure: Armenia, Azerbaijan and Georgia’s strategies vis-à-vis Russia","Jansen, Erik","['Blarel, N.R.J.B.', 'Boin, R.A.']",2017,Faculty of Social & Behavioural Sciences,Political Science (MSc),Master thesis,en,,
Curiosity and the information-gap: When size actually does matter or how teasers influence curious consumers,"Zilm, Joanna","['Noordewier, M.K.', 'Dijk, W. van']",2017,Faculty of Social & Behavioural Sciences,Psychology (MSc),Master thesis,en,,"['curiosity', 'teaser advertisement', 'information-gap', 'expectancy', 'outcome evaluation']"
Macht en risico,"Ton, Erik","['Scheepers, D.T.', 'Lee, R.A. van der']",2017,Faculty of Social & Behavioural Sciences,Psychologie (BSc),Bachelor thesis,nl,,
Benaderingen van antropogene klimaatverandering aan de hand van het discourse van het Antropoceen: Een kritische bespreking van de notie van het 'Tijdperk van de Mens',"Driehuijs, Floyd","['Pels, P.J.', 'Janssens, F.']",2017,Faculty of Social & Behavioural Sciences,Cultural Anthropology and Development Sociology (BSc),Bachelor thesis,nl,,"['Antropoceen', 'discours', 'klimaatverandering', 'natuur', 'politiek']"
Classifying and coding cases of extended-immediate deterrence: An analysis of the debate between Huth & Russett and Lebow & Stein,"Student, X","['Pellikaan, H.']",2017,Faculty of Social & Behavioural Sciences,Politicologie (BSc),Bachelor thesis,en,,
"When a compliment makes you anxious: The relationships between fear of positive evaluation, state anxiety, post-event processing, and future performance expectations in response to positive peer feedback in a late adolescent sample","Mijnders, Tes","['Miers, A.C.', 'Molen, M.J.W. van der']",2017,Faculty of Social & Behavioural Sciences,Psychology (research) (MSc),Research master thesis,en,,"['fear of positive evaluation', 'future performance expectations', 'positive peer feedback', 'post-event processing', 'social anxiety']"
Lekker in je vel binnen 7 minuten,"Dessauvagie, Lola","['Tollenaar, M.S.', 'Berg, J.F.', 'Heij, W. la']",2017,Faculty of Social & Behavioural Sciences,Psychologie (BSc),Bachelor thesis,nl,,
The user experience of business software: fulfilment of psychological needs as predictor of affect,"Veen, Youp van","['Haazebroek, P.', 'Verschuur, W.L.G.']",2017,Faculty of Social & Behavioural Sciences,Psychology (MSc),Master thesis,en,,"['HCI', 'User experience', 'Business software', 'Psychological needs', 'Affect']"
Professional therapists on criteria for recovery from eating disorders,"Kroon, P.N.N.","['Noordenbos, G.', 'Overgaauw, S.']",2017,Faculty of Social & Behavioural Sciences,Psychology (MSc),Master thesis,en,,
The influence of stress and expectations on skin condition,"Jong, J.M. de","['Meeuwis, S.H.', 'Doef, M.P. van der']",2017,Faculty of Social & Behavioural Sciences,Psychology (MSc),Master thesis,en,,
Cognitive reactivity and the recurrence of depression,"Hartwig, Felicitas L.","['Jans, L.A.W.', 'Antypa, N.']",2017,Faculty of Social & Behavioural Sciences,Psychology (MSc),Master thesis,en,,"['Cognitive reactivity', 'Depression', 'Recurrence', 'LEIDS-R']"
Afsplitsingen in de tweede kamer verklaard: Het verband tussen kandidaatselectie en afsplitsingen nader bekeken,"Stouten, Martijn","['Vollaard, J.P. (Hans)']",2017,Faculty of Social & Behavioural Sciences,Politicologie (BSc),Bachelor thesis,nl,,
A predictive model of activity level and depression on cognition in elderly with dementia living on a psychogeriatric ward,"Ganpat, Sadhena","['Schuitema, I.', 'Hiele, K. van der']",2017,Faculty of Social & Behavioural Sciences,Psychology (MSc),Master thesis,en,,
The influence of oxytocin on sensitivity to cold- and heat pain,"Jong, Hanna de","['Skvortsova, A.', 'Veldhuijzen, D.S.']",2017,Faculty of Social & Behavioural Sciences,Psychologie (BSc),Bachelor thesis,en,,
Risk factors for psychological stress in children of parents with a chronic medical condition,"Ambachtsheer, Utah","['Sieh, D.S.', 'Guicherit, J.A.']",2017,Faculty of Social & Behavioural Sciences,Psychology (MSc),Master thesis,en,,"['Chronic medical condition', 'Child', 'Psychological stress']"
Cognitive deterioration in chronic refractory epilepsy,"Adriaans, Ellen","['Schuitema, I.', 'Habers, G.E.A.']",2017,Faculty of Social & Behavioural Sciences,Psychology (MSc),Master thesis,en,,"['Cognitive deterioration', 'Epilepsy']"
Het effect van het format van een breukenopgave op de prestaties van leerlingen in groep acht van het primair onderwijs en in klas een en twee van het voortgezet onderwijs,"Paasse, Lisa","['Mostert, T.M.M.', 'Hickendorff, M.']",2017,Faculty of Social & Behavioural Sciences,Pedagogische wetenschappen (BSc),Bachelor thesis,nl,,
Text Characteristics and Individual Difference Factors: Effects on Text Processing and Reading Comprehension,"Harpley, Jessica","['Koornneef, A.W.', 'Bruïne, A. de']",2017,Faculty of Social & Behavioural Sciences,Education and Child Studies (MSc),Master thesis,en,,
The effect of an olfactorily conditioned stress management traing on well-being,"Piotraschke, Julia","['Manai, M.', 'Schaefer, R.S.']",2017,Faculty of Social & Behavioural Sciences,Psychologie (BSc),Bachelor thesis,en,,
Conditioned pain modulation: What is the association between optimism and the CPM-effect?,"Post, C.W.","['Veldhuijzen, D.S.', 'Schaefer, R.S.']",2017,Faculty of Social & Behavioural Sciences,Psychologie (BSc),Bachelor thesis,en,,
Het land van Theo van Gogh en Mohammed B.: In hoeverre speelt polarisatie in het Nederlandse Islamdebat een rol in radicalisering?,"Pels, Thomas","['Rana, J.', 'Saptari, R.']",2017,Faculty of Social & Behavioural Sciences,Cultural Anthropology and Development Sociology (BSc),Bachelor thesis,nl,,
Observation of inquiry based instruction methods of teachers from international schools in the Netherlands: correlation with student motivation for and interest in the lesson,"Klaarbergen, Mirjam van","['Raijmakers, M.', 'Schijndel, T.']",2017,Faculty of Social & Behavioural Sciences,Education and Child Studies (MSc),Master thesis,en,,
"""What does it mean?"": Contextual interpretations of intergroup help offers","Boer, Quint de","['Leeuwen, E.A.C. van', 'Ruigendijk, H.A.H.']",2017,Faculty of Social & Behavioural Sciences,Psychology (MSc),Master thesis,en,,"['Intergroup', 'Help', 'Offer', 'Conflict']"
Chinese SMME's in Zuid-Afrika,"Horssen, Marlies van","['Luning, S.W.J.', 'Janssens, F.']",2017,Faculty of Social & Behavioural Sciences,Cultural Anthropology and Development Sociology (BSc),Bachelor thesis,nl,,
Levenstevredenheid en Uitstelgedrag,"Bartelts, Bram","['Hickendorff, M.', 'Koornneef, A.W.']",2017,Faculty of Social & Behavioural Sciences,Pedagogische wetenschappen (BSc),Bachelor thesis,nl,,
Parental evaluation of care in multiproblem families and the role of communication,"Moor, I.I.","['Doef, M.P. van der', 'Chris, C.J.M.', 'Pannebakker, N.']",2017,Faculty of Social & Behavioural Sciences,Psychology (MSc),Master thesis,en,,"['Evaluation of care', 'multi-problem families', 'communication']"
"Depression, self-efficacy regarding self-management, and healthy lifestyle behaviors for chronic kidney disease patients in predialysis stage","Hortensius, S.","['Dijk, S. van', 'Peerdeman, K.J.']",2017,Faculty of Social & Behavioural Sciences,Psychology (MSc),Master thesis,en,,"['depression', 'chronic kidney disease', 'self-efficacy']"
Identities and narratives as social constructs: The making of sectarion war in Yemen,"Hofs, Maartje","['Ragazzi, F.P.S.M.', 'Nieuwenberg, P.']",2017,Faculty of Social & Behavioural Sciences,Political Science (MSc),Master thesis,en,,
"The effects of duration and degree of democracy on income inequality in Chile, Costa Rica and Uruguay","Wemmenhove, Vincy","['Coppenolle, B.K.S. van']",2017,Faculty of Social & Behavioural Sciences,Politicologie (BSc),Bachelor thesis,en,,
Een kwestie van identiteit: Hoe de sociale identiteit van Eshkol de non-compliance van Israël na de zesdaagse oorlog verklaard,"Hal, Danielle van","['Vonno, C.M.C. van']",2017,Faculty of Social & Behavioural Sciences,Politicologie (BSc),Bachelor thesis,nl,,
Het hebben van macht en nemen van risico: Hoe het nemen van risico wordt beïnvloed door machtservaring en morele identiteit,"Hoeven, Maik van der","['Scheepers, D.T.', 'Lee, R.A. van der']",2017,Faculty of Social & Behavioural Sciences,Psychologie (BSc),Bachelor thesis,nl,,
Neural feedback mechanisms in response to social evaluative feedback: The role of theta power in social anxiety,"Bach, Miriam","['Molen, M.J.W. van der', 'Harrewijn, A.']",2017,Faculty of Social & Behavioural Sciences,Psychologie (BSc),Bachelor thesis,en,,"['EEG', 'social anxiety', 'social evaluation', 'theta power', 'time-frequency analysis']"
De sensitiviteit en de depressiesymptomen van de moeder in relatie tot agressief gedrag en internaliserende gedragsproblemen bij het kind met 20 maanden,"Sahan, Nesrin","['Huijbregts, S.C.J.', 'Adrichem, D.S.']",2017,Faculty of Social & Behavioural Sciences,Education and Child Studies (MSc),Master thesis,nl,,
"Verschillen tussen sporters en niet-sporters in de mate van zelfwaardering, extraversie als moderator","Koenders, M.","['Haringsma, R.', 'Edelaar-Peeters, Yvette']",2017,Faculty of Social & Behavioural Sciences,Psychologie (BSc),Bachelor thesis,nl,,
Processing speed in adults with autism spectrum disorder: Influence of gender and hypersensitivity,"Oosterhuis, Maroussia S.","['Habers, G.E.A.', 'Schuitema, I.']",2017,Faculty of Social & Behavioural Sciences,Psychology (MSc),Master thesis,en,,
Exploring the physiological stress system in infants: Interrelations with maternal sensitivity and infants’ temperament,"Zandvliet, Ruth","['Huijbregts, S.C.J.', 'Swaab, H.']",2017,Faculty of Social & Behavioural Sciences,Developmental Psychopathology in Education and Child Studies (research) (MSc),Research master thesis,en,,
"De onderlinge invloeden van drie variabelen ten opzichte van leessnelheid: Voorkennis, werkgeheugen en tekstbegrip","Breejen, R. den","['Bakker, A.', 'Koornneef, A.']",2017,Faculty of Social & Behavioural Sciences,Pedagogische wetenschappen (BSc),Bachelor thesis,nl,,
De vergelijking van de invloed van feedback op tekstbegrip tussen digitaal lezen en lezen op papier bij kinderen en adolescenten: Een meta-analyse,"Snijders, Manouk","['Swart, E.K.', 'Chung, S.']",2017,Faculty of Social & Behavioural Sciences,Education and Child Studies (MSc),Master thesis,nl,,
Hartkloppingen en zweethandjes?: Het effect van een ontspanningsoefening en verbale suggestie op de fysiologische stressreactie: Met piekeren als mogelijke mediator,"Siepel, Eline","['Schakel, L.', 'Laarhoven, A.I.M. van']",2017,Faculty of Social & Behavioural Sciences,Psychologie (BSc),Bachelor thesis,nl,,
De relatie tussen emotieregulatie bij baby’s en het ontstaan van agressief gedrag op de peuterleeftijd,"Hofman, Judith","['Heijden, K.B.', 'Suurland, J.']",2017,Faculty of Social & Behavioural Sciences,Pedagogische wetenschappen (BSc),Bachelor thesis,nl,,
Interpersoonlijke circumplex en conflicthanteringstrategieën,"Kouterik, Esmée van","['Heus, P.de', 'Weeda, W.D.']",2017,Faculty of Social & Behavioural Sciences,Psychologie (BSc),Bachelor thesis,nl,,
The role of cognition within the framework of the clinical staging model for psychotic disorders,"Numminen, Essi","['Habers, G.E.A.', 'Schuitema, I.']",2017,Faculty of Social & Behavioural Sciences,Psychology (MSc),Master thesis,en,,"['Cognition', 'Schizophrenia', 'Staging']"
The influence of labels: increasing the stigma?: Differences in valuing mental and physical health states between psychology students and beta students,"Zwamborn, Yaelle","['Edelaar-Peeters, Y.', 'Haringsma, R.']",2017,Faculty of Social & Behavioural Sciences,Psychologie (BSc),Bachelor thesis,en,,
Representativiteit van behandeluitkomsten binnen zorgdomein verslaving care,"Havers, Christel","['Beurs, E. de', 'Berg, J.F. van den']",2017,Faculty of Social & Behavioural Sciences,Psychologie (BSc),Bachelor thesis,nl,,
"Categorization, decolonization and implicit norm creation: The diversity of inclusive education","Jong, Sharon de","['Boog, I.', 'Postma, M.A.']",2017,Faculty of Social & Behavioural Sciences,Cultural Anthropology and Development Sociology (MSc),Master thesis,en,,
"De samenhang tussen prenataal reflectief functioneren, moederlijke sensitiviteit en internaliserend probleemgedrag van het kind op 6 en 20 maanden","Nobels, Jolanda","['Heijden, K.B. van der', 'Suurland, J.']",2017,Faculty of Social & Behavioural Sciences,Pedagogische wetenschappen (BSc),Bachelor thesis,nl,,
"The economic tunnel vision me, myself and I: How an economic frame affects ostracism and the experienced feelings","Maarseveen, Enola van","['Doolaard, F.T.', 'Noordewier, M.K.']",2017,Faculty of Social & Behavioural Sciences,Psychology (MSc),Master thesis,en,,"['ostracism', 'prosocial behaviour', 'economic schema', 'cyberball', 'priming']"
The difference in evaluation of people who show congruent and incongruent emotions,"Troost, Carolien G.A.","['Dijk, W.', 'Seip, E.C.']",2017,Faculty of Social & Behavioural Sciences,Psychology (MSc),Master thesis,en,,['Schadenfreude']
"The tragedy of the anticommons: The influence of social value orientation, the trophy effect, and profitability on willingness to accept in an anticommons dilemma","Tellam, Daan","['Kwaadsteniet, E.W. de', 'Dijk, E. van']",2017,Faculty of Social & Behavioural Sciences,Psychology (MSc),Master thesis,en,,"['anticommons', 'ownership']"
De invloed van het DRD4-genotype op leesvaardigheid en leesmotivatie,"Jaskirat, Singh","['Swart, E.K.', 'Dijken, M.J. van']",2017,Faculty of Social & Behavioural Sciences,Pedagogische wetenschappen (BSc),Bachelor thesis,nl,,
Ras ontvouwd: Een antropologisch perspectief op de theoretische kaders van het concept ras,"Biervliet, Stefana","['Pels, P.J.', 'Boog, I.']",2017,Faculty of Social & Behavioural Sciences,Cultural Anthropology and Development Sociology (BSc),Bachelor thesis,nl,,['ras']
Performance of Turkish migrants on a adapted visual association test,"Kalkisim, Yuled","['Peerdeman, K.J.']",2017,Faculty of Social & Behavioural Sciences,Psychology (MSc),Master thesis,en,,
Ongewenste bemoeizucht of morele verantwoordelijkheid: Opvattingen over abortus in het Nederlandse parlementaire debat omtrent interventie en soevereiniteit,"Pondman, Lili","['Mansvelt Beck, B.J.']",2017,Faculty of Social & Behavioural Sciences,Politicologie (BSc),Bachelor thesis,en,,
De invloed van mismatchgrootte op assimilatie of contrast effecten bij verwachtingen van geluid,"Nijhuis, Nicolette Janine","['Jepma, M.', 'Steenbergen, L.']",2017,Faculty of Social & Behavioural Sciences,Psychologie (BSc),Bachelor thesis,nl,,
De invloed van organisaties op issue emergence binnen transnational advocacy networks,"Eenennaam, Bob van","['Vonno, C.M.C. van']",2017,Faculty of Social & Behavioural Sciences,Politicologie (BSc),Bachelor thesis,nl,,
De invloed van verschillende manieren van voorlezen op de woordenschat en het verhaalbegrip van kleuters,"Hoed, Esther den","['Dijken, M.J. van', 'Mol, S.E.']",2017,Faculty of Social & Behavioural Sciences,Education and Child Studies (MSc),Master thesis,nl,,
Macht en risico: Empirisch onderzoek naar het effect van de betekenis van macht (als mogelijkheid of verantwoordelijkheid) op het nemen van risico,"Schellens, Thomas","['Scheepers, D.T.', 'Lee, R.A. van der']",2017,Faculty of Social & Behavioural Sciences,Psychologie (BSc),Bachelor thesis,nl,,
Test anxiety: Uncovering the association between test anxiety and dynamic testing,"Fragkiadaki, Diamanto","['Vogelaar, B.', 'Resing, W.C.M.']",2017,Faculty of Social & Behavioural Sciences,Psychology (MSc),Master thesis,en,,"['test anxiety', 'dynamic testing', 'analogical reasoning', 'instructional needs']"
De effecten van een verbale suggestie op een ontspanningsoefening ten aanzien van acute stress waarbij er gecontroleerd wordt voor neuroticisme,"Noordover, Theo","['Schakel MCs, L.', 'Laarhoven, A.I.M. van']",2017,Faculty of Social & Behavioural Sciences,Psychologie (BSc),Bachelor thesis,nl,,
Persoonlijke ontwikkeling en geluk in het leven in relatie tot werk en carrière maken,"Eijk, Marloes van","['Rooij, M.J. de', 'Dechesne, M.', 'Wilderjans, T.F.']",2017,Faculty of Social & Behavioural Sciences,Psychologie (BSc),Bachelor thesis,nl,,
The association between visuoconstruction and survival in dementia with lewy bodies,"Kerklaan, Anke","['Peerdeman, K.J.']",2017,Faculty of Social & Behavioural Sciences,Psychology (MSc),Master thesis,en,,"['Dementia lewy bodies', 'Visuoconstruction', 'Survival']"
"The effects of attention and concentration on sequential movement learning: Researching the relationship between attention, concentration, musical guidance and transfer","Padmos, Inoura","['Schaefer, R.S.', 'Veldhuijzen, D.S.']",2017,Faculty of Social & Behavioural Sciences,Psychologie (BSc),Bachelor thesis,en,,
Een onderzoek naar de relatie tussen cumulatieve en vroegkinderlijke traumatische gebeurtenissen en psychopathologie in een studentenpopulatie,"Kalkman, Eline","['Mouthaan, J.', 'Haringsma, R.']",2017,Faculty of Social & Behavioural Sciences,Psychologie (BSc),Bachelor thesis,nl,,
Contextuele en kale breukopgaven: Het effect van het format op de prestaties van leerlingen uit het primair en voortgezet onderwijs,"Kaltner, Ilona","['Mostert, T.M.M.', 'Hickendorff, M.']",2017,Faculty of Social & Behavioural Sciences,Pedagogische wetenschappen (BSc),Bachelor thesis,nl,,
The effect of social norms on sustainable consumption in a loyalty programme,"Driessen, Amely","['Mors, E. ter', 'Dijk, W. van']",2017,Faculty of Social & Behavioural Sciences,Psychology (MSc),Master thesis,en,,"['sustainable consumption', 'social norm']"
De werktevredenheid-werkprestatie relatie: een self-fulfilling prophecy?,"Boukich, Ghizlan","['Molenmaker, W.E.', 'Kwaadsteniet, E.W. de']",2017,Faculty of Social & Behavioural Sciences,Psychologie (BSc),Bachelor thesis,nl,,
Differences in mainstream media coverage of the Ukraine crisis in Poland and the Netherlands,"Akker, Marta op den","['Meffert, M.F.']",2017,Faculty of Social & Behavioural Sciences,Politicologie (BSc),Bachelor thesis,en,,
Flightcrew crew resource management training,"Galan, Michiel de","['Band, G.P.H.', 'Poletiek, F.H.']",2017,Faculty of Social & Behavioural Sciences,Psychology (MSc),Master thesis,en,,
Losing the land: The consequences of the land concessions in Cambodia from a perspective of choice,"Verkade, Annelin","['Maaker, E. de', 'Janssens, F.']",2017,Faculty of Social & Behavioural Sciences,Cultural Anthropology and Development Sociology (MSc),Master thesis,en,,
Studenten met HFA: De invloed van cognitieve flexibiliteit en theory of mind op studievertraging,"Reinds, Heleen","['Ziermans, T.B.', 'Dijkhuis, R.R.']",2017,Faculty of Social & Behavioural Sciences,Education and Child Studies (MSc),Master thesis,nl,,
Consociational democracy: what was driving Lebanon's sectarian strife between 2006 and early 2016?,"Sileikaite, Agne","['Spirova, M.S.', 'Zwart, F. de']",2017,Faculty of Social & Behavioural Sciences,Political Science (MSc),Master thesis,en,,
Het effect van een interventie - gericht op ouder-kind interactie - op de woordenschat van één-jarigen,"Joode, J.Y. de","['Jong-Kegel, C.A.T. de', 'Kooy-Hofland, V.A.C. van der']",2017,Faculty of Social & Behavioural Sciences,Education and Child Studies (MSc),Master thesis,nl,,
A study of emotion labour and burnout in the indian hospitality industry: Does following ‘Atithi Devo Bhava’ make ‘the’ difference?,"Wandrekar, A.S.","['Doef, M.P. van der', 'Verhoeven, C.J.M.']",2017,Faculty of Social & Behavioural Sciences,Psychology (MSc),Master thesis,en,,"['Emotional labour', 'Burnout', 'Indian hospitality industry']"
De invloed van Transcutaneous Nervus Vagus Stimulatie tijdens de uitvoering van de Emotional Attentional Blinktaak,"Andric, Jessica","['Burger, A.M.', 'Overgaauw, S.']",2017,Faculty of Social & Behavioural Sciences,Psychologie (BSc),Bachelor thesis,nl,,
De relatie tussen temperament en fysieke agressie bij kinderen in de baby- en peuterleeftijd,"Veenstra, Dorien","['Heijden, K.B. van der', 'Suurland, J.']",2017,Faculty of Social & Behavioural Sciences,Pedagogische wetenschappen (BSc),Bachelor thesis,nl,,
The effects of virtual reality navigation training in healthy individuals,"Bouwmeester, J.","['Ham, C.J.M. van der', 'Peerdeman, K.J.']",2017,Faculty of Social & Behavioural Sciences,Psychology (MSc),Master thesis,en,,
Olfactory conditioning of a brief stress-management training and the effects of optimism and pessimism thereon,"Bisschops, Kirsten","['Ciere, Y.', 'Middendorp, H. van']",2017,Faculty of Social & Behavioural Sciences,Psychologie (BSc),Bachelor thesis,en,,
De legitimiteit van de rechterlijke macht onder vuur,"Kramer, J.S.","['Waling, G.H.', 'Vollaard, J.P.']",2017,Faculty of Social & Behavioural Sciences,Political Science (MSc),Master thesis,nl,,
The power of powernapping: A research of the relation between sleep rhythm and dopamine,"Rust, Anne","['Steenbergen, L.', 'Lippelt, D.P.']",2017,Faculty of Social & Behavioural Sciences,Psychologie (BSc),Bachelor thesis,en,,
How does competitive behaviour develop?: A predator-prey contest game in adolescence,"Ruiter, Maaike de","['Beijer, M.', 'Crone, E.A.M.']",2017,Faculty of Social & Behavioural Sciences,Psychologie (BSc),Bachelor thesis,en,,
De invloed van omgevingsfactoren op de gedragsproblemen bij kinderen met een autisme spectrum stoornis,"Homan, Merel","['Rijn, S. van', 'Bouw, N.']",2017,Faculty of Social & Behavioural Sciences,Pedagogische wetenschappen (BSc),Bachelor thesis,nl,,
Security after terrorism: Explaining differing security responses following large-scale terrorist attacks,"Larsen, Jarl Mattias","['Ragazzi, F.P.S.M.', 'Brinkel, T.B.F.M.']",2017,Faculty of Social & Behavioural Sciences,Political Science (MSc),Master thesis,en,,
"What it feels like, for a girl: A feminist analysis of how Shona girls navigate kinship systems and cope with patriarchy","Zvobgo, Julia Chandapiwa","['Postma, M.A.', 'Jansen, J.A.M.M.']",2017,Faculty of Social & Behavioural Sciences,Cultural Anthropology and Development Sociology (MSc),Master thesis,en,,"['gender', 'agency', 'feminism', 'auto-ethnography', 'kinship', 'bride price', 'Zimbabwe']"
Curious evaluations,"Veenhuizen, Tim","['Noordewier, M.K.', 'Dillen, L.F. van']",2017,Faculty of Social & Behavioural Sciences,Psychologie (BSc),Bachelor thesis,en,,
Experienced in wayfinding? The relation between spatial experience and performance on spatial navigation exercises,"Ruiter, Eileen","['Ham, C.J.M. van der', 'Skvortsova, A.']",2017,Faculty of Social & Behavioural Sciences,Psychologie (BSc),Bachelor thesis,en,,
