title,authors,supervisors,date,language,keywords,program,abstract
"The_effect_of_gender_nonconformity_of_the_applicant_on_CV_ratings-
_mediated_by_perceived_warmth-_competence_and_morality","['Wolda, M.']","['Toorn, J,. van der']",2020-05-18T18:00:10Z,en,"['Discrimination, gender nonconformity, CV ratings, hireability, \nqualification']","Social, Health and Organisational Psychology","Appearances are often found to be subject to discrimination in the hiring process. The 
present study investigates the effect of gender nonconform appearances on CV 
ratings. A job ad for a junior lawyer and four different CVs were created. Only the 
photo of the four CVs differed, depicting a female gender conform person, a female 
gender nonconform person, a male gender conform person and a male gender 
nonconform person. Participants were asked to imagine that they were a recruiter and 
had to judge the suitability of the applicant for the job ad. Participants (n = 174) rated 
the CV on a scale for perceived hireability, perceived qualification and salary 
conferral. To investigate mediating processes, additional scales for warmth, 
competence and morality were filled out (n = 169). Gender nonconformity of the 
male applicant as opposed to gender conformity negatively affected his assigned 
salary, but not his perceived hireability and perceived qualification. Gender 
nonconformity of the female applicant as opposed to gender conformity positively 
affected her rated hireability, but not her assigned salary and rated qualification. No 
mediation effects were found. Although not for all variables effects are found, this 
study does show that gender nonconform people might face some discrimination 
according to the salary differences obtained for men and the hireability differences 
obtaind for women. These are important findings, because discrimination could be 
one of the causes for the poorer psychological wellbeing of gender nonconform 
people and their lower average income. Further research is needed to investigate if the 
missing of expected effects is due to limitations of this study."
"Postpartum Depressive Symptoms through a Self-Determination Theory Perspective: Basic Needs, Maladaptive Perfectionism and Partners’ Interpersonal Style","['Sodderland, L.']","['Neyrinck, B.A.M.']",2020-05-18T18:00:10Z,en,"['postpartum depression, self-determination theory, maladaptive perfectionism, autonomy support, psychological control, need frustration']",Clinical Psychology,"Using a Self-Determination Theory perspective, this study examined the role of maladaptive perfectionism and partners’ interpersonal style (i.e., partners’ autonomy support and psychological control) in both paternal and maternal postpartum depressive symptoms (PDS). Also, the mediating effect of need frustration on the relation between maladaptive perfectionism and PDS was investigated. Five self-report questionnaires were completed by a total of 251 Dutch parents (fathers 37.5%, mothers 62.5%) of 1- to 8-months old children. A hierarchical multiple regression analysis showed maladaptive perfectionism and need frustration to be independent positive predictors of PDS. Additionally, mediation analyses showed need frustration to mediate the relation between maladaptive perfectionism and PDS, with full mediation in fathers and partial mediation in mothers. Possible explanations and conclusions based on our findings are discussed, underscoring the need to include fathers in research into PDS."
"Investigating Prevalence of Disordered Eating and its Association to Risky Sexual Behaviour, in Filipino University Students","['Cornelissen, M.C.']","['Sternheim, L.']",2020-05-15T18:00:08Z,en,[],Neuropsychology,"Eating disorders (ED) are a serious illness that can have detrimental effects on a individuals psychosocial functioning. Though the aetiology still remains unclear, there have been various investigations examining the association between ED and impulsivity in terms of maladaptive behaviours, such as substance abuse and risky sexual behaviours. Unfortunately, most of the existing research on this topic are based on western population samples. Therefore, the objective of this investigation is to determine the prevalence of disordered eating and examine the association of disordered eating behaviour, specifically the binge purge type, and risky sexual behaviour (RSB), within a non-western population sample (Philippines). 246 students from various universities completed both the eating attitudes questionnaire (EAT-26) and the Sexual Risk Survey (SRS). Results demonstrate a prevalence of 56.3% scoring above the cut-off point of 20, indicative of serious disturbances in eating behaviours or attitudes, and warrants further evaluation by a qualified professional. A weak positive correlation was found between disordered binge-purge behaviour and RSB (r = .241, p &lt; 0.001). The findings exhibit that prevalence of disordered eating are higher than that of western results. These findings further support western literature demonstrating the co-occurrence of disordered eating and impulsivity."
Rijksbijdragen in perspectief,"['Tielraden, E.P. van']","['Mandemakers, dr. Jornt', 'Maas, prof. dr. Ineke']",2020-05-18T18:00:10Z,nl,[],Sociology: Contemporary Social Problems,"Deze scriptie heeft onderzoek gedaan naar het besluitvormingsproces van infrastructurele projecten. Het onderzoek heeft de Rijksbijdragen van verschillende infrastructurele projecten onderzocht en daarbij zijn interviews afgehouden met sleutelfiguren. Hierbij zijn verschillende factoren achterhaald die het besluitvormingsproces beïnvloeden en deze zijn vervolgens geprobeerd te verklaren. 
Tot slot zijn beleidsaanbevelingen gedaan voor het ministerie van Infrastructuur & Waterstaat."
Heterogeniteit in conformerend gedrag bij sociale beïnvloeding,"['Horde, T.']","['Rijt, A. van de', 'Maas, W.A.F.']",2020-05-18T18:00:08Z,nl,[],Sociologie,
De dreigende macht van online platformen,"['Bruin, R.B. de']","['Hassler-Forest, Dan']",2020-05-27T18:00:08Z,nl,['deeleconomie; AirBnB; customization; platformeconomie; interface-analyse'],Communicatie- en informatiewetenschappen,"Door de digitalisering van de samenleving heeft de deeleconomie een exponentiële groei doorgemaakt. Een  succesvol voorbeeld van bedrijf binnen de deeleconomie is AirBnB. AirBnB is een online platform voor de wereldwijde (ver)huur van accommodaties. Hierbij staat de huurder een authentieke, persoonlijke ervaring bezorgen centraal. De afgelopen jaren is er kritiek geleverd op de werking van het platform. Volgens critici veroorzaakt het platform overlast in wijken, onwijkt het de belasting en hebben werknemers geen onderhandelingspositie. Een minstens even relevant vraagstuk is hoe AirBnB aan de hand van een niet-neutrale interface gebruikers stuurt met het doel om data te ontrekken. Het (door)verkopen van data aan marktonderzoekers en adverteerders levert immers geld op. Dit staat in contrast met de idealistische, niet-commerciële visie van AirBnB. In dit eindwerkstuk is aan de hand van de discursieve interface-analyse van Stanfill (2015) onderzocht hoe de interface van AirBnB bijdraagt aan de machtspositie van bedrijven binnen de deeleconomie. Dit is gedaan door de homepage, de zoekpagina en de resultatenpagina van de website en de applicatie van AirBnB te analyseren. De authentieke uitstraling van de interface draagt bij aan de idealistische, niet-commerciële visie door persoonlijke details in de kamer als  foto te plaatsen of door de kamer een persoonlijke naam te geven. Bovendien wordt de algemene informatie zoals de prijs of de voorzieningen in de kamer aanzienlijk kleiner afgebeeld dan de foto’s en de naam van de kamer. In een eventueel kwantitatief vervolgonderzoek is het relevant om te meten hoe gebruikers daadwerkelijk reageren op de verschillende affordances."
"Organizational Citizenship Behavior and the relationship with Burnout, Work Engagement, and JD-R Model","['Crovetto Roba, J.A.']","['Ijbema, J.F.']",2020-05-27T18:00:15Z,en,"['Job demands, Job resources, Burnout, Work engagement, OCB.']","Social, Health and Organisational Psychology","Purpose – The present study is based on the JD-R model and aims to understand the relationship between job resources, job demands and organizational citizenship behavior. It is also intended to research the potential role of burnout and work engagement as a mediator between job resources, job demands, and OCB-I and OCB-O.  Design and method – Cross-sectional data was collected from employees of higher educational institutions in Chile. The hypothesized model was tested using multiple linear regression and PROCESS-macro from Hayes (2017).  Findings – Role clarity positively and directly relates to work engagement, and both job demands (workload and emotional demands) are positively and directly related to burnout. Social support, work engagement, and burnout relate positively and directly with OCB-I. Social support and work engagement are positively and directly associated with OCB-O. Role clarity is negatively and directly associated with OCB-O. Additionally, work engagement and burnout partially mediate the relationship that both job demands and role clarity have with OCB. Originality – This study contributes to the knowledge about the JD-R model and its relationship with OCB-I and OCB-O in Chile.  Furthermore, the results indicate that work engagement could potentially promote OCB in the workplace. Therefore, organizations could promote OCB by promoting wellbeing at work."
The content of mental imagery in Acrophobia: the potential of virtual reality in chartering mental imagery,"['Dorresteijn, S. van']","['Meyerbroker, K.']",2020-05-27T18:00:14Z,en,[],Clinical Psychology,"Mental imagery is a subjective experience and its antecedents and consequents are objectively observable. Mental images can be positive or negative and are often associated with emotions. One anxiety disorder in which there is little known about the content of mental imagery is acrophobia. This research aims to look at the content of the mental imagery concerning heights.  First, participants will be randomly assigned to either the low-high condition or the high-low condition. Further, participants will be exposed to different height positions in a virtual reality environment, after which they have to answer questionnaires and an interview about if they experienced mental imagery, voluntarily or involuntarily and about in which modalities and from which perspectives these were experienced.   A Chi-Square Test for Goodness of Fit was done to compare whether looking down from heights triggered the same mental imagery as looking up to heights on different variables.  All four hypotheses, about the content, voluntariness, the sensory modalities and the vividness of the mental imagery, were rejected. It is advised to do future research with a larger, more clinical sample."
"Social Networks, Social Support and Public Parks in Ljubljana","['Oostwegel, L.J.N.']","['Mollenhorst, G.W.']",2020-06-02T18:00:18Z,en,['social networks; social support; slovenia; ljubljana; social exclusion; urban green space; green space;  parks; family network; neighbourhood'],Human Geography,"In 2016, almost 75% of the European population lived in cities. While some citizens have the opportunity to access nature areas far away from thebuilt environment, others have limited options to do so. Therefore, there is a growing need for healthy and green spaces. Public green spaces, such as parks; urban forests; and recreational and sports grounds provide convenient recreation options that increase the citizens’ well-being. Often, it is proposed that public green space has a number of social benefits. It is suggested that public green space affects the social networks of residents. Social interactions in public parks are studied frequently, but little is known if this actually results in a bigger or stronger social network. On top of that, while it is sometimes suggested that urban green space affects social support, research is lacking to support this claim. A broader understanding is needed of the relationship between social networks, social support and urban green space. 201 citizens of Ljubljana, Slovenia, filled out a survey about the urban green spaces they visit, their social network and the amount of social support they receive. Residents that visit green space have more strong ties than residents that do not. On top of that, residents that visit green space in the neighbourhood, have more weak ties within the neighbourhood. The amount of social support received, is bigger for those that go to parks, but this is completely mediated by the fact that they have more strong ties. Further research is needed, to find out if this is really caused by social interactions in parks, or if this has other grounds."
Samen informatie zoeken: Het effect van samenwerken op de betrouwbaarheid van de gevonden informatie,"['Zwierenberg, N.']","['Kleijn, Suzanne']",2020-06-09T18:00:14Z,nl,[],Communicatie- en informatiewetenschappen,"Internet is voor veel mensen een bron van informatie. Dit onderzoek wil aantonen dat samenwerking de betrouwbaarheid van gezochte informatie verhoogt. Uit onderzoek van Walraven et al. (2009) blijkt dat een individuele leerling weinig criteria gebruikt voor het beoordelen van de betrouwbaarheid van op internet gevonden informatie. De aanname hierbij is dat het gebruik van meer criteria leidt tot een betere beoordeling van de informatie. Uit andere onderzoeken komt naar voren dat samenwerken een positieve invloed kan hebben op leerresultaten. In dit onderzoek is onderzocht hoeveel criteria worden gebruikt door mensen die samenwerken. 

Tien deelnemers zijn gevraagd om in duo’s een zoekopdracht uit te voeren en een vragenlijst in te vullen. De schermacties zijn opgenomen en in een interview besproken. Statements over criteria en samenwerken in de interviews/vragenlijst zijn gecodeerd. Uit deze studie komt naar voren dat samenwerken tijdens een zoekopdracht het gebruik van meer broncriteria bevordert, waardoor het gebruik van betrouwbare bronnen wordt gestimuleerd.

Bij dit onderzoek zijn kanttekeningen te maken: de doelgroep van de participanten is ouder en hoger opgeleid dan de doelgroep in het onderzoek van Walraven et al. (2009).  En er zijn beduidend minder deelnemers geïnterviewd. In dit onderzoek is gekozen om interviews op basis van beeldschermopnames van de activiteiten op de computer uit te voeren in plaats van de hardop-denk-methode die Walraven et al. (2009) gebruikt hebben. De in dit onderzoek gebruikte methode biedt echter ruimte voor reflectie. De interviewvragen hebben mogelijk onvoldoende ingezoomd op samenwerking tijdens het zoeken. Ondanks de kritische noten bij het uitgevoerde onderzoek, heeft het onderzoek inzicht gegeven in de positieve invloed van samenwerking op het toetsen van de betrouwbaarheid van bronnen. Dit is waardevol voor educatieve instituties."
Wayfinding and signage for mobility hubs:  a case study at Utrecht Central Station.,"['Castellsaguer Petit, E.']","['Janssen, C.']",2020-06-08T18:00:21Z,en,[],Applied Cognitive Psychology,"Mobility hubs are places where multiple transportation modes are available and where these 
different kinds of transportation can be shared. These kinds of commercial, public areas need 
good wayfinding strategies to make every traveler's journey as successful and safe as 
possible. The goal of this thesis is to identify what the information wants and needs are for 
different travelers. In the first study, 92 travelers were interviewed at Utrecht Central Station 
to find out what kind of traveler wants what kind of information, what they think of the 
current signage at the station, and how they would improve this. Results indicated that most 
travelers had trouble locating themselves, thought signage was not well placed, and had 
trouble finding different modes of transport, especially bus stations. In a second study, I 
looked at the questions that were asked at the information booths at the station. The questions 
correlated with the problems found in the interviews and gave some additional insights. 
Taken together, this research recommends taking the more vulnerable target groups into 
consideration, like older adults and people who rarely visit the hub, when designing a future mobility hub"
De favela’s in Rio de Janeiro en haar bewoners,"['Lubach, V.G.']","['Kerckhoffs, Dennis']",2020-06-29T18:00:13Z,nl,[],Liberal Arts and Sciences,"Rio de Janeiro in Brazilië kent momenteel 600 favela’s. De omstandigheden waarin de
bewoners van de favela’s leven hebben zowel invloed op de bewoners als op de omgeving. Dit
interdisciplinaire onderzoek onderzoekt de effecten en consequenties van de favela’s in Rio de
Janeiro op de bewoners van de favela’s. Op basis van de geïntegreerde inzichten uit de
disciplines Internationale Betrekkingen, Sociale Geografie, Pedagogische Wetenschappen en
Geneeskunde wordt een antwoord gegeven op de onderzoeksvraag: Hoe kan de interactie
tussen de favela’s in Rio de Janeiro en haar bewoners in kaart worden gebracht? De conclusie
hierbij is dat alle vier de disciplines het erover eens zijn dat er een wederzijdse interactie is.
Deze interactie bevindt zich op verschillende niveaus en schalen en is in kaart gebracht op basis
van het ecologische systeem model van Bronfenbrenner."
"Participating in the Streets: Social Conflict and its Influence on Policy Planning, a Comparative Study of Gas Extraction in Groningen and Wind Farm Development in Drenthe (2000-2019)","['Ferwerda, M.']","['Schouwenburg, H.']",2020-07-02T18:00:17Z,en,"['social conflict, self-organised participation, protest movements, gas induced earthquakes, wind farm development, comparative analysis, Groningen, Drenthe']",Geschiedenis van Politiek en Maatschappij,"In this thesis the causes for the success of social conflict, as form of self-organised participation, in influencing policy and planning is analysed. In Groningen people struggle with the consequences of the extraction of fossil fuels, as gas induced earthquakes frequently hit the province. In Drenthe the need for more sustainable energy is perceived as a threat to the landscape and community, as large wind farm projects are developed in the region. In this thesis a comparison of the movements that emerged in response to the policies attached to these cases is made. A combination of success factors is formulated: if the public opinion is favourable towards a movement, it contributes to the support the movement enjoys, with enough support the movement is able to expand its actions, these actions should include legal procedures, if ruled in favour of the movement, success is inevitable."
Institutioneel Kosmopolitisme- Een oplossing,"['Mein, M.']","['Sauer, H.C.']",2020-07-02T18:00:19Z,nl,"['Kosmopolitisme, Thomas Pogge, Rechtvaardigheid']",Filosofie,"Grootschalige mensenrechtenschendingen zijn een wereldwijd probleem. Thomas Pogge stelt in Cosmopolitanism and Sovereignty dat de huidige institutionele regels een belangrijke oorzaak zijn van de schendingen en hij ontwikkelt het institutioneel kosmopolitisme als oplossing voor deze kwestie. Hij stelt dat er afstand genomen moet worden van het huidige concept van soevereiniteit en niet enkel onder staten verdeeld moet worden. In zijn voorstel behouden staten absolute politiek gezag over bepaalde domeinen, maar staan naast mondiale bestuursorganen met absolute politiek gezag over andere gebieden. Dit essay zal evalueren in hoeverre zijn kosmopolitisme bij kan dragen aan een toename van het aantal gerealiseerde mensenrechten. Ik zal als eerste formuleren waar het huidige systeem van soevereine staten tekort schiet en vervolgens zal ik betogen hoe het institutioneel kosmopolitisme hiervoor een oplossing kan bieden."
"The Transvestite, the Transsexual and the Trans Woman: The Transmisogynist Representation of Transgender Killers in Psycho, The Silence of the Lambs and The Mantis","['Ophelders, E.P.H.']","['Aaftink, C.']",2020-07-03T18:00:09Z,en_US,"['transgender, trans women, representation, queer theory, trans theory, literature, film, television, pathologization, transmisogyny, intersectionality']",Engelse taal en cultuur,"This thesis examines three stories revolving around the transmisogynist trope of transgender female serial killers: the 1959 novel Psycho by Robert Bloch and its film adaptations by Alfred Hitchcock and Gus van Sant, the 1989 novel The Silence of the Lambs by Thomas Harris and its film adaptation by Jonathan Demme, and the Netflix Original series The Mantis. By historically contextualizing these texts and critiquing contemporaneous conceptualizations of transgender individuals through a modern-day trans activist lens, the way in which past societal beliefs contributed to the transmisogyny in the texts is explored. Norman Bates in Psycho is portrayed as a crossdressing man, which is presented as a symptom of being dangerously disturbed, linking gender nonconformity and mental illness to extreme violence. Jame Gumb in The Silence of the Lambs is portrayed as a transgender woman who is denied access to health care services needed to medically transition, enforcing the idea of a “false transsexual” which encourages disbelief of trans people’s self- identification. Virginie Delorme in The Mantis is portrayed as a trans woman who was similarly refused sex reassignment surgery and is rejected by men because of her poorly performed clandestine vaginoplasty, supporting the transphobic notion that post-operative trans women are merely mutilated men. The uncovered flaws in representing transgender women fairly and accurately point in a direction for future views on trans women that are not conducive to the production of such harmful fictional media."
"“But you do not look like a lesbian!?”
The role of LGBT stereotypes and representation of the LGBT community in the Dutch web series Anne+ and how they affect the development of a queer identity","['Waardenburg, L.']","['Vasiliki, B.']",2020-07-03T18:00:11Z,en,['Stereotypes;identity;queer;representation;media'],Taal- en cultuurstudies,"For this thesis I analysed the Dutch (web) series Anne+ to find out what stereotypes were being used, why they were being used and what effects these stereotypes have. Being represented is of utmost importance for minority groups, as this makes them visible in society and gives them social as well as political power. I will also analyse how the usage of stereotypes in Anne+ is linked to the formation of one’s individual identity as well as their queer group identity. Establishing a group identity can engender positive and negative effects. Being inside a group with people who have shared experiences strengthens the political position, yet the group identity will often still be based on some sort of norm, excluding the people who do not fit in all the boxes. The makers of Anne+ tried to create representative queer role models, however they still ended up using certain stereotypes. Even though stereotypes might appear in a humorous way, they still reinforce the negative imagery of the sexual minorities that they are representing."
Reciprociteit in het Litouws,"['Maleckaitė, G.']","['Zwarts, J.']",2020-07-03T18:00:07Z,nl,"['Reciprociteit, Litouws, markers']",Taal- en cultuurstudies,"In deze scriptie wordt een aspect van de reciprociteit in de Litouwse taal onderzocht. Reciprociteit in het Litouws kan uitgedrukt worden met de markers –si-/-s en vienas kitą. Volgens Kemmer (1993) bestaan er ‘lichte’ en ‘zware’ markers die reciprociteit kunnen uitdrukken en deze kunnen simultane dan wel opeenvolgende situaties omschrijven. Het is interessant om te weten welke marker in welke situatie in het Litouws gebruikt wordt.
92 sprekers van het Litouws moesten voor twaalf situaties bepalen wat, volgens hen, de juiste marker was voor bepaalde natuurlijk reciproke (simultane) en niet-natuurlijk reciproke (opeenvolgende of simultane) situaties. Uit het onderzoek is gebleken dat bij de situaties waarin maar één soort reciprociteit mogelijk is, óf natuurlijk reciprook, óf niet- natuurlijk reciprook, de sprekers een duidelijke voorkeur voor een bepaalde marker lijken te hebben: voor de natuurlijk reciproke situaties is dat de marker –si-/-s en voor de niet- natuurlijk reciproke situaties is dat de marker vienas kitą. In de situaties waarin werkwoorden gebruikt worden die zowel als natuurlijk en als niet-natuurlijk reciprook geïnterpreteerd kunnen worden, is het niet duidelijk of er een bepaalde marker dominant is. Aan het eind van deze scriptie worden er redenen gegeven waarom dit het geval zou kunnen zijn en hoe het onderzoek in de toekomst ook inzicht kan bieden in de reciprociteit van dubbelzinnige werkwoorden."
Verschuivingen in Visio Pauli: een vergelijking van twee vertalingen met de Latijnse tekst,"['Emonds, B.']","['Lemmen-Friedrich, K.']",2020-07-03T18:00:09Z,nl,['Middeleeuwen; Iers; Welsh; Visio Pauli; apocrypha; vertalen'],Keltische talen en cultuur,"In deze scriptie wordt een middeleeuws Latijnse tekst, Visio Pauli, vergeleken met een middeleeuws Ierse vertaling en een middeleeuws Welshe vertaling. De vergelijking wordt uitgevoerd met behulp van een methode gebaseerd op het vergelijkings- en beschrijvingsmodel van Kitty van Leuven-Zwart. Uit de vergelijking blijkt dat hoewel beide vertalingen redelijk dicht bij de brontekst blijven, de vertalers duidelijk te werk gegaan zijn op een manier die past bij de literaire tradities van hun land en die voor hun doelpubliek geschikt is."
