title,authors,supervisors,date,language,keywords,program,abstract
"Brexit and the European Public Sphere: Europeanization in British public debates (June 10-24, 2016)","['Wesselink, B.']","['Beers, M.C.']",2017-05-03T17:03:08Z,en,"['EU, European Public Sphere, Brexit, Europeanization, Public Debates, Euroscepticism']",International Relations in Historical Perspective,"This research undertakes an analysis of British public debates on the EU in the two weeks 
leading up to the Brexit-referendum. Based on a conceptualization of the public sphere, here 
understood as the public acts of political communication through which collective actors 
create an interactive medium and space of relationships among political institutions and 
citizens on issues of European integration, the purpose is to make sense of the evaluative 
British public debates. 
There are multiple signs that point towards the existence of media effects on 
European democratic performance evaluations. Subsequently, the European Public Sphere is 
thought to contribute to a more visible ‘European’ public debate. However, the EPS might 
also coincide with an increase in negative evaluations of the EU, which likely has an 
unfavourable influence on EU public opinion. Therefore, it is important to investigate to 
what extent Europeanized public debates show a negative or positive image of the EU in the 
British public debate. 
The method of claim analysis, provides almost all the information that is needed to 
execute an in depth examination of Europeanization in the British public sphere. 
Furthermore, following the lead of other studies on the EPS, three quality, nationwide 
newspapers from British print media, with different political stances and attitudes towards 
the EU were selected for source gathering. The empirical findings show that Europeanized 
public debates are significantly more positive in their evaluation of the EU than non
Europeanized public debates. In addition, Europeanized public debates present a very 
explicit nature, while non-Europeanized public debates remain relatively ambivalent. 
Overall, the findings challenge the current interpretations that the British media 
market is unusually Eurosceptic, especially with regard to the Europeanized selections. 
Moreover, the results further emphasize that an assessment of sentiment towards the EU, 
based solely on Europeanizing claims, falls short because it does not consider how the claim 
is posited in the debate."
"“Today is Tuesday, September 11th”: Representation of Trauma in the Film Extremely Loud and Incredibly Close","['Bakker, S.J.']","['Keilbach, J.']",2017-05-03T17:03:01Z,en_US,['Extemely Loud and Incredibly Close; Trauma; film analysis'],Film- en Televisiewetenschap,"This thesis examines the representation of trauma by means of cinematic techniques (sound, editing, and cinematography) in the film EXTREMELY LOUD AND INCREDIBLY CLOSE. The main question for this thesis is: To what extent can the use of cinematic techniques in EXTREMELY -LOUD AND INCREDIBLY CLOSE be associated with the representation of post-9/11 trauma? The central theory for this thesis is trauma and trauma representation in film, where the works of E. Ann Kaplan and Thomas Elsaesser constitute the central argument. Kaplan offers a strong argument on defining the concept of trauma, stating that in order to analyze its
representation, one must be aware of its meaning. Elsaesser mainly argues that trauma representation in fiction is condescending towards real victims, and he offers a theory of parapraxis, which states that the sense of trauma merely arises when evidence of its presence can be found in the absence of what stays hidden in trauma film and/or literature. For the analysis, three scenes have been chosen and they will each be analyzed for the use of sound, editing, and cinematography. For each scene, it will be discussed whether the use of these cinematic techniques contributes to the representation of trauma in this film. By analyzing the scenes in itself, and each time discussing the cinematic techniques again, it will offer a more complete analysis of said scene, because the techniques can also be discussed in relation to each other. In the end, however, it will be made clear that the cinematic techniques in itself cannot represent trauma, and the emotions that are conveyed by the scenes are mostly due to the narrative elements: the cinematic techniques only emphasize these emotions."
Non-native speaker perception: Dutch Language Attitudes Towards the British and American English Accent with Regard to Sophistication,"['Kooijman, G.H.K.']","['R.G.J.L. Supheert, Dr.', 'K.D.C.J. Sebregts, Dr.']",2017-05-03T17:03:09Z,en,"['non-native speaker perception, language attitudes, sophistication']",Engelse taal en cultuur,"Against a media backdrop of film and television this study will explore Dutch language attitudes towards the British and American English accent with regard to sophistication. In order to investigate non-native speaker perception, an experiment was carried out among Dutch students using audio material from the British crime drama Broadchurch (2013) and its American remake Gracepoint (2014). A questionnaire consisting of Likert-scales and open questions was used to test the language attitudes of the respondents. The results showed that there was only a slight difference in the evaluation of the two accents when it came to the intelligence and competence part of sophistication. When looking at the results regarding the social and economic part of sophistication, however, the evaluation of the accents differed significantly. Overall, it could be concluded that especially when it comes to social status and economic welfare, the Dutch respondents assigned the British English speaker a slightly higher level of sophistication than the American English speaker."
Zorgen voor de jeugd. Historische ontwikkelingen die van invloed zijn geweest op de toename van de jeugdhulp in de periode 1945-2015.,"['Rahms, M.A.']","['Dijkman, J.E.C.']",2017-05-03T17:03:05Z,nl,[],Geschiedenis van Politiek en Maatschappij,
Bleibt blijven immer bleiben? - Der Unterschied in Verwendung der Kopulae blijven und bleiben und was diesen Unterschied für Literaturübersetzungen vom Niederländischen ins Deutsche bedeutet. Eine Korpusanalyse,"['Timmer, M.']","['Sudhoff, Dr. Stefan', 'van Vredendaal, Drs. Jaap']",2017-06-08T17:01:17Z,de,"['Kopulaverb, blijven, bleiben, Andrew Chesterman, Übersetzungsstrategien, Parallelkorpus']",Duitse taal en cultuur,"In dieser Bachelorarbeit wird untersucht, inwiefern die Verwendungsmöglichkeiten der niederländischen Kopula blijven und der deutschen Kopula bleiben sich voneinander unterscheiden und welche Bedeutung dies für Literaturübersetzungen vom Niederländischen ins Deutsche hat. Anhand eines Parallelkorpus für Literaturtexte wird festgestellt, wie die Verwendungsmöglichkeiten sich voneinander unterscheiden und welche Übersetzungsstrategien von Andrew Chesterman für das Übersetzen von blijven angewendet werden. Mittels der Analyse stellt sich heraus, dass das niederländische blijven mehr Verwendungsmöglichkeiten hat als das deutsche bleiben. Außerdem kann herausgestellt werden, dass die Übersetzungsstrategien von Chesterman nicht ausreichen, um spezifische Konstruktionen, die in der Ausgangssprache erlaubt sind, in der Zielsprache jedoch nicht, zu übersetzen. Deshalb werden genauere Strategien aufgestellt, die zeigen, dass in Bezug auf das Übersetzen von blijven im Deutschen meistens die Kopula weggelassen oder die ganze Struktur geändert wird."
De semantiek van zinnen met ook in het Nederlands: Een onderzoek naar semantische mogelijkheden voor samengestelde zinnen met ook.,"['Wulp, I.M. van der']","['Ruys, E. G.']",2017-06-08T17:01:16Z,nl,"['Semantiek, ook, auch, lineaire volgorde, semantische volgorde, logische implicaties, fonologische reductie, deletie']",Nederlandse taal en cultuur,"Dit eindwerkstuk behandelt de semantische voorwaarden voor het woordje ook naar aanleiding van een theorie van Reis en Rosengren (1997). In dit eindwerkstuk toets ik de verwachting van Reis en Rosengren (1997) dat een propositie q altijd semantisch vooraf moet gaan aan een propositie p met ook. Naar aanleiding van dit eindwerkstuk kan gesteld worden dat q niet altijd semantisch vooraf moet gaan aan p. Dit is problematisch voor de theorie van R&R, die daar wel vanuit gaan. Uit mijn analyses volgde ten eerste dat q tegelijkertijd wel lineair en niet semantisch vooraf kan gaan aan p. Het is zelfs mogelijk om q helemaal niet vooraf te laten gaan aan p. Ten tweede bleek dat vrije variatie van ook tussen proposities x en y mogelijk is. Ten derde bleek het mogelijk te zijn om q semantisch niet (maar lineair wel) vooraf te laten gaan bij zinnen met een logische implicatie. Tot slot bleek dat fonologische reductie zowel bij identieke herhalingen als logische implicaties mogelijk is."
"The Poem Before the Storm: Edna St. Vincent Millay, Alice Duer Miller and the approach of World War II","['Vries Lentsch, E.H.P. de']","['Kager, A.M.W.']",2017-06-08T17:01:18Z,en,"['poetry, isolationism, interventionism, us, ww2, alice duer miller, edna st. vincent millay']",Engelse taal en cultuur,
Weerslag van de Stasi: Het Probleemveld van Herinnering in het Verenigde Duitsland tot 1995,"['Lugt, T. van der']","['Huijnen, P.']",2017-06-07T18:05:45Z,nl,[],Geschiedenis,"Deze scriptie stelt de vraag hoe de verwerking van het Stasi-verleden, zowel in de politiek als in de pers, past in de bredere omgang van het verleden van Duitsland. De effecten van de opheffing van de Stasi worden in een breder licht gezet van de algemene herinneringscultuur van Duitsland, ofwel de Vergangenheitsbewältigung. Zowel de politieke afhandeling, als de rapportage over de gebeurtenissen in de publieke opinie, als de tegenstellingen tussen Oost- en West-Duitsland die hier hun rol in spelen worden bestudeerd."
Calvinistische Continuïteit. Onderzoek naar de reputatievorming van Philips van Marnix van Sint-Aldegonde.,"['Steert, T.']","['Visser, A.S.Q.']",2017-06-08T17:01:15Z,nl,[],Nederlandse taal en cultuur,
Late Paleocene - Early Eocene long and short term environment and climate change in Southeast Australia,"['Huurdeman, E.P.']","['Bijl, P.K', 'Sluijs, A.', 'Peterse, F.', 'Frieling, J.', 'Donders, T.H.']",2017-06-27T17:04:15Z,en,"['Paleocene, Eocene, southern ocean, paleoenvironment, biomarkers, dinocysts, spores, pollen, paleovegetation']","Earth, Life and Climate","The Late Paleocene and Early Eocene are characterized by greenhouse climates, culminating in the early Eocene climate optimum (EECO; 53-50 Ma), the warmest period of the last 65 Myr. Especially the high polar temperature estimates are poorly understood from a climate dynamics perspective; climate modelling studies cannot reproduce the temperatures from proxy data in these areas. In recent years, near tropical temperatures were reconstructed for the Antarctic margin and Tasmania, at a paleolatitude of 60° S, supported by spore and pollen data which suggest vegetation indicative for tropical settings in these areas. This study uses biomarker data (TEX86) proxies, dinoflagellate cyst assemblages, and spores and pollen assemblages to reconstruct terrestrial and marginal marine paleoenvironmental conditions during the Late Paleocene and Early Eocene (~5751.5 Ma) of the Latrobe-1 core on the coast of southeast Australia (paleolatitude ~55° S), with special focus on the Paleocene-Eocene Thermal Maximum (PETM; ~56 Ma). A stratigraphic framework for the sedimentary record was developed using biostratigraphic constraints from dinocysts and terrestrial palynology and bulk organic stable carbon isotope stratigraphy. The TEX86H SST record shows high temperatures (up to 32 °C) in the PETM and EECO, although data suggests an influence of land-derived isoprenoid GDGTs. The abundant tropical pollen and spores and abundance of tropical dinocyst species Apectodinium suggest high air and sea surface temperatures during the PETM and towards the EECO. Paleovegetation shows a shift from Late Paleocene rainforest gymnosperm taxa to angiosperm dominated forests towards the EECO, with the introduction of several angiosperm lineages during the PETM and following hyperthermals. These results support the near-tropical temperatures recorded at the Antarctic margin. The paleoceanographic  configuration at this location gives an opportunity to assess influence of low latitude surface waters on high latitude climate."
Somaliland 1991 – 2010: een oase van rust in een roerige omgeving,"['Risselada, S.']","['Massink, S. F. M.']",2017-06-26T17:05:00Z,nl,"['Somaliland, autonome regio, hybride democratie']",Geschiedenis,"De centrale vraag van deze scriptie is “Welke factoren zijn van invloed geweest op het ontstaan en behoud van de hybride democratie in Somaliland vanaf 1991 en in hoeverre heeft dit model geleid tot stabiliteit?” 
In 1991 scheidde Somaliland zich af van Somalië en verklaarde zichzelf onafhankelijk. Somaliland is officieel een autonome regio van het land Somalië, daar de Verenigde Naties Somaliland (nog) niet heeft erkend als land. Toch heeft Somaliland alle kenmerken van een land met eigen grenzen, een eigen regering, eigen wetten en een eigen bevolking. 
Op basis van het wetenschappelijk debat over welke factoren een rol spelen bij de verandering naar een democratisch regime, wordt de situatie in Somaliland geanalyseerd. Het multidimensionale model van Pridham, aangevuld met consolidatie elementen van Sørensen wordt hierbij gehanteerd en getoetst. Somaliland heeft gekozen voor het model van een hybride democratie. Uit het onderzoek van deze scriptie blijkt, dat een dergelijke vorm van democratie en het proces van staatsvorming dat Somaliland heeft doorgemaakt, heeft geleid tot meer stabiliteit. 
In deze scriptie worden twee methoden van onderzoek gebruikt: literatuuronderzoek en bronnenonderzoek. De beschrijving van het wetenschappelijke debat en de geschiedenis van Somaliland wordt vooral gedaan op basis van literatuuronderzoek. Voor de analyse van de regimeverandering in Somaliland wordt zowel literatuur als bronnenonderzoek gebruikt, met name de constitutie van Somaliland. Zowel de bronnen als de literatuur zijn geselecteerd op basis van relevantie voor het onderwerp."
Using decision tree algorithms for modelling driver distraction situations.,"['Mouhtadi, T.A.']","['Janssen, dr C.P.']",2017-06-28T17:02:48Z,en,[],Kunstmatige Intelligentie,"Algorithms based on decision trees are widely used in artiﬁcial intelligence research. In this thesis we apply two different of these algorithms to data gathered in a driver distraction study with 25 participants. The majority of studies in cognitive modelling only start gathering data after formulating a hypothesis, based on theory in the domain. We starts with the data however and analyse it to try and ﬁnd interesting features. The idea behind this approach is to try and discover less obvious patterns. First we extracted 7 features from the original data to get a dataset that we could apply our algorithms to. Our algorithms were able to correctly predict 54% and 57% respectively of the users either focussing on the road or on their phone. We found that inherent properties such as age and gender are not strong predictors of performance in driving. On the other hand looking at the actual driving performance can be used to see if a participant is focussing on the road or their phone. It is important to note for further research that the original data assumed that participants were following instructions to focus on the road or the phone, but did not verify it. To gain better insights from decision tree algorithms it is important that the data is checked to ensure that the data is consistent. For improving the accuracy of the algorithms it would also greatly help to have a larger number of participants. This task had participants look at their phone to ﬁll in a number. For further research it would be useful to look at tasks with distractions in other modalities with the same algorithms."
Relation between Cloud Cover and Relative Humidity,"['Giorgio, N.']","['Delden, A.J. van']",2017-06-26T17:04:41Z,en,[],Natuur- en Sterrenkunde,
"A new invisible non-human actor is framing politics, but who is it?
A Non-Participatory Observational Research of Facebook’s Newsfeeds","['Hommenga, A.J.']","['Kustritz, A.M.']",2017-07-05T17:01:51Z,en,['Filter bubble; black box; throwntogetherness; non-human actor'],Media en cultuur,"The article that you are about to read investigates how content on Facebook´s newsfeeds is framed and to what extent this constructs filter bubbles, wherein encountering difference is not facilitated. This is done in a case-study of two constructed Facebook accounts in the context of the recent American Election: pro-Trump and pro-Clinton. This is relevant because popular discourse indicates that encounters with the other side of the political spectrum on the personalized newsfeeds are rare. This research shows that this is problematic, because reality turns into a constructed personalized image of the real in digital filter bubbles and these bubbles do not represent western society’s heterogeneity. Besides, the emergence of fake news makes this even more problematic, because it turns out to be difficult to check the truthfulness of the newsfeed’s content on the newsfeed itself. Therefore, fake news can be acted upon as if it is real. The newsfeeds are observed as if they are a digital city where people move through, thereby this analysis builds on theories of a correlation between the surrounding structure wherein people act and the way that people act in it. However, the focus does not lie on movement, but on the framing of meaning in the shared space. Therefore, a non-participant observational research method is applied, because then the way that the newsfeed’s technologies construct filter bubbles can be isolated. The research findings are that hidden technologies of the personalized newsfeeds frame meaning in it, thereby the pro-Trump newsfeed only consists of content in favor of Trump and the pro-Clinton account only consists of content in favor of Clinton. Thus, the newsfeed’s hidden technologies are virtual gatekeepers that decide what an individual sees and what not. The results are personalized filter bubbles, that do not contest the users thoughts, but merely affirm them. The article builds towards a feature that should be added to the newsfeeds in order for Facebook to claim their responsibility as gatekeepers, because Facebook is responsible."
Women in Crime: an analysis of the portrayal of female leads in American and Dutch crime dramas.,"['Kersten, M.J.']","['Supheert, Dr Roselinde', 'Cole, Dr Debbie']",2017-07-05T17:01:52Z,en_US,"['Representation, Imagology, Media, Television, Females, Portrayal, Self-images, Culture, Stereotypes']",Interculturele communicatie,"This thesis offers an analysis of females in leading roles in crime dramas from two different countries, researching whether the females in the series are portrayed differently. As the series come from two different cultures, it is expected that different images are used for the portrayel of the female as images in the series can be identified as a countries self-images. It is also expected that some images are stereotypical images of females. A qualitative contrastive method is used which looks at a corpus of six series: three from America and three from the Netherlands.The research reveals that there is indeed a difference in portrayal of the female lead, with a more stereotypical portrayal  in the USA and a less stereotypical portrayal in the Netherlands."
Implementation of inquiry-based learning: Insights in day-to-day practice,"['Scheerboom, A.M.B.']","['Doorman, L.M.']",2017-07-04T17:01:35Z,en,[],Science Education and Communication,
Een verlicht ontwaken uit Nederlands Grootste Nachtmerrie? De postures van Salah Edin en Abid Tounssi,"['Groot, P.P. de']","['Ham, L.J.']",2017-07-07T17:01:28Z,nl,['posture; postureanalyse; hiphop; rap; Salah Edin; Abid Tounssi; islam; authenticiteit; Nederlands Grootste Nachtmerrie; Het Spijt Me; identiteit'],Nederlandse taal en cultuur,"Van radicale rapper naar muziekafzwerende moslim: Abid Tounssi, voorheen bekend als rapper Salah Edin, is tot inkeer gekomen. In ‘Een verlicht ontwaken uit Nederlands Grootste Nachtmerrie?’ (2017) wordt de postureanalyse, in navolging van Jérôme Meizoz en Laurens Ham, toegepast op de twee conflicterende postures van Tounssi.

  Onder het pseudoniem Salah Edin brengt hij in 2007 zijn Nederlandstalige rapalbum Nederlands Grootste Nachtmerrie uit. Het album kan op veel aandacht rekenen vanwege de albumhoesfoto - Salah Edin staat afgebeeld als Mohammed B-lookalike - en de videoclip bij het nummer ‘Het Land Van…’ waarin Salah Edin samenvalt met het beeld dat Nederland van ‘de Marokkaan’ zou hebben: radicaal en gevaarlijk. De Marokkaans-Nederlandse rapper associeert zich provocatief met het stereotype van de radicale, gevaarlijke moslim. 

  Tien jaar na de release het album tourt Abid Tounssi - die zijn eigen naam nu als artiestennaam gebruikt - met de spoken word-voorstelling ‘Het Spijt Me’. In de voorstelling en aanverwante mediaoptredens keert Tounssi zich radicaal tegen zijn pseudoniem Salah Edin en de muziek die hij onder die naam maakte. Zijn islamitische geloofsovertuiging speelt in de spijtbetuiging een belangrijke rol.   

In deze scriptie worden de postures van Salah Edin en Abid Tounssi geanalyseerd door te letten op authenticiteit en islamreferenties. Daarbij wordt gebruik gemaakt van videoclips, mediaoptredens, liedteksten, albumcovers en optredens. Hoewel als conflicterend gepresenteerd blijkt dat beide postures met betrekking tot islam en authenticiteit nog redelijk overeenkomen: misschien is Abid Tounssi wel Nederlands Allergrootste Nachtmerrie.   

Deze scriptie is een kruisbestuiving van een beproefde methode - postureanalyse - en vernieuwend materiaal - hiphop - en biedt daarmee inzichten in genrespecifieke kenmerken van hiphop, discussies over Nederlanderschap en de reikwijdte van posturestudie."
Lessen in (on)gelijkheid: 'witte onschuld' in vroegmoderne koloniale literatuur,"['Baldwin, B.C.K.']","['Visser, A.S.Q.', 'Stronks, E.']",2017-07-07T17:01:30Z,nl,"['white innocence, vroegmoderne koloniale literatuur, kolonialisme, slavernij, slavery, west-indies, suriname']",Nederlandse taal en cultuur,"Geschiedenis van een neger (177?) probeert zijn lezer iets bij te brengen over ongelijkheid, maar mijdt hierbij het onderwerp etnische ongelijkheid zo veel mogelijk. Heeft dit werk aandacht voor etnische ongelijkheid en wat leert dit over de inspanningen die destijds werden geleverd om etnische ongelijkheid te verminderen? Gloria Wekker heeft in White Innocence (2016) de paradoxale manier waarop Nederlanders omgaan met etniciteit beschreven, enerzijds is er erkenning van etniciteit als betekenisvol verschil, anderzijds is er ontkenning. Volgens haar maakt het koloniale verleden geen volwaardig deel uit van het cultureel archief, doordat de Nederlandse identiteit sterk is gekleurd door 'onschuld' en de voorrechtspositie voor witte mensen die dit oplevert. Het Nederlandse zelfbeeld kreeg vormd ten tijde van kolonisatie en wordt nog steeds in de hand gewerkt door verhalen over het Nederlandse verleden. Geschiedenis van een neger is een verhaal uit het Nederlandse verleden, een analyse ervan biedt inzicht in de toepasbaarheid van Wekkers theorie op een vroegmodern werk en kan uitwijzen in hoeverre ‘witte onschuld’ haar wortels vindt in het verleden. Uit de analyses blijkt dat Geschiedenis van een neger een soort tussenpositie inneemt: het draagt iets uit over etnische ongelijkheid door een zwarte hoofdpersoon in het leven te roepen en deze zo goed mogelijk te maken, maar de slechte behandeling die deze hoofdpersoon moet ontgelden wordt niet op zijn uiterlijk betrokken."
