title,authors,supervisors,date,language,keywords,program,abstract
"The influence of the outcome of the Mini-Cog on postoperative complications 
in patients with a proximal femur fracture.","['Geertman, Silke']","['Bovenschen, Niels']",2023-11-07T00:00:46Z,EN,"['Mild Cognitive Impairment, Proximal Femure Fracture, Complications']",Geneeskunde,"Introduction: Elderly patients with dementia or cognitive impairment are more at risk for hip 
fractures. However, data about the influence of MCI on complications after hip surgery is scarce, and 
studies using standardized test are missing. The main aim of this study was to identify the influence 
of the outcome of the Mini-Cog on postoperative complications, in patients aged ≥65 years, with a 
proximal femur fracture undergoing hip surgery.

Methods:
This is a substudy of the MCHOPIN study, a multicenter prospective cohort study. Data is based on 
the database set of the MCHOPIN study. The primary outcome of interest was postoperative 
complications. Subgroup analyses for sex and age were performed. 

Results: 
A total of 351 patients were included in this study. They were categorized according to their outcome 
of the Mini-Cog, into the ‘’possibly not mild cognitive impaired group’’ also the Mini-Cog - group 
(n=230) and the ‘’probably mild cognitive impaired group’’ also the Mini-Cog + group (n=121). 42.5% 
of all the included patients developed postoperative complications. Significant statistical differences 
were seen in the total amount of postoperative complications between the Mini-Cog – and the MiniCog + group. More in the Mini-Cog + group developed postoperative complications. After preforming 
subgroup analyses no statistically difference were found. 

Conclusion: 
More postoperative complications in the Mini-Cog + group were found. However this study, shows 
the complexity between the different confounding factors, and their influence on postoperative 
complications. For further research it is recommended that more confounding factors on 
postoperative complications and MCI should be identified."
Retinal Vasculopathy with Cerebral Leukoencephalopathy and Systemic Manifestations (RVCL-S),"['Versluis, Danique']","['Lesscher, Heidi']",2023-11-04T00:00:45Z,EN,"['RVCL-S, pathophysiology, endothelial dysfunction, inflammation, diagnostic markers, therapeutic targets']",Biology of Disease,"Retinal vasculopathy with cerebral leukoencephalopathy and systemic manifestations (RVCL-S) is a systemic small vessel disease that affects various organs, including the brain, retina, kidneys, and liver. The disease is characterised by retinal vasculopathy, white matter lesions, focal and global brain dysfunction, and several systemic manifestations. These symptoms arise from C-terminal truncating mutations in the three prime repair exonuclease-1 (TREX1) gene. The mutations lead to the insertion of a premature stop codon, inducing the production of truncated proteins. How these truncated proteins exactly cause the disease manifestations is not yet known. However, prior studies appeared to indicate endothelial dysfunction as an important mechanism. Besides endothelial dysfunction, inflammation and serotonergic system malfunction have also been proposed as potential underlying mechanisms. Hence, these processes could potentially help to bridge the gap between the truncated TREX1 proteins and the clinical manifestations of RVCL-S. Therefore, the purpose of this review is to provide an overview of the main suggested theories concerning the pathophysiology of RVCL-S, including ideas for diagnostic markers and novel therapeutic targets"
The Mitigating Role of Psychological Flexibility on Non-Migrants’ Quality of Life during Covid-19,"['Habash, Yasmina']","['Knipscheer, Jeroen']",2023-11-09T00:00:45Z,EN,"['Psychological flexibility; quality of life; Covid-19, distress; wellbeing; coronavirus; Covid-19 distress; pandemic; Acceptance and Commitment Therapy.']",Clinical Psychology,"This study investigates the potential moderating role of psychological flexibility in the relationship between Covid-19 distress indicators—namely, Covid-19 experiences and knowledge of associated fatalities—and quality of life among a non-western migrant sample. Employing a cross-sectional design, we surveyed 129 participants from non-western backgrounds. The survey encompassed demographic data, attitudes toward Covid-19 regulations, personal Covid-19 encounters (operationalized as Covid experience), and acquaintances' Covid-19-related deaths. Established scales, including the Flexibility Index Test (FIT-24) and RAND 36-Item Short Form Health Survey (RAND SF-36), quantified psychological flexibility (PF) and assessed quality of life (QoL). Contrary to expectations, Covid experience (CE) and known fatalities (D) did not significantly predict PF or QoL. However, a positive link between PF and QoL was observed. Notably, PF did not moderate the relationship between Covid-19 distress indicators and QoL, as initially hypothesized. In summary, the findings demonstrate a positive link between PF and QoL. However, PF moderating the relationship between CE/D and QoL was not observed. This underscores the unique impact of PF on well-being within the context of Covid-19."
Shared Decision Making during the first physiotherapeutic consult: evaluating the construct validity of the Rochester Participatory Scale,"['Zuurbier, Isabel']","['Pisters, Martijn']",2023-11-09T00:00:52Z,EN,[],Fysiotherapiewetenschap,
Suppression and degradation of UpA dinucleotide-containing messenger RNAs and the impact of nucleotide modifications on stability,"['Vermeir, Stein']","['Externe beoordelaar - External assesor,']",2023-12-09T00:01:06Z,EN,['UpA dinucleotide; AU-rich element (ARE); AU-rich element binding protein (AUBP); pseudouridine (Ψ); N1-methylpseudouridine (m1Ψ); 2-thiouridine (s2U); N6-methyladenosine (m6A); mRNA degradation; mRNA vaccine'],Drug Innovation,"Messenger RNA (mRNA) is strictly regulated in cells. Ever since its discovery, science has been trying to create drugs from mRNA, which finally materialized in the form of the recent severe acute respiratory syndrome coronavirus 2 messenger RNA vaccines. Stability has long been an issue in mRNA vaccine design. The instability of mRNA molecules can partly be found in the composition and modification of its nucleotides. Pseudouridine nucleotide modifications stabilized mRNA enough for clinical use, whereas RNAs high in adenosine and uridine nucleotides or those containing UpA or CpG dinucleotides are degraded more quickly than RNAs lacking the (di)nucleotides. This leads to a natural suppression of CpG and UpA dinucleotides in mRNA. The cause of CpG dinucleotide suppression can be found in DNA methylation, where methylated CpG DNA can spontaneously deaminate into TpG dinucleotides. The cause of UpA dinucleotide suppression is however unconfirmed but might find its roots in RNA editing, CpG methylation or gene expression. Degradation of UpA dinucleotide-containing mRNAs is similarly uncertain and may be attributed to RNase L or AU-rich element RNA binding proteins (AUBP), which can stabilize or destabilize mRNA. Herein, current theories on UpA suppression and degradation will be reviewed in addition to adenosine and uridine modifications to discuss which factors surrounding (di)nucleotides and nucleotide modifications influence the stability of mRNA. Finally, this review hypothesizes a link between evolution towards UpA dinucleotide suppression and avoidance of destabilizing AUBP binding."
Comparative study of three Low-Code No-Code Frameworks,"['Weenink, Roland']","['Roelfsema, Hein']",2023-12-08T00:00:53Z,EN,"['Low-Code No-Code, LCNC, LCDP, SAP, Mendix, Neptune, Software, Accenture']",Science and Business Management,"Constant pressure on businesses to innovate and improve efficiency in order to remain competitive has led to a shortage of software developers. This in turn has led to an increase in popularity of Low-Code No-Code frameworks (LCNC). LCNC frameworks are easy to use, visual drag-and-drop development platforms that enable employees with domain knowledge to develop applications without a proper programming background (citizen developers). This study assessed how three different LCNC frameworks, SAP Build, Mendix and Neptune compare based on a quantification method of their feature set. Furthermore, the strengths and weaknesses of these LCNC frameworks are determined and analysed based on their impact on the IT world. The findings show that Mendix has the average highest potential based on its features, having the highest collaborative development support and the most graphical user interface features. SAP Build has the strongest interoperability support, and the strength of Neptune is within the reusability feature. The strengths and weaknesses of each LCNC framework differ, therefore the impact of each LCNC is dependent on the specific use case. A recommendation to Accenture is made on how to position LCNC frameworks to their clients based on this research. LCNC framework adoption leads to the overall benefits
of an increased development speed and cost reduction and drawbacks in customisability in general. The recommendation for a specific LCNC framework highly depends on the needs and sector of the client."
Benchmarking Cryptocurrency Forecasting Models in the Context of Data Properties and Market Factors,"['Akkerman, Stephan']","['Karnstedt-Hulpus, I.R.']",2023-12-09T00:00:49Z,EN,['cryptocurrency; cryptocurrencies; forecasting; time series; time series forecasting; AI; machine learning; deep learning; statistics; financial forecasting'],Artificial Intelligence,"Cryptocurrency price prediction presents a significant challenge due to the inherent nonlinearity of the market. In this thesis, we assess the performance of thirteen time series
forecasting models in predicting the prices of twenty-one different cryptocurrencies across
four specific time frames. Our analysis centers on how data characteristics and market conditions affect the precision of these models and explores the implications of both broadening the scope of training data and extending the forecast periods. Our findings indicate that TBATS, LightGBM, XGBoost, and ARIMA consistently deliver the most accurate results. We identify key factors influencing prediction accuracy, including market trends, heteroskedasticity, volatility, and market capitalization. Additionally, the choice of time frame
markedly affects all models’ predictive accuracy. Contrary to expectations, we observe that
increasing the volume of training data does not necessarily enhance the performance of
deep-learning and RNN-based models. Our thesis offers a comprehensive benchmark of
forecasting models within the cryptocurrency context, underscoring the conditions crucial
for improving prediction accuracy."
The cell cycle overturned: Mechanisms by which viruses interfere with key components of the cell cycle progression,"['Zubcevic, Meira']","['Kops, G.J.P.L.']",2023-12-08T00:00:56Z,EN,['viruses; mitosis; HIV-1; viral accessory proteins; Vpr; chromosome segregation; anaphase; APC/C; centrosomes; microtubules; cohesin; cytokinesis'],Infection and Immunity,"The cell cycle is regulated by a complex network of signaling pathways and molecular
machineries aimed at the faithful division of the complete genome into two identical daughter
cells. Errors in this regulation can lead to aberrant chromosome segregation and often cause a
form of chromosomal instability (CIN). This cellular phenotype is frequently found in cancer and
other malignancies and can arise through mutations in important regulatory tumor suppressor
genes or the overactivation of oncogenes. Besides cellular oncogenes, numerous viral
oncogenes have been described over the last decades. The targets of these viral proteins are
often important regulators of mitosis. This viral influence on mitotic regulation can interfere with
normal chromosome segregation, increasing the risk of CIN. This review discusses how viral
proteins interfere with the cellular machinery that ensures faithful chromosome segregation,
using a selection of examples. Viruses can deregulate cell cycle progression by interacting with
proteins involved in cell cycle checkpoints or DNA repair, activating or inhibiting the anaphase
promoting complex (APC/C), causing centrosome overduplication, (de)stabilizing microtubules,
or disturbing cytokinesis. Examples are provided for each of these interactions, intermittently
focusing on retroviruses and especially the Human Immunodeficiency Virus 1 (HIV-1).
Implications are drawn for cancer research and virology, and a possibility for the use of CINinducing
viral proteins as a mechanism to enhance oncolytic viral therapy is considered. The
interplay between viruses and the cell cycle is an important field that requires more
interdisciplinary efforts in research and can contribute greatly to our knowledge of the origins of
cancer and possible treatments."
Maleic acid amide derivatives as pH-sensitive linkers for therapeutic peptide conjugation,"['Baniak, Barbara']","['Vermonden, T.']",2023-12-09T00:00:44Z,EN,['maleic acid amide derivatives; pH-sensitive linker; drug delivery; therapeutic peptides; polymeric micelles'],Science and Business Management,"Therapeutic peptides are gaining popularity in the biopharmaceutical industry due to their higher tissue penetration and lower immunogenicity than traditional anticancer drugs. However, therapeutic peptides require carriers to reach the tumour site, as they are rapidly cleared from the bloodstream. The advancement of nanomedicine allows us to solve this challenge by entrapping the peptide inside polymeric micelles. Passive targeting, using the Enhanced Permeability and Retention effect (EPR) and selective release of cargo from the nanocarrier in response to stimuli endogenous to tumour tissue (such as reduced pH), are envisioned to be implemented in the delivery approach. This work exam-ines three maleic anhydride derivatives as possible substrates for pH-sensitive linker synthesis on a model therapeutic peptide. The novel aspect of this study is binding a model peptide into polymeric micelles using a maleic acid amide-based linker. Although these maleic anhydrides have been previously employed for pH-sensitive drug delivery applications, in this study, side product formation significantly decreased the effectiveness of the investigated tool. The results presented in this work raise questions towards the employment of maleic amide derivatives in such systems as side product interference could not be avoided."
Bringing GPU Parallelization and Complex Boundaries to a Computational Fluid Dynamics Solver,"['Zwieten, Valentijn van']","['Panja, Deb']",2023-12-09T00:00:54Z,EN,['fluid dynamics; Stokes; linear Stokes; Navier-Stokes; optimizing; optimization; performance; runtime; GPU; memory;'],Game and Media Technology,"We present optimizations and flexibility improvements to an existing computational fluid dynamics solver based on fast Fourier transforms. The existing solver was implemented partly on the CPU and partly on the GPU, leading a large performance overhead due to context switches. This, among other performance issues, made it unfeasible for practical application. Additionally, the grid-based manner in which the boundaries for solids were implemented limited the range of problems it could accurately depict and solve. Moreover, the abundance of hard-coded features made it cumbersome to use. In this thesis, these problems are resolved as follows: Nearly the entire solver has been ported to the GPU, eliminating the performance overhead introduced by context switches. A host of additional runtime and memory optimizations are implemented into the program. The implementation of boundaries has been improved to handle arbitrary geometries. Finally, a basic command-line interface has been introduced to set a range of solver parameters when launching the program. In optimal situations the runtime is decreased by a factor exceeding 1000x and the memory footprint is reduced by up to a petabyte. In more general cases the runtime decrease is often in the triple digits and the footprint is reduced by many gigabytes. With the introduced improvements the way is paved for the solver to be a tool that is used by researchers in the field of fluid dynamics."
"Recruitment, inheritance and role of downy mildew-associated microbiome in Arabidopsis thaliana","['Ploemacher, Hannah']","['Berendsen, R.L.']",2023-12-09T00:00:56Z,EN,[],Environmental Biology,
A User-Centered Explainable AI Visualization Study for Enhancing Decision Making in Law Enforcement,"['Genderen, Kim van']","['Dimara, Evanthia']",2023-12-09T00:01:02Z,EN,[],Human-Computer Interaction,"Police need to be able to analyse large amounts of data in order to enforce the law. Nevertheless, this task cannot be solely completed by humans, and therefore requires the utilization of Machine Learning (ML) models. However, a concern arises in terms of the lack of transparency of these models, which could have major consequences in high-stake scenarios. Hence, it is critical to provide explanations if we anticipate using such models in fields such as law enforcement. However, many visualisations have been developed to explicate Machine Learning (ML) models for data scientists instead of decision makers. This creates an issue as data scientists have distinct objectives when interacting with an ML model compared to decision makers. While data scientists possess technical knowledge, they lack domain knowledge and seek solutions to improve the model. Conversely, decision makers utilise the model’s output to inform their decision making processes. They possess domain knowledge but lack technical expertise. Due to distinct characteristics and different requirements when dealing with ML models, they also require a different explanations. In collaboration with the National Police Lab Artificial Intelligence (NPAI), this research developed a way to effectively visualise local explanations of ML models for decision makers in the law enforcement domain. We focused on decision makers within public order and safety domains. The interviews unveiled several prerequisites that were integrated into the design. The evaluation demonstrated that decision makers comprehended the visualization and that the tool facilitated decision making. Nevertheless, it emerged that the explanation was not entirely comprehensible to the decision makers. They could pinpoint the characteristics that influenced the classification of the risk and identify the risk that the model attributed to the incident. However, they lacked the ability to discern which features made a larger contribution, and the uncertainty score proved challenging to interpret."
DEVELOPMENT OF GD2 TARGETING THERANOSTICS FOR NEUROBLASTOMA,"['Sünnen, Emma']","['Poot, A.J.']",2023-12-09T00:01:04Z,EN,[],Drug Innovation,
"The Transnational Expansion of Mara Salvatrucha (MS-13): An Assessment of the Gang's Transnational 
Patterns, Purposes, and Prospects in Spain.","['Frisan, Sara']","['Slooter, Luuk']",2023-10-01T01:01:13Z,EN,['Transnational Gangs; Mara Salvatrucha; Media and Political Narratives; Spanish Criminal Groups'],Conflict Studies and Human Rights,"[""The study investigates the nature and extent of the consolidation of Mara Salvatrucha gang (MS13) in Spain. With the aim of answering the research question, what are the nature and implications of the 
transnational spread of Mara Salvatrucha in Spain? the dissertation intends to shed light on the local 
peculiarities of MS-13 in Spain and assess its transnational connections with the ""original"" Mara 
Salvatrucha who are active in Central America. The research will be conducted through the review of 
selected secondary sources on the topic, identifying academic gaps and misconceptions about the gang's 
transnational expansions. By comparing the structure, purposes, and level of sophistication of Mara 
Salvatrucha in Central America and Spain, the study will establish evidence of the divergence between 
the different manifestations of the phenomenon. MS-13 in Spain exhibits substantial differences in its 
aims, leverage, and prospects compared to its counterparts in other settings. It can be argued that aside 
from shared symbology, branding, and cultural background, the Spanish MS-13 variant is configured as 
a distinct and separate reality from the Central American gang, shaped by the confluence of structural 
and psychological factors experienced by diaspora communities in the country. MS-13 in Spain is limited 
in its composition and organizational capabilities. It has no political aspirations and plays a minor role in 
the Spanish and European criminal scenario. These results clash with the narratives of threat surrounding 
Mara Salvatrucha. Nonetheless, understanding the actual dimensions and peculiarities of the Spanish 
chapter of MS-13 is crucial to re-demystify the gang’s perception and design context-appropriate policies
that target crime prevention and promote effective integration of immigrants. While it cannot be taken 
for granted that the Mara Salvatrucha will not undergo a process of evolution also in Spain, it is 
implausible that it will follow a development similar to its path in Central America, given the significant 
differences in the socioeconomic and institutional context""]"
Van piramide naar cirkel,"['Zuijdendorp, Maaike']","['Amsterdam, N. van']",2023-10-03T00:00:44Z,NL,"['Holacracy, zelfsturende organisaties']","Organisaties, verandering en management","Hoewel de meeste organisaties zijn georganiseerd volgens een management hiërarchie kent deze organisatievorm nadelen als rigiditeit en bureaucratie, die vooral problematisch zijn omdat de huidige organisatie context dynamisch en complex is. Er wordt al jarenlang, door zowel organisatiewetenschappers en beoefenaars gezocht naar alternatieven voor de management hiërarchie. Een stroming van zelfsturende organisaties probeert aan deze nadelen te ontkomen door de management hiërarchie te verwijderen en autoriteit radicaal te decentraliseren. Dit onderzoek komt te gemoed aan de behoefte aan meer onderzoek naar ervaringen van medewerkers in zelfsturende organisaties. De zelfsturende organisatiemethode die is onderzocht is holacracy, een methode van zelfsturing waar nog weinig empirisch onderzoek naar is gedaan. De centrale onderzoeksvraag is: hoe ervaren medewerkers holacratisch werken?
Het onderzoek is uitgevoerd via de kwalitatieve methoden interviews, observaties en bestudering van documenten. Er is gekozen voor kwalitatieve methoden om zo de ervaringen van medewerkers uit eerste persoonsperspectief te begrijpen en zo in de beschrijving ervan recht te kunnen doen aan de complexiteit en meerstemmigheid van ervaringen.
De resultaten laten zien dat door de gedecentraliseerde besluitvorming medewerkers meer autonomie en snelheid in besluitvorming ervaren. Ook wordt de vrijheid gewaardeerd om het takenpakket zelf samen te stellen. Het wegvallen van de manager-ondergeschikte relatie wordt door sommige uitvoerend medewerkers als plezierig ervaren, anderen missen hierdoor sturing. Voor oud- managers is het wegvallen van deze hiërarchische relatie een uitdaging omdat er grote verandering in hun gedrag wordt verwacht. Deze gegevens maken dat het niet altijd lukt volgens het formele systeem van decentralisatie van autoriteit te werken. In het maken van beslissingen wordt soms nog gezocht naar consensus of er vindt beïnvloeding plaats door medewerkers zonder formele autoriteit. Bij beïnvloeding speelt de informele hiërarchie een rol.
De belangrijkste conclusie is dat holacratisch werken genuanceerd wordt ervaren. Op de ervaringen van medewerkers zijn vooral het wegvallen van de hiërarchische manager-ondergeschikte relatie en het niet altijd werken volgens de formele gedecentraliseerde autoriteit van invloed. Doordat het formele systeem niet altijd wordt nageleefd lijkt er een informele hiërarchie te bestaan waarin de oude management hiërarchie doorwerkt.
Dit onderzoek draagt bij aan wetenschappelijke en maatschappelijke zoektocht naar alternatieven voor de management hiërarchie en biedt organisaties inzichten om holacracy succesvol te implementeren.
Beperkingen zijn dat slechts de ervaringen van enkele medewerkers zijn onderzocht bij een beperkt aantal holacratische organisaties. Dankzij de hiaten in de organisatiemethode, het aanpassen van de methode aan de organisatiecontext en het niet altijd werken volgens de formele regels bestaat de kans dat verschillen in ervaringen eerder hieraan te wijten zijn dan aan de organisatiemethode zelf. Verder volgt mijn belangrijkste beperking uit de bevinding dat het organisaties niet lukt de methode zuiver toe te passen. Hierdoor is het niet mogelijk geweest om de potentiële ervaring van het organisatiemodel bloot te leggen.
Vervolgonderzoek zou kunnen differentiëren tussen ervaringen van verschillende type medewerkers en persoonlijkheden. Daarnaast zou verder onderzocht kunnen worden of de niet persoonsgebonden manier waarop holacracy autoriteit decentraliseert kenmerkend is voor holacracy of dat dit voor alle zelfsturende organisaties geldt. Ook kan in vervolgonderzoek aan dacht uitgaan naar de informele hiërarchie binnen holacracy en de mogelijke nadelen die hierdoor worden ervaren."
