title,authors,supervisors,date,language,keywords,program,abstract
Gezond en duurzaam eten op de kaart gezet: Een mixed-method onderzoek naar de representatie van het planetary health diet in kranten uit verschillende landen wereldwijd.,"['Prieëlle, J. de']","['Charldorp, T.C. van']",2020-12-08T19:00:10Z,nl,"['mixed-method, representatie, planetary health diet, gezond en duurzaam eten, flexitarisch eetpatroon, kritische discoursanalyse, kwantitatieve inhoudsanalyse, massa media, kranten, wereldvoedselprobleem, framing, nieuwsframes']",Communicatie- en informatiewetenschappen,"Het planetary health diet heeft betrekking op de door een groep wetenschappers geschetste noodzakelijke verandering in eetgewoontes om in 2050 de wereldbevolking op een gezonde en duurzame manier te kunnen voeden. In het licht van culturele diversiteit en de sturende kracht van massamedia, is in dit mixed-method onderzoek getracht inzicht te krijgen in de wijze waarop dit dieet gerepresenteerd wordt in kranten uit verschillende landen wereldwijd. Hiervoor zijn de Verenigde Staten, Australië, India, het Verenigd Koninkrijk en Zuid-Afrika geselecteerd. Van elk van deze landen stonden drie Engelstalige kranten centraal. In totaal zijn 46 krantenartikelen verzameld die gepubliceerd zijn tussen januari en april 2019. Een bottom-up benadering in de vorm van een kritische discoursanalyse binnen een kleine selectie nieuwsberichten (n = 10) toonde dat het voorgestelde dieet weergegeven werd aan de hand van een negental nieuwsframes, namelijk het oorzakelijk verantwoordelijkheidsframe, het oplossingsverantwoordelijkheidsframe, het conflictframe, het familiariteitsframe, het gezondheidsframe, het economische consequentieframe, het realisatieframe, het prescriptiefframe en het ecologieframe. Vanuit een top-down perspectief zijn vervolgens met een kwantitatieve inhoudsanalyse de toepassingsfrequenties van de geïdentificeerde frames in alle nieuwsberichten (n = 46) geïnventariseerd. Hieruit bleek dat er significante cross-culturele variaties waren in het gebruik van de nieuwsframes, waardoor het planetary health diet op uiteenlopende manieren gerepresenteerd werd. Vervolgonderzoek zou onder meer de representatie van dit dieet over een langere tijdsperiode kunnen analyseren en daarbij focussen op nieuwsberichten in verschillende talen en van media uit andere landen dan de vijf die voor dit onderzoek geselecteerd waren."
'Lo que se pretende en los cursos de ELE es enseñando un español correcto'. Una propuesta para mejorar la enseñanza del gerundio español en un contexto holandés.,"['Plantagie, M.C.']","['Jauregi Ondarra, K.', 'de Graaff, R.']",2021-02-01T19:00:08Z,es,['gerund; SFL; Spanish; Dutch; linguistic transference; grammar; Gente Hoy'],Spaanse taal en cultuur: educatie en communicatie,"In spite of the apparent similarities between the Spanish gerund and the similar form in one’s L1 (or other L2/FL), many students of Spanish as a Foreign Language make errors in its use that are considered incorrect from a prescriptivist or a descriptivist perspective. It is estimated that linguistic transference plays an essential role in this process, as well as the scarcity of explicit education of the form. For this reason it is surprising that up until now this syntactic phenomenon has not been heavily studied in the academic literature with didactic objectives in mind. Therefore, with the aim of evoking academic interest in this complex grammatical structure, the present study reports on the employment of the Spanish gerund by adolescent students of Spanish with Dutch as their L1 – a language with a relatively low use of the equivalent of the gerundio. After analysing didactic material and submitting 22 students of Spanish and 7 native speakers to a grammaticality judgment, it is concluded that above all education should be improved on the various semantic meanings of the non-periphrastic gerund and the nuances of the independent gerund. The ideal education of the gerund is then presented as an amplification of correct knowledge rather than the correction of incorrect knowledge."
Kwalitatief onderzoek naar de invloed van second order leren in docententeams op onderwijsvernieuwing in het primair onderwijs,"['Franken, R.A.']","['Hagemeijer, R.E.', 'Kolkhuis Tanke, I.R.']",2021-02-15T19:00:40Z,nl,"['second-order learning, teamleren, organisatieleren, onderwijsvernieuwing, primair onderwijs, template analyse']",Educational Sciences,"Dit onderzoek was gericht op de invloed van second-order leren in docententeams op onderwijsvernieuwing in primair onderwijs. Onderwijsvernieuwingen die diep ingrijpen op onderwijspraktijken hebben de aard van een second order change. Leren is een voorwaarde om te veranderen op individueel, team en organisatieniveau. Leren van docenten is cruciaal, omdat zij tegelijkertijd veranderingsagent zijn en moeten veranderen. Een diepgaande vorm van leren, second order learning, is een voorwaarde om diep ingrijpende veranderingen te realiseren. De focus was op teamleren als verwachte schakel tussen individueel en organisatieleren. Het kwalitatief onderzoek is uitgevoerd als een instrumentele case study bij twee basisscholen, die het lopende schooljaar een vernieuwing hadden ingevoerd. De participanten waren lid van docententeams of vanuit een andere rol betrokken bij de vernieuwing. De data werden met semigestructureerde interviews verzameld. De analyse is met een gestructureerde techniek uitgevoerd: Template Analysis. Uit het onderzoek bleek, dat second-order leren in docententeams een positieve invloed heeft op onderwijsvernieuwing; vooral bij stabiele teams waarbij teamleden in wederzijdse afhankelijkheid met elkaar samenwerken. De resultaten liggen hoofdzakelijk op teamniveau. Het is daarom raadzaam meer aandacht te geven aan de interactie van mensen tussen teams en het schoolniveau om de link met leren op organisatieniveau te creëren en borgen."
De Bijdrage van de Sociale Werkomgeving aan de Ontwikkeling van Psychologische Kapitaal bij Young Professionals op de Arbeidsmarkt.,"['Lebbink, M.C.']","['Kolkhuis Tanke, I.R.', 'Louws, M.L.']",2021-02-15T19:00:40Z,nl,"['Psychologisch kapitaal (PsyCap), bevlogenheid, burnout, sociale werkomgeving, young professionals']",Educational Sciences,"Bevlogen werknemers dragen bij aan het succes van een organisatie (Bakker & Demerouti, 2008). Psychologisch kapitaal (PsyCap), bestaande uit de positieve capaciteiten hoop, optimisme, veerkracht en self-efficacy, kan dienen als hulpbron voor bevlogenheid (Van Wingerden, Bakker, & Derks, 2016). In dit onderzoek wordt de bijdrage van de sociale werkomgeving (collega’s en leidinggevenden) aan de ontwikkeling van PsyCap bij young professionals op de arbeidsmarkt onderzocht. Uit de resultaten is gebleken dat leidinggevenden kunnen bijdragen aan deze ontwikkeling door middel van coaching; het geven van advies en feedback; het bieden van een ander perspectief op gebeurtenissen; het bijdragen aan een veilige omgeving waarin open gecommuniceerd wordt en fouten maken mag; het faciliteren van het opdoen van ervaring; het geven van voldoende tijd om deze ervaring op te doen; het bieden van opleidingsmogelijkheden en het geven van inhoudelijke en financiële waardering. Collega’s kunnen bijdragen door middel van coaching; het geven van advies en feedback; het bieden van een ander perspectief; het delen van ervaringen; voorbeelden en het bijdragen aan een veilige omgeving. Bovenstaande bevindingen dragen bij aan het onderzoeksveld naar de ontwikkeling van PsyCap bij young professionals. HRD-professionals kunnen de bevindingen benutten om de ontwikkeling van PsyCap bij young professionals te stimuleren."
De invloed van dynamieken tussen leidinggevende en medewerker op innovatief werkgedrag,"['Spaargaren, J.']","['Kolkhuis Tanke, I.R.', 'Wouters, P.J.M.']",2021-02-15T19:00:40Z,nl,"['innovatief werkgedrag, influence based leadership, dynamieken, leiderschap']",Educational Sciences,"De maatschappij verandert door aanhoudende technologische veranderingen en innovaties. 
Voor het onderwijs is het belangrijk om actueel te blijven en aansluiting te houden met nieuwe generaties leerlingen door bijvoorbeeld innovaties of vernieuwingen door te voeren en daarmee competitief en onderscheidend zijn van elkaar. 
Het onderwijs is een plek waar veel sociale uitwisseling plaatsvindt en de interactie tussen werknemer en de leidinggevende is een vorm van deze uitwisseling. Leidinggevenden kunnen veel invloed hebben op het innovatief gedrag van werknemers. Binnen commerciële organisaties is dit voldoende onderzocht maar in het onderwijs is hier nog weinig onderzoek naar gedaan. 
In dit onderzoek is gekeken naar de invloed van leiderschapsdynamieken op het innovatief werkgedrag van docenten. Daarbij is specifiek gekeken naar welke dynamieken tussen leidinggevende en medewerker een stimulerende of belemmerende invloed hebben op innovatief werkgedrag. Om dit te onderzoeken zijn semi-gestructureerde interviews afgenomen bij de lesgevende docenten en de leidinggevenden. Deze interviews zijn geanalyseerd volgens de gefundeerde theorie. 
De resultaten laten zien dat communicatie, aansturing, ondersteuning en waardering, kennisdeling en vrijheid en autonomie het innovatief werkgedrag van medewerkers stimuleren. Een gebrek aan dezelfde begrippen belemmeren het innovatief werkgedrag. Ook is er in dit onderzoek gevonden dat een gebrek aan samenwerking tussen een leidinggevende en een medewerker innovatief werkgedrag belemmert."
Digital Game-based Learning: How Goal-oriented Instruction and Intrinsic Motivation Affects learning.,"['Lahaye, C.T.']","['Wouters, P.J.M.', 'Broek, G.S.E. van den']",2021-02-15T19:00:40Z,en,['Digital Game-based Learning Environments; Mastery Goal-oriented Instruction; Performance Goal-oriented Instruction; Intrinsic Motivation.'],Educational Sciences,"Few studies have investigated the integration of digital games in learning contexts. One way of integrating Digital Game-based Learning [DGBL] into the learning context is to provide instructions about the objectives of playing the game. Although research indicates that goal-oriented instructions increase deep learning, the effect of instruction is not yet fully understood. The aim of this study is to investigate how the relationship between mastery-oriented instruction and deep learning is mediated by intrinsic learning motivation in DGBL environments. Therefore (n = 103) participants, aged 16-25, participated in an experimental mixed design study with a pre-test and post-test in three conditions. The control condition did not receive instruction whereas the experimental conditions received either a performance or mastery goal-oriented instruction. The results show no relationships between goal-oriented instruction type and deep learning. The results suggest a negative effect for performance goal-oriented instruction on intrinsic learning motivation. However, further research is needed to confirm this. A significant relationship is found between intrinsic learning motivation and deep learning. Which indicates that educators should aim to increase intrinsic learning motivation of students in DGBL environments. The intrinsic learning motivation of students positively impacts deep learning."
Learning in Education with Augmented Reality on a Smartphone: Individually or Collaborative?,"['Pijl, O.']","['Schaars, M.M.H.', 'Tilborg, A.J. van']",2021-02-16T19:00:11Z,nl,['augmented reality; learning outcomes; collaboration; cognitive theory of multimedia learning; conventional learning'],Educational Sciences,"Augmented reality (AR) tools designed with the principles from the cognitive theory of multimedia learning (CTML), could enhance learning in education, but previous research has shown contradictory results while working individually or collaboratively with AR. To prove if the CTML principles are responsible for the increasing learning outcomes, current study used AR tools which violated the CTML principles in general to examine the differences in the learning outcomes. Ultimately, a statement can be made if a teacher could implement AR tools which violates CTML principles in their education. Forty-nine Dutch speaking participants from regional training centers in the Netherlands were recruited. Current study used a 2x2 quasi-experimental factorial design. The factors were learning environment (AR/conventional) and group composition (collaboratively/individual). The results were analyzed with ANCOVA analysis with pretest as covariate. All groups scored significantly higher on posttest compared to pretest, but non-significant effects of learning environment and group composition were found, which means that the used AR-tool does not negatively influence the learning outcomes and could be implemented in education. Further research should measure different forms of students’ cognitive load and different forms of collaboration in order to positively influence the learning outcomes with AR-tools which violated the CTML principles."
"Ondernemers Perspectief: Invloed van Motivatie op Ecologische Duurzaam
Ondernemerschap","['Reineke, M.']","['Hagemeijer, R.E.', 'Kolkhuis Tanke, I.R.']",2021-02-16T19:00:11Z,nl,['Duurzame ontwikkeling; duurzaam ondernemerschap; ecologisch ondernemerschap'],Educational Sciences,"Toenemende milieuproblemen en de druk van het ecologisch systeem zorgen ervoor dat ondernemers meer druk ervaren om duurzaamheid aan te pakken in de activiteiten van hun onderneming. Ecologisch duurzaam ondernemerschap is een specifiek fenomeen van het duurzaam ondernemerschap waarbij een nadruk wordt gelegd op het ecologische aspect van duurzame ontwikkeling. De case studie vond plaats bij 17 (mede)oprichters van een ecologisch duurzaam ondernemerschap. De resultaten suggereren dat de motivatie om ecologisch duurzaam te ondernemen kan variëren van het oneens zijn met en het willen verbeteren van de huidige industrie en duurzame waarden. De ecologisch duurzaam ondernemer lijkt een specifiek wereldbeeld te hebben en probeert dit te realiseren. Dit toont parallellen met wat er geschreven is over het constructivistisch narcisme. In dit onderzoek komt naar voren dat de motivatie van de ecologisch duurzaam ondernemer meer complementair dan concurrerend is ten opzichte van de strategische acties, de uitdagingen en de bedrijfsresultaten. Een verklaring zou kunnen zijn dat de duurzame waarden en de overtuiging dat de ecologisch duurzaam ondernemer de wereld kan verbeteren in het klimaat van de organisatie aanwezig is. Toekomstig onderzoek zou betrekking kunnen hebben op de relatie tussen ecologisch duurzaam ondernemers en de constructivistische narcisten."
"Self-regulated Learning, Self-efficacy and Reading Comprehension as Predictors on Arithmetic Performance of Mbo Students","['Ekelmans, J.M.']","['Schaars, M.M.H.']",2021-02-15T19:00:39Z,en,"['Arithmetic, self-regulated learning, self-efficacy, reading comprehension, mbo']",Educational Sciences,"Arithmetic skills are important for students’ future careers and daily lives, but the arithmetic skills of mbo students are not at the required level and are improving too slowly. The Dutch government aims to include an arithmetic examination for mbo students starting in the 2019-2020 school year, and passing this examination will be mandatory to acquire a diploma. Therefore, the arithmetic problems within the mbo student population must be examined. There are several factors that influence arithmetic performance. The literature states that self-regulated learning (SRL), self-efficacy, and reading comprehension (RC) influence performance in arithmetic; thus, the current study uses multiple regression analysis to investigate the extent to which SRL, self-efficacy, and RC predict the arithmetic performance of students. The results demonstrate that SRL, self-efficacy and RC significantly predict and explain 23.1% of mbo student’s arithmetic performance. Future research should focus on improving SLR, self-efficacy and RC related to arithmetic performance of mbo students. In order to contribute to their improved arithmetic performance and thus also to their daily lives, future careers and education."
Behavioural Intention of Teachers for Teaching Computational Thinking in Primary Education,"['Bruggink, B.']","['Wouters, P.J.M.', 'Broek, G.S.E. van den']",2021-02-15T19:00:39Z,en,"['Computational Thinking, Theory of Planned Behaviour, Structural Equation Modelling, 21st century skills']",Educational Sciences,"Teachers are challenged with the task of teaching Computational Thinking (CT) to their students. This study seeks to identify factors and their influence that initiate teachers to implement CT in their teaching programs. The Theory of Planned Behaviour (TPB) is used to gain insight into factors that influence people’s intention to perform behaviour. The influence of policies and a shared vision on school level was also taken into account. A questionnaire was used and spread among teachers (n = 73) of schools who were interested in implementing CT in their education. Structural equation modelling was used to see if the independent variables (1) attitude; (2) subjective norm; (3) perceived control; (4) policy & vision, influenced the dependent variable “intention to use CT”. The relationship among the independent variables was also measured. Subjective norm and perceived control seemed to significantly influence the teachers’ intention to implement CT in teaching programs. Correlations were found between all independent variables, these variables influence each other and might suggest indirect effects of both attitude and policy & vision on the intention of teachers to implement CT in teaching programs."
Van overtoerisme naar ecotoeisme,"['Broek, F.N. van den']","['Leeuw, B. de']",2021-03-01T19:00:18Z,nl,"['Overtoerisme, ecotoerisme, interdisciplinair, Amsterdam']",Liberal Arts and Sciences,"Interdisciplinair onderzoek naar de transitie van overtoerisme naar ecotoerisme in Amsterdam. Vanuit de sociale geografie, sociale psychologie en Governance for sustainable development wordt er een overzicht gegeven van hoe elke discipline hier een rol in kan spelen en is er een door middel van een integratie van de disciplines een holistische aanpak geformuleerd die deze transitie kan sturen."
Een bijdrage aan het Nieuwe Racisme? Representaties van de zwarte gemeenschap in The People V. O.J. Simpson: American Crime Story,"['Bayoumi, D.S.M.']","['Romondt Vis, P. van']",2021-03-03T19:00:15Z,nl,"['Representatie, discours, stereotypering, racialized & racist regimes of representation, ‘de Ander’, new racism']",Communicatie- en informatiewetenschappen,"Vanuit een maatschappelijk perspectief kunnen negatieve mediarepresentaties van minderheidsgroeperingen problematisch zijn, omdat ze bijdragen aan de onderdrukking (Crue, 2003) en marginalisatie van minderheidsgroeperingen (Shadid, 2005). Daarom is het van belang om representaties in mediateksten te analyseren, want hoe meer (negatieve) beelden er op televisie zijn, hoe sneller kijkers dit beeld oppikken en een stereotype creëren (Dong & Murillo, 2007), wat ongunstige en negatieve houdingen tegenover minderheidsgroeperingen kunnen veroorzaken (Fujioka, 1999). 
Hall (1997) beweert dat er traceringen van stereotypen uit de slavernijtijden te vinden zijn in de hedendaagse mediarepresentaties van zwarte Amerikanen. Dit wordt onderzocht door middel van een critical discourse analysis van Fairclough (1995), waarmee acht fragmenten uit vier afleveringen uit de televisieserie The People v. O.J. Simspon: American Crime Story geanalyseerd, waardoor de volgende onderzoeksvraag beantwoord kon worden: Hoe wordt de zwarte gemeenschap in de Verenigde Staten gerepresenteerd in de Netflix-serie The People v. O.J. Simpson: American Crime Story? 
Uit de discoursanalyse is gebleken dat het discours rondom de zwarte gemeenschap regelmatig negatief is, aangezien zwarten vooral aan de hand van negatieve stereotyperingen worden gerepresenteerd. Veelvoorkomende thema’s in de serie, zoals slavernij, criminaliteit en geweld, komen in meerdere fragmenten naar voren als de zwarte gemeenschap ter sprake komt. 
Enerzijds biedt dit onderzoek, in wetenschappelijk belang, een inzicht hoe media nieuw racisme kunnen incorporeren (Siapera, 2010; Van Dijk, 2000), omdat de serie ook traceringen van een verouderd, racistisch, stereotyperend figuur (Toms) heeft geïncorporeerd (Hall, 1997). Hierdoor is er aangetoond dat traceringen van dit soort figuren nog steeds op subtiele wijzen kunnen voortleven in moderne media, waarmee de bewering van Hall (1997) bevestigd wordt. 
Anderzijds dragen de gevonden traceringen van het figuur niet bij aan het nieuwe racisme (Siapera, 2010; Van Dijk, 2000), omdat zwarte stereotyperingen in de serie niet uitsluitend ingezet worden om de zwarte gemeenschap negatief te representeren, maar om het raciale debat rondom O.J. Simspon’s verhoor op reële wijze te belichten, aangezien zwarte stereotyperingen toentertijd een belangrijk deel van de sociale kwestie vormden. Ook dragen de negatieve representaties van de zwarte gemeenschap in de serie, in een bredere, historische context, ook niet bij aan de instandhouding van een racistisch regime van representatie (Hall, 1997; Siapera, 2010)."
Een Analyse van Albert Camus’ kritiek op Søren Kierkegaard,"['Dwarshuis, F.G.']","['Ziche, dr. P']",2021-05-06T18:00:14Z,nl,"['Camus , Kierkegaard, Absurd ,']",Liberal Arts and Sciences,"Albert Camus doet in De Myte van Sisyfus een poging om zijn eigen conceptie van een ethiek van het absurde uiteen te zetten. Dit doet hij door zich te verzetten tegen eerdere pogingen om dit te doen. Een van de auteurs waartegen hij zich verzet is de Deen Søren Kierkegaard. In dit essay analyseer ik de kritiek van Camus op Kierkegaard. Naar mijn mening is er de mogelijkheid om ook Camus zelf de maat te nemen: in hoeverre is zijn kritiek op Kierkegaard niet ook van toepassing op zijn eigen conceptie van het absurde? Camus probeert met deze kritiek de uniciteit van zijn eigen standpunt te onderbouwen. Ik meen echter dat Kierkegaard en Camus dichter bij elkaar blijken te staan dan Camus misschien zelf wel heeft gedacht. Beide filosofen ondernemen in hun werken een zoektocht naar een leven met het absurde. Beiden willen het probleem niet uit de weg gaan, maar ermee leven. Voor Kierkegaard biedt God genezing van het absurde, voor Camus is de enige optie zelf God worden."
Heroic diversity: A study on cultural diversity of the heroes cast of the video game Overwatch,"['Breevoort, A.E.R.']","['Raessens, Joost']",2021-07-02T18:00:10Z,en,[],Nieuwe media en digitale cultuur,"Battling over objectives and taking down other teams is your goal when you participate in a 6-vs-6 player match in the video game Overwatch. It transpires on a so-called ‘near-future Earth’ and was released on May 24, 2016 by the game studio Blizzard Entertainment. The video game has received appraisal on its effort to portray diverse forms of representation in the ‘Heroes’ cast, the group of playable characters of the game. However, some critics have also argued that these ‘forms of diversity’ may need to be because its diversity is not real. In this thesis the argument is posed that the current understanding of cultural diversity within video games with the accompanying available research, does not cover what cultural diversity really is from a diversity studies perspective. Therefore, this study took this perspective into account. Moreover, the philosopher Slavoj Žižek provided a lens in order to critically compare the cultural diversity in Overwatch to what real cultural diversity entails. A video game could be seen as a conversational object within broad societal issues, therefore this thesis was conducted through a critical discourse analysis. From this analysis it appeared that the question of if there is real diversity present, seems to depend on how you look at the game. When one puts the focus on the lore and background stories of the heroes of Overwatch, the game appears to be quite culturally diverse. However, when one takes a look at how much of this comes back in the game itself, when a player plays with a character, the cultural diversity happens to not be so apparent."
"DE AIVD LUISTERT MEE,
Een onderzoek naar ethische verantwoording van intelligencevergaring door de jaren heen in Nederland.","['Ottes, W.H.']","['Beers, Marloes']",2021-08-02T18:00:21Z,nl,[],Liberal Arts and Sciences,"De invoering van de in 2018 aangenomen Wet op de Inlichtingen- en Veiligheidsdiensten zorgde in Nederland voor enige commotie omtrent privacy versus veiligheid. Het huidige onderzoek heeft twee Nederlandse kranten in drie periodes en de mate van ethische verantwoording onderzocht, om een antwoord te vormen op de vraag: “In hoeverre blijkt uit De Telegraaf en De Volkskrant een ethische verantwoording van de Nederlandse intelligence in de jaren 1987 – 1988, 2002 en 2018.” Voor de analyse is gebruik gemaakt van de kranten De Telegraaf en De Volkskrant. Dit onderzoek focust zich op drie tijdsperiodes waarbij de houding van de twee verschillende kranten tegenover inlichtingendiensten wordt gecategoriseerd. De conclusie die getrokken kan worden uit dit onderzoek is dat ethische verantwoording per onderzochte periode is toegenomen. Vervolgonderzoek naar effectieve selectie van artikelen en categorisering is relevant om de ethische verantwoording in de toekomst beter te kunnen onderzoeken."
