title,authors,supervisors,date,language,keywords,program,abstract
Act your age! Een verkennend onderzoek naar de aanwezigheid van oudere actrices in Nederlandse box-office hits,"['Lier, B.W. van']","['Thissen, J.']",2017-02-01T18:32:07Z,nl,"['Oudere actrices, box-office hits, rolverdeling']",Film- en Televisiewetenschap,De aanwezigheid van oudere actrices in films is een nog summier onderzocht onderzoeksgebied. Dit onderzoek heeft een eerste stap gezet om op dit gebied voor Nederlandse box-office hits vanaf de jaren zeventig te kijken hoe deze aanwezigheid zicht heeft ontwikkeld. Hieruit bleek dat de afgelopen vier decennia (1970-2010) oudere actrices aanzienlijk minder rollen in films vertolkten in vergelijking met jongere actrices en met acteurs. Met name de laatste vijf jaar is er echter een duidelijke verbetering waar te nemen waarin oudere actrices meer rollen mogen vertolken en ook op een positieve manier representatieve rollen mogen vertolken. De vergrijzing van de Nederlandse bevolking en de veranderende arbeidsparticipatie onder Nederlandse vrouwen heeft mede voor een context gezorgd waarbinnen een grotere acceptatie van oudere actrices en daardoor het grotere aantal rollen dat zij binnen films vertolken mogelijk was.
Fighting discourse: Social workers’ strategies to create a counter-discourse on the position of Muslims in Dutch society,"['Tebbens, N.']","['Gould, L.M.']",2017-02-01T18:32:09Z,en,"['Terrorist attacks, Discourse Theory, Framing, Social Boundaries, Polarisation, Social workers, Bottom-up strategies, Counter-discourse']",Conflict Studies and Human Rights,This research aims to understand how social workers who aim to improve the relationship between Muslims and non-Muslims intend to counter the discourses on the violent acts in Paris and Brussels.
The Ins and Outs of Translating a Commercial Website: Horseware,"['Weychan, J.M.']","['Kosters, O.']",2017-02-01T18:32:12Z,en,"['commercial text, website, technical terminology, Horseware, equestrian']",Vertalen,"The purpose of this thesis is to analyse the potential translation problems that arise when translating 
a commercial website. As a case study the website of Horseware, a producer of equestrian products, 
has been chosen. Translation problems that are the result of text type (commercial), medium (a 
website), intended function and effect of the text as well as the technical terminology are all 
discussed. With the help of approaches and strategies as suggested by Christiane Nord, Patrizia 
Pierini, Veronica Smith and Christine Klein-Braley, and many others the problems will be investigated 
and possible solutions will be shown. The most desirable solutions will be applied in the translation 
of (a part of) the Horseware website, showing in which ways it is necessary to adjust the source text 
to the target audience in the translation process."
"The student as initiator of the bicycle renaissance in Dublin.
A study on the main perceived barriers to bicycle commuting by the students of Trinity College Dublin.","['Spauwen, K.T.']","['Bos, B.M.']",2017-02-15T18:22:08Z,en,[],Liberal Arts and Sciences,
Classivicatie van algebraïsche oppervlakken.,"['Meuwese, R.H.']","['Beukers, F.']",2017-02-15T18:21:47Z,nl,[],Wiskunde,
Gauss-sommen over algebra's,"['Ringeling, B.J.']","['Beukers, F.']",2017-02-15T18:21:49Z,nl,[],Wiskunde,
"Identifying key factors influencing sustainable wine production - A case study on the wine sector in the Porto and Douro region, Portugal","['Laan, R.J. van der']","['Moors, prof. dr. E.H.']",2017-02-21T18:48:17Z,en,"['Sustainable wine production, Regional Innovation System, Sectoral System of Innovation, New World wine region, Old World wine region, Porto, Douro, Wine region.']",Sustainable Business and Innovation,"The agricultural sector is an important contributor to the unsustainable use of natural resources today and poses large sustainability challenges in the future. This is due to a growing world population that consumes an ever increasing resource intensive diet. The wine sector, while commonly viewed as a natural and low-impact sector, has significant environmental impacts, such as water use, loss of biodiversity and greenhouse gas emissions. Hence, it becomes increasingly important to incorporate sustainable wine production in the worlds wine regions. New World wine regions (e.g. California, New Zealand) have shown to rapidly develop their sustainable wine production, unlike Old World wine regions (e.g. European regions like France, Spain, Portugal). 
The purpose of this study is to find factors that influence sustainable wine production. Therefore, both the Regional Innovation System (RIS) and the Sectoral System of Innovation (SSI) are integrated into a Regional and Sectoral Innovation System (RSIS). From this approach, influencing factors are explored and determined whether they are supporting or hindering sustainable wine production. The Sustainability Assessment of Farming and the Environment (SAFE) framework is used to identify sustainability challenges in the case-study region and to identify the sustainability element of factors influencing sustainable wine production. As a case-study region, the Old World Porto and Douro wine region in Portugal is chosen. Next to the Old World case-study region, a general comparison with the New World wine region California is executed, to find discrepancies between the two. The main sustainability challenges identified in the Porto and Douro wine region are; excessive pesticide use, genetic erosion, water scarcity, the low price of wine, and decreasing population in the viticultural area. The main hindering factors to sustainable wine production identified are related to the legislative framework, the financial risks involved, and the resistance to change mind-set of people working in the wine sector. The main supporting factors to sustainable wine production identified are related to a growing market for sustainable wines, increase in wine tourism and entrepreneurship. Due to the comparison with the New World wine region, the inadequate representation of the farmers has been identified as a hindering factor to sustainable wine production in the Porto and Douro wine region. It is recommended that the Porto and Douro wine region governing organizations explore the possibility to introduce mechanisms that support, reward, and educate on, sustainable wine practices, considering the supporting and hindering RSIS factors that are identified."
Evaluation of the effectiveness of vaccination as an intervention tool in the control of visceral leishmaniasis in Sudan,"['Farrand, S.L.']","['Le Rutte, E.A.']",2017-02-21T18:48:25Z,en,"['visceral leishmaniasis, intervention tools, vaccine, control, Sudan']",Geneeskunde van gezelschapsdieren,"Background: Visceral leishmaniasis (VL) is a parasitic vector-borne neglected tropical disease (NTD), transmitted by sand flies. VL is endemic in Sudan, where it is mainly caused by Leishmania donovani. The WHO targets in Sudan are 100% detection and treatment of cases by 2020. However, with current control measures an estimated 80% of the cases remain undetected and untreated. Therefore additional intervention measures seem necessary, such as active case finding or potentially a vaccine. In this study we analysed a longitudinal dataset from Mushrau Koka, a village in East Sudan, to obtain insight in 1) the immune response of people against L. donovani over time, 2) the risk factors for development of subclinical or clinical infection and 3) the possible protective effect of previous infections. The aim of this study was to investigate the potential effectiveness of a vaccine as an intervention tool for VL control in Sudan.

Methods: A longitudinal epidemiological study was conducted in Mushrau Koka, Sudan between 1994 and 1996, using 5 different surveys. Various data regarding VL were collected from 1142 persons, among others about age, sex, place of birth, weight, length, medical history, clinical signs and whether VL was diagnosed. All individuals were also tested for antibodies against Leishmania parasites by using the direct agglutination test (DAT, humoral immunity), and the leishmanin skin test (LST, cellular immunity).

Results: The current leishmaniasis control programme in Sudan is not sufficient to achieve the WHO targets of 100% detection and treatment. Currently, there are VL vaccines in development, but it can take a long time before effective vaccines are available for the field. If an effective human vaccine comes available, it will likely be implementable in the current vaccine program in Sudan. Clinical VL incidence was found to be higher in persons with a high DAT titer, (between 1:25600 and 1:102400), than in persons with a low (1:200 to 1:800) or medium (1:1600 to 1:12800) DAT titer. LST positivity was found to increase with higher age. Contrary to our expectations, in Mushrau Koka, LST positivity did not show a protective effect against developing VL (diagnosed in retrospect). VL incidence was found to be higher in men than in women. In literature we found that VL incidence is higher in people with a household member with VL. These risk factors could assist in formulating additional intervention tools for VL control in Sudan. 

Conclusions: This study did not show a protective effect of previous exposure to L. donovani. Since it might also take a long time before an effective human vaccine comes available, we suggest that additional interventions should focus on screening people in high risk groups, such as house hold members of a clinical VL case, with a diagnostic test (DAT), and follow up individuals with a high DAT titer, to increase the detection and treatment rates in Sudan."
"An investigation of the metamorphic evolution of the Kvalvika garnet peridotite body, Flemsøya, Nordøyane, WGR, SW Norway","['Apeiranthiti, D.']","['van Roermund, H.', 'Drury, M.']",2017-02-21T18:48:18Z,en,"['peridotite, garnet, mantle, thermodynamic, modelling, perple-x, Norway, Kvalvika']",Earth Structure and Dynamics,"Quantitative analyses of pressure and temperature conditions are combined with microstructural and mineral compositional analyses to reconstruct the PT path of the Kvalvika garnet peridotite (KGP) lens situated in the Northern (U)HP domain of the Wester Gneiss Region (WGR), Flemsøya island, SW Norway. The KGP lens is an orogenic garnet-spinel peridotite with different modal proportions of olivine ±garnet ±clinopyroxene ±orthopyroxene ±spinel defining compositional banding expressed as garnet clinopyroxenite and garnet websterite bands. 
Structural observations, using naked eye, light-optical and electron-optical microscopic techniques, together with mineral compositional analyses (EMP) of garnet phenocryst, revealed the presence of 3 stable mineral assemblages M1-M2-M¬3 seemingly equivalent to previously reported studies of garnet peridotite bodies at the (U)HP domain of the WGR. Specifically, 2 generations of garnets, called M1 and M2 were identified with microstructural evidence indicating that M2 garnet together with Cr-rich spinel are the recrystallized product of the M1 garnet.  
Thermodynamic modeling, using the software Perple_X and the available upgraded solid solution data set for Cr-rich phases, yield pressure and temperature conditions for the M1 garnet of T=1500°C and P=3,4GPa and for the M2 garnet, of T=1000°C and P=2,6GPa. Supplementary, classic/empirical geothermobarometric methods were also applied to the M3a assemblage of the garnet peridotite and to the garnet pyroxenite rocks. The results indicate P=2,8GPa and T=700-720°C
The resulted PT conditions allowed the reconstruction of the PT path of the KGP which includes sub-isobaric cooling from asthenospheric temperatures around 1500°C to 1000°C and pressures around 3,4GPa to 2,6GPa, Finally, the PT path of the KGP lens is comparable to the early tectonometamorphic evolution of garnet peridotite lenses situated in Otrøy and Bardane from the (U) HP domain of the WGR implying similar geodynamic evolution."
Identifying transferrable lessons of Urban Water Management and Governance in the USA and beyond: Facilitating Integrated Water Resources Management through the Application of the City Blueprint Framework and Governance Capacity Framework,"['Feingold, D.P.']","['van Leeuwen, C.J.']",2017-02-21T18:48:17Z,en_US,[],Sustainable Development,"Cities in the U.S. face increasing pressures on their water resources from urbanization and climate change resulting in depletion, pollution, and increased flood and heat risk. These challenges are complex while the specific impacts of climate change are uncertain. Integrated water resources management (IWRM) and adaptive management (AM) are the keys for cities to address the complexity and uncertainty they face. The research determines the trends and pressures that may affect a city’s water resources management and assesses the IWRM performances of Los Angeles, New York City, Boston, Milwaukee, Portland and Phoenix in order to identify strengths and areas for improvement of IWRM. Enhancing governance capacity on the city level facilitates the improvement of IWRM practices. The governance capacity of New York City was assessed in order to identify governance conditions that can be strengthened in New York City and other cities in the U.S. The results show that cities in the U.S. face pressure from urbanization and heat risk while tertiary wastewater treatment, solid waste recycling, nutrient recovery from wastewater treatment, stormwater separation, and green space can be improved to enhance the overall IWRM performance of U.S. cities. There is room for improvement for all governance conditions with special focus on improving continuous learning through increased monitoring, evaluation and cross-stakeholder learning."
A New Method to Determine Maximum Perturbation Growth in a Quasi-Geostrophic Ocean Model,"['Oosterwijk, A.P.C.']","['Dijkstra, H. A.', 'van Leeuwen, T.']",2017-02-22T18:20:46Z,en,"['PSO,COBYLA,QG model,constraint optimisation, particle swarm,']","Meteorology, Physical Oceanography and Climate","Analysing growth of initial perturbations in dynamical systems is an  important aspect of predictability theory 
because it tells us which perturbations have the strongest influence on the system. For linear systems, these perturbation are the modes with the largest eigenvalues.
For nonlinear systems, we consider the conditional nonlinear perturbation (CNOP). These can be found by solving a nonlinear constrained maximization problem, which is typically done using
sequential quadratic programming (SQP), a routine that requires an adjoint model. Such adjoint models are not always available. Therefore, we study two adjoint-free methods: PSO and COBYLA. Because such 
methods typically work best on low-dimensional problems, we apply dimension reduction. We use the proposed methodology to find the CNOPs of a quasi-geostrophic ocean model. We find that 
COBYLA outperforms PSO and is able to find reasonable CNOPs, although at a higher computational cost than conventional adjoint-based methods."
"De drijfveren van experiëntiële vermijding: het verband tussen experiëntiële vermijding, regulatiefocus en actie-oriëntatie","['Klundert, N. van de']","['Custers, Ruud']",2017-02-28T18:18:29Z,nl,"['Experiëntiële vermijding, Regulatiefocus, Actie-oriëntatie, Toestandsoriëntatie']",Liberal Arts and Sciences,"In deze studie wordt onderzocht wat experiëntiële vermijding drijft. Experiëntiële vermijding
betreft het vermijden van negatieve persoonlijke ervaringen, gedachten en gevoelens en de onwil om
hiermee in contact te blijven. In de eerste studie wordt de samenhang tussen experiëntiële vermijding
en regulatiefocus onderzocht. Regulatiefocus bestaat uit promotie- en preventiefocus, respectievelijk
het nastreven van positieve uitkomsten en het vermijden van negatieve uitkomsten. Er werd een
pilotstudie uitgevoerd onder participanten tussen de 18 en 47 jaar (N = 30). Er bleek geen samenhang
te zijn tussen experiëntiële vermijding en preventiefocus, maar wel een significante, sterke, negatieve
correlatie tussen experiëntiële vermijding en promotiefocus (Studie 1). Dit effect is gerepliceerd in
een tweede studie (Studie 2a) onder participanten tussen de 18 en 30 jaar (N = 72). Tevens is hierin de
samenhang tussen experiëntiële vermijding, regulatiefocus en actie-oriëntatie onderzocht. Hieruit is
gebleken dat experiëntiële vermijding negatief samenhangt met actie-oriëntatie. Uit het huidige
onderzoek blijkt dat experiëntiële vermijding samengaat met een gebrek aan promotiefocus en een
gebrek aan actie-oriëntatie. Het lijkt er dus op dat experiëntiële vermijding het vastzitten in passiviteit
betreft. In Studie 2b (N = 66) is onderzocht of de manier waarop mensen in de dagelijkse praktijk
doelen formuleren correspondeert met de regulatiefocus zoals deze naar voren komt in de Regulatory
Focus Questionnaire. Hiervoor is geen ondersteuning gevonden. Suggesties voor vervolgonderzoek
zijn om de studies te repliceren in een grotere steekproef en onder klinische patiënten, om zo mogelijk
een meer geschikte behandeling te vinden voor het aanpakken van experiëntiële vermijding."
"Mindfulness, Mindful Coping, Burnout, and Work Engagement","['Bus, M.F.']","['Damen, T', 'Den Ouden, M']",2017-03-01T18:31:39Z,en,['Mindfulness; Mindful Coping; Burnout; Work Engagement; MBSR'],Klinische en Gezondheidspsychologie,In dit onderzoek zijn data verzameld bij 160 werknemers van de Radboud Universiteit en de Hogeschool van Arnhem en Nijmegen die een mindfulness-based stress reduction training (MBSR) hebben gevolgd. Het doel was om het effect van mindfulness op werk gerelateerde psychologische uitkomsten te verklaren. De resultaten laten zien dat mindfulness geen personal resource is in het JD-R model; alleen bij hoge waarden van mindfulness verklaard mindfulness een deel van de relatie tussen werkbronnen en bevlogenheid. Daarnaast bewijst deze studie het effect van MBSR op verschillende uitkomstmaten en de rol van mindfulness hierin. De training blijkt effect te hebben. Verder blijkt uit de studie dat mindful coping een werkend bestanddeel is van de MBSR training. Beperkingen van dit onderzoek en de noodzaak van verder onderzoek worden bediscussieerd.
Bifurcation Analysis in 1D diffusive neural fields models with transmission delays,"['Bellingacci, R.']","['Gils, S. van', 'Kuznetsov, Y. A.', 'Zegeling, P.A.']",2017-02-28T18:18:19Z,en,"['Bifurcation, neural fields, delay differential equations, dde']",Mathematical Sciences,"Bifurcation theory for delay differential equations on neural field models has been extensively analysed in the paper of  Stephan van Gils et al. Shortly after, in the paper of Koen Dijkstra et al., it was shown how symmetry arguments could simplify the computation of the spectrum and of the normal forms. In this thesis spatial diffusion has been incorporated in the delayed neural field equation. A bifurcation analysis on known examples is carried forward and the influence of the diffusion coefficient on both the spectrum and the normal form coefficients are analysed."
De Roode Duivel en Uilenspiegel,"['Aalders, E.']","['van Veen, A.']",2017-02-28T18:18:27Z,nl,"['satire, Roode Duivel, Uilenspiegel']",Geschiedenis,"Het maatschappelijke engagement groeide in de negentiende eeuw enorm. Er ontstonden politieke partijen en het verenigingsleven bloeide. De constitutionele monarchie en de maatschappelijke betrokkenheid van burgers zorgde voor een klimaat waarin satirische bladen konden gedijen. Het socialistische De Roode Duivel (1892-1897) en liberale Uilenspiegel (1870-1916) waren twee succesvolle satirische weekbladen. De twee periodieken bieden een uniek inzicht in de satire ten aanzien van socialisten, vrouwen, en volksverheffers aan het einde van de negentiende eeuw. Ondanks de verschillende politieke achtergronden van de bladen waren er niet alleen verschillen maar ook overeenkomsten tussen de wijze waarop de drie groeperingen werden bespot."
"Drugs, geweld en corruptie in het abnormale Mexico: Een retorische analyse naar de representatie van de Mexicaanse cultuur in de aflevering ‘Mexico’ van Spuiten en Slikken op Reis","['Doop, E. den']","['Meuzelaar, A.']",2017-03-22T18:02:00Z,nl,"['Spuiten en Slikken op Reis, Mexico, representatie, stereotypering, the other, Stuart Hall, retorische analyse, Bill Nichols']",Communicatie- en informatiewetenschappen,"In dit onderzoek is er door middel van een retorische analyse gekeken naar de representatie van de Mexicaanse cultuur in de aflevering ‘Mexico’ van Spuiten en Slikken op Reis. Hiervoor is eerst een breder kader geschetst over de representatie van andere culturen in het algemeen aan de hand van theorie van cultuurtheoreticus Stuart Hall. Ook is aan de hand van theorie van filmtheoreticus Bill Nichols uitgelegd hoe een filmmaker door middel van retorische middelen de kijker kan overtuigen van een perspectief op een onderwerp. De categorieën arrangement, style en invention uit Nichols’ theorie zijn vervolgens geoperationaliseerd om de aflevering ‘Mexico’ te kunnen analyseren. Uit deze analyse blijkt dat de Mexicaanse cultuur als the other wordt gerepresenteerd en dat daarbij de Mexicanen worden gestereotypeerd als gewelddadig, corrupt en betrokken bij de drugswereld. Doordat de narratieve structuur en de stilistische elementen inspelen op ethos, pathos en logos, wordt de kijker overtuigd van deze representatie over de Mexicaanse cultuur. Deze representatie sluit aan bij bestaande representaties over Mexico die blijken uit eerder onderzoek. De aflevering van Spuiten en Slikken op Reis draagt dus bij aan bestaande stereotypes over de Mexicaanse cultuur, waardoor het programma deze bevestigd en daardoor versterkt. Een beperking van dit onderzoek, is dat niet de gehele aflevering is besproken in de analyse en dat er daardoor wellicht een vertekend beeld kan zijn ontstaan van de aflevering. Vervolgonderzoek zou meerdere afleveringen van Spuiten en Slikken op Reis kunnen analyseren, om zo uitspraken te kunnen doen over het programma in het algemeen."
Een Nieuwe Strategie: De VS en de Noord-Koreaanse Nucleaire Crisis 1993-1994,"['Kursten, J.A.']","['Hellendoorn, E.A.A.']",2017-03-21T18:02:15Z,nl,"['Noord-Korea, Zuid-Korea, Korea, VS, non-proliferatie, kernwapens, Agreed Framework, nucleair, Clinton, IAEA, NPT']",Geschiedenis,"Het onderwerp van dit paper is de Noord-Koreaanse nucleaire crisis en de beëindiging van deze crisis door de totstandkoming van het Agreed Framework in 1994. De periodisering van het paper behelst de periode van maart 1993 tot oktober 1994. De crisis begon namelijk in maart 1993, omdat Noord-Korea toen aankondigde uit het Non-proliferatieverdrag te stappen. Dit werd uiteindelijk voorkomen in oktober 1994 door het Agreed Framework, een verdrag dat Noord-Korea zou voorzien van lichtwaterreactoren en non-nucleaire energie in ruil voor het bevriezen van zijn nucleaire reactoren. Het onderzoek in dit paper concentreert zich op de interne en externe invloeden op dit besluitvormingsproces, respectievelijk de binnenlandse en internationale invloeden. Binnenlandse factoren vormen hierbij de rol van de publieke opinie, de oppositie en discussies binnen de regering. Internationale factoren zijn juist de Aziatische buren van Noord-Korea, namelijk Zuid-Korea, Japan, Rusland en China. De conclusie van het onderzoek is dat voornamelijk de rol van Zuid-Korea doorslaggevend was, door de weerzin in het land tegen een oorlog, hoe klein de kans daarop ook was. Ook speelde het land een centrale rol in de financiering van de lichtwaterreactoren. Desondanks mag niet de rol worden vergeten van de Amerikaanse regering in het streven naar een vreedzame oplossing en de mate waarin president Clinton zijn non-proliferatiebeleid aanpaste aan Noord-Korea. Clinton was bereid de dreiging van sancties te laten vieren om zo Noord-Korea tegemoet te komen, met het optreden van oud-president Carter in de onderhandelingen met Kim Il-Sung als doorbraak."
