title,authors,supervisors,date,language,keywords,program,abstract
Coaching; alleen (de) ervaring telt,"['Hardenbol, N.W.']","['Groothuis, M.']",2018-07-19T17:01:45Z,nl,[],Leraar Voorbereidend Hoger Onderwijs in Maatschappijleer,
Welke vorm van literatuuronderwijs wordt het meest gewaardeerd?,"['Ekhart, R.D.']","['Haenen, J.']",2018-07-19T17:01:44Z,nl,"['literatuuronderwijs, vakoverstijgend']",Leraar Voorbereidend Hoger Onderwijs in Engels,
"One size does not fit all in Africa: a critical examination of explanations for the African growth tragedy through a micro study of resistance, health and education in colonial Nigeria","['Dalrymple-Smith, A.E.']","['Frankema, E.']",2018-07-19T17:01:49Z,en,"['African Growth tragedy, Institutions, Factor Endowments, Ethno Linguistic Fragmentation, Sub Saharan Africa, Micro Studies, African Agency, Colonialism, Nigeria, Development, Health, Education']",U-TEAch,"Recent explanations for the “African growth tragedy” have often relied on cross-country regressions, which can provide one elegantly simple cause at the root of poor long-term economic performance. In recent years the development of particular kinds of institutions, the creation of ethno linguistic fragmentation as a result of colonialism and geography / factor endowments have all been identified as being key to explaining poor growth in Sub Saharan Africa. This study argues that such an approach is flawed, as at a micro level no overarching explanation is sufficient. In addition what most of this research neglects is the crucial importance of African agency on individual countries’ paths of development. This is not to say that such studies are not useful as they do provide avenues of research and theories to test. However this study will ague that contextually specific micro studies, which take local African agency into account are the best approach to understanding long term development. This study focuses on colonial era Nigeria from 1905 to 1932, examining education, health and resistance to British rule and examining long term trends in the post colonial era. It is concluded that in different areas of the country, education and health developed at different speeds and that to explain such differences a variety of factors are needed. In all areas resistance to colonial rule and African agency played a key role in determining the course of development."
Tekenen met potlood of tekenen met Pencil? De invloed van de aanwezigheid van iMacs op de invulling van de lessen tekenen op het KS College in Doetinchem,"['Nagtzaam, M.P.']","['Veldkamp, drs. A.']",2018-07-19T17:01:44Z,nl,"[""iMac's, onderwijs, Apple, tekenen, school, ICT, docenten, mediawijsheid""]",Kunstgeschiedenis: educatie en communicatie,Computers zijn tegenwoordig niet meer uit het onderwijs weg te denken. Het KS College in Doetinchem (fictief) gaat mee met deze ontwikkeling en heeft in schooljaar 2009-2010 iMacs aangeschaft en daarmee de functie van het lokaal A1 veranderd. In hoeverre deze aanschaf van de iMacs van invloed is geweest op de invulling van lessen tekenen is door de studenten Evelien Pothoven en Myrthe Nagtzaam onderzocht. De belangrijkste conclusies uit hun onderzoek zijn gericht op de overeenkomsten en verschillen tussen de verwachtingen en de bevindingen van de docenten. Daarnaast hebben zij de verschillen vóór en na de aanschaf in kaart gebracht.
"A LIFE DECISION: TO CONTINUE IN ENGLISH OR NOT?! 

A CASE STUDY ON REASONS TO SWITCH FROM BILINGUAL TO REGULAR 
SECONDARY EDUCATION IN THE NETHERLANDS","['Verheijen, E.J.E.']","['Kranenburg, F.A.N.']",2018-07-19T17:01:47Z,en,['Bilingual education; switch; semi-structured interviews; study experience; study achievement; motivation'],U-TEAch,"This case study, performed at a bilingual school in the Netherlands, researches 
the main reasons for pupils to decide to switch from the bilingual to the regular 
programme. Carrying out qualitative research, semi-structured interviews were 
conducted, focusing on pupils' background, the educational environment, study 
experiences and study achievements. The twelve interviewed pupils mentioned 
ten different reasons to switch and these were listed according to their frequency. 
By means of two different data analysis methods, three pupil profiles were 
extracted, representing indications of the types of pupils that can possibly decide 
to switch to the regular programme in the future. Switching was associated with 
study experience and study achievement."
Op zoek naar de beste leergang Spaans,"['Knetsch, J.']","['Westermann, Adrienne']",2018-07-19T17:01:45Z,nl,"['Paso Adelante, Gente Joven, Caminos, taalvaardigheden, leergang Spaans']",Spaanse taal en cultuur: educatie en communicatie,"Docenten Spaans hebben hun leergang beoordeeld op lees-, luister-, spreek- en schrijfvaardigheid én grammatica. De volgende drie leergangen worden met name besproken: Paso Adelante, Gente Joven en Caminos."
Op weg naar volwassenheid,"['Mulder, D.P.']","['Evelein, Dr. F.G.']",2018-07-19T17:01:43Z,nl,[],Leraar Voorbereidend Hoger Onderwijs in Muziek,
Kletsen in de klas. Een onderzoek naar referentieniveaus mondelinge taalvaardigheid.,"['Spall, K.G.', 'Perneel, F.D.', 'Beltman, C.F.']","['van de Kraats, R.']",2018-07-19T17:01:51Z,nl,[],Nederlandse taal en cultuur: educatie en communicatie,In 2014 wordt het Referentiekader voor taal en rekenen ingevoerd. De toetsen Nederlands in alle leerjaren moeten voldoen aan de referentieniveaus en zullen waarschijnlijk moeten worden aangepast. Dit is een onderzoek dat gedaan is op drie scholen om te kijken wat de stand vanzaken is omtrent de referentieniveaus mondelinge taalvaardigheid.
Tevredenheid over onderlinge samenwerking van leerlingen in de onderbouw H/V bij wel/niet opsplitsen naar CITO-score,"['Veeken, P.L.R. van der']","['Vermunt, J.D.H.M.']",2018-07-19T17:01:51Z,nl,"['tracking, streaming, splitsen, havo, vwo, tevredenheid, samenwerking, samenwerken']",Leraar Voorbereidend Hoger Onderwijs in Natuurkunde,"De periode waarin H/V leerlingen in één gemengde groep onderwijs volgen is in Nederland verschillend. Sommige scholen verkiezen een langere periode waar andere scholen een vroege splitsing verkiezen. In dit onderzoek is de tevredenheid van leerlingen over de keuze van hun school onderzocht, met de verwachting dat leerlingen tevreden zijn over de keuze die de school heeft gemaakt. De reden hiervoor zou zijn dat de leerlingen zich aanpassen aan het traject waar ze zelf mee te maken krijgen. Uit een enquête (afgenomen onder leerlingen van twee scholen die voor verschillende splitsingsmomenten hebben gekozen) blijkt dat leerlingen inderdaad tevreden zijn over het splitsingsmoment dat hun eigen school gebruikt. Antwoorden uit afgenomen interviews bij docenten van deze scholen ondersteunen grotendeels de bevindingen uit de enquête."
"Wat vind je er zelf van? Een beschrijvend onderzoek naar ervaringen en voorkeuren van jongens en meisjes van mondelinge, klassikale feedback","['Hermans, M.M.']","['Van Vugt, F.']",2018-07-19T17:01:52Z,nl,"['feedback, jongens, meisjes, leerlingen, profeed, voortgezet onderwijs']",Leraar Voorbereidend Hoger Onderwijs in Scheikunde,In een beschrijvend onderzoek zijn jongens en meisjes met elkaar vergeleken op basis van hun ervaringen met en voorkeuren voor de feedback die zij van hun vrouwelijke en mannelijke docenten ontvangen. Daarnaast zijn deze ervaringen en voorkeuren vergeleken met geobserveerde lessen. De ervaringen en voorkeuren van leerlingen zijn bevraagd via een interview. Door de verschillen tussen jongens en meisjes en binnen beide groepen zijn er weinig significante overeenkomsten tussen ervaringen en voorkeuren van leerlingen gevonden. Enkele ervaringen en voorkeuren bleken wel enige overeenkomst te vertonen met de geobserveerde lessituaties. Kritische kanttekeningen bij de interviews en observaties worden gegeven voor vervolgonderzoek.
"Smart Students, Poor Grades: Factors contributing to lower grades in the transition from first to second year bilingual secondary school","['Postma, M.T.J.']","['Fonville, J.J.']",2018-07-19T17:01:53Z,en,"['bilingual education, drop in performance, expectations, motivation, underestimation, study skills, gifted students']",Leraar VHO Geschiedenis en Staatsinrichting,"This research looked into the factors that cause a drop in performance in second year bilingual students . The combined factors of higher expectations of teachers, student motivation, underestimation of the second year and a lack of study skills play a role.
Recommendations were formulated that might be useful for other schools that deal with gifted students as well: increase the difficulty of the first year to make the transition to the second year more gradual, give the students the opportunity to compensate poor grades before the first report card, and train students’ study skills during the first year to better prepare them for the second year."
Eager To Exchange? Teachers and their motivation for international exchanges in Dutch secondary education.,"['Batenburg, J.W.F. van']","['Kranenburg, F.A.N.']",2018-07-19T17:01:50Z,en,"['international exchanges, internationalization, secondary education, motivation']",Geschiedenis: educatie en communicatie,"International exchanges between schools are an essential part of the growing internationalization of secondary education in the Netherlands. Despite political and scientific encouragements, the number of international exchanges within secondary education remains relatively low. How can this discrepancy between educational ideals and  reality be explained? Prior research indicates that teachers are the main actors in the organization and execution of international exchanges. This study sets out to investigate the motivation of teachers who do partake in this specific form of education. Six interviews provide a starting point from which the tasks, goals and concerns of teachers involved in international exchanges are analyzed. The conclusions that derive from this analysis lead to suggestions for further research and practical recommendations on international exchanges. Examining the role of the teacher could in turn generate new insight in how the number of international exchanges within Dutch secondary education can be stimulated."
HET EFFECT VAN ACTUALISERING: puur vermaak of een toegevoegde waarde voor het lezen van historische literatuur?,"['Norbruis, L.F.', 'Brussen, J.']","['Mantingh, E.']",2018-07-19T17:01:54Z,nl,"['Nederlands, literatuur, historische literatuur, Ware Bataven, actualisering, literatuuronderwijs, het schoolvak Nederlands']",Leraar Voorbereidend Hoger Onderwijs in Nederlands,
Giving Corrective Oral Feedback in a Bilingual Context - In what ways can oral corrective feedback on language mistakes be made more effective within the lessons of the bilingual education department?,"['Joore, M.G.']","['Koopman, G.J.']",2018-07-19T17:01:54Z,en,[],U-TEAch,
Peutervoetbal: De beleving van ouders op de ontwikkeling van hun kind nader bekeken,"['Brummel, I.L.', 'Feltz, J.E. van der', 'Haan, H.H. de', 'Tintelen, E. van']","['Smits, D.W.']",2018-07-19T17:02:16Z,nl,['Peutervoetbal ; cognitieve ontwikkeling ; sociale ontwikkeling ; emotionele ontwikkeling ; motorische ontwikkeling ; beleving ouders'],Pedagogische Wetenschappen,"INLEIDING Fysiek actief zijn op jonge leeftijd wordt steeds actueler. Over de effecten en de wenselijkheid
van sporten op jonge leeftijd is weinig bekend. Het doel van dit onderzoek was inzicht geven in de beleving van
ouders over de bijdrage van sporten in groepsverband op de ontwikkeling van hun jonge kind. De vraagstelling van
het onderzoek was: Wat is het verschil in beleving van de ouder(s), betreffende de bijdrage van deelname van hun
kind aan peutervoetbal op zijn of haar cognitieve, emotionele, sociale en motorische ontwikkeling, gekeken
naar het geslacht van de ouder, de periode van deelname van het kind, het wel of niet naar de crèche
gaan en het aantal kinderen binnen het gezin? METHODE Respondenten betroffen ouders van kinderen
die aangesloten zijn bij Stichting Peutervoetbal Nederland. Onderzoek is verricht middels een digitale
enquête (n=27). Data-analyse is uitgevoerd met de 1) één-weg variantie analyse (ANOVA), 2) Chikwadraattoets,
3) Mann-Whitney U-toets, 4) t-toets voor onafhankelijke steekproeven, en 5) Kruskall Wallis-toets.
RESULTATEN Op alle onderzochte ontwikkelingsdomeinen is geen statistisch significant
verschil gevonden. CONCLUSIE EN DISCUSSIE Er is geen verschil gevonden in de beleving van ouders
betreffende de bijdrage van deelname van hun kind aan peutervoetbal op de ontwikkelingsdomeinen, gekeken
naar het geslacht van de ouder, de periode van deelname van het kind, het wel of niet naar de crèche
gaan en het aantal kinderen binnen het gezin. De gestelde hypothesen kunnen niet worden aangenomen.
Voor vervolgonderzoek wordt aangeraden een grootschaliger onderzoek op te zetten voor vergroting
van respons met wellicht een passendere methode."
De Gamification van E-Learning: een Groter Leereffect door Motivatie en Engagement.,"['Rijkes, S.']","['Leeuwen, van, A.', 'Hulshof, C.D.']",2018-07-19T17:02:16Z,nl,['Gamification; Serious Games; Learning effectiveness; Leereffect; Game-elements; Game-attributes; Gamified e-learning; Motivation; Motivatie; Engagement; Betrokkenheid; Game-elementen; Educational games; e-learning'],Educational Sciences: Learning in Interaction,"Veel organisaties en universiteiten hebben te kampen met hoge drop-out cijfers in e-learning 
cursussen. Gamification, het toepassen van game-elementen op iets wat geen game is, lijkt een goede 
oplossing te zijn voor dit probleem. Door het toevoegen van game-elementen aan een e-learning 
cursus zouden lerenden net zo gemotiveerd en geëngageerd moeten worden als de spelers van de 
games waaruit deze game-elementen zijn geleend. Maar is dit echt zo eenvoudig? Veroorzaken deze
game-elementen daadwerkelijk de motivatie en het engagement van de spelers? Resulteert deze 
motivatie en dit engagement in een educatieve omgeving dan ook in een groter leereffect? 

Uit dit literatuuronderzoek naar het leereffect, de motivatie en het engagement dat game-elementen teweeg zouden kunnen brengen, blijkt dat er bewijs kan worden gevonden dat bepaalde 
game-elementen een mogelijke verhoging in het engagement en de motivatie kunnen veroorzaken. 
Doordat deze resultaten veelal gevonden zijn in de context van een serious game, is het belangrijk dat 
er meer onderzoek gedaan wordt naar het mogelijke effect van bepaalde game -elementen op de 
motivatie, het engagement en de leeruitkomst in andere contexten."
"The effect of abnormal attachment, alexithymia, and trauma on the relation between medically unexplained symptoms and negative affect in tertiary care psychosomatic patients","['Schöls, C.P.']","['Houtveen, J.']",2018-07-19T17:02:15Z,en,"['Psychosomatische klachten, Alexithymie, Hechting, Trauma, Medisch onverklaarde klachten.']",Klinische en Gezondheidspsychologie,"Doel: In dit onderzoek is gekeken naar het effect van alexithymie, onveilige hechting en trauma op de relatie van medische onverklaarde klachten (MUS) en negatief affect (NA). Er is een algemene consensus in de literatuur dat er een positief verband bestaat tussen MUS en NA. Alexithymie, onveilige hechting en trauma worden frequent gerapporteerd door patiënten met psychosomatische klachten. Daarnaast is het gesuggereerd dat alexithymie, onveilige hechting en trauma invloed kunnen hebben op MUS en NA. Voor dit onderzoek zijn de volgende hypothesen opgesteld: (1) MUS en NA zijn positief gecorreleerd, (2) alexithymie en onveilige hechting hebben een negatieve invloed op de relatie van MUS en NA en (3) 
trauma zal de relatie tussen MUS en NA versterken. Methoden: 338 derdelijns psychosomatische patiënten hebben zelfrapportagevragenlijsten ingevuld voor somatische klachten, symptomen van angst en depressie, alexithymie, onveilige hechting en trauma. Vervolgens werden ze onderverdeeld in subgroepen voor hoge en lage scores. Daarnaast werden er twee subgroepen gemaakt voor patiënten die voldeden aan de criteria van type I of type II alexithymie. Resultaten: Correlatieanalyses toonden aan dat MUS en NA positief zijn gecorreleerd, dat deze relatie voor hoge scores op onveilige hechting zwakker is en voor hoge scores op trauma en bij patiënten met type II alexithymie zelfs non-significant bleek. Daarnaast bleken de interactie effecten van type II alexithymie en hoge scores op onveilige hechting en trauma met NA significante negatieve voorspellers van MUS. Conclusie: MUS en NA zijn positief gecorreleerd voor de meest zware patiëntgroep. Daarnaast beïnvloeden type II alexithymie, onveilige hechting en trauma deze relatie. Er zijn daarmee modererende effecten, maar geen mediërende effecten gevonden."
Het zijn net Nederlanders; Een onderzoek naar de identiteit van de tweede generatie Nederlanders met een Marokkaanse achtergrond,"['Lorwa, L.']","['Scholtens, Rutger-Jan']",2018-07-19T17:02:17Z,nl,['Antropologie; Multiculturalisme; Marokkaanse-Nederlanders; Etnische Categorisering; Identiteit en identificatie; Integratie'],Multiculturalisme in vergelijkend perspectief,"Door het categorale denken, en de prominente rol die cultuur hierin krijgt, worden Nederlanders met een Marokkaanse achtergrond nog steeds gezien als anders, als on-Nederlands, waardoor vooroordelen en stereotyperingen over Nederlanders met een Marokkaanse achtergrond gehandhaafd blijven, en sociaal-maatschappelijke problemen worden toegeschreven aan culturele oorzaken en er geen oog is voor bijvoorbeeld social-economische oorzaken.
Hoe hard Nederlanders met een Marokkaanse achtergrond ook werken, hoe ‘verkaast’ ze ook zijn, zolang cultuur de verklarende factor wordt om de Nederlandse samenleving mee in te delen, zullen we nooit bij een gedeeld Nederlands burgerschap kunnen komen, wat nodig is om een daadwerkelijke culturele vrijheid, een vrijheid van zijn wie je bent en wie je wilt zijn, te kunnen bereiken."
Etnische verschillen in ouderbetrokkenheid,"['Haas, A.H.Y. de']","['Fleischmann, Fenella', 'Coenders, Marcel']",2018-07-19T17:02:21Z,nl,['Ouderbetrokkenheid; ouderparticipatie; etnische verschillen.'],Multiculturalisme in vergelijkend perspectief,"In deze thesis wordt onderzocht of er verschillen zijn in de mate van ouderbetrokkenheid tussen etnische groepen en tussen vaders en moeders en welke verklaringen hiervoor te vinden zijn. Er wordt onderscheid gemaakt tussen verschillende dimensies van ouderbetrokkenheid, dit zijn: overkoepelende ouderbetrokkenheid, ouderbetrokkenheid thuis, ouderparticipatie met lage kosten en ouderparticipatie hoge kosten. Deze genoemde kosten betreffen de tijd en moeite die door de ouder geïnvesteerd moeten worden. 
Er blijken verschillen te zijn in de mate van ouderbetrokkenheid tussen respondenten van Turkse en Marokkaanse herkomst ten opzichte van respondenten van Nederlandse herkomst. Turkse en Marokkaanse respondenten blijken minder betrokken te zijn bij de scholing van hun kind. De verklaringen voor deze etnische verschillen in ouderbetrokkenheid verschillen per dimensie van ouderbetrokkenheid. Voor de overkoepelende variabele van ouderbetrokkenheid geldt dat de verschillen tussen respondenten van Marokkaanse herkomst en respondenten van Nederlandse herkomst weg  zijn zodra er gecorrigeerd wordt voor opleidingsniveau, doeltreffendheid en taalvaardigheid. Ook een correctie voor de opvoedingsdoelen zorgt ervoor dat er geen verschillen meer zijn. Voor respondenten van Turkse herkomst geldt dat zodra er gecorrigeerd wordt voor opleidingsniveau, doeltreffendheid en taalvaardigheid zij significant meer betrokken blijken te zijn dan autochtone Nederlanders. Er zijn geen verschillen meer tussen respondenten van Turkse en Marokkaanse herkomst op de dimensie ouderbetrokkenheid thuis zodra er gecorrigeerd wordt voor opleidingsniveau, doeltreffendheid en taalvaardigheid. De dimensie ouderparticipatie met lage kosten laat geen verschil zien tussen etnische groepen, echter wanneer er gecorrigeerd wordt voor taalvaardigheid dan blijkt dat respondenten van Turkse en Marokkaanse herkomst een hogere mate van ouderbetrokkenheid hebben in vergelijking tot respondenten van Nederlandse herkomst. Voor de dimensie ouderbetrokkenheid met hoge kosten zijn er geen verschillen meer tussen etnische groepen zodra er gecorrigeerd wordt voor opleidingsniveau en doeltreffendheid. 
Verder blijkt uit dit onderzoek dat vaders minder betrokken zijn dan moeders. Geen van de in dit onderzoek meegenomen stimulerende en belemmerende factoren voor ouderbetrokkenheid kunnen dit verschil verklaren."
Grote Verwachtingen: De Rol van Ouderlijke Aspiraties in de Relatie tussen Cijfers en Verandering in Gedragsmatige en Emotionele Schoolbetrokkenheid,"['Dijken, S.R. van']","['Poorthuis, A.', 'Beek, Y. van']",2018-07-19T17:02:21Z,nl,"['Ouderlijke aspiraties, ouderlijke verwachtingen, cijfers, schoolbetrokkenheid']",Development and Socialization in Childhood and Adolescence,"In een longitudinaal onderzoek naar de rol van ouderlijke aspiraties in de relatie tussen cijfers en verandering in schoolbetrokkenheid werden 201 leerlingen gedurende hun eerste schooljaar op het voortgezet onderwijs gevolgd. Aan het begin van de studie waren zij tussen de 11.7 en 14.1 jaar oud (M=12.6, SD=0.4). De emotionele en gedragsmatige schoolbetrokkenheid werden in september en maart gemeten, verder werden rapportcijfers verkregen van de scholen en de ouderlijke aspiratie, gemeten als het cijfer waarmee de ouder tevreden zou zijn. Ook blijken rapportcijfers een afname in emotionele schoolbetrokkenheid te voorspellen, Cohen’s d=.30. Dit effect werd niet gevonden voor gedragsmatige schoolbetrokkenheid. Het onderzoek geeft geen ondersteuning voor een mogelijke rol van ouderlijke aspiraties in de relatie tussen cijfers en verandering in schoolbetrokkenheid."
Gemotiveerd of niet: De effecten op de ervaring van self-agency bij een doel en een prime.,"['Duijzers, G.I.C.']","['Weiden, A. van der']",2018-07-19T17:02:15Z,nl,['self-agency; motivatie; doel; prime; congruente uitkomst; incongruente uitkomst.'],Social and Health Psychology,"Het toeschrijven van een actie aan jezelf (self-agency) is fundamenteel in sociale communicatie. Onderzoek heeft aangetoond dat zowel primes als doelen agency op sociaal toegankelijke manier teweeg brengen. Deze gevoelens van self-agency zijn gebaseerd op een congruentie tussen de geactiveerde uitkomst en de werkelijke uitkomst. Wij denken echter dat er verschillende mechanismes zijn op de ervaring van self-agency bij een doel en prime. Om dit te onderzoeken hebben we congruentie gemanipuleerd. Een uitkomst kon ofwel congruent als incongruent zijn met het doel of de prime. Na elke uitkomst werd de ervaring van self-agency gemeten. De resultaten lieten een verhoging van de ervaring van self-agency zien bij een congruente uitkomst, zowel bij een doel als een prime. Daarnaast is er een significant verschil gevonden tussen de self-agency metingen van een incongruente uitkomst met het doel en een incongruente uitkomst met de prime. Dit toont aan dat er verschillende mechanismes zijn die een rol spelen op de ervaring van self-agency."
"The influence of early life stress and the 5-HTTLPR
polymorphism on stress responsiveness:
a gene x environment approach","['Sollie, A.C.']","['Bossema, E.R.', 'Doornen, L.J.P. van']",2018-07-19T17:02:18Z,en,"['stress, 5-HTTLPR, gene, environment, early life stress, ELS']",Klinische en Gezondheidspsychologie,"The current study focuses on nature x nurture interactions on individual differences in stress
responsiveness. Stress plays a role in many psychological disorders giving rise to the need to map environmental and genetic factors contributing to individual differences in stress responsiveness. The effects of both early life stress, an environmental factor, and the 5HTTLPR
polymorphism, a genetic factor, on psychological and physiological stress responsiveness were examined using the TSST-G to induce stress. Although no main effects
for any of the variables were found, the results support a possible inverse relation between early life stress and a psychological stress measure. It further shows evidence of possible differences in this relationship between S- and non-S-carriers of the 5-HTTLPR polymorphism."
