title,authors,supervisors,date,language,keywords,program,abstract
Variation and change in Early Modern Dutch: Negation in Letters as Loot,"['Remijnse, L.']","['Van Koppen, J.M.']",2019-10-01T17:00:37Z,en,"['historical linguistics, syntax, sociolinguistics, Early Modern Dutch, negation,']",Linguistics,"In Early Modern Dutch, variation within writers is found between negative concord and single negation. This intermediate phase between negative concord and single negation is affected by both bottom-up change (the negative clitic started to erode due to functional redundancy) and top-down change (elite writers dropped the negative clitic completely). In literature, the frequency of the negative clitic has been described, pointing to an increase of the clitic in southern regions and in lower social classes. However, the theory of Jespersen’s cycle and finer mechanisms of generative syntax have not been involved in these studies. In the current corpus study, 17th century letters from people across regions and social classes were analyzed with respect the variation in negation, involving Jespersen’s cycle and notions from generative syntax. In particular, it was explored what types of grammars are shown between the varieties displayed by the writers of these letters. From a qualitative analysis of the data, it was found that many co-occuring varieties display different phases of Jespersen’s cycle in synchronic fashion: while some varieties display a conservative grammar exhibiting consistent negative concord (phase II), others display a progressive grammar containing consistent single negation (phase III). Furthermore, a dominant portion of the letters display a grammar with variation between negative concord and single variation. These findings contradict the assumed nature of Jespersen’s cycle, which portrays the phases of development in subsequent fashion. With respect to the syntactic features of the negative clitic – polarity features projecting PolP – four different derivational systems are found in at least one variety: (i) a high PolP as part of an extended CP, which indicates the C-parameter; (ii) a low PolP that attracts the finite verb to T, which results in V1 position in verb clusters; (iii) both high PolP and low PolP; and (iv) no PolP. Many letters with single negation show high PolP. From this observation I conclude that, although the negative clitic has been deleted in these varieties, its polarity features remain present. Hence the parametric hierarchy of the extended CP is not affected. Some of the varieties with single negation show evidence in favor of low PolP: the finite verb is attracted to V1 position of its verb clause in polarity-related sentences. This means that the negative clitic must have been present during the derivation, base-generated in low PolP and attracting the finite verb to T but was deleted artificially at surface structure. The result is then a dual grammar exhibiting progressive single negation at surface structure, but conservative negative concord at deep structure. This might have been an effect of the external upper-class prescription to drop the negative clitic on the one hand, and internal natural development on the other hand. A portion of the grammars with single negation exhibited total loss of the C-features. This is considered the most progressive grammar, showing Jespersen’s phase III at both surface structure and deep structure. With respect to the varieties showing variation between single negation and negative concord, it has been explored what factors drove the language user to insert the negative clitic. In literature, the negative clitic is assumed to express emphatic meaning: it emphasizes negative contrast or stress on the importance of the subject matter. For West-Flemish, the clitic has been proposed to emphasize the unexpectedness of the negation of a presupposition. In my dataset, I found the clitic to convey the latter function in all letters showing variation. A subset of these letters also showed the more general function of emphasizing negative stress. This extended emphatic function is captured in high PolP. I propose that, during language development, high PolP became available for the clitic to move to convey this emphatic meaning. Since this function is less specific, it also supports the assumed motive for the eventual loss of the negative clitic: functional redundancy. It follows that high PolP as part of the extended CP eventually loses ground. In the final step of this research, I applied the sociolinguistic variables of class (high/low) and region (Noord-Holland/Zeeland) to the letters. The most conservative variety, containing consistent negative concord, only appear in the low class of Zeeland, while the most progressive variety, containing consistent deletion of both the negative clitic and its polarity-related C-features, only appears in Noord-Holland. Since the prescribed grammar with single negation originated in the high class of Noord-Holland, it comes as no surprise that the most conservative grammar is found in southern regions and that the most progressive grammar is found in Noord-Holland. My data-analysis shows that in some varieties, the deletion of the negative clitic is merely a surface deletion, while in other varieties, which all happen to occur in Noord-Holland, both the clitic and its features are deleted."
Mother and Child are Doing Fine,"['Meulen, B.D. van der']","['Smiet, Katrine']",2019-10-01T17:00:37Z,en,['parenting; gender; fatherhood; maternal gatekeeping'],Gender Studies,"Research shows that while 96,7% of fathers believe that being involved in childcare is
important, only one-third of their surroundings and health care professionals believe the same
(Sardes, 2017). Other case studies (Reed, 2011) (Sicouri et al., 2018) (Early, 2001) also show
that the attitude of health professionals and certain workplace norms prohibit men from
involvement in pregnancy care and the care of their baby. In this thesis I research how fathers
deal with this discrepancy. I answer the question: “How do paternal caregivers navigate
between gendered expectations of parenthood and their own interpretations of fatherhood?”
The gendered expectations that are studied, follow from educational content on pregnancy and
infant care, the approach of health care professionals and institutions such as the workplace.
This is studied through semi-structured, in-depth interviews with six fathers and a thematic
analysis of three parenting books. The results show that fathers feel that they are portrayed in
parenting books as the incapable and jolly parent who does not really care for parenthood. In
the obstetrician’s office they feel predominantly taken seriously but they are still not fully
included, which often pushes them into a subordinate position. Dutch parental leave policies
limit new fathers both directly and indirectly in their process of becoming the father they aim
to be, but still try to actively resist the workplace norms by taking more time of than is expected
of them. These social and institutional barriers should be critically examined by professionals
and institutions that work with fathers in order to transgress the normative ways of caring and
parenting."
WHAT IF SOMEONE STARTS TO SOB? On the role emotions in Moral Case Deliberation and the role of the facilitator regarding emotions,"['Gabriëls, T.P.']","['Stolper, M.', 'van den Hoven, M.']",2019-10-01T17:00:39Z,en,['Moral Case Delibration; facilitating MCD; ethical decision making; emotions'],Applied Ethics,"MCD allows for a conversation between professionals, facilitated by a facilitator, about a moral question that professional struggle with in their practice. In this thesis I explore the question to what extent the value of emotions in Moral Case Deliberation (MCD) is determined by the way facilitators act towards those emotions. The research conducted was a qualitative research with semi-structured interviews as primary method of data-collection, in the spirit of action research. In the theoretical framework of this thesis I delved into both emotions and the role of the facilitator, in separate chapters. I found that the way facilitators (decide to) respond to emotions in their MCDs does seem to affect the degree to which emotions are (considered) of value in MCD. There are indications that both their outlook on the value of emotions and their ability to handle emotions in MCD, are determining factors in the degree to which emotions are functional (or: not dysfunctional) in the MCD. This indicates that it could be interesting to give dealing with emotions a more prominent place in both the role of the facilitator, and in the training for aspiring facilitators."
De representatie van de Indische bevolking in Indisch-Nederlandse kinderliteratuur,"['Garritsen, N.E.']","['Koch, J.']",2019-10-01T17:00:39Z,nl,"['Indische kinderliteratuur, postkolonialisme, gender, Nederlands-Indië']",Cultuurgeschiedenis van modern Europa,"In dit onderzoek is gekeken naar de representatie van de Indische bevolking in Indisch-Nederlandse kinderliteratuur (1880-1942). Hierbij is gebruik gemaakt van de hermeneutische traditie en theorieën uit de postcolonial- en genderstudies. Deze kinderboeken laten zien hoe een groot deel van de westerse bevolking dacht over de koloniale verhoudingen in Nederlands-Indië. Dit onderzoek laat zien dat er een sterk westers superioriteitsbesef was. De Nederlander wordt op een zeer beschaafde en positieve manier afgebeeld tegenover de koloniale other. De manier waarop de other wordt afgebeeld, is zeer ambivalent. In dit onderzoek komt naar voren dat de koloniale macht in Nederlands-Indië in geen van de kinderboeken ter discussie wordt gesteld."
"""Zij horen hier!"" Analyse van het discours over het kinderpardon bij de late-night talkshow van de Nederlandse Publieke Omroep","['Wasser, E.M.H.']","['Besamusca, Emmeline']",2019-10-01T17:00:38Z,nl,[],Interculturele communicatie,
Ideaal wonen: voor iedereen weggelegd?! Een onderzoek naar de invloed van mobiliteitsvoorkeuren en persoonsfactoren op het realiseren van het ideale woonmilieu voor inwoners van Provincie Zuid-Holland,"['Linden, E.J.I. van der']","['Visser, K.']",2019-10-23T17:00:32Z,nl,['Mobiliteitsgedrag; Woonmilieuvoorkeuren; Persoonsfactoren; Zuid-Holland'],Human Geography,"Zuid-Holland is, net als andere provincies, steeds verder aan het verstedelijken. Om aan de woningvraag te voldoen gaan gemeenten, de Provincie en de overheid de uitdaging aan en ontwikkelen in bestaande of compleet nieuwe woonomgevingen. Anderzijds is er een tendens gaande die steeds meer op het openbaar vervoer en minder op het gebruik van de auto gericht is. Deze combinatie doet de vraag rijzen hoe er woonomgevingen kunnen worden gerealiseerd die voldoen aan de wensen van de inwoners zelf en toegespitst zijn op mobiliteitsvoorkeuren die per woonomgeving verschillen. Dit onderzoek richtte zich op het vraagstuk hoe deze uitdagingen succesvol kunnen worden volbracht vanuit het perspectief van de inwoners van Zuid-Holland. Met het oog op de woonmilieuvoorkeuren van de inwoners, hun persoonsfactoren en mobiliteitsvoorkeuren, was de hoofdvraag van dit onderzoek: 

In hoeverre hangt het realiseren van het ideale woonmilieu voor inwoners van Zuid-Holland samen met persoonsfactoren en mobiliteitsvoorkeuren en hoe kunnen huidige en voorkeurswoonmilieus beter op elkaar worden afgestemd?
Deze hoofdvraag is beantwoord door middel van een aantal deelvragen:
-	In welk soort woonmilieu willen Zuid-Hollanders volgens de Grote Omgevingstest 2018 wonen en in hoeverre wonen deze respondenten in hun ideale woonmilieu? 
-	Hoe wordt het realiseren van het ideale woonmilieu voor Zuid-Hollanders beïnvloed door persoonsfactoren?
-	Hoe wordt het realiseren van het ideale woonmilieu voor Zuid-Hollanders beïnvloed door hun mobiliteitsvoorkeuren?
Dit onderzoek begint met de introductie en eindigt met de conclusie (hoofdstuk 4). Verder bestaat dit onderzoek uit een theoretisch hoofdstuk dat het onderwerp binnen de bestaande wetenschappelijke kennis plaatst, een methodenhoofdstuk dat de manier van onderzoeken toelicht en verantwoordt en een empirisch hoofdstuk dat de onderzoeksresultaten bespreekt. Het onderzoek is uitgevoerd met gebruik van de data van De Grote  Omgevingstest 2018, met 48.399 respondenten die ieder een huishouden uit Zuid-Holland vertegenwoordigen. 

Theoretische concepten 
Woonmilieus worden door Grünfeld (1988) gedefiniëerd als ‘de omgevingskwaliteit van een afgebakend ruimtelijk gebied dat door bewoners regelmatig gebruikt en relevant wordt geacht voor hun activiteiten en communicaties, waar zij bovendien een bepaalde eenduidigheid aan toe kennen.’ De afbakening van dit ruimtelijke gebied is niet per se gelijk aan die van een wijk of buurt. In zowel De Grote Omgevingstest 2018 als in de wetenschappelijke literatuur is er een onderscheid in woonmilieus gebaseerd op stedelijke, suburbane of rurale woonomgevingen. De Grote Omgevingstest 2018 heeft deze driedeling in een negendeling opgesplitst, met binnenstad, levendig, rustig en luxe stedelijk als stedelijke woonmilieus, een woonwijk met laagbouw, woonwijk met laag- en hoogbouw en een luxe woonwijk als suburbane woonmilieus en een dorps en een landelijk woonmilieu als rurale woonmilieus. Het model van Hooimeijer en Mulder (1999) bespreekt factoren die tot verhuisgedrag leiden en gaan over kansen, mogelijkheden en voorkeuren en triggers enerzijds en beperkingen en restricties anderzijds. Dit model laat zien hoe een verandering in bijvoorbeeld een huishoudensamenstelling of het krijgen van een andere baan kan leiden tot andere wensen en beperkingen. Ook komt aan bod dat er beperkingen kunnen ontstaan door een conflict tussen woonmilieuvoorkeuren en woonwensen. 
Stedelijke woonomgevingen worden gewaardeerd om een concentratie van voorzieningen, kennis, werkgelegenheid en bereikbaarheid. Ook hebben stedelijke woonmilieus een aantrekkingskracht door het bruisende karakter, dat menselijk kapitaal aantrekt (Feijten, Hooimeijer & Mulder, 2008; Glaeser, 2011). Suburbane woonmilieus zijn kindvriendelijk, ruimer opgezet en hebben woningen met een tuin en een eigen parkeervoorziening (Feijten, Hooimeijer & Mulder, 2008). De rurale woonmilieus staan meer bekend om de rust en ruimte, gezonde lucht en hoogwaardige woningen (Heins, 2002). Rurale woonmilieus zijn gewild, maar een kritische noot hierbij is dat dit ook kan komen door het idyllische beeld van het platteland. Dit zou betekenen dat daadwerkelijk verhuisgedrag naar rurale woonomgevingen achterblijft. Rurale woonomgevingen zijn het moeilijkst te creëren door gebrek aan ruimte. Daarom spreekt Heins (2002) van het ‘pseudo-platteland’. Dit houdt in dat aspecten van rurale woonmilieus worden gerealiseerd aan de randen van de stad. 
De bereikbaarheid van een woonomgeving en de toegankelijkheid van een gebied heeft te maken met mobiliteitsgedrag. Mobiliteitsgedrag verschilt per persoon en per woonomgeving. Een stedelijke voorkeur gaat vaak gepaard met een voorkeur voor het gebruk van openbaar vervoer [OV] en buiten de stad zijn inwoners meer gericht op het gebruik van de auto (Olde-Kater et al., 2015). De ambitie van gemeenten is steeds meer gericht op het aantrekkelijker maken van OV als mobiliteitsvorm om aan ruimtelijke- en duurzaamheidsvraagstukken te voldoen. Daarom worden er nieuwe concepten binnen Smart Mobility geïmplementeerd en wordt getracht het gebruik van deelauto’s en deelfietsen op te schalen (Koopal, 2018). Ruimtelijk vertaalt zich dit in OV-georiënteerd ontwikkelen, wat gebiedsontwikkeling rond bestaande en nieuwe OV-locaties inhoudt. Toch blijkt dat gedragsveranderingen in mobiliteitsvormen in gebieden buiten de stad traag gaan, door gewenningen en overwegingen (Van Wee et al., 2002).  

Uitkomsten en aanbevelingen 
De deelvragen zijn beantwoord door beschrijvende statistiek en logistische regressieanalyses met ‘wel of niet ideaal wonen’ als afhankelijke variabele. Inwoners in woonwijken met laag- en hoogbouw wonen het minst ideaal, evenals inwoners die in de levendige stadswijk wonen. De woonmilieus die populairder zijn, zijn de ruimer opgezette en rustigere woonmilieus. Naast de landelijke woonmilieus zijn de rustige stadswijk en de woonwijk met laagbouw het vaakst als ideaal aangegeven. Dit getuigt van een behoefte aan rustigere woonomgevingen. Dat juist de landelijke woonmilieus als het meest populair uit het onderzoek komen, is verrassend. Zuid-Holland verstedelijkt, in de steden is sprake van een woningtekort en door de groeiende bevolking is een ruim opgezette woonomgeving moeilijker te realiseren dan het verdichten van steden. Zoals in de literatuur naar voren komt, zou het toevoegen van een landelijk woonmilieu alleen kunnen als er sprake is van een ‘pseudo-platteland’. Een andere hernieuwde vorm van landelijk wonen zouden tiny houses kunnen zijn. Deze kunnen worden ontwikkeld nabij een stad, met een hogere dichtheid dan de oorspronkelijke landelijke woonomgeving, maar die toch de ‘rust en ruimte’ uitstraalt waar de vraag naar is. Vervolgonderzoek naar de mogelijkheden en percepties voor tiny houses in Zuid-Holland zou een relevante aanvulling op dit onderzoek zijn. 
De uitkomsten van de analyse op persoonsfactoren laten blijken dat de kans op ideaal wonen wordt vergroot bij een hoger inkomen. Hetzelfde blijkt voor leeftijd: hoe ouder, hoe groter de kans op ideaal wonen is. Van alle huishoudensamenstellingen neemt de kans op ideaal wonen meer toe  voor huishoudens met één- of twee personen zonder kinderen. Het regressiemodel bleek niet erg sterk; dit betekent dat persoonsfactoren niet als enige de grootste invloed hebben op het realiseren van het ideale woonmilieu. 
Het regressiemodel werd sterker toen aan de controlevariabelen de mobiliteitsvariabelen werden toegevoegd. Bepaalde mobiliteitsvoorkeuren vereenvoudigen het realiseren van het ideale woonmilieu. Inwoners met één auto hebben voordeel ten opzichte van anderen, evenals inwoners die voor een OV-bereikbaarheid of een goedkope nieuwbouwwoning kiezen boven een parkeergelegenheid voor hun woning. Hierbij rijst wel de vraag of dit daadwerkelijk mobiliteitsvoorkeuren zijn die dit verschil maken, of dat dit te maken heeft met de haalbaarheid en realiseerbaarheid van woonwensen. Vervolgonderzoek zou daarom een andere manier van dataverzameling kunnen betekenen waarin respondenten waardes toekennen aan fiets-/auto- of OV-gebruik en voorkeuren wat betreft mobiliteit anders worden getoetst. 
Er is een trend in mate van stedelijkheid en auto-afhankelijkheid. Hoe stedelijker het woonmilieu, hoe meer de inwoners gericht zijn op OV-gebruik en hoe minder waarde inwoners hechten aan parkeren en autogebruik. In suburbane woonmilieus blijken de inwoners minder auto-afhankelijk dan verwacht. In de suburbane woonwijken lijkt meer draagvlak te zijn voor OV-georiënteerd ontwikkelen dan verwacht. Vervolgonderzoek naar draagvlak voor OV-georiënteerd ontwikkelen in suburbane gebieden zou bij deze uitkomst relevante aanvullende kennis bieden. De aanname is dat minder auto-georiënteerd bouwen voordelig is, maar naar de kosten en baten van autoluwe gebiedsontwikkelingen is nog weinig onderzoek naar gedaan. 
Dit onderzoek heeft laten blijken dat wonen en mobiliteit steeds integraler moeten worden benaderd. Woonomgevingen hangen samen met mobiliteitsgedrag. Dit houdt in dat mobiliteitsgedrag als belangrijk moet worden beschouwd bij het ontwikkelen van woonomgevingen om te voldoen aan de wensen en het gedrag van de inwoners."
Accelerating an inclusive energy transition in owner-occupied and rental housing: The sustainable governance of Utrecht Overvecht’s existing housing stock,"['Ravestein, A.']","['Wijburg, G.']",2019-10-23T17:00:33Z,en,['energy transition; inclusive; Utrecht Overvecht; sustainability; governance; housing'],Spatial Planning,"Sustainability has become one of the most important global issues that needs to be addressed. In the Paris agreement, 186 nations agreed to stay within 2 degrees Celsius temperature increase. Each nation has to translate this agreement to their own policies and then translate it to concrete changes. The energy transition is one of these policies. This research looked into the feasibility and the governance of an inclusive energy transition in residential housing. It combined sustainability with the complex local context by merging urban and sustainable governance.

The energy transition must be seen as a social transition, rather than a technical/financial one. With millions of households needing to change their energy supply before 2050 many of whom have not sustainability as one of their top priorities. In the end, the technical/financial side of the transition must be arranged correctly if the transition is to be successful and inclusive, and thus cannot be overlooked.

There are two approaches to the energy transition, the social approach with means attaching the transition to something residents desire, so that they are willing to pay for it. Or, the technical/financial approach, wherein the transition is arranged in a way in which it removes the burden of transitioning entirely. These two approaches deal with the social aspect of the transition differently. The interplay of these approaches in different neighbourhoods remains unclear.

In order to make sure that the sustainability is improved, an overarching goal needs to be set. However, in order to make sure that the implementation in the complex local context is feasible, owners of houses need to be involved in the process. This research presents a model wherein both the goal setting, as the local context is implemented by assigning different goals where actors can have an influence in. In the last step, the implementation is based on many actors working together. Resident initiatives may have an important role in this implementation as they may be able to tailor the policy to the local context in which they operate."
MEX AND THE CITY: WOMEN’S PERCEPTIONS OF UNSAFETY IN THE STREETS OF MEXICO CITY,"['Barsukova, D.']","['van Noorloos, Femke']",2019-10-23T17:00:33Z,en_US,"['Mexico City, gender perspective, urban design, coping strategies, gender-based violence, public security crisis']",International Development Studies,"This thesis attempts to contribute to the existing knowledge on gender and urban space. It
looks into the problem of women’s perceptions of urban (un)safety in public spaces and the
ways they address the perceived risk. The work further explores how women’s urban
routines are influenced by the security measures they introduce to feel safer. The case study
of this research is Mexico City, specifically the streets of its Historic Center. Focus on the
outcomes of the coping strategies for women’s urban lifestyle was missing in the previous
studies. Key techniques used were in-depth interviews, surveys, safety audit and
participative walks, as well as collaboration with the local expert community.
Beyond discovering and describing women’s experiences in urban spaces, this work
produces empirical evidence on how their fear is constructed along the lines of gender. The
female citizens of the city tend to introduce limiting and non-sovereign response strategies in
order to decrease their vulnerability. This affects their use of public space and has
implications for their everyday routine, with the perceived state of unsafety decreasing
women’s enjoyment of urban opportunities and engagement in city life. Moreover, zero-sum
urban governance makes the distribution of services and security policy uneven to the
disfavor of some groups of women. This fact is evident in the Historic Center, where street
vendors and the homeless are seen as obstacles to touristification. Finally, employing a
gender perspective, this thesis argues that gender and intersectional issues need to be
considered in the spatial design and urban planning of Mexico City."
