title,authors,supervisors,date,language,keywords,program,abstract
"A two way street.
Empowerment defined through the Perspective of Youth at Uweza Foundation.","['Alajaji, D.A.']","['Schaik, S. van', 'Haan, M. de']",2020-02-20T19:02:01Z,en,['Empowerment; Kibera; Kenya; NGO; Youth;'],"Youth, Education and Society","Empowerment has become a buzzword in the international development community, but has yet to be
universally defined. This research aims to shed light on how participants at a non-governmental organization in
the Kibera district in Nairobi, Kenya define empowerment and what they perceive as its critical elements to be
empowered. In seven focus groups, the definition of empowerment and drawings about empowerment were
discussed among 54 participants. Results show that participants mostly define empowerment as a process of
development, actualisation of goals and not as a process of becoming critical. In the focus group discussions about
the drawings, several aspects of empowerment were discussed, participants mainly highlighted their gains in
resources, connection to the NGO, talent development, community impact, change in occupation and mental
impact. These findings shed new insight to the meaning of empowerment in the Kibera district in Kenya.
Furthermore, it offers a critical view on defining empowerment. This research offers insights from those
experiencing “empowerment”. It can inform researchers, policy makers, and anyone concerned with empowerment
on inclusive ways to understand how to approach development."
Werken aan zelfregulerend leren met School’s Cool,"['Bergen, I. van']","['Damhuis, C.', 'Londen-Barentsen, M. van']",2020-02-20T19:02:02Z,nl,['kansenongelijkheid; onderprestatie; zelfregulerend leren; leerstrategieën; mentorproject'],"Youth, Education and Society",
An Examination of the Extent of English Language Support at Home and in School of Mauritian Primary School Children,"['Zwitserloot, H.']","[""Rood, R. van 't"", 'Schaik, S. van']",2020-02-20T19:02:21Z,en,"['Mauritian primary schools; reading comprehension; (oral) language development; (oral) language support; inequality;\r\nMauritaanse bassischolen, begrijpend lezen; (mondelinge) taalontwikkeling; (mondelinge) taalondersteuning; ongelijkheid']","Youth, Education and Society","Indicators of inequality in reading comprehension of Mauritian primary school children were reason to investigate the extent of children’s language support at home and in school. A mixed-method design was used to do so. Private-aided (n = 5), public (n = 1) and ZEP (n = 1) schools were visited. Data was collected through questionnaires with parents (n = 17), children (n = 286) and teachers (n = 23). Interviews were held with headmasters and headmistresses (n = 5) and MIE students (n = 4). Lastly, classroom observations (n = 8) were held to investigate the amount of time English spoken in school. Language support occurred both at home and in school. The level of language support at home was considered “medium” for parents and children. High-SES parents scored higher on language support than low-SES parents. No differences in language support at home were found between ethnic groups. Language support in school varied from “medium” to “medium/high” for teachers and from “low/medium” to “medium/high” for children. No differences in language support in school were found between teachers at different school types. However, differences were found for children; language support in public schools was higher than in private-aided and ZEP schools. Language support consisted of routine activities (e.g. reading, storytelling), though there was a lack of exposure and English was not sufficiently spoken in school. Future research could focus on extending sample sizes and on the impact of media. Interventions could be developed to increase children’s language support. 

Indicatoren van ongelijkheid in begrijpend lezen bij Mauritaanse basisschoolkinderen waren reden om de omvang van taalondersteuning van kinderen thuis en op school te onderzoeken. Een “mixed-method” ontwerp werd gebruikt om dit te doen. Privé-ondersteunde (n = 5), openbare (n = 1) en ZEP-scholen (n = 1) werden bezocht. Gegevens werden verzameld via vragenlijsten met ouders (n = 17), kinderen (n = 286) en leerkrachten (n = 23). Interviews werden gehouden met schooldirecteuren (n = 5) en MIE-studenten (n = 4). Ook zijn er observaties in de klas (n = 8) gehouden om de hoeveelheid Engels die op school gesproken werd te onderzoeken. Taalondersteuning kwam thuis en op school voor. Taalondersteuning thuis werd als “gemiddeld” beschouwd voor ouders en kinderen. Hoge-SES ouders scoorden hoger op taalondersteuning dan lage-SES ouders. Er werden geen verschillen in taalondersteuning thuis gevonden tussen etnische groepen. Taalondersteuning op school varieerde van “gemiddeld” tot “gemiddeld/hoog” voor leraren en van “laag/gemiddeld” tot “gemiddeld/hoog” voor kinderen. Er werden geen verschillen gevonden in taalondersteuning op school tussen leerkrachten van verschillende schooltypen, maar wel voor kinderen. Voor kinderen was de taalondersteuning op openbare scholen hoger dan in privé-ondersteunde en ZEP-scholen. Taalondersteuning bestond uit routine activiteiten zoals lezen en verhalen vertellen, maar er was gebrek aan blootstelling aan de Engelse taal en er werd onvoldoende Engels gesproken op school. Toekomstig onderzoek kan zich richten op het uitbreiden van de steekproef en op de impact van media. Interventies kunnen ontwikkeld worden om de taalondersteuning van kinderen te vergroten."
Herkennen van emotionele en gedragsproblemen door begeleiders van volwassenen met een lichte verstandelijke beperking en hun behoefte aan bijscholing,"['Alteren, M.I. van']","['Douma, J.', 'Verhoeven, M.']",2020-02-20T19:02:21Z,nl,['emotionele problemen; gedragsproblemen; LVB; herkennen; signaleren; bijscholing'],"Clinical Child, Family and Education Studies","Achtergrond. Emotionele en gedragsproblemen (EGP) komen vaak voor bij mensen met een lichte verstandelijke beperking (LVB), echter weten begeleiders dit niet altijd te herkennen. Herkennen van EGP is belangrijk omdat de begeleider een signalerende rol heeft en hulp in kan schakelen. Het herkennen van EGP vraagt kennis van begeleiders, welke via scholing kan worden vergroot. Huidig onderzoek richt zich op het herkennen van EGP door begeleiders, behoefte aan bijscholing en welke begeleiderskenmerken met beide samenhangen. Methode. Begeleiders (N = 45) van volwassenen met een LVB (N = 78) hebben de Adult Behavior Checklist ingevuld en aangegeven in welke mate zij denken dat er sprake is van EGP. Ook zijn begeleiderskenmerken en de behoefte aan bijscholing bevraagd. Resultaten. Het percentage sensitiviteit (sprake van EGP, herkend door de begeleider) ligt rond de 50%, behalve voor agressief gedrag (18.18%) en regelovertredend gedrag (20.00%). Het percentage specificiteit (geen sprake van EGP, herkend door de begeleider) ligt op 85% of hoger. De meeste begeleiders hebben (in enige mate) behoefte aan (bij)scholing. Hoe jonger de begeleider, hoe meer behoefte aan (bij)scholing. Conclusie. EGP worden niet altijd juist herkend. Wanneer het aankomt op de afwezigheid van EGP kan worden afgegaan op het gevoel van de begeleider, wanneer het aankomt op de aanwezigheid van EGP is meer voorzichtigheid geboden omdat begeleiders dit niet altijd weten te herkennen. De uitkomsten bieden aanknopingspunten voor het inzetten van gerichte en passende scholing en doen van verder onderzoek."
"Beschermende Factoren voor het Vergroten van de Educatieve Veerkracht van Alleenstaande, Minderjarige Vreemdelingen tussen de Zestien en Achttien jaar","['Veer, E. van der']","['Schaik, S. van', 'Londen, M. van']",2020-02-20T19:02:20Z,nl,['URM; educational resilience; protective factors; personal characteristics; support; positive school climate.'],"Youth, Education and Society","Aim: Because protective factors may increase the resilience of unaccompanied refugee minors [URM] and school is an important factor in the well-being of URM, the aim of this study was to provide insight into what, according to URM and professionals, are protecting factors for increasing the educational resilience of URM between sixteen and eighteen years old. Method: Through semi-structured interviews with URM (n=11) and professionals (n=8) is investigated how they think personal characteristics, support systems and positive school climate can be protective factors. Results: URM were committed to school in order to achieve their goals. Professionals thought it would be beneficial for the academic development of URM if URM were dedicated to school within and outside the school. According to professionals and URM, URM feel most supported by teachers, housing counselors and peers. URM and professionals indicated that URM need teachers and housing counselors who listen well, show understanding and work together. In addition, they stated that contact with peers from different cultural backgrounds is good for learning the Dutch language. In the end, discrimination in the school should be prevented and school should be a safe place for students, where teachers are patient and listen to the students. Discussion: To increase the educational resilience of URM, professionals should stimulate the goal orientation, motivation and efforts of URM and encourage URM to find extracurricular activities. Schools should invest time in creating a safe and welcoming environment in the school."
Cultural Sensitivity of the Education Quality Intervention: A Qualitative Study Providing Insight Into Elements Contributing to Cultural Sensitivity of the Edu-q intervention at Primary and Secondary schools (Paramaribo and Saramacca),"['Zijverden, A.S.C. van']","['Baar, P.', 'Vissenberg, C.']",2020-02-20T19:02:20Z,en,['cultural sensitivity; quality assessment tool; PM&E approach; Surinam'],"Youth, Education and Society","The Edu-q intervention has been implemented in Surinam in March 2019. This intervention is developed by Edukans, an international NGO with head quarters in the Netherlands. The intervention makes use of the Edu-q card assessment tool. With this intervention Edukans strives for good quality of education on a global scale, taking a participatory and monitoring evaluation (PM&E) approach. The participatory stakeholders are: inspectors, school leaders, teachers and parents. This qualitative study has provided insight into the elements contributing to cultural sensitivity of the Edu-q intervention in Surinam at primary and secondary schools (Paramaribo and Saramacca). An answer has been formulated on the basis of 21 semi-structured interviews with the stakeholders. It has appeared that the content of the Edu-q card can remain the same, but formulations should be adapted to their culture in order to reach the intended consequences of Edukans. Futhermore, in terms of their approach; hierarchy, socioeconomic status and language, seemed to be the most important elements to take into account in order to achieve cultural sensitivity of the Edu-q intervention."
Evaluating the current status of child participation in community development,"['Trummer, S.M.']","['Weijer-Bergsma, E. van de', 'Mulder, H.']",2020-02-20T19:02:20Z,en,['Child participation; community development; community capitals framework; ladder of participation.'],"Youth, Education and Society","Background: Community development (CD) aims at tackling local issues to improve quality of life and thrives on participation of community members (Phillips & Pittman, 2015). While continuously developing since the 1960’s, the relevance of child participation (CP) for CD has only recently been acknowledged (Stein, 2014). Problem: Existing studies of CP and CD (e.g.Hart, 1997), have not evaluated the relationship of CP to levels of participation and community asset areas. Aim: This thesis evaluates levels of CP present in different community asset areas and identifies related benefits and difficulties. Method: The ladder of participation (LoP) is employed to categorise levels of participation and the community capitals framework (CCF) to categorise asset areas. Data was derived from a systematic literature review and a series of semi-structured interviews with members of a CD-project. Results: In more than one third of cases, CP in CD takes place at non-participative levels. Overall, CP in CD and its specific benefits and difficulties, most frequently relate to human and social capital. The highest levels of participation relate to natural capital. Political capital poses a discrepancy across methods, being the most frequently coded capital in the literature, but not coded at all in the interviews. Adults’ attitudinal barriers towards children pose various difficulties for CP. Discussion: The prevalence of non-participative levels of CP in CD may indicate that these low levels are considered ‘participation’, which may be related to attitudinal barriers of adults."
De invloed van ouderlijke attributies door vaders en moeders op de ontwikkeling van gedragsproblemen bij peuters,"['Batenburg, C. van']","['Wilde, A. de', 'Verhoeven, M.']",2020-02-20T19:02:23Z,nl,"['Parenting attributions, toddlers, behavior problems, child gender, parent gender']","Clinical Child, Family and Education Studies","Background. Until now, few research has been conducted about parental attributions by mothers and fathers and problem behavior in toddlers. Research that has been conducted shows a relationship between the variables among children. For this reason, among others, it is important to investigate this domain among toddlers. Objective: This study examined the association between parenting attributions (devided into child- and parent responsible attributions) and problem behavior in young children. In addition, the difference between fathers and mothers in these relationships is examined. Method: 51 mothers en fathers participated in this study. The parents had at least one child between the ages of 2 and 4 years about whom they completed the questionnaire. Both parents filled out questionnaires concerning parenting attributions and problem behavior of the child. Results: The results of the paired samples t-tests indicate that a higher degree of child- and parent responsible attributions are associated with less behavioral problems in toddlers. After performing the hierarchical regression analysis, it appears that only child responsible attributions by mothers and parent responsible attributions by fathers are significantly related to less behavioral problems in toddlers. Conclusie: Child- and parent responsible attributions by both parents are related to the development of behavioral problems in toddlers. Looking at the difference between fathers and mothers in these relationships, only child-responsible attributions by mothers and parent-responsible attributions by fathers appear to cause less behavioral problems in toddlers. Future research is important to gain more insight into these relationships."
Onbekend maakt Onbemind: de Uitdaging van Interdisciplinaire Informatiedeling in de Preventie van Radicalisering.,"['Swinkels, J.K.L.']","['Schaik, S. van', 'Londen-Barentsen, M. van']",2020-02-20T19:02:19Z,nl,['youth professional; youth domain; prevention radicalization; interdisciplinary cooperation; information sharing'],"Youth, Education and Society","To prevent radicalization among youth, professionals in the youth domain (e.g., child protection officers, youth workers, and police officers) need to share information interdisciplinary. To support them with this, the pilot “Workshops sharing information of possible radicalization” was implemented in seven municipalities and one youth care organization in the Netherlands. The aim of this study was to examine the needs of professionals in order to share information between disciplines as well as to examine the working elements of the pilot. Semi-structured interviews (n=12) and a survey (n=37) were held among participants of the program. The results show that a lack of mutual trust, different views on information sharing practices and insufficient knowledge about radicalization and the legal framework are perceived as bottlenecks to share information. To achieve adequate information sharing, youth professionals are in need of support to increase their knowledge base and skills as well as to deepen their trust in each other. Only with the right knowledge about the problem as well as about each other and with sufficient levels of mutual trust, interdisciplinary information sharing will arise and radicalization can possibly be prevented."
The Influence of Health-Care Professionals' Work Experience in Recognition of ASD: The Moderating Role of the Number of Symptoms Presented,"['Batuusa, S.']","['Burke, D.A.']",2020-02-20T19:02:23Z,en,"['Mental-health problems, ASD, Health-care professionals, symptoms, recognition, work experience']","Clinical Child, Family and Education Studies","Children with Autism Spectrum Disorder (ASD) often see health-care professionals (HCPs) more frequent than typically developing children. However, not all children are recognized timely. Early recognition is important to ensure timely diagnosis, and long-term positive outcomes. The current study aims to examine whether work experience influences HCPs ability to recognize ASD. It will also examine the impact of the amount of information provided about ASD on its recognition. Finally, the interaction between work experience and the number of symptoms provided about ASD will be examined in relation to recognition of ASD. Participants (N=431) evaluated vignettes describing children with ASD. Results show that work experience does not influence the recognition of ASD. However, when many symptoms were presented, recognition of ASD greatly improved. Unexpectedly, this did not hold true for HCPs with little experience. The clinical practice should be aware of delayed and missed recognition in order to benefit from the merits of early interventions.  
Keywords: Mental-health problems, ASD, Health-care professionals, symptoms, recognition, work experience"
I Just Want To Be Happy: the Effect of Cognitive Behavioural Therapy on Adolescents with Depressive Symptoms,"['Maldonado Sevilla, D.']","['Heuvel, M. van den', 'Bodden, D.']",2020-02-20T19:02:54Z,nl,"['Depression, Cognitive behavioural therapy, prevention, negative cognitions']","Clinical Child, Family and Education Studies","Background: Suffering from depressive symptoms, such as negative cognitions, can occur at any age, but the chance increases during adolescence. Cognitive behavioural therapy (CBT) is a form of treatment that is used in preventive interventions for depressive symptoms. Little is known about the effectiveness of specific CBT elements on depressive symptoms. Aim: This study was aimed at examining the effectiveness of four different CBT elements (cognitive restructuring, behavioural activation, relaxation and problem solving skills) on depressive symptoms. Second, it was examined whether a change in negative cognitions mediates the relationship between the elements and depressive symptoms. The sample consisted of 220 Dutch high-school students between 10 and 20 years of age with subclinical depressive symptoms. The current research was part of the longitudinal research by the Trimbos-Instituut. Results: An ANCOVA and a paired sample t-test were conducted to investigate if there was a significant effect of CBT elements on depressive symptoms. The results show that there was no significant relation between CBT and depressive symptoms and that there was no significant decrease in symptoms between the pre- and post-measurement. As no correlations were found between the variables in the model, the mediation analysis could not be executed. Conclusion: According to this study specific CBT elements are not effective in decreasing depressive symptoms. At last it can be concluded that negative cognitions is not a mediator between CBT and depressive symptoms. Further research is suggested since the effectiveness of CBT elements is important for future interventions for adolescents with depressive symptoms."
De relatie tussen ouderlijke attributies en negatieve disciplinering in de peutertijd: Bestaan er verschillen tussen vaders en moeders?,"['Lohuis, M.']","['Verhoeven, M.', 'Heuvel, M. van den']",2020-02-20T19:02:54Z,nl,"['parental attributions, harsh discipline, differences fathers and mothers, toddlers']","Clinical Child, Family and Education Studies","In this study, research has been done into the relationship between parental attributions and harsh discipline in the preschool age and the difference therein between fathers and mothers. For this, 50 parents with a child between 24 and 51 months (M = 35.1, SD = 7.6, 54% jongen ) completed to chard the degree of child-responsible and parent-responsible attributions and harsh discipline. The results show that fathers and mothers do not differ in terms of the extent to which they apply negative discipline. However, a difference has been found regarding parental attributions. Although both mothers and fathers appear to have significantly more child-responsible attributions, it has been found that mothers have significantly more child-responsible attributions than fathers. For mothers, a significant, positive relationship was found between child-responsible attributions and harsh discipline as well as between parent-responsible attributions and harsh discipline. In addition, only child-responsible attributions appear to be an important predictor for harsh discipline. For fathers, no relationships were found between parental attributions and harsh discipline. In conclusion, child-responsible attributions appear to be an important predictive factor for harsh discipline, with differences found between fathers and mothers. This provides starting points for the development of prevention programs."
"Do we love food equally? 
The relationship between identification with an eating culture and hedonic activation in response to palatable food","['Keller, F.C.']","['Evers, C.A.J.M.']",2020-02-20T19:02:55Z,en,[],"Social, Health and Organisational Psychology","Exposure to palatable food leads to hedonic activation (HA). HA creates an impulse to immediate gratification which causes a response conflict that can result in overeating and ultimately in obesity. According to statistics, in The Netherlands ethnic minorities suffer more from being overweight and obese compared to the Dutch population. In these ethnic minorities food has a significant role according to literature. For this reason, in this study they are described as eating cultures. With this role of food in mind, the following hypothesis was formulated: the higher the level of identification with an eating culture, the higher the level of HA in response to palatable food exposure. In order to challenge this hypothesis, the Affect Misattribute Procedure (AMP) was used. The Inclusion of Other in the Self-scale (IOS) was used to measure the level of identification with an eating culture. It was found that there was no relationship between the level of identification with eating cultures and HA in response to exposure to palatable food. Potential limitations and methodological issues are discussed that may explain the lack of significant results. Based on these results, it can be concluded that more research is needed on the effect of (eating) cultures on HA. It is recommended that future studies include assessment in SES and cultural inclusivity concerning eating cultures and palatable food."
Expressing Emotions in the Iterated Prisoner’s Dilemma,"['Árnason, S.Ó.']","['Dastani, Prof. dr. M.M.', 'Meyer, Prof. dr. J-J.Ch.']",2020-02-20T19:03:46Z,en,"[""agents, emotions, emotional expressions, guilt, shame, prisoner's dilemma, psychological game theory, signaling theory, epistemic logic, information asymmetry, appraisal theory, social affordance, fairness intentions""]",Artificial Intelligence,"The mystery of cooperation has been researched from many perspectives and one explanation is that agents have fairness preferences where reciprocity matters. A key question in fairness literature is whether intentions matter and the modeling of fairness intentions turns out to require the tools of psychological game theory where payoffs depend not only on actions but also on beliefs. A problem in psychological game theory is that equilibrium analysis is difficult since beliefs are not typically observable ex post. I analyze how this affects behavior in the iterated prisoner´s dilemma, with agents that might care about fairness intentions, when one agent (Alice) cooperates and the other (Bob) defects. Alice thinks that Bob acted unfairly if he did so while believing that Alice would cooperate, but fairly if he did so while believing that she would also defect. In my analysis I define two types of players, a good one that cares about fairness intentions when choosing a strategy, and a bad one that only cares about himself and therefore always defects. Since Alice doesn’t know ex post what Bob’s belief was about her strategy, she has difficulties knowing his type and predicting his next move. This is a problem of asymmetric information and I look at the problem of signaling one’s type to the other using signaling theory where the central problem is that for signals to be believable, they must be costly to fake. Emotions have been proposed as commitment mechanisms that help with this problem in human societies. I present a way to solve this by allowing players to express emotions between iterations of prisoner’s dilemma. To do this I develop a theory of social affordance appraisal for agents, to argue that they can use emotional expressions as strategic actions in a social world."
