title,authors,supervisors,date,language,keywords,program,abstract
Nonconceptual Content in Perception,"['Bremmers, L.']","['Lievers, M.']",2019-09-04T17:00:45Z,en,"['Conceptualism, John McDowell, Nonconceptual content, Nonconceptualism, Perceptual content, Perceptual experience, Philosophy of perception']",Philosophy,"Since the publication of Gareth Evans’s The Varieties of Reference in 1982, in which Evans introduced the distinction between conceptual and nonconceptual content, there has been an ongoing debate in the philosophy of perception about the nature of the content of perceptual experiences. At first sight, the debate between conceptualists and nonconceptualists does not seem that difficult to get a grip on, as most proponents or opponents of nonconceptual content use versions of the same arguments to argue for and against one of the two positions. However, this thesis shows that there is a complication: methodological disagreements between conceptualists and nonconceptualists cause the participants in the debate to talk past one another. In response to this complication, this thesis argues that (1) philosophical accounts of perception must meet two conditions if a more constructive debate between conceptualists and nonconceptualists is to be realized, and that (2) given my conditions for philosophical accounts of perception, perceptual content can best be understood as nonconceptual."
The Passion Cycle Paintings of Maarten van Heemskerck: A Study of the Rhetorical Gestures in his Religious Paintings During the Three Decades After his Return from Italy,"['Davis, B.J.']","['Weststeijn, T.']",2019-09-04T17:00:46Z,en,['Maarten van Heemskerck; 16th-century art; Passion Cycle painting; Netherlandish art'],Art History of the Low Countries,
Alonso Sánchez Coello en zijn aanstelling tot hofschilder van Filips II van Spanje,"['Mennens, L.I.']","['Hoogenboom, A.']",2019-09-04T17:00:43Z,nl,[],Taal- en cultuurstudies,
"Sound cinema, deafness, and hearing impairments. Toward a new theory of audiovision","['Centonza, A.']","['Ahrendt, R.']",2019-09-04T17:00:55Z,en,['sound; cinema; film; audiovisual; audiovision; deafness; hearing impairment; disability; film studies; disability studies; gender studies; sound studies; a quiet place;'],Musicology,"Deafness and hearing impairments pose sound cinema in front of a crucial problem: is a non-ableist representation possible? At first, the issue might seem related to the kind of narratives that sound cinema tailors around disability, and it is indeed mostly from this perspective that it has been investigated. However, there is more to it. How is a non-ableist representation at all possible, when sound cinema constructs practices of listening that, apparently, always imply a spectator “able” to listen? In other words, is it possible for sound cinema to construct practices of listening that are (at least) open toward the infinite range of shifting possibilities that constitute embodied listening, instead of adhering to and shaping the norm of an idealised “perfectly” hearing ear?
In my thesis, I want to explore the apparent paradox that emerges by letting deafness, hearing impairments and sound cinema encounter: the (im?)possibility of an audiovisual representation that accounts for what the Cambridge Dictionary problematically defines as “the quality of being unable to hear.” To do so, I intend to move interdisciplinarily between Audiovisual Studies, Critical Disability Studies, and Critical Feminist Studies, and along their intersections. First, I explore a theoretical framework which allows me to argue that sound cinema represents specific hearing/listening practices as universal, shaping for its films aural dimensions informed by arbitrary criteria, while rarely dealing with such an arbitrariness and often silently proposing it as the norm. By letting this theoretical framework resonate with critical interventions on deafness, cochlear implants, and embodied listening, sound cinema’s mainstream listening practices will be coloured with deeply ableist tints. Second, I assert the necessity of a new theory of audiovision—one that truly strives to take into account the contributions of Critical Disability Studies—in order to both understand the processes of aural mediation proposed by existing audiovisual objects and construct new ones. I commence the building of this new theory by discussing and reshaping the concepts of “point of audition” and “aural diegetic space.” The theory is then tested against A Quiet Place, a high-concept horror film which fascinatingly constructs its audiovisual codes in conformance to the deafness of one of its main characters. Finally, I reflect on the possible directions that audiovision might take when exposed to the perspective of deafness and hearing impairments. This reflection is constituted by two components: a short film, striving to further research through artistic practice what explored on a theoretical level, and a verbal/written critical assessment of the choices that led (and those that could have led) the short film’s creation.
By attempting to understand the issues proposed to sound cinema by deafness and hearing impairments, my thesis does not want to chase the possibility of audiovisual representations that imagine disability for “able” people. Instead, this project seeks to explore the limits of oral/aural listening practices as indicated by the epistemological shifts proposed by deafness and hearing impairments, in an effort to indicate new directions for a broader debate concerning the processes of audiovisual mediation."
In the dust of the multiverse? How black comedy in Rick and Morty elaborates on and challenges Eugene Thacker’s cosmic pessimism,"['Browne, T.N.']","['dr. Birgit Kaiser, B.K.']",2019-09-04T17:00:54Z,en,"['cosmic pessimism, rick and morty, posthumanism, nihilism, science fiction, television, popular culture, irony, grotesque, dark humour, black humour']",Comparative Literary Studies,"This thesis reads the American animated comedy, Rick and Morty, can be alongside and against Eugene Thacker’s “cosmic pessimism”, a pessimistic posthumanist philosophy elaborated over various works. The aim is to see how an understanding of the tenets of cosmic pessimism can enrich a reading of Rick and Morty, and moreover to see what challenges Rick and Morty poses for cosmic pessimism itself, since this latter, according to Thacker, takes the distinctly un-comedic genre of supernatural horror, not he animated sitcom, as the privileged site of its elucidation.
	In order to carry out this investigation, the work considers Rick and Morty within two different traditions: that of dark comedy, and that of the postmodern sitcom. These guide the reading, with an understanding of the postmodern sitcom providing the tropological and contextual ground of the investigation and the major features of dark humour — specifically irony and the grotesque — providing the structure by which the analysis proceeds.	
	This investigation aims to explore Rick and Morty as a truly distinctive text at the confluence of diverse aesthetic and philosophical notions, and in so doing will challenge and modify the conclusions of Thacker’s cosmic pessimism."
Overcoming Essentialism: A Transcultural Approach to Gandhāran Buddhist Material Culture,"['Zhao, C.']","['Rakow, Katja']",2019-09-04T17:00:55Z,en,"['Gandhāra, Buddhism, material culture, essentialism, transcultural, translocative']",Religious Studies,"This thesis aims to challenge the conventional essentialist approach and to suggest a more appropriate approach—the transcultural approach—to study Gandhāran Buddhist material culture in particular and religions or cultures in general. By answering the research questions that what deficiencies an essentialist approach possesses and what advantages the transcultural approach has, this thesis argues that taking a transcultural approach is more productive and heuristic than taking the conventional essentialist one. The essentialist approach has become prominent and even dominant in Gandhāran studies since the 19th century. The explanatory notes of Gandhāran Buddhist material culture in contemporary museums demonstrate that the essentialist view is still prevalent in the contemporary postcolonial era. However, the essentialist approach largely simplifies the complexity of cultural or religious processes in social-historical reality; it makes the mixed cultures lose their subjectivities and agencies; it is also more likely to make academic discussions vulnerable to be exploited by certain political agendas. Instead of following the essentialist approach, the author adopts a transcultural approach instead to re-examine Gandhāran Buddhist material culture. Taking the transcultural theoretical thinking as a first step, based on the case study of the visual representation of Gandhāran Vajrapāni, the author further attempts to re-construct a theory of cultural interactions and entanglements—the translocative framework. Based on the theorization of the translocative framework, the author argues that the transcultural approach can encourage us to attend to the complexity behind the interactive or integrative dynamics of religions and cultures; it is helpful to resume the subjectivity and agency of local cultures; it reflectively challenges the preceding politicalized discourses of cultural essentialism. Moreover, it can contribute to our understandings of religions and cultures as well as open up more space for further theoretical discussions."
Le Carthage de Flaubert. La représentation de l'identité de l'Autre dans Salammbô,"['Verbiesen, I.']","['Vermijn, Y.J.C.']",2019-09-04T17:00:57Z,fr,[],Franse taal en cultuur,"Cette recherche vise à examiner la façon dont est décrite l’identité des Carthaginois dans le roman historique Salammbô de Gustave Flaubert, publié en 1862, à partir d’une vision occidentale sur les cultures orientales. Ainsi, cette formation d’identité est à critiquer en raison du discours colonial porté par son auteur, au moins selon la théorie d’Edward Saïd sur l’Orientalisme. De plus, selon l’idée de l’altérité, une distinction entre le Nôtre t l’Autre est faite. En outre, selon les structuralistes la façon de décrire une culture qui nous est étrangère dit le plus souvent autant sur la nôtre. La particularité du roman de Flaubert se trouve dans la présence de deux Autres : d’une part les Carthaginois, d’autre part les Mercenaires qui se révoltent contre eux dans une guerre cruelle. L’élément-clé est la comparaison des deux identités, renforcée par la relation amoureuse entre les deux représentants de ces deux groupes : Salammbô et Mâtho, ce dernier souvent nommé « le roi des Barbares ». Ainsi, nous avons affaire à une double altérité, deux Autres, les Carthaginois qui ont l’air le plus « normal » et les Mercenaires qui sont les « Barbares » : il en résulte une dynamique compliquée. Afin de comprendre comment cette vision est construite, nous étudions les sources souvent occidentales de Flaubert. Il devient de plus en plus clair que la conception occidentale ne se trouve pas forcément dans les sources, mais plutôt dans l’imagination de l’auteur qui est fortement influencée par son voyage à Carthage et par la société dans laquelle il vivait, un XIXe siècle de nationalisme où le colonialisme français était à son apogée, tout comme le développement de nouvelles sciences. Alors que Flaubert désapprouve ce nationalisme de ses contemporains, l’influence de son époque est à ne pas nier."
The Syntax-Discourse Interface of the Mandarin Anaphoric Elements: Interpreting Referential Dependencies with File Cards,"['Du, K.']","['Avrutin, S.']",2019-09-04T17:00:53Z,en,['Syntax-Discourse interface; Anaphora resolution; Mandarin reflexivity; File cards; Long-distance binding'],Linguistics,"Referential dependencies could be established at different levels of representation: syntactic (within the computation system) and extra-syntactic (within the C-I interface). In comparison with the well-studied syntactic dependency, how the extra-syntactic dependencies are processed and encoded for interpretation still begs for further clarification. Mandarin Chinese, known to be discourse-oriented and lack overt morpho-syntactic features, has the puzzling long-distance binding phenomenon. Using the File Card system (Avrutin, 1999; 2004), this thesis will look into the Mandarin anaphoric elements whose referential dependencies are abundantly found on the discourse levels of representation, in order to develop a Syntax-Discourse Interface model which could eventually be applied to account for some psycholinguistic phenomena pertaining to the interpretation of referential relations."
"#CaSuffit, une analyse de l’antisémitisme contemporain en France","['Vissers, M.R.']","['van den Wijngaard-Foux, M.C.']",2019-09-04T17:00:56Z,fr,['antisémitisme;juifs;société'],Franse taal en cultuur,"Peut-être plus que tous les autres pays européens, la France a dû faire face à l’antisémitisme ces dernières années. A plusieurs reprises, l’antisémitisme est devenu meurtrier avec entre autre l’attentat dans une école juive et les meurtres de Sarah Halimi et Mireille Knoll. En 2018, le nombre d’actes antisémites a augmenté de 74%, ce qui a choqué la société française. Sous le slogan « Ça Suffit ! » des milliers de personnes se sont rassemblées pour manifester contre cet antisémitisme croissant en France. Mais pourquoi l’antisémitisme augmente-t-il autant en France après deux ans de baisse en 2016 et 2017  ? C’est ce que nous allons essayer de montrer dans ce travail. La question principale est la suivante : Comment peut-on expliquer la hausse récente des actes antisémites en France ?"
Perfect markers: Exploring desiderata for the semantics of the Perfect in Greek,"['Askitidis, K.']","['Bruyn, B. Le']",2019-09-04T17:00:53Z,en,"['Perfect, Greek, Parakimenos, markers, semantics, pragmatics']",Linguistics,"The semantics of Parakimenos, the Perfect in Greek, has been a topic that has been studied extensively, but it is really hard to define due to its interchangeability with the Greek Aorist. Due to that, I introduce an approach, that could account for the semantics of Parakimenos by focusing on the markers that  co-occur with it most frequently.
At first, I conduct a corpus research with the markers that are considered to be found with Parakimenos. The findings suggest that the markers make up a scale with two extremes and a number of in-between values: some markers typically go Parakimenos, others typically go Aorist and yet others take up an in-between position.
Moving on, I carry out a forced-choice native speaker experiment in which the above findings are replicated. 
At the end, I argue that this marker-based approach could be insightful in studying the Perfect cross-linguistically."
Subject Inversions in Lubukusu,"['Barabas-Weil, L.C.']","['van Koppen, J.M']",2019-09-04T17:00:54Z,en_US,"['Syntax, Bantu, Agreement, Multiple Probing, Lubukusu']",Linguistics,"In this thesis, I investigate subject inversions in Lubukusu. In subject inversions, the sentence does not follow the canonical word order SVO but instead the logical subject is in a postverbal position. The subject marker of the verb can either agree with a preverbal locative when the verb is an unaccusative or with the postverbal logical subject. Furthermore, the verb shows additional locative morphology if the sentence has a preverbal locative. The logical subject stays in situ independently of the verb agreeing with it or not. In this paper, I show that the locative is base generated in the specifier of IP if the subject marker agrees with it and that the locative can only be inserted in the specifier of IP, when the verb is an unaccusative. To account for this observation, I argue that the inflectional head in Lubukusu has Time, Locative and Phi-features. While the Locative probe only probes upwards, the Phi-probe is flexible and can agree both upwards and downwards. The Phi-probe always agrees with the external argument. If no external argument is available, the probe agrees with the internal argument. This operation can be intervened by inserting a locative DP into the specifier of IP."
"Sensing Sound, Feeling Film - Exploring haptic aurality in cinema","['Peters, M.F.']","['Kessler, prof. dr. F.E.']",2019-09-05T17:00:54Z,en,"['haptic, aurality, sense, studies, visuality, haptical, cinema, whiplash, first reformed, haptic aurality, history of violence, visceral, audiovisual passage, acousmatic sound, aural ambiguity, auditory distress, haptics, chion, marks, sobchack, barker, donaldson, home-cook, verstraete']","Media, Art and Performance studies","This thesis aims to broaden the studies of hapticity in cinema through further development of haptic aurality. This relatively unknown term is the counterpart of haptic visuality, and represents the totality of sound elements in a film soundtrack, ranging from silence and ambient noise to songs and score. It has often been claimed that film is a visual medium, which has generally led to a much less developed theoretical field on sound in film, and thus the development of haptic aurality as a concept is still its infancy. This tendency has be noticed by a number of authors, but they are few and far between. What makes matters even more complicated is that the authors that do focus on the haptic quality of sound in film tend to work with different aspects of haptic aurality, their focus is all over the place, and there is hardly any common ground when it comes to terminology and conceptualization. Therefore, my theoretical framework covers the most important theories, ideas and concepts created by a variety of authors, after which these are filtered, selected and structured. Combined with a methodology that draws upon the anthropological, ethnographic method of thick description, I analyze five films in separate case studies, adhering to separate categories. These categories are created using two parameters; the kind of sound (silence, noise, or music), and the depth of haptic intensity (ranging from haptic to visceral). Since the experience of sound comes in so many varying ways, it is appropriate to work with five different cases in order to show the variety in haptic manifestations that these sounds showcase. The results of these five analyses lead me to the conclusion that the field of haptic aurality should be seen as a legitimate arena of research that expands film studies beyond the limitations of rational, narrative-driven analysis, focusing on intuitive and sensory experiences."
"On Coercion and Persuasion: How militia group Hashd al-Shaabi made strategic use of legitimacy sources in establishing civilian compliance in Ninewa governorate, Iraq, in 2017 and 2018","['Hesselink, E.S.']","['Gould, Dr. L.M.']",2019-09-05T17:00:55Z,en,"['legitimacy, civilian compliance, governance, armed actor, militia, legitimacy sources']",Conflict Studies and Human Rights,"This thesis is focused on the strategic use of legitimacy sources in establishing civilian compliance by an armed group. It zooms in on the case study of Hashd al-Shaabi in Ninewa governorate, Iraq. This armed group mobilized in 2014 through a fatwa issued by the highest Shia leader of Iraq, Grand Ayatollah Ali al-Sistani, with the purpose of defeating Islamic State (IS) on Iraqi territory. During the successful fight against IS, Hashd al-Shaabi became increasingly active in governance and was recognized as official government organization.
Academic literature suggests that in order to establish control and authority, armed actors will seek civilian compliance, which can be based on coercive strategies or persuasive means. Because authority based on pure coercion is not sustainable and very costly, armed actors are expected to move towards persuasion instead, thereby focusing on acquiring legitimacy. Starting from this theoretical debate, this thesis operationalizes legitimacy along the lines of symbolic sources of legitimacy (such as myth-symbol complex, grievances and external threat) as well as performance-centred sources (charismatic leadership, sacrifice and martyrdom, personal loyalties, providing services and formalization).
Although coercion is an important element in Hashd al-Shaabi’s attempts to establish civilian compliance, and large parts of their governance system are based on their military power, three legitimacy sources are strategically used. These are myth-symbol complexes, partly linked to grievances, sacrifice and martyrdom and personal loyalties. Through a qualitative research method of policy document analysis, in-depth interviews, focus group discussions, field notes and observations, this thesis has added empirical insight in debates on legitimacy, civilian compliance and governance by armed actors. Its focus on local developments provide a useful approach to avoiding reductionism and advocates for further research into these complex actors, contexts and issues."
Cultivating digital roots: A case study on the co-creation of a digital tool for school gardens,"['Early, T.A.']","['Bakker, A.', 'van Joolingen, W.R.']",2019-09-05T17:00:48Z,en_US,"['informal education, garden education, professional development, curriculum reform, design thinking']",Science Education and Communication,"This case study explores the design and development of a co-created digital garden tool prototype with a Teacher Design Team (Binkhorst, et al., 2011) of garden educators from the Natuur en Milieu Educatie Programma of the Gemeente Amsterdam. The design research project sought to document the process of creating a garden app prototype, functioning as a boundary object (Starr, 2010), with the goal of better addressing the various perceptions of discontinuity (Bronkhorst & Akkerman, 2016) across the NME Program operation and management, home, and school environments. 

Using Design Thinking principles and an outcome-based, novel approach, weaving together professional development and curriculum reform, the project team co-collaborated in the design of an app prototype that was tested with a pilot group, resulting in a layered understanding of the main research question: how can a digital tool prototype, based on garden themes and content, be developed in co-collaboration with garden educators to promote continuity between garden, school, and home environments? 

The research design is then critiqued against the phenomenon of learnification (Biesta, 2013), and ecological principles are discussed in relation to understanding the NME program as an ecosystem, addressing the sub research question oriented on support strategies and infrastructure research needed to conduct similar projects, as well as within other informal education programs. 

The following recommendations are made for future research: If you want to design a collaborative, professional development project, broader consideration for the function in relation to structure-- ecosystem dynamics-- of the garden program should be done in order to have the proper depth perception guiding the research design and execution. Improving communication across the levels of the NME program in order to better identify the necessary supportive strategies can function like microbial networks, allowing educators to root down so that they can branch out, try new things and feel supported, and feel that they are capable of integrating new types of curriculum tools and strategies. If you want something to happen on the student group level, you need to have boundary crossing at other levels and support infrastructures across the different layers."
The Sacred Lives of Things: Revaluing church objects as heritage and commodities,"['Cuperus, J.']","['Meyer, Birgit']",2019-09-05T17:00:54Z,en_US,"['material religion, value, waste, heritage, sacred']",Religious Studies,"One in five Dutch churches has lost its original function in the last decades, due to declining religious affiliation and secularization. When a church building is decommissioned and has to be repurposed, the objects inside it are often required to be removed. In these moments of forced mobility, reflection on the value of church objects is required. In Roman Catholic churches in the Netherlands, rules and regulations are implemented to restrict these movements and to prevent objects from ending up in what are considered the ‘wrong’ hands. This study examines the ways in which the restrictions on church objects attributes value to items, and highlights how personal relations that people and objects develop sometimes subvert these restrictions and attribute value to objects in a different way. Focusing on churches and a religious heritage museum in Utrecht and on an antique shop specializing in religious art in Limburg, which are places where church objects often end up, this study offers a comparative perspective through which changing values can be examined.
	I propose to understand the movement of church objects from a church to a different context as a move from one economy to another. In these different economies, objects are interpreted and used differently and therefore can be understood as powerful mediators, which mediate different things. In Roman Catholic churches objects can be consecrated, which imbues them with a ‘sticky’ value which cannot so easily be removed when it moves to another economy. Studying the sacred through the lens of economy provides a new perspective on the materiality of secularization and the changing religious practices which come with it."
