title,authors,supervisors,date,language,keywords,program,abstract
Buitenlands beleid en Culturele Revolutie,"['Laat, S.T. de']","['Massink, S.F.M.']",2017-09-05T17:02:59Z,nl,[],Geschiedenis,"Tot omstreeks 1960 waren de Sovjet-Unie en China elkaars ideologische bondgenoot, met een gedeelde visie op communisme. In de jaren ’60 vond echter een belangrijke gebeurtenis plaats voor het buitenlandse beleid van China, namelijk het Sino-Sovjet schisma. Hierdoor stevende China af op een periode van isolatie, waarbij weinig tot geen warme banden werden onderhouden op het internationale niveau. Binnen China lanceerde Mao de Grote Proletarische Culturele Revolutie, waarvan het succes nog altijd betwijfeld wordt. Na de revolutie, in 1969, werden relaties met de Verenigde Staten aangehaald. Dit onderzoek focust zich op de merkwaardige shift die China maakte in het buitenlands beleid, waarbij het gedurende de Koude Oorlog van de Sovjet-Unie richting de Verenigde Staten bewoog."
Leesgedrag en culturele waarden rond rolverdeling binnen het gezin en arbeidsmarkt,"['Aans, M.M.']","['El Aissati, Abder El Aissati']",2017-09-06T17:01:56Z,nl,"['leesgedrag, leesattitude, rolverdeling, traditionele denkbeelden, tekstpreferenties, communicatie,']",Interculturele Communicatie,"Een combinatie van factoren heeft geleid tot een behoefte om onderzoek te doen naar de relatie tussen leesgedrag en culturele waarden rondom rolverdeling tussen mannen en vrouwen in gezin en arbeidsmarkt. Allereerst heeft de literatuur laten zien dat er, ondanks stimulatie vanuit de overheid voor een egalitaire verdeling tussen mannen en vrouwen, een preferentie bestaat voor een traditionele rolverdeling bij jongeren. Daarnaast is gebleken dat deze culturele waarden invloed hebben op het leesgedrag van jongeren (Van Vliet, 1991). De (traditionele) denkbeelden van jongeren worden vertaald  naar tekstpreferenties voor teksten waarin deze traditionele rolverdeling naar voren komt. De identificatietheorie van Van Vliet (1991) gaat er vanuit dat gelijkenissen tussen de lezer en het verhaal kunnen resulteren in een verhoging van het leesplezier- en frequentie. Dit kan vervolgens potentieel leiden tot een vertaling van deze denkbeelden naar het toekomstig handelen volgens deze denkbeelden (Ajzen, 1991; Stokmans, 2009). Hiermee wordt duidelijk dat een onderzoek gewenst is om deze relatie tussen de factoren bloot te leggen. Dit leidde voor dit onderzoek tot de volgende hoofdvraag: 
‘In welke mate verklaart de houding van jongeren ten opzichte van de rolverdeling binnen het gezin en arbeidsmarkt de leesattitude van jongeren ten opzichte van fictieve teksten waarin een contrasterende rolverdeling binnen het gezin gepresenteerd wordt? 
 
Het onderzoek is uitgevoerd aan de hand van vijf deelvragen, die ondersteund worden door drie hypothesen. Middels kwantitatief experimenteel onderzoek met opvolgend een statistische analyse van de data is getracht antwoord te geven op bovenstaande hoofdvraag. De doelgroep van dit onderzoek betreft leerlingen in de leeftijdscategorie 12 tot 15 jaar uit het voortgezet onderwijs. Aan de hand van twee teksten, waarin een contrasterende rolverdeling naar voren komt, is een vragenlijst opgesteld die is ingevuld door 72 respondenten.  
 
De belangrijkste resultaten en conclusies die naar voren zijn gekomen in dit onderzoek zijn dat jongeren op bepaalde onderdelenrond rolverdeling  traditionele denkbeelden hebben. Betreffende de toekomstverwachtingen van jongeren omtrent rolverdeling tussen mannen en vrouwen in hun latere leven, zijn de jongeren minder traditioneel. Meisjes blijken een significant geëmancipeerder beeld over rolverdeling te hebben dan jongens. Dit vertaalt zich ook in de tekstpreferenties van de jongeren. Het blijkt dat er een significante negatieve correlatie waarneembaar is tussen de attitude van meisjes rondom rolverdeling en tekstattitude, waaruit gesteld kan worden; hoe meer geëmancipeerd meisjes denken, hoe leuker ze de tekst waarin dit beeld wordt bevestigd vinden. Wanneer de Theory of Planned Behaviour (Ajzen, 1991) wordt gevolgd, kan er verwacht worden dat deze preferenties zich gaan vertalen in handelingen die voortkomen uit de attitudes van de jongeren ten aanzien van rolverdeling."
"Pennen en zwaarden voor de heilstaat. Over de ambiguïteit van de socialistische stroming in Nederland, het jaar na de splitsing van de SDB, 1894 - 1895","['Danen, L.']","['Van Veen, A.']",2017-09-06T17:01:54Z,nl,[],Geschiedenis,
''Working with a passion for excellence'',"['Lenders, J.']","['Beerkens, R.M.']",2017-09-06T17:01:56Z,nl,[],Interculturele Communicatie,
Translating Forms of Address in Jane Eyre & North and South,"['Müller, V.K.']","['Kosters, O.R.']",2017-09-08T17:02:04Z,en_US,"['Jane Eyre, Elizabeth Gaskell, Charlotte Brontë, North and South, Translation, Forms of Address, aanspreekvormen, vertalen']",Vertalen,"This thesis deals with translating forms of address, in particular ‘you’, into Dutch, specifically in the 19th-century novels Jane Eyre by Charlotte Brontë and North and South by Elizabeth Gaskell. Different relationships between main characters and some minor characters in Jane Eyre are analyzed in four different Dutch translations, dating from 1946, 1980, 1998 and 2014, to find translation strategies that are used for the forms of address. Context and historical background of these translations are taken into account with these analyses. The findings of this thesis suggest that there are multiple possible strategies to translate ‘you’ into Dutch, all of which take the dialogue surrounding the form of address into account, as well as the dialogue setting and the plot of the story. A strategy for translating ‘you’ into Dutch in North and South will be based on the strategies as observed in the various translations of Jane Eyre into Dutch. The proposed strategy will be tested in an annotated translation of some excerpts of Elizabeth Gaskell’s novel."
Werken op en over Grenzen: Boundary Crossing Competenties van HRD-Adviseurs,"['Tiel Groenestege, N.R.']","['Akkerman, S.', 'Groenestege, T.']",2017-09-20T17:02:00Z,nl,"['Boundary crossing, grenzen, verbinden, HRD, adviseurs, competenties, exploratief, beschrijvend']",Onderwijswetenschappen,"Boundary crossing competenties zijn nog niet uitgebreid onderzocht. Dit terwijl de boundary crosser belangrijk blijkt te zijn voor het overbrengen van ideeën en informatie, innovatie, en samenwerking (Long, Cunningham, & Braithwaite, 2013). Dit exploratieve en beschrijvende onderzoek neemt HRD-adviseurs als uitgangspunt en beantwoordt de vraag op welke manier zij aan boundary crossing doen en welke competenties daarbij in het spel zijn. Data zijn verkregen door middel van semigestructureerde interviews (N=6) en een focusgroepbijeenkomst (N=4) met HRD-adviseurs, werkzaam bij drie organisatieadviesbureaus. HRD-adviseurs doen interorganisationeel; intraorganisationeel; interdisciplinair; en door netwerken aan boundary crossing, vaak door het in sociale interactie faciliteren van verbindende processen. De competenties die ze daarbij gebruiken zijn ondergebracht in kennis, vaardigheden en attitudes. Belangrijke kennis blijkt contextuele en handelingskennis. Daarnaast komt een scala aan vaardigheden naar voren die worden ondergebracht in vijf categorieën: 1) diagnostische; 2) facilitatie-; 3) meta-; 4) proces-; en 5) sociale vaardigheden. Belangrijke attitudes ten slotte, zijn nieuwsgierigheid, meebewegen en een ruimte scheppende houding voor uitwisseling met de ander. Boundary crossing door het leggen en of faciliteren van verbindingen blijkt als een van de kernactiviteiten van HRD-adviseurs gezien te worden. Ook passen boundary crossing competenties bij ontwikkelingen die raken aan de beroepsuitoefening in de HRD. Daarom is vervolgonderzoek relevant om de resultaten te valideren in bredere context."
Karakteristieken van de interactie tussen basisschoolleerkrachten in professionele leergemeenschappen,"['Keulers, J.P.A.']","['Janssen, J.', 'Slof, B.']",2017-09-20T17:01:52Z,nl,['Interactie; leerkrachten; samenwerking; inhoud; structuur; professionele leergemeenschap; onderwerpen.'],Onderwijswetenschappen,"In dit kwantitatief observatieonderzoek staat de interactie ten tijde van de samenwerking van basisschoolleerkrachten tijdens bouwvergaderingen centraal. Het doel was om de interactie te karakteriseren en om na te gaan of enkele karakteristieken van de interactie samenhangen met verbeteringen in de lespraktijk. Leerkrachten werden, verspreid over drie bouwvergaderingen, geobserveerd op De Regenboog en Paardenbloem (N=15) om de karakteristieken van de interactie te achterhalen. Naderhand vulden de leerkrachten een vragenlijst (vijf-punt Likertschaal) in om de verbeteringen in de lespraktijk te kunnen vaststellen. Uit de resultaten blijkt dat de interactie tijdens de bouwvergaderingen gemiddeld 32.4% inhoudelijk over het onderwijs gaat. Het merendeel van de interactie blijkt over administratieve zaken te gaan. Wanneer de leerkrachten inhoudelijk interacteren over het onderwijs halen zij voornamelijk het curriculum, de instructiemethode en strategieën als onderwerpen aan. Deze interactie over de inhoudelijke onderwerpen wordt slechts in 17.8% van de gevallen volgens de interactiestructuur van aanleiding, exploratie, integratie en oplossing vormgegeven. Dit zou een reden kunnen zijn waarom de leerkrachten na de bouwvergadering nauwelijks verbeteringen hebben doorgevoerd. Een van de discussiepunten betreft het enkel analyseren van formele interacties, terwijl informele interacties ook een belangrijke bron vormen om lesverbeteringen door te voeren (Rogers, 2014). Een vervolgonderzoek hiernaar is gewenst."
Volg de hand of de pijl: Effecten van verschillende cues op de visuele aandacht en leren,"['Leferink, Z.S.']","['Wermeskerken, van, M.', 'Gog, van, T.']",2017-09-20T17:01:57Z,nl,"['videovoorbeelden, signaling principe, embodied cognition, eye tracking']",Onderwijswetenschappen,"Deze thesis is een replicatie van De Koning en Tabbers (2013) waarbij onderzocht wordt wat het effect is van embodiment cueing in vergelijking met artificiële cueing bij animaties op de leerprestaties (i.e. retentie en transfer) en de visuele aandachtsprocessen van lerenden. Participanten (n = 24) bestudeerden een animatie over het ontstaan van bliksem waarbij of een afbeelding van een pijl (pijl-groep) of een afbeelding van wijzende hand (hand-groep) meebewoog met het relevante element in de animatie. Resultaten toonden geen significante verschillen tussen de pijl-groep en de hand-groep op zowel de visuele aandacht voor het relevante taakgebied (p = .066) als de leerprestaties (retentie: p = .799; transfer: p = .527). Voor dit onderzoek kan geconcludeerd worden dat, in tegenstelling tot de bevindingen van De Koning en Tabbers (2013), cueing door middel van een hand geen effect heeft op de visuele aandacht en de leerprestaties bij animaties."
Nieuw-Nederland als beginpunt van de New Yorkse Melting Pot,"['Pieters, L.']","['Onnekink, David']",2017-09-20T17:01:29Z,nl,"['Nieuw-Nederland, tolerantie, culturele diversiteit, melting pot']",Geschiedenis,
Integrated cost comparative framework for trenched and trenchless techniques in the Netherlands,"['Cardon de Lichtbuer, G.C.É.M.G.']","['Aat Barendregt, A T']",2017-11-21T18:01:06Z,en,[],Water Science and Management,
Mate van Gespreid Leiderschap in de Basisschool als Voorspeller voor Leerresultaten,"['Broos, S.W.J.']","['Venne, L.H.J. van de', 'Hagemeijer, R.E.']",2017-11-30T18:01:25Z,nl,['gespreid leiderschap; teacher leaders; leerresultaten primair onderwijs; distributed leadership inventory'],Onderwijswetenschappen,"Jaarlijks maakt de inspectie van het onderwijs een risicoanalyse van scholen waarbij de eerste detectiefase plaats vindt op grond van leerresultaten (OCW, 2012). Juist door de toenemende aandacht voor de prestaties van scholen is het van belang om de aandacht te richten op hoe die prestaties beïnvloed kunnen worden. Er zijn veel bronnen om aan te nemen dat leiderschap een positief effect heeft op leerresultaten (Waters, Marzano & McNulty, 2003; Spillane, Halverson & Diamond, 2004). Schoolleiderschap toonde vaak een hiërarchisch model waarbij de schooleider als individu de school bestuurt (Copland, 2003; Hulpia, 2009). Dit model staat tegenwoordig ter discussie. Gespreid leiderschap wordt als een waardevol alternatief voor de traditionele één-persoons leiderschapsmodellen gezien (Gronn, 2002; Harris, 2004). Deze leiderschapsvorm wint steeds meer terrein in onderwijsland (Harris, 2008; Spillane 2006). Reden te meer te onderzoeken of gespreid leiderschap een bijdrage kan leveren aan behoud of verbetering van leerresultaten. Op 23 scholen binnen een schoolbestuur is de mate van gespreid leiderschap onderzocht met de door Hulpia, Devos en Rosseel (2009) ontwikkelde vragenlijst; Distributed Leadership Inventory (DLI). Hierna werd gekeken of er verschillen waren tussen de mate van gespreid leiderschap en de leerresultaten op schoolniveau. Controlevariabelen: opleidingsniveau ouders, klasgrootte en schoolgrootte werden meegenomen. De resultaten impliceren dat er een significante negatieve samenhang is tussen een hoge mate van gespreid leiderschap en leerresultaten. Dit in tegenstelling tot de verwachting vanuit de literatuur. In het licht van de beperkingen van dit onderzoek werden de resultaten bediscussieerd en worden implicaties gedaan voor vervolgonderzoek."
"The trustworthiness of trust measurement. 
Predicting trusting behaviour in trust games by survey-measured trust","['Blok, M.M.E.']","['Przepiorka, W.', 'Nivette, A.E.']",2017-11-30T18:01:29Z,en,['Trust; measurement; trust games; experiment; survey'],Sociologie,"Trust has found to be of great influence on social and economic transactions of everyday life (Fehr, 2009). Although the topic has caught the attention of scholars within many fields, the question how trust can be measured has not been answered properly (Nannestad, 2008). Previous studies have shown that the main measurement methods of trust – the survey based generalized trust question and the experimental trust game – do not correlate (Ermisch et al., 2009; Fehr et al., 2003; Glaeser et al., 2000). Data and methods on which these results are based can be fairly criticized. I hypothesise that survey-based trust can predict trusting behaviour in trust games. In this study, generalized trust is perceived by the behaviouristic definition. I argue that measurement on generalized trust can be improved by using a homogeneous sample, by using a random and anonymous matching procedure in the experiment and by creating a survey-measure, formed by a multiple-item trust scale. The data consists of experiments from Switzerland (2010 and 2014), the United Kingdom (2011) and Spain (2012), including both trust game and survey. I conclude that survey-measured trust, when used in a multiple-item scale, successfully predicts trusting behaviour in trust games."
Populistische volksvorming; Populisme en nationalisme in België en Nederland tussen 2005 en 2015,"['Koning, H.C.M. de']","['Corduwener, P.']",2017-08-31T17:01:23Z,nl,"['populisme, nationalisme, Vlaams Belang, Partij Voor de Vrijheid']",Geschiedenis,Welke theorieën gaan schuil achter het populisme en het nationalisme en hoe versterken zij elkaar. Vervolgens worden met de politieke partijen Vlaams Belang en de Partij Voor de Vrijheid deze theorieën nader toegelicht.
Beurtverdeling tijdens de strafzitting,"['Kok Luís, N.']","['Van Charldorp, T.']",2017-09-05T17:02:37Z,nl,[],Interculturele Communicatie,
Het nieuwe verzekeren(?) - Een kritische discoursanalyse van de ‘rijgedragverzekering’ van Achmea,"['Bovenkamp, S.E. van de']","['Koevoets, Dr. Sanne']",2017-09-05T17:02:53Z,nl,"['Kritische discoursanalyse (KDA), rijgedragverzekering, surveillance, data, controlemaatschappij, Deleuze, disciplinemaatschappij, Foucault']",Nieuwe media en digitale cultuur,"Achmea heeft aangekondigd een ‘rijgedragverzekering’ te willen invoeren. Een kastje in de
auto verzamelt gegevens over het rijgedrag van de automobilist, op basis van deze data wordt
beoordeeld of de gebruiker recht heeft op een premiekorting of niet. Over dit voorstel is ophef
ontstaan in Nederlandse kranten en er zijn Kamervragen gesteld over deze verzekering. Deze
case is het onderwerp van de kritische discoursanalyse uitgevoerd voor dit onderzoek.
Berichtgeving in de zes grootste Nederlandse dagbladen en de Kamervragen zijn
geanalyseerd om te onderzoeken ‘hoe in de context van dataverzameling en surveillance de
verantwoordelijkheid van het controleren en disciplineren van rijgedrag rond de voorgestelde
‘rijgedragverzekering’ van Achmea wordt geconstrueerd in het publieke discours?’ Op basis
van de kritische discoursanalyse zijn een drietal hoofdthema’s geformuleerd die het publieke
discours kenmerken: Risico’s, Voordelen en Verantwoordelijkheden. Deze sluiten aan bij de
gevolgen van digitale surveillance die binnen diverse disciplines en onderzoeken zijn
aangetoond. Deze onderzoeken worden kort toegelicht om de reikwijdte van dit onderzoek te
duiden. Het concept van de disciplinemaatschappij van Michel Foucault en de
controlemaatschappij van Gilles Deleuze bieden inzicht in de machtsdynamiek die ontstaat bij
surveillance en controle die inherent is aan dit type verzekering. Dit onderzoek laat zien dat er
een paradox ontstaat binnen het publieke discours. De risico’s van deze controle circuleren
duidelijk, maar wettelijke grenzen zijn onduidelijk, het gebruik van data niet transparant en
mogelijk versnipperd, wat verzet en weerbaarheid lastig maakt. Dit blijkt uit de verdeeldheid
over en het doorschuiven van de verantwoordelijkheden. Deze paradox is daarmee wellicht
nog het grootste risico dat wordt gereflecteerd binnen het publieke discours."
"Positionsverben: Der Unterschied zwischen der deutschen und niederländischen Sprache beim Gebrauch der Verben sitzen (zitten), liegen (liggen) und stehen (staan) bei Menschen, Tieren und Objekten","['Oosting, T.']","['Berg, M.C. van den', 'Sudhoff, S.']",2017-09-06T17:02:12Z,de,"['posture verbs  , positionsverben  , positionele werkwoorden , positiewerkwoorden  , cardinal posture verbs  , verb , verbs , werkwoord , german , Duits , Deutsch , Nederlands , Dutch , Niederländisch , taalgebruik , spraak , Sprachgebrauch , language use , language , difference , taal , verschil , sprachlich , Unterschied , Sprachvergleich , taalvergelijking , language comparison , excel , corpus , BowPed , afbeelding , afbeeldingen , abbildung , abbildungen , TRPS , stimulus , stimuli , waar , waar is X , BLC , basic locative construction , topologisch , topological , spatial , spatieel , spatiële , relation , relatie , Beziehung , spatial topological relation , space , zitten , sit , sitzen , liggen , lie , liegen , staan , stand , stehen , grammaticalisatie , grammaticalization , grammatikalisation , variation , variatie , leeftijd , age , Alter , figuur , figure , Figur , ground , grond , Untergrund , Frequenz , frequentie , frequency , activity , activiteit , Aktivität , inactivity , inactiviteit , inaktivität , Belebtheid , animacy , levendig , levend , levenloos , literatur , literature , literatuur , vergelijking , vergleich , empirisch , empirical , research , Forschung , onderzoek , Umfrage , enquête , experiment , test , lichaamshouding , Körperhaltung , horizontaal , verticaal , neutraal , horizontal , vertikal , vertical , horizontal , neutral , oriëntatie , orientation , Orientierung , mensch , menschen , mens , mensen , human , Tier , Tiere , dieren , dier , ding , dingen , object , objekt , objecten , objekte , gegenstand , gegenstände , Sprache']",Taalwetenschap,
Empowering Women: A Study on the Impementation of Gender Equality Programming in Dadaab (Kenya) and Za'atari (Jordan),"['Boven, L.']","['Massink, S.']",2017-09-22T17:02:02Z,en,[],Taal- en cultuurstudies,"This thesis will discuss the Dutch involvement regarding gender in an international context of humanitarian aid. The role of the Netherlands is discussed through gender equality programming set up by UN Women to help empower women in the refugee camps Dadaab (Kenya) and Za’atari (Jordan). With the Netherlands as one of the largest donors to UN Women it is important to look at the outcomes of the work done by UN Women for future policies. Different approaches and outcomes of gender equality programming in both refugee camps will be discussed, as well as critique on the effectiveness."
Het effect van tweetaligheid op (kleur)perceptie,"['Driel, S.D. van']","['Winter, Yoad', 'Zwarts, Joost']",2017-10-02T17:01:38Z,nl,"['tweetaligheid, perceptie, kleurperceptie']",Liberal Arts and Sciences,"De relatie tussen taal en perceptie is al meer dan een halve eeuw punt van discussie. In kleurstudies zijn zowel universalistische patronen te vinden als taalspecifieke invloeden op perceptie. Hoe zijn deze patronen en invloeden terug te zien in het cognitieve gedrag van tweetaligen? In deze scriptie wordt het effect van tweetaligheid op perceptie – met de focus op kleur – bestudeerd aan de hand van een literatuurstudie. In de literatuurstudie wordt eerst een fundament opgezet door drie onderzoeken over tweetaligheid en perceptie in de perceptieve domeinen vorm en materiaal, ruimtelijkheid en perspectief te analyseren. Vervolgens wordt er ingezoomd op het domein kleur om de relatie tussen taal en perceptie in tweetaligen te bekijken aan de hand van drie kleurstudies. Uit de besproken studies blijkt dat er een effect is van tweetaligheid op (kleur)perceptie. Beiden talen hebben invloed op het cognitief conceptualiseren en categoriseren van perceptuele stimuli, zoals kleuren. Deze scriptie slaat de brug tussen taal, perceptie en cognitie en biedt inzicht in zowel de rol van taal bij (kleur)perceptie als inzicht in conceptualisering en categorisering bij tweetaligen. Deze inzichten dragen bij aan de huidige discussie over taal en perceptie en het universalisme versus het relativisme."
Maxim Februari; De veelzijdigheid van de mens voorop,"['Drewes, P.J.']","['Ham, Laurens', 'Vitse, Sven']",2017-11-02T18:01:23Z,nl,[],Nederlandse taal en cultuur,
"HET KONINKRIJK: SURINAME en de Nederlandse identiteit.
Een Critical Discourse Analysis van de Nederlandse identiteit in HET KONINKRIJK: SURINAME","['Steenbruggen, M.A.']","['van Romondt Vis, Pauline']",2017-11-14T18:01:17Z,nl,[],Communicatie- en informatiewetenschappen,"In dit onderzoek wordt geanalyseerd welk discours geconstrueerd wordt over de Nederlandse nationale identiteit in HET KONINKRIJK: SURINAME. Dit naar aanleiding van het artikel ‘Identificatie met Nederland’ van de Wetenschappelijke raad voor het regeringsbeleid (2007). Daarin stond dat de Nederlandse identiteit kan fungeren als een instrument om de mislukte integratie van minderheden op de rails te krijgen. Paul Scheffer schreef in 2000 in zijn essay ‘Het multiculturele drama’ dat Nederlanders meer moeite moeten doen voor het definiëren van een nationale identiteit, zodat meer migranten kunnen integreren in Nederland. De NPO zou volgens Dekker (2014) als publieke omroep moeten bijdragen aan het definiëren van de Nederlandse identiteit. In dit paper is de Nederlandse identiteit in de aflevering HET KONINKRIJK: SURINAME onderzocht met behulp van een Critical Discourse Analysis (CDA). Aan de hand van een CDA zijn de narratieve structuur, de mise-en-scène en de cinematografie geanalyseerd van de aflevering HET KONINKRIJK: SURINAME uit 2015. Deze analyse toont dat de Nederlandse nationale identiteit een dynamisch en meerduidig karakter heeft en gedefinieerd kan worden in interactie met anderen. Ook toont de analyse dat de Nederlandse identiteit kan functioneren als een ideologie die bijdraagt aan het in- en uitsluiten van sociale groepen, waardoor ongelijke machtsrelaties in Nederland gevormd en onderhouden worden tussen witte Nederlanders en zwarte Nederlanders met een Surinaamse achtergrond. Uit de analyse blijkt dat de NPO kan bijdragen aan het definiëren van de Nederlandse identiteit en dat Nederlanders moeite doen om een concretere definitie van de Nederlandse identiteit te definiëren. De Nederlanders die moeite doen zijn echter wel witte Nederlanders, waardoor duidelijk wordt dat white privilege een belangrijke voorwaarden is voor het definiëren van de Nederlandse identiteit. Hierdoor kan geconcludeerd worden dat de huidige Nederlandse identiteit nog niet geschikt is om te fungeren als een instrument om de multiculturele samenleving en de integratie van minderheden te bevorderen, omdat het nog te veel ongelijke machtsverhoudingen tussen witte Nederlanders en zwarte Nederlanders met een Surinaamse achtergrond faciliteert."
Een Onmogelijke Keuze - Over het Conflict tussen de Liefde en de Moraal,"['Jong, S. de']","['Vorstenbosch, Jan']",2017-11-15T18:01:20Z,nl,"['liefde, moraal, conflict, normatieve ethiek, Frankfurt, Velleman, Swanton']",Liberal Arts and Sciences,"Deze thesis behandelt de vraag of de mens zowel de liefde als de moraal kan dienen zonder dat zich daarbij een conflict voordoet. Aan de hand van het gedachtegoed van Frankfurt en de posities van Velleman en Swanton draag ik verschillende theoretische argumenten aan waarmee dit conflict schijnbaan kan worden opgelost. Aan het einde van deze thesis zal ik echter betogen dat geen van de voorgedragen oplossingen reëel is en het conflict tussen de moraal en de liefde onoplosbaar is.Voor de normatieve ethiek betekent dit dat de vraag hoe te handelen uiteindelijk niet volledig door een universele theorie beantwoord kan worden. Geconfronteerd met een dilemma, dient de mens een keuze te maken voor wat hij als individu nu daadwerkelijk waardevol acht."
