title,authors,supervisors,date,language,keywords,program,abstract
Behoefte-ondersteuning en behoefte-frustratie: samenhang met motivatie en uitstelgedrag bij het maken van huiswerkopdrachten. Onderzoek naar de positieve en negatieve oorzaken en gevolgen van motivatie onder havo-scholieren.,"['Beek, C.P. van der']","['Hornstra, T.E.', 'Pol, J.E. van de']",2016-08-24T17:00:36Z,nl,['Behoefte-ondersteuning; Behoefte-frustratie; Motivatie; Uitstelgedrag; Zelfdeterminatietheorie; Controle'],Onderwijskunde,"In dit onderzoek worden behoefte-ondersteuning en behoefte-frustratie in verband gebracht met motivatie en uitstelgedrag bij het maken van huiswerkopdrachten onder havo-4 scholieren. Er wordt gekeken naar de samenhang tussen behoefte-ondersteuning/frustratie en uitstelgedrag, en of deze samenhang wordt gemedieerd door het type motivatie van de scholier. Het onderzoek wordt uitgevoerd middels vragenlijsten.
Er worden geen directe verbanden gevonden tussen behoefte-ondersteuning/frustratie en uitstelgedrag, maar wel indirecte verbanden via verschillende mediatoren, welke suggeren dat behoefte-ondersteuning leidt tot minder uitstelgedrag en behoefte-frustratie leidt tot meer uitstelgedrag. Daarentegen blijkt dat de behoefte-frustrerende factor controle samenhangt met minder uitstelgedrag."
Uitingen van Zelfregulerend Leren in Massive Open Online Courses,"['Burger, F.M.']","['Jansen, R.S.']",2016-08-24T17:00:38Z,nl,['MOOC; digitale leertaak; zelfregulerend leren; mixed method; think aloud protocol;'],Onderwijskunde,"Massive Open Online Courses (MOOCs) zijn een vrij recent ontwikkelde vorm van onderwijs. Een verschil met het traditionele onderwijs is dat er een hoge mate van zelfregulerend leren voor nodig is. In dit onderzoek is, door middel van een mixed design methode, inzicht gekregen in hoe zelfregulerend leren tot uiting komt bij studenten die een MOOC volgen en, nog specifieker, in een MOOC leertaak. Voor het kwantitatieve deel van dit onderzoek is data van een ander onderzoek gebruikt. Hierbij is een vragenlijst over zelfregulerend leren afgenomen onder 162 MOOC studenten. Voor het kwalitatieve deel van het onderzoek is een digitale leertaak uitgevoerd door 12 studenten in individuele labsessies, waarbij een think aloud protocol vorm van dataverzameling plaatsvond. Uit de resultaten is gebleken dat de studenten tijdens de leertaak
hun leren reguleren op basis van het ingeschatte nut en de nieuwheid van de informatie. Tevens is gebleken dat de studenten geen eigen doelen of planning opstelden voor zichzelf. Er is hieruit geconcludeerd dat niet alle aspecten van zelfregulerend leren zichtbaar zijn tijdens het uitvoeren van een digitale leertaak."
De relatie tussen accuratesse van docentbeoordelingen over leerlingprestaties op begrijpend lezen en adaptieve scaffolding,"['Bos, D.W.']","['Pol, J.E. van de', 'Jansen, R.S.']",2016-08-24T17:00:37Z,nl,['Docentbeoordelingen; diagrammen; leerlingnamen; adaptieve scaffolding'],Onderwijskunde,"In dit onderzoek zijn twee relaties onderzocht. Ten eerste is de relatie onderzocht tussen de accuratesse van docentbeoordelingen en adaptieve scaffolding en ten tweede het verschil tussen de accuratesse van docentbeoordelingen op basis van leerlingnamen en de accuratesse van docentbeoordelingen op basis van leerlingnamen en door de leerling gemaakte diagrammen. Er is onderzoek gedaan in vijftien klassen, havo-3 en vwo-3. De leerlingen lazen teksten en beantwoordden in een toets vragen daarover. Vervolgens vulden zij twee vragenlijsten (Perceived Adaptivity Questionnaire en Adaptive Intervention) in. Er zijn geen significante resultaten gevonden. Desalniettemin heeft het onderzoek aanknopingspunten geboden voor vervolgonderzoek en aangetoond dat dit onderwerp relevant is voor verder en vooral uitgebreider onderzoek"
Relation between administrative policies and school policies in secondary education,"['Bandringa, M.S.']","['Jaspers, J.G.M.']",2016-08-24T17:00:35Z,en,['secondary education; administrative policies; school policies; school board; school leader'],Onderwijskunde,"In secondary educational organisations, the distance between school boards and school leaders has been increased, which could lead to co-operation problems between them. The lack of co-operation could affect the relation between the administrative policy and the school policies within the educational organisation. This study focuses on the question to what extent the policies of both management levels are mutually related. This was examined by conducting a qualitative document analysis of administrative and school policies of six educational organisations in secondary education. The coding program MAXQDA was used to analyse these documents. The analysis showed that three core themes of the administrative policies are organisational fundaments and future planning, educational policy, and personnel policy. These themes were present in all administrative and school policies in each organisation. The way the content of these themes are described, however, often varies between policies on both levels. It is suggested that future research should focus in more detail on the content of the policies, in order to examine the consistency of the policies on both levels in an educational organisation."
"The major-interest congruence of Dutch first year students, and the influence of parents and peers","['Agricola, J.J.']","['Hulshof, C.D.', 'Jansen, R.S.']",2016-08-24T17:00:35Z,nl,"['RIASEC, major-interest congruence, parental encouragement, parental steering, peer influences.']",Onderwijskunde,"In this study the influence of parents and peers on the college major choice process is examined. 
Using the RIASEC questionnaire, interest profiles were determined and linked to whether congruence exists between student interest profile and their choice of major. The article will look at whether or not influence of parents and peers can be linked to a higher or lower level of major-interest congruence. Participants consisted of 72 students enrolled in first year classes at the Social Sciences faculty of Utrecht University. The results showed no significant correlations for the hypotheses. Parental steering and peer influences had a low negative correlation with major-interest congruence. In contrast to the second hypothesis parental encouragement and support also had a low negative correlation with major-interest congruence."
Motivatiebevordering binnen het reboundonderwijs,"['Grosso, A. Del']","['Vreekamp, M.', 'Hornstra, T.E.']",2016-08-24T17:00:39Z,nl,['Reboundonderwijs; motivatie; autonomie; controle'],Onderwijskunde,"Niet alle leerlingen doorlopen hun schoolloopbaan zonder problemen. Sommige leerlingen belanden op het reboundonderwijs, omdat ze bijvoorbeeld een gebrek aan schoolmotivatie hebben. In dit onderzoek zijn twee deelstudies uitgevoerd om inzicht te krijgen in eventuele veranderingen in motivatie van leerlingen op het reboundonderwijs (deelstudie 1) en welke strategieën leerkrachten toepassen om de motivatie van hun leerlingen te stimuleren (deelstudie 2). Volgens de STD van Ryan & Deci (2000) is ondersteuning van de drie basisbehoeften relatie, competentie en autonomie een belangrijke voorwaarde voor het optimaliseren van motivatie. In deze deelstudies is de focus gelegd op autonomie. Voor deelstudie 1 is bij 43 leerlingen van vijf reboundscholen de SRQ-A afgenomen. Voor deelstudie 2 zijn vijf leerkrachten geïnterviewd. Uit deelstudie 1 blijkt dat bij de leerlingen een significante verbetering is van de extern gereguleerde vorm van motivatie. Uit deelstudie 2 blijkt dat leerkrachten de leerlingen graag autonomie willen verlenen, maar dat dit ook gepaard gaat met controlerende strategieën."
Statusgroepen en Prosociaal en Coërcief Strategiegebruik in de Brugklas,"['Corten, N.A.E.', 'Erning, R.M. van', 'Mark, T.C.M. van der', 'Wit, R.E. de']","['Vermande, M.']",2016-08-26T17:00:41Z,nl,"['populariteit, geliefdheid, brugklassers, resource control, prosociaal strategiegebruik, inspiring followers, coërcief strategiegebruik, pesten']",Pedagogische Wetenschappen,"Onderwerp. De Resource Control Theory (RCT; Hawley, 1999) stelt dat sociale dominantie (resource control) door zowel prosociale als coërcieve strategieën kan worden bereikt. In dit onderzoek is gekeken hoe verschillende combinaties van populariteit en geliefdheid (impopulair-niet geliefd, populair-geliefd, en gemiddeld) verschillen in het gebruik van procosiale strategieën, inspiring followers, coërcieve strategieën en pesten. Methode. Er is gebruik gemaakt van reeds beschikbare data afkomstig van het onderzoek Dynamics of Youth van de Universiteit Utrecht (n=293, 150 meisjes). De variabelen zijn gemeten aan de hand van peernominaties. Om de hoofd- en interactie effecten van de drie clusters en sekse op de onafhankelijke variabelen te meten, zijn verschillende MANOVA’s uitgevoerd. Resultaten. Er is een significant hoofdeffect van cluster gevonden. Dit effect werd alleen bij inspiring followers gevonden. Adolescenten in het populair-geliefde cluster gebruikten inspiring followers het meest, adolescenten in het impopulair-niet geliefde cluster het minst. Ook werd er een significant hoofdeffect van sekse gevonden. Meisjes scoorden hoger op inspiring followers, en lager op coërcief strategiegebruik en pesten dan jongens. Er was geen significant interactie-effect tussen sekse en cluster op strategiegebruik. Conclusie. De drie clusters van Van den Berg, Burk, en Cillessen (2015) verschillen minder van elkaar dan verwacht werd. Deze resultaten geven slechts in beperkte mate evidentie om de clusters te kunnen valideren. Implicaties voor de praktijk en suggesties voor vervolgonderzoek worden besproken."
Wat is de Relatie tussen de Gezinssamenstelling en het Mediagebruik van Basisschoolkinderen?,"['Hoogers, A.', 'Hamers, L.S.', 'Velden, M. van der', 'Harbers, N.']","['Vossen, H.G.M.']",2016-08-26T17:00:42Z,nl,['Media; mediagebruik; kinderen; gezin; gezinssamenstelling; geboortepositie; geslachtsamenstelling; burgerlijke staat; aantal broers en zussen'],Pedagogische Wetenschappen,"Doel: Door de snelle opkomst van elektronische media is het mediagebruik van kinderen de afgelopen jaren toegenomen. Mogelijk speelt de directe omgeving, waaronder het gezin, een rol in het mediagebruik van kinderen. In dit onderzoek is daarom gekeken naar de relatie tussen de gezinssamenstelling en het mediagebruik van kinderen tussen de 4 en 12 jaar. Daarnaast is onderzocht of de gezinssamenstelling in relatie staat met blootstelling aan gewelddadige media-inhoud. Methode: De data is verzameld bij 301 ouders met een kind op de basisschool aan de hand van een online vragenlijst. De gegevens zijn geanalyseerd aan de hand van een hiërarchische regressieanalyse en covariantieanalyse. Resultaten: Er is gebleken dat de geboortepositie van het kind een significante positieve relatie heeft met het mediagebruik van kinderen. Daarnaast blijkt leeftijd een significante positieve relatie te hebben met zowel het mediagebruik van kinderen als blootstelling aan gewelddadige media-inhoud. Het aantal brusjes in het gezin, de geslachtssamenstelling van het gezin en het aantal ouders in het gezin blijken daarentegen niet significant gerelateerd te zijn aan mediagebruik en blootstelling aan gewelddadige media-inhoud. Conclusie: Uit dit onderzoek blijkt dat de gezinssamenstelling niet van grote invloed is op het mediagebruik van basisschoolkinderen. Aanbevelingen voor vervolgonderzoek worden besproken."
Gerelateerde Factoren aan Ouderlijke Mediasturing op Mediagebruik van het Kind,"['Nijkamp, R.', 'Smeijers, L.J.', 'Vangheluwe, S.', 'Verstappen, Y.']","['Vossen, H.G.M.']",2016-08-26T17:00:43Z,nl,"['parental mediation, media-use, attitude, frequency, socio-economic status, gender.']",Pedagogische Wetenschappen,"An increase in the daily usage of media by children has been noticed over the past decades. Several strategies can be applied by parents, in order to mediate the media-related behavior of the child. The aim of the study was to investigate whether a relation between parental- and child-related factors and parental media mediation could be identified. 
N = 301 subjects participated in this study and completed an online questionnaire on parental media mediation of children aged from 4 to 12 years old. The socio-economic system theory of Bronfenbrenner (1986) was used to determine the factors influencing parental media mediation. Several parental- and child-related factors were analyzed. 
A negative parental attitude towards media represented 12% of the total explained variance of restrictive parental media mediation (R2 = .12), when controlled for age and gender of the child. The frequency of media usage by the child was found to negatively correlate with restrictive parental media mediation (p = .050). Boys were found to receive significantly more active (p = .004) and restrictive (p = .012) media mediation by the parent. 
Parents exhibiting a negative attitude towards media were found to predict restrictive media mediation. In addition, frequency of media usage by children was found to correlate with this restrictive media mediation. Furthermore, gender of the child was found to predict the level of provided active and restrictive media mediation by the parent. Although the results of this study seem promising, several limitations have to be taken into account interpreting these results."
Sociale Dominantie en Sociale Vaardigheden van Resource Control Typen,"['Keijzer, N. de', 'Maat, A.J.', 'Vrugteveen, I.', 'Horst, M.V. van der']","['Vermande, M.']",2016-08-26T17:00:43Z,nl,['resource control; resource control types; social dominance; social skills'],Pedagogische Wetenschappen,"The present study focused on social dominance based on the Resource Control Theory (RCT). Adolescents in the first class of secondary school have to gain new social positions in the group, which might cause competition in obtaining social dominance. According to the studies of Hawley two different strategies, coercive and prosocial, are used to gain this social dominance. Based on these strategies, adolescents can be divided into five resource control subtypes: prosocial controllers, coercive controllers, bistrategics, noncontrollers and typicals. Data are derived from the program Dynamics of Youth of Utrecht University. In present study 619 adolescents (Mage = 12 years and 1 month, SD = 5.48 months) have participated. First, differences in resource control between the types were verified. The differences between the five types correspond to earlier research, namely that bistrategics gain the most resource control and noncontrollers the least. Subsequently, this study focused on social skills of the resource control types. Prosocial controllers scored the highest on social skills, whereas coercive controllers scored the lowest. Together, these findings suggest that both coercive and prosocial strategies can lead to social dominance. Whereas prosocial strategies are connected to the highest social skills, coercive strategies are connected to the lowest."
Resource control groepen en peer status,"['Hoek, M.J.C.A. van', 'Doldersum, I.', 'Hereijgers, S.C.M.', 'Asatouri, C.']","['Vermande, M.']",2016-08-26T17:00:42Z,nl,['resource control; peer status; peer likeability; perceived popularity; leiderschap; strategiegebruik; prosociaal; coërcief.'],Pedagogische Wetenschappen,"The main purpose of the present study was to examine if adolescents, who are going through a school transition, can achieve a higher peer status in a more socially accepted way. According to the Resource Control Theory (Hawley, 1999) there are five types of groups that use different strategies to achieve this higher peer status: prosocial controllers, coercive controllers, bi-strategic controllers, non-controllers and typical controllers. By doing a MANOVA and an ANOVA these five groups have been compared in this study on peer status (resource control, perceived popularity, being a leader in a group and peer likeability). The research shows that the bi-strategic controllers score significantly higher on resource control, perceived popularity and being a leader in a group, than the non-controllers and the typical controllers. The prosocial controllers score significantly higher on peer likeability than the bi-strategic controllers and the coercive controllers. This implies that adolescents, who are going through a school transition, can only achieve a higher peer status in a more socially accepted way for the peer status: peer likeability. For the other types of peer status, resource control, perceived popularity and being a leader in a group, the results show that it is not possible to achieve a higher peer status in a more socially accepted way."
Het maatschappelijk debat omtrent duurzame landbouw in Nederland,"['Vergouw, M.']","['Hegger, D']",2016-08-27T17:00:24Z,nl,"['debat, maatschappelijk, duurzaam, landbouw, Nederland, perspectieven, milieu, voedsel']",Liberal Arts and Sciences,"There is a scientific and public consensus that the current Dutch agricultural system is not tenable at the long term. What a more sustainable agricultural system should look like, is however a topic of large debate. This study explores the diversity of perspectives on what is meant by sustainable agriculture by stakeholders of the sector, in the public debate. The two main perspectives on sustainable agriculture are an ecological and intensification perspective. Different technologies can serve as a means to support either of these visions. Three important topics of discussion within the public debate are 1) whether or not Dutch farmers should take responsibility to produce food for the rest of the world even if that has a negative impact on the local environment, 2) the land sparing versus land sharing debate and 3) the belief in a highly technological future for food production versus a growing desire for an authentic, local food production. The topic of sustainable food production as a whole is becoming more noticeable in the Dutch society. This holds out a prospect that different barriers to a fruitful discussion can be overcome to have a constructive debate on sustainable agriculture in the future."
De relatie tussen ouderlijke sturing en het televisiegebruik van 4-12-jarige kinderen,"['Driehuis, A.A.E.', 'Leeuwen, I. van', 'Raamsdonk, J.A. van']","['Vossen, H.']",2016-08-26T17:00:42Z,nl,['parental media mediation; frequency television use; television content'],Pedagogische Wetenschappen,"The aim of this study was to examine the relationship between parental media mediation and television use in children aged 4 to 12 years. A relation was expected between parental media mediation and the amount of minutes the child is watching television as well as the type of television program the child especially watches. To collect the data, an online survey among 301 parents is used. Only Dutch-speaking parents with a child aged 4 to 12 years and with access to various types of media participated in the study. The results showed that there is no significant link between parental media mediation and the amount of minutes the child is watching television. Additionally, the results showed that there is a significant link between active parental mediation and the child’s educational television use and between co-viewing and the child’s entertaining television use. There was no significant link between restrictive parental mediation and the child’s violent television use."
'Freedom fighters or enemies of freedom' De veranderende houding van de VS ten opzichte van de Afghaanse Moedjahedien en de legitimering hiervan in de Koude Oorlog en de War on Terror,"['Sanders, P.R.']","['van de Grift, Liesbeth']",2016-08-27T17:00:22Z,nl,[],Liberal Arts and Sciences,
Magnon-mediated current drag in the semiclassical regime,"['Peters, K.J.H.']","['Duine, R.A.']",2016-09-01T17:00:28Z,en,['spin caloritronics; spintronics; spin; magnons; magnonics; spin transfer; ferromagnetic insulator; YIG; interface; magnon transport; spin waves; spin-Seebeck; heat current;'],Natuur- en Sterrenkunde,"In this Thesis we analyse the phenomenon of a charge current mediated by magnons from one non-magnetic metal layer to another through a ferromagnetic insulator. Using the Boltzmann equation in combination with magnetoelectronic curcuit theory we derive the necessary equations for the interfacial spin and heat currents due to the interaction between electrons and magnons at an interface between a non-magnetic metal and a ferromagnet. Then we analyse magnon transport in a ferromagnetic insulator and find expressions for the magnon spin and heat currents, for the magnon (heat) conductivity and the spin-Seebeck coefficient. We also derive the magnon diffusion length in terms of the relaxation time. As an application of the derived equations we look at a tri-layer structure where a ferromagnetic insulator (Yttrium Iron Garnet) is sandwitched between two non-magnetic metals (Platinum) and predict the ratio of the current mediated from one platinum layer to the other by magnons in the ferromagnet. From this we conclude that, although only of the order 10^−6, the ratio has a maximum when the thickness of the second platinum layer is about the same as the spin diffusion length."
An Introduction to Large Scale Structure,"['Hassine, A.F. Ben']","['Pajer, E.']",2016-09-01T17:00:29Z,en,"['Cosmology, Large Scale Structure, Effective Field Theory of Large Scale Structure, Perturbation Theory']",Natuur- en Sterrenkunde,"With the development of more and more large scale surveys in the past few years, and the years to come, the importance of understanding the large scale structure of the universe is steadily increasing. Without an effective model to describe this structure we would not be able to glean all the information we can from the surveys, wasting their potential. In this work some of the dynamics behind the evolution of large scale structures will be explained, as well as methods to accurately study this in both the linear and the perturbative nonlinear regime, using Standard Perturbation Theory and the Effective Field Theory of Large Scale Structure. From this we will find that using either method we can compute the time dependence of the density contrast perturbatively. The EFToLSS  will be more accurate but needs more information to determine important parameters like the speed of sound and equation of state. We will also look at an elaboration on the theory by considering some of the implications from General Relativity. Here the most important result will be a motivation why using a Newtonian approximation in the first chapters of the thesis is warranted. After this a simplification of the theory is considered in the form of Spherical Collapse, where it will be shown that the importance of the growing mode in linear SPT with respect to higher order modes depends highly on the begin conditions."
Training a name-variant model using historical data,"['Kemenade, J. van']","['Bloothooft, G.', 'Schraagen, M.']",2016-08-31T17:01:09Z,en,"['name variants, record linkage, multiclass classifcation']",Kunstmatige Intelligentie,"One of the main problems in the field of record linkage is the variation in names. A possible approach for dealing with this variation is to remove name variation. To remove this variation each name in the historical records has to be converted to a base form. In this study a model is presented that can convert Dutch first names to their base form. To build this model a subset of a dataset containing 132.140 first names and their base form will be used to train three different multiclass classifiers: k Nearest Neighbours, Boosted Decision Trees and Support Vector Machines. Each of the classifiers is compared on accuracy, training time and classification speed. The best performing classifier, a boosted decision tree, is then selected for training and testing on the entire dataset. The final model is a boosted decision tree with a learning rate of 1.0 and 200 decision trees with a maximum depth of 17 levels. The validation error of the model, using 10-fold cross validation, is 84.56%. The accuracy of the final model on the test set, containing 24.576 names and 447 base forms, is 85.04% with a classification speed of more than 300 samples per second."
Van der Waals interactions and microstructural changes in cellulose microfibrils dispersions,"['Klik, C.']","['Velikov, K.P.', 'Kuijk, A.', 'Imhof, A.']",2016-09-01T17:00:27Z,en,[],Natuur- en Sterrenkunde,"Acetobacter xylinum bacteria can use as much as half the energy available to them spinning cellulose fibrils to create a biofilm. The material produced by these bacteria can be deagglomerized, after which the cellulose microfibrils are a good case study of semiflexible fiberlike colloidal particles, which have attracting interactions.
The microfibrils were studied in mixtures of water and glycerol. By measuring the turbidity of microfibril suspensions, the dispersion relation for cellulose was determined, and found to match literature values reasonably well.
The van der Waals free energy was calculated for parallel fibrils in mixtures of glycerol and water. The difference in aggregation caused by the stronger interaction in water and the weaker interaction in glycerol was studied.
By means of transmission spectroscopy and confocal microscopy, microstructural changes due to van der Waals forces were studied. An increase in the turbidity of the samples was measured and attributed to aggregation of microfibrils. In images taken with a confocal microscope, a change of homogeneity of the network of fibrils was observed, when left untouched for several weeks.
It was concluded it is likely the microfibrils were in fact aggregating due to van der Waals interactions over a period of several weeks."
