title,authors,supervisors,date,language,keywords,program,abstract
Iwaniec's Conjecture on The Beurling-Ahlfors Transform,"['Nieraeth, Z.']","['Ban, E.P. van den', 'Veraar, M.C.']",2016-09-01T17:00:37Z,en,"[""Iwaniec, Iwaniec's Conjecture, Beurling-Ahlfors transform, Hilbert transform, Riesz transform, Quasiconformal, Quasiconvex, Rank-one convex, Morrey's problem, Morrey's conjecture, Burkholder, Burkholder functional""]",Mathematical Sciences,"Inspired by Astala, Iwaniec, Prause and Saksman's partial result of Morrey's problem regarding rank-one convex and quasiconvex functions on the functionals from Burkholder's martingale theory, we discuss and relate several open problems in different fields of mathematics. In particular, we discuss the theory of Calder\'{o}n and Zygmund regarding the $L^p$-boundedness of the Beurling-Ahlfors transform $\mathscr{B}$ for $1&lt;p&lt;\infty$ to formulate Iwaniec's conjecture regarding the precise operator norms of $\mathscr{B}$. Moreover, we discuss its consequences in the theory of quasiconformal mappings. Finally, we discuss the notions of rank-one convexity and quasiconvexity, motivated by their role in the theory of calculus of variations, and show how a positive answer to Morrey's conjecture implies quasiconvexity of the Burkholder functional, which, in turn, is shown to imply Iwaniec's conjecture."
Applying Level Based Analysis to Optimal Mixing Evolutionary Algorithms.,"['Hoog, I.D. van der']","['Thierens, Dirk']",2016-09-01T17:00:34Z,en_US,"['GOMEA, EA, evolutionary, level, based, theorem']",Wiskunde,"In recent years a new variant of Drift Analysis was introduced in the field of computational complexity
called Level Based Analysis. The Level Based Analysis provides a one-size-fits-all framework
to analyze Evolutionary Algorithms. This paper analyzes how the Level Based Theorem works and
applies it to GOMEA algorithms to get upper bounds on their computational time complexity. The
Univariate GOMEA algorithm will be analyzed on the Onemax domain using the Level Based Theorem
and more traditional methods. This paper will compare the use and bounds of the Level Based
Analysis with these more traditional methods and supply loose upper bounds for more GOMEA
algorithms on different domains as benchmarks for future work."
Extremal graphs and the Erdős-Stone-Simonovits theorems,"['Widdershoven, C.']","['Müller, T.']",2016-09-01T17:00:34Z,en,['extremal graph; Erdős-Stone-Simonovits; Erdős-Stone; graph theory'],Wiskunde,"The Erdős-Stone-Simonovits theorems say that any graph F can be embedded in
any graph G when G has a sufficient amount of vertices and edges. We will discuss
some extremal problems and look at the Turán numbers of triangles, quadrilater-
als and some other graphs leading up to the proof of the Erdős-Stone-Simonovits
theorems."
Seismic oceanography; A tomographic reconstruction of a two-dimensional flowing medium,"['Steen, J.E. van']","['Leeuwen, Tristan van']",2016-09-01T17:00:35Z,en,[],Wiskunde & Toepassingen,
Tetrahedral triangulations of the sphere,"['Huijben, J.']","['Beukers, F.']",2016-09-01T17:00:35Z,en,[],Wiskunde,
"Samen opvoeden in de gemeente Barneveld!? 
Een explorerend onderzoek om de Pedagogische Civil Society in de gemeente Barneveld in kaart te brengen","['Bakker, L.', 'Bos, K.E. van den', 'Burgers, R.J.', 'Damen, R.L.']","['Horjus, B.']",2016-09-02T17:01:02Z,nl,['Pedagogische Civil Society (PCS); gedeelde opvoedingsverantwoordelijkheid; opvoedsteun; ontmoetingsplekken; sociaal klimaat.'],Pedagogische Wetenschappen,"Nederlands:
Samenvatting
Dit onderzoek richt zich op de vraag wat de ervaringen van ouders in de gemeente Barneveld zijn met de Pedagogische Civil Society (PCS). Ervaringen zijn onderverdeeld in vier constructen die tezamen de PCS vormen: het openstaan voor gedeelde opvoedingsverantwoordelijkheid, het geven en ontvangen van opvoedsteun, de ontmoetingsplekken in de buurt en de visie op het sociaal klimaat in de buurt.
Data is verzameld via een kwantitatieve vragenlijst die ingevuld is door ouders met thuiswonende kinderen tot 18 in de gemeente Barneveld (N=357).
Uit de resultaten komt naar voren dat respondenten ambivalent zijn in het betrekken van andere personen bij de opvoeding. Religieuze respondenten lijken meer open te staan voor het delen van opvoedingsverantwoordelijkheid. Daarnaast geven bijna alle respondenten aan dat ze zowel opvoedsteun geven als ontvangen. Informele steun komt voornamelijk van eigen ouders in tegenstelling tot formele steun die voornamelijk vanuit school gegeven wordt. De meeste respondenten ontmoeten elkaar op speelpleinen in de directe nabijheid van hun huis. Daarnaast geven de meeste respondenten aan dat ze een positief sociaal klimaat ervaren in hun buurt. Concluderend lijkt het erop dat de basisvoorwaarden voor PCS aanwezig zijn in de gemeente Barneveld, maar dat deze uitgebreid en versterkt kunnen worden. 
Trefwoorden: Pedagogische Civil Society (PCS), gedeelde opvoedingsverantwoordelijkheid, opvoedsteun, ontmoetingsplekken, sociaal klimaat.

Engels:
Abstract
The current study explores to which extent respondents experience the Pedagogical Civil Society (PCS) in the municipality Barneveld. Respondents experiences are divided in four constructs that characterize PCS: Their willingness to share parenting responsibility, give and receive parenting support, meeting points in the area and social climate in their neighbourhood. Data was collected through a quantitative survey (N=357) by the municipality Barneveld. Results show respondents in Barneveld are ambivalent about involving others in childrearing practices, religious respondents seem to be more positive to share parenting responsibility. Almost all respondents indicate they both receive and give parenting support. Most informal parenting support is received from their own parents as opposed to formal support, which mostly comes from school. Most respondents meet each other at playgrounds in the direct vicinity of their residents. Respondents indicate they experience a positive social climate. In conclusion it seems the basics of PCS are met but could be expanded and strengthened.  
Keywords: Pedagogical Civil Society (PCS), shared parenting responsibility, parenting support, meeting points, social climate."
"Bindende banden versterken of overbruggende banden creëren?
Pedagogische Civil Society en interetnisch contact in Culemborg","['Abrol, P.', 'Bolwijn, F.', 'Heijden, I. van der', 'Maas, S.']","['Horjus, B.']",2016-09-02T17:01:01Z,nl,"['Pedagogische Civil Society, bindend sociaal kapitaal, overbruggend sociaal kapitaal, vooroordelen, Kom je bij me spelen.']",Pedagogische Wetenschappen,"The importance of the Pedagogical Civil Society [PCS] has been an important focus of recent policymaking in the Netherlands. However, the application of this principle in ethnically diverse communities is a challenge. This thesis describes the role of the PCS when it comes to bridging and bonding social capital; contacts between and within ethnic groups in Culemborg. To gather data semi-structured interviews among 13 parents and online surveys among 100 parents are used. Important findings are that the current PCS and interethnic contacts are existent. Choosing whom to consult in rearing practices depends on lifestyle rather than ethnicity. Although there are obstacles regarding interethnic contacts; potential prejudice towards other groups is one in particular. Finally, the possibility of the implication of the programme Kom je bij me spelen, which aims to encourage interethnic contacts via children is evaluated. Parents seem to be willing to participate in the programme, though spatial segregation may be a barrier."
Kunnen Kinderen Rekenen op hun Taalvaardigheid bij het Maken van Rekensommen?,"['Ameide, L. van', 'Bouter, A.E.', 'Oppeneer, A.W.', 'Vlemmings, C.M.']","['Rijt, B. van de']",2016-09-02T17:01:01Z,nl,"['Taalvaardigheid, rekenvaardigheid, technische leesvaardigheid, spelling, woordenschat, UGT-R, Cito']",Pedagogische Wetenschappen,"Doel. Uit diverse onderzoeken is gebleken dat er een relatie is tussen de taal- en rekenvaardigheid. Het is echter onduidelijk welke deelaspecten van de taalvaardigheid een effect hebben op de rekenvaardigheid bij kinderen. In dit onderzoek is het effect van de deelvaardigheden technische leesvaardigheid, spelling en woordenschat op de rekenvaardigheid onderzocht. Methode. Middels de UGT-R, Cito Rekenen, DMT, Cito Spelling en Cito Woordenschat, is deze relatie onderzocht bij 111 kinderen uit groep 3. Resultaten. Tussen de UGT-R en Cito Rekenen bestaat een zwak, positief verband. Het verband tussen technische leesvaardigheid en rekenvaardigheid is zwak en positief. Daarnaast is een zwak, positief verband gevonden tussen de Cito Spelling-scores en Cito Rekenen-scores. De relatie tussen de Cito Spelling-scores en de UGT-R is niet significant. Eveneens is een matig, positief verband tussen woordenschat en de UGT-R-scores en een sterk, positief verband tussen woordenschat en Cito Rekenen gevonden. De factoren sekse, nationaliteit en geboortevolgorde hebben geen significant effect op technische leesvaardigheid en spelling. Technische leesvaardigheid, spelling en woordenschat verklaren 30.9% van de variantie op de UGT-R, en 55.6% van de variantie op de Cito Rekenen. Conclusie. Tussen de reken- en taalvaardigheid bestaat een positieve relatie. Bij het ontwikkelen van interventies voor rekenproblemen is het van belang ook rekening te houden met de taalontwikkeling van kinderen."
Sociaal-demografische Gegevens van Ouders en Risico op Kindermishandeling bij Peuters,"['Bekkering, C.I.V.', 'Damen, M.M.W.', 'Kurt, N.', 'Moerkerk, A.C.J. van']","['Heide, A. ter', 'Dominik, A.']",2016-09-02T17:01:02Z,nl,['Child abuse; child safety; parent socio-demographic data; toddlers'],Pedagogische Wetenschappen,"Introduction. The current study examined whether parent socio-demographic data (education, employment, income and neighborhood) differed for the risk on child maltreatment (physical, emotional, and sexual abuse and neglect). The aim of this study is to contribute to existing theories about potential risk factors and the prevalence of child maltreatment in toddlers. It is shown that child maltreatment has negative consequences for the health and development of toddlers. An elevated risk on child maltreatment was expected when parents have a poor education, are unemployed, have a low income or reside in a disadvantaged neighborhood. Method. Two questionnaires were filled out by parents or playschool and early education center employees about toddlers (n=250). MAN(C)OVA’s were used to examine the research questions. Results. Mothers with poor education have a higher risk on child maltreatment and neglect than mothers with medium and high education. Unemployed fathers have a higher risk on emotional abuse. Conclusion. The current research has shown that not all parent socio-demographic data play an important role in the risk for child maltreatment. Because this is partly in contrast with earlier research, more research is needed on this subject."
"Werken na detentie: waar een wil is, is een weg?","['Bevelander, W.J.']","['Lippényi, Z.', 'Frey, V.C.']",2016-09-02T17:00:58Z,nl,[],Actuele sociale vraagstukken,"In dit onderzoek is getracht te achterhalen of gedetineerden gemotiveerd zijn om te werken na detentie en welke factoren hierop van invloed zijn. De onderzoeksvraag is:  ‘In hoeverre zijn gedetineerden in een Nederlandse Penitentiaire Inrichting gemotiveerd om werk te zoeken en welke factoren beïnvloeden hun motivatie om te werken?’. Het doel van dit onderzoek was om meer kennis te verkrijgen en duidelijkheid te verschaffen over de factoren die bijdragen aan de motivatie van gedetineerden om werk te zoeken na detentie. Tevens zijn er beleidsaanbevelingen gedaan omtrent hoe gedetineerden gemotiveerd kunnen worden om werk te zoeken. Om de hoofdvraag te kunnen beantwoorden heeft er allereerst een literatuurstudie plaatsgevonden. De factoren menselijk kapitaal, sociaal kapitaal, cognitieve transformatie, stigma en turning points zijn op basis van de literatuur als leidraad voor dit onderzoek genomen. Vervolgens hebben er 18 diepte-interviews met mannelijke gedetineerden plaatsgevonden in de PI Nieuwegein. Deze semi-gestructureerde interviews zijn de belangrijkste methode van dataverzameling voor dit onderzoek. Geconcludeerd is dat er wisselend gedacht wordt over werken na detentie. Een groot deel van de gedetineerden, dus niet iedereen, is gemotiveerd om werk te zoeken. Een opvallende bevinding was dat door eerdere werkervaring en detentie (als turning point) veel gedetineerden onafhankelijkheid en zelfstandigheid zoeken. Dit motiveert hen om een eigen onderneming op te zetten. Daarnaast zoeken gedetineerden een houvast in werk, dat hen zal beschermen tegen het terugvallen in criminele activiteiten. Familie en vrienden blijken een belangrijke hulpbron te zijn en motivators voor het zoeken naar een baan. Een andere opvallende bevinding was dat gedetineerden (toekomstige) stigma kunnen omzetten naar een wil om te werken. Ook kwam uit het onderzoek naar voren dat gedetineerden kunnen anticiperen op toekomstige turning points (het krijgen van een kind of trouwen), wat maakt dat zij willen werken wanneer dat gebeurt. Demotiverende factoren zijn onder andere de eis van een VOG die zij niet kunnen leveren en gemiste werkervaring (gat op het CV)."
Psychische problemen van peuters en het risico op kindermishandeling,"['Badenbroek, K.', 'Kempen, L.M. van', 'Krabbendam, N.E.', 'Lochem, F. van']","['Heide, A.L. ter', 'Dominik, A.']",2016-09-02T17:01:01Z,nl,"['child abuse, child safety, psychological problems, toddlers']",Pedagogische Wetenschappen,"Introduction. Toddlers are a vulnerable population for child abuse. The present study examines the relationship between psychological problems in toddlers and the risk for child abuse. Insight in this relation can help in the prevention and early detection of child maltreatment. The focus is on emotional problems, behaviour problems, hyperactivity- and attention problems and social problems. The definition of child abuse is divided in physical abuse, sexual abuse, emotional abuse and neglect. It was expected that psychological problems in toddlers increase the risk for child maltreatment. Method. Data from several questionnaires was used for the present study. A total of 295 participants in the ages of 2-4 years old from 60 locations of early education centres in Utrecht, the Netherlands, participated in this study. Lineair regression analyses have been used to examine the relationship between the concepts psychological problems and child maltreatment. Results. All kinds of psychological problems tested in this study were positively associated with a higher risk of neglect and emotional maltreatment. Due to constant scores on the variables sexual and physical maltreatment, no judgment could be made about this forms of abuse. Conclusion. This research is of added value because more attention will be given to children with psychological problems in the future. As such, their higher risk for maltreatment can be reduced or even prevented. Suggestions for future research and limitations are discussed."
"Samen koersen naar Passend Onderwijs:
Knelpunten in de samenwerking binnen een samenwerkingsverband","['Abrahamse, J.W.', 'Geertse, L.M.', 'Piepers, E.M.G.']","['Tijsseling, C.', 'Sieckelinck, S.']",2016-09-02T17:01:00Z,nl,['Passend Onderwijs; samenwerkingsverband; collaboration; case-study'],Pedagogische Wetenschappen,"Background: On the 1st of August 2014, the policy ‘Passend Onderwijs’ set course in the Netherlands, bound for integrating pupils with special educational needs in regular educational settings as much as possible. This is arranged by so-called ‘samenwerkingsverbanden’ (SWV’s), collaborations in which schools are working together to fulfill their duty of taking care of pupils with special needs. Objective: The aim of this study is to detect bottlenecks in the collaboration between professionals in SWV’s in order to improve the functioning of these collaborations and therefore the functioning of the policy ‘Passend Onderwijs’. Method: In this case-study, 12 professionals of one SWV in the Netherlands were interviewed in depth about their views on three aspects of the collaboration of their SWV, namely: Shared beliefs, policy and communication. Results: The main bottlenecks of the SWV under scrutiny were lack of time and discrepancy between interests. Conclusions: This study underlines the importance of collaboration in the SWV in the functioning of the policy ‘Passend Onderwijs’. If the professionals in the SWV consider the bottlenecks in the collaboration, by being aware of and respecting each other’s interests and points of view, ‘Passend Onderwijs’ could become succesful."
Lezen en begrijpen: een onderzoek naar de begrijpelijkheid van informatieve teksten voor de basisschool,"['Vreede, A.G. de']","['Evers-Vermeul, J.']",2016-09-02T17:00:53Z,nl,[],Nederlandse taal en cultuur,
Invloed op taal-specifieke uitspraak en wijze van testafname op non-woord herhaling,"['Papenborg, R.A.', 'Koot, L.', 'Boon, L.M.C.', 'Custers, V.A.']","['Blom, E.', 'Baar, A. van']",2016-09-05T17:01:05Z,nl,"['Verbaal kortetermijngeheugen, non-woord herhaling, Non-Woord Repetitie Taak, Quasi-Universele Non-Woord Repitie Taak, taal-specifieke uitspraak, visuele representatie']",Pedagogische Wetenschappen,"Inleiding. Eén van meest gebruikte tests om het verbaal kortetermijngeheugen te meten zijn Non-Woord Repetitie Taken (NWRT). Bij een NWRT moeten kinderen niet-bestaande woorden herhalen die ze nog niet eerder gehoord hebben. Toch hebben verschillende onderzoeken aangetoond dat non-woord herhaling wordt beïnvloed door taalervaring. Daarnaast kan non-woord herhaling beïnvloed worden door de wijze van testafname. In deze studie wordt de invloed van taal-specifieke uitspraak en visuele representatie op de non-woordherhaling onderzocht bij eentalige Nederlandse kinderen tussen de 4 en 6 jaar. Methode. Aan het onderzoek hebben 120 eentalige Nederlandse kinderen met een normale ontwikkeling in de leeftijd van vier tot en met zes jaar deelgenomen. Om de non-woord herhaling te meten is de Quasi-Universele Non-woord repetitietaak (Q-U NWRT) afgenomen. In dit onderzoek is een between-subject design gebruikt waarbij elke groep is getest met één van de vier versies van de Q-U NWRT: (a) de Nederlandse alienversie, (b) de Engelse alienversie, (c) de Nederlandse kralenversie en (d) de Engelse kralenversie. Resultaten. De groep met de Nederlandse versie van de Q-U NWRT scoort significant hoger op de Q-U NWRT dan de groep met de Engelse versie. Daarnaast scoort de groep met de kralenversie significant hoger op de Q-U NWRT dan de groep met alienversie. Conclusie. De factoren taal-specifieke uitspraak en visuele representatie lijken invloed te hebben op non-woord herhaling. Kinderen scoren hoger op de Q-U NWRT wanneer deze is afgenomen in de moedertaal van het kind en wanneer de kralen- in plaats van de alienversie is gebruikt."
Measuring the effect of gamification on user adoption of a software application,"['Dool, P. van den']","['Dalpiaz, F.', 'Houtkamp, J.M.']",2016-09-05T17:01:10Z,en,"['gamification, user adoption, artifact design, omgevingsdashboard, self-determination, motivation']",Business Informatics,"The focus of this research is on the intersection of user adoption and gamification. User adoption is important for both developers and buyers of new technologies, and it is a complex problem that involves many variables. A promising and relatively new way to increase user adoption is gamification, which is expected to increase user engagement and participation. Conventional wisdom tells that gamification affects user adoption via user motivation.

To be able to effectively influence user adoption via gamification, it is important to know if and how gamification can influence the motivation of users. There are few scientific studies that focus on this exact problem, and its underlying principles. Therefore, the goal of this research is to investigate the underlying motivational principles that play a role when using gamified software applications. Another goal is to discover how to implement gamification in a software application to increase user adoption.

The research approach includes assembling a conceptual model, on the basis of literature about user adoption, motivation and gamification. Next, we develop a strategy to implement gamification to increase identified regulation (a form of motivation) in users. Based on this strategy, we implement a gamified mockup version of an existing software application in Axure RP. We also develop a control mockup version of the application without game elements. The designs are evaluated in two ways: (i) interviews with experts from the fields user experience, psychology and communication, and game design; (ii) through a controlled experiment that measures the attitude and beliefs of participants after using one of the mockup applications.

The findings in literature suggest that using game elements other than points, badges, and leaderboards (PBL) could lead to a more sustainable kind of user motivation. However, the results of the controlled experiment show no significant effect of the gamification implementation on user adoption or the underlying variables we hypothesized to be influenced. The experts find the gamified application to be more suitable (than the control version) for onboarding new users of the application.

The main conclusions from this research are that the way gamification was implemented in this research does not lead to higher identified regulation, and higher hedonic motivation, and has no effect on intention to use, nor intention to recommend the application. However, the expert interviews lead to several recommendations for developers of gamified applications.

This thesis recommends to first thoroughly investigate the goal of the application, and based on that to devise a strategy on how to implement gamification to support this goal. An additional recommendation is to implement one or more elements that support the user in the transition into a game mindset."
De Sportstimulering van Adolescente Meiden binnen het Gemeentelijk Netwerk Amersfoort,"['Klap, E.', 'Bruintjes, E.C.']","['Baerveldt, C.', 'Horjus, B.']",2016-09-05T17:01:01Z,nl,"['Sportgedrag, adolescenten, meiden, sportaanbod, interventies, Amersfoort']",Pedagogische Wetenschappen,"Uit literatuurstudie blijkt dat het sportgedrag van meiden sterk afneemt wanneer zij in de adolescentiefase komen. Naar aanleiding daarvan is binnen het gemeentelijk netwerk in Amersfoort onderzocht wat er bekend is over de afname in sportgedrag van meiden, hoe het sportaanbod is vormgegeven, wat knelpunten zijn in het sportaanbod en hoe het aanbod beter kan aansluiten bij de behoefte van adolescente meiden. Er zijn elf semigestructureerde interviews afgenomen bij informanten binnen het gemeentelijk jeugdnetwerk in Amersfoort. Er blijken verschillende perspectieven te zijn op het sportgedrag van adolescente meiden. Sommige informanten zien een afname van sportgedrag van meiden in de praktijk, andere zagen dit niet. Er wordt in de gemeente zoveel mogelijk vraaggericht sportaanbod georganiseerd, door het aanbieden van flexibele lidmaatschappen, tijden en trainingen of speciale meidenteams op te richten. Belangrijke knelpunten zijn moedeloosheid onder professionals, toegang tot sportaanbod en geen zicht op adolescente die niet sporten en niet bekend zijn bij de hulpverlening vanuit het beleidsniveau. Verbeteringen zijn intrinsieke motivatie stimuleren door middel van sociale media, voorlichting geven over gezondheid, toegang tot sport verbeteren door iemand die de meiden de weg wijst, bestaande interventies uitbreiden en aanpassing van de vormgeving van het sportaanbod door flexibele trainingstijden. Er kan geconcludeerd worden dat er in de gemeente Amersfoort al veel gedaan wordt aan sportstimulering. Om de knelpunten te reduceren en verbeteringen door te voeren zal er onderzoek gedaan moeten worden naar de omvang van het probleem. Zo kan de doelgroep zichtbaar worden en kan er passend sportaanbod gecreëerd worden. Twee aanbevelingen zijn gedaan, namelijk gendergescheiden sport aanbieden en het werken vanuit een communitybenadering voor het vergroten van de effectiviteit van interventies."
