title,authors,supervisors,date,language,keywords,program,abstract
The Vassiliev invariant of degree 2 as a tool to study protein structure,"['Reyes Soto, X.']","['van der Veen, R. I.']",2019-01-22T18:01:05Z,en,"['Knot Theory, Alexander Poylnomial, Vassiliev invariant of degree 2, Tangle, Protein, Mathematical Biology']",Mathematical Sciences,"Knot theory refers to the mathematical study of the objects with the same name we encounter in daily life. Its main goal is to determine when two knots are equivalent. Knot invariants are tools that allow us to determine this. Results coming from knot theory have been useful to other areas of knowledge, such as chemistry, fluid dynamics and molecular biology. In my thesis, I present one of these applications to the study of protein structure. 
For this purpose, I used two knot invariants for knots: the Alexander polynomial and the Vassiliev invariant of degree 2. This is the subject of Chapter 1. I present their generalization to objects called ""tangles"" in Chapter 2. The tool that provides this generalization is the algebraic structure called ""meta-monoid"".
In Chapter 3 I include how to construct a graph of a protein from information coming from the Protein Data Bank (PDB) online repository. Also, I explain how to derive a simplified structure from which we can get a tangle. The computation of the Vassiliev invariant of degree 2 of the protein with PDB entry 1L2Y appears in Chapter 4.
The code in Python that translates the information of the PDB files into a tangle (with a graph as intermediate step) appears in Chapter 5."
De historiografische visies op de Koude Oorlog in geschiedenismethodes van 1948 tot 2017,"['Stolk, P.']","['Wansink, B.']",2019-01-22T18:01:11Z,nl,"['Schoolboekonderzoek, Koude Oorlog']",Geschiedenis: educatie en communicatie,"Deze masterscriptie voor de opleiding Educatie & Communicatie richtte zich op de representatie van de Koude Oorlog in geschiedenismethodes tussen 1948 en 2017. Over het ontstaan en de schuldvraag van de Koude Oorlog bestaan verschillende historiografische visies. De orthodoxe visie legt de schuld bij de SU, de revisionistische bij de VS, de post-revisionistische bij beide landen. Na De Koude Oorlog is daar de New Cold War history bijgekomen die het conflict veel breder trekt. De onderzoeksvraag de ten grondslag ligt aan dit onderzoek is of de methodes uit de verschillende periodes de dominante historiografische visie volgen. In totaal zijn er twaalf methodes kwalitatief onderzocht aan de hand van analysevragen over het begin van het conflict, de vormgeving van het narratief en het plaatsen van de schuld bij een specifiek land. Het onderzoek wijst uit dat dit niet het geval is. Factoren als de verzuilde achtergrond van de auteurs, de didactische invalshoek en de vormgeving van het narratief spelen hierbij een veel grotere rol. Een socialistische auteur legt de schuld bij de VS, een narratief waarbij het conflict als een reeks gebeurtenissen wordt beschreven geeft vaak een genuanceerder beeld."
Profinite Homotopy Theory,"['Blom, T.']","['Moerdijk, I.', 'Meier, L.']",2019-01-22T18:01:06Z,en,"['Pro-categories, Model structures, Homotopy theory, Profinite, Algebraic topology, Profinite spaces, Profinite groupoids']",Mathematical Sciences,"In this thesis the model structures defined by Geoffroy Horel and Gereon Quick on the categories of profinite groupoids and simplicial profinite sets, respectively, are studied. We fill in some gaps in the proofs of Geoffroy Horel and Gereon Quick, and also give a thorough treatment of pro-categories."
De relatie tussen gezinssamenstelling na echtscheiding en jeugddelinquentie.,"['Grasmeijer, D.I.', 'Ek, D. van']","['Koper, N.', 'Vries, L.A. de']",2019-02-05T18:00:56Z,nl,"['juvenile delinquency, family structure, stepparent, single-parent, transitions.']",Pedagogische Wetenschappen,"This study examined the relationship between family structure after divorce and juvenile delinquency in the Netherlands. The researches also looked at whether the adolescent's sex could affect the relationship between family structure and delinquency. It was also hypothesized that the number of transitions in family structure had an influence on juvenile delinquency. The more transitions an adolescent experiences, the higher the degree of delinquent behavior of the adolescent. A questionnaire has been used to ask students (n = 747) about their home situation and behavior. The results showed that there’s no significant result for the relationship between family structure and juvenile delinquency. There also appears to be no interaction effect with sex. However, a post hoc analysis showed that adolescents who live in both a single-parent and a stepparent family had a significant higher
degree of delinquent behavior compared to adolescents who lived in a intact family. Implicating that the number of transitions in family structure does not affect the degree of delinquent behavior. Suggestions for follow-up research are discussed."
The Cap Set Problem,"['Deutekom, W.P.']","['Schindler, D.']",2019-02-07T18:00:31Z,en,"['Cap Set, Progression-free, Pigeonhole principle, Polynomial method.']",Wiskunde,"In this paper we will take a look at bounds that are found on the cap set problem. We
will especially discuss results from the article `Progression-free sets in Z^n_4
are exponentially small' by Croot, Lev and Pach and elaborate some of the proofs in this article. Before these
specific results, we will extensively explain the idea of the cap set problem and show that
the biggest cap set in the game Set with two attributes has size four. Besides that, we will
give some background information on arithmetic progressions in different group settings.
Moreover we will discuss entropy functions, the pigeonhole principle and the polynomial
method, which play an important role in the work of Croot, Lev and Pach and the work of
Ellenberg and Gijswijt, where they solve the classical cap set problem. Lastly we will take a
look at the reasoning behind an improved construction of progression-free sets, where Elkin
improves the best lower bound that was found in 1946 by Behrend."
Zeta Functions of Multilinear Varieties,"['Feenstra, D.']","['Beukers, F.']",2019-02-07T18:00:32Z,en,['Zeta function; Rings; Field; Fields; Varieties; Multilinear; Irreducible; Reducible'],Wiskunde,This thesis is about determining the Hasse-Weil zeta function of certain multilinear varieties. These zeta functions capture all the information conveyed by a certain sequence of numbers in a power series.
Pelvimetry: the repeatability and reproducibility of the Rice pelvimeter in South-African beef cattle,"['Munck, F. de']","['Vernooij, J.C.M']",2019-02-06T18:00:30Z,en,[],Gezondheidszorg landbouwhuisdieren en vet. volksgezondheid,
In Plans and in Practice - The effectiveness of the Provincial Reconstruction Team in Baghlan,"['Barends, R.A.']","['Malcontent, Peter']",2019-02-06T18:00:24Z,en,[],International Relations in Historical Perspective,
The Role of Heat and Momentum Exchange at the Sea Surface in Radiative-Convective Equilibrium,"['Mol, W.B.']","['Delden, A. J. van', 'Heerwaarden, C. C. van']",2019-02-20T18:00:34Z,en,"['large eddy simulation, tropical climate, rcemip, radiactive convective equilibrium, surface fluxes, monin-obukhov, latent heat']",Climate Physics,"Radiative-convective equilibrium (RCE) is an idealized representation of the tropical atmosphere in which net radiative cooling fluxes are compensated by convective heat fluxes. 
In large domain RCE experiments with cloud resolving models, or coarser models, convection can show large scale spontaneous organisation referred to as 'convective self-aggregation'. 
This type of convective organisation happens despite uniform initial and boundary conditions and an absence of large scale forcing.
This phenomenon is important to understand, because it has a significant impact on the domain-mean climate.
It is not very well understood yet, partly due to generally poor agreement among model studies.
A contributor to this poor agreement is the sensitivity of convective self-aggregation to almost any model parameter.
In an attempt to further investigate this phenomenon,  a model intercomparison project, RCEMIP, has been set up; each participating modelling group performs the same experiment with their own model. 
Coarse models are not expected to accurately resolved near-surface turbulence.
One way of parametrizing the resulting underestimation of surface fluxes and prevent numerical issues in the free convection limit, is by enforcing a minimum value for the wind speed that is put into the surface layer formulation scheme.
In the proposed simulations of RCEMIP, a value of \umins = 1 m s-1 is used for models that apply this solution. 
Limited domain large eddy simulations (LES) are performed using MicroHH to see what the effect of \umins = 1 m s-1 is on the evolution of the RCE state, compared to a value closer to zero. 
We find that the majority of the domain in these experiments have winds below 1 m s-1 at any time during the 20 to 30 days of simulation.
Averaged over regions where the lowest-level wind speed is below 1 m s-1, latent heat fluxes are increased by as much as 20%.
This would mean that enforcing a minimum wind speed of 1 m s-1 reduces the flux contrast between the calm environment and convective regions, thereby reducing the strength of the surface flux feedback as a self-aggregation mechanism.
The spatial variance in the near-surface moisture field increases with a higher value for \umin, however. 
Performing the same kind of experiment, but with a set-up that would allow self-aggregation to occur, is suggested to further understand the impact of changes to the surface flux feedback mechanism."
Air-Sea Interaction in the Gulf Stream Region,"['Tsartsali, E.']","['Delden, A.J. van']",2019-02-20T18:00:34Z,en,"['gulf stream, air-sea interaction, vertical mixing mechanism, pressure adjustment mechanism, horizontal resolution impact.']",Climate Physics,"The Gulf Stream (GS) is a region with large mesoscale activity, as strong sea surface
temperature gradients and oceanic eddies are developed in the area. These mesoscale features
force the atmosphere by affecting the near surface wind. In this study, we investigate
this mesoscale air-sea interaction using several air-sea coupled configurations of the Global
Climate Models: ECMWF-IFS, HadGEM3 and MPI-ESM. The climatology and the internal
variability of variables such as sea surface temperature (SST), turbulent heat fluxes, precipitation
and near surface wind divergence are studied for the time period between 1951 and
2049.
The horizontal resolution of the oceanic component of the models seems to be determinant
factor for the accurate representation of the air-sea coupling. We find that the models
with eddy parameterized oceanic component are incapable of accurately describing several
atmospheric fields over this region. Also, only the eddy resolving oceanic component is
capable of describing correctly the separation of GS at Cape Hatteras, whereas the rest of
the configurations shift the GS path northwards. Even though the atmospheric resolution
does not seem to be important for the climatology, it is significant for the variability of many
atmospheric fields.
Next, we focus on the two main mechanisms which explain the wind response to the SST
fronts. These are: the Vertical Mixing (VMM) and Pressure Adjustment (PAM) mechanisms.
In accordance with the VMM, the destabilization of the atmosphere over the warmer SSTs
leads to intensification of the vertical mixing in the boundary layer. Thus, large momentum
from aloft is transported downwards resulting in acceleration of the near surface wind. On
the other hand, the PAM suggests that the differential heating of the atmosphere at each side
of the SST front generates pressure gradient forces. These pressure anomalies are responsible
for the convergence and divergence zones on the warm and cold flank of GS respectively.
The strength of the two aforementioned mechanisms is investigated for all the configurations.
For the VMM, we find that the coupling between the downwind SST gradients and
the wind divergence becomes stronger by increasing the resolution. However, the coupling
between the crosswind SST gradients and the wind curl is not statistically significant for all
the configurations.
Regarding the PAM, we find that the mean sea level pressure adjustment due to SST
forcing is stronger in the higher atmospheric resolution configurations. In contrast, the
coupling between the mean sea level pressure Laplacian and the wind convergence gets
slightly weaker by increasing the resolution. This fact is likely due to the large scale processes
that can contribute to the generation of secondary circulations.
For the strength of the air-sea coupling, both oceanic and atmospheric resolutions are
significant, as a too coarse atmospheric component is not capable of capturing the mesoscale
features produced by the oceanic one."
Comparing competing models of retrieval processes,"['Nederend, M.L. van het']","['Nouwen, R.W.F.']",2019-02-20T18:00:33Z,en_US,"['sentence processing, aphasia, retrieval, dependency resolution, stan, Bayesian modeling, cognitive modeling']",Artificial Intelligence,"In order to correctly parse a sentence, its underlying structure needs to be
understood. The functional task of every word in a sentence stands in relation
to other words through the notion of dependency, and the task for the person
taking in a sentence is to lay such dependency links between the word they are
currently attending and one of the previously attended words. How exactly the
chosen previously attended word is retrieved from memory is often under specified.
Therefore Nicenboim & Vasishth (2018) compared two models with each
other in terms of their power to describe the speed/accuracy trade-off of this
process. We expand on this work by using these two models with a dataset that
includes individuals with aphasia. The first model is the activation-based race
model. It assumes that resolving syntactic dependencies is related to the activation
of previously retrieved candidate dependants. When confronted with a new
item, these candidates accumulate activation over time. The dependant (and
thus, the interpretation) associated with the accumulator that first surpasses
its threshold is chosen. The second model is the direct access model which assumes
instant access to previously retrieved words. The difference in listening
times here is explained by a backtrack-and-repair process that may take place
when the initial parse is deemed incorrect. The activation-based race model is
implicitly assumes that incorrect interpretations are generally associated with
longer listening times, whereas the direct access model is ties incorrect interpretations
with shorter listening times. The resulting fits on the empirical data
show that although the data tells us that the mean listening times for all of
its cross sections are shorter for incorrect trials, the direct access model does
not perform better. Instead, the resulting fits indicate that both models have
problems fitting certain different aspects of the data."
Noether’s problem and the existence of generic polynomials,"['Tiesinga, H.G.J.']","['Beukers, prof. dr. F.', 'Cornelissen, prof. dr. G.L.M.']",2019-02-20T18:00:33Z,en,"['Galois, Noether, Inverse Galois problem, generic polynomial, parametric polynomial, quaternion group, cyclic group, dihedral group,']",Mathematical Sciences,"The main topics of this thesis are Noether’s problem and the existence of generic polynomials. These
problems are both related to the inverse Galois problem, which asks the question whether every
finite group is isomorphic to the Galois group of a Galois extension over the field of rational numbers. We solved Noether’s
problem and found generic polynomials for the subgroups of Sn for n ≤ 4 and the quaternion group
of order 8. Moreover, we established generic polyomials for the cyclic groups of odd order and
discussed their existence for some other groups such as the dihedral groups of odd order, p-groups
and Frobenius groups. We also worked out a counterexample for Noether’s problem, namely the
cyclic group of order 8."
Introducing Minkowski Normality,"['Lepper, M.R. de']","['Dajani, K.']",2019-02-20T18:00:34Z,en,"['Minkowski, normal numbers, continued fractions, ergodic theory, Kepler tree']",Mathematical Sciences,"We introduce the concept of Minkowski normality; a new type of normality that is related to the continued fraction expansion. Moreover, we use the ordering of rationals that is obtained from the Kepler tree to show that the sequence
1/2, 1/3 , 2/3, 1/4, 3/4, 2/5, 3/5, 1/5, ,···
can be used to give a concrete construction of an infinite continued fraction expansion of which the digits are distributed according to the Minkowski question mark measure. We define an explicit correspondence between continued fraction expansions and binary codes to show that we can use the dyadic Champernowne number to prove normality of the constructed number. Furthermore we provide a generalised construction that is based on the underlying structure of the Kepler tree. This generalisation shows that any construction that concatenates the continued fraction expansions of all rationals, ordered increasingly, based on the sum of the digits of their continued fraction expansion, results in a number that is Minkowski normal."
Optimal routing of cables in order to upgrade the copper network,"['Jonker, M.A.']","['Bisseling, R.H.']",2019-02-20T18:00:35Z,en,[],Mathematical Sciences,
Embodied en Enactive Spectatorship; de fysieke adressering van de toeschouwer als bron van betekenisgeving in voorstellingen,"['Okhuijsen, A.']","['Merx, S.']",2019-03-05T18:00:38Z,nl,"['Embodied Spectatorship, Enactive Spectatorship, Fysieke adressering, Betekenisgeving']",Media en cultuur,"De voorstellingen In Many Hands en Phobiarama zijn voorbeelden van een ontwikkeling binnen het hedendaagse theater, waarbij de grens tussen het podium en het auditorium vervaagt. In dit onderzoek zoom ik in op de fysieke adressering van de toeschouwer en de rol in het proces van betekenisgeving.  Aan de hand van een dramaturgische voorstellingsanalyse geef ik antwoord op de vraag: op wat voor manier speelt de fysieke adressering van de toeschouwer een rol in het proces van betekenisgeving in de voorstellingen In Many Hands van Kate McIntosh en Phobiarama van Dries Verhoeven. 

Om de wisselwerking tussen de voorstellingen, de toeschouwer en het proces van betekenisgeving te kunnen onderzoeken ga ik eerst in op het concept ‘spectatorship’. Vervolgens ga ik in op de concepten ‘embodied’ en ‘enactive spectatorship’. De notie van deze concepten vestigt de aandacht op het lichaam van de toeschouwer. Het lichaam is constant actief en fysiek aan het handelen om tot een coherente waarneming van de werkelijkheid te komen. Daarbij is het waarnemen van een voorstelling ook een actieve handeling, waarbij de toeschouwer actief zintuigelijke impulsen verwerkt. Tegelijkertijd is de toeschouwer bezig zich actief te verhouden tot de betekenissen die gegenereerd worden in een voorstelling. 

In Many Hands biedt de toeschouwer de tijd en ruimte om in te zoomen op de materialiteit van verschillende objecten. De toeschouwer wordt uitgenodigd om via een fysieke expeditie, de performance wereld om haar heen actief te verkennen. Daarbij stuurt het adresseren van de zintuigen (zicht, reuk, tast en gehoor) aan op een gevoel van rust, verbinding, nabijheid en intimiteit. Door naast de materialiteit van de objecten, weinig informatie te tonen, kan de bezoeker in alle rust de wereld om haar heen aftasten, ontdekken en verkennen. Het lichaam van de toeschouwer wordt geadresseerd als een handelend medium, waarin de beweging van de toeschouwer leidend is voor haar eigen ervaring.  

Phobiarama plaatst de bezoeker, via een op het spookhuis geïnspireerde lichamelijke ervaring, in een wereld van angst, vervreemding en zelfreflectie. In plaats van in te zoomen op details van specifieke objecten, vliegen de auditieve en visuele prikkels de toeschouwer om de oren. De toeschouwer wordt dusdanig gebombardeerd met informatieve prikkels, dat de toeschouwer overspoeld wordt met sensaties en vragen in plaats van dat zij de tijd heeft om een coherente werkelijkheid te construeren. Het lichaam is in Phobiarama veel meer in de greep van sensaties en prikkels en overgeleverd aan de situatie en de emoties die het met zich mee brengt. In Phobiarama wordt het lichaam meer als een receptor van impulsen geadresseerd, waarin het lichaam zelf niet in staat is om daarin actieve keuzes te maken."
Sympathieverdeling in Captain America: Civil War,"['Huisman, T.A.']","['Pafort-Overduin, C.']",2019-03-05T18:00:37Z,nl,"['Marvel, Structure of Sympathy, Recogniton, Alignment, Allegiance, Murray Smith, Cognitieve Filmtheorie, Captain America: Civil War, Iron Man, Transmedia Storytelling, Primacy Effect, Marvel Studios']",Media en cultuur,"In dit onderzoek is geanalyseerd hoe in de Marvel Studios film Captain America: Civil War sympathie gecreëerd werd voor de personages Steve Rogers en Tony Stark. Hierbij is ook onderzocht of één van de twee personages een bevoorrechte positie heeft gekregen. Dit onderzoek werd uitgevoerd met behulp van het analysemodel the structure of sympathy van Murray Smith, en de drie kernconcepten van deze methode: recognition, allignment, en allegiance. Ik heb hiermee de constructie van de personages besproken (recogniton), de verhouding tussen de toeschouwer en de personages (alignment), en de morele en ideologische evaluatie van een personage door de toeschouwer (allegiance). Steve Rogers heeft op het niveau van recognition een voordeel, wegens zijn traditie van het maken van moreel juiste keuzes. Alignment was verdeeld, want er was meer subjective access voor Tony Stark, maar meer spatio-temporal attachment voor Steve Rogers. Allegiance is iets complexer. Beide personages presenteren duidelijk een verschillende kant binnen het conflict, waardoor er aanvankelijk een heldere moral resolution is. Tegen het einde van de film wordt dit onduidelijker, wanneer Tony tegen zijn eigen standpunten in gaat. Tevens zwakt hij dan de moral centre af, door te besluiten wraak te nemen op Bucky wegens de moord op zijn ouders. Steve heeft dan een voordeel doordat hij gerechtigheid zoekt, en de schuld voor de moord bij opdrachtgever HYDRA zoekt. Uiteindelijk wint Steve het conflict over de akkoorden en de vrijheid van Bucky, maar het superheldenteam valt alsnog uit elkaar. Hierdoor is de slechterik Zemo de echte winnaar in de film, omdat hij slaagt in het opbreken van de Avengers."
The Hamilton Mixtape. Hoe muziekstijlen in Hamilton ingezet worden om personages te karakteriseren.,"['Driessen, M.L.']","['Groot Nibbelink, L.W.']",2019-03-05T18:00:37Z,nl,"['musical, theater, Hamilton, muziek, muziekstijl, voorstellingsanalyse, karakterisering']",Media en cultuur,"Op 6 augustus 2015 opende Hamilton: An American Musical op Broadway in New York. De musical vertelt door middel van verschillende muziekstijlen het verhaal van Alexander Hamilton. Hij was een van de Founding Fathers van Amerika en vocht samen met andere revolutionairen zoals George Washington tegen de Britse koning George III voor de vrijheid van zijn land tijdens de onafhankelijkheidsoorlog. Het bijzondere aan deze musical is dat er gebruik wordt gemaakt van zeer veel verschillende muziekstijlen, zoals hiphop, Britpop en R&B. 
Dit Bachelor-Eindwerkstuk demonstreert hoe muziekstijlen in de musical Hamilton ingezet worden om de personages Alexander Hamilton, King George III en Elizabeth Schuyler-Hamilton te karakteriseren. Deze personages maken namelijk elk gebruik van een van de bovengenoemde stijlen. Hamilton maakt vooral gebruik van hiphop en rap, King George zingt alleen maar British Invasion en Britpop en Eliza uit zich vooral in R&B. In dit onderzoek ga ik na welke culturele associaties horen bij deze muziekstijlen. Vervolgens toon ik middels structurele voorstellingsanalyse aan dat deze associaties bijdragen aan de karakterisering van de personages en hun onderlinge relaties. Tot slot ga ik in op de consequenties die deze karakterisering heeft voor de interpretaties van de personages, hun relaties en de musical.
Uiteindelijk concludeer ik dat de muziekstijlen niet zelf de karakterisering inzetten, maar deze wel versterken. De personages zouden namelijk op een heel andere manier geïnterpreteerd worden als ze in andere muziekstijlen zouden zingen. Het onderzoek toont dus dat de muziekdramaturgie van Hamilton heel gedegen in elkaar zit. De culturele associaties met de muziekstijlen zijn goed te betrekken op de musical en de personages, waardoor de personages en hun relaties een muziekdramaturgische bedding krijgen. De muziekstijlen brengen dus extra lagen in de verhoudingen en geven diepgang aan de musical."
