title,authors,supervisors,date,language,keywords,program,abstract
Why the current debate on (merely) verbal disputes is uninformative and unnecessary,"['Dronkers, D.']","['Cohnitz, D.']",2017-02-16T18:03:22Z,en,"['verbal disputes, philosophy of language, metaphilosophy']",Philosophy,"In this thesis, I critically examine the current philosophical debate on (merely) verbal disputes. In particular, texts by Carrie Jenkins, David Chalmers, and Eli Hirsch are discussed. It is found that the two purposes of the debate, according to the participants, are (1) to separate 'deep' ontology (which revolves around 'real' differences) from 'shallow' ontology (in which nothing substantial is at stake), and (2) to provide insights into key notions in the philosophy of language (e.g. language, meaning). It is also found that all the participants to the debate use the same procedure to reach their conclusions. It is argued that the combinations of these particular purposes and this particular procedure renders the whole debate uninformative (in the sense that the procedure adds nothing to its input that is relevant for the purposes of the debate) and unnecessary (in the sense that one can already fulfil the purposes of the debate on the basis of the input alone, without applying the procedure)."
Tussen wens en werkelijkheid. Een onderzoek naar het voortschrijdend inzicht van de Nederlandse beleidsmakers in de ISAF-missie naar Uruzgan (2006-2010).,"['Hahn, J.A.']","['Grift, L. van de']",2017-02-16T18:03:25Z,nl,[],International Relations in Historical Perspective,
The Euler totient function in short intervals,"['Overbeeke, T.M. van']","['Cornelissen, G.L.M.']",2017-02-22T18:20:51Z,en,"['Analytic Number Theory, Representation theory, Random matrix theory, Dirichlet characters, Finite field, Intervals, Short intervals, Euler, totient function, variance']",Mathematical Sciences,"It is known that the two rings Z and Fq[T] have a lot of similar properties. Here Fq[T] denotes the polynomial ring over the ?finite ?field Fq of q elements. In 2014 Keating and Rudnick developed a new technique for calculating the variance of functions in short intervals in Fq[T]. In this thesis we study this technique and apply it to the von Mangoldt function, as Keating and Rudnick did to prove a result analogous to a theorem in Z, due to Goldston and Montgomery. We then apply this technique to the Euler totient function to arrive at some new results concerning its variance in short intervals in Fq[T]. Finally we turn our attention to the Euler totient function in short intervals in Z. Surprisingly, it turns out that the analogue to the statement in Fq[T] does not hold."
Individualized Smile Detection Using Transfer Learning,"['Becht, I.G.']","['Poppe, R.W.']",2017-02-22T18:20:52Z,en,[],Game and Media Technology,"In current machine learning approaches to visual smile detection the training data generally
consists of a variety of different faces displaying a smile or neutral expression, and the
target data introduces a new face to classify. Although this approach has shown promising
results towards correctly classifying the newly introduced target face, we believe that
performance can be improved by acknowledging that there are differences in smile-styles
and facial differences throughout the training process. In this research we aim to do so by
applying transfer learning. This entails first training a classifier on a data set showing a
wide variety of smiling and non-smiling faces, as is the general approach. Afterwards we
apply transfer learning, by means of an Adaptive SVM, where a small number of labeled
instances from the target face is provided as to make the classifier more specific to the target
face. To make transfer learning effective we use low-level geometric features which we
expect to capture the difference between smiles and no-smile in a variety of different faces
and smile styles.
We evaluate our approach by comparing performance against alternative strategies. We
find that using a traditional classifier trained on an aggregated data set containing the general
and target data outperforms our baseline and our suggested transfer learning approach
for each of the test videos. A big problem for the transfer learning approach seems to be
the quality of the labeled data of the target face used during training. The aggregated approach
seems less effected by it, making it a preferred approach for real-life applications
where labeled target data will be sparse and difficult to select. However, its performance
improvements does not outweigh its efforts in current experiments, and further research
should focus on the choice of target data to use during the training process."
Analyzing the face on the Shroud of Turin with a three-dimensional morphable model,"['Chinellato, N.']","['Veltkamp, R.']",2017-02-22T18:20:56Z,en,"['Shroud of Turin, morphable model, computer vision']",Game and Media Technology,"In this thesis I study the claim that the face that is visible on the Shroud of Turin contains some three-dimensional information. I do so with the aid of the computer vision technique called morphable models. I analyze how an implementation of such a model acts when given three-dimensional meshes obtained from real faces, from noise functions and finally from the Shroud face image, trying to understand whether the outputs of the model can be used to classify the inputs."
The design and implementation of a Discrepancy Monitoring System,"['Groot, K. de']","['Hage, J', 'Jansen, S']",2017-02-22T18:20:50Z,en,[],Business Informatics,"With the reemergence of the client-server paradigm in the design of web applications, duplication of responsibilities is often inescapable, and we end up with applications reimplementing functionality in another language. In an attempt to lessen the impact of this sub-optimal design on an existing software product, multiple potential solutions were investigated and evaluated. Based on constraints posed by both the general case of an existing product and the specific environment of the case company, a tool using static analysis techniques was found to be the most promising approach. A proof-of- concept of this tool was developed, and tested against an existing application. While this tooling offered assistance and insight, the findings largely lacked the precision required to target specific problems, mainly pointing to problems with a broader scope, solvable with improvements in architecture and process."
Lineair algoritme voor Greedy Weighted Graph Matching en de link met het Stable Marriage probleem,"['Veldhuis, T.']","['Bisseling, R. H.']",2017-02-22T18:20:49Z,nl,[],Wiskunde & Toepassingen,"Een matching is een deelverzameling van de kanten in een graaf, waarbij elk punt aan maximaal een ander punt gematcht is. Tussen het probleem op een gewone graaf, Greedy Matching, en op een bipartite graaf, het Stable Marriage probleem, is een link gevonden in 2016. Voor Greedy Matching heeft Preis in 1999 een lineair halfapproximatie-algoritme ontworpen. Voor het Stable Marriage probleem is nog geen lineair algoritme gevonden. Door de link tussen de problemen is de vraag of dit ook mogelijk is. De scriptie gaat in op de link en voornamelijk op het algoritme van Preis."
Green Software: The Awareness Awakens,"['Broekman, J.M.']","['Werf, J.M.E.M van der', 'Dalpiaz, F.']",2017-02-22T18:20:54Z,en,"['Green Software, Awareness, sustainability']",Business Informatics,
Prediction for Transition Probabilities in Multi-State Models,"['Snijders, M.']","['Spitoni, C']",2017-02-22T18:20:56Z,en,[],Wiskunde,"The problem of censoring causes estimating transition probabilities in datasets with incomplete data to be interesting and complicated. The main focus of this thesis is on developing theory for a hazard based (Markov) multi-state model, a useful estimator of the transition probabilities and how to combine this with extra information available of an individual."
The Automated Generation of User Specific Dashboards in a Multi-tenant ERP Product,"['Wiel, J.M.J. van de']","['Jansen, Slinger', 'Spruit, Marco']",2017-02-22T18:20:55Z,en,[],Business Informatics,
"Collisions between the Fashion Industry, Media and Politics. The framing of fashionable femininity in Soviet Lithuania’s magazine Tarybinė Moteris and Post-Soviet Lithuania’s fashion blog StiliuSOS through political and technological perspectives","['Kozakaitė, G.']","['Kustritz, A.']",2017-03-02T18:03:49Z,en,"['fashion media, technology, the fashion industry, power politics, image clothing, written garment, the signification']",Nieuwe media en digitale cultuur,"Collisions between the fashion industry, technology and politics undergo constant transformations that can be visible in the content of fashion media. This thesis is oriented towards Soviet and Post-Soviet Lithuania’s fashion industry and its media through technological and political perspectives. These two distinct periods encompass divergent political contexts that had and still have a visible effect on the country’s society and the fashion industry itself. This study reflects the collision between media, fashion and politics by analysing the headlines and images of a former Lithuanian magazine Tarybinė Moteris and a contemporary online fashion blog StiliuSOS. In order to investigate the latter media sections beyond their direct meaning and to observe political and societal alterations, a semiotic approach is used. The results show that the images and headlines in Tarybinė Moteris reflect the prevailing deficiency and political stagnation in Soviet Lithuania, a peculiar civil disobedience and restrictions over Soviet Lithuanian women’s self-expression. During the occupation, the magazine could be used for two main reasons: as a tool of propaganda or as a tool of resistance against the Soviet regime. Also, the results demonstrate that Soviet Lithuania’s women were still trying to embrace their fashionable femininity by making their own clothes that signifies their uniqueness and idiosyncrasy in comparison to Western fashion, which is based on mass-production and planned obsolescence. Hence, StiliuSOS show that an opportunity to purchase in capitalist society needs to be guided by fashion media. The results demonstrate that capitalism creates not only an option, but also an obligation to express oneself through consumerism that forms the capitalist ideology. Furthermore, both politics and media technology have a visible effect on the fashion industry and its development. Technological changes are visibly effected by societal and political transformations, which means that technology is not autonomous, but is also dependent on cultural and political factors. This study shows that fashion media and the fashion industry itself can be used as a beneficial research material in analysing political and societal processes."
'Hoe bedoel je staatsterrorisme?' Een onderzoek naar de toepasbaarheid van terrorismedefinities op het Israëlische beleid in de Palestijnse gebieden sinds 2000.,"['Saad, K.']","['Pekelder, J.', 'Raben, R.']",2017-03-02T18:03:50Z,nl,"['terrorisme, Israël, Palestina, staatsterrorisme, Gaza, Westelijke Jordaanoever, Midden-Oosten']",International Relations in Historical Perspective,"Deze masterthesis is een bestudering van verschillende definities van terrorisme en de acties van de Israëlische staat jegens zijn Palestijnse burgers. De reden van dit onderzoek is het excessieve geweld van de Israëlische staat van de afgelopen jaren en het klimaat van terrorisme sinds het begin van deze eeuw. Dit onderzoek probeert een link te leggen tussen terrorisme en geweldplegingen van een staat, in dit geval Israël. Terrorisme in deze vorm, staatsterrorisme, is een betwiste term die niet door iedereen wordt aangenomen als bestaand. Aan de hand van terrorismedefinities van onder andere Alex Peter Schmid, Randall Law en Igor Primoratz en Israëls eigen definitie van terrorisme, worden diverse acties van de Israëlische staat tegen Palestijnse burgers geanalyseerd. Dit wordt gedaan om de volgende onderzoeksvraag te behandelen: Kan de behandeling van de Palestijnen in de bezette gebieden door Israël als een vorm van staatsterrorisme gezien worden? Vanwege praktische overwegingen worden drie soorten acties bestudeerd: 1) het vernietigen van privé-eigendommen, 2) het doden van Palestijnse burgers en 3) het beschieten van medisch personeel. Deze drie geweldplegingen worden onderzocht in drie afgebakende periodes in de afgelopen zestien jaar. Geconcludeerd kan worden dat Israël tot op zekere hoogte staatsterrorisme pleegt tegen zijn Palestijnse burgers, getoetst aan de terrorismedefinities gehanteerd in dit onderzoek. Nader onderzoek zou zich kunnen richten op andere staten om een internationaal perspectief te creëren rondom dit vraagstuk, waarbij dit onderzoek als startpunt kan dienen."
The ‘Synthetic Biology Learning Platform': facilitating dialogue about the Socio-Scientific Issues Concerning synthetic biology?,"['Tamis, N.']","['Bakker, E.P.H.M. de']",2017-03-01T18:34:37Z,en,"['Dialogue, Synthetic Biology, Socio-scientific issues, Science education, digital learning platform.']",Science Education and Communication,"This study evaluates whether the ‘Synthetic Biology Learning Platform' (‘SBLP’) is a suitable and usable tool to facilitate formal and informal educators to support dialogue with students and visitors about synthetic biology (SynBio). The ‘SBLP’ is a digital repository that contains materials that support such a dialogue. This study looks at three specific research questions. First, the study investigates whether the ‘SBLP’ is a suitable tool to meet its aim. This is investigated by evaluating the platform on collected criteria found in education and communication literature, followed by semi-structured interviews with four formal and four informal educators. Secondly, this study examines to what extend the platform is a usable tool. Again, criteria are formulated, now based on usability literature. The platform is checked for these usability criteria, after which a protocol analysis is performed by the same four formal and four informal educators as participants in the semi-structured interviews. Finally, by studying the ‘SBLP’ on its suitability and usability, this study tries to gain insight into important guidelines for digital learning platforms that have the same aim: to facilitate educators in supporting dialogue about an emerging field of science. Suggestions for improvement that the participants gave in the interviews and protocol analysis are inductively analysed to consider additional guidelines that are missing in the previous analysis. 
	This study indicates that the ‘SBLP’ is more suitable and usable for formal educators, compared to informal educators. However, for both kinds of educators there are still some aspects that can be improved. This includes aspects such as the structure and presentation of the platform. This study finally shows that the criteria used in this study to test the suitability and usability of the platform, seem good general guidelines for the facilitation of formal educators. On the other hand, they are less applicable to facilitate informal educators. In addition, this study offers some suggestions for the improvement of the facilitation of informal educators, for example with regard to the presentation of the content on the platform."
"The Monopoly on Correct Interpretation; On Values, Political Discourse and International Power Relations","['Overgaag, M.C.']","['Kalf, Wouter']",2017-03-07T18:16:56Z,en,"['power, political discourse, value pluralism, monism, international relations, domination, western universalism, moral justification']",Wijsbegeerte,"The liberal democratic paradigm has been the object of considerable critique, varying from arguments of communitarianism, conservatism, and Marxism. Although these critiques might be warranted, they are generally aimed at proposing alternative political ideologies. This paper focusses on bringing to light the discursive practices constituting the liberal paradigm, and its relationship with language and power. Relying on value pluralism and a deontological approach to moral politics, it is argued that a political discourse based on Western values cannot be morally justified. First, for such a discourse falsely claims universality for cultural values, and second for such a discourse would be incongruent in its underlying principles on the one hand, and it discursive practices on the other."
Wasserman op Facebook,"['Schuurman, R.']","['den Ouden, dhr. H.', 'van der Geest, dr. I.M.']",2017-03-07T18:16:55Z,nl,[],Communicatie en Organisatie,
"Collectief herinneren, trauma, slachtofferschap en groepsidentiteit in de context en het werk van de Palestijnse theologen Naim Ateek en Mitri Raheb","['Floor, M.E.']","['Liere, van, L.M.']",2017-04-08T17:02:05Z,nl,['collective trauma; collective victimhood; Palestine; Israël; Holocaust; Nakba; Liberation Theology; Contextual Theology'],Religie en Samenleving,"In this thesis I give an answer to the question how the Palestinian Christian theologians Naim Ateek and Mitri Raheb approach both (collective) trauma and victimhood in their theologies, and how these themes play a role in the context of Israel & Palestine, where they live and work. 

In order to answer this question, I did literature study. First, I have researched what the political psychologist Vamik Volkan says about the meaning of (chosen) trauma, victimhood and identity. Second, I related these themes with religion, by researching what the Christian theologian Miroslav Volf says about the role of memory and remembrance with Christian faith. Third, I studied the political philosopher Diane Enns, who adds a significant perspective, by pointing out the risk of violent aspects within victimhood of ethnic groups. 

My first conclusion is that both Jewish-Israeli society and Palestinian society can be described by the huge influence of collective traumas and collective victimhood. Within Israeli society, the (most) important identity marker is the presence of the (remembrance of) the Holocaust. Within Palestinian society, the trauma of the Nakba, and the continuation of the Nakba which is the Israeli occupation of Palestinian territory, has a huge impact. As a consequence of being deeply rooted in both trauma and victimhood, both groups seem to be unable to look at their situation, and the situation in Israel / Palestine, from a different perspective. 

My second conclusion is that the Palestinian Christian theologians Naim Ateek and Mitri Raheb give a theological answer to the questions being asked from their context, characterized by victimhood and trauma. They try to read and interpret the Bible in such a way, that it motivates and encourages Palestinian Christians not to act out of victimhood, but to take responsibility for their own situation. 
Ateek states that God  is a God of justice and only justice. He believes that human beings can only understand the true nature of God, by watching the life and teachings of Jesus. Ateek is convinced that God is always on the side of victims, but that He requires them to not act out of victimhood, but to work for justice for all. This means that victims receive comfort by the knowledge that God understands their situation, that He rejects the acts of the oppressor, and that in the end justice will prevail.
Raheb states that trauma and victimhood can be seen by a different perspective, when people understand that the Holy Spirit helps them to not look back, but to look forward to a hopeful future. 
Both Ateek and Raheb call for a pro-active attitude in which Jews, Muslims and Christians, both in Israel / Palestine and around the world, work together with non-violent actions for a just solution."
Understanding Diffusion and Osmosis by making Drawing-Based Models,"['Wildenburg, Y.']","['Joolingen, WR van']",2017-04-06T17:04:16Z,en,['SimSketch; diffusion; osmosis; drawing-based; model; modelling'],Science Education and Communication,"The study investigated reasoning process of students who modeled the processes of diffusion and osmosis with the program SimSketch. To be able to use SimSketch for the subject of diffusion and osmosis, some software and an assignment had to be designed. Five 4 vwo students were recorded while going through the assignment and the extra questions about their understanding of models and their opinion of SimSketch. These quotes were coded in five categories:  Understanding of SimSketch, Prior knowledge activation, Reasoning, Newly gained knowledge and Learning due to SimSketch. From the model-understanding questions, it became clear the students know a model to be a hypothetical representation of the real world, instead of a replica. This helped them to see SimSketch as a model and to compare this model with the real world and the knowledge the students already possessed about diffusion and osmosis. Most basic knowledge was still known by the students, additional knowledge was obtained from the researcher, from the results visible in SimSketch and by reasoning. While modelling, this knowledge was used by the students to explain if and why they thought a new situation was more like the original, they were able to make an assessment and formulate arguments to support this. Drawing-based modelling for this matter helped the teacher to discover the faults and possible misconceptions of the students more easily since those are more visible. Not only the teacher but also the students seem to discover their faults more easily thanks to drawing-based modelling since they are corrected by the effects of their own settings."
Graffiti van Begin tot Nu,"['Schulz, C.A.']","['Beukenhorst, H.B.']",2017-04-10T17:03:09Z,nl,"['graffiti, new york, lissabon']",Liberal Arts and Sciences,"The graffiti culture that first appeared in New York City between the 70s and 80s inspired a worldwide graffiti movement. Nowadays, the streets of Lisbon are characterised by a great amount of graffiti and street art and the city has a progressive attitude towards graffiti. Combining two case studies about respectively the graffiti cultures of New York in 1970-1980 and contemporary Lisbon, this research examines which elements of the original New York based graffiti culture are still existing today. Tags, throw-ups and pieces that originated in New York are forms of graffiti still existing in contemporary Lisbon. However the streets of Lisbon carry a wider variety of illegal and legal graffiti. The terms ‘street art’ or ‘urban art’ are often used to describe the present graffiti and its variant forms. In New York graffiti was practiced predominantly by youth from the ghetto in competition over respect among peers; in contemporary Lisbon, within the legal graffiti scene in particular, these motivations made way for a focus on producing art. Eventually both graffiti cultures of New York and Lisbon were and are constantly evolving, since creativity functions as fuel for development."
De CO2-prestatieladder als oplossing voor een klimaat neutrale bouw? - Een onderzoek naar de bijdrage van de CO2-prestatieladder aan reductie van CO2 in de keten van bedrijven in de constructie-industrie in Nederland,"['Dijk, L.S. van']","['van Rietbergen, T.']",2017-04-06T17:03:53Z,nl,[],Economische geografie,
Waarderingsmethoden voor maatschappelijke kosten en baten bij gebiedsontwikkeling en rechtvaardigheid.,"['Bilderbeek, B.F.']","['Van Straalen, F.M.']",2017-04-06T17:03:52Z,nl,['planologie; MKBA; social justice; ex ante beleidsevaluatie'],Spatial Planning,
