title,authors,supervisors,date,language,keywords,program,abstract
Assessment of the impact of ambient groundwater flow on High Temperature Aquifer Thermal Energy Storage (HT-ATES) performance and thermal spreading,"['Diederen, M.P.M.']","['Hartog, N.', 'Bloemendal, M.']",2020-08-24T18:00:12Z,en,[],Earth Surface and Water,"High Temperature Aquifer Thermal Energy Storage (HT-ATES) is a technology where groundwater of up to 90 ˚C is stored in the subsurface which is used as a source of heat for spatial heating. By utilizing high temperatures, the use of a fossil-fuel heat pump as in low temperature (&lt; 25˚C) ATES is excluded. Before realizing HT-ATES, a basic framework of the storage specific and site-specific hydrogeological conditions that effect the thermal recovery efficiency and thermal spreading of heat in the subsurface is needed. This study has provides a part of such framework by the hand of numerical simulations, specifically looking at the impact of ambient groundwater flow (AGF) on HT-ATES systems in scenarios with the presence of an overlying aquifer. Additionally, theoretical interpretations of the results help to explain the interaction between various processes modelled.
The results show that for HT-ATES systems in sites with ambient groundwater flow, thermal recovery efficiencies alter slightly due to the interaction between significant density-driven flow and ambient groundwater flow. However, the trend in ambient groundwater flow losses, where losses increase when decreasing the storage size or increase the AGF velocity, is similar to that of LT-ATES. Therefore, analysis whether AGF losses play a significant role at a certain site can still be performed with the analytical formula of Boemendal & Hartog 2018 that calculates efficiency losses due to ambient groundwater flow. In terms of spatial spreading, ambient groundwater flow causes for an increase in spreading in direction of the flow and increases when utilizing a larger storage aquifer. Additionally, flow in the storage aquifer results in more conduction losses to the overlying aquifer.
The presence of an overlying aquifer causes for an increase in thermal spreading in vertical direction when significant density driven flow is present. Density driven flow in the storage aquifer results in more heat to conduct upwards which then spreads vertically in the overlying aquifer as well due to density driven flow. Having flow in the overlying aquifer does not result in major losses in efficiency but does reduces the spreading vertically and increases it horizontally, causing a shift in spatial impact of the heat. Additionally, dispersion causes reduction of overall temperatures in the overlying aquifer, therefore decreasing the impact on the subsurface in terms of high temperatures. The insights of this study have provided a basic understanding of how HT-ATES interplays with site specific hydrogeological conditions and therefore how these must be taken into account when realizing HT-ATES."
The (Inter)medial Qualities of Videomapping,"['Bogert, I.D.']","['Kattenbelt, C.']",2020-08-23T18:00:10Z,en,[],Media en cultuur,"This thesis explores the medial and intermedial qualities of videomapping, trying to answer the question ‘‘How can videomapping be seen as an intermedial performance?’ Videomapping is an artform where projections are often casted directly on their surroundings, instead of on a screen. Three examples of videomapping performances are used to illustrate the specific characteristics of videomapping. In order to look at intermedial qualities, it is important to first explore the medial qualities of videomapping. Lars Elleström’s modalities recognizes media to be build up from four modalities, which are then put into context by their qualifying aspects. The spatiotemporal modality seemed to be of great importance for the realization of a videomapping performance. In other words: videomapping performances use static backgrounds and add the dimension of time by projecting moving images. In Chiel Kattenbelt’s words, causes videomapping a “temporalization of the space”. Mapping the projections very precisely blurs the border between the immaterial beams and the material background. This paradox has also been recognized by Anna Friedberg when looking at spectatorship in cinematics.
After looking at the medial qualities of videomapping, theories on intermediality are deployed to look at the way videomapping is connected to other media. Irina Rajewsky’s categories of intermediality and Jens Schröter’s models of the intermedial discourse were connected to similarities that stood out from analyzing the three artworks. Both theorists departed from the notion that all media stand in connection to other media, and there are indeed many ways in which videomapping connects to other media, for example through a strong similarity of both aesthetics and creation of the work Keys of Light and abstract painting by Wassily Kandinsky. This striking example is therefor analyzed in a more detailed way. The research concludes by emphasizing that videomapping is intermedial in many ways, but maybe mostly by how it very close to cinema, yet differentiating itself by how videomapping transforms the static background, making it part of the performance instead of using a white screen to merely display content."
Mapping the Jurassic/Cretaceous lithological units in the Buëch area in France using Sentinel-2 and ASTER,"['Liepa, A.']","['de Jong, S.M.', 'Nijland, W.']",2020-08-24T18:00:23Z,en,"['Geological mapping, Image spectroscopy, SVM, SAM, ASTER, Sentinel-2, France']",Earth Surface and Water,"Spaceborne remote sensing performs a significant role today in geological mapping, interpretation and analysis of large areas in a rapid and cost-efficient manner. Spaceborne satellite imagery have been successfully utilized in lithological mapping of arid areas, however, similar approaches for lithological mapping in semi-arid regions with high degree of structural complexity, vegetation and topographic effects are yet to be developed. The primary objective of this study is to combine field-based spectroscopic research with geological remote sensing in obtaining representative lithological maps of the Buëch area in South-East France. To achieve this aim Support Vector Machine (SVM) classifier and Spectral Angle Mapper (SAM) were used on Sentinel-2 and ASTER imagery. Spectroscopic examination of field samples enabled the creation of spectral endmembers representative for the area and detection of local weathering mechanisms. The results derived from SVC classifier showed great pattern-recognition ability and more accurate classification of different lithological groups. SAM derived thematic mapper demonstrated the ability to correctly classify a great portion of blue marl outcrops, by recognising the lack of spectral response displayed by blue marls as being the distinctive indicator of the class. Using and evaluating different satellite imagery shows that Sentinel-2 allows better mapping in this semi-arid area, indicating that the higher spatial resolution of Sentinel-2 has an edge over the higher spectral resolution in the SWIR range of ASTER for this specific setting and methodology. The study has shown that field-based spectroscopic research complements geological remote sensing well. The limiting factor in achieving better classification is the spectral and spatial properties of the satellite imagery. Therefore, future research should consider the integration of hyperspectral data and assimilation of geomorphic products to increase the accuracy of lithological unit discrimination."
Drivers and Barriers in the Diffusion of Eco-innovations,"['Leede, G.L. de']","['Hekkert, M.P.']",2020-08-25T18:00:50Z,en,"['eco-innovation, environmental innovation, diffusion, drivers and barriers']",Liberal Arts and Sciences,"Sustainable development has become an important concept in the last decades. Sustainable
development tries to reconcile the relationship between economic growth and
environmental damage. In the last decades, ecological problems became more severe.
Decoupling economic growth and environmental harm seems to be crucial in order to avert
a lot of environmental damage. One major role to tackle this conflict is reserved for
environmental innovation. Environmental innovations or eco-innovations are new products
and processes that reduce the environmental impact. Eco-innovations can bring sustainable
benefits, but only when widely used or implemented. Thus, eco-innovations have to diffuse
across society. This paper aims to increase the understanding of the most important factors
that slow down or accelerate the diffusion of eco-innovations. It will thus answer the
question: which factors slow down and which factors accelerate the diffusion of eco-
innovations?

To answer this question, a systematic literature review has been carried out. 39
articles about the diffusion and adoption of eco-innovations among firms have been
analysed. In the analyses, various factors that influence the diffusion came up. Based on
recurring patterns in the articles, five categories were identified in which the factors were
placed. These categories form the new classification this paper proposes. The five categories
are cost relating factors, benefit relating factors, regulatory factors, informational factors
and dummy factors. The factors in the last category are often used as control variables in the
literature. The most reported factors (15 times or more) are resources, investment costs,
type of regulation (cost relating factors), market demand for sustainable products/services,
profitability (benefit relating factors), availability of regulations, type of regulation
(regulatory factors), resources, information flows, attitude of managers/owners,
organizational environmental practices (informational factors) and size (dummy factors). The
new classification is more logical and useful in the current literature.
A limitation is that comparison of factors in different articles can be difficult, because
of all the differences in eco-innovation types, industries and adopters. Another limitation is
that developing countries are neglected in literature.
Future policies should take the importance of the five categories and corresponding
factors into account."
Interconnections between religion and artificial intelligence: Resemblance between the Way of the Future Church and sociological definitions of religion,"['Smit, A.D.']","['Baumgartner, C.']",2020-08-25T18:00:52Z,en_US,[],Religiewetenschappen,
"Crowd Simulation as a Service: A
scalable, real-time architecture.","['Hameleers, C.W.M.']","['Geraerts, R.J.', 'van der Werf, J.M.E.M.']",2020-08-28T18:00:07Z,en,"['crowd simulation,software architecture, software as a service, cloud computing, MSaaS']",Game and Media Technology,"In this thesis on real-time crowd simulation as a service, we explore how crowd simulation
applications can benefi?t from cloud computing. The aim of this thesis is to provide a
candidate architecture for real-time cloud-based simulation software that is scalable and
highly performant. We also aim to document our design process to show how and why
decisions were made.
First, we introduce the subject by motivating the need for cloud computing in simulation
software. We then provide an overview of related work about both crowd simulation
and computer and cloud architecture. Next, we describe the problems we are trying to
solve and we list a collection of requirements that will help guide our design process.
We then combine our knowledge into a candidate architecture for real-time Modeling
and Simulation as a Service (MSaaS). After presenting our candidate architecture we
perform research into the performance sensitive parts of MSaaS and discuss how we can
apply our results."
Atomically Precise Gold Containing Clusters for Selective Ethanol Oxidation,"['Hoof, J.M. van']","['Donoeva, B.']",2020-08-28T18:00:17Z,en,['Atomically precise cluters; heterogeneous catalysis; gold; ceria'],Nanomaterials Science,"Conventional nanocatalysts have a nonuniform particle size distribution, while catalytic activity of nanoparticles is size dependent. This is also the case for gold as the intrinsic chemical properties of very small gold particles (called Au clusters) are strongly dependent on its size and composition. It is, however, unknown how the catalytic activity evolves in this nanosized regime. Sintering of these clusters could be prevented by using a suitable support material and without calcination at high temperatures. In this research, the activity and stability of various Au nanoclusters are investigated. In order to do this, CeO2 rods, cubes and polyhedra are synthesised as support material exhibiting ({110} and {111}), {100} and ({100} and {111}) exposed surface planes respectively because these tend to have different stabilising properties. After deposition of Au9 clusters on each CeO2 material and heat treatment, the rods and cubes showed least nanoparticle formation. Hereafter, Au8, Au6Pd are deposited and Au nanoparticles were grown on CeO2 rods because this material seemed to prevent sintering. These catalysts were subsequently tested in the gas phase oxidation of ethanol using O2. The Au nanoparticles showed the highest activity, but its higher selectivity towards CO2 also resulted in possible polycarbonate species bound to the CeO2 surface which lead to deactivation. Furthermore, a decrease of cluster size by only one atom (Au9  Au8) resulted in a decrease in oxidation activity, while a bimetallic cluster (Au6Pd) did not show a much higher activity contrary to previous believes. Next to this, Au9 clusters deposited on SiO2 are treated with BCl3 to chemically remove its protecting ligands. This resulted in growth of the Au nanoparticle size and Au leaching. This makes BCl3 treatment an unsuitable method for chemical ligand removal to investigate the properties of various Au clusters on inert supports."
Epistocratie en het identiteitsprobleem,"['Vos, F. de']","['Sauer, H.', 'Lievers, M.']",2020-08-28T18:00:49Z,nl,"['Epistocratie, democratie, stemrecht, identiteit']",Liberal Arts and Sciences,"De politieke filosofie houdt zich al een tijd bezig met het al dan niet rechtvaardigen van
verschillende samenlevingsvormen. Jason Brennan pleit voor een gematigde vorm van
epistocratie met beperkt kiesrecht, als alternatief voor de democratie met universeel kiesrecht.
Stemrecht wordt in Brennans epistocratie alleen toegekend aan burgers die over voldoende
politieke competentie beschikken. In dit essay zal ik één argument tegen de epistocratie van
Brennan toevoegen aan het debat rondom de epistocratie. Ik zal proberen aan te tonen dat de
epistocratie van Brennan problematisch is, omdat het ontnemen van stemrecht van burgers
ondermijnend is voor de individuele identiteit van deze burgers. Om dit aan te tonen zal ik
binnen zes secties de belangrijkste argumenten voor en één argument tegen mijn stelling
analyseren. Identiteit maakt nog te weinig onderdeel uit van de discussie rondom epistocratie
en alternatieve samenlevingsvormen en daar moet verandering in komen."
Ticks in the Netherlands: from the perspective of the owners of companion animals.,"['Emden, S. van']","['Nijsse, E. R.']",2020-08-31T18:00:48Z,en,"['ticks, tick-borne diseases, companion animals, owners knowledge, tick control methods, Netherlands']",Geneeskunde van gezelschapsdieren,"During the master's program of Veterinary Medicine at the University of Utrecht, all students must conduct
a research internship and a master thesis. This report is the master thesis of the research internship carried
out by S. van Emden at the department of Infectious Diseases and Immunology, under supervision of the
division Clinical Infectiology of the University of Utrecht and the Institute of Risk Assessment.
Research was conducted to gain more insight in Dutch owner’s knowledge about ticks present on companion
animals and tick-borne diseases, the used tick control methods and the population proportions of tick species
in the Netherlands. In addition, research was conducted to gain insight in the knowledge of dog and cat
owners about tick-borne diseases. Data for this research was obtained among pet owners and veterinarians
at the same time. Data about prevalence of tick borne diseases, recommended prevention methods and a
possible new tool for removing ticks on dogs can be found in the report of D. Spreen, another student of the
faculty of Veterinary Medicine."
Sallandse blokkendozen; een onderzoek naar de naoorlogse poldergemalen in Salland,"['Eikenaar, F.A.']","['van de Vijver, dr. D.R.E.']",2020-09-02T18:00:17Z,nl,"['gemalen, gemaal, poldergemaal, poldergemalen, architectuur, techniek, Salland, Zwolle, Heino, Wijhe, waterschap, waterschap Salland, waterschap Dalmsholte, waterschap Drents Overijsselse Delta, TAUW, H. Postel, Willers, wederopbouw, jaren vijftig, jaren zestig, naoorlogse architectuur, Linterzijl, Langeslag, Bremmelerstraat, Lierder- en Molenbroek, Markvoort, watererfgoed, Het Oversticht']",Kunstgeschiedenis,"In de lage delen van Salland bevindt zich een concentratie van soortgelijke naoorlogse poldergemalen, die door hun overeenkomstige vormgeving - enigszins oneerbiedig - Sallandse blokkendoosjes worden genoemd. Dat is opmerkelijk aangezien er tot in de jaren zestig, met uitzondering van kleinere prefab gemalen, geen gemaal hetzelfde is gebouwd. Dit onderzoek gaat in op de ogenschijnlijke overeenkomstigheid door de technische en architecturale kenmerken van de vijf poldergemalen te achterhalen en onderling te vergelijken. Hieruit blijkt of deze Sallandse gemalen daadwerkelijk zo eenvormig zijn als ze in eerste instantie lijken en welke positie zij innemen in de Nederlandse gemaalbouw."
Hoe LinkedIn op een speelse manier vorm geeft aan de online identiteit,"['Seegers, R.C.']","['Smit, A.P.']",2020-09-02T18:00:16Z,nl,"['Sociale media, online identiteit, affordances, discursieve interface analyse, gamification, gaming capital']",Nieuwe media en digitale cultuur,"Er is een belangrijke tweestrijd gaande in artikelen en onderzoeken die gedaan zijn naar sociale media en (de representatie van) online identiteit. Zo stelt Chambers, onderzoeker in sociologie en media & cultuur studies, dat sociale netwerksites (SNS) zijn ontworpen om de offline (niet gemedieerde) identiteit van gebruikers weer te geven.1 In tegenstelling tot Chambers stelt José van Dijck, onderzoeker in de media en digitale samenleving, juist dat SNS geen neutrale omgeving zijn voor het vormen van jouw online identiteit. Een interessante uitspraak van David Beer, dat interfaces belangrijke instrumenten zijn voor de identiteitsvorming 2, is de aanleiding van dit onderzoek. Daarnaast zijn concepten zoals gamification en gaming capital nuttig om inzicht te verkrijgen in hoe spel en speelsheid voorkomen in een serieus platform van LinkedIn. En zal besproken hoe dit de notie van online identiteit beïnvloedt. Dit onderzoek analyseert daarom de meest opvallende affordances in de interface van de mobiele applicatie van LinkedIn, aan de hand van een discursieve interface analyse. Hiermee wordt antwoord gegeven op de hoofdvraag: hoe komt gamification naar voren aan de hand van de affordances van LinkedIn en hoe verhoudt zich dit tot de notie van online identiteit?"
The Myth of the Enlightened Supermen in Gravity’s Rainbow,"['Groot, C.M.S.']","['Cook, S.J.', 'Pascoe, D.A.']",2020-09-02T18:00:16Z,en,"['Pynchon, Adorno and Horkheimer, Enlightenment, Postmodernism, Historiography, Comic Books, Superhero, Mythology']",Engelse taal en cultuur,"This paper sets out to examine the influence of Adorno and Horkheimer’s Dialectic of Enlightenment on post-war American literature. Despite being widely recognized as a seminal work of the Frankfurt School critical theory as well as the forming of the socio-political counterculture movement of the 1970s, Dialectic’s influence on the lower arts like superhero comic books has barely been explored in the academic debate. In his postmodern novel Gravity’s Rainbow (1973), Thomas Pynchon incorporates this scientific myth of enlightenment throughout the narrative. This paper draws the historical, political and cultural connections between the origin of the superhero and the enlightenment’s Übermensch."
"“Wie zal ons scheiden van de liefde van Christus?”
Over de representatie van homoseksualiteit in protestantse romans","['Wal, J.M. van der']","['Pieterse, S.A.']",2020-09-03T18:00:12Z,nl,"['homoseksualiteit, protestantisme, identiteit, representatie, ontvoogdingsnarratief']",Nederlandse taal en cultuur,"In de protestantse literatuur wordt geschreven over homoseksualiteit. Ook in protestantse kerken wordt nagedacht over dit thema. Per protestantse stroming verschilt het hoe er over dit thema gedacht wordt. Uit eerder onderzoek is gebleken dat er vier strategieën zijn hoe homoseksuelen in de kerk met hun seksuele en religieuze identiteit kunnen omgaan. In dit onderzoek wordt gekeken naar vijf romans die gaan over een homoseksueel hoofdpersonage: De glazen schelp (2000), Jij (2010), Sub Rosa (2012), Praat er maar niet over (2018) en Door jou ben ik mij (2019). Deze vijf romans zijn in een kerkstroming geplaatst. Voor verdere close-reading zijn hieruit twee romans geselecteerd: Sub Rosa en Praat er maar niet over. In deze twee romans wordt gekeken naar de representatie van homoseksualiteit. Gekeken wordt naar de rol van de kerkelijke achtergrond, naar de fase van het identiteitsconflict volgens Rodriguez en Ouellette en naar de verhouding van de romans tot het ‘ontvoogdingsnarratief’ zoals gedefinieerd in het onderzoek van Batteau. Hierbij worden de vertelstructuur, de strategieën en de cultuurtekst binnen de roman onderzocht. In Sub Rosa, waarin een personage een roman schrijft over een ander personage, blijkt het ontvoogdingsnarratief een rol te spelen in hoe het ene personage gerepresenteerd wordt door het andere personage. De roman laat zien dat er ook een ander verhaal is dan die van het ontvoogdingsnarratief. In Praat er maar niet over blijkt het plot het ontvoogdingsnarratief te bevatten en speelt ook het ontvoogdingsnarratief een rol in de tweestrijd die het hoofdpersonage ervaart. Deze roman laat de innerlijke strijd zien met het ontvoogdingsnarratief en biedt ook een ander verhaal. Gebleken is dat niet zozeer de kerkstroming een rol speelt in de representatie van homoseksualiteit als wel de tijd waarin de roman zich afspeelt. Zo is te zien dat in Sub Rosa, dat zich later afspeelt dan Praat er maar niet over, het innerlijke probleem zich minder naar binnen toe keert dan in Praat er maar niet over."
Het begrip heiligheid in de discussie rondom de herbestemming van de Willibrordkerk in Utrecht,"['Gieling, J.']","['Spaans, J.']",2020-09-04T18:00:22Z,nl,"['Willibrordkerk, spirituele ongebondenheid, material religion, heiligheid']",Taal- en cultuurstudies,"In dit eindwerkstuk onderzoek ik in hoeverre en hoe de posities van de verschillende partijen in de discussie rondom de herbestemming van de Willibrordkerk in Utrecht zijn te verklaren aan de hand van het begrip heiligheid. Allereerst geef ik de geschiedenis van de Willibrordkerk die voor dit onderzoek relevant is. De Willibrordkerk is meerdere keren ontwijd en is door verschillende partijen gebruikt. Het gebouw zou eerst gesloopt worden, maar werd toen door pater Winand Kotte en zijn apostolaat in gebruik genomen. Door geldgebrek werd de kerk uiteindelijk verkocht aan de priesterbroederschap St. Pius X. In deze scriptie ga ik in op het begrip heiligheid. Ik onderscheid twee vormen van heiligheid: een officiële vorm volgens het katholieke recht en een meer persoonlijke vorm van heiligheid. Aan de hand van het begrip material religion en spirituele ongebondenheid laat ik zien dat de persoonlijke vorm van heiligheid ook kan optreden in een seculiere context. De Willibrordkerk kan ook heilig aanvoelen voor niet-religieuze of niet-kerkelijk gebonden mensen. Vervolgens introduceer ik de verschillende partijen die een rol spelen in de discussie rondom de herbestemming van de Willibrordkerk: de gemeente Utrecht en de Nederlandse overheid, het apostolaat van pater Winand Kotte, Pius X, het aartsbisdom Utrecht, de voormalige vrijwilligers van de kerk en “bekende Utrechters” en het museum Catharijneconvent. Aan de hand van krantenartikelen, websites en informatiebladen heb ik de belangrijkste waarden van deze partijen op een rij gezet. Deze waarden heb ik gekoppeld aan het begrip heiligheid zoals ik het uiteenzette in mijn theoretisch kader, waarbij ik telkens het onderscheid tussen de twee vormen van heiligheid probeerde aan te houden."
"De menselijke perceptie in de Oostvaardersplassen:
een case study","['Konijnenberg, H.C.L.']","['Leeuw, N.G. de']",2020-09-04T18:00:30Z,nl,[],Liberal Arts and Sciences,
