title,authors,supervisors,date,language,keywords,program,abstract
The Quantified Self: Caring or Controlling?,"['Kool, E.M.']","['Werkhoven, S.']",2016-08-02T17:01:00Z,en,['The Quantified Self; Self-tracking; Well-being; Reductionism; Normalization'],Applied Ethics,Followers of the Quantified Self movement connect themselves to tracking devises that perform intensive quantitative measurements of their physical and mental functioning. The personally generated data is believed to enable individuals to effectively promote their well-being. The central question of this thesis is whether self-tracking is indeed a legitimate tool to promote one’s own well-being. The ambitions of the quantified self are criticised on the basis of Sumner’s theory of well-being as life-satisfaction that states that well informedness and autonomy are the fundamental conditions upon which individual’s well-being can be evaluated. It will be argued that quantitative measurements cannot give a comprehensive impression of individual’s well-being for it is only a partial representation. On the basis of Michel Foucault’s studies on technologies of the self and disciplining power it will be argued that self-tracking is not promoting self-governance but population control instead for tracking devices are a perfect means through which normalizing power is performed.  In the end an alternative perspective is presented by reinventing Foucault’s care for the self and an appeal is made to individuals to be more critical and reflective towards their relation with self-tracking devices.
Genocidal Practices in Aceh? A Critical Analysis of the Netherlands East Indies Army's Conduct of the War Against Acehnese Civilians During the Aceh War of 1873-1914.,"['Djodikromo, D.M.A.']","['Swart, E.']",2016-08-03T17:01:01Z,en,['Aceh; Colonialism; Conflict Studies; Genocide Studies; History of the Netherlands; History and Memory; Imperialism; Indonesian History; Raphael Lemkin; Postcolonial Studies'],Geschiedenis,"Writing history is a political activity. It is told from the perspective of the author and often reflects a certain national historical framework. In the case of Dutch colonial historiography, which shall be discussed here, a similar pattern is to be seen. In the years following decolonization, the aftermath of Dutch military defeat in 1945-1949 and the loss of colonial prestige set a motion in progress which ultimately led to a certain marginalisation of the Dutch East Indies’ historical significance within Dutch historiography. The ties between the Netherlands and its former colonies became severely strained, and, as a result, the Dutch no longer regarded the latter as an integral part of its national destiny and history. 
	According to a number of scholars, the Aceh War of 1873-1914 is a prime example of how politics has influenced Dutch colonial historiography. Certain aspects of the war, they argue, have been wilfully neglected in order to suit the Dutch national historical framework. During the war, which was fought between the Netherlands and the Sultanate of Aceh, the NIL regularly conducted military tactics that today would be regarded as inhumane. The absence of a clear distinction between native combatants and native civilians led to Dutch assaults on the population itself. Some scholars suggest that these events had strong genocidal overtones. Whatever the case, the events contradict traditional views on Dutch colonial history, which is generally regarded as rather peaceful when compared to that of other European colonial histories. This raises the following questions. What is a civilian and what is a combatant? To what extent can the NIL’s conduct of the war against Acehnese civilians be regarded as acts of genocide? If acts of genocide did indeed take place, why have these events been largely ignored in Dutch colonial historiography? And how should the war be properly remembered? This research seeks to examine if the Netherlands East Indies Army (NIL) conducted acts of genocide against Acehnese civilians during the war. In the following chapters, I shall discuss the definition of genocide, the NIL’s actions in Aceh and whether or not those actions can be regarded as acts of genocide. For this research, I have chosen the timeframe 1873-1914, which has proven to be vital in identifying and understanding the dynamics and evolution of the NIL’s conduct of the war in Aceh. It took the Dutch forty years to conquer Aceh, hence the chosen timeframe. Following this examination, I will conclude by making recommendations on the remembrance of the war."
Religiously framed conflict in Syria: A comparison of the Muslim Brotherhood in Syria and Islamic State,"['Zoelen, F. van']","['von Frijtag Drabbe Kunzel, G.']",2016-08-03T17:00:59Z,en,['Islamic State; Muslim Brotherhood; Syria; Assad regime; religion; framing; conflict studies; history; framing tasks; diagnostic framing; prognostic framing; motivational framing'],Geschiedenis,"This paper aims to gain an understanding of the role of religion in conflict. Specifically, religion plays a key role in legitimizing actions and gaining supporters for a particular movement. Therefore, the question ‘How do Islamic State and the Muslim Brotherhood use religion to legitimize their actions and how can we understand this legitimization?’ will be central to this paper. Two cases will be examined throughout this paper, namely the Muslim Brotherhood and Islamic state. Their conflicts with, respectively, the governments of Hafiz and Bashar al-Assad were (and are) clearly religiously oriented. Using speeches and documents issued by both movements as well as relevant literature, an analysis of the use of religion by the Muslim Brotherhood and Islamic State will be made. Taking a particularizing perspective, religion will be treated as an isolated phenomenon to enable the analysis of the frames used by both movements. Framing is a conscious and strategic act, and helps to give meaning to events, actions and other phenomena. Dividing the framing process in certain ‘framing tasks’ each chapter examines the use of religion in a particular framing task. These framing tasks are diagnostic framing, prognostic framing, and motivational framing. In the end, this paper shows that both movements make extensive use of religion to legitimize actions and gain supporters; they do so by publicizing a frame of injustice, for which they then provide a solution, and then motivate people to do something about."
Indammen of Afbranden? Eisenhower's Containmentpolitiek in Zijn Nationale Veiligheidsbeleid in 1956,"['Tiel, M.W.']","['Hoeven, R. van der']",2016-08-03T17:00:57Z,nl,"['Eisenhower, containment, communisme, 1956']",Geschiedenis,"In 1953 stelt de Amerikaanse president Eisenhower zijn nationale veiligheidsbeleid op. Uit de literatuur blijkt dat dit beleid volledig werd toegespitst op het indammen van het communisme. Dit wordt ook wel containmentbeleid genoemd. In december 2015 werd de SAC Study 1959 openbaar gemaakt. De SAC Study 1959 is het eerste document dat ooit openbaar is gemaakt dat op deze schaal Eisenhowers militaire planning beschrijft. Uit dit document blijkt dat er een grote discrepantie is tussen Eisenhowers nationale veiligheidsbeleid en zijn militaire planning.
Eisenhower heeft in zijn boeken en publieke toespraken aangegeven dat Amerika niet in oorlog is met de burgers die leven in communistische regimes, maar met de leiders van deze regimes. Toch toont de militaire planning aan dat er vergevorderde plannen werden gemaakt om doelbewust burgers te bombarderen in de communistische landen. Daarnaast gaf Eisenhower aan dat de nucleaire wapens met name werden gebruikt om de Sovjet Unie af te schrikken. Ook dit blijkt niet het geval te zijn, omdat de militaire planning aantoont dat er geen oorlogsplan bestond waarin deze wapens voor afschrikking werden gebruikt. Er lag enkel een plan klaar om deze wapens op grote schaal te gebruiken. Tevens toont de militaire planning aan dat de Verenigde Staten ook plannen maakten om China en Oost-Europa te bombarderen. Eisenhowers heeft expliciet aangegeven in een conflict te zijn met de Sovjet Unie, en niet met de gehele communistische wereld. 
Uit de verschillen tussen Eisenhowers nationale veiligheidsbeleid en de militaire planning blijkt dat Eisenhower geen containmentbeleid voerde. Daarnaast blijkt dat Eisenhowers publieke uitspraken over zijn nationale veiligheidsbeleid regelmatig niet kloppen met de militaire planning waar hij verantwoordelijk voor was. Om die reden pleit ik voor een revisie van de literatuur, waarbij containmentbeleid wordt vervangen voor ‘corrective’ beleid. Deze aanpassing zorgt ervoor dat de nieuwe kennis over Eisenhowers militaire planning wordt geïmplementeerd in het bestaande beeld over zijn nationale veiligheidsbeleid."
Nemesis Narratives: The relationship between embedded and emergent narrative in Middle Earth: Shadow of Mordor.,"['Kroon, J.C.']","['van Vught, J']",2016-08-03T17:01:00Z,en,"['games, embedded narrative, emergent narrative, narrative structure, emergent characters, emergent events']",Nieuwe media en digitale cultuur,"As digital games have become a potent cultural and economic force, they have come under more scrutiny from a variety of academic disciplines. A point of contention has been the role of narrative in digital games, in large part due to the fact that the interactivity inherent to games presents a problem for more traditional conceptions of narrative structure. Narrative in games can be broadly categorized in two forms: embedded narrative, which is pre-scripted and designed as a property of a game itself; and emergent narrative, which is the experiential narrative constructed by the player as they play the game. These two forms are observed as being closely related and connected in a relationship of necessity characterized by the reliance of emergent narrative on embedded narrative elements for its generation. This relationship represents a pattern across games which tell an explicit story, specifically action/adventure and roleplaying games. Middle Earth: Shadow of Mordor challenges this standard because it contains a gameplay system (the Nemesis System) which generates dynamic characters that grow and change due to the player’s actions. The system also produces events which are specific to these characters, and unique to a given player’s experience of the game. The player’s emergent narrative, made unique by the dynamic nature of the Nemesis System, influences the embedded narrative of the game. In this way, Middle Earth: Shadow of Mordor represents a break from the strict relationship of necessity between embedded and emergent narrative. The Nemesis System represents a new development in the structure of game narratives, and indicates the potential of game systems for the generation of emergent narrative which is not strictly bound to embedded or pre-designed narrative."
"Museum der verdeelden: Nationaal bewustzijn en het Surinaams Museum tijdens de Autonomie, 1954-1975","['Molenberg, B.C.']","['Pelgrom, A.R.']",2016-08-03T17:00:58Z,nl,['Surinaams Museum; Uses of Heritage; Heritage; Paramaribo; Zeelandia; Autonomie; identiteit; nationale identiteit; Suriname; cultuur; erfgoed; authorised heritage discourse'],Geschiedenis,"Toen Suriname na 1954, met ingang van het Statuut voor het Koninkrijk der Nederlanden,  functioneerde als autonoom land binnen het Koninkrijk groeide het nationaal bewustzijn onder de bevolking. In het etnisch sterk verdeelde land nam dit bewustzijn diverse vormen aan. Daarnaast droeg de Surinaamse overheid nog een eigen, overkoepelende versie van nationale identiteit uit. Dit artikel gaat in op de vraag hoe in deze vormgevende periode cultuur (c.q. erfgoed) bij heeft gedragen aan de vorming van (nationale) identiteit - het maakt daarbij gebruik van het in 2006, door Laurajane Smith gemunte idee van 'authorised heritage discourse' (AHD). Het artikel richt zich daarbij specifiek op het Surinaams Museum, dat in dezelfde periode werd gesticht en zich ontpopte tot een belangrijk medium van het AHD aldaar."
Évaluation des traductions sur les produits de Hema et Kruidvat,"['Peeters, R.']","['Berns, J.K.M.']",2016-08-03T17:01:02Z,fr,"['Traduction, marché international, plurilinguisme, information produit, qualité, conséquences']",Franse taal en cultuur,"De nos jours, la plupart des produits sur le marché ne s’orientent pas vers un seul public cible, dans un seul pays, avec une seule langue. Il faut que toutes les informations sur ces produits soient disponibles en d’autres langues et on a donc besoin des traductions. Il ne s’agit pas toujours d’une tâche facile. On a affaire à d’autres systèmes linguistiques, à des différences culturelles, des différentes conventions, lois, etc. Le succès du produit sur le marché international dépend entre autres de la qualité des traductions et de la mesure dans laquelle le texte s’adapte aux facteurs mentionnés ci-dessus. Dans ce mémoire, nous nous concentrerons sur ce domaine de plurilinguisme des produits sur le marché international en prenant comme objet d’étude le cas des traductions françaises des informations néerlandaises sur l’emballage des produits de HEMA et de Kruidvat. En nous concentrant sur une sélection des produits de HEMA et Kruidvat dont les textes sont aussi traduits en français, la recherche dans ce mémoire vise à répondre à la question suivante: Quelle est la qualité des traductions sur l'emballage des produits de HEMA et Kruidvat et qu’elles en sont les conséquences?"
Frankrijk en de toetreding van Spanje tot de Europese Economische Gemeenschap: De terughoudende houding van Frankrijk tijdens de onderhandelingen voor de Europese integratie van Spanje (1979-1986),"['Schaap, A.']","['Massink, S.F.M.']",2016-08-03T17:01:01Z,nl,"['Europese integratie, EG, EEG, NAVO, Frankrijk, Spanje, Franco-regime, González, Mitterrand, Giscard']",Geschiedenis,"In deze bachelorscriptie wordt het onderhandelingsproces onderzocht voor de toetreding van Spanje tot de Europese Gemeenschappen en in het bijzonder de Europese Economische Gemeenschap. Tijdens die onderhandelingen in de periode 1979-1986 stuitten de Spaanse onderhandelaars op verzet van de Franse delegatie. Aan de hand van primair bronnenonderzoek naar egodocumenten van Franse en Spaanse staatshoofden, politici en diplomaten wordt onderzocht waarom Frankrijk de Europese integratie van Spanje belemmerde."
Comment traduire une chanson populaire française en néerlandais?,"['Hugens, M.S.']","['Berns, J.K.M.']",2016-08-03T17:00:59Z,fr,"['Chanson, traduction, Stromae']",Franse taal en cultuur,"« Pourquoi traduire une chanson ? ». La réponse est très simple : une traduction permet de briser la barrière linguistique et permet aux personnes non-natives de la langue source d’avoir la même expérience en écoutant une chanson que les locuteurs natifs de cette langue. 

Dans ce mémoire nous tentons traduire plusieurs chansons du chanteur belge Stromae. Pour bien faire cela, nous étudions d'abord deux théories de traduction des chansons afin de constituer notre propre approche. Notre but est de pouvoir répondre à cette question: 

Dans quelle mesure est-il possible de faire une traduction chantable en néerlandais d’une chanson populaire française en restant fidèle à la musique et au contenu de l’original ?"
Do I Know My Grandparent? An Exploration of Trauma and the Contrast Between Familial and Institutional Knowledge in My Grandfather Would Have Shot Me and De Derde Generatie.,"['Wille, L.C.']","['Knittel, S.C.']",2016-08-04T17:01:14Z,en_US,['Holocaust studies; trauma theory; transgenerational trauma; cultural memory; postmemory; third generation; victims; perpetrators; familial knowledge; institutional knowledge; literature; non-fiction; De Derde Generatie; My Grandfather Would Have Shot Me; Natascha van Weezel; Jennifer Teege'],Literatuurwetenschap,"Grandchildren of victims as well as perpetrators of the Holocaust are now producing works about their family history and their relationship as grandchildren to this history. It is a pivotal moment in history, when the last witnesses are dying and a stark contrast appears between familial and institutional knowledge about the Holocaust. This thesis compares two texts by a grandchild of victims of the Holocaust and by a grandchild of a perpetrator of the Holocaust, showing that the intertwining of and contrast between familial and institutional knowledge can be crucial for the development of trauma in posterity, and that subsequent generations on both sides of the Holocaust do suffer from trauma, although these traumas are different in terms of specific feelings and origin. Finally, this thesis shows the tendency to focus only on the victims and their descendants, and the need of descendants of perpetrators for acknowledgement that they, too, are affected by the Holocaust. Ultimately, this thesis aims to point to the necessity of an opening up of the dialogue about and between these two groups of posterity of the Holocaust."
Tevredenheidsonderzoek bij Middenbouw Leerlingen uit het Primair Onderwijs en Zeer Moeilijk Lerende Leerlingen uit het (Voortgezet) Speciaal Onderwijs,"['Visser, M.F.L.']","['Weijer-Bergsma, E. van de', 'Endendijk, J.']",2016-08-04T17:01:20Z,nl,['Tevredenheidsonderzoek; middenbouwleerlingen; primair onderwijs; zeer moeilijk lerende leerlingen; voortgezet speciaal onderwijs'],Maatschappelijke Opvoedingsvraagstukken,"Ervaring van plezier en veiligheid is belangrijk voor ontwikkeling van leerlingen en hangt via welbevinden, schooltevredenheid en schoolbetrokkenheid samen met schoolprestaties van leerlingen. Het meten en monitoren van tevredenheid van leerlingen is voor schoolbesturen van belang voor het creëren van optimale leer- en ontwikkelomstandigheden op school. Tevredenheidsonderzoek wordt afgenomen onder bovenbouwleerlingen uit het primair onderwijs en leerlingen uit het (voortgezet) speciaal onderwijs. Echter, worden middenbouwleerlingen uit het primair onderwijs en zeer moeilijk lerende leerlingen uit het (voortgezet) speciaal onderwijs niet meegenomen in tevredenheidsonderzoek. Deze leerlingen ervaren moeilijkheden met het invullen van vragenlijsten door struikelblokken op het gebied van tekstbegrip en abstractievermogen. Door te onderzoeken hoe deze struikelblokken kunnen worden vermeden in ontwikkeling van een aangepast meetinstrument kan deelname aan tevredenheidsonderzoek voor deze leerlingen mogelijk worden. Op vier scholen voor primair onderwijs en (voortgezet) speciaal onderwijs is kwalitatief en kwantitatief onderzoek gedaan naar de ontwikkeling van een aangepast meetinstrument voor tevredenheidsonderzoek onder 249 leerlingen. De vragenlijsten per onderwijsvorm zijn tijdens het onderzoek na elke testdag aangepast op het gebied van tekstbegrip en abstractievermogen, op basis van de onderzoeksbevindingen. Uit het onderzoek bleek dat veel aanpassingen uit de vragenlijsten per onderwijsvorm overeenkwamen met elkaar. Onderscheid zou beter kunnen worden gemaakt op ontwikkelingsleeftijd, namelijk voor 4/5/6 jaar, 6/7/8 jaar en voor 8/9 jaar. Middenbouwleerlingen uit het primair onderwijs en zeer moeilijk lerende leerlingen uit het (voortgezet) speciaal onderwijs kunnen vanaf heden deelnemen aan tevredenheidsonderzoek door de ontwikkeling van het aangepaste meetinstrument voor leerlingen met een ontwikkelingsleeftijd van 4 tot 9 jaar."
Body image of patients with morbid obesity before and after bariatric surgery,"['Verhagen, M.']","['Geenen, R.']",2016-08-04T17:01:18Z,en,"['Body image, appearance evaluation, appearance orientation, morbid obesity, bariatric surgery, MBSRQ, self-esteem']",Klinische en Gezondheidspsychologie,"Morbid obesity can have severe psychological impact and is a major risk factor for health issues (Schwartz & Brownell, 2004), such as type 2 diabetes, hypertension and sleep apnea (Gilmartin, Long & Soldin, 2013), higher levels of stress, anxiety, depression, food craving and binge eating disorder (BED) symptoms (Abilés, Rodríguez-Ruiz, Abilés, Mellado, García, Pérez de la Cruz, Fernández-Santaella, 2010) and impairments in quality of life (Sarwer, Lavery & Spitzer, 2012). Understanding body image in relation to obesity may contribute to comprehension of the etiology and maintenance of obesity and may help in improving care. The current study examines the level of body image of patients with morbid obesity before and after bariatric surgery in comparison with the general population, the factors associated with body image before and after bariatric surgery, and the relation of body image with weight-loss outcome.  Body image of 379 patients with morbid obesity was compared to a matched control group of 1517 people from the general population. Body image was measured with a shortened Dutch version of the Multidimensional Body-Self Relations Questionnaire (MBSRQ; Cash, 2000) and Self-Esteem was measured with the Dutch version of the Rosenberg Self-esteem Scale (Rosenberg, 1965; Woertman, 1994). Patients who underwent surgery scored better in terms of appearance evaluation than patients before surgery, but there was still a large difference with the general population. Preoperative patients judged their appearance worse than postoperative patients but attached less importance to their appearance than postoperative patients. Appearance evaluation was shown to be independently predicted by self-esteem indicating lower levels of appearance evaluation in patients with low self-esteem. Moreover, appearance orientation before surgery was shown to be independently predicted by gender, indicating lower levels of appearance orientation in male patients. After surgery, gender and middle education were significant predictors of appearance orientation. Neither body image nor other variables could predict weight-loss. For clinical practice, this study underlines the existence of a subgroup of patients experiencing problems with their body image. Female patients and patients with low self-esteem need extra attention when it comes to body image. Future research, mostly longitudinal, is needed."
"Transgenders en seksualiteit in TANGERINE:
de constructie van sympathie","['Röling, J.A.T.']","['Pafort-Overduin, Clara']",2016-08-04T17:01:11Z,nl,"['Constructie van sympathie, representatie, intersectionaliteit, transgenders, seksualiteit, positieve representatie']",Taal- en cultuurstudies,"In deze analyse wordt aan de hand van Murray Smith’s structure of sympathy onderzocht op welke wijze sympathie geconstrueerd wordt in de Amerikaanse film TANGERINE (2015). Deze theorie beschrijft hoe de kijker drie verschillende fases doorloopt bij de constructie van het gevoel van sympathie of antipathie voor een personage. De uitkomsten hiervan worden mede geïnterpreteerd door gebruik te maken van het begrip intersectionaliteit, met een nadruk op de intersectie van gender, etniciteit en beroep. In de analyse wordt op deze manier geprobeerd om op een nieuwe wijze film- en genderstudies te combineren. Uit het onderzoek is naar voren gekomen dat er middels muziek, cameravoering en shotlengte een accent wordt gelegd op specifieke emoties van de personages. Hierdoor wordt de kijker uitgenodigd, en ruimte geboden, om mee te voelen met de personages en een gevoel van sympathie te ervaren. Dit gevoel wordt kracht bijgezet door de nadruk die gelegd wordt op de gemarginaliseerde positie van de twee hoofdpersonages, Sin-Dee en Alexandra. De film hanteert hierbij een documentaire-stijl, hetgeen de film voorziet van een realistische uitstraling en bijdraagt aan een mogelijke positieve representatie van de getoonde minderheden. De gekozen aanpak in de analyse van TANGERINE zorgt ervoor dat de uitkomsten inzicht geven in meer dan alleen de film zelf, zoals het geval zou zijn bij een standaard representatieanalyse. Er ontstaat inzicht in de wijze waarop een film door de constructie van sympathie, een verandering teweeg zou kunnen brengen in de zienswijze van de kijker. De analyse probeert zo een bijdrage te leveren aan een toename van positieve representaties van gemarginaliseerde groepen in film en op televisie."
The Paradox of Oil: How Oil causes Instability: the case of Nigeria,"['Mierlo, T.C.G.M. van']","['Tuin, I. van der']",2016-08-04T17:01:12Z,en,['Nigeria; oil; instability; conflict; volatility; hegemonic alliance; Dutch Disease; corruption; rent-seeking behavior; greed; grievance; weak state; state repression; degraded human wellbeing; marginalisation'],Liberal Arts and Sciences,"It seems that the presence of oil in the Niger Delta has not led to the wealth and prosperity one might expect, but instead to a situation of instability. Therefore, this research will revolve around the paradoxical question: What role does oil assume in the stability of Nigeria, and to what extent? The role of oil comprises different components entrenched within the local, national and international scopes in which a wide range of stakeholders are involved. To attain a more comprehensive understanding of this complex question, it is of importance to gain knowledge from different disciplines that need to be integrated to achieve this. In this thesis, three disciplines will delve into the Nigerian oil issue: Economics (EC), Environmental Studies & Social Geography (ESSG) and Conflict Studies (CS). Each discipline will elaborate on its own definition of stability and will describe the relationship of this stability to oil in Nigeria and the Niger Delta."
