title,authors,supervisors,date,language,keywords,program,abstract
The Value of Being Thin,"['Dijkema, I.A.']","['Kalis, Annemarie']",2016-08-14T17:00:28Z,en,"['Anorexia Nervosa, Wellbeing, Objective-list Theory, Hedonist Theory, Desire-based Theory, Competence, Balance in Values, Thin, Life, Health.']",Applied Ethics,"In this thesis I will explore a conflict that medical practice is faced with, when dealing with patients who suffer from anorexia nervosa. These patients are primarily concerned with losing weight, in order to achieve their ultimate aim of being thin. This aim is in common perception and in medical practice considered as unreasonable. Therefore, medical practice is aimed at treating these patients to regain a healthy weight and prevent them from death as a result of their underweight. In medical practice, competent patients are allowed to make autonomous decisions with regards to their treatment. Although patients with anorexia nervosa hold a rather unusual balance in their values, they satisfy the required criteria for competence. Medical practice is legally required to take the decisions of these patients seriously. Since their decisions can threaten their health and their life, it is unclear how medical practice should deal with this issue. This study illustrates an ethical analysis of this conflict, and offers three lines of reasoning medical practice can accept to deal with this matter. My main aim is to illustrate which options there are for medical practice, in order to support the wellbeing of patients with anorexia nervosa. This analysis will provide an answer to the question whether or not medical practice should accept that people with anorexia nervosa value being thin as more important than their health or their life."
Literature as Counter-History in The Blind Assassin and Atonement,"['Hoogen Stoevenbeld, L.H.']","['Knittel, S.C.']",2016-08-15T17:00:25Z,en,"['historiographic metafiction, cultural memory, counter-history, The Blind Assassin, Margaret Atwood, Atonement, Ian McEwan, World War II']",Literatuurwetenschap,"By comparing The Blind Assassin by Margaret Atwood and Atonement by Ian McEwan, this thesis provides an insight into the way literature can reflect on the traditional historical narrative, which has been a subject of criticism in postmodernism, and even supplement it. Through their use of literary techniques found in historiographic metafiction and fictions of memory, the two novels criticize the one-sided, dominant representations of the 1930s and 40s in Canada and England, which usually focus on soldiers, bombs, and politics. The novels present a counter-history by reclaiming underrepresented parts of the past; in this case issues of gender and class."
The Relationship Between the Extent of Mental Model and Most Effective Timing of Feedback,"['Verheij, B.J.A.']","['Coppens, L.C.', 'Hoogerheide, V.']",2016-08-18T17:00:31Z,en,['mental model; feedback timing; testing effect; spacing'],Onderwijskundig ontwerp en advisering,"Tests do not only assess what was learned, but they also enhance learning itself. This testing effect is even stronger if the learner receives corrective feedback after a retrieval test. Research concerning the optimal timing of this feedback shows various results. The number of errors could be crucial. The more errors have been made, the more beneficial immediate feedback seems to be; the less errors have been made, the more beneficial delayed feedback seems to be. Initial test score is an indication for the extent of the learner’s mental model about a subject. Moreover, response certitude seems to be an indicator for the extent of mental model. The research question of this study is: to what extent does the size of one’s mental model of a subject determine when corrective feedback can be given best?
	In this quantitative experiment, 112 nine years old students wrote down concepts related to World War II. This subject was not taught at school. Then a test about the subject was presented. One group of students got corrective feedback immediately after answering a question, the other group received the feedback after another lesson. All students indicated how sure they were of each answer. The next day, all students did the same test again.
	A multiple regression analysis was conducted, with feedback condition and extent of mental model (i.e., number of concepts written down before the first test, initial test score and mean response certitude) as independent variables and learning gain as the dependent variable. The research question concerned the interaction effect of condition and extent of mental model. This interaction effect was nonsignificant.
	In this experiment, extent of mental model and optimal feedback timing were not related. Possibly, this can be explained as follows. Although extent of mental model differed a lot amongst students, all had some knowledge about the subject. Possibly, the crucial question is whether an intrinsically right answer to a test item exists or not. If students know that test items are real, they will try to retrieve the answer from long term memory. If they know that the correct answers cannot be known beforehand, taking a test is initial learning, whereby new information should be processed via the working memory. In such cases, immediate feedback might contribute to this initial processing, which could explain better results after immediate feedback in such experiments."
Automatiseren en Bewegen,"['Vliet, M.C. van der']","['Coppens, L.C.', 'Wermeskerken, M.M. van']",2016-08-18T17:00:31Z,nl,['Bewegen; fysieke activiteit; automatiseren'],Onderwijskundig ontwerp en advisering,"Probleemstelling. Vanuit de zorg om de gezondheid van kinderen is de afgelopen jaren steeds meer aandacht voor het belang van bewegen. In verschillende onderzoeken is naast het positieve effect op de gezondheid ook gevonden dat meer bewegen een positieve invloed heeft op het leren van kinderen. Zo heeft bewegen een positieve invloed op het vermogen om cognitieve problemen op te lossen. Het huidige onderzoek bekijkt de invloed van de timing van bewegen op het automatiseren van rekentafels. Het directe verband tussen bewegen en  automatiseren is nog niet aangetoond. De timing van het bewegen kan van invloed zijn op het leren van kinderen en daarmee eveneens op het automatiseren. Of dit zo is, wordt in dit onderzoek bekeken. De onderzoeksvraag luidt dan ook: wat is voor kinderen in groep 4 het effect van de timing (voor of tijdens) van bewegen op het automatiseren van de tafel van 7 op korte en langere termijn? 
Methode. Op drie verschillende manieren is door kinderen in groep 4 van het Nederlandse basisonderwijs geoefend met de tafel van 7. Gedurende twee weken oefenden de kinderen zes keer op de manier die bij hun conditie hoorde. Binnen iedere conditie werd op een ander moment bewogen (voor of tijdens de activiteit). De kinderen in de controleconditie bewogen niet. De kennis van de kinderen werd op drie momenten getest door middel van een tempotoets.
Resultaten. Uit analyse van de resultaten bleek dat er een significant verschil was in scores op de post test en de retentie test. Dit verschil werd alleen gevonden tussen de groep leerlingen die voor het oefenen hebben bewogen en de kinderen die helemaal niet hebben bewogen. Toen de beide bewegen condities gezamenlijk werden vergeleken met de controle conditie was er geen significant verschil. 
Conclusie. Dit onderzoek kan het positieve effect van bewegen niet bevestigen. Er is namelijk geen verschil waar te nemen tussen de kinderen die hebben bewogen voor of tijdens het oefenen en de kinderen die niet hebben bewogen. Dit is in tegenstelling tot de verwachtingen en de resultaten uit eerder onderzoek. De timing van het bewegen is echter wel van belang. Kinderen die vóór het oefenmoment hadden bewogen, scoorden namelijk significant hoger op de tempotoetsen. Hierdoor kan gesteld worden dat door het bewegen voor het oefenen te laten plaatsvinden de leerlingen de tafel van 7 beter beheersen."
The Role of Parents in Interethnic Contact: Do Parental Integration Attitudes Influence the Ethnic Diversity of Their Adolescent Children’s Friendship Networks in Class?,"['Schramkowski, E.C.J.']","['Simsek, M.', 'Nivette, A.E.']",2016-08-18T17:00:31Z,en,['Interethnic contact; interethnic friendship; classroom diversity; ethnic friendship network; integration; intergenerational value-transmission; assimilationism; assimilationist thinking; school choice; social matching; contact theory'],Sociologie,"Abstract. The purpose of this study is to investigate the effect of parental integration attitudes on the ethnic diversity of their adolescent children’s friendship networks in class. Moreover, we are interested in whether this effect is mediated by ethnic classroom diversity. Data for this study were obtained from the Dutch part of the first wave of the Children of Immigrants Longitudinal Survey in Four European Countries [CILS4EU] (Kalter et. al., 2013). The results suggest that for ethnic minority children, a negative relationship between parental adherence to assimilationism and ethnic diversity of friendship networks in class is found. Although no mediating role of ethnic classroom diversity is found, a positive relationship between ethnic classroom diversity and ethnic diversity of friendship networks seems to exist for Dutch respondents."
Opvoedingstaken verdelen in de Nederlandse maatschappij. Een onderzoek naar de verschillen in opvoedingstaakverdeling tussen autochtonen en niet-Westerse allochtonen in Nederland,"['Röben, A.']","['Breeschoten, L., van', 'Assen, M.A.L.M., van']",2016-08-17T17:01:18Z,nl,"['Opvoedingstaakverdeling, niet-Westerse allochtonen, etniciteit, opleiding, religie, machtsafstand,']",Sociologie,"Deze studie onderzoekt in hoeverre er een verschil is tussen niet-Westerse allochtonen en autochtonen in de opvoedingstaakverdeling en hoe dit eventuele verschil kan worden verklaard. Om dit verschil te verklaren wordt er gekeken naar de invloed van religie en opleidingsniveau. Er wordt gebruik gemaakt van de Nederlandse Levensloop Studie om de vraag te beantwoorden en de hypotheses te toetsen. Uit dit onderzoek is gebleken dat er een verschil is tussen niet-Westerse allochtonen en autochtonen in opvoedingstaakverdeling, echter dit is een schijnverband, het verschil wordt verklaard door opleidingsniveau. Religiositeit heeft geen effect op opvoedingstaakverdeling. Naarmate een individu hoger opgeleid is hanteert hij een gelijkere opvoedingstaakverdeling dan een lager opgeleid individu. Niet-Westerse allochtonen zijn gemiddeld lager opgeleid dan autochtonen wat hun minder egalitaire opvoedingstaakverdeling verklaard. Deze studie levert een wetenschappelijke bijdrage omdat onderzoek naar opvoedingstaakverdeling is onderbelicht, terwijl dit van maatschappelijk belang is omdat de positie van vrouwen in familiesystemen economische gevolgen heeft."
Wederkerigheid op de werkvloer? Hoe trainingen en werknemerskenmerken de vertrekintenties beïnvloeden.,"['Heide, A.L. van der']","['Gerwen, N.M.H., van', 'Lössbroek, J.J.H.']",2016-08-17T17:01:17Z,nl,"['Training, vertrekintenties, baantevredenheid, betrokkenheid, opleidingsniveau']",Sociologie,"Employers invest an increasing amount of time and money in on-the-job training for employees. Previous research shows inconsistent results on this matter. The subject of this research is the effect of on-the-job training on the turnover intentions of employees. Applying Gouldner’s (1960) reciprocity principle we expect a negative relation between these two variables. This research analyses both direct effects of education, job satisfaction and commitment and the indirect interaction effects via training on the turnover intention. The Human Capital Theory (Becker, 1963), Mobley’s turnover intention model (1977) and the Social Integration Theory (Ultee, Arts & Flap, 2009) were used to draw the hypotheses. Using the American GSS dataset from 2006 with 798 relevant respondents, a multiple regression model was used to test the hypotheses. Findings show no direct effect of on-the-job training on the turnover intentions, the positive effect that was found, was non-significant. A negative relation was found, however, between job satisfaction and turnover intentions and commitment and turnover intentions. Employees who are satisfied with their job and who are more committed to their company are less likely to leave. Evidence was also found that an interaction effect exists between training and commitment. Thereby, when an employee is highly committed to the employer, the positive effect of training on turnover intentions will be weaker."
The Environment as Public Good: Insights in Environmental Behaviour and Support for Environmental Policies and the influence of Time Preferences,"['Damhuis, E.A.E.']","['Weesie, H.M.', 'Macro, D.A.']",2016-08-18T17:00:32Z,en,"['collective action, collective benefits, time preferences, selective incentives, environmental behaviour, support for environmental policies']",Sociologie,"action in regard to environmental issues. The free-rider problem occurs, where not everyone contributes to a cleaner environment. The contribution to the environment is measured by environmental behaviour and support for environmental policies. The latter indicates willingness to contribute. Although there have been multiple studies in the environmental sociology, this study combines the collective action problem with time preferences. Based on earlier research, collective benefits should have a positive effect on environmental behaviour as well as support for environmental policies. Moreover, theories suggest that there is an effect of selective incentives on behaving environmentally friendly. Also, a positive moderating effect of time preferences is predicted. Data was obtained from the ‘Swiss Environmental Survey 2007’. Results of OLS multiple regression show evidence that supports the effect of collective benefits on environmental behaviour and support for environmental policies. Selective incentives show to be partially explained by the results. There was no evidence found that supports the moderating effect of time preferences on environmental behaviour and on support for environmental policies."
Probleemgedrag op school onder etnische minderheden,"['Harmsen, A.']","['Coopmans, M.', 'Boschman, S.E.']",2016-08-17T17:01:17Z,nl,['Probleemgedrag; school; discriminatie; Nederland; etniciteit; attituden; pro-school; etnische minderheden'],Sociologie,"In dit onderzoek is onderzocht of de effecten van ervaren discriminatie op probleemgedrag van etnische minderheden in Nederland beïnvloed kunnen worden door heersende pro-school attituden in de klassencontext. Op basis van de social exclusion theory wordt verwacht dat het ervaren van discriminatie een positief verband zal hebben met probleemgedrag op school. Op basis van literatuur betreffende de invloed van klassennormen op individueel gedrag wordt verwacht dat pro-school attituden in de klas een negatief verband zal hebben met probleemgedrag op school. Op basis van literatuur betreffende intergroepsverhoudingen wordt verwacht dat pro-school attituden het effect van discriminatie op probleemgedrag zullen beïnvloeden. In dit onderzoek is gebruik gemaakt van de CILS4EU dataset bestaande uit in 2010/2011 ondervraagde 14-jarige scholieren. Regressies zijn uitgevoerd en er is geen bewijs gevonden voor de invloed van pro-school attituden op het effect van discriminatie op probleemgedrag. Wel is bevestigd dat ervaren discriminatie een positief verband heeft met probleemgedrag, en tevens is bevestiging gevonden voor het negatieve verband tussen pro-school attituden in de klas en probleemgedrag op school."
Samenwonen of trouwen; wat is de scheidingskans?,"['Huisman, B.L.M.']","['Heijden, F.I., van der', 'Knigge, A.']",2016-08-18T17:00:30Z,nl,[],Sociologie,"De afgelopen jaren is er een daling te zien in het aantal huwelijkssluitingen en een stijging in het aantal echtscheidingen. In deze bachelor scriptie wordt er met behulp van de Netherlands Kinship Panel Study (NKPS) onderzoek gedaan naar de scheidingskans tussen samenwoners en getrouwden. Eerder onderzoek heeft zich nog niet gericht op het verschil in oorzaken van scheiding tussen samenwoners en getrouwden, wat het interessant maakt om dit te onderzoeken. In deze studie wordt er gebruik gemaakt van de mediatoren verbondenheid en traditionaliteit. De verwachting is dat samenwoners een grotere scheidingskans hebben dan getrouwden. Wanneer er gekeken wordt naar verbondenheid binnen de relatie wordt verondersteld dat getrouwden meer verbondenheid ervaren waardoor hun scheidingskans kleiner is. Ten slotte wordt verwacht dat samenwoners in mindere mate traditionele opvattingen aanhangen, waardoor zij een minder traditionele relatievorm hebben. Hierdoor kan verwacht worden dat zij een grotere scheidingskans hebben. Er wordt een logistische regressie uitgevoerd (N=3516) om dit verband te onderzoeken. Resultaten laten zien dat de scheidingskans voor samenwoners groter is dan voor getrouwden. Dit verband wordt gedeeltelijk verklaard door emotionele verbondenheid en traditionaliteit."
Kunst en de klimaattop,"['Dubbers, Y.']","['Zonnenberg, N.S.J.F.']",2016-08-22T17:01:21Z,nl,"['Kunst, klimaattop, activisme, kunstenaar-activist, kunstenaar-organisator, Climate Games, Olafur Eliasson, Brandalism, McKee, Weibel, Raunig, COP21']",Kunstgeschiedenis,"De invloed van de kunstenaar-activist op het maatschappelijke debat over klimaatverandering.

Toen demonstraties werden verboden tijdens de klimaattop, die van 30 november tot en met 12 december 2015 in Parijs werd gehouden, werden kunstprojecten noodgedwongen vrijwel het enige middel om de stem van het volk te verbeelden. 
	Voor deze scriptie is onderzoek gedaan naar dertig kunstprojecten die tijdens de klimaattop te zien waren, waaronder projecten van Brandalism, Olafur Eliasson, Tools for Action en Teresa Borasino. De kunstprojecten zijn in kaart gebracht door middel van een kwantitatief onderzoek en gekoppeld aan het werk van drie schrijvers die actief zijn in hedendaagse kunstdiscours rondom protestkunst. De Amerikaanse kunstcriticus Yates McKee, de Oostenrijkse curator, kunstenaar en theoreticus Peter Weibel en de Oostenrijkse filosoof en kunsttheoreticus Gerald Raunig schetsen een beeld van hedendaagse kunst die, op momenten van overlapping met activisme, grote invloed kan hebben op de maatschappij. In deze scriptie wordt daarom onderzocht in hoeverre de hedendaagse kunstenaar-activist bijgedragen heeft aan het publieke debat over klimaatverandering dat ontstond rondom de klimaattop in Parijs.
	In dit onderzoek is naar voren gekomen dat er een tweedeling gemaakt kan worden tussen activistische kunstprojecten van grassroots-organisaties, die met hun werk kritiek leverden op het politieke en economische systeem, en geëngageerde kunstenaars, die minder kritisch waren op het systeem en eerder als doel hadden de toeschouwer bewust te maken van de klimaatproblematiek en zijn eigen aandeel daarin. Binnen de grassroots-organisaties was de kunstenaar-activist actief: hij organiseerde creatieve protestacties en creëerde een netwerk waarbinnen zowel activisten als burgers actief waren. De kunstenaar-activist gebruikte daarnaast vooral de sociale media om zijn werk binnen de maatschappelijke en politieke context te plaatsen en de protestbeweging te vergroten. In de reguliere media is de verbinding die de kunstenaar-activist aangaat met de maatschappij en de belangrijke rol die hij had in de vorming van het debat niet duidelijk terug te zien.
	Hoewel de verbinding die de kunstenaar-activisten met de maatschappij hadden niet goed weergegeven werd in de media, is uit dit onderzoek duidelijk geworden dat de kunstenaar-activisten op straat en op het internet wél kanalen hebben gevonden om de publieke opinie te beïnvloeden. Door zijn creativiteit, durf en organisatorisch vermogen heeft de kunstenaar-activist veel gewone burgers gemobiliseerd en aangezet tot actie. Zodoende heeft de kunstenaar-activist gezorgd dat de strenge veiligheidsmaatregelen op een creatieve wijze omzeild konden worden om tijdens de klimaattop toch een tegengeluid te kunnen laten horen."
Measuring the legacy of plants and plant traits using UAV-based optical sensors,"['Meij, R.P. van der']","['Kooistra, L.']",2016-08-22T17:01:13Z,en,"['UAVs, Remote Sensing, precision agriculture, crop traits, treatment effects, height, nitrogen, leaf chlorophyll, biomass, carbon']",Geographical Information Management and Applications (GIMA),"Although they have been effectively around for several decades, the societal interest for Unmanned Aerial Vehicles (UAVs) has recently taken off dramatically.It is anticipated that (precision) agriculture (PA) in particular will represent the largest client of UAV technology in the coming decade.practitioners of PA consider the presence of complex in field variability and require accurate and repeated information regarding crop statuses on a detailed small scale to adjust their intervening practices accordingly. A UAV flight was conducted in the 2015 growing season over a field comprising of seventy separate plots cultivated with oats, each having received different treatments. Spectral data was acquired in the visible and near-infrared range (450-915nm) over 94 adjacent wavebands by a hyperspectral push broom scanner. The acquired hyperspectral data was related to in situ measured crop parameters in an independent calibration procedure through univariate regression analysis over individual wavebands, existing vegetation indices (VIs), new optimized indices and partial least squares (PLS) regression. A selection of the best performing indices and models found during calibration was evaluated with respect to their precision and predictive accuracies on an independent validation set. Validation displayed considerably varied results, indicated by relatively high prediction capabilities for models estimating crop height (CVRMSE = 5.12%, R2 = 0.79) followed by leaf chlorophyll content (CVRMSE = 14.5%. R2 = 0.79). The best models related to prediction of N content (CVRMSE = 21.6%. R2 = 0.68), fresh biomass (CVRMSE = 20.8%. R2 = 0.56) and C content (CVRMSE = 20.8%. R2 = 0.52) exhibited larger prediction inaccuracies and lower precision. Furthermore, the outcomes suggest that predictions through remotely sensed UAV data for height, leaf Chl content, N content and, to a lesser degree, fresh biomass may be effectively further discriminated for different cultivars and their associated treatments"
"Predictors to the frequency of using an electric bicycle sharing system: A case study to the influence of socio-demographics, lifestyle, motivations and barriers for using BiciMAD - the electric bicycle sharing system of Madrid","['Korse, V.']","['Ettema, D.F.']",2016-08-22T17:01:14Z,en,"['electric bicycles, bike sharing system, lifestyle, motivations and barriers, Madrid']",Human Geography and Planning,"Contemporary societies, and especially dense urban areas, are finding a solution to the high levels of air pollution and the high amount of overweight people due to physical inactivity and sedentary lifestyles. One way in overcoming these problems is to set in motion a switch in people's travel mode choices. For example, by replacing private car trips with active travel modes such as (electric) bicycles. Since more and more cities are introducing bicycle sharing systems to their residents nowadays, this study aims to gain insight into the preferences and necessities of users. The goal of this study is to explore the predictors to the frequency of using BiciMAD, the electric bicycle sharing system of Madrid, introduced in June 2015. Based on a completed survey by 514 current BiciMAD-users, this study confirms that motivations and barriers to using an electric bicycle sharing system play a more important and influential role compared to socio-demographic and spatial variables. Cities aiming to introduce such a system in the near future may apply this study's outcomes when introducing and promoting the system to its urban residents."
