title,authors,supervisors,date,language,keywords,program,abstract
"Why is the Universe Spatially Flat? 
An argument from conformal symmetry.","['Awwad, Y.']","['Prokopec, T.']",2017-07-26T17:01:43Z,en,"['Conformal, Gravity, Flat, Universe, General, Relativity, Symmetry, Isometry, Symmetries, Isometries, Killing']",Theoretical Physics,"The 't Hooft criterion states that smallness of a physical parameter can be considered \textit{technically natural} if setting it to zero would enhance the symmetry of the system. In this work we propose to extend this criterion to include space-time isometries and curvature. Within this framework, the observed smallness of the curvature of the universe can be understood as technically natural (and protected from quantum fluctuations) if setting curvature to zero increases the number of isometries of space-time.

In General Relativity, setting the curvature of an expanding space-time to zero does not lead to additional isometries. However, such a symmetry enhancement does happen if we consider Conformal Gravity, where we modify gravity to be conformally symmetric.

Studying the behaviour of conformal isometries leads us to formulate the Geometric Isolation conjecture. This asserts that a manifold that decomposes nontrivially into two or more isolated factors admits only a limited number of conformal symmetries. In such a setting, the conformal Killing equation can be greatly simplified and will yield fewer independent solutions than allowed by the dimension of the manifold.

We apply these principles to cosmological space-times that factor as $\RR \times \Sigma$, where $\RR$ indicates the time-like direction and $\Sigma$ an expanding, space-like 3-manifold. We will deviate from the usual FLRW space-times where $\Sigma$ is chosen to be one of $S^3$, $\RR^3$ or $\HH^3$ and instead allow $\Sigma$ to be one of the eight geometries from Thurston's Geometrization Conjecture. While the Conformal Gravity setting introduces extra isometries for any choice of $\Sigma$, we will show that only the flat geometry $\Sigma \simeq \RR^3$ restores the full conformal group in four dimensions.

As a result, flat space-time represents a point of exceedingly enhanced symmetry, thus satisfying the requirement for our extension of 't Hooft technical naturalness."
"""De christenen van nu zijn filosofen"": identiteitsconstructie en psychologische processen in de 'Octavius' van Minucius Felix","['Maas, M. van der']","['Rutgers, L.V.']",2017-07-27T17:01:05Z,nl,"['christenen, christendom, filosofie, late oudheid, Minucius Felix, Octavius, identiteit, identiteitsconstructie']",Geschiedenis,"In dit onderzoek wordt ingegaan op vroegchristelijke identiteitsconstructie, aan de hand van de tweede- of derde eeuwse tekst Octavius, geschreven door Marcus Minucius Felix. Door gebruik van sociaalpsychologisch onderzoek naar intergroup relations – oftewel: de manieren waarop relaties tussen maatschappelijke groepen werken – is een bijdrage getracht te leveren aan het debat omtrent de vraag in hoeverre binnen vroegchristelijke teksten sprake is van identiteitsconstructie in overeenstemming met de realiteit. Hieruit zal blijken dat zowel mentale processen als de apologetische traditie waarbinnen Minucius schreef van invloed waren op zijn constructie van een christelijke identiteit."
Architecture Mining with ArchitectureCity,"['Rooimans, R.M.']","['van der Werf, J.M.E.M.', 'Hage, J.']",2017-07-26T17:01:41Z,en,"['Architecture Mining, ArchitectureCity, Process Mining, Software Architecture, CodeCity,']",Computing Science,"Ideally, software documentation follows the actual implementation. 
However, due to a plethora of reasons, many software systems have outdated or incomplete architecture documentation.
In this paper, we present an approach that relies on the actual operation of software to gain new insights for software architects. 
Based on the software operation data generated by the system, we employ architecture mining to extract and enhance operational data to support the software architect. 
For this, we have developed the Architectural Intelligence Mining Framework, and more specifically, ArchitectureCity, which uses the analogy of cities to visualize the runtime of software: buildings, representing individual architectural elements are grouped in districts based on different clustering techniques, and streets depict the traffic between the different districts.
We have applied the framework to a real life case study. The visualization techniques were positively received, which shows the potential of the proposed techniques."
"‘Fearing a loss to a colony’. Hockey in het Britse Rijk.
De prestaties van het Brits-Indische olympische hockeyelftal in de Britse media als onderdeel van de koloniale verhoudingen van Groot-Brittannië met Brits-Indië, 10 maart-28 mei 1928.","['Keeris, W.H.T.']","['Jagt, J.W. van der']",2017-07-26T17:01:51Z,nl,[],Geschiedenis,
De rol van sociale informatieverwerking bij het effect van de interventie Programma Alternatieve Denkstrategieën (PAD) op reactieve en proactieve agressie,"['Stroobant, M.']","['Kluin-Haster, M.', 'Liber, J.']",2017-07-31T17:01:34Z,nl,['Sociale Informatieverwerking; Programma Alternatieve Denkstrategieën; PAD; klasinterventie; agressie; reactieve agressie; proactieve agressie'],Klinische kinder- en jeugdpsychologie,"De huidige studie onderzocht of de implementatie van de interventie Programma Alternatieve Denkstrategieën (PAD) van invloed was op de vermindering van zowel reactieve als proactieve agressie bij jongens met externaliserende gedragsproblemen. Er werd onderzocht of er een verbetering van verschillende sociale informatieverwerkingsprocessen plaatsvond na de implementatie van PAD en of deze verbetering van invloed was op de vermindering van reactieve en proactieve agressie. De scholen van de 113 jongens met een leeftijd variërend van 6 tot 11 jaar, werden willekeurig toegewezen aan de experimentele groep en de controle groep. De interventie PAD werd geïmplementeerd in de experimentele groep en in de controle groep werd de gebruikelijke aanpak uitgevoerd. Ouderrapportages werden gebruikt om proactieve en reactieve agressie te meten. Participanten luisterden naar vignetten over provocaties van leeftijdsgenoten en beantwoordden vragen betreffende sociale informatieverwerkingsprocessen. Er werd een effect gevonden van PAD op het genereren van een agressieve respons. Tevens zorgde de interventie PAD voor een vermindering van reactieve agressie, niet voor proactieve agressie. Ook werd er geen mediatie-effect gevonden van de verschillende sociale informatieverwerkingsprocessen op de relatie van PAD op reactieve en proactieve agressie. Echter, door de kwaliteit van de gebruikte test moeten deze resultaten met grote voorzichtigheid geïnterpreteerd worden en is verder onderzoek naar de rol van zowel eerdere als latere sociale informatieverwerkingsprocessen bij het effect van de interventie PAD op reactieve en proactieve agressie gewenst."
Phase-based treatment for PTSD in refugees and depression as predictor of treatment outcome: a preliminary evaluation,"['Ahmić, S.']","['Boelen, P.A.', 'Knipscheer, J.W.', 'Rie, S. de la']",2017-07-31T17:01:38Z,en,"['PTSD, complex trauma, refugees, phase-based treatment, NET, depression, treatment outcome.']",Klinische en Gezondheidspsychologie,"Background: Refugees have an increased risk for developing PTSD with a comorbid major depression. According to the ISTSS Expert Consensus Treatment Guidelines for Complex PTSD, phase-based treatment can be applied to reduce posttraumatic stress disorder (PTSD) in populations with complex trauma. Nevertheless, little is known about phase-based PTSD treatment in refugees with PTSD and complex trauma, often with a comorbid depression. Aim: This study describes an evaluation of a phase-based treatment in refugees with complex trauma and PTSD. The second aim is to test if depression is a predictor of treatment outcome. Method: The Clinician Administered PTSD Scale (CAPS) was administered in a sample of 33 refugees with PTSD who participated in the phase-based treatment. From this sample, 25 refugees completed The Brief Symptom Inventory (BSI). The BSI was employed to assess depression. Treatment consisted of psycho-education, creative arts therapy, psychomotor therapy, Narrative Exposure Therapy (NET) and socio-therapy. Results: Analysis showed that PTSD symptoms were reduced after treatment. One-third of the participants demonstrated a reliable and clinically significant change. Depression was not significantly associated with treatment outcome and did not decrease after treatment. Demographic variables did not predict treatment outcome or depression scores. Conclusion: Because significant improvement was established, the phase-based treatment may be successfully applied to reduce PTSD symptoms in refugees with complex trauma and PTSD. A separate treatment for depression is suggested. Implications and recommendations for future research are discussed."
"Biscuits, self-control, chocolate cakes and response conflicts: the influence of trait self-control and temptation strength on the conflict between one’s short and long-term goals","['Vlek, M.J.']","['Gillebaart, M.', 'Benjamins, J.S.']",2017-07-31T17:01:34Z,en,['Temptation strength; trait self-control; categorization task; response conflict'],Klinische en Gezondheidspsychologie,"This study investigated in what way one’s level of trait self-control, as well as the strength of a temptation influences the magnitude and process of a response conflict. To gain insight into this, a digital mouse tracker categorization task was used, in which participants categorized foods of varying temptation strength. Participants were students at Utrecht University. Prior to starting the task, they filled in the Brief Self-Control Scale to assess their level of trait self-control. Contrary to expectations, results from the categorization task indicated the magnitude of a response conflict appeared to be lower in participants with a higher level of trait self-control. An interaction was found between temptation strength and the level of trait self-control, influencing this magnitude: a higher magnitude was observed for people lower in self-control than for people higher in self-control. The size difference in the magnitude of a response conflict between people high and low self-control was bigger when pictures of weakly tempting food were shown than for when pictures of highly tempting food were shown. For the process of a response conflict, no main effect of the level of trait self-control was found. There was no interaction between the temptation strength of level of trait self-control for the process of a response conflict. Based on these results, suggestions for future research are given."
To what extent do positive psychological interventions prevent negative functioning and promote well-being,"['Taher, R. Al']","['Doosje, S.', 'Bockting, C.L.H.']",2017-07-31T17:01:39Z,en,[],Klinische en Gezondheidspsychologie,"The prevalence rates of well-being show that only 17% of the world population is flourishing, which
increases the risk in developing mental illnesses, such as depression. The use of Positive Psychology
Interventions (PPIs) have been used in previous studies to increase well-being and buffer against negative
functioning. The purpose of the present study is to investigate the relationship between well-being and
negative functioning; it was hypothesized that there will be a negative correlation between well-being and
negative functioning, that there will be an increase in well-being levels compared to the control group, a
decrease in negative functioning levels compared to the control, and that exercise frequency will have a
significant role in the increase and decrease of those levels compared to the control group. Method: An
online intervention study with a between-measures design was used, consisting of three groups, one control
and two experimental (gratitude and mindfulness). 203 participants (M= 29.65; SD = 11.59) completed the
study. Participants had to fill-out a pre-test questionnaire, had eight days to practice their exercise, and a
post-test questionnaire. Results: two Pearson’s correlations was used to check between CES-D and MHCSF
during the pre-and-posttest and found statistically significant correlations (pre: r = -.705; df = 201; p
= .000; r2= .497); (post: r = -.538; df = 201; p = .000; r2 = .289); a GLM ANCOVA showed that gratitude and
mindfulness conditions did not lead to a greater decrease in negative functioning F(2,178) = 0.23; p = .17.,
nor with exercise frequency F(14,178) = 1.37; p = .18, and did not lead to an increase in well-being levels
F(2,178) = 0.05; p = .953., nor with exercise frequency F(14,178) = 1.06; p = .40. Conclusions: While there
is a negative correlation between well-being levels and negative functioning, the study did not find that the
role of positive activities and exercise frequency have a significant effect in increasing well-being and
decreasing negative functioning. We did find an increase in well-being levels over time due to exercise
frequency."
De ontwikkeling van eerste en tweede orde theory of mind vaardigheden bij kinderen,"['Luitse, F.C.']","['Boom, J.', 'Liber, J.M.']",2017-07-31T17:01:37Z,nl,['Theory of mind; vaardigheden; ontwikkeling; kinderen; eerste orde; tweede orde; faux pas; TOM; deceptie;'],Klinische kinder- en jeugdpsychologie,"Deze studie onderzoekt de ontwikkeling van verschillende theory of mind vaardigheden bij kinderen met meerdere taken. Het doel is om de eerste orde en tweede orde vaardigheden van theory of mind op eenzelfde leeftijdsschaal in kaart te brengen. We hebben 61 normaal ontwikkelende kinderen van 4-12 jaar onderzocht. Een logistische regressieanalyse is uitgevoerd waarbij de waarschijnlijkheid dat een kind correct antwoordt op een taak is uitgezet tegen de leeftijd. We hebben gevonden dat eerste orde vaardigheden eerder ontwikkelen dan tweede orde vaardigheden, maar dat de ontwikkeling van tweede orde vaardigheden al begint voordat de ontwikkeling van eerste orde vaardigheden is afgerond. Deceptie lijkt eerder te ontwikkelen bij kinderen dan false belief, maar ontwikkeling van false belief ontwikkelt eerder dan tweede orde vaardigheden. Het begrijpen van liegen, doen-alsof, het maken van grapjes, bluf, beeldspraak en sarcasme begint al op 7-jarige leeftijd, na de ontwikkeling van false belief, maar voor de ontwikkeling van faux pas. Kinderen lijken op 11-jarige leeftijd pas begrip te krijgen van faux pas. Kinderen blijken vaardigheden als het aannemen van verschillende rollen en perspectieven en empathie eerder te ontwikkelen dan de verwachtte 9-jarige leeftijd."
Confronted with chocolate: The role of self-control and temptation strength on food consumption,"['Hoonhoud, E.']","['Gillebaart, M.', 'Prinsen, S.']",2017-07-31T17:01:35Z,en,['Self-control; temptation strength; interaction effect; eating behavior; health'],Klinische en Gezondheidspsychologie,"Temptations can evoke a conflict between immediate, smaller motives (i.e. enjoying a chocolate bar) and abstract, larger motives (i.e. losing weight). In order to resist temptations and behave in accordance with the long-term and larger motives, self-control is needed. Furthermore, the strength of a temptation influences whether people can resist temptations and make future-oriented decisions as well. The aim of the current research was to study the effect of both self-control and temptation strength on behavior and to examine the interaction effect between self-control and temptation strength on behavior. The sample consisted of 101 participants between 16 and 50 years of age (M = 22.38, SD = 4.26). The independent variables in this study were temptation strength, which was manipulated by offering the participants either weakly tempting or highly tempting food, and trait self-control, which was measured on a continuous scale. The dependent variable in this study was the amount of chocolate the participants consumed. Contradictory to the expectations, there was no significant predictive value of both self-control and temptation strength on food consumption. The predictive value of the interaction between self-control and temptation strength on food consumption turned out to be non-significant as well. Further research into the effect of this interaction on behavior is needed. The current study can be seen as the starting point of research into the interaction between self-control and temptation strength, as it is the first to combine these two."
"Promoting healthy food choice with a visual cue
The influence of manipulating simulation with a visual product extrinsic cue on sensory evaluation and liking of a food product.","['Antheunisse, C.']","['Smeets, M.A.M.', 'Naber, M.']",2017-07-31T17:01:37Z,en,[],Toegepaste cognitieve psychologie,"Moving consumers towards the choice of healthier reformulated food is challenging, as reformulated food and even reduced-salt labels generate a negative taste expectation and experience. However, it is known that if consumers merely perceive a visual of a food item, this can trigger simulations of consuming it, resulting into certain behaviour intentions and attitudes. Adopting a grounded cognition perspective, we suggest that showing a visual cue, congruent to the situated eating context of a food product (soup in a kitchen) leads to more simulation of the soup consumption experience, more salivation, more liking and a different sensory evaluation, compared to showing a visual cue, incongruent to the situated eating context (soup in a cinema). These hypotheses were tested in a between-subjects design with three conditions. In an experiment, simulation was manipulated by a visual cue (congruent, incongruent or control) and a tasting session was executed. As expected, a congruent visual leads to more simulation on aspects directly related to the food product itself, an increase in the amount of salivation, increased desire to eat the product and the expectation to like the product more, than an incongruent visual. Surprisingly, results do not indicate any direct or indirect effect (mediated by simulation) of congruence on liking of the food product or the sensory evaluation. These findings suggest that using simple unconscious visual cues can facilitate the choice of healthy food, but more research is needed on how these cues can also influence the taste experience itself."
De invloed van sociale steun als beschermende factor voor de negatieve gevolgen van pesten en gepest worden.,"['Keek, M.P.M.']","['Onrust, S.', 'Orobio de Castro, B.']",2017-07-31T17:01:36Z,nl,['Pesten; sociale steun; zelfwaardering'],Klinische kinder- en jeugdpsychologie,"Pesten is een groot probleem op basisscholen. Dit gedrag brengt serieuze gevolgen met zich mee op fysiek, emotioneel en sociaal vlak voor zowel kinderen die gepest worden als kinderen die pesten. In dit onderzoek werd gekeken of sociale steun een beschermende factor is voor de negatieve gevolgen van pesten en gepest worden. Zowel de directe invloed als de langetermijninvloed werd in acht genomen. Er werd gebruik gemaakt van een bestaande dataset van een quasi-experimenteel onderzoek waarbij enkel data van de controlegroep werd gebruikt (N = 903; Mleeftijd = 10.98). Zoals verwacht hadden kinderen die gepest werden, een lagere zelfwaardering dan kinderen die niet gepest werden. Daarnaast werd er een positief verband gevonden tussen sociale steun en zelfwaardering. Tot slot bleek sociale steun directe bescherming te bieden voor de zelfwaardering van kinderen die gepest worden. Voor kinderen die pesten was sociale steun een moderator in de relatie met zelfwaardering op de lange termijn. Hieruit blijkt dat sociale steun een belangrijke rol speelt, wanneer wordt gekeken naar de negatieve gevolgen van pestgedrag."
BANG: The consequences of FP voters' static understanding of national identity in contemporary multicultural society.,"['Tas, S.H.']","['Belia, V']",2017-08-02T17:02:11Z,en_US,"['FP voters, Self/Other distinction, National identity, Multiculturalism, Whiteness,']",Taal- en cultuurstudies,"On March 15, 2017, 13.33% of the Dutch electorate voted for the Freedom Party (FP) of Geert Wilders, making his party the second largest party represented in our countries national parliament. Wilders is a much-contested politician, who stands out mostly because of his crude language about Muslims and Dutch Moroccans. His victory emphasizes an increasingly hostile political divide in the Netherlands about the position of (im)migrants. This divide - and its hostility - urges for an understanding of the position of FP voters, so as to sustain a peaceful society. 
In this research, an attempt is made to understand the concerns of the people who vote for the FP, led by the research question: How do FP voters construct the ‘Self’ via the ‘Other’? 
In order to answer this research question, the discourse of the respondents in the book KWAAD (ANGRY) by Joost Niemöller, is analyzed. KWAAD consists of extensive interviews about immigrants with a diverse group of 31 ‘angry’ Dutch people who (plan to) vote for the Freedom Party. 
The analysis establishes that the sense of ‘Self’ of the FP voters in KWAAD is derived from a notion of national identity that treats culture as a possession instead of a process. This binary understanding of culture means that the Dutch identity is in a zero-sum conflict with outside influences, resulting in intolerance for other cultures. Furthermore, we see that Muslims – who are the ultimate ‘Other’ – are painted as intolerant, disrespectful, backwards, aggressive, inferior, criminal and oversexualized, which conversely renders the ‘Self’ as an innocent, feminized victim of the presence of this invasive ‘Other’. The accumulation of these characterizations is seen in the fact that respondents consider themselves to be oppressed. The interviewees report being marginalized and excluded from the public debate by the dominant mainstream, and feel silenced when expressing their opinions about Muslims. 	
When accepting the foundational understanding of national identity as static and incompatible with outside influences, it becomes self-evident that ‘our’ culture should be defended against outside influences, most notably against Muslims. It subsequently becomes understandable that a vote for Wilders and his radical views is the only alternative."
Factors relating to the divergence in success of economic liberalisation of formerly communist Eastern European countries (1990-2015),"['Rebel, D.J.']","['van Zanden, Prof. Dr. J.L.']",2017-08-02T17:02:08Z,en,"['Liberalisation, Eastern Europe, Economic Development, Comparative Historical Study']",Geschiedenis van Politiek en Maatschappij,"Liberalisation has been a key word for economic improvement since the 1970s, however it is not the only
time liberalisation has taken place. Additionally, it has not always proven effective at solving a nation’s
economic ills. To find out what factors determine the success of economic liberalization, this research
performs a series of regressions on several factors, across multiple countries in Eastern Europe. It
determines success by looking at GDP (per capita, PPP), unemployment, net migration, and the suicide
rate. Three hypotheses are used to guide research, based on explanations most commonly used in the
debate surrounding the explanation of the divergent results of liberalisation in Eastern Europe. These
hypotheses revolve around preconditions, policy, or international factors being the primary explanatory
factors. Statistics from the World Bank and IMF are used as primary sources for data, with the great
volume of previous studies of smaller scale or breadth providing secondary sources and historical context.
The historical analysis of the data and context provides explanations for each of the dependent variables
by comparing countries that performed well with those that did not in relation to the dependent variable
in question. The study concludes that for GDP per capita PPP policy, factors influencing policy, and EU
membership carry the most explanatory weight. For divergence in the unemployment rate policy is again
the primary explanator, influencing the unemployment rate’s reaction to the general growth of the
economy, though preconditions factor into how much the rate could grow or be reduced. Divergence in
the suicide rate is linked to social shocks, which are in part linked to preconditions and policy, but also
general economic shocks. More research must be done on the influence of social factors on the suicide rate
however. More research also is required on social, and perhaps legal factors regarding the divergence of
net migration, as this study does not manage to reach substantial conclusions from investigating it."
