title,authors,supervisors,date,language,keywords,program,abstract
The Gansstraat demonstration: The location of the islamic migrant other at a spacial contesting performance.,"['Rouhof, L.D.']","['Van de Hemel, Ernst']",2018-08-18T17:01:28Z,en,"['Islam, Spatiality, Spatial performance, Migrant other, Demostration, AZC, Anti-AZC movements, Islamophobia']",Islam en Arabisch,"Anti-AZC protest performances communicate a rejection of an (potential) AZC within a particular geographical area. It is the case, however, that these performances cover more than a territorial struggle. With the use of spatial theory the Gansstraat demonstration, a collaboration between a local anti-AZC movement and a national political party based on anti-migration sentiments, is understood as a contestation where the perceived spatial homogeneity is threatened by a change of representation to the particular locality of Sterrenwijk in Utrecht. 

It appears that a perception of the migrant other contributes to a desire to secure the territorial boundaries of a social homogeneity, particularly as multiple anti-AZC protests are performed in Islamophobic rhetoric. This is also the case with the Gansstraat demonstration."
Prognostic Significance of Tumour-Associated Macrophages in Head and Neck Cancers: a Systematic Literature Review and a Study into their Effects in Nasopharyngeal Carcinoma,"['Sanders, M.E.']","['Ooft, M. L.']",2018-09-18T17:01:35Z,en,"['Keywords article 1: tumour-associated macrophages, M1, M2, head and neck cancer, CD68, CD163, prognosis\n\nKeywords article 2: tumour-associated macrophages, nasopharyngeal carcinoma, EBV, CD68, CD163, FoxP3, Tregs, prognosis']",UCU Liberal Arts and Sciences  - Sciences: Medical Sciences,"Foreword: This bachelor thesis consists of two articles, a systematic literature review that assesses the diverse roles of macrophages in head and neck cancers and a scientific research article identifying the prognostic role of macrophages in nasopharyngeal carcinoma. 

Article 1: Prognostic Significance of Tumour-Associated Macrophages in Cancers of the Head and Neck: a Systematic Literature Review
BACKGROUND: Head and neck cancers account for a global incidence of more than 650,000 cases annually. Since head and neck cancers are characterized by poor survival rates it is essential to identify prognostic factors. Tumour-associated macrophages (TAMs) have a diverse set of functions in tumours and can be both pro- and anti-tumourogenic. 
OBJECTIVE: To assess the prognostic role of TAMs for survival in HNSCCs with a focus on identifying diverse roles of the subpopulations of TAM in a systematic literature review.
METHODS: A systematic search of PubMed and Embase was performed for publications matching the domain of “head and neck cancer,” determinate of “macrophages” up to the date of 7th of July, 2016. All the articles were screened for prognostic studies that matched with the domain and the determinate. Using Quality in Prognostic Studies (QUIPS) relevant studies were evaluated for risk of bias. Information on immunomarkers, macrophage subtypes and other relevant clinicopathologic characterteristics was extracted from the data and compared. 
RESULTS: The initial search generated 281 studies. Eight studies were finally selected on the inclusion criterion. This included 6 studies focused on oral squamous cell carcinoma (OSCC), 1 study on oropharyngeal squamous cell carcinoma (OPSCC) and 1 study on supraglottic laryngeal carcinoma. All 8 studies looked at pan-macrophage marker CD68, while 3 studies looked at M2 macrophage-specific marker CD163. Four of the studies reported that elevated CD68 count was related to poor survival outcome, while the other four reported non-significant findings regarding CD68 association with survival. The 3 studies looking at CD163, all reported significant correlation with poor prognosis. 
CONCLUSIONS: Although some bias cannot be excluded, high density of TAM seems to be associated with worse overall survival in head and neck squamous cell carcinoma. M2 macrophage plays an active role in tumour development and progression. 

Article 2: The Prognostic Significance of Tumour-Associated Macrophages in Nasopharyngeal Carcinoma
BACKGROUND: Nasopharyngeal carcinoma (NPC) is characterized by considerable amount of immune infiltrate. There is controversy among studies about whether tumour-associated macrophages (TAMs) density positively or negatively affect prognosis in tumours. Since NPC differs so significantly from other cancers of the head and neck region it is imperative to identify suitable prognostic factors.
OBJECTIVES: To assess the prognostic significance of TAMs and T regulatory cells (Tregs) in NPC.
MATERIALS AND METHODS: This study included 92 patients with NPC. CD68, CD163 and FoxP3 antibodies were used to identify and assess the expression levels of TAMs and T regulatory cells using immunohistochemistry. A tissue microarray was used for the high throughput analysis of the samples. Samples were semi-quantitatively scored and divided into groups of high and low expression. Correlations between clinicopathologic characteristics were assessed using the Pearson X2 test and ANOVA for continues variables. Survival analyses were performed using the Kaplan-Meier method and the Cox proportional hazards model.
RESULTS: The mean immunomarker counts of CD68 and FoxP3 were significantly higher in EBV positive cells compared to EBV negative cells and elevated CD68 and FoxP3 expression was correlated with EBV-positive NPCs. Both CD68 and CD163 were positively correlated with high FoxP3 expression. Elevated FoxP3 expression was strongly associated with increased overall survival (HR 3.283 (95% CI: 1.139-9.464)). Macrophage markers, CD68 andCD163, did not show significant relation to survival.
CONCLUSIONS: Elevated levels of Tregs, immune cells that have previously been associated with tumour progression, are in fact beneficial for survival in patients with NPC. This may however be related to the EBV status in NPCs. Despite significant differences in TAM density in the different NPC subsets, neither macrophage marker was significantly correlated with survival rate."
Evaluation of the efficacy of IQV04 for weight loss in overweight and obese dogs.,"['Bieze, A.']","['Corbee, R.J.']",2018-09-18T17:01:28Z,en,"['Obesity, overweight, dogs, weight loss, IQV04']",Geneeskunde van gezelschapsdieren,"Introduction: Overweight and obesity are worldwide problems. Because of the higher risk of associated diseases, it is better to prevent and treat overweight and obesity. Beside weight loss programs, there are different medications and supplements available. After promising results from human health studies on the efficacy of Litramine, a similar product, named IQV04, is developed for dogs to support weight loss. The objective of this study was to evaluate the efficacy of IQV04 for weight loss in overweight and obese dogs. 
Materials and methods: Nineteen colony dogs were randomly divided in three groups, in this placebo controlled and double-blinded study. All dogs received once a day a standardised maintenance meal for their resting energy requirement (RER) with one of the three pills (IQV04 concentration A, IQV04 concentration B and placebo). Body weight and pelvic circumference were measured weekly. By start and end of the study, physical examination, body condition score, complete blood count, serum biochemical analysis and fecal examination was done. 
Results: Results suggested that there was a difference in body weight reduction between the three groups. The rate of weight loss in the placebo, IQV04 concentration A and IQV04 concentration B group were 2.45 ± 0.51, 2.85 ± 1.84 and 3.03 ± 1.26% body weight reduction per week, respectively. However, this difference did not reach significance. Also there was no significant difference found in pelvic circumference reduction per week. 
Conclusion: Further studies with larger patient pool are required to achieve more statistic power."
Finance Neutral Output Gap Estimates for the Netherlands: Does it improve the real-time usability?,"['Blanken, J. den']","['Lukkezen, J.', 'Elbourne, A.']",2018-09-19T17:01:44Z,en,"['output gap, potential output, financial cycle, business cycle, uncertainty, real-time']",International Economics and Business,"In this paper the hypotheses set by Borio, Sisyatat and Juselius (2013), extending the conventional HP-filter with financial cycle information increase the real- time robustness of output gap estimates, is tested. For the first time, real-time finance neutral output gaps are estimated for the Netherlands. A new constructed quarterly database is used for this purpose. Results confirm that finance neutral output gap estimates are more robust real-time relative to HP-filtered output gaps: Including financial cycle information does improve the real-time reliability and thereby the usefulness for policy makers. However, these improvements are small in magnitude and not robust during the recent global financial crisis. Considering the general drawbacks of the finance neutral approach and the specific results found in this specific paper, the by Borio et al. (2013) proposed approach is above all usable as a starting point for future research. It certainty should not be used as an omniscient instrument and neglecting other output gap estimation methods and supplementary indicators."
"Samen zelfstandig, samen sterker: Een interpretatieve studie naar betekenisgeving van samenwerking in de sector Hernieuwbare Energie van de Triodos Bank","['Bakker, M.A.S.']","['Loyens, K']",2018-09-19T17:01:43Z,nl,[],"Organisaties, verandering en management",
The association between leukocidin M and F’ expression by Staphylococcus aureus strains and the clinical severity of ruminant mastitis,"['Sommeling, L.E.I.']","['Rutten, Victor']",2018-08-30T17:00:57Z,en,"['Staphylococcus aureus, leukocidin MF’, ruminant mastitis']",Geneeskunde van gezelschapsdieren,"Staphylococcus aureus is an important causative agent of ruminant mastitis. The bacterium has several ways of immune evasion, of which the production of bicomponent leukocidins is one. It is suggested that LukMF’, a leukocidin almost exclusively produced by ruminant S. aureus strains, is the most important leukocidin in vitro. To elucidate the importance of this toxin in ruminant mastitis, milksamples were taken from sheep and cows to determine the prevalence of the LukMF’ genes, study the in vivo and in vitro production of the toxin and relate the production of LukM to the somatic cell count (SCC) and clinical features of the concerning animals. A high prevalence of LukMF’ was found in both the sheep- and the cow isolates, but presence of the genes was not associated with the severity of mastitis. LukM production in vitro couldn’t be associated with the severity of mastitis but an association was found between the presence of LukM in vivo and the severity of mastitis."
Van hemel naar (S)hell. Een interdisciplinair sluitstuk over de invloed van Shell in de Nigerdelta.,"['Rog, J.']","['Tuin, I. van der']",2018-09-05T17:01:08Z,nl,[],Liberal Arts and Sciences,
A retrospective study regarding the prevalence of tick-borne pathogens in Ixodes ricinus ticks collected from companion animals in the Netherlands over the past 10 years through the Tickbusters survey,"['Linders, L.J.']","['Jongejan, Prof. dr. F.']",2018-09-19T17:01:08Z,en,"['Ixodes ricinus, ticks, Tickbusters, pathogens, Netherlands, tick-borne pathogens, acaricides, infection, co-infection']",Geneeskunde van gezelschapsdieren,"Background
Almost 900 different tick species have been described worldwide. In the Netherlands, Ixodes ricinus is the predominant tick. Adult ticks have a broad host range, including larger mammalian species such as cattle, sheep and goats, dogs, and in particular wild ungulates, e.g. deer. Ixodes ricinus is vector and reservoir of Borrelia, Anaplasma, Ehrlichia, Babesia and Rickettsia species as well as for viral pathogens such as tick-borne encephalitis virus.

Methods
Over the past 10 years (2006-2015) a large number of ticks has been collected from dogs and cats in the Netherlands as part of the Tickbusters survey. A random selection of 40 I. ricinus ticks collected during the peak of the tick season in May of each year was made and tested by PCR and Reverse Line Blot (RLB) hybridization to perform a retrospective screening of tick-borne pathogens. In addition, ticks submitted during the 2016 campaign were identified to species, stage and sex. All ticks were individually numbered and stored in 70% ethanol until further use.

Results
Several pathogens were found in I. ricinus, especially Borrelia burgdorferi sensu lato, Borrelia afzelii and Borrelia garinii and several Rickettsia spp. Other pathogens were Babesia venatorum (sp EU1), Babesia major, Neoehrlichia mikurensis and Anaplasma phagocytophilum. The number of co-infected ticks ranged between 0 and 5 depending on the year.
During the 2016 campaign, 1867 ticks were received between early March until the end of June from the Netherlands and Belgium. Of these, 57,8% originated from dogs and 42,2% were removed from cats. I. ricinus was the most abundant species identified. 

Conclusion
There were no significant differences in the prevalence of tick-borne pathogens in I. ricinus, collected during the month of May on dogs and cats during the past 10 years in the Netherlands. Although no clear up or downward trend was identified, the results show that the significant infection rates ranging between 10% and 30% are likely to be retained the tick population and continue to pose a threat to companion animals and humans in the foreseeable future."
"Surgical treatment of perineal hernias in male dogs: the correlation between castration, recurrence and urinary incontinence","['Brenker, S.R.']","['Kummeling, A.']",2018-09-19T17:01:12Z,en,"['Surgical treatment, perineal hernias, male dogs, castration, recurrence, urinary incontinence']",Geneeskunde van gezelschapsdieren,"Objectives: Perineal hernias are most common in intact male dogs. Surgical repair of the
hernia is the recommended method of treatment. There is a suspicion that recurrence of
perineal hernias after herniorraphy is associated with neutering status of the dog. The effect
of castration on preventing recurrence of perineal hernias has been described in several
studies. The obtained results were inconclusive. Perineal hernias can cause a great variety of
clinical signs. Studies regarding the correlation between herniorraphy and castration in
relation to the occurrence of urinary incontinence are limited. This study was set up to
investigate if the incidence of recurrence of perineal hernias after herniorraphy differs
significantly between castrated and intact male dogs and if the incidence of urinary
incontinence after castration and herniorraphy is significantly higher than the incidence of
urinary incontinence after castration without perineal hernia surgery. Finally, we made an
effort to confirm the expectation that neutered male dogs with a perineal hernia are
predisposed for urinary incontinence.
Material and methods: In this retrospective study the medical records of all male dogs
surgically treated for a perineal hernia at the Department of Clinical Sciences of Companion
Animals of Utrecht University between January 2005 and June 2015 were reviewed. Patient
owners were contacted by telephone and asked to fill in a digital survey regarding the followup
period.
Results: 113 male dogs were surgically treated for a perineal hernia at the Department of
Clinical Sciences of Companion Animals of Utrecht University between January 2005 and June
2015. Eight dogs (7.1%) remained intact during the entire follow-up period. Sixteen dogs
(14.2%) were neutered prior to the first herniorraphy, 65 dogs (57.5%) during the surgery and
6 (5.3%) after surgery. Only one of the dogs was chemically neutered. In 17 dogs (15%)
neutering status was unknown. Recurrence occurred in 25 dogs (22.1%). Recurrence was seen
in 17% of the neutered dogs and 62.5% of the intact dogs. Statistical analysis showed that the
difference between both groups was significant (P = 0.009). Information regarding urinary
incontinence was available for 64 dogs. Urinary incontinence was seen in eight of these dogs
(12.5%). Six dogs were neutered prior to the occurrence of urinary incontinence. The
remaining two dogs were intact at the time of first occurrence of urinary incontinence.
Statistical analysis showed no significant association between neutering status and the
occurrence of urinary incontinence (P = 0.312).
Conclusion: The incidence of recurrence of perineal hernias after herniorraphy is significantly
higher in intact male dogs compared to neutered male dogs. There is no significant association
between occurrence of urinary incontinence after herniorraphy and neutering status. Urinary
incontinence may be more common in neutered dogs with perineal hernia than in healthy
neutered dogs, but a prospective study with a control group is necessary to confirm this
theory."
The perception and knowledge of Giardia among people who work in dog shelters,"['Overbeek, A.K.']","['Nijsse, Uiterwijk, E.R. and M.']",2018-09-19T17:01:12Z,en,"['Giardia, knowledge, perception, dog shelter employees']",Geneeskunde van gezelschapsdieren,"In this study the perception and knowledge about Giardia among people who work in shelters is
examined. This is done on the basis of a questionnaire, consisting of 17 multiple choice questions.
The questionnaire focusses on several topics, such as: Do people see Giardia as a problem? Which
measures are taken to prevent an infection and which measures will be taken if there is an infection?
Is Giardia seen as a zoonotic disease? Which therapy is applied? Veterinarians have been asked
additional questions about treatment, business counseling, advice and guidance.
The results of this study indicate that the majority (up to 84%) of the participants who filled in the
questionnaire do not see Giardia as a problem at their shelter. Moreover, they seem to have
insufficient knowledge about Giardia. It can be concluded that the veterinarians seem to use an
appropriate therapy for individual cases. However, there seems to be a lack of a protocol focusing on
the shelter as a whole. A search in the available literature did not produce a satisfying protocol.
Therefore, future research should focus on developing such a protocol, usable for both veterinarians
and shelter personnel.
This research is part of a large-scale study, ‘’the Giardia Project’’. In this project, different dog
populations in the Netherlands are examined: house dogs, clinical dogs (dogs with gastrointestinal
symptoms) and kennel/shelter dogs. Current research in these populations investigates the
prevalence of Giardia within these three groups, the different diagnostic methods (CSF, IFA and the
SNAP® Giardia Test by IDEXX) and if there is a connection between Giardia and the consistency of
faeces. In addition, the prevalence of the humane assemblages of Giardia (assemblage’s A and B) in
the three dog populations is also examined to make a statement about the potential zoonotic risk of
Giardia. In order to do this, a PCR method will be developed. The research goals of this project are to
get a better understanding of the prevalence of Giardia, detected with different tests, in combination
with the consistency of faeces, and to get a better understanding of the prevalence of assemblage’s
A and B in dogs and the potential zoonotic risk.
Eventually, when the knowledge and perception of Giardia among people who work in shelters have
been studied, their knowledge can be expanded. For this, the results of ‘’the Giardia Project’’ are of
interest, in order to further educate people."
A rickets-like bone disease in young dairy goat kids,"['Honingh, C.']","['Koop, G.']",2018-09-19T17:01:11Z,en,"['Rickets, bone-disease, goat kids,']",Gezondheidszorg landbouwhuisdieren en vet. volksgezondheid,"On a yearly base approximately 10-15% of the goat kids on a commercial dairy goat farm in the Netherlands was affected with a rickets-like bone disease. Clinical features, which consisted of bended (front)legs and a stiff posture and gate, were seen from the age of 14 to 21 days onwards. The objectives of this study were to quantify clinical symptoms and determine whether or not the incidence of disease was associated with external risk factors, derived from does, paternity and diet. A total of 36 yearlings and 112 second parity does lamb between 5 and 19 March 2016. In the last trimester of pregnancy, 61 of 112 second parity does were treated with a vitamin D preparation.  In a four-weeks longitudinal study, clinical features of this rickets-like disease were measured in a total of 235 goat kids. On the basis of appendix  I and II,  each kid was classified into a category. Calcium, inorganic phosphate and 25-hydroxyvitamin D3 levels were determined in blood samples. Furthermore, three goat kids were selected for pathological examination of kidney, liver and bones. The number of clinically diseased goat kids was not significantly associated with the vitamin D treatment of does (p=0,744), parity of mothers (p=0,559) and bucks (p=0,264). The external risk factor diet, was associated with the number of goat kids, which exposed mild clinical symptoms (p=0,002). The mean concentrations of calcium, inorganic phosphate and 25-hydroxyvitamin D3 in the clinically diseased offspring of vitamin D treated does were 2,45 mmol/L (σ=0,11), 2,90 mmol/L (σ=0,14) and 92 nmol/L (σ=35), respectively. The results show that neither the existence of clinical signs nor the blood concentrations of calcium, inorganic phosphate and 25-hydroxyvitamin D3 were associated with the vitamin D treatment of does. Pathological examination showed several bone deformations, which were most probably related to a rickets-like bone disease."
"Comparative efficacy of a novel combination of permethrin and fipronil against Rhipicephalus sanguineus, Ixodes hexagonus and Dermacentor reticulatus ticks","['Jong, O.J. de']","['Jongejan, F.']",2018-09-19T17:01:09Z,en,"['permethrin, fipronil, frontect, Tri-Act, ticks, Rhipicephalus, sanguineus, dermacentor, reticulatus']",Geneeskunde van gezelschapsdieren,
The effect of controlled release of celecoxib on the gene expression and biochemical composition of extracellular matrix in a canine model of IVD degeneration.,"['Kamphuijs, S.J.']","['Tryfonidou, M.A.']",2018-09-19T17:01:07Z,en,"['Intervertebral disc degeneration, dog, canine, celecoxib, controlled release']",Geneeskunde van gezelschapsdieren,
"Susceptibility of Rhipicephalus sanguineus, Rhipicephalus bursa and Rhipicephalus appendiculatus ticks to alpha-cypermethrin","['Boer, Y.C.M.']","['Jongejan, F.']",2018-09-19T17:01:08Z,en,"['alpha-cypermethrin, resistant, rhipicephalus bursa, rhipicephalus sanguineus, rhipicephalus appendiculatus']",Geneeskunde van gezelschapsdieren,
De rol van gezinsstructuur in de samenhang tussen impulsiviteit en delinquent gedrag onder adolescenten tussen de 12 en 18 jaar,"[""Sa'Bari, Z. Al""]","['Tuithof, M.']",2018-08-25T17:01:03Z,nl,['Adolescenten; delinquentie; impulsiviteit; gezinsstructuur'],Sociale en organisatiepsychologie,"Achtergrond: Impulsievere adolescenten vertonen vaker delinquent gedrag dan laag impulsieve adolescenten. Ontwikkelingsmodellen stellen dat adolescenten die vatbaarder zijn voor het vertonen van afwijkend gedrag, ook meer profiteren van de voordelen van een beschermende omgeving, waardoor zij minder afwijkend gedrag vertonen. De huidige cross-sectionele studie onderzoekt het modererende effect van een volledig gezin als beschermende omgeving, op de samenhang tussen impulsiviteit en delinquent gedrag. Methode: Voor de analyses is gebruikgemaakt van data van het Peilstationsonderzoek 2011. De scholieren uit de steekproef (n = 7133) varieerden in de leeftijd van twaalf tot en met achttien jaar (M = 14.3). Impulsiviteit, delinquentie en gezinsstructuur zijn gemeten door middel van zelfrapportages. Resultaten: Met de logistische regressieanalyse is een positieve samenhang gevonden tussen impulsiviteit en delinquent gedrag. Daarnaast is tegen de verwachting in een moderatie-effect in de tegenstelde richting gevonden, waarbij adolescenten met een hogere mate van impulsiviteit meer delinquent gedrag  vertonen in een beschermende omgeving als een volledig gezin, dan in een risicovolle omgeving als een onvolledig gezin. Conclusie: De social push hypothese biedt een verklaring voor deze bevindingen. Toekomstig longitudinaal onderzoek is nodig om inzicht te bieden in de gevoeligheid voor delinquent gedrag van adolescenten in een beschermende omgeving."
