title,authors,supervisors,date,language,keywords,program,abstract
THE TRANSFORMATION OF A LOCAL FOODSCAPE DUE TO THE TRANSITION TO SHRIMP FARMING IN RURAL BANGLADESH,"['Berk, Daan van']","['Bayrak, Mucahid']",2023-10-17T01:01:42Z,EN,['Foodscape; shrimp farming; inequality'],International Development Studies,"A blue revolution has taken place in most of the developing countries in Asia. This can also be seen back in Bangladesh with the rise of shrimp farming. The rise of shrimp farming had effects on the farming practices in Bangladesh, there was a transition from rice farming to rice-shrimp farming or monocultural shrimp farming. This research focuses on how the transition to shrimp farm transformed the foodscape of a local rural community in Bangladesh. There is a lot of literature on shrimp farming and the consequences of it, but there is none that focuses on food.
The data for this research is gathered by doing fieldwork in Bangladesh. In Bangladesh qualitative research methods such as interviews, observations and pictures were used to discover how the foodscape was changed.
The interviews gave a clear image on the transformation in the foodscape. Salt water is a requirement for shrimp farming, this salt water was let in the area via a switch gate. As a result the area became salinized. Because of this, other crops could not grow anymore or grow in less amounts and with less quality than before. A landscape that was green before shrimp farming, became a ‘desert in the delta’. The local population got most food via self-consumption, but are now more dependent on the local markets. However this transformation in foodscape only happened for people who did not profit of shrimp farming. The profiters of shrimp farming had bigger lands for shrimp farming and also land outside the shrimp area. The area therefore has a two-sided foodscape. On the one hand, the people who lost their crops and became more dependent on the market and on the other hand, the people who made more profits than before and still could grow the crops that they grew before shrimp farming.  The main driver of change for this transformation in foodscape is the salinization. The most important indirect driver of this change are political and economic factors."
The Thematic Relationship Between Weather and Emotions in Old English Poetry,"['Geremia, Johanna']","['Petrovskaia, Natalia']",2023-10-18T23:00:58Z,EN,['weather; emotions; Old English poetry; Medieval Literature; Biblical poetry; Anglo-Latin; Anglo-Saxon'],"Ancient, Medieval and Renaissance Studies","Joining the rise in scholarship approaching Old English literature with either an ecocritical or emotional approach, this thesis takes a critical look at the specific ways in which descriptions of weather interact with emotions. The aim of this thesis is to demonstrate that there is a connection between weather and emotions in Old English poetry that appears most strongly in five types of narratives. These narratives are exile, punishing floods, Judgment Day, sea storms, and paradise, and in each one the connection presents itself differently. This thesis also considers works from the Anglo-Saxon tradition in order to establish a stronger sense of the connection by comparing the Latin and vernacular traditions. The connection appears in four forms, with weather either causing emotions or emphasising the emotional tone of a scene, and emotions either instigating weather events or describing weather phenomena. A secondary objective of this thesis is to look at God’s emotional role in the narratives and how he controls or affects the weather."
"Social media, wat doe je met me? - De relatie tussen social media gebruik en depressieve gevoelens bij adolescenten met de mate van eigenwaarde als mediator","['Bakx, Lotte']","['Henricks, L.A.']",2023-10-18T23:01:06Z,NL,[],"Clinical Child, Family and Education Studies","Abstract
Adolescence is a vulnerable period for developing depressive feelings and low self-esteem. Previous research has shown that social media may play a role in the development of these aspects. Almost all adolescents today use social media. However, few studies have reported specific findings on social media use and depressive feelings in adolescents mediated by self-esteem levels. The current study examined this relationship with a research group consisting of 37 adolescents between the ages of 16-18. They completed an online survey via Qualtrics with questionnaires about social media use, perceived depressive feelings and self-esteem levels. The mediation analysis was done by using the PROCESS analysis technique. First, the results showed that there was no relationship between the frequency of social media use and depressive feelings. In addition, it appears that self-esteem did not mediate the relationship between the frequency of social media use and depressive feelings. Both were contrary to the literature and predetermined expectation. There are several limitations of the study. For example, one-time measurements would not accurately predict social media use, measuring total social media use did not give an impression of how adolescents use social media, the study group was small, and adolescent self-reporting was not found to be completely reliable. For future research, it is important to consider longitudinal re-examination with more participants in which a smaller aspect of social media use is measured more specifically."
Intelligence profiles of children with atopic dermatitis. Measured by the WISC-III.,"['Wagenaar, Lynn']","['Schappin, R.']",2023-10-18T23:01:04Z,EN,['Atopic dermatitis'],"Clinical Child, Family and Education Studies","Atopic dermatitis (AD), also known as constitutional eczema, is a common inflammatory skin condition that causes itchy, red, and irritated skin. These symptoms associated with AD, such as itching, skin pain, sleep disturbances, and fatigue, can interfere with the mechanism behind executive functioning and the intelligence in children. Understanding the relationship between AD and intelligence is important for developing effective interventions and support for children with AD. This study explores the potential effects of AD on the intelligent profiles of children. To measure these relationships the WISC-III was administered to 55 children to measure their intelligence and analyze their intelligence profile. They were compared to a norm group based on the literature of the WISC-III. It was hypothesized that there will be peculiarities within the intelligence profile. The results show that no significant differences have been found in the total intelligence score and the processing speed. The results, however, did show a significant difference in score withing the verbal IQ and performal IQ. A significant higher verbal IQ score was obtained by the children with AD. Also 48.2% of the participants had a disharmonic intelligence profile. Preliminary findings suggest potential strengths and weaknesses withing the intelligence among children with AD, but further research is needed to establish more insight in executive functioning. Identifying cognitive peculiarities in children with AD can inform tailored treatments and interventions to optimize their treatment."
Phase slips in space-time crystals,"['Schokking, Jillis']","['Straten, Peter van der']",2023-11-02T00:00:46Z,EN,['time; crystal; BEC; Bose; Einstein; Condensate; phase'],Experimental Physics,"In this work, we attempt to find a suitable approach to study phaseslip switching between time crystal modes. These time crystal are density oscillations in Bose Einstein condensates. Our goal is to determine the parameter space in which dynamics between crystal modes arise, characterise this behaviour, and provide a basis for experimental work. Numerical evaluation of the Fokker-Planck equation requires a long evaluation time. Combined with the large parameter space of our system, faster running approximations are desirable. We focus on two models. The first method is the line model, an one-dimensional approximation to the Fokker Planck equation. The second is a quantum trajectory method, based on the the equations of motion of our system. We compare these to the (two dimensional) Fokker-Planck equation, evaluated using the MacCormack method.
The line model reproduces the correct equilibrium distribution at high number of quanta in the crystal, but fails close to the origin in the phase space of the crystal. We observe that flux current terms in the Fokker-Planck equation become dominant in this region, preventing probability flow between modes. This is further verified
by the dynamics observed using the other methods, the origin is always avoided. We conclude this model to be unsuitable. The quantum trajectory method becomes nonphysical in the limit of no damping, otherwise it reproduces the same qualitative behaviour as the 2d Fokker-Planck method. At higher noise levels we find both over and under-damped oscillations between crystal modes. Based on the 2d Fokker-Planck method, the type of oscillation depends largely on the detuning of the crystal with respect to the breathing mode. Both the frequency and damping parameters of the oscillations scale with the noise parameter. Additional simulations are required to verify if the quantum trajectory method produces the same scaling of the oscillation parameters. Even if this is not the case, the quantum trajectory method does provide a useful way to rapidly search
the parameter space. Experimental observation of a mode switch constitutes a π shift in the phase of
the time crystal, after the system is allowed to go unmeasured for some time. Apart from sufficient isolation, observation of mode switching requires control to some extend over the detuning and noise term. The first could be realized by changing the breathing mode frequency temporarily. The noise term needs to be two orders of magnitude stronger than experimental realisations so far. To this end, the influence of the thermal cloud on the noise term needs to be investigated. The parameter space of the driving parameters in which mode switching occurs, match that of current experimental realisations."
Applying the COM-B model to understand the (non) use of wellbeing indicators in policy development: what can we learn from civil servants? A case study of the Netherlands,"['Kaffel, Leonie']","['Stok, Marijn']",2023-10-31T00:00:53Z,EN,['Societal wellbeing; Beyond-GDP; brede welvaart; COM-B model'],"Social Challenges, Policies and Interventions","Although the shortcomings of Gross Domestic Product (GDP) as a proxy for societal wellbeing are widely acknowledged, few countries around the world have successfully institutionalised alternative measures in their national policymaking. In the Netherlands, efforts to move Beyond-GDP are largely synonymous with the adoption of brede welvaarts-denken (BWD), broad prosperity thinking. Evidence of BWD uptake, however, is limited and while efforts to move Beyond-GDP are growing internationally, the factors that influence the adoption of wider wellbeing measures in policymaking remain largely unknown. Applying the COM-B model of behaviour which highlights that Capability, Opportunity and Motivation are prerequisites to the performance of any given Behaviour, 23 semi-structured interviews with 29 civil servants, specialists and/or researchers were conducted in this study to: firstly, ascertain the (non) use of BWD in Dutch policymaking and secondly, understand the factors that facilitate or hinder uptake. Using inductive thematic analysis, 13 themes emerged as influencing BWD uptake, revealing a gap between a positive rhetoric surrounding BWD and its application in practice. Deductive coding of these themes to the COM-B model led to three main findings: 1) Most themes fell under the Opportunity stream, implying that widespread social and environmental change to governmental and policymaking structures is required for uptake to increase. 2) While many of the identified barriers and facilitators to BWD uptake were the same, some disconnect emerged across the profiles of participants. Therefore, greater communication between the relevant stakeholders involved in BWD is recommended. 3) The complexity of BWD means greater conceptual clarity is needed, and the barriers and facilitators from all COM streams require joint attention if added value is to be evidenced and application is to become institutionalised across all levels and types of policymaking."
The Tet Effect: American Exceptionalism in Popular Culture,"['Barneveld, Rick']","['Mavrodin, Corina']",2023-10-31T00:00:45Z,EN,"['Vietnam War, Tet Offensive, American Exceptionalism, Popular Culture, Film, Music, Literature, Individualism, Patriotism, Cultural Hegemony']",International Relations in Historical Perspective,"[""""This research delved into the influence of the Tet Offensive on the development of American exceptionalism within popular culture. It centred around the following research question: How did the events of the Tet Offensive shape and transform American exceptionalism within popular culture in the period of 1968-1972? The relation between the Vietnam War and cultural expressions is a source of historiographical debate and research about the subject often focusses on singular explanations. As a result, this thesis attempted to clarify this intricate interconnection by studying the effects on the Tet Offensive on different types of cultural sources, while also keeping social-political developments in mind. 
In order to answer the central question of this research, the concept of exceptionalism was divided into three distinct features in patriotism, individualism and perceived cultural hegemony. The evolution of these elements was studied in American films, music and literature. These methods provided ample means to reveal the effects of the Tet Offensive on popular culture.
The application of this research has shown that the efficacy’s of these elements developed in a dissimilar manner in the chosen time period. It depended highly on social-political context and the type of industry that was explored. One overarching statement that could be made however, is that the Tet Offensive had a profound impact on the evolution of all these elements within popular culture. It prompted musicians, film makers and authors to question the traditional notions of exceptionalism and consider the changing public opinion with regards to anti-war sentiment. Furthermore, it highlighted the need to examine ramifications of American foreign policy by exploring the narratives of communities that were affected by it. 
	As this thesis focussed on a specific time period, its limitations were found in its ability to study the development of exceptionalism in the post-Vietnam period. Further research about the enduring effects of the Tet Offensive on popular culture could strengthen the findings of this inquiry.""""]"
Mathematical models for the spread of multiple pathogens with cross-reactivity and waning of immunity,"['Nieuwenhuizen, Jaap']","['Bootsma, Martin']",2023-10-31T00:00:51Z,EN,"['Epidemiology, simulation, modelling, stochastic']",Mathematical Sciences,"Using several mathematical models for multi-strain epidemics, we study both theoretically and with stochastic simulations, how waning of overall immunity and cross-immunity impact the coexistence of multiple pathogen strains. The focus lies on one specific multi-strain model with individual-based continuous waning (cross-)immunity. For that model, we observe and study three immunity regimes: (1) short-term immunity, (2) long-term immunity and short-term cross immunity, and (3) long-term immunity and long-term cross-immunity, which differ in the observed number of coexisting strains. Equilibria densities are derived using a compartmentalised model. The short-term immunity coexistence regime is also studied through compartmental models, with analysis being conducted to: (i) influence of cross-immunity on strain density, and (ii) the densities of total infecteds and susceptibles, in addition to the chance of invasion of a new strain into an existing equilibrium. For the long-term immunity non-coexistence parameter regime, we obtain explicit approximations for the expected time between outbreaks."
Longitudinal neuroimaging study of accelerated brain ageing in patients with post-operative delirium.,"['Apotikar, Aryaa']","['Schnack, Hugo']",2023-10-31T00:00:48Z,EN,[],Molecular and Cellular Life Sciences,"Delirium is described as one of the mental manifestations of a pathophysiological condition called acute encephalopathy. It can take form in changes in mental abilities, such as lack of awareness, attention, and disorientation. It is prevalent in more older age individuals and is a major risk factor for a long-term cognitive impairment such as dementia and worsening existing dementia. 
A longitudinal pattern recognition neuroimaging study, aided with machine learning predictive tools, would capture, if any, the direct correlation between the apparent, biological age (brain age) of an individual and delirium. This form of data analysis could be conducted using patient data of non-delirium individuals and those afflicted with delirium to encapsulate the causal/ effect change in brain age with delirium. Thereby, investigation of the longitudinal brain change that is associated with delirium could be utilised to provide a better understanding of the mental disability and its long-term adverse effects. This study aims to generate a predictive brain age model using machine learning tools to elucidate accelerated brain ageing associated with delirium."
Volumetric data structures for real-time ray tracing,"['Winther, Rosalie de']","['Telea, Alex']",2023-10-31T00:01:35Z,EN,['raytracing; pathtracing; ray tracing; path tracing; volumetric; volumetrics; data structures; datastructures; vdb; volume; traverse research; compression; kmeans; k means; clustering; block compression; textures; gpu; graphics processing unit; breda; graphics; computer graphics; delta tracking; disney; grid; octree; sparse; dag; directed acyclic graph; brick map; traversal; bit mask; assets; animation; games; movies; rendering; simulation;'],Game and Media Technology,"Volumetric effects such as clouds, explosions, smoke, and fog are important scene elements for computer games. While these can be efficiently handled in a rasterizer, path tracers typically struggle to render them efficiently. In this thesis we provide the required prior knowledge to think about the different trade-offs of volume data structures, and we provide a specialized implementation for compressed density data. The resulting data structure reduces the voxel data memory footprint by a factor of 8 to 16 times over 16-bit floating point values. This is achieved by utilizing a novel method of storing density data in block-compressed textures and deduplicating homogeneous nodes. These methods allow us to store animation sequences in game-ready asset sizes and render them at real-time frame rates."
Hoe een stiksel een naam kan worden. Verwording tot soortnaam bij niet-woordmerken.,"['Bruikman, Dennis']","['Torenbosch, J.R.']",2023-09-21T23:00:49Z,NL,"[""Verwording tot soortnaam; verwording tot soortaanduiding; Benelux merkenrecht; uitburgering; verwatering; het 'door toedoen of nalaten van de merkhouder'-criterium; Levi Strauss / Casucci""]","Intellectual Property Law, Innovation and Technology",In deze scriptie wordt besproken dat verwording tot soortnaam beter verwording tot soortaanduiding genoemd zou kunnen worden. Dit omdat volgens de huidige jurisprudentie verwording tot soortnaam niet slechts tot woordmerken is beperkt en dat alle merken kunnen verworden tot soortaanduiding. Dit heeft de Hoge Raad geoordeeld nadat het HvJEU het impliceerde. Verder wordt besproken dat de bestaande regelgeving omtrent verwording tot soortnaam toepasbaar is op niet-woordmerken en voor 'verwording tot soortaanduiding' dus geen nieuwe regelgeving vereist is. Wel zijn veel elementen uit de jurisprudentie over het onderwerp enkel op woordmerken van toepassing.
MTD-H: Using Conspiracy Numbers To Solve Game Trees In A More Informed Manner,"['Groeneveld, Niels']","['Bodlaender, Hans']",2023-10-31T00:00:55Z,EN,[],Artificial Intelligence,"Games like Chess, Go or Tic-Tac-Toe have been around for a long time.
But programmable computers have only been accessible for the last 50 years.
One of the areas that has been researched, is the science of rational decision making (e.g. decision theory) while other rational actors are also making decisions, and impacting the world (e.g. game theory).
The pursuit of letting computers mimic rationality has also been applied to games like Chess, through solving the game’s underlying game tree.
In this work, we introduce MTD-H, an alteration of the MTD-bi algorithm, used for solving game trees for games like chess.
We evaluate a chess engine implementing this MTD-H algorithm, and compare it to other solving methods as well."
"Human behaviours, emotions, and perceptions in human-wildlife interactions: a mobile app-based approach","['Felstead, Wiggy']","['Dorresteijn, Ine']",2023-09-01T00:03:20Z,EN,['Human-Wildlife Interactions : Citizen Science : Mobile Application : Emotion : Behaviour'],Sustainable Development,"Human-wildlife interactions (HWIs) are a fundamental aspect of human existence. The Netherlands is currently experiencing a resurgence of wildlife amidst the combined pressures of increased urbanisation, climate change and habitat conversion. The progressively limited space for humans and wildlife to coexist means encounters between them are becoming increasingly prevalent. While some welcome the successful conservation and rewilding efforts, others fear a rise in human-wildlife conflict. Current HWI literature suffers conflict bias, lacks multiple species insights, and overstates the influence of rational decision-making. HWIs encompass the behaviour of humans and animals in response to each other. Consequently, insight into the drivers of human behaviour is vital for mitigating conflict and promoting coexistence. While emotions and perceptions are thought to be influential, there are significant gaps in the current literature as to their influence. This study utilised citizen scientists while testing a mobile application prototype to record HWIs, a novel approach that enabled human behaviours, emotions, and perceptions to be recorded in near real-time.
This case study focused on two natural areas in the Netherlands used by recreationists and home to diverse wildlife species. The influence of animal species on human behaviour, emotions and perceptions, and the relationships between these variables was explored as well as the participant experience using a mobile application to record HWIs. Data on HWIs were collected by citizen scientists using the mobile app over six weeks. Pearson’s chi-squared and Fisher’s exact tests were employed to test the effect of animal species on human behaviours, emotions, and perceptions. Heat maps were created to identify the frequency of specific emotions and perceptions for each human behaviour. Correlation analysis and multiple ordinal regression were used to test for association between human behaviours, emotions, and perceptions.
Key findings suggest that HWIs between recreationists and wildlife are overwhelmingly positive. Furthermore, animal species had a significant effect on human behaviour and perceptions, while human emotions were universally positive. Contrary to expectations, no significant relationship was identified between human emotions, perceptions, and behaviours indicating that the complexity and nuance of these variables were insufficiently captured with the chosen methodology. Qualitative analysis however provides a promising future avenue. The main implications for wildlife management involve communicating the positive nature of interactions to alter the current conflict-biased discourse. Lastly, this research provides a template for an innovative approach to further research into HWIs using a citizen science mobile app."
