title,authors,supervisors,date,language,keywords,program,abstract
"'Sommige vond ik niks aan,' zei Matilda, 'maar andere waren prachtig!' Een onderzoek naar de receptie van het werk van Roald Dahl in Nederland","['Hardeman, L.']","['Andringa, E.B.']",2013-01-08T18:01:16Z,nl,"['Dahl, jeugdliteratuur, receptieonderzoek']",Taal- en cultuurstudies,"Deze scriptie betreft een onderzoek naar de ontwikkeling van de naamsbekendheid van Roald Dahl in Nederland vanaf 1963. Daarbij wordt onder andere ingegaan op de receptie van het werk van Dahl in het Verenigd Koninkrijk, de plaats die hij inneemt in het Engelse en Nederlandse jeugdliteraire veld en de spin-offs van zijn werk. De hoofdvraag wordt beantwoord door middel van recensieanalyses en het antwoord erop wordt geplaatst binnen theorieën van socioloog Pierre Bourdieu."
The offer of flexible working hours within companies,"['Kroon, S.C. van der', 'Olieman, C.']","['Been, Msc. W.', 'Westphal, Msc. S.']",2013-01-08T18:01:03Z,en,"['Work-life policies, Sweden, The Netherlands, flexible working hours.']",Sociologie,"This thesis examines the variation in the offer of flexible working hours within companies. According to the neo-institutional theory, the rational choice theory and the organizational adaptation theory, four organizational characteristics have an influence on the implementation of flexible working hours. A comparison is made between Sweden and the Netherlands. Swedish companies offer more flexible working hours than Dutch companies. A comparison between the two countries indicates the importance of the country context that is related to the influence of organizational characteristics. Differences that are found can be used to form an adequate policy to stimulate the implementation of flexible working hours within companies."
Werkwoordsinflectie door Hebreeuws-Nederlandstalige basisschoolleerlingen,"['Visser, M.E.']","['Bree, E.H. de', 'Verhagen, J.']",2013-01-08T18:01:03Z,nl,[],Orthopedagogiek,
Motives for Adopting Bio-based Plastic Packaging Materials in the Dutch Food Industry,"['Dam, W. van']","['Faber, J.', 'Patel, M.']",2013-01-15T18:03:25Z,en,"['Bio-based plastic, Packaging, Adoption theory, Brand image, Early product life cycle']",Science and Innovation Management,"The purpose of this study is to provide insight into the factors that determine the willingness of brand owners in the Dutch food industry to adopt bio-based plastic packaging. In order to obtain an answer first a conceptual model is developed based on the Five Forces model by Porter, and Roger’s adoption theory. To better determine the appropriate indicators for the measurement of the concepts a pilot consisting of expert interviews is performed. The data for this study is collected by means of an online survey sent to all brand owners in the Dutch food industry. 

Descriptive statistics of the survey data show that there are only two groups of bio-based plastic adopters among Dutch brand owners: those that are currently considering bio-based plastic packaging, and those that have not considered it yet. Due to the low number of completed questionnaires advanced multivariate statistical methods cannot be used for data analysis. Instead the data analysis is performed using independent T-tests of means for both brand owner groups. 

These tests identify incentives from the food service industry, expected opportunities for CO2 reduction on both the short-term and long-term, and the importance of the brand name in decision-making as factors that determine the willingness of brand owners to adopt bio-based plastic packaging. The tests also shows that in particular large brand owners, both in terms of employees and packaging volume, are considering the use of bio-based plastic packaging. 

That brand owners are at best just considering bio-based plastic, and that there are only a few doing even that, indicates that while bio-based plastic packaging remains a substitute product within an already existing industry, it appears to be distinctive enough from petroleum-based packaging to initiate a new product life cycle. Another indication is that the food service industry currently has a more prominent role than retailers due to their stronger customer relationship and higher margins, which make it easier for them to cover the investment costs. There is no need for the government to interfere with regulations to stimulate the use of bio-based plastic packaging. Following the typical product life cycle, brand owners may be expected to gradually extend their activities to other markets, such as retail. One thing to keep in mind with using bio-based plastic is the effect of possible ethical discussions concerning competition with food and genetically modified biomass."
Immunotherapy-possibilities and dangers in food allergy,"['Kostadinova, A.I.']","['Garssen, Johan']",2013-01-14T18:00:57Z,en_US,"['immunotherapy, food allergy, tolerogenic peptides, non-digestible oligosaccharides']",Drug Innovation,"Food allergy is a growing health concern in the westernized world with approximately 6% of children suffering from it. A lack of approved treatment has led to strict avoidance of the culprit food proteins being the only standard of care. Nowadays in-depth research is conducted to evaluate the possible use of allergen-specific immunotherapy (SIT) as an active therapeutic option for food allergy. Various routes of administration for the immunotherapy are investigated, including subcutaneous, oral, sublingual, and epicutaneous and some appear to be successful in inducing desensitization. Most research has been conducted with oral immunotherapy due to its efficacious and relatively safe profile. Increasing interest is dedicated to safer and more convenient approaches, such as sublingual and epicutaneous SIT, however, doubts exist about their possible capacity to induce tolerance. Although the underlying mechanisms of successful desensitization with SIT are not yet clear, evidence suggests that those involve suppression of mast cell and basophil reactivity, reduction in allergen-specific IgE and increase in allergen-specific IgG4 antibodies, as well as stimulation of natural or de novo induced regulatory T cells and skewing of the T cell response from the pro-allergic Th2 to the Th1 phenotype. The high frequency of allergic adverse reactions of the various approaches and the inability to achieve permanent oral tolerance have highlighted the need of refinements in the strategies and the potential use of tolerazing adjuvants. A promising strategy for preventing IgE cross-linking and thus enhancing safety of SIT, while still activating T cells, is the use of tolerogenic peptides. The implementation of a tolerizing Treg/Th1-polarizing adjuvant, such as a specific mixture of non-digestible oligosaccharides, into immunotherapy approaches has the potential of not only increasing the chance of achieving permanent state of tolerance, but also improving the safety and tolerability of the therapy. Immunotherapy for food allergy is still not ready for the clinic, but current and upcoming studies are dedicated at collecting enough evidence for the possible implementation of allergen-specific immunotherapy as a standard treatment for food allergy."
"'Ieder woord telt'
het verloop van de communicatie over zingeving in het contact tussen de huisarts en de palliatieve patiënt.","['Kloek, T.J.']","['Pieper, dr.J.T.Z.']",2013-01-15T18:00:57Z,nl,"['communicatie, zingeving, huisarts, palliatieve patiënt']",Theologie en geestelijke verzorging,"In Nederland brengen veel patiënten hun laatste levensfase thuis of in de hospice door. Daarbij vallen ze onder de zorg van de huisarts. In deze thesis komt aan bod welke rol zingeving speelt in het contact tussen de huisarts en de palliatieve patiënt. Daarbij is gekeken naar welke zingevingvragen huisartsen waarnemen bij palliatieve patiënten, hoe de communicatie hierover verloopt, hoe de huisartsen hun eigen mogelijkheden op dit gebied evalueren en of er bij hen behoefte bestaat aan bijscholing. Middels vier semi-gestructureerde interviews kan uit dit onderzoek geconcludeerd worden de huisartsen hun rol in het palliatieve proces als eerste als een medisch technische zien, maar dat zij daarbij een biomedisch-psychosociaal ziektemodel hanteren. Communicatie over zingevingvragen speelt zich met name af op het affectieve vlak. Religieuze zingevingvragen worden nauwelijks op het initiatief van de huisarts ter sprake gebracht, wel zijn zij bereid om hierover in gesprek te gaan of een pastor,een maatschappelijk werker of een oncologisch verpleegkundige in te schakelen. Hier zou in de toekomst een rol weggelegd zijn voor de  vrijgevestigd algemeen geestelijk verzorger. Goed contact over zingevingvragen is vaak meer mens- gerelateerd dan beroeps- gerelateerd. De huisartsen ervaren over het algemeen hun vaardigheden op het gebied van communicatie over zingevingvragen als toereikend en volgen met regelmaat hiervoor een bijscholing."
Scenario Analysis for GHG emissions from the Built Envirnment of Developing Countries. Indian Residential Sector as a case for illustration,"['Vazquez Romero, J.']","['Patel, M.']",2013-01-15T18:03:27Z,en,"['Residential, India, GHG, Black Carbon, Mitigation Actions']",Energy Science,"Buildings are one of the main end-uses of energy and are responsible of roughly a third of total GHG emissions. Although the building sector presents the largest and most cost effective emission reductions possibilities, this sector is currently characterized by an oversized carbon footprint. Following current trends, GHG emissions from building are expected to double by 2050. Developing countries lead the growth of the building sector as it is closely coupled with demographic and economic drivers. These and other variables can be evaluated by their influence on energy demands and thus, can project trends on GHG emissions from the use-phase of buildings.

Especially in developing countries, the residential sector accounts for most of the energy consumed in buildings. Three different categories of mitigation measures can be used to make this sector more energy efficient: a better insulation of buildings, fuel switching to more convenient fuels and more energy efficient technologies. Different indicators are used for understanding their potential impact for curbing GHG emissions. 

India presents a large increase of population coupled with a high, although unequal, economic growth. Due to this fact the Indian residential sector could harvest important results from the implementation of the three categories of measures. Three different scenarios were constructed in order to first evaluate how Indian buildings energy demands could develop in the absence of mitigation measures. Other scenario shows the most important government initiatives targeting the residential sector. A third scenario evaluates further possibilities for curbing the expected high increase of GHG emissions from the Indian residential sector."
Future Prospects and the Dynamic Development of Promissory Configurations,"['Jansen, M.']","['Van Lente, Dr. Ir. H.', 'Peine, Dr. Ir. A.']",2013-01-15T18:03:26Z,en,"['Promissory Configuration, expectations, smart home, configurations']",Science and Innovation Management,"This paper explores the development of promissory configurations. The concept promissory configuration is introduced in this paper, resulting from a combination of insights from the expectations literature and the notion of configurational technologies by Fleck (1993). Promissory configurations are configurational technologies, but the difference is that they do not appear on the market. They only exist in terms of expectations about the technological configuration, hence the word promissory is included. Configurational technologies, as mentioned by Fleck (1993), have a peculiar development process because the configuration is heavily influenced by the particular application of the technology. Configurational technologies are ad hoc in the sense that (re)configuration will occur when contingencies of the particular application change. The smart home technology is chosen as case for studying the development of promissory configurations. Results of Peine (2008; 2009) let us presume that different expectations and promises are present in the development of the past three decennia’s of the smart home technology. The results of this research show that there are three promissory configurations in the development of the smart home technology. Each promissory configuration is specified in application expectations and expectations about the underlying technology. By applying the concept of promissory configurations, the disorderly development of the smart home technology can be better understood. Concluded is that the underlying technology co-develops with the application of the underlying technology, whereby the combination of these two developments are the core of the promissory configuration. Within the three promissory configurations, the core idea of interoperability between appliances has been stable, only the underlying configuration enabling this interoperability has been altered over time."
Assessment of the accuracy of the IEC 61853-1 norm for PV technology,"['Bearzatto, L.P.']","['van Sark, dr.W.G.J.H.M.']",2013-01-15T18:03:29Z,en,"['Photovoltaic, IEC standard, 61853-1, PV performance']",Sustainable Development,"This research assesses the accuracy loss of the solar panel conformity assessment, created by the 61853-1 IEC norm. The norm was created to make a more accurate comparison between different solar panels possible, using varying temperature and irradiance conditions instead of only the standard test conditions as a way to determine performance. The norm assumes a scaled Air mass of 1.5 for all irradiances. The accuracy of this assumption is under scrutiny because of the fundamental correlation between Air mass, the solar zenith angle and the irradiance resulting of the former.
The assumed Air mass of the norm is compared with data from the SMARTS2 model and measured outdoor data for solar panels on the fixed tilted plane and on a sun tracking plane. The differences are quantified and analyzed. The effect of the difference in spectral distribution is also correlated with the spectral response curves of six different types of semiconductors used in solar panels (CdTe, CIGS, GaAs, Ge, a-Si and c-Si). This research shows that the norm is accurate for a panel on a fixed tilted plane, but can be deemed unreliable for solar panels on a sun tracking plane."
Lokaliseren of Standaardiseren? Onderzoek naar het gebruik van communicatieve strategieën op internationale en gelokaliseerde merkpagina's op Facebook,"['Hagemeijer, E.T.E.']","['ten Thije, J.D.', 'de Vries, I.O.']",2013-03-11T18:01:12Z,nl,"['Social Media, Lokaliseren, Standaardiseren, Interculturele Communicatie']",Interculturele Communicatie,"Dit scriptieonderzoek richt zich op de volgende vraag: In hoeverre en op welke wijze lokaliseren succesvolle multinationals hun Facebook strategie en welke invloed heeft dit op het gebruik van communicatieve strategieën op merkpagina’s? Vooraf is de vraag gesteld welke merken uit Interbrand’s top 100 met beste internationale merken in 2012, hun Facebook merkpagina standaardiseren al dan niet lokaliseren ten opzichte van de Britse, Duitse en Nederlandse markt en welke onafhankelijke factoren hier invloed op hebben. Tijdens meerdere vervolganalyses op basis van een selectie merkpagina’s van producten met een hoge betrokkenheid en producten met een lage betrokkenheid, is er zowel aandacht besteed aan de door bedrijven gecreërde inhoud als de door consumenten gecreërde inhoud. De analyse van de door consumenten gecreërde inhoud is onder te verdelen in waardevermeerderende activiteiten, zoals het delen van positieve ervaringen ten opzichte van het product, en activiteiten die afbreuk doen aan het merk, zoals het delen van klachten en kritiek."
Het verschil in engagement en interactiviteit bij gebruik van clickers op de basisschool,"['Fleerkate, M.W.']","['Janssen, J.J.H.M.']",2013-03-06T18:01:01Z,nl,"['clicker', 'iPad', 'emotionele engagement', 'gedragsmatige engagement', 'engagement', 'interactie', 'interactiviteit', 'student respons system']",Onderwijskundig ontwerp en advisering,"Clickers worden in het hoger onderwijs al een aantal jaar gebruikt om meer interactiviteit en engagement te brengen in de colleges. Om te onderzoeken of clickers op een lager niveau en in een kleinere groep hetzelfde effect heeft, is de invloed van clickers op de interactiviteit en de emotionele en de gedragsmatige engagement gemeten in single case experiment van 26 leerlingen uit groep 6 op een basisschool. Er zijn vier lessen gegeven, waarvan twee lessen met clickers. Uit een repeated measures test blijkt dat het gebruik van clickers emotionele en gedragsmatige engagement beïnvloedt en dat het gebruik interactiviteit deels beïnvloedt. Clickers hebben dus invloed binnen deze basisschool. In vervolgonderzoek zou leerwinst en de invloed van andere basisscholen en leerkrachten kunnen worden"
Het informeel leren van mbo- docenten in een team,"['Sauer, T.']","['Schaap, H.', 'Bruijn, de, E.']",2013-03-11T18:00:53Z,nl,"['multiple case- study', 'mbo', 'informeel leren', 'leren in een team.']",Onderwijskundig ontwerp en advisering,"In deze studie is het informele leren onderzocht van 74 mbo- docenten binnen overlegmomenten die zij in de dagelijkse praktijk met elkaar hebben. Zeven teams uit 2 domeinen hebben geparticipeerd.
Door middel van een deels kwantitatieve, deels kwalitatieve multiple case study zijn de 3 elementen uit het gehanteerde conceptuele model onderzocht, en de mogelijke beïnvloeding van deze elementen op elkaar. Het betreft de elementen: een lerend team, leeractiviteiten in een team en een verandering in gedrag of cognitie van de docenten. Hiermee is getracht in beeld te brengen of kenmerken van een lerend team van invloed zijn op het voorkomen van leeractiviteiten en of deze leeractiviteiten een verandering in gedrag of cognitie tot gevolg hebben. 
Het onderzoek laat zien dat de meeste van de deelnemende teams zichzelf zien als een lerend team, er veel leeractiviteiten plaatsvinden en dat zij door overleg met elkaar nieuwe inzichten op doen en vaker experimenteren. Docenten gebruiken het overleg in hoge mate om de eigen onderwijspraktijk te toetsen aan die van collega’s. Feedback vragen en geven doen zij weinig. Het bleek niet mogelijk om de verwachte beïnvloeding van de elementen op elkaar te bevestigen."
The role of miRNAs in cardiac hypertrophy,"['Pruissen, F.']","['de Weger, R.', 'Lok, S.']",2013-03-05T18:00:42Z,en,"['microRNA, cardiac hypertrophy']",Biology of Disease,"Cardiac hypertrophy and increased cardiomyocytes size are important triggers in the pathophysiology in heart failure. In this review, the role of miRNAs in cardiac hypertrophy is described.  
MiRNAs are small non-coding single stranded RNAs of approximately 18-22 nucleotides long. They are able to downregulate target mRNA. Past 10 years, it has become clear that many miRNAs are involved in cardiac diseases. In this review, the influence of miRNAs in cardiac hypertrophy is discussed. Also, the use of miRNA as biomarkers in cardiovascular diseases and as therapeutic potential will be considered.
At the moment, therapeutic potentials of miRNAs in cardiac hypertrophy are not convincing. Only a couple of miRNAs can act as biomarkers. Moreover, only one cardiac specific miRNA is identified, miR-208. Targeting miRNAs in vivo is very complicated, concerning to the many possible side effects in other organs. The main challenge for future research will be to determine more cardiac specific miRNAs, as well as to find a way to target miRNAs in vivo."
EFFICIENCY MEASUREMENTS ON THIN FILM SOLAR CELLS WITH DIFFERENT TEXTURIZED SURFACES AND TCO THICKNESSES,"['Mohammadian, Y.']","['Jong, M.M. de', 'Rath, J.K.']",2013-03-09T18:00:40Z,nl,"['solar cells, thin film, TCO, efficiency, polycarbonate substrate, light trapping, aluminum doped zinc-oxide, pyramidal structure']",Natuur- en Sterrenkunde,
"De functiemix, de waardering van het schoolklimaat en occupational commitment in het primair onderwijs.","['Ekkelenkamp, G.H.']","['Zandsteeg, G.A.B.', 'Schaap, H.']",2013-03-06T18:01:00Z,en,[],Onderwijskundig ontwerp en advisering,"Dit empirische onderzoek vond plaats bij 46 leerkrachten in het primair onderwijs in Nederland. Met behulp van het drie componenten model voor occupational commitment van Meyer, Allen en Smith (1993) is het occupational commitment van leerkrachten onderzocht. De onderzoeksresultaten suggereren dat er geen verschillen in occupational commitment zijn tussen leerkrachten op basis van deelname aan de functiemix. Wel is er in dit onderzoek op basis van deelname aan de functiemix een verschil gevonden in de waardering van het schoolklimaat. 
	In het onderzoek van Collie, Shapka en Perry (2011) is een positieve relatie gevonden tussen de waardering het schoolklimaat en occupational commitment. In dit onderzoek werd een vergelijkbare relatie gevonden tussen de waardering van het schoolklimaat en de deelschaal affective commitment."
Betekenisvol leven: een weg naar levenstevredenheid en acceptatie van de dood bij ouderen,"['Huurman, L.A.']","['Schut, H.A.W.']",2013-03-04T18:01:08Z,nl,"['Levenstevredenheid', 'doodsacceptatie']",Klinische en Gezondheidspsychologie,
Van Weltschmerz tot Worgengel. Functies van representaties van de dood en het sterven in het werk van François HaverSchmidt.,"['Paauwe, C.C.J.']","['Pieterse, S.A.']",2013-03-11T18:01:13Z,nl,[],Nederlandse taal en cultuur,
Multidisciplinaire verantwoording: Een onderzoek naar verantwoording van publieke managers in een multidisciplinair samenwerkingsverband,"['Verheul, W.']","['Geuijen, K.', 'Noordegraaf, M.']",2013-03-12T18:04:04Z,nl,"['netwerk, netwerksamenwerking, netwerken, multidisciplinair, brandweer, GHOR, politie, gemeenten, verantwoording, verantwoordelijkheid, strategie, crisis, ramp, rampenbestrijding, crisisbeheersing, publiek management, publieke manager, manager, samenwerking, veiligheid, verantwoordingsrelatie, veiligheidsregio']",Bestuurs- en organisatiewetenschap,"De complexiteit van de samenleving en de conclusies uit evaluaties van verscheidene rampen en ongevallen hebben het besef doen ontstaan dat een goede samenwerking tussen de hulpverleningsdiensten noodzakelijk is om adequaat te kunnen reageren op grootschalige incidenten en crises. Managers van de hulpverleningsdiensten (brandweer, politie, GHOR en Gemeenten) hebben daardoor in toenemende mate te maken met netwerksamenwerkingen. Zo dienen zij samen afspraken te maken over wie welke taken, bevoegdheden en verantwoordelijkheden hebben ten aanzien van de voorbereiding op en bestrijding van rampen & crises. 

In de bestuurs- en organisatiewetenschap heerst echter al langer het idee dat verantwoording over deze taken, bevoegdheden en verantwoordelijkheden op gespannen voet kan staan met netwerksamenwerking. Dit onderzoek heeft tot doel om meer inzicht te krijgen in hoe er 
door publieke managers in netwerken invulling wordt gegeven aan hun verantwoording. De netwerksamenwerking tussen de hulpverleningsdiensten in het kader van rampenbestrijding & crisisbeheersing wordt daarvoor als uitgangspunt genomen.

Specifiek is de bedoeling van dit onderzoek om de verantwoording van de publieke manager vanuit een strategisch oogpunt te bekijken, waarbij de relatie tussen de publieke manager en zijn omgeving, bestaande uit netwerkpartners, de eigen organisatie en andere publiek en private partijen, centraal staat."
Het Digitale Patiëntenportaal: Ook toegankelijk voor verpleegkundigen?,"['Horst, K.D. ter']","['Bos, A.']",2013-03-12T18:04:00Z,nl,"['e-health, verpleegkundigen, gebruikersacceptatie']",Bestuurs- en organisatiewetenschap,"Binnen enkele ziekenhuizen in Nederland wordt er gewerkt met ‘Digitale patiëntenportalen’; een beveiligde internetomgeving van het ziekenhuis waarin de patiënt thuis kan inloggen om informatie in te zien en uit te wisselen met de zorgverlener. Een digitaal patiëntenportaal kan ook wel gezien worden als een toepassing van e-health dat zelfmanagement onder patiënten stimuleert. E-health wordt ook wel als methode gezien om in de toekomst te kunnen blijven voldoen aan de toenemende vraag binnen de gezondheidszorg. Echter kan een toepassing als het digitale patiëntenportaal enkel haar vruchten afwerpen wanneer zij daadwerkelijk gebruikt wordt, waarbij gebruikersacceptatie de grootste aanleiding is voor gebruik. Onderzoek onder patiënten naar acceptatie en gebruik heeft al vaker plaatsgevonden. In dit onderzoek staan verpleegkundigen, als cruciale gebruikers, centraal. Zij zijn degenen die het veelal ontwikkelen en invoeren. Daarnaast zijn het de verpleegkundigen die het introduceren bij de patiënt en zullen zij het moeten integreren in hun dagelijkse werkpraktijk.

Dit kwalitatieve onderzoek brengt in beeld in hoeverre en op welke wijze verpleegkundigen digitale patiëntenportalen in ziekenhuizen accepteren. Daarbij is onderzocht op welke wijze de portalen zijn ontwikkeld en ingevoerd en op welke wijze de verpleegkundigen de portalen gebruiken en waarderen. Verbeterpunten die naar voren komen uit dit onderzoek kunnen worden meegenomen bij de toekomstige toepassing van patiëntenportalen."
