title,authors,supervisors,date,language,keywords,program,abstract
Excessief geweld tijdens de Atjeh-oorlog: 1874-1878: Het begin van de geweldsescalatie,"['Prieckaerts, L.T.']","['Veen, A. van']",2016-09-15T17:00:37Z,nl,[],Geschiedenis,"De Atjeh-oorlog speelde zich tussen 1873 en 1914 af in Atjeh, Nederlands-Indië. Als er al over deze oorlog geschreven wordt, dan gaat het met name over het excessieve geweld in het laatste deel van de oorlog, vanaf ongeveer 1894. In twee recente artikelen in het Journal of Genocide Research is ook aandacht besteed aan eerder excessief geweld in deze oorlog, vanaf 1878. Onder excessief geweld wordt onder andere verstaan: het platbranden van kampongs, het vernietigen van voedselvoorraden en oogsten en het verjagen van de bevolking.
De onderzoeksvraag is: in hoeverre is er in het begin van de Atjeh-oorlog, in de periode van de tweede veldtocht van 1874 tot 1878, al een aanzet tot de geweldsescalatie terug te vinden, zoals die later in de literatuur wordt besproken voor de periode vanaf 1878 van de Atjeh-oorlog? 
In hoofdstuk 1 wordt een overzicht gegeven van de Atjeh-oorlog, de controverses rond deze oorlog en de ‘papieren oorlog’ die parallel liep met de Atjeh-oorlog. In hoofdstuk 2 worden drie bronnen uit de ‘papieren oorlog’ onderzocht op aanwijzingen over excessief geweld in de jaren 1874-1878. In hoofdstuk 3 worden drie bronnen bekeken die op een meer objectieve manier rapporteren over deze jaren van de oorlog. 
De conclusie is, zowel op basis van de bronnen van hoofdstuk 2 als de bronnen van hoofdstuk 3, dat er zelfs al tijdens de eerste veldtocht (eind 1873) incidenteel sprake is geweest van excessief geweld en dat excessief geweld tijdens de tweede veldtocht, vanaf 1874, veel voorkwam. Vanaf 5 januari 1876 wordt excessief geweld een structureel wapen in de strijd tegen het verzet in Atjeh."
In strijd met de Nederlandse bioscoopbond: Een historisch bronnenonderzoek naar de filmdistributie in Maastricht en Heerlen van 14 september 1944 tot 31 december 1946,"['Drost, L.E.']","['Pafort-Overduin, C.']",2016-09-15T17:00:37Z,nl,"['Nederlandse Bioscoopbond, Tweede Wereldoorlog, Heerlen, Maastricht']",Media en cultuur,
"Making Heimat - 
A Qualitative Case Study Exploring the Social Integration Processes of Male Syrian and Afghan Refugees and Asylum Seekers in Their Initial Integration Phase in Germany","['Lüdemann, C.D.A.L.']","['van der Borgh, G.J.C.']",2016-09-21T17:00:41Z,en,"['Social Integration, Syrian refugees, Afghan refugees, Germany']",Conflict Studies and Human Rights,"The purpose of this study is to investigate, how single, male Syrian and Afghan refugees and asylum seekers between the ages of eighteen and thirty-five develop social connections in their initial integration phase in Germany. To answer the primal question this study takes a qualitative case study approach, exploring the social integration processes of Syrian and Afghan men, accommodated in two socioeconomically and ethno-culturally contrasting neighbourhoods in Hamburg and Berlin.

The thesis is divided into five chapters, of which the first introduces and gives background to the German refugee situation and related challenges and developments. The second chapter addresses the theoretical debate, in which this study is embedded, providing a review of the most important literature on social integration and explaining the analytical framework guiding this research. In addition, the methodological approach is explained in the second chapter. The third chapter situates the present study in the German refugee-policy context and characterises the research settings in Berlin and Hamburg. Chapter four is dedicated to the analysis of the qualitative data obtained from document analysis, participant observation and above all interviews held with refugees, asylum seekers, social workers, directors of refugee accommodations, volunteers, as well as members and directors of local civic refugee organisations between March and July 2016. The concluding chapter summarises the empirical findings and theoretical implications, as well as discusses the inferences and recommendations that can be derived from the research findings.

On the basis of the results of this research, it can be concluded that the most important social contacts for the studied population of Syrian and Afghan refugees and asylum seekers are their families back home and their housemates, predominantly from the same national or linguistic background, as well as the social service providers operating the refugee accommodations. Social bonds between refugees and asylum seekers and people 'like them' strongly outweigh social bridges with citizens of the German host society. Moreover, the data indicated that the refugees and asylum seekers in this study sought out areas that are frequented by people with their ethnic, cultural or linguistic backgrounds, emphasizing the importance of having a sense of belonging and community in a foreign country."
Kosovo: a 'European' or an 'Albanian' State? Frames of Statehood in the Contentious Political Debate Between the Democratic Party of Kosovo and Lëvizja Vetëvendosje on the Belgrade-Pristina Dialogue,"['Roy, P. le']","['van der Borgh, Chris']",2016-09-21T17:00:39Z,en_US,"[""Belgrade-Pristina Dialogue; Democratic Party of Kosovo; PDK; Lëvizja Vetëvendosje; frames of statehood; framing theory;  'nationalizing' nationalism; politics of signification""]",Conflict Studies and Human Rights,"In this thesis I examine the 'frames of Kosovar statehood' as created, upheld and promoted by the governing party, the Democratic Party of Kosovo (PDK), and the opposition party, Lëvizja Vetëvendosje, in their contentious political debate on the Belgrade-Pristina Dialogue. Since its beginning in March 2011, the two parties have not only disputed the effect that the dialogue and its agreements will have on Kosovo's statehood, but also disagreed on the very nature of that statehood: on what kind of state Kosovo is and should be, as well as whose state it is. Drawing on Benford and Snow's framing theory, the diagnostic and prognostic framing processes, as well as the counterframings with which the two parties have attempted to undermine each other, are analyzed, in order to determine the 'frames of statehood' advocated by these collective actors. The core argument of this thesis is that whereas the PDK presents the frame of Kosovar statehood of Kosovo as a multicultural, civic and European state, Vetëvendosje employs the frame of Kosovo as a state of and for the Kosovo ethnic-Albanians; a nation-state. This research is empirically relevant in that it contributes to the existing literature on Kosovo's contentious politics. Moreover, it sheds theoretical light on what Rogers Brubaker has neglected in his theoretical framework on 'nationalizing' nationalisms of newly independent states, namely, the dynamics, interactions, and contestations in which nationalization is demanded, and opposed."
De tragiek gevonden in ‘darstellung’: het Deleuziaanse narratief in Chinua Achebe’s Things Fall Apart,"['Hugte, S.J.C. van']","['Kaiser, dr. B.']",2016-09-21T17:00:37Z,nl,['Deleuze; Things Fall Apart; Achebe; Monomaniac; Hypochondriac; guardian of the law; being of primary nature; being of secondary nature; actuality; virtuality; Apollinisch; Dionysisch; Kolonialisme; Darstellung; representatie; subaltern'],Literatuurwetenschap,"Het koloniaal subject, gereduceerd tot een 'subaltern', kan zichzelf volgens Gayatri Spivak niet meer representeren. Daarmee uit zij kritiek op Gilles Deleuzes genesis van representatie, waarbij hij te weinig aandacht zou geven aan de heterogeniteit van de oud-kolonieen. In dit essay wordt beargumenteerd dat de 'subaltern can speak'; filosofische representatie van het subject (darstellung) is mogelijk.Daartoe zal Things Fall Apart van Chinua Achebe door middel van 'close reading' geanalyseerd worden.

De distinctie tussen 'primary' en 'secondary nature' die Gilles Deleuze aanhaalt in zijn essay Bartleby; or, the Formula zal daarbij centraal staan. Beargumenteerd zal worden dat Okonkwo en Obierka door de komst van de kolonialisten en de nieuwe Apollinische realiteit die zij met zich meebrengen hun geloof in de Igbo-maatschappij verliezen. Daarbij maken Okonkwo en Obierka een 'process of becoming' door, waarbij zij steeds meer in 'beings of primary nature' veranderen. Uiteindelijk leidt de kolonisatie daardoor tot de zelfmoord van Okonkwo (de monomaniac) en een onmogelijkheid om zich nog langer uit te drukken aan de kant van Obierka (de hypochondriac)."
‘Property to seek lost souls’? The ‘social lives’ of contributions made in the South Pacific in the mid-nineteenth century and their representation in missionary publications,"['Hall, S.A.']","['Schilling, B.']",2016-09-21T17:00:38Z,en,"['material culture, social lives,  missions, London Missionary Society, South Pacific, contributions, nineteenth century, empire']",Cultuurgeschiedenis,"The nineteenth-century London Missionary Society (LMS) missions to the South Pacific involved a remarkable form of material culture: the contribution. Contributions were produce, craft objects or money which South Pacific Christians gave to the LMS, like its metropolitan supporters, in order to fund its missions. Hitherto contributions have been neglected by historians. This thesis seeks to trace the ‘social lives’ of the contributions made by converts in the South Pacific to the LMS through missionary publications in order to understand how these reflect the relationship between missions and (in)formal empire in the mid-nineteenth century. It will largely do so using periodicals the LMS published between 1841 and 1871. The ‘social lives’ or ‘object-biographical’ approach used here draws on and adapts the concepts and theories of Arjun Appadurai and Igor Kopytoff on how to approach ‘things’, in particular commodities.  The ‘social life’ of a contribution has been broken down into three main stages: its cultivation, creation or earning; when it became a contribution; and, finally, what happened to it afterwards, in particular where it ended up. The ‘social lives’ of contributions reveal that there was not one link between LMS missions and (in)formal empire, but several. In the first stage, the attitudes of the missionaries with regard to their roles in bringing Christianity and civilisation to those in the South Pacific, which would in turn enable them to produce contributions, formed the most important link. These attitudes were also an important link for the second stage. In addition, this second stage seems to reveal the missionaries’ authority and raises questions around how voluntary contributions were. Finally, the third stage connected empire and missions through the trading networks relied upon by the LMS to exchange contributions for money."
Les forums politiques en ligne français et néerlandais : deux formules inconciliables ?,"['Schutte, L.M.']","['Sécardin, Olivier']",2016-09-21T17:00:37Z,fr,"[""Pays-Bas, France, démocratie, politique, participation civique, forums politiques en ligne, liberté d'expression, analyse contrastive.""]",Interculturele Communicatie,"Cette recherche a été conduite dans le cadre du Master de Communication Interculturelle. La recherche étudie les forums politiques en ligne et l’engagement civique en France et aux Pays-Bas.  A travers la politique du forum, les usages, droits et médiations ainsi qu’une étude de cas de dix forums politiques en ligne en France et aux Pays-Bas, cette recherche vise à répondre à une question centrale, à savoir « Dans quelle mesure les forums politiques français et néerlandais traduisent-ils deux conceptions de la participation civique radicalement différentes ? ». Quatre aspects sont pertinents pour comprendre les différences de conception de la participation civique en France et aux Pays-Bas. Ces aspects sont la politique, la démocratie, la liberté d’expression et la participation politique (« hors ligne »). La recherche montre qu’il n’existe pas de différences matérielles ou concrètes entre les forums politiques en ligne en France et aux Pays-Bas. Les différences sont surtout perceptibles dans la conception de la politique et dans l’interprétation de la liberté d’expression. La recherche donne une image générale des différences entre la conception de la participation civique en France et cette conception aux Pays-Bas et peut, de cette façon, servir de point de départ à des recherches complémentaires concernant un tel sujet."
"Framing the War in Yemen: Narratives of Aggressive Neighbours, Internal Extremism, and Humanitarian Crisis","['Vis, A.S.']","['Sprenkels, Dr. R.']",2016-09-21T17:00:40Z,en,"['conflict, Yemen, Saudi Arabia, Iran, news agencies, narratives, framing']",Conflict Studies and Human Rights,"The aim of this thesis is to pull apart the narratives used by Yemeni, Saudi and Iranian news agencies concerning the conflict in Yemen, in order to understand how the conflict is framed by these agencies. In approaching the research question; How do the contending narratives of Saudi, Iranian, and Yemeni news agencies frame the conflict in Yemen between March 2015 and May 2016?, this thesis identifies and analyses the narratives each of these agencies use to portray the conflict in Yemen, using a theoretical framework built around the concept of framing to analyse how each agency places blame, proposes solutions, and positions their country within the conflict, through the concepts and language they use to create their narratives. The analysis seeks to understand each agency’s stance towards the conflict, and analyse how this is perpetuated by their news coverage in order to further justify their understanding of, and intended outcome for, the conflict in Yemen. By outlining the role that the narratives in the media play in shaping the audience’s attitude, this thesis highlights the relevance of identifying and analysing how such narratives are framed. Rather than aiming to uncover facts, or truths, about the conflict in Yemen, its relevance lies in the result of highlighting and analysing the claims made by these news agencies, thus identifying points of contention between them and serving as an alternative perspective through which to understand the battle of words and ideas that is taking place surrounding the conflict. An awareness of the framing processes used to shape contending understandings of the conflict, and the solutions they propose, will allow a more critical overview of the conflict as it unfolds. Furthermore, this research highlights how a set of core concepts was manipulated by each agency; using the same bank of concepts to frame their evaluation of, and proposed solution for, the conflict in Yemen."
"The System of Animals: Imperial Hunting, Trophies, Photography and the Logic of Collecting","['Verbeek, A.M.']","['Schilling, B.']",2016-09-21T17:00:38Z,en,[],Cultuurgeschiedenis,"This thesis seeks to provide a fresh perspective on imperial hunting in Africa, c. 1870-1914, and its entangled discourses using a material culture approach. Specifically, it analyses imperial hunting using the systemic logic of collecting as theorised by Jean Baudrillard (1994) and takes hunting travelogues published in this period as its source material. The bulk of these travelogues and the subsequent historiography on imperial hunting see its practices and symbolism in terms of projecting imperial power and maintaining racial divides. By contrast, this thesis argues that viewing hunting trophies (both those produced from animal bodies and photographs of live animals) as objects to be possessed and collected reveals the underlying anxieties and fears about the effects of civilisation that shaped colonial discourses. This is manifested most clearly in the production of trophies as ‘perfect’ specimens and the impossibility of possessing Africa’s wildlife. Furthermore, viewing ‘camera hunting’ through this theory of collecting reveals a new perspective on the shift from imperial sport hunting to wildlife photography, conservationism and the formation of game reserves around the turn of the century: namely, it reveals the underlying systemic logic that created the need for a pristine wilderness. In sum, this thesis argues that analysing hunting trophies and African wildlife as objects provides a new perspective on the scientific and aesthetic discourses and practices through which the imaginative geography of Africa was constructed in British imperial culture."
Emergence of sectarianism in the diaspora: The case of anti-Ahmadiyya discrimination within the United Kingdom,"['Qureshi, Z.M.']","['Frerks, Georg']",2016-09-21T17:00:40Z,en,[],Conflict Studies and Human Rights,
The Effect of Negative Word-of-Mouth on Innovation Diffusion and the Performance of Marketing Strategies: an Agent Based Percolation Model,"['Edelkoort, D.A.']","['Frenken, Prof. Dr. K.']",2016-09-29T17:01:00Z,en_US,['Social Networks; Innovation Diffusion; Negative Word-of-Mouth; Percolation Theory; Network Seeding; Marketing; Promotion Strategies;'],Innovation Sciences,"Because real-world marketing experiments are costly, firms make use of diffusion models to decrease uncertainty. Over the last few years Agent Based Models of Percolation have received increased attention in the literature, in which awareness of an innovation diffuses through social contagion, and price and promotion (seeding) strategies can be experimented with (cf. Solomon et al., 2000).

A limitation of the basic percolation model such as Solomon et al. (2000) is that consumers in a social network only receive information about the existence of an innovation, but their own attitude towards the adoption of the innovation remains unaffected by that of their neighbors under the influence of Positive- and Negative Word-of-Mouth (PWOM and NWOM). Although the effects of PWOM and NWOM have been studied empirically, only few extensions on the basic percolation model have been made capturing this effect (e.g. the NWOM model by Erez et al. (2004), and the social reinforcement model by Mas Tur (2016)). This research addresses a gap in the literature studying the effect of NWOM on percolation size and exploring the performance of price and promotion (seeding) strategies given there is NWOM. The standard percolation model is extended with the effect of NWOM in the decision process of an actor, coming from rejecting neighboring actors.

It is found that, given there is NWOM, percolation size decreases and the steepness of the percolation threshold increases. This implies that percolation size, and therefore revenue, decreases and becomes more sensitive to price changes. Although the relation between network structure and social influence is studied by e.g. Mas Tur (2016), we have explored this relationship in depth and have identified new mechanisms which causes the relative decrease in percolation size, given there is NWOM, to be higher on clustered networks as opposed to random networks.

Regarding seeding strategies, it is found that increasing the number of seeds increases percolation size and that the relative decrease in percolation size given there is NWOM is lower for a high number of seeds as opposed to a low number of seeds. Furthermore, since promotion strategies can be targeted towards specific customers we have studied how percolation size differs by picking seeds with different network centralities. We have found that seeds which are placed far apart from each other and have a high degree centrality are particularly effective when aiming for high percolation size and that the relative decrease in percolation size given there is NWOM is lowest for seeds that have short path lengths to other agents in the network (betweenness and closeness centrality)."
Good drinking water and sanitation governance? The case of Ghana,"['Zombori, B.E.']","['Dieperink, C.']",2016-09-29T17:01:01Z,en,"['access to sanitation, access to drinking water, water governance, Ghana, Netherlands']",Sustainable Development,"The global sustainable development goals (SDG), as recently updated by the UN, still include: “Goal 6. Ensure access to water and sanitation for all. The issue of access to water and sanitation is the most prevalent in Africa. This study focuses on Ghana, a country in Africa. Further, the research looks at water governance and management aspects of this SDG.
The objective of this research is to assess the current structures around sustainable access to safe drinking water and basic sanitation in the focus country of Ghana, where there are outstanding issues in this area, in order to come up with which aspects of water governance to focus on and possibly recommendations to solve the discovered issues. In order to evaluate the water governance in Ghana, in this study, the water governance of the
Netherlands was used as a benchmark to answer the following research question: What are the strengths and weaknesses of Ghana’s water governance in terms of sustainable access to safe drinking water and basic sanitation when comparing to the industry best practice that is represented by the Dutch water governance?
I aim to assess the Ghanaian water governance and management practices, using the ten building blocks approach by van Rijswick et al (2014) as assessment framework, This approach provides the following building blocks of water governance to consider: (1) water system knowledge; (2) values, principles, policy discourses; (3) stakeholders involvement; (4) trade-offs between social objectives; (5) responsibility, authority, means; (6) regulations
and agreements; (7) financial arrangements; (8) engineering and monitoring; (9) enforcement and (10) conflict prevention and resolution.
By conducting a literature review the relevant assessment criteria is developed based on scientific literature and based on that, a methodology of assessment (Chapter 2 & 3). Next, it will provide an overview of the Dutch situation, looking at the Netherlands as a good governance benchmark (Chapter 4). After customizing the assessment framework to the issue at hand, and setting the benchmark against which to measure, further in-depth insight to the practical issues in relation to each of the building blocks in Ghana was attempted (Chapter 5). Further, after comparison of the available data of the two countries (Chapter 6) the following findings are made. First, that the major strengths of the Ghanaian system include the presence of democracy, of both government and market actors, the set-up of the design and implementation as well as the existence of the environmental monitoring system. Second, the major weakness is in the lack of available data. Recommendations are arrived at based on the findings as to how to improve water governance practices regarding sustainable access to safe drinking water and basic sanitation in Ghana (Chapter 7). These
recommendations include first and foremost that the availability of the water systems knowledge is needed to improve water governance in Ghana, together with transparent rules, and sufficient financial funding."
