title,authors,supervisors,date,language,keywords,program,abstract
"De taalkundige discussie over het gebruik van
genderinclusief taalgebruik in Nederland. Waarom zegt de
NS ineens ‘beste reizigers’ i.p.v. ‘dames & heren’?","['Grootveld, J.S.']","['van den Berg, M.C.']",2019-09-03T17:01:09Z,nl,"['genderinclusief, taalgebruik, feminisme, non-binair, genderneutraal, genderspecifiek']",Taalwetenschap,"In Nederland zijn er twee bewegingen die zich sterk maken voor genderinclusief taalgebruik. Zowel
de beweging van non-binaire mensen, die zich niet met het binaire man-vrouw gender identificeren,
als de feministen die pleiten voor een gelijkwaardige representatie van het mannelijke en
vrouwelijke gender binnen de Nederlandse taal. De non-binaire beweging heeft vooral behoefte aan
termen die niet binair verwijzen naar gender zodat non-binaire personen ook geïncludeerd kunnen
worden binnen een taal. Het gebruik van generisch hij en het gebrek aan vrouwelijke rol- en
functiebenamingen zijn argumenten vanuit de feministische beweging voor het idee dat het
vrouwelijk gender niet gelijk vertegenwoordigd is in de Nederlandse taal.

Taal en gender is sinds de tweede feministische golf (jaren ’70) onderwerp van onderzoek. De laatste jaren lijkt de focus vooral te liggen op het non-binaire gender includeren binnen de Nederlandse taal door het gebruik van neutrale en specifieke aanspreekvormen. Een simpel
voorbeeld van het gebruik van een neutrale aanspreekvorm is dat van de NS. In 2017 is de NS
overgestapt van ‘dames en heren’ naar ‘beste reizigers’ en maakte daarmee de aanspreekvorm in de
standaardomroep neutraal. 

Dit afstudeerproject richt zich op de talige dimensie van deze beweging; het genderinclusieve
taalgebruik. Specifiek zal het zich richten op de taalkundige argumenten
voor en tegen genderinclusief taalgebruik. De geschiedenis van genderinclusief taalgebruik wordt aan de hand van een literatuuronderzoek
onderzocht. De bevindingen worden gerapporteerd door middel van een onderzoeksverslag en een
kennisclip om de opgedane kennis te delen met geïnteresseerden. Beide kanten van de taalkundige
discussie zullen worden belicht vanuit een sociolinguïstisch perspectief; specifiek gericht op taal en
gender. De discussie zal open worden gelaten, zodat ieder zijn eigen mening kan vormen. De
kennisclip is bedoeld om de doelgroep te voorzien van (extra) kennis over het onderwerp, een
discussie in gang te zetten en misschien tot eventuele nieuwe ideeën voor genderinclusief
taalgebruik te komen."
"Remembering, Resisting, Reclaiming: An Exploration of the Relationship Between Counter-Memory, Visual Representation and Ireland’s Magdalene Laundries","['Moran, N.M.']","['Belia, Vasiliki']",2019-09-03T17:01:08Z,en,"['Counter-Memory, Magdalene Laundries, Ireland, Collective memory, collective forgetting']",Gender Studies,"This research aims to explore the relationship between counter-memory, visual representations and Ireland’s Magdalene laundries. Through the exploration of three chosen visual works: Burke Brogan’s Eclipsed (1992), Steve Humphrie’s Sex in a Cold Climate (1998) and Alison Lowry’s (A)dressing Our Hidden Truths (2019), this thesis will explore the different representations of the Magdalene women and experiences, analyse the way in which each individual way engages with memory and assess if the chosen works can be considered to be sites of counter-memory which challenge the hegemonic historical narrative in which the Magdalene women have been rendered largely invisible and voiceless. The Magdalene asylums operated in Ireland from the late 18th century, with the first institution opening in Dublin in 1767 (Smith, 2007, p.25). Originally set up by religious orders with the intention to house and reform sex workers who were perceived to be “fallen” women, these asylums changed function following the turn of the 20th century. These institutions became a place where women who were deemed to be morally impure and corrupt were coercively confined, forced to rigorous and harsh free labor while being subjected to a myriad of abuses. It is estimated that between 10,000 to 30,000 thousand women passed through these institutions during their years of operation. And yet, the history of these women is seldom known. The experiences and stories of the Magdalene women have been expunged from Irish history and confined to the peripheries, shrouded in secrecy and shame. This research aims to contribute to the small, yet significant, body of work which exists about the Magdalen women,  by providing further visibility about their existence and experiences and exploring how they can be included in the Irish collective memory."
“A Drop of Blood”: The Translation of Subversive Wordplay in Sylvia Townsend Warner’s Lolly Willowes,"['Magnússon, V.']","['Koster, C.']",2019-09-03T17:01:08Z,en,['translation; wordplay; Lolly Willowes; Sylvia Townsend Warner; Dirk Delabastita; vertaling; sociocritical wordplay; feminist criticism; spinsters'],Vertalen,"The connection between style and criticism in the works of Sylvia Townsend Warner (1893-1978) has been observed by several scholars yet so far none of them have focused on Warner's use of (critical) wordplay. Wordplay is a stylistic device that is particularly well-suited to delivering criticism, often inviting a decontruction of something that is generally accepted or taken for granted. In Warner's first novel, Lolly Willowes (1926), the critical abilities of wordplay are frequently exploited in order to deconstruct and expose the social mores of the British middle-class of the 1920's, particularly those mores that relate to unmarried, young women. Since I consider such critical wordplay crucial to the novel as a whole (LW is about an unmarried woman who leaves her family and their interference and expectations in order to live a solitary live in the countryside and ends up becoming a witch) my aim was to produce a Dutch translation of several fragments from LW containing wordplay; a translation that recognised and acknowledged the importance of LW's critical wordplay. The resulting annotated translation is preceded by an analysis in which I: provide relevant contexts; outline a theory of wordplay based on the work of Dirk Delabastita; select and provide a close reading of several wordplay examples; establish their function and effect; identify possible translation problems; find solutions that support the perceived function and effect of the wordplay as well as my personal reading of the text."
"EMOTIONAL AND AFFECTIVE TERRITORIES IN THE SCHOOL
CONTEXT: REIMAGINING EDUCATIONAL PRACTICES IN
BOGOTÁ, COLOMBIA","['Rojas Silva, J.']","['Gorska, M.']",2019-09-03T17:01:08Z,en,"['Emotions, Education, Alternative Pedagogies, Affect, Commons,\nIntimacy, Knowledge Economy, Decolonial Pedagogy']",Gender Studies,"This thesis brings a perspective of emotions and education and explores how affect can be
incorporated as a form of pedagogy. Specifically this research focuses on the emotional
epistemologies of the students as they inform social dynamics and relations of
power/knowledge, are sites of resistance and represent another form of knowledge coming
from affects and emotions that are being and becoming critical. I build upon pedagogical
situations I experienced working in public and private schools in Bogotá, Colombia to
interrogate biopolitical and disciplinary practices in pedagogy and to propose and reimagine a
Decolonial/Feminist and Commoning pedagogy that involves collective and collaborative
learnings that de-center the production of knowledge from the teacher and center curiosity
and emotions as crucial points of departure for transformative learnings. I draw on two
interviews I conducted with two scholar-artists and educators that are engaged in alternative
pedagogies aiming to bring a perspective of the Commons and affective pedagogies that serve
as counter points to a neoliberal and knowledge economy logic in education. While
examining the different approaches I addressed in this research project, I have aimed to
contribute to the interdisciplinary field of education bringing a perspective about affect and
emotion and opening new possibilities for theory and research. Also to raise discussions and
to invite further engagement on thinking about alternative pedagogies in school contexts."
Moderating online extremism on fringe and mainstream platforms; An analysis of governance by Gab & Twitter,"['Blekkenhorst, M.']","['Kerssens, N.']",2019-09-03T17:01:07Z,en,"['platform governance, moderation, online extremism, fringe platforms, platform society, online public discourse']",Nieuwe media en digitale cultuur,"In this research, I have compared the moderation on social media platforms Gab and Twitter. Twitter is a platform that has always promoted free speech but has increasingly strengthened its moderation to prevent harassment and misuse of the platform. Gab was created as an alternative for Twitter and promises free speech and minimal moderation. It is a platform that welcomes users who have been banned from other social media platforms.
	An analysis of the guidelines and affordances of Gab and Twitter shows that both of these platforms have had to adjust their moderation strategies to ensure the online safety of the users. Twitter makes an effort to increase the safety in response to user complaints. Gab has had to reinforce its moderation because of complaints from partnering companies that host the site. 
After many companies have parted ways with Gab because of controversies and because of the amount of hateful content that the site allows, Gab is looking for ways to host the platform outside of the web infrastructure of the big companies. I argue that the developments of fringe platforms like Gab are a reason for more profound research of the motivations of these platforms and the role that they fulfil within the online public discourse."
Reading Nafisi Reading Lolita: Re-Orientalism in 21st century American Literature,"['Isik, D.']","['You, M.M.']",2019-09-03T17:01:07Z,en_US,"['Orientalism, Re-Orientalism, Diaspora, Arab-American, Iranian-American, Middle East, Islam, Islamophobia']",Literatuur vandaag,"Abstract
 	Although Edward Said’s theorization of Orientalism has been widely applied to literary works over the last four decades, it should also be considered how it has been re-theorized and renewed as a result of more contemporary literature. In reaction to Said’s term, scholar Lisa Lau has coined the concept of “Re-Orientalism,” which means that diasporic authors are representing the people from the Orient in the West while they are Oriental themselves, though at the same time they are non-Oriental, or Occidental, because of their current residence. In this thesis, I apply Lau’s theory of Re-Orientalism to one of the most successful diasporic memoirs in 21st century American literature: Azar Nafisi’s Reading Lolita in Tehran. I conclude that Nafisi’s work has distorted the representation of the Other in the West and that it reinforces Western stereotypes."
Dutch Directness and British Politeness: A comparison on directness and politeness in Dutch and British contexts,"['Lau, M.Z.']","['Trenton Hagar, Debbie Cole']",2019-09-03T17:01:07Z,en,[],Interculturele communicatie,"Politeness is important in social interactions. Politeness takes form through language. A specific phrasing of a speech act can have a certain effect on one’s goal. The term politeness in Brown and Levinson’s (1987) politeness theory is explained in terms of taking care of the face. In interaction, face-threatening acts or FTAs, speech acts that threaten or damage someone’s face, can occur. The damage of a face-threatening act can be limited with the used of politeness strategies. There are five politeness strategies: 1) bald on record, 2) positive politeness, 3) negative politeness, 4) off record, and 5) do not perform.
This culture-comparative research examines the use of politeness strategies when performing face-threatening acts in British English and Dutch. The research question is: How are face-threatening acts done by speakers of Dutch and speakers of British English?
The current research will look at differences and similarities in politeness in British English and Dutch to examine the stereotype of the “direct Dutch” and the “polite Brit”. It will demonstrate how to conduct non-essentialist culture-comparative research.
This research uses a mixed method with a discourse completion task, which are used to do a contrastive discourse analysis of face-threatening of British English and Dutch speakers. The participants are given five discourse situations where they have to perform a face-threatening act. The participants’ responses are coded and categorised one of the five politeness strategies. The responses of the Dutch speaking participants and the British English speaking participants are analysed and compared.
The results indicate that in general Dutch speakers and British speakers show a preference of using negative politeness strategies when doing a face-threatening act. Overall a significant difference in politeness strategies between the Dutch and the British group was found."
"Constructing the Identity of the Popular Pirate The Outlaw, Marginal Identities, and Utopia in
Black Sails (2014-2017) and Assassin’s Creed IV: Black Flag (2013)","['Dirksen, S.J.']","['Koch, dr. J.P.M.']",2019-09-03T17:01:18Z,en,"[""popular culture, pirates, Golden Age of Piracy, romantic outlaw, utopia, historical videogames, historical television series, Assassin's Creed IV: Black Flag, Black Sails""]",Cultuurgeschiedenis van modern Europa,"This thesis investigates how the Golden Age of piracy and the identity of pirates is reconstructed in the recent popular television series Black Sails, and the videogame Assassin’s Creed IV: Black Flag. By building upon recent literature on the connection between pirates in popular culture and history, it asks: How is the identity of the popular pirate constructed in the recent television series Black Sails (2014-2017) and the videogame Assassin’s Creed IV: Black Flag (2013)? In order to answer this question, this thesis is divided into three chapters which elaborate on the following three themes: outlaw identity, gender and ethnicity, and utopia. Each theme will be discussed in relation to pirates in popular representations by providing a discussion of (recent) literature, and a subsequent application of the discussed ideas on both Black Sails and Assassin’s Creed IV by elaborating on a few key moments. Discussing the way pirates are represented in popular media grants insights into the way the past is invented on screen, how pirates are idealized, and how videogame- and filmmakers alike create and maintain a sense of believability in stories which mix (historical) fact with fiction. As the appeal of the outlaw and the pirate outlaw is widespread, they have been interpreted in countless (fictional) stories, and this, in turn, has created a persistent image of a mythical pirate, which is even further articulated because of the fact that so little is known about the historical pirates of the Golden Age. Yet this scarcity also offers videogame- and filmmakers the freedom to paint their own idealized picture of Golden Age pirates, and it adds to the fabricated status of pirates on screen. As I have argued in this thesis, the idealization and contemporary nature of the pirate in Black Sails and AC4 is evident in the way they represent a more desirable version of the past, in which current societal issues, such as the representation of marginal identities, play a significant role in the establishment of a story which is supposed to appeal to a twenty-first century audience. Recent representations of Golden Age pirates thus indicate that, even if they seem to depart from more caricatured versions of pirates, they still pertain to utopian ideas expressed not only in their narratives, but also in their visual and musical aspects."
“They are us.” A research of the visual portrayal of criticism of fear for the ‘Other’ and ‘us versus them’ mentality in the film US (2019),"['Welten, A.N.B.']","['Olivieri, D.']",2019-09-03T17:01:16Z,en,"['US (2019), Jordan Peele, film analysis, neoformalism, feminist film semiotics, us versus them, the Other, the Self, othering, social thriller, Western normativity']",Gender Studies,"In this thesis I research how Jordan Peele’s second award winning film US visually symbolizes and criticizes the contemporary Western fear for the ‘Other’ and ‘us versus them’ mentality. Many films depict ‘us versus them’ dynamics, but hardly ever is this mentality criticized. I argue that US does this by a unique way of portraying the ‘Other’ as identical to the ‘Self’. After discussing the concepts of ‘othering’, fear for the ‘Other’ and ‘us versus them’ mentality through theories from gender/feminist, film/media, and postcolonial academic disciplines (using the 9/11 attacks as the most topical historical event to explain the Western ‘us versus them’ mentality), I carry out a neoformalist film analysis with the help of feminist film semiotics to analyze the mise-en-scene of US, specifically looking at the use of colors, costuming, props, performance and set design. An ‘us versus them’ mentality, fueled by fear for the ‘Other’ and created through the process of ‘othering’, is a problematic phenomenon in the (Western) world: it causes false generalization and the acceptance of stereotypes as realistic representations, which can result in – amongst other things – systemic racism and separation between people. By analyzing visual aspects of US, I argue how this film comments on and criticizes these concepts. This way, the film can be seen as socially relevant since I argue it to be a plea for unity amongst human beings at a time when political leaders seem to want nothing more than pursue this damaging ‘us versus them’ mentality."
Terminology in Translation. Study of the IATE Term Database for Term Translation in the Domain of Life Cycle Assessment Applied to Waste Management,"['Eldik, A.J. van']","['Egdom, G.M.W. van']",2019-09-03T17:01:18Z,en,['Translation; Terminology; Life Cycle Assessment; Waste Management; IATE.'],Vertalen,"Circular economy (CE) has been of great interest in recent years and Life Cycle Assessment (LCA) is frequently used to analyze the product life cycle from cradle-to-grave. Additionally, LCA can be applied to Waste Management, as waste poses a growing problem. The European Union produces a variety of texts on this subject which are translated to languages used within the EU. However, as these domains were developed recently, relevant terminology may not be included in the European Union’s term database: IATE. The main objective of this study is to investigate to which extent IATE is suitable for the translation of terminology used in English source texts to Dutch within the domain of Life Cycle Assessment applied to Waste Management. The source text that will be discussed in this study is part of Sustainable Solid Waste Collection and Management by Pires, Martinho, Rodrigues, & Gomes (2018b).
In this study, the automatic term extraction tool TermoStat by Drouin (2003) is used. Subsequently, the output will be evaluated using the annotation scheme developed by Rigouts Terryn (2017). The resulting list of terms will be cross-referenced with the IATE database.
	The source text contains 185 terms of which 102 are included in the IATE database. However, 83 terms are not (or not sufficiently) represented. Thus, when translating texts from these domains, translators cannot depend on the IATE database, meaning that the translation process is slowed down, because Dutch term equivalents must be obtained from other resources. Term fiches are proposed for 21 terms that are not represented in IATE. 
	Though the interest in CE and LCA has increased considerably, the IATE database is not adapted for the translation of texts which fall under these domains. Consequently, the database should be expanded to include terms so academic and institutional knowledge on these topics can be made available for a larger audience using translation."
Is this who I really am? The impact of DNA Analyses in an ethnically diverse world,"['Renema, M.A.']","['Hagar, T.J.', 'Cole, D.L.']",2019-09-03T17:01:17Z,en,['DNA Analysis; Ethnicity; Ethnic Identity; Identity; Interviews'],Interculturele communicatie,"The purpose of this study was to analyse the impact of DNA analysis on participants’ ethnic identity. Since 2000, DNA tests (purportedly) provide consumers with information about their ethnicity. So far, little research has been conducted on the psychological effects of DNA tests in relation to ethnicity in the genes and ethnicity in social terms. Existing literature describes that ethnicity and identity are established based on how actors express themselves, such as through sameness and differences. In addition, the interaction between how actors view themselves and how they are viewed by others should be considered in ethnic identity formation. The data was collected through nine interviews conducted over video chat or through online messaging. Subsequently, these were analysed through latent content analysis. In the results, participants indicated to be connected to a single ethnicity or to plural ethnicities before the DNA test. Three of nine participants with high estimates of newly discovered ethnicities indicated the results had not impacted them due to how they defined themselves internally and culturally. Three participants indicated change based on internal, emotional and meaningful drives. Further research should be undertaken to gain a deeper understanding of the effects of a DNA test on participants who consider their ethnic identity to be salient."
"African Influences, Dutch Translation: On the Translation of Orality and the Influences of African Languages in Marlon James's Black Leopard, Red Wolf","['Janse, M.A.S.']","['Kosters, Dr. O.R.', 'Koster, Dr. C.']",2019-09-03T17:01:16Z,en,['African literature; literary fantasy; translation; nonstandard language; fictional dialect; orality'],Vertalen,"The aim of this thesis is to analyse the influences of African languages and African oral traditions on the language used in the novel Black Leopard, Red Wolf by Marlon James, and subsequently, explore in what ways these influences might manifest themselves in a Dutch translation. The main focus lies on the inclusion of terms and phrases in different African languages; the varied use of nonstandard language, and especially nonstandard syntax; idiolect of characters; and the inclusion of oral poetry. A translation-oriented source text analysis is presented, whereby different translation strategies are considered in order to choose the ones deemed most suitable to the translation of this text. Finally, these strategies are put to the test in the translation of six fragments from the novel, in which the abovementioned aspects come to the fore."
From The New Yorker to Quest: The Translation of a Popular Science Text for a More Diverse Target Audience,"['Dekker, R.R.']","['Egdom, G.M.W. van']",2019-09-03T17:01:17Z,en,['translation; popular science; translating;'],Vertalen,"This paper aims to explore the best method for translating texts meant for a publication with a more diverse target audience. The case study used for this paper is an article named: ""The Day the Dinosaurs Died"". It is written by Douglas Preston for American magazine The New Yorker. The article, as well as the magazine, has a specific target audience: highly educated adults. As such, the language used by Preston is not suitable for certain audiences, for example young readers or people who have been less educated. The target publication for the translation is the popular Dutch magazine Quest. This magazine has a much more diverse target audience than The New Yorker in terms of age and level of education, and thus the language use as well as the terminology in the article will have to be taken into consideration while translating."
The Moral Justifiability of Encouraging Ecological Worldviews in Education,"['Geest, F.J. van der']","['van Steenbergen, Naomi']",2019-09-03T17:01:17Z,en,[],Applied Ethics,"In the needed transformation towards a sustainable society, an increasing amount of scholars point to the importance of worldviews when trying to encourage sustainable behavior. The endeavor of encouraging a particular worldview in citizens with this specific aim poses a potential conflict with the values currently present in liberal democracies, namely that the state should remain neutral with regard to worldviews in public spaces and institutions, in order to protect the autonomy and freedom of citizens to form and live by one’s own worldview. In this thesis the focus is on the moral permissibility of encouraging ecological worldviews in compulsory education, since this would potentially be one of the most effective public institutions for carrying out the suggested transformation in worldview. In the ethical discussion of this issue, a distinction of different worldview components, combined with the reconsideration of the feasibility and desirability of government neutrality, as well as the possible boarders of freedom and autonomy in adopting a particular worldview in education, will lead to the conclusion that under certain conditions, it can indeed be morally permissible to encourage ecological worldviews in compulsory education."
De functie van de long take in Utøya. 22 July,"['Steenbergen, D.T.']","['Copier, L.T.']",2019-09-03T17:01:16Z,nl,[],Film- en Televisiewetenschap,
