title,authors,supervisors,date,language,keywords,program,abstract
La traduction de chansons chrétiennes,"['Kragt, L.S.']","['Berns, J.']",2017-01-11T18:00:26Z,fr,['traduction;chansons;religieuses'],Franse taal en cultuur,"Ce mémoire est une recherche sur les difficultés qu'on rencontre pendant la traduction de chansons chrétiennes et des éléments qui doivent être pris en considération pendant ce processus. Aux Pays-Bas, les chrétiens chantent beaucoup de chansons traduites de l'anglais, mais à notre avis, il est temps de changer de regard et de se tourner vers un autre pays comme source pour les chansons chrétiennes. En traduisant quinze chansons du français en néerlandais, nous allons préciser comment la traduction de chansons chrétiennes est faite, nous regarderons de plus près les difficultés, de sorte que les croyants néerlandais puissent s'engager dans une nouvelle voie musicale.

La recherche est précédée par un cadre théorie, une interview avec un traducteur néerlandais et un chapitre sur les réalia qui jouent un rôle dans la traduction de chansons chrétiennes en néerlandais. Les traductions sont accompagnées par une annotation dans laquelle les différents choix sont expliqués. Ces choix sont ensuite discutés et nous soulignerons les aspects principaux de la traduction de chansons chrétiennes."
A dose response to a toxoplasma vaccine in farmed deer in New Zealand,"['Jansen, T.J.']","['Egberink, H.F.']",2017-01-03T18:00:31Z,en,[],Geneeskunde van gezelschapsdieren,
Boven Beperkingen Uitstijgen - Een kwalitatief onderzoek naar de bijdrage van begeleiding aan de productiviteit en sociale integratie van Wajongers bij grote private werkgevers,"['Visscher, A.']","['Van Berkel, R']",2017-01-27T20:27:24Z,nl,['participatiewet; wajongers; wajong; inclusiviteit; inclusieve werkgevers; inclusief ondernemen; arbeidsbeperking; participatie; begeleiding; productiviteit; sociale integratie'],Strategisch human resource management,"De huidige maatschappelijke situatie toont dat Nederlandse werkgevers de komende jaren moeten investeren in arbeidsbeperkte werknemers. Voor grotere private werkgevers vormt dit een uitdaging: het gaat al snel om tientallen plaatsingen van een voor hen veelal onbekende werknemersgroep. Daar ruim een derde van de Wajongers nu nog niet of beschermd werkt terwijl ze wel geschikt zijn voor regulier werk, ligt hier een potentiële werknemersdoelgroep voor werkgevers. Wetenschappelijk onderzoek laat zien dat werkgevers lage verwachtingen hebben over de productiviteit en sociale integratie van deze groep, twee belangrijke voorspellers van een duurzaam dienstverband. Literatuur over de succesvolle (doch onbekende) HR-praktijk begeleiding rechtvaardigde een onderzoek naar de inhoud en organisatie van begeleiding. Daarbij was evenzeer van belang dat de betekenisgeving van verschillende actoren in kaart werd gebracht. Al met al was een behoefte aan onderzoek gericht op de bijdrage van begeleiding aan de productiviteit en sociale integratie van Wajongers bij inmiddels ‘inclusief ondernemende’ grote private organisaties. Dit heeft geleid tot de volgende onderzoeksvraag: Welke invulling krijgt begeleiding voor Wajongers bij grote private werkgevers en wat is volgens betrokken actoren de bijdrage van de aanwezige begeleidingsvormen aan de productiviteit en sociale integratie van deze werknemers?"
De paradox tussen vertrouwen en controle in een institutionele en economische context,"['Troostheide, W.J.']","['Boselie, P.']",2017-01-27T20:27:25Z,nl,"['holacratie, vertrouwen, controle, strategische ruimte, institutionele druk, competitieve mechanismen, paradox theory, clan control']",Strategisch human resource management,"De afgelopen jaren is er in de media en in de populairwetenschappelijke literatuur groeiende aandacht voor bedrijven die, vergelijkbaar met het Braziliaanse voorbeeld van Semco, afstand doen van hiërarchische en reguliere managementstructuren en hun werknemers een hoge mate van vertrouwen, vrijheid en verantwoordelijkheid toekennen in hun werkzaamheden. In deze masterthesis is door middel van open interviews onderzocht hoe de dominante coalitie van zes Nederlandse organisaties zonder een directe vorm van aansturing omgaan met competitieve en institutionele druk. Hierbij is gebruik gemaakt van een theoretisch heuristisch raamwerk waarin de Contextually Based Human Resource Theory van Paauwe (2004), literatuur over vertrouwen, Ouchi’s (1977, 1979, 1980) werk over organization control en de Paradox Theory van Smith & Lewis (2011) met elkaar geïntegreerd zijn. De resultaten bieden steun voor de stelling dat in de onderzoeksorganisaties dankzij de bijzondere manier van aansturing minder druk wordt ervaren vanuit de markt en de institutionele dimensie. Overige bevindingen zijn dat er in dienstverlenende organisaties op een andere manier gestalte wordt gegeven aan de concepten vertrouwen en controle dan in industriële organisaties, dat in dit type organisatie mechanismen werkzaam zijn die Ouchi beschrijft als clan control (1980), dat transformationeel leiderschap een belangrijke rol heeft, en dat onderzoek naar vergelijkbare atypische organisatievormen methoden van participatieve aard vereist."
Survival of the fittest! - Een kwestie van fit: een belang van een goede afstemming tussen medewerker en organisatie in het streven naar duurzame inzetbaarheid,"['Versteegh, B.L.M.']","['Van Harten, J']",2017-01-27T20:27:22Z,nl,"['duurzame inzetbaarheid, attitude medewerkers, P-O fit, kenmerken werkomgeving, mixed methods onderzoek']",Strategisch human resource management,"In de literatuur gaat veel aandacht uit naar de positieve effecten van het creëren van een goede afstemming tussen persoon en organisatie op de attitude en het gedrag van medewerkers. Dit staat bekend als P-O fit. Nog niet eerder is echter de invloed van P-O fit op duurzame inzetbaarheid bestudeerd. Om deze reden was de eerste doelstelling van dit onderzoek om inzicht te krijgen in het effect van P-O fit op het ontwikkelingsgedrag (ondernemen van ontwikkelingsactiviteiten) en de duurzame inzetbaarheid van medewerkers. Tevens zijn relatief weinig studies beschikbaar over de invloed van een ontwikkelingscultuur en steun van de leidinggevende op de attitude (ontwikkelingsbereidheid) en het ontwikkelingsgedrag van medewerkers. Daarbij zijn specifieke HR-praktijken in deze onderzoeken niet meegenomen. De tweede doelstelling was daarom een duidelijker beeld te creëren over de invloed van deze kenmerken van de werkomgeving (geconceptualiseerd als ontwikkelingscultuur, steun van de leidinggevende en HR-praktijken) op de attitude en duurzame inzetbaarheid van medewerkers. Tot slot was de derde doelstelling het in kaart brengen van ontwikkelingsbehoeften van medewerkers en een eerste aanzet geven voor de ontwikkeling van een meetschaal voor ontwikkelingsbehoeften. De volgende onderzoeksvraag stond centraal: “In hoeverre hangen kenmerken van de werkomgeving samen met de attitude van medewerkers ten aanzien van persoonlijke ontwikkeling, en in hoeverre leidt een afstemming hiertussen tot duurzaam inzetbare medewerkers?”"
De witte norm: een onderzoek naar het effect van etnische afkomst op geloofwaardigheid,"['Rieter, F.T.C.']","['Winnubst, M.H.']",2017-01-27T20:27:23Z,nl,['geloofwaardigheid; etnische afkomst; discriminatie; vooroordelen; categoraal denken; white fantasy; white as default; etnocentrisme; expertise; trustworthiness'],"Communicatie, beleid en management","Welke etnische afkomst iemand heeft, kan gevolgen hebben voor zijn of haar geloofwaardigheid. In dit kwalitatief exploratieve onderzoek is bijvoorbeeld naar voren gekomen dat een nieuwslezer van Nederlandse afkomst als meer inherent geloofwaardig wordt beschouwd, terwijl een nieuwslezer van Marokkaanse afkomst meer als geloofwaardig wordt geacht door het feit dat hij een nieuwslezer is (en dus niet door een inherente geloofwaardigheid). Hoewel discriminatie op basis van afkomst en/of uiterlijke kenmerken bij wet verboden is, is te zien dat deze zaken toch nog sterk meespelen in hoe wij (bv) de geloofwaardigheid van anderen beoordelen."
Disruptive innovations en het motiveren van medewerkers,"['Maas, C.']","['Winnubst, Dr. M.H.', 'Loos, Prof.dr. E.F.']",2017-01-27T20:27:25Z,nl,"['disruptive innovations, motivatie, attitude, subjectieve norm, gedragscontrole, medewerkers IJsselland ziekenhuis en experts']","Communicatie, beleid en management","'Disruptive innovations en het motiveren van medewerkers' is de titel van een comparatief onderzoek naar de rol van de drie determinanten (attitude, subjectieve norm en gedragscontrole) bij het motiveren en adopteren van de digitalisering door medewerkers van het IJsselland ziekenhuis in Capelle aan den IJssel."
De tracer-methodiek als leerinstrument,"['Dulst, M.A.R. van']","['Ridderbos, M.', 'Noordegraaf, M.']",2017-01-27T20:27:21Z,nl,"['Kwaliteit en veiligheid van zorg, zorgprofessionals, leren van zorgprofessionals, managementinterventies, kennismanagementinstrumenten']",Publiek management,Hoe zorgprofessionals leren over kwaliteit en veiligheid door gebruik van de tracer-methodiek en het effect van managementinterventies op  leren.
Aanknopingspunten voor vernieuwend onderwijs,"['Stolk, E.']","['Leisink, P.']",2017-01-27T20:27:22Z,nl,[],Strategisch human resource management,Een onderzoek naar de condities die er aan bijdragen dat ouderen docenten hun manier van lesgeven veranderen in overeenstemming met hedendaagse vernieuwingen in het onderwijs
Voortvarend van start met prestatievergelijking?,"['Sloot, M.H. van der']","['Noordegraaf, M']",2017-01-27T20:27:25Z,nl,[],Publiek management,
"'Verenigingen en leden' óf 'sportbedrijven en consumenten'? De leden aan het woord.
Een kwalitatief onderzoek naar de betekenis van sportparticipatie bij leden van Nederlandse wintersportverenigingen.","['Deenen, L.I. van']","['Chalhi, S.', 'Claringbould, I. E. C.']",2017-01-27T20:27:50Z,nl,['georganiseerde sport; commercialisering; individualisering; informalisering; consumentisme; verenigingslogica; associatieve logica; consumentenlogica; consumentgerichte discours; wintersport; Nederlandse Ski Vereniging.'],Sportbeleid en sportmanagement,"De Nederlandse georganiseerde sport is in- en extern onderhevig aan verandering. De maatschappij heeft onder andere te maken met processen van commercialisering en individualisering, welke een afnemende organisatorische legitimiteit veroorzaken voor de traditionele associatieve organisatievorm van de sportcontext. Hiernaast lopen publieke financiën ten aanzien van de sport terug. Binnen de georganiseerde sport heerst hierdoor een collectief bewustzijn en consumentgericht discours omtrent organisatorische verandering. Hierbinnen blijkt een consumentgerichte invalshoek te domineren, welke op basis van een macro-perspectief is ingestoken – de maatschappelijke context zou significant doorwerken in de sportwereld. Dit onderzoek problematiseert deze benadering vanuit de gedachte dat een micro-perspectief, op het niveau van de sporter zelf, ontbreekt. De sportverenigingen in Nederland overstijgen de sport namelijk als autonome instituties, waardoor de vraag rijst hoe het discours omtrent een consumentgerichte structuur binnen de vereniging zich verhoudt tot het consumentgerichte discours in het bredere organisatieveld van de sport. In dit onderzoek is de verhouding tussen de traditionele verenigingswaarden en een consumentistische houding in de betekenisgeving van de respondenten geschetst, waarmee het discours omtrent een consumentgerichte structuur binnen de vereniging in de wintersportcontext is blootgelegd. Vervolgens zijn deze bevindingen tegen het licht van het consumentgerichte discours gehouden. Er is onder andere gebleken dat de betekenisgeving van verenigingsleden deels het consumentgerichte discours onderbouwt. Er is enerzijds een significante groep leden die zich als consument opstelt door bijvoorbeeld enkel het sportaanbod af te nemen en geen tegenprestatie te leveren. Anderzijds bestaat er een kern van traditioneel associatief ingestelde leden. De leden tonen hiernaast een significante behoefte aan keuzevrijheid, inspraak en invloed binnen de vereniging, welke gedachte binnen het consumentgerichte discours ook wordt ondersteund. Een tegengeluid komt echter uit de redenering van de leden naar voren: het sociale aspect heeft enorm veel waarde wat haaks staat op de intrede van individualiteit en consumentisme binnen de sportvereniging."
"DOCENTEN ALS FREELANCE PROFESSIONALS
BINDING VAN FREELANCE PROFESSIONALS ALS SCHAKEL TUSSEN EEN JURIDISCHE OPLEIDER EN DE CURSISTEN.","['Vliet, N. van der']","['Vermeulen, J.']",2017-01-27T20:27:52Z,nl,"['Binding, Affectieve binding, Betrokkenheid, Freelance professionals, Juridische opleider, Cursusinstelling']","Organisaties, verandering en management","In dit onderzoek is de binding van de freelance professionals onderzocht die bij ROSA, een juridische opleider, doceren. Dit kwalitatieve onderzoek bekijkt de binding vanuit het perspectief van de docenten. ROSA wil dat de docenten loyaal zijn aan hen. De docenten zijn flexibel en hebben een eigen wil in wat zij bij welke instelling willen doen om wat voor reden dan ook. ROSA is afhankelijk van haar docenten omdat de docenten de expertise bezitten waardoor zij de meeste invloed hebben op de kwaliteit van de cursussen. De docenten staan tussen de organisatie en de cursisten in. De docenten hechten de meeste waarde aan het persoonlijk contact met de cursusmanagers als het gaat over binding. Dit onderzoek biedt inzichten en geeft de effecten weer van de binding die de docenten ervaren met ROSA. Daarnaast geven de aanbevelingen een bijdrage in het versterken hiervan."
The Dealer's Choice. Agenda-setting Dynamics in the Council of Ministers,"['Strating, A.R.']","['Princen, Sebastiaan']",2017-01-27T20:27:51Z,en,"['Agenda-setting, Council of Ministers, European Union']",European Governance,"Since its inception in the 1950s, the European Union (EU) has evolved into a very influential institution. Many decisions that are taken at the level of the EU heavily impact developments on international, national and regional levels. However, before these decisions are made, issues have to make it onto the agenda. The process of agenda-setting in the EU is essential to the process of decision making, as it determines the issues that are discussed in the first place. This is instrumental when trying to understand the EU: there are many issues that could be discussed at EU level, but not all of them are, simply because they do not make it onto the agenda. 

Now it appears that the topic of remuneration of high public office holders came onto the agenda within the EU – at the Council of Ministers – on 3 December 2015, during a meeting of the Working Party on Staff Regulations. The fact that this occurred is an incentive to look further into this case. How did remuneration of high public office holders get onto the official agenda in the first place, and are there factors that explain its rise? Therefore the main question that should be answered in this thesis is:

Which factors are important in the agenda-setting dynamics in the Council of Ministers?"
Being an employer brand. A qualitative research focussing on job choice and person-organization fit in the context of little employer branding.,"['Klein Entink, M.J.']","['Leisink, P.L.M.']",2017-01-27T20:27:51Z,en,['Job choice; perceived person-organization fit; employer branding; war for talent; employer attractiveness; human resource management'],Strategisch human resource management,
XTC: Check eerst de feiten! Een semiotisch onderzoek naar de werking van het spotje 'Slik jij zomaar alles?' van SIRE,"['Hansort, L.']","['Loos, E.']",2017-01-27T20:27:49Z,nl,"['Semiotiek, Campagne onderzoek, Storytelling, Communicatie']","Communicatie, beleid en management",
1+1=3. Een onderzoek naar effectieve netwerksamenwerking op lokaal niveau bij het tegengaan van islamitische radicalisering onder jongeren,"['Rossem, N.J. van']","['Meulen, M. van der']",2017-01-27T20:27:50Z,nl,[],Publiek management,
Sensemaking of Safe Spaces in Sport for Development,"['Morssinkhof, N.']","['van der Meij, N.']",2017-01-27T20:27:49Z,en_US,['Safe spaces; Sport for Development; Sensemaking'],Sportbeleid en sportmanagement,
Toezicht en NGO's: Balanceren tussen onafhankelijkheid en verbinding,"['Cuijpers, B.H.F.']","['Braun, C.H.J.M', 'Schillemans, T.']",2017-01-27T20:27:49Z,nl,[],Bestuur en beleid,
Up Close and Personal - Can Climate Change Policy Framing Increase Citizen Support?,"['Bos, A.M.']","['Grimmelikhuijsen, Dr. S.G.', 'Meijer, Prof. dr. A.J.']",2017-01-27T20:28:13Z,en,['Climate Change Policy ∙ Co-benefits and Co-costs ∙ Experimental Design ∙ Framing ∙ Gain and Loss frames ∙ Policy Support'],Research in Public Administration and Organizational Science,"Support for climate change policies is crucial in the quest of limiting climate change. However, the success of the traditional method, highlighting the environmental benefits of policies, has stalled (Bain et al., 2015). The traditional method is especially ineffective in gathering policy support for people who do not (fully) believe in the problem of climate change (climate change critics).

In a recent study, Bain et al. (2015) find a new method to engage people in environmentally friendly behaviour. Bain et al. (2015) state that this method is effective for both climate change critics and non-critics. In this method, policy information gets framed in terms of personal benefits called co-benefits. Examples are: saving money by using green energy and health benefits due to cleaner air. Informing people through the use of co-benefits is called a gain frame.

If a gain frame is indeed effective for both climate change critics and non-critics, the use of a gain frame could potentially lead to a substantial increase in climate change policy support. Up until now, this has not been tested. Furthermore, several studies suggest that negative information has a stronger psychological effect than positive information (Baumeister et al., 2001). Therefore, the use of a loss frame, which highlights personal costs of climate change, may have a stronger effect on policy support.  However, Bain et al. (2015) have not taken this into account.

In this study, I test and extend the theory of Bain et al. (2015) in four ways: (1) I test the external validity by examining the effect of a gain frame on climate change non-critics, (2) I add a loss frame, (3) I look at the possible different effects of health and financial co-benefits and co-costs, and (4) I connect the ‘values-belief-norms’ (VBN) theory with the theory of framing by looking at the effect of gain and loss frames on people with different levels of egoistic and altruistic values.

I find that the use of a gain and loss frame is not successful in gathering climate change policy support. The gain and loss frames decrease policy support for people who believe in climate change. This finding can be explained by the theory of framing: a frame needs to correspond with the belief system of the audience (Dietz et al., 2007). I find that if a frame focuses on personal costs and benefits, while a person is concerned about environmental costs and benefits, the frame has a negative effect and decreases policy support. Furthermore, I find no significant difference between a health and a financial topic and no significant relationship between egoistic and altruistic values in relation to different frames. These findings highlight that the use of frames is not the ultimate solution for the problem of the stagnated support for climate change policies."
Using self-persuasion to change public service motivation and policy alienation: lessons from a survey experiment,"['Nagtegaal, R.']","['Vandenabeele, W.V.', 'Tummers, L.G.']",2017-01-27T20:28:13Z,en,"['Self-persuasion, survey experiment, public service motivation, policy alienation, experimental public administration, behavioural public administration']",Research in Public Administration and Organizational Science,"Self-persuasion interventions have been successfully used in psychological research to ef¬fectuate individual attitude change. This article examines the application of low intensity self-persuasion interventions in public administration by using it to influence public service motivation (PSM) and the policy alienation dimension of societal mean-inglessness. Our first hypothesis is that pro-referent low intensity self-persuasion treatments will increase reported levels of public service motivation. Hypothesis 2a considers that counter-attitudinal low intensity self-persuasion will decrease levels of reported societal meaninglessness. Hypothesis 2b refers to pro-attitudinal low intensity self-persuasion will increase levels of reported societal meaninglessness. Hypothesis 3 considers that pro- and counter-attitudinal self-persuasion is more effective when compliance is high.  We test our hypotheses using two survey experiments amongst 680 health care professionals. Our results show that concept specific self-persuasion changes reported levels of PSM and policy alienation. Specifically, this research indi¬cates that PSM can be made more salient by low intensity self-persuasion, although effects are small. Regarding policy alienation, counter-attitudinal self-persuasion lowers levels of societal meaninglessness, but in situations of no compliance, it can backfire and heighten societal meaninglessness instead. In general, our findings suggest that self-persuasion can be used in public administration research provided that researchers take into account the nature of the targeted variables and the compliance methods necessary and possible."
Flexibiliteit als activiteit: een verkennend onderzoek naar de wijzen waarop hbo-docenten omgaan met flexibilisering van onderwijs en de factoren die daarop van invloed zijn,"['Berge, A.X. ten']","['Noordegraaf, Mirko']",2017-01-27T20:28:14Z,nl,"['flexibililisering, onderwijsvernieuwing, docenten, professionals, coping, professioneel vermogen, hbo']",Publiek management,
Betrokken in Zuid. Een kwalitatief onderzoek naar het gebiedsgericht werken in de gemeente Amsterdam stadsdeel Zuid.,"['Maaskant, F.']","['Hagelstein, G.H.', 'van Rijsselt, R.']",2017-01-27T20:28:12Z,nl,['gebiedsgericht werken; gemeente; lokaal bestuur; participatie'],Bestuur en beleid,Een kwalitatief onderzoek naar het gebiedsgericht werken in de gemeente Amsterdam stadsdeel Zuid.
Troebele transparantie,"['Leeuwen, H. van']","['Grimmelikhuijsen, Stephan']",2017-01-27T20:28:13Z,nl,"['transparantie, onderwijstransparantie, onderwijs, verantwoording']",Publiek management,"Een discoursanalyse naar de betekenisgeving over het begrip en de opbrengsten van transparantie in het onderwijs, bezien vanuit het Ministerie van Onderwijs, de Onderwijsinspectie en de VO-raad"
Democracy of (in)action. Testing the effects of barriers and motives on non-participation in public initiatives,"['Broekhuizen, G.R.']","['Michels, A.M.B.', 'Meijer, A.J.']",2017-01-27T20:28:14Z,en_US,[],Research in Public Administration and Organizational Science,
Ieder voordeel heeft z'n nadeel: De waarde van gepromoveerde medewerkers voor niet-wetenschappelijke organisaties,"['Ruiter, K.J.']","['Thunnissen, M.A.G.', 'Vandenabeele, W.']",2017-01-27T20:28:14Z,nl,[],Strategisch human resource management,
France's involvement in the construction of the Rwandan genocide,"['Kuperus, C.C.C.']","['Segers, Mathieu']",2017-01-27T20:28:21Z,en,[],Taal- en cultuurstudies,
