title,authors,supervisors,date,language,keywords,program,abstract
Scaffolding First Year Biology Undergraduates in a Problem Solving Approach for Designing Experiments in Molecular Biology: An Explorative Design Based Study,"['Postma, P.A.']","['Knippels, M-C.P.J.']",2013-11-28T05:03:17Z,en,['Designing experiments; Problem solving; Scaffolding; Design based research; Molecular biology education.'],Science Education and Communication,"The process of designing experiments is central in (life) science research, though rarely taught to undergraduate science students explicitly in educational practice. This explorative study aimed to learn about the characteristics and opportunities of an innovative educational approach to guide first year biology undergraduates in designing experiments in molecular biology. We focused on the process of designing an experimental work plan and choosing adequate techniques to a given experimental method. The approach employs general problem solving strategies '  which are intuitive in nature '  to domain specific knowledge about molecular biology techniques to scaffold students in designing experiments. We adopted a design based research approach for developing an extra- curricular lesson for first year biology undergraduates in designing experiments in expression cloning technology. The lesson was put into practice in a small scale exploratory study with six first year biology undergraduates (four males and two females, average age 19) and combined with a pre- post- test construction and semi-structured interviews. Results showed that the lesson can scaffold students in adopting a self-directed design approach based on general problem solving strategies. The presented approach can make students more aware of the ' why'  and ' how'  of steps in an experiment and to reason about the applicability of molecular biology techniques. These are considered relevant understandings for a scientist to prepare and conduct experiments efficiently, to trace errors and to analyse results critically. Therefore, it is recommended that already at the start of undergraduate science programs explicit attention should be paid to the skill of designing experiments."
'Een noodzakelijke vooruitgang': Over in hoeverre het Gemeenschappelijk Landbouwbeleid van de EEG van invloed is geweest op de monetaire samenwerking in de jaren ' 70,"['Gerritsen, R.']","['Segers, M.L.L.']",2013-11-28T05:03:22Z,nl,"['Monetaire integratie, EMS, Wernerplan, neofunctionalisme, GLB, EEG, EMU']",Internationale betrekkingen in historisch perspectief,"In deze scriptie staat centraal in hoeverre het Gemeenschappelijk Landbouwbeleid van de EEG van invloed is geweest op de monetaire samenwerking in de jaren ' 70 en of dit een argument vormt voor de neofunctionalistische functionele spillover-theorie. Ik heb dit onderzocht omdat er hoewel er veel geschreven is over de invulling van de monetaire samenwerking in de jaren '70 er veel minder geschreven is over de achterliggende motieven voor de samenwerking. In deze scriptie ligt juist de focus op deze achterliggende motieven. Het accent ligt hierbij vooral op het Gemeenschappelijk Landbouwbeleid (GLB) van de EEG dat veel hinder ondervond van fluctuerende wisselkoersen, maar ook nationale belangen, Ostpolitik en de met name de zwakke dollar en de trans-Atlantische connectie spelen een rol. Vervolgens toets ik deze bevindingen aan de neofunctionalistische functionele spillover-theorie. De uitkomst hiervan is dat het GLB zeker ten tijde van het Wernerplan van grote invloed is geweest op het EMU-project en er in deze jaren dus ook zeker sprake was een functionele connectie. Ten tijde van de totstandkoming van het EMS is deze connectie minder duidelijk, of zelfs afwezig. Het achterliggende motief voor de monetaire samenwerking van eind jaren '70, het EMS, moet meer gezocht worden in de zwakke Amerikaanse dollar en het complete wantrouwen van Helmut Schmidt in het Amerikaanse monetaire en economische beleid van Jimmy Carter."
Cyborgs in an Augmented World. Towards the Deconstruction of Dualistic Thinking  in the 21st Century,"['Skordili, D.']","['Lehmann, A. S.']",2013-11-28T05:03:24Z,en,"['posthumanism, cyborg, technological imaginary, science fiction, binary opposition, augmented reality']",Nieuwe media en digitale cultuur,"The increasing ubiquity of computer technology and the advent of social networking websites have created a new fusion of the physical and the digital world. This technological shift has given rise to a discussion in new media research, calling for the necessity of a new framework in the study of the human-technology relationship. This framework should reject the preservation of the dualistic thinking which has dominated our understanding of this relationship, since the first traces of the involvement of machines into our lives. This thesis seeks to contribute to this discussion by showing that a new perception towards technology is already apparent in recent science fiction texts on the merging of human and digital technology. Indicative narratives from novels and films of the late 20th century are compared with corresponding texts produced since the beginning of the present decade, in order to show this shift which has taken place in our technological imaginary. The findings from this comparative analysis are then related to the earlier theories of posthumanist criticism of the 1990s, which had called for the construction of a new figuration of the posthuman, which recognises our cyborg nature as hybrids of human and machine.   It is argued that this figuration is appearing today in contemporary popular culture and this intensifies the necessity for the construction of a new framework which uses as a starting point the acknowledgement that we are already cyborgs in a world which combines the offline and the online, the digital and the physical: an augmented world."
A Social Media Strategy Framework for Software Product Companies,"['Werder, K.']","['Helms, R.W.']",2013-11-28T05:03:16Z,en_US,"['Social Media, Strategy, Framework, Social networking']",Business Informatics,"Social media has been reported to cause most of the Internet' s traffic. When looking towards the business use of social media, already 94% of companies that have a marketing department use it. Benefits to firms can be manifold ranging from improved customer relationships to cost savings by providing customer service and support through social media (Culnan, Mchugh, & Zubillaga, 2010). However, most companies lack holistic planning for their social media engagements to systematically harness the benefits. Therefore a framework is required that helps companies to develop a social media strategy while closing the gaps in their current deployment. 
The qualitative research project focuses on the analysis of the social media efforts of Europe' s 50 largest software companies. Starting with a desk research that analyses the social media accounts of such companies and evaluate the external perspective of their efforts, the identified results help to contrast and select the right cases for a multi-case study through purposive sampling. The multi-case study investigates the internal perspective of eight companies in further depth. The first case serves as a test case to further refine the data collection plan.
The framework points towards three components scope, capabilities and governance that managers of social media need to take into consideration. Based on the framework, a social media cheat sheet is proposed that helps companies to develop their own strategy or identify possible gaps. Furthermore, four key strategies are identified that firms seem to follow: denial, controlled, opportunistic and explorative. Companies can use these strategies to identify the one they are currently following and the one they desire to apply. Overall, the framework and identified strategies help companies to develop and plan their future social media engagements in a more strategic and holistic way. Applying the research results allows firms to better harness the benefits of social media while mitigating negative effects."
Extending semantic matching in DyKnow to handle indirectly-available streams,"['Leng, D.N. de']","['Meyer, J-J.Ch.']",2013-11-28T05:03:17Z,en,"['semantic matching, DyKnow, stream, stream reasoning, ontology, sense-reasoning gap']",Technical Artificial Intelligence,"Stream reasoning is incremental reasoning over streams, i.e. sequences of time-stamped values. Our stream reasoning approach uses a metric temporal logic. In order to reason about the physical world, knowledge represented in a system has to originate from physical sensors, often providing noisy and incomplete quantitative data. There exists a sense-reasoning gap between this low-level sensor data and the symbolic knowledge necessary for stream reasoning. DyKnow can be used for bridging this gap. In order to find streams based on their semantics, DyKnow employs semantic web technologies that enable it to do semantic matching.

This thesis focuses on indirectly-available information, and seeks to make available this information as streams through the use of transformations in DyKnow. Because the set of available streams may be time-dependent, the availability of desired information changes over time. By utilising transformations, such a dynamic set of available streams may be better handled. To these ends, this thesis further extends DyKnow and its implementation in ROS to support transformations by looking at knowledge processes, an improved semantic matching procedure, and improvements to the declarative languages used to specify DyKnow instances."
Enhancing Player Experience,"['Brahim, A.N.']","['Van der Velden, Andre']",2013-11-28T05:03:21Z,en,"['LBGM, City, Experience, Lost in Time, Immersive Interface']",Taal- en cultuurstudies,"In this paper, I explore the ways in which gameplay within cityscapes changes the
experience of that cityscape, in order to fully grasp how game designers can enhance player experience within a
metropolis. I chose Tempeest' s ' Lost in Time'  as my case-study, based on their nomination for the city
marketing award 2012, and their intention to transform the experience of the city. In the
first chapter, I look at the way people experience the city without using any form of mobile
interface. Second, I explore the ways other LBMGs are experienced. In chapter 3 I discuss
my empirical findings, while in chapter 4 interpreting my empirical facts. And at last, in
chapter 5, I propose a new set of immersive mechanisms which designers of LBGMs could
use to enhance player experience."
De journalistieke buitencategorie van de Centrumpartij,"['Welgraven, W.P.']","['Frijtag Drabbe Kunzel, G.G. von']",2013-11-28T05:03:23Z,nl,['journalistiek or Centrumpartij'],Politiek en maatschappij in historisch perspectief,"Deze thesis gaat over de manier waarop de journalistiek in de jaren tachtig van de vorige eeuw omging met de rechts-radicale Centrumpartij. Behalve op literatuur en bronnenonderzoek, ook gebaseerd op enquÃªte onder twaalf parlementaire journalisten uit die periode."
Surinamese Society in the Eighteenth and Nineteenth Century. A Comparative Research between the Artists John Gabriel Stedman and Pierre Jacques Benoit,"['Kegley, F.L.']","['Segal, Joes']",2013-11-28T05:03:24Z,en_US,"['Suriname, John Gabriel Stedman, Pierre Jacques Benoit']",American Studies,
Digitaal activisme anno 2012,"['Haafkens, R.']","['van Veenendaal, drs. I.Y.E.']",2013-12-07T05:01:00Z,nl,"['Communicatie, semiotiek, hacktivisme, Anonymous']","Communicatie, Beleid en Management","In deze masterscriptie is vanuit een interpretatief paradigma met behulp van kwalitatieve methoden onderzoek gedaan naar de semiotische werking van ' A message to all World leaders' . Een videoboodschap van Anonymous die op Youtube te zien is. Aanleiding voor dit onderzoek is de steeds groter wordende invloed op de maatschappij van ICT. Het gebruik van digitale middelen door activisten neemt toe, soms zijn deze middelen illegaal, dit verschijnsel heet hacktivisme. Bij dit onderzoek heeft de volgende vraag centraal gestaan;
Hoe geven Nederlandse hoogopgeleiden betekenis aan de videoboodschap; A Message to All World Leaders, van Anonymous die op Youtube te zien is?
Om deze vraag te beantwoorden zijn een viertal deelvragen geformuleerd. De eerste deelvraag is; wat zegt de wetenschappelijke literatuur over hacktivsme? Deze deelvraag is beantwoord door middel van het uitvoeren van een literatuurstudie naar hacktivisme. Hacktivisme kan gedefinieerd worden als het geweldloze gebruik van legaal en illegaal ambigue middelen om politieke doelen te bereiken (Samuel, 2004, p. 2). In de wetenschappelijke literatuur zijn twee perspectieven dominant, welke ik het sociale en het ICT perspectief noem. Het sociale perspectief bekijkt hacktivisme als een digitale vorm van activisme en heeft aandacht voor de mogelijkheden tot politieke participatie. Het ICT perspectief benadert hacktivisme als een ICT beveiligingsvraagstuk. De tweede deelvraag in dit onderzoek is; wat zegt de wetenschappelijke literatuur over Anonymous? Deze vraag is beantwoord door het verrichten van een literatuurstudie. De resultaten hebben geleidt tot  een duidelijk beeld van de afzender en heeft de  context van de videoboodschap is Anonymous beschreven.  Anonymous is een gemeenschap met anonieme leden, die geen formeel lidmaatschap en leiderschap kent. De acties van Anonymous zijn de uitkomst van een (evolutionair) proces binnen die gemeenschap. Anonymous streeft politieke doelen na en maakt hierbij gebruik van digitale middelen die (soms) illegaal zijn. Vervolgens is deelvraag drie aan bod gekomen; wat zegt de wetenschappelijke literatuur over semiotiek en betekenisgeving? Deze vraag is beantwoord door middel van het uitvoeren van een literatuurstudie en heeft geleid tot een analyse instrument voor de semiotische analyse. 
De vierde deelvraag luidt als volgt; welke tekens spelen een rol van betekenis in de videoboodschap van Annymous? Om deze vraag te beantwoorden heb ik een semiotische analyse van de videoboodschap gemaakt. Door middel van de semiotische analyse kon ik aangeven hoe de tekens in de videoboodschap betekenis creëren, gebaseerd op mijn eigen interpretatie. De videoboodschap toont beelden van politieke leiders, oorlog, onderdrukking, kapitalisme, technologische vooruitgang en opstand. Al eeuwen worden kennis, ethiek en technologie geconditioneerd door de elite. Met de komst van technologische vooruitgang is de onderdrukking van de mensen niet meer mogelijk. Door digitale en fysieke eenwording is een groot collectief bewustzijn ontstaan. Hierdoor kunnen mensen niet langer voor de gek worden gehouden. Door vrijheid op internet ontstaat er vrijheid over de hele wereld. De videoboodschap sluit af met het verzoek om je bij Anonymous aan te sluiten. Uit mijn eigen analyse blijkt dat het verhaal een belangrijke rol speelt in de videoboodschap, de ' story of conspiracy'   van Stone (2002) is duidelijk herkenbaar, dit is een variant op de ' story of helplessness and control' . Metaforen worden strategisch gebruikt om positieve of negatieve eigenschappen van zaken in de videoboodschap te benadrukken. De gebruikte beelden van politieke leiders, oorlog, onderdrukking, kapitalisme, technologische vooruitgang en opstand ondersteunen het verhaal op effectieve wijze. Uit mijn semiotische analyse blijkt dat er weinig elementen in de videoboodschap aanwezig zijn die de kijker persoonlijk bij de videoboodschap zullen betrekken. In de video speelt het geluid een belangrijke rol omdat het verhaal door middel van een voice-over vertelt wordt, ter ondersteuning wordt er dramatische muziek gebruikt.
De vijfde deelvraag is; welke tekens uit de videoboodschap 'A Message to All World Leaders' worden door hoger opgeleiden Nederlanders erkent en hoe worden deze geïnterpreteerd? Om deze vraag te beantwoorden zijn er  semigestructureerde interviews afgenomen met tien respondenten. Dit is gedaan aan de hand van een topic lijst, welke gebaseerd is op het eerder genoemde onderzoeksinstrument. Het verhaal van ' conspiracy'  wordt gedeeltelijk herkent door de respondenten. Twee van de tien respondenten herkennen de belangrijkste elementen, terwijl de andere respondenten enkele elementen herkennen.  Zeven van de tien respondenten geven aan dat de beelden van oorlog belangrijk zijn in de videoboodschap. De schuld aan de ellende die de oorlog representeert wordt gelegd bij de politieke leiders. De beelden worden gepercipieerd als een geschetste tegenstelling tussen het volk en de machthebbers. Op basis van analyse van de resultaten met betrekking tot de interpersoonlijke metafunctie blijkt dat acht van de tien respondenten zich niet betrokken voelen bij de videoboodschap. Drie van de tien respondenten konden zich niet identificeren met het onderwerp van hacken of protest. Vier van de tien respondenten konden zich niet herkennen in het geschetste beeld van de wereld en voelden zich daarom niet betrokken bij de videoboodschap. Alle respondenten vinden dat het tempo waarin de coördinatie van shot A naar B verloopt erg hoog is. Zeven  van de tien respondenten vinden dat de videoboodschap door haar hoge tempo de aandacht trekt en dat het hoge tempo geen afbreuk deed aan de verwerking van de videoboodschap. Alle tien de respondenten zijn positief over de achtergrondmuziek. Ze  geven aan dat de muziek bijdraagt aan de spanning en dat het de boodschap goed ondersteunt. Acht van de tien respondenten waren minder positief over de voiceover omdat ze vinden dat deze slecht te verstaan is.
Herkenning speelt een grote rol de bij de betekenisgeving aan de videoboodschap van Anonymous door van hoog opgeleiden Nederlanders.  Acht van de tien respondenten  kunnen zich niet identificeren met het getoonde beeld van de wereld, of kunnen zich niet identificeren met het onderwerp van (h)activisme. Hierdoor voelen zij zich niet aangesproken door de videoboodschap. De respondenten selecteren de beelden die ze wel herkennen en die hen wel aanspreken als het gaat om het geven van betekenis aan de videoboodschap. Er wordt aan de afzonderlijke beelden geen betekenis gegeven maar de beelden worden gegroepeerd. Aan deze groepen wordt vervolgens betekenis toegekend. De coördinatie van shot A naar B speelt daarom een belangrijke rol bij de betekenisgeving. De coördinatie van de shots hangt samen met de achtergrondmuziek en de voiceover en de respondenten geven allemaal aan dat de muziek de boodschap dramatischer maakt."
Explaining the formal autonomy of public sector agencies in Colombia and Venezuela,"['Gonzalez Becerra, C.I.']","['Verhoest, Koen']",2013-12-07T05:01:00Z,en,"['Agencies, Formal Autonomy,Administrative traditions, Reform Paths, Agency Logic, Commitment Logic, Political Uncertainty, Policy conflict']",Research in Public Administration and Organizational Science,"In this thesis we aim to study and explain the formal autonomy of public sector agencies in Colombia from 1990 to 2011 and in Venezuela from 2000 to 2011. Using Â´mapping of public organizationsÂ´ as data collection technique, we studied the landscape of agencies and their main characteristics in Colombia and Venezuela every five years.
The basic argument, on which this study is built upon, is that due to the common administrative traditions, public sector reform paths, and external pressures of Colombia and Venezuela, these two countries will have similar patterns of agenciesÂ´ formal autonomy. However, as in 2000 Venezuela experienced a major government policy change towards socialism, we also attempt to explore how this policy change is represented in agencies'  formal autonomy. Therefore, we use the Colombian case to explore the agenciesÂ´ formal autonomy since the moment in which the major public sector reform started in Latin America: early 1990Â´s, and we use Venezuela for comparison with Colombia because its change of policy since the year 2000.
The analysis is conducted in two parts. First we present a descriptive section which explores the general trends of agenciesÂ´ formal autonomy in Colombia and Venezuela. Particularly, we look at the distribution of agencies according to their formal autonomy and the relation between formal autonomy on the one hand and agenciesÂ´ primary task and policy sectors on the other hand.
The second section of the analysis seeks to give an explanation to the findings of the descriptive section. For that purpose, three main theoretical perspectives are used: sociological institutionalism, historical institutionalism, and rational choice institutionalism. The latter is divided in an agency level ration choice perspective and a country level rational choice perspective. To conduct the explanatory analysis we used binary logistic regression as data analysis technique.
The results of the analysis show that the patterns of formal autonomy in Colombia and Venezuela differed both before and after the government policy change of the latter. This indicates that administrative traditions and external pressures cannot account for the levels of agencies'  encountered in Colombia and Venezuela. We found that agency level factors such as the primary task that the agencies perform and the policy sector in which agencies are located is related with their level of formal autonomy. However, the results indicate that these relations do not follow the predictions that were made based on the different theoretical perspectives."
"""Je maakt van een timmerman geen bakker"". Een onderzoek naar de mate waarin medewerkers en managers binnen de Belastingdienst Rivierenland in staat zijn â  employableâ   te zijn en de rol die communicatiekanalen hierbij spelen","['Piels, H.C.E.']","['Loos, E.F.']",2013-12-07T05:00:18Z,nl,"['interne communicatie, motivatie, vermogen, kansen, vaardigheden, human resource, HR, rijke media, minder rijke media.']","Communicatie, Beleid en Management","Toenemende vergrijzing binnen overheidsinstellingen (CBS, 2012) en de bezuinigingstaakstellingen van ongeveer 400 miljoen euro (Belastingdienst, 2011) waarmee de Belastingdienst te kampen heeft, zouden de kwaliteit van personeel binnen de Belastingdienst negatief kunnen beïnvloeden. Vanwege vergrijzing neemt de gemiddelde leeftijd van medewerkers binnen de Belastingdienst toe en vanwege bezuinigingstaakstellingen zou dit tot gevolg kunnen hebben om niet in kwaliteit van personeel te investeren. De Belastingdienst kiest er toch voor om in personeel te investeren en zet daarom het programma employability in. Een programma dat ervoor moet zorgen dat de juiste medewerker op de juiste plaats te vinden is en medewerkers flexibel inzetbaar zijn. Dit om zowel tegemoet te komen aan organisatiebehoeften, maar ook vanuit de mogelijkheid tot eigen ontwikkeling van het personeel. Maar in welke mate zijn medewerkers en managers ook daadwerkelijk in staat om ' employable'  te zijn en welke rol kunnen communicatiekanalen hierbij spelen? De twee hoofdvragen die worden beantwoord in dit onderzoek luiden: In hoeverre vinden medewerkers, teamleiders en directeuren binnen Belastingdienst Rivierenland dat zij over vaardigheden beschikken om ' employable'  te kunnen zijn? en Op welke manier kan interne communicatie een bijdrage leveren aan het vergroten van de vaardigheden die medewerkers, teamleiders en directeuren ervaren om ' employable'  te kunnen zijn?"
'Zo doen wij dat nu eenmaal' -- Competentieversterking bij medische professionals via professionele culturen,"['Beerthuis, T.']","['Noordegraaf, M.']",2013-12-07T05:01:01Z,nl,"['Competenties, competentieversterking, professionals, professionele culturen, veranderprocessen, verandering, zorg, prestatiedruk, medisch']",Publiek management,"De zorgsector heeft met allerlei ontwikkelingen te maken. Werk- en prestatiedruk, een explosieve- en gedifferentieerde zorgvraag, maar ook nieuwe  manieren van werken door professionals. Door deze ontwikkelingen hebben medische professionals steeds vaker ' nieuwe'  organiseercompetenties nodig zoals ' samenwerken' , ' verandermanagement'  of ' communiceren.'  In een poging om bovenstaande ontwikkelingen te beheersen, passen organisaties geregeld top-down gestuurde, dwingende veranderprocessen toe. Deze stuiten echter op professionele culturen: culturen waarin autonomie en zelfsturing zeer belangrijk zijn. Om competentieversterking toch mogelijk te maken kan in plaats van het ' doorbreken'  van professionele culturen of het ' opleggen'  van veranderingen zoals competentieversterking, juist gekeken worden naar het vormgeven van veranderprocessen op een manier die aansluit bij professionele culturen. Dit heeft geleid tot een centrale vraagstelling: ' Op welke manier kunnen veranderprocessen gericht op competentieversterking bij professionals worden vormgegeven, zodat deze aansluiten bij professionele culturen en welke factoren beiÌ nvloeden deze aansluiting?'  Aan de hand van theorie is gekeken naar welke vormgeving de meeste aansluiting zou kunnen vinden bij professionele culturen. Dit is getoetst aan de casus 'Verwonder & Verbeter', een veranderproces gericht op competentieversterking in het Universitair Medisch Centrum Utrecht. Professionals leken erg enthousiast over deze casus, waardoor dit een mooi studieobject leek om deze aansluiting te bekijken. Uit dit onderzoek bleek dat de theoretische vormgeving sterk overeen kwam met de redenen waarom professionals enthousiast waren over het veranderproces. Het onderzoek brengt in kaart op welke manier veranderprocessen vormgegeven kunnen worden zodat deze aansluiting bereikt kan worden. Ook worden een aantal aanbevelingen gedaan voor de casus, overdraagbaarheid en beroepsorganisaties."
