title,authors,supervisors,date,language,keywords,program,abstract
Short Stay in de Stad; een verkennend onderzoek naar de invloed van short stay appartementen op de leefbaarheid in twee Amsterdamse buurten,"['Harskamp, J. van']","['Dignum, Dr. K.']",2013-06-12T17:01:11Z,nl,"['Short Stay, leefbaarheid, Amsterdam, Jordaan, Haarlemmerbuurt, sociale cohesie, veiligheid, fysieke leefomgeving, gedragscomponent, normen- en waardencomponent, belevingscomponent, wisselende huurders']",Stadsgeografie (Urban Geography),"De gemeente Amsterdam heeft in 2009 de eerste short stay vergunningen uitgegeven. Op deze manier moet het voor buitenlandse werknemers makkelijker worden een tijdelijke woonruimte in de stad te vinden. De komst van deze wisselende huurders heeft een mogelijk effect op de leefbaarheid van de verschillende Amsterdamse buurten. Dit mogelijke effect is echter nog niet onderzocht. In dit onderzoek staat daarom de volgende vraag centraal: “In hoeverre heeft de invoering van het short stay beleid in 2009 invloed op de leefbaarheid van een Amsterdamse buurt?”
De gedachte achter de invoering van het short stay beleid in is het programma ‘Amsterdam Topstad’ uit 2006. Verschillende initiatieven komen in dit programma aan bod waardoor Amsterdam als internationale stad aantrekkelijk blijft en aantrekkelijker wordt. Naast initiatieven worden obstakels zoals de krappe woningmarkt genoemd. Het short stay beleid dient als een oplossing om de problemen van de krappe woningmarkt voor buitenlandse werknemers die tijdelijk in Amsterdam willen wonen, te verminderen.
Er bestaat nog geen wetenschappelijke literatuur over het effect van het short stay beleid op de leefbaarheid in een buurt. Om deze reden is in het onderzoek verder ingegaan op het begrip leefbaarheid. Het begrip komt vaak terug in verschillende onderzoeken ten aanzien van buurten en steden maar een eenduidige omschrijving bestaat niet. Leefbaarheid wordt ook wel gezien als een containerbegrip. In dit onderzoek zijn drie dimensies van leefbaarheid onderscheiden; sociale cohesie, het gevoel van veiligheid en de fysieke leefomgeving. Sociale cohesie, een ander containerbegrip, kan onderverdeeld worden in drie componenten; de gedragscomponent, de normen- en waardencomponent en de belevingscomponent. Voor alle dimensies en componenten in het onderzoek is vervolgens nagegaan welk mogelijk effect geconstateerd kan worden nadat wisselende huurders in de buurt zijn komen wonen. Op alle dimensies wordt een negatief effect van wisselende huurders op de leefbaarheid in de buurt verondersteld. Voor de sociale cohesie wordt voornamelijk op de mate en intensiteit van het contact tussen buurtgenoten (gedragscomponent) een negatief effect verwacht.
Om bovenstaande verbanden te onderzoeken is gebruik gemaakt van een experimentele- en controlegroep in de buurten Jordaan en Haarlemmerbuurt. Aan de hand van adressen met een short stay vergunning is een experimentele groep opgemaakt van adressen in de buurt van een woning met short stay vergunning. Adressen die zich juist niet in de buurt van een woning met short stay vergunning (of een hotel) bevinden behoren tot de controlegroep. Nadat de enquête is verspreid over beide groepen zijn in totaal 108 enquêtes retour gekomen en geanalyseerd. Uit de eerste analyses kwam naar voren dat de bewoners tevreden zijn met de buurt waarin zij wonen. In vergelijking met andere leefbaarheidsonderzoeken van de gemeente Amsterdam, komt het cijfer dat bewoners aan de buurt (8,2) geven, overeen. Wat betreft de leefbaarheid komt uit de analyses naar voren dat de bewoners tevreden zijn met hun buurt. Op alle dimensies van leefbaarheid wordt hoog gescoord en ook uit de interviews die zijn afgenomen komt het algemene beeld naar voren dat bewoners zeer tevreden zijn over de leefbaarheid. De invloed van persoons- en huishoudenseigenschappen op de sociale cohesie in een buurt is in dit onderzoek beperkt gebleken. Veronderstelde verbanden tussen bijvoorbeeld het geslacht, leeftijd, opleidingsniveau, nationaliteit, inkomen en sociale cohesie zijn niet gevonden. Andere eigenschappen zoals het wel of niet eigenaar zijn van een woning, het hebben van een baan of het hebben van kinderen blijken wel samen te hangen met een aantal componenten van sociale cohesie in de buurt. Deze verbanden zijn stuk voor stuk zwak van aard. Door twee aangrenzende buurten in hetzelfde stadsdeel te onderzoeken is de invloed van buiten de buurt beperkt gehouden. Op deze manier is de invloed van een lager schaalniveau (persoons- en huishoudenseigenschappen) en een hoger schaalniveau (invloed van buiten de buurt) minimaal en is vervolgens dieper ingegaan op het mogelijke verschil in leefbaarheid tussen de experimentele- en controlegroep.
In hoofdstuk 6 zijn de twee gevormde groepen met elkaar vergeleken. Op basis van een aantal stellingen per component en dimensie is gevraagd naar de mening van de bewoners. Bij de analyse van sociale cohesie is alleen een significant verschil gevonden tussen de verdeling van beide groepen van het gedragscomponent. Bewoners uit de experimentele groep scoren lager op dit component. Op de meest oppervlakkige en directe component van de leefomgevingskwaliteit, namelijk de mate en intensiteit van contact, heeft de komst van short stayers een negatieve invloed. Dit blijkt ook uit een aantal van de gesprekken die gevoerd zijn met de bewoners. Huizen met een short stay vergunning worden gezien als een hotel en de komst van short stayers maakt de buurt ook anoniemer. Daarnaast geven een aantal bewoners aan dat de komst van short stayers in de buurt geen invloed heeft op de contacten in de buurt. Echter, dit zou kunnen veranderen als het aantal short stayers in de buurt groter wordt.
Op de overige dimensies van de leefomgevingskwaliteit is geen verschil gevonden tussen beide groepen. Een aantal bewoners geeft in het interview aan last te ondervinden van short stayers hoewel dit niet terug is te vinden in de eerste kwantitatieve analyses. Alleen bij de stellingen waarbij direct wordt gevraagd naar de invloed van wisselende huurders, wordt op twee van de negen items een significant verschil gevonden tussen de experimentele en de controlegroep. Het gaat hierbij om verschillende vormen van overlast (exclusief geluidsoverlast) en de mate waarin de straat schoon is. Bewoners uit de experimentele groep ondervinden meer overlast en vinden dat de straat minder schoon is dan bewoners uit de controlegroep. Uit enkele gesprekken komt deze negatieve invloed van short stayers op de leefomgevingskwaliteit ook naar voren hoewel niet alle bewoners dit merken. Sommige bewoners geven aan dat dit wel kan veranderen als het aantal short stayers in de buurt groter wordt. Verwacht wordt dat in dat geval de negatieve invloed van short stayers op de leefomgevingskwaliteit groter wordt."
Impact of demographical change on the severity of an epidemic,"['Chan, K.M.D.']","['Bootsma, M.C.J.']",2013-06-12T17:00:51Z,en,"['Ageing', 'epidemiology', 'numerical study', 'theoretical study', 'H1N1', 'demographical change', 'frequency dependency', 'density dependency', 'semi-domination contact pattern', 'contact pattern', 'long-term care facility', 'nursing home', 'elderly home', 'probability of minor outbreak', 'probability of major outbreak', 'effectiveness of interventions', 'health care workers', 'residents', 'final size', 'mortality', 'simulation model', 'analytical approximation', 'Hong Kong', 'pathogen', 'infectious disease']",Mathematical Sciences,"The thesis consists of two parts. The topic of the two parts are different, the title and the abstract of each part is:

1. The impact of demographical change such as ageing on the severity of an epidemic: a theoretical and numerical study of the final size and the basic reproduction number.
Abstract
Ageing and the effect of birth restriction change the demography in populations. These changes in demography influence contact patterns in societies, and, since contact patterns are important in disease transmission, influence the severity of infectious disease outbreaks. Here we use a deterministic multi-type SIR model to study theoretically and numerically how demographical changes impact the basic reproduction number   and the final size of an infectious disease outbreak. We study either a density dependent contact pattern or a frequency dependent contact pattern. There is no consensus in literature in which multi-type contact pattern should be called frequency dependency. We have defined several new contact patterns in which the number of contacts per unit of time of an individual with a specific group is constant if we scale all group sizes by the same factor. In a model with reciprocal contacts where individuals have a fixed amount of contacts per unit of time with their own group and each young individual has a fixed amount of contacts per unit of time with older individuals, the basic reproduction number and final size increases when the number of young individuals increases. For other contact patterns, including the density dependent contact pattern, we have found theoretical results of a similar character. Numerical results suggest that if the society would have been more aged in Hong Kong in 2009, the number of cases of H1N1-2009 infection would have been smaller. However, due to the dependence of severity of an infection on the characteristics of the infected individuals, this need not imply a decrease in burden on the health care system. In a case study, we have found that birth restriction in Hong Kong may prolong the time before a similar H1N1 strain to the H1N1-2009 can cause an epidemic in Hong Kong.  

and

2. Effectiveness of interventions targeted at health care workers and residents in reducing the probability and the size of an infectious disease outbreak in a long-term care facility for the elderly
Abstract
Protecting elderly from an infectious disease infection is important due to the high case fatality ratio among elderly. It is predicted that the fraction elderly will increase in most developed countries, which can lead to an increase of the number of required long-term care facilities for the eldery in the future. Hence, in the future, protection of individuals in long-term care facilities for the elderly from infectious diseases infection becomes even more important in order to reduce the severity of an outbreak of an infectious disease outbreak. Previous studies contradict each other on how effective of interventions targeted at residents and health care workers are in reducing the probability of a major outbreak in a long-term care facility for the elderly. We used a stochastic simulation model and an analytical model to clarify this issue. Interventions can target health care workers and/or residents and may reduce the susceptibility and/or infectiousness of the individuals. In this study we define the level of an intervention of any type by the reduction of susceptibility and/or infectiousness of the targeted individual in percent. We call an intervention of any type weak, if the level of the intervention is less than 40% in comparison with the situation with no interventions. This study shows that weak interventions targeted at health care workers or visitors cannot reduce the probability of a major outbreak in the facility when the infectious disease has a basic reproduction number higher than 1.6 in the general population. These interventions hardly influence the average outbreak size given a major outbreak in the facility, in contrast to residents of the facility. Weak interventions aimed at residents can be effective even when the basic reproduction number exceeds 1,6. We showed that intervention level and the effectiveness of interventions in reducing the size and probability of a major outbreak in the long-term care facility for the elderly are in general not linearly related. Our study also reveals that interventions must start early in the epidemic and should not be stopped when the peak of the force of infection has been reached."
Het consumptielandschap en de nieuwe bewoners: De (mis)match tussen vraag en aanbod in Amsterdam,"['Zwijnenburg, J.']","['Dignum, K.']",2013-06-12T17:01:10Z,nl,"['Gentrificatie, Gentrification, middenklasse, consumptiepatronen, consumptiebehoefte']",Stadsgeografie (Urban Geography),"In dit onderzoek staat de gentrifier centraal.Deze ‘nieuwe bewoners’ worden in dit onderzoek vanuit de verschillende gentrificatieprocessen beschreven. De gedachte is dat met een toenemende nieuwe middenklasse (de gentrifiers) er een veranderende vraag ontstaat.Het onderzoek betreft twee delen. Om antwoord te geven op het eerste deel, het onderscheiden van verschillende groepen gentrifiers, is er gekeken naar literatuur rondom de leefstijl en leefwijze. Bourdieu (1984) is de grondlegger van theorie rondom de leefstijl, waarbij een nadruk ligt op de status, identiteit en de perceptie hierop. Dit is gemeten aan de hand van de verbondenheid met de stad Amsterdam. Dit zou resulteren in een groep die sterk verbonden is met de stad en mensen die in Amsterdam wonen om andere redenen (het maken van carrière bijvoorbeeld). Het onderscheid op basis van deze twee leefstijlen is niet uitgekomen.
Er is daarom op basis van de leefwijze een onderscheid gemaakt binnen de groep gentrifiers. De leefwijze wordt bepaald door de beperkingen wat betreft tijd en geld, wat mede het activiteitenpatroon van een individu bepaalt. Uit de theorie is naar voren gekomen dat de huishoudenssamenstelling van grote invloed is op de leefwijze. Zo heeft bijvoorbeeld de gentrifier met kinderen meer tijd-ruimtelijke beperkingen en heeft de alleenstaande gentrifier een meer actief consumptiepatroon. Voor al deze groepen, zowel de gentrifiers als de overige bewoners, is gekeken of het voorzieningenaanbod aansluit op de behoefte. Er is hierbij specifiek gekeken naar de dagelijkse voorzieningen en de restaurants en eetcafés.Uit de analyse blijkt dat de ruimtelijke spreiding en de nabijheid van de (dagelijkse) voorzieningen de belangrijkste indicatoren zijn voor de ‘behoefte aan meer’. Is de voorziening niet aanwezig in de directe omgeving, dan is de kans groter dat de betreffende respondent behoefte heeft.
De conclusies van het onderzoek zijn dat er verschillende gentrifiers zijn te onderscheiden op basis van de leefwijze. Uit de analyse is echter gebleken dat zij niet een ander consumptiepatroon hebben. De behoefte van de verschillende groepen (zowel gentrifiers als niet-gentrifiers) verschilt dan ook minimaal. Bij de dagelijkse voorzieningen is vooral de ruimtelijke spreiding van invloed op de behoefte aan meer. De aanwezigheid van de voorziening in de directe omgeving bepaalt de behoefte. Dit geldt ook voor de unieke dagelijkse voorzieningen. De behoefte aan restaurants is leeftijdsgebonden; de jongere Amsterdammer heeft veelal meer behoefte. Het onderscheid op basis van de gentrifier bepaalt niet de ‘behoefte aan meer’. De ‘veranderende vraag’ zorgt in dit opzicht niet voor een mismatch tussen vraag en aanbod."
"Verwachtingen van applets in het scheikunde onderwijs: Leerlingen, Docenten en Ontwerpers","['Orsel, S.M.', 'Pleijsier, R.A.']","['Mooldijk, Ad', 'Waveren, Caroliene van']",2013-06-12T17:01:00Z,nl,[],Leraar Voorbereidend Hoger Onderwijs in Scheikunde,"De toepassing van applets, animaties en computersimulaties in het onderwijs wordt door de snelle technologische ontwikkeling van internet, software programma’s en de verbeterde digitale infrastructuur op scholen bevorderd. Voor het vak scheikunde kunnen applets gebruikt worden om scheikundige processen en moleculen te visualiseren en om scheikundige concepten inzichtelijk te maken. In het voortgezet onderwijs in Nederland maken docenten de keuze voor een bepaalde applet. De gebruikte applets vormen geen onderdeel van een bepaalde lesmethode en zijn een aanvulling op het lesmateriaal. De applets zijn ontworpen door commerciële bedrijven of universiteiten (veelal Amerikaanse) waardoor de aansluiting met de leerlingen in het Nederlandse voorgezet onderwijs niet altijd voldoet.
In dit onderzoek is gekeken naar de verwachtingen van ontwerpers en gebruikers van applets. Tevens is onderzocht welke ontwerpvoorwaarden de ontwerpers en welke criteria de docenten en leerlingen belangrijk vinden. Dit is gedaan aan de hand van de volgende variabelen: spelelement, gebruik, visualisatie op microniveau, feedback, presentatie (vormgeving en taal), probleemoplossend vermogen, uitdaging, inzicht in achterliggend concept en leerdoelen en creativiteit. De verwachtingen van ontwerpers en de ontwerpvoorwaarden zijn onderzocht met behulp van literatuurstudie. De percepties van docenten komen uit eerder onderzoek gedaan in het kader van de lerarenopleiding Utrecht. Voor de percepties van leerlingen is in het onderzoek gebruik gemaakt van vragenlijsten en observaties van leerlingen tijdens het gebruik van een applet in de les. Het onderzoek is op twee scholen uitgevoerd in de vwo bovenbouwklassen. Als theoretische kader is het model van Van den Akker (2006) over representaties van curricula gebruikt.
In dit onderzoek blijkt dat ontwerpers, docenten en leerlingen in veel gevallen hetzelfde denken over eigenschappen van applets. Dat is het geval bij de variabelen spelelement, gebruik, feedback, presentatie (taal), probleemoplossend vermogen en inzicht in achterliggend concept en leerdoelen. Ze verschillen in presentatie (vormgeving) en uitdaging. Voor visualisatie op microniveau en creativiteit is door gebrek aan data geen conclusie te trekken.
De intenties die ontwerpers hebben om onderzochte variabelen in de applet te laten terugkomen, wordt bij enkele variabelen ook ervaren door de leerlingen. Dit is zo bij gebruik, visualisatie op microniveau, probleem oplossend vermogen en inzicht. Bij presentatie komen de intentie van de ontwerper en de ervaring van de leerling redelijk overeen. Dit is niet het geval bij spelelement, feedback en uitdaging. Voor de variabele creativiteit ontbrak data om tot een conclusie te komen."
The usage of the Historical Present in Old Irish narrative prose,"['Loon, D. van']","['Schrijver, P.C.H.']",2013-06-10T17:00:58Z,en,"['Linguistics, Old Irish, Celtic, Verbs, Historical Present, Táin Bó Cuailnge']",Medieval Studies,"By analyzing all the verbal forms used in the Old Irish text Táin Bó Cúailnge I have endeavoured to investigate the usage of the historical present in Old Irish narrative prose. All verbal forms were labeled according to different types of criteria regarding their contextual ‘footprint’. I have linked these labels to the terminology used in the study of verbal aspect. This labeling has resulted in a large table presenting the contextual function of every verbal form.

I then formulate several hypotheses regarding the usage of different types of verbal forms to represent a past event. It was necessary to focus on all these types of verbal forms as the usage of the historical present could not be researched independently. These hypotheses are then discussed in detail, with examples from the Táin Bó Cúailnge. 

I have endeavoured to show that the historical present is used to indicate imperfectivity. When a sequence of verbal forms (i.e. two or more verbal forms that occur in subsequent clauses) is put in the present tense the verbs become temporally closely linked. They represent one single Situation. It would appear that the author of a text could also imply a temporally close link between two verbs even if they are in fact perfective by using present tense verbal forms. 

The preterite verbal forms show the opposite of the historical present. Preterite verbs are, according to my hypothesis, used to indicate perfectivity. Preterite verbs represent single, complete Situations. The percentages, which I derived from my database, show a mirror-relation between the usage of the historical present and preterite verbal forms. The preterite verbal forms do show a slightly larger amount of problematic verbal forms, but the majority of those verbs have been demonstrated to be Middle Irish.

In this paper I answer the question why and how present tense verbal forms are used to indicate an event in the past. If my hypotheses are accepted, then a new feature of the Old Irish language has been discovered. In future translations of Old Irish narrative prose texts we can utilize the hypothesis regarding the usage of the historical present in order to arrive at the correct interpretation of the text. The element of imperfectivity, which historical presents represent, results in translations of prose texts that are dynamic and full of tension, rather than a simple chronological summary of past events."
"Attituden jegens euthanasie en hulp bij zelfdoding in
Nederland: Is er een samenhang met openheid voor
ervaringen en empathie?","['Reijnhoudt, M.']","['Schut, Dr. H.A.W.']",2013-06-10T17:00:46Z,nl,"['Euthanasie', 'hulp bij zelfdoding', 'empathie', 'openheid voor\nervaringen', 'actieve levensbeëindiging', 'attitude.']",Klinische en Gezondheidspsychologie,"In Nederland zijn euthanasie en hulp bij zelfdoding (HBZ)
bij ondraaglijk fysiek en/of psychisch lijden sinds 2002
bij wet gelegaliseerd. Ondanks de legalisering is het
morele debat omtrent actieve levensbeëindiging niet
verstomt. Er is nog weinig onderzoek gedaan naar het
verschil in attituden jegens euthanasie en HBZ bij fysiek
en psychisch lijden. Daarnaast is ook onderzoek naar
persoonsvariabelen en attitude jegens actieve
levensbeëindiging schaars. Dit onderzoek richt zich op de
relatie tussen de persoonlijkheidstrekken openheid voor
ervaringen en empathie en de attitude jegens euthanasie
en HBZ bij fysiek en psychisch lijden. 213 Nederlandse
participanten kregen vragenlijsten voorgelegd over:
demografische factoren, attituden jegens euthanasie en
HBZ bij fysiek en psychisch lijden, openheid voor
ervaringen en empathie. In dit cross-sectionele
onderzoek is gebruik gemaakt van correlatie analyses.
Uit de resultaten blijkt dat men positiever is over actieve
levensbeëindiging bij fysiek lijden dan bij psychisch
lijden. Daarnaast blijkt dat men negatiever is over HBZ
dan over euthanasie. De persoonlijkheidstrek openheid
voor ervaringen blijkt positief te correleren met zowel
euthanasie als HBZ. Tevens lijkt er een positieve
samenhang te zijn tussen openheid voor ervaringen en
actieve levensbeëindiging bij psychisch lijden. Er blijkt
geen relatie te zijn tussen empathie en attitude jegens actieve levensbeëindiging. Hoewel in voorliggend
onderzoek geen uitspraken gedaan kunnen worden over
causaliteit, blijkt er wel degelijk een rol weggelegd te zijn
voor persoonlijkheidstrekken bij attituden jegens
euthanasie en HBZ."
The interplay between hypoxia-inducible factor and E2F - Transcriptional crosstalk under hypoxic conditions,"['Neiteler, A.']","['Bakker, W.J.']",2013-06-08T17:00:49Z,en_US,"['hypoxia-inducible factor, HIF, hypoxia, E2F, transcriptional regulation, crosstalk, cell cycle, metabolism, DNA repair, cell death, apoptosis, angiogenesis']",Molecular and Cellular Life Sciences,"Hypoxia is an important condition in both developmental and pathological settings. It is crucial for cell survival to adapt to hypoxic stress. A key response to hypoxia is regulation of gene expression. The transcription factor HIF is involved in the regulation of most hypoxia-sensitive genes. HIF is known to regulate genes involved in the cell cycle, angiogenesis, metabolism, DNA repair and cell death. The E2F family of transcription factors also regulate genes in these cellular processes. Intriguingly, recently it was shown that E2F7/8 regulate angiogenesis through a transcriptional cooperation with HIF (Weijts and Bakker, 2012). It is therefore likely that these important transcription factors are involved in many of the same pathways under hypoxic conditions. However, not much is known about the interplay between HIF and E2F. This literature study investigates and reveals a broad relationship between HIF and E2F in the cell cycle, metabolism, DNA repair and cell death. Elucidation of the relationship between HIF and E2F may provide a better understanding of the role of hypoxia in development and disease."
EPIGENETICS-EPIDISEASES-EPIDRUGS,"['Antonova, S.V.']","['Graaf, Pd']",2013-06-12T17:00:49Z,en,"['Epigenetics, cancer, inhibitors,']",Molecular and Cellular Life Sciences,"The mechanism by which genetic expression is modified and regulated is of a main interest in the field of epigenetics. It involves various chromatin-modifying and associated proteins, often referred to as “writers”, “readers” and “erasers”, capable of establishing different modification groups (e.g. methyl, acetyl) on histone residues and consequently recruiting various transcription factors in order to further shape the gene expression. Naturally, a strict regulation of the activity of these proteins is necessary for normal cell functioning. Often it is the deregulation of writers, readers and erasers that leads to aberrant gene transcription and cancer. For that reason revealing the epigenetic mechanisms of cancer at molecular level is essential for understanding the initiation and progression of the disease. In addition, aberrant expression of histone modifying proteins can serve as a direct biomarker of certain types of cancer and an indicator of a proper diagnosis. Identifying the cause of gene deregulation also allows for further development of drugs that can target the cause and eliminate it. A novel concept in the fields of cancer research and epigenetics are the epi-drugs – natural or synthetic inhibitors of certain histone modifying enzymes, which are currently considered as potent candidates for anti-cancer therapeutics. The present review aims to introduce the concept of epigenetics, describe its main players, and reveal the possible application of epi-inhibitors in the field of cancer treatment."
