title,author,date,supervisor,faculty,abstract,keywords
The Weaving of Legitimacy: NGOs and Labour Regulation in the Global Garment Industry,"Quintero, Andrés Navas",2014-12-12,['Pegler Lee'],International Institute of Social Studies,"The garment industry has reached global proportions over the last decades, driven by transnational companies that outsource manufacturing processes to suppliers in the Global South, in an attempt to save costs and maximize their profits. This business model has affected the well-being of workers, since fac-tories maintain their competitive position by engaging in exploitative labour practices. International NGOs based in the Global North have strived to im-prove workers’ conditions through advocacy and support strategies, but their efforts are challenged by disputes over their legitimacy. This research aims at understanding how two of these organizations (Clean Clothes Campaign and Fair Wear Foundation) justify their legitimacy to participate in the regulation of labour in the global apparel business. An analytical framework for the study of NGO legitimacy justification is constructed and applied, employing Critical Discourse Analysis methods and various theoretical approaches to value chain governance, labour improvement and legitimacy.
The findings suggest that both organizations promote a rationale of supply chain responsibility for improving labour rights’ respect. However, the tactics and tools that they develop to achieve it differ, given their distinct strategic po-sitions in the industry. FWF seeks compliance with labour standards by pro-moting cooperation and building capacity for self-regulation among actors linked to the production processes. Meanwhile, CCC attempts to generate soli-darity relations in the realm of civil society to push for binding regulations in the sector. This distinction extends to their legitimacy claims, which reveal dif-ferent critical resources available for the organizations to exert influence in the governance of the industry. Their approaches can be interpreted either as con-verging in instituting a new programme of government in the apparel business or as tending towards a divergence, which may hinder further improvements in workers’ rights.","['NGOs', 'governance', 'legitimacy', 'garment industry', 'labour rights', 'discourse analysis', 'supply chains', 'economic globalization']"
Belonging and Integrating Migrants and Refugees within Higher Education System. A Case of Cavendish University Uganda.,"Nassaka, Grace",2014-12-12,['Hintjens Helen'],International Institute of Social Studies,"This paper explores the complex issue of integration and belonging of Migrants and Refugees in Higher Education. The aim is to discover more about the challenges and opportunities of integration and belonging of Migrants and Refugees pursuing Higher Education in Cavendish, a Ugandan University. Through a mainly qualitative approach, the paper suggests that knowledge of English as a dominant language used at the University, the self-belief of an individual, individual and effort to adapt into a new society’s demands are all important factors in the success of Migrants and Refugees in gaining a sense of belonging within Cavendish University. The research findings suggest that differences in terms of gender, class and age can influence Migrants and Refugees in their sense of belonging at Cavendish University, as well as their academic performance. Still students’ prejudice against each other has also been an important factor in undermining effective social interaction as well as their sense of belong. In the conclusion, the paper argues that there is good reason to believe that whatever the efforts made by individual Refugees and Migrants, integration and belonging within the University are more likely when academic institution and the broader society also take some share of responsibility for making integration work.","['belonging', 'integration', 'refugees', 'self-settled refugees and migrants', 'Uganda']"
Rethinking Juvenile Justice in Ghana: Proposing Practical Measures through a Child Rights Based Approach,"Nyantakyi, Maame Akua",2014-12-12,['Arts Karin'],International Institute of Social Studies,"The CRC and other International instruments provide standards on the rights of the child to ensure special treatment of the juvenile to achieve rehabilitation and reintegration. These standards acknowledge children as bearers of certain universally agreed norms and serve as a solid theoretical basis for justifying issues concerning children In accordance with the CRC, the aim of the juvenile justice system is to establish a separate system of treatments of juveniles from adults to ensure reintegration. Elements of criminal justice systems which include lengthy and punitive legal proceedings are to be avoided. Contrary to this, many juvenile justice systems subject children to the rigors of the criminal justice system which often does not take into consideration the child‟s age, vulnerability and right to special treatment. Ghana has shown commitment to protect the rights of juveniles by ratifying the CRC and other relevant international instruments related to juveniles. Ghana has however not met the standards of these instruments which provide for special treatment of the juvenile to ensure rehabilitation and reintegration. This paper addresses the issue of how Ghana can adopt a Child Rights Based Approach to juvenile justice with a particular focus on „diversion‟.","['juvenile', 'juvenile justice', 'diversion', 'child rights', 'child rights based approach', 'formal justice system', 'Ghana']"
Understanding Incarceration and Spousal/Partner Relationships: An exploration of female imprisonment and its effects on family relations in Zimbabwe,"Mafume, Rotina",2014-12-12,['Zarkov Dubravka'],International Institute of Social Studies,"This paper focuses on gendered dynamics of spousal relationships of incarcerated women. It seeks to understand the roles played by gender and sexuality in shaping these relationships. The paper uses gender lenses to critically examine how the penal system, prisons, and family are all gendered institutions that create a specific identity for the imprisoned woman. This identity presumably affects the partner and spousal relationships of imprisoned women. Thus interwoven in the analysis are issues of femininity versus criminality, language and crime. Gendered symbolism and imprisonment are explored in relation to how society creates representations that create the identities of the imprisoned woman. Thus the research informs feminist scholarships and correct male bias in research mainly centred on imprisoned man and marriage. My findings show that social stigma, women’s life situations, and children are the most important elements of gendered relationships and institutions affecting the spousal/partner relationships of incarcerated women.","['female', 'gender', 'imprisonment', 'marriage', 'spousal', 'partner', 'inmates', 'prison', 'women', 'divorce', 'separation', 'femininity', 'masculinity', 'family', 'children', 'kin', 'incarceration']"
Challenges Impeding Access to Social Protection Programmes for the Elderly Poor in Skipped Generation Households,"Mwangi, Leah Nyambura",2014-12-12,['Cheney Kristen E.'],International Institute of Social Studies,"Aging is a phenomenon of concern in Kenya. As the old population grows, they diminish their endowments making them susceptible to shock and chronic poverty. They require attention and care from different interventions. Traditionally, it is expected that the young should care for the old. However, studies show that the elderly have had to take up a kinship role and raise their grand-children due to losing their children to HIV/AIDS. Skipped generation thus emerge adding an additional role to the elderly population. The government has made several efforts to protect and promote the rights of the elderly and have adopted social protection programmes whose main objective is to pro-mote sustainability and alleviate poverty as well as enhance human capacity and development. These include two cash transfers for the elderly and the OVC in their care i.e. Older Persons Cash Transfer and the Kenya Cash Transfer Programme for Orphan and Vulnerable Children. This paper examines these programmes and the possibilities of the elderly in accessing the cash transfers and the implications on their livelihoods and social well-being.
Information is drawn from different sources and publications on social protection programmes in Kenya as well as from semi-structured interviews conducted among the elderly care givers, an NGO representative and local government officials. Two concepts, social exclusion and entitlement approach are used in analysing the findings that demonstrate that the elderly caregivers have been excluded and are rarely able to access the two cash transfers to which they are entitled. The elderly care givers are excluded by been denied access to cash transfers through lack of information about the existence of the programs, bias and discrimination during registration and distribution of cash transfers and unfair criteria for program registration. In addition, the programs are seen as mutually exclusive and therefore the elderly cannot benefit from both of them.","['elderly', 'elderly care givers', 'poverty', 'orphan and vulnerable children', 'social protection programmes', 'skipped generation households', 'Kenya']"
Representing Justice on Radio: A Case of Post-war Northern Uganda,"Odong, Jackson",2014-12-12,['Žarkov Dubravka'],International Institute of Social Studies,"Taking the case of the ‘Facing Justice’ radio programme, this research aims to analyse
the relationships of power that exist between different actors involved in
making the programme. In particular, the study analyses the various meanings
of ‘justice’ produced in the programme, using the analytical tools of framing and
focalisation. Justice on the radio is an account of meanings created through narratives,
and placed within the context of geopolitical relationships of power and
‘donor’ partnerships. This study found that Western-based media agencies can
be grounded in specific – often legal and hegemonic - ideologies and definitions
of justice. And the study finds that such, strongly legal and retributive definitions,
can be at odds with more critical understanding of justice, whether academic
or advocacy-based. The gap with local meanings of justice can be even
greater, given that justice in a context of the complex relationships of post-war
recovery needs to deal with the inequalities and injustices of everyday life, of
livelihoods and well-being of the majority. In conclusion, the study finds that
whilst definitions of justice in Facing Justice are widely dispersed and multiple,
some meanings have become hegemonic, and others are contested, or even ignored.
In all the frames, including gender justice, contested terrain remains between
dominant legal justice approaches and more locally-based restorative definitions
of justice which propose various forms of resistance to hegemonic
meanings of justice.","['post-war transition', 'representation', 'media', 'radio', 'donor/partnership relationships', 'meanings of justice', 'legal justice', 'restorative justice', 'gender justice', 'Uganda']"
The effect of development induced displacement on relocated household: The case of Addis Ababa,"Gebreegziabher, Tesfa Teferi",2014-12-12,['Berner Erhard'],International Institute of Social Studies,"From the total of development-induced displacement, 60% (6 million displaced people) in the world are caused by urban related projects (Stanley 2004, Robinson 2003). Likewise, the city government of Addis Ababa is undertaking huge displacement program aiming to provide decent houses for its dwellers and to change the image of the city through inner city slum rehabilitation. Providing land for the displaced having land tenure right, condominium houses and finally kebele houses are the three relocation strategies but two of the three are the concern of this paper. Generally, what effect does have the displacement program on relocated livelihood and more specifically how the strategies enacted by the city government has affecting the displaced households requires to be examined.
In this paper, the effect of displacement on relocatees livelihood in terms of economy, social solidarity and basic services and infrastructure is assessed using both qualitative and quantitative data collection approach. The findings of the study are substantiated and examined using literatures to see how it suit or deviate from the existing theory farmed through impoverishment, risks and reconstruction (IRR) model, the “right to the city” approach and housing. It argued that displacement program enabled some households to possess condominium houses (who able to pay). However, the paper also explores the former area( inner city) has multidimensional importance for dwellers in terms of source of their livelihood, residence area, centre of social solidarity and as hub of all basic services and infrastructures. In contrary, the new area (both condominium and Kebele houses) accessing all these benefits is too difficult. Kebele dwellers are always scared and continuing unstable since the substitute kebele houses will be demolished soon. Likewise, condominium dwellers are also facing critical financial constraints to cover the mortgage payment.","['development-induced displacement', 'relocation', 'relocatees', 'kebele houses', 'condominium houses']"
"Lives of those left behind: An ethnographic study on the vulnerabilities of women in the aftermath of farmer suicides in Yavatmal, Maharashtra, India","Rao, Prarthana Jagannatha",2014-12-12,['Chhachhi Amrita'],International Institute of Social Studies,"Agriculture is the primary sector in India. A large percentage of the population still relies on agriculture for its employment in one form or another, thereby making it the largest employer in the country. Despite its obvious relevance in terms of generating employment and creating agricultural self sufficiency in India, the government has continued to ignore its importance by gradually decreasing its investment in agriculture. Adding to this, liberalization of the Indian market in 1991 proved to be a turning point for the agricultural sector, which was bombarded with new investors, commercialization of crops and increased competitiveness.
As a result of this, Indian farmers were left vulnerable and unprotected, forced to bear the brunt of inadequate policies and safeguard mechanisms. Farmers, under the pressure to increase productivity and perform well, started committing suicide. Certain states, because of their geographical location and its connection to certain crops, became more susceptible to crop failure, in this era of climate change. The state of Maharashtra which is primarily suitable for growing cotton, is one of them. Statistics began showing that every thirty one minutes, a farmer committed suicide in India. This issue started gathering a lot of attention in the mid 2000s. Various forms of media started visiting these suicide prone sites in an effort to understand the phenomenon. Since then, a lot of research has been done on the reasons for farmer suicides. However, very little has been written on the repercussions of these suicides on the members of the household who survived, especially the women. These women are forced to deal with the harsh reality of not just a loved one dying but also the additional burden put on their shoulders at the loss of an earning member of the family. In an effort to understand the lives of these women, this paper will aim to highlight their stories and their vulnerabilities, thereby providing a medium to hear their voices and set a starting point for further research on how their lives can be made more secure.","['farmer suicides', 'livelihoods', 'vulnerabilities', 'government', 'women', 'gender', 'welfare']"
Land Policy and the Maasai in Tanzania: The Demise of Pastoralism?,"Looloitai, Lilian Joseph",2014-12-12,['Spoor Max'],International Institute of Social Studies,"The pastoralists Maasai primarily depend on livestock keeping for their subsistence
which requires access to grazing land and water for maintaining their traditional
systems. Mobility is fundamental to control rangeland degradation and
sustain pastoralism. The current land policy and increasing privatization of land
within the rangelands in Tanzania are seen as quite contrary to the interests of
the Maasai, and might lead to the demise of their pastoralism system in the future.
Existing land related policies and legislations are suppressing the pastoralists
Maasai rights to access, use and manage their common grazing land. The
case study of Ewor-endeke village is affected considerably by the implementation
of private property rights. Land privatization is not of any value to the
Ewor-endeke people who are still depending on pastoralism rather than source
of demise and extreme poverty.","['pastoralism', 'mobility', 'land policy', 'property rights', 'Maasai', 'Ewor-endeke', 'Tanzania']"
The Unintended Consequences of Change in Microfinance Regulation (A case study of Nigeria),"Akanni, Ayodamope Funmilade",2014-12-12,['Cameron John'],International Institute of Social Studies,"Considering the economic conditions of the developing countries, it is crucial to provide financial inclusion in order to alleviate the poor living standard of people and bring as much people above the poverty line. …………. Provision of access to credit may be one of the most productive ways to emancipate human capacity and reduction of income poverty. As stated by the former World Bank president; James Wolfensohn, microfinance fits directly to the aim of poverty reduction and standard of living improvement through the provision of loans and technical assistance to the poor (Mishra et al. 2013 : 237). ………………
The microfinance institutions of Nigeria were formerly named community banks, but the name and regulation was changed due to the malpractices in the whole banking sector and the envisaged imminent doom in the Nigerian Financial sector which necessitated an infusion of new banking regulations and capital requirement increase. The regulation did not particularly augur well with the microfinance banks in terms of consequences of illiquidity and limited funds to transact with. Owing to the liquidity portfolio of the microfinance banks, the financial literacy and borrowers’ capacity of their supposed target client, the MFIs in Nigeria found themselves at the cross-roads of trade-off between sustainability and outreach which happens to MFIs owing to their capital base and transaction cost on the verge of expansion which is a consequence of their compliance to prudential supervision and regulation (Cull et al. 2011:961).","['Microfinance', 'Outreach', 'Sustainability', 'Mission drift', 'Poverty', 'Adverse Selection', 'Moral Hazards', 'Transaction Cost', 'The Six Cs']"
"A Cost-Benefit Analysis of Monetary Integration
The Case of Lesotho, Namibia, and Swaziland in the CMA","Nainda,  Abigail V.",2014-12-12,['Murshed Mansoob'],International Institute of Social Studies,"This paper investigates the cost and benefits of the smaller member countries in Southern Africa on their participation in the currency area, namely the Common Monetary Area (CMA). Monetary unification may help economic integration; this in part is viewed as a way of improving macroeconomic man-agement for the various member countries involved. To this effect, it was found that given the high degree of openness of the economies of Lesotho, Namibia and Swaziland (LNS) and their small size, the use of nominal ex-change rate as an instrument of adjustment will render limited impact. For that reason, the current peg to the Rand affords greater benefits than costs to the LNS countries. Nonetheless, if the South African economy becomes unstable at any point in time, this will have major repercussions to the rest of the CMA given its powerful muscle in the current arrangement and the degree of de-pendency of the LNS countries on the anchor economy. Furthermore, fiscal consolidation within the currency area is deemed necessary and the manage-ment of fiscal accounts should be highly considered for the LNS economies as this also leads to more synchronized business cycles between member coun-tries.","['Optimum currency area', 'economic and monetary integration', 'monetary union', 'currency area', 'regional integration', 'customs union']"
"Estimating the Overall Revenue, Technical and Allocative Efficiencies of Ethiopian Commodity Exchange (ECX) Authority","Gizaw, Solomon Demissie",2014-12-12,['Murshed Mansoob'],International Institute of Social Studies,"This study estimates the mean Overall Revenue, Technical and Allocative Efficiencies of Ethiopian Commodity Exchange (ECX) market for the seventeen locations from 2009 to 2013 and also identifies the significant inefficiency effects (determinants) of an ECX transaction process. Moreover, this paper compares the technical efficiency of the two famous firms’ efficiency analyzing models: the Stochastic Frontier Analysis (SFA) and Data Envelopment Analysis (DEA). All input expenditure data and output exchanged through ECX trading channel over the range of the study period have used for estimating all the above efficiency scores. The whole inputs expenditures have categorized as Labor, Depreciation Expense (Capital Used), Warehouse and Office Rent and Other Material cost nominated as “others”. The major commodities considered as an output-indicators are Coffee, Pea Bean and Sesame constitutes more than 99 % of the agricultural commodity exchanged on the ECX trading floor, which are traded for export market that could be the foreign currency source for the country. The aggregated value of the daily exchanged quantities of each commodity multiplied by their corresponding daily prices has used as a proxy of output indicator for both SFA and DEA models efficiency score estimations. Therefore Output-oriented Revenue Function is the best fit equation for this data set and the Constant Returns to Scale (CRS_TE) estimated in the DEA model is considered as Overall Revenue Efficiency of the ECX. Using a DEA model, the mean Overall Revenue, Technical, and Allocative efficiency scores estimated for seventeen DMUs for the last five years are 0.60, 0.63 and 0.95 respectively. Alternatively, the mean Technical Efficiency score estimated using Stochastic Frontier Analysis (SFA) model is 0.81. The DEA model revealed that only two independent variables nominated as “ASSYIN” and “LLRC” are significantly affecting the Overall Revenue Efficiency of the ECX market.","['Ethiopian Commodity Exchange (ECX)', 'Revenue efficiency', 'Technical efficiency', 'Allocative efficiency', 'DEA Model and SFA Model']"
Mobilising movement against fracking: An ethnographic exploration of ‘Reclaim the Power’ anti fracking action camp,"Olofsson, Malin Joanna",2014-12-12,['Arsel Murat'],International Institute of Social Studies,"Based on ethnographic field work conducted during the 2014 Reclaim the Power- Anti Fracking Action Camps, using participant observations, informal discussion and interviews, this study explores coalition formation between ac-tors with very different political and ideological orientations. Evidence from previous environmental direct action groups illustrates how diverse interests, motivations and tactics lead to irreconcilable tensions. This study explores the diverse political and ideological orientations of activists at Reclaim the Power, their demands and objectives, how representation within the camp was negotiated and ultimately how their demands were expressed, as a means to explore the formation of broad based coalitions. Different approaches from the social movement literature are used for analysis. The study illustrates how despite diversity a strong coalition was formed based on the broad resonance of the framing of RTP as a social, economic and environmental justice movement. Framed as such fracking provided an anchor for broad struggles against the state and the political and economic system to form alliances with struggles over localised social and environmental risks facilitating the formation of diverse coalitions.","['fracking', 'anti fracking movement', 'activism', 'social movements', 'radical envi-ronmental movements', 'coalitions', 'UK']"
