title,author,date,supervisor,faculty,abstract,keywords
Conflict of harmonie?,B.A.J.M. Lombarts,2015-07-27,"['J.C. van der Vlies', 'D. van Lente']","Erasmus School of History, Culture and Communication","Enerzijds zijn er in de geschiedenis conflicten ontstaan tussen de natuurwetenschap en religie. Anderzijds werden er pogingen ondernomen door confessionelen om de natuurwetenschap in een andere vorm naar voren te brengen die aansloot bij hun wereldbeeld. Maar hoe komt dat naar voren in schoolboeken? Mijn onderzoeksvraag luidt: Hoe komt natuurwetenschap naar voren in protestantse en katholieke schoolboeken in Nederland gedurende de periode van 1920 tot 1970? Onderzocht wordt hoe de auteurs van de twee denominaties de geschiedenis van de natuurwetenschap overbrachten op leerlingen. Tevens wordt er onderzocht hoeveel waarde de auteurs hechtten aan de wetenschap in hun eigen tijd en hoe zij dat probeerden over te brengen op de lezers van hun methoden. Er wordt in dit onderzoek een onderscheid gemaakt tussen schoolboeken tot 1950 en boeken die in de jaren zestig van de twintigste eeuw zijn uitgegeven. Zo is onderzocht of er een verschil naar voren komt op het gebied van de natuurwetenschappen in schoolboeken met een katholieke of een protestantse signatuur. Op deze manier is ook onderzocht of er een verschil bestaat tussen ‘verzuilde’ en ‘ontzuilde’ geschiedenisboeken. De geschiedenismethoden zijn kwalitatief en kwantitatief onderzocht. Door middel van een kwalitatieve analyse is er ingegaan op de inhoud om zo de gedachtegang van de auteurs te achterhalen. Aangezien dit onderzoek zich richt op de productiekant van het schoolboek, wordt dit gedaan door de inhoud van de onderzochte geschiedenismethoden te koppelen aan informatie over de auteurs. Op die manier is getracht te achterhalen met welk achterliggend doel de methode geschreven is. Daarnaast is er gebruik gemaakt van een kwantitatieve inhoudelijke analyse om inzichtelijk te maken welke en hoeveel wetenschappers er naar voren komen in de onderzochte methoden. Door het gebruik van een inhoudsanalyse kan er een objectief, meetbaar en verifieerbaar verslag gegeven worden van de aantoonbare inhoud van de methoden. Zo wordt duidelijk welke natuurwetenschappers volgens de auteurs het meest relevant zijn. Uit het onderzoek blijkt dat veel auteurs de natuurwetenschap op geheel eigen wijze integreerden in hun geschiedverhaal. Het zwaartepunt werd dan ook niet door elke auteur op dezelfde facetten gelegd die met de natuurwetenschap samenhangen. Zo werd niet door elke auteur een relatie gelegd tussen de natuurwetenschap en specifiek het protestantisme of katholicisme. Vooral bij de schoolboeken met een protestantse signatuur is dat het geval. Uit het onderzoek blijkt dat de katholieke auteurs verschillend dachten over de manier waarop men om moest gaan met de moderniteit en hoe deze overgedragen moest worden op hun lezers. Om die reden zijn er verschillende verzuilingstheorieën van toepassing op de onderzochte methoden.","['Verzuiling', 'Ontzuiling', 'Schoolboeken', 'Katholicisme', 'Protestantisme', 'Natuurwetenschap']"
Happily ever after in Cyprus,"Dimitriou, Andreas",2015-07-21,['Kersten A.'],"Erasmus School of History, Culture and Communication","This thesis is a qualitative research on the discourses about romantic love of young Cypriot women who are either heavy or non heavy viewers of romantic comedies. Cyprus is an interesting place to undertake such a research about romantic love because despite the fact that its culture is being progressively westernised, it still has great links with traditional values including ideas about romantic love. The research question being addressed is how the discourses of heavy and non-heavy viewers of romantic comedies can be distinguished and typified. In order to answer the research question 14 qualitative interviews were conducted with young Cypriot women. Following a cultivation theory approach the participants were separated into 7 heavy viewers and 7 non-heavy viewers of romantic comedies. A main assumption of this thesis was that heavy viewers hold more idealistic views on romantic love than the non-heavy viewers of romantic comedies. The analysis of the transcribed interviews which was conducted to answer the research question followed a discourse analysis approach. Several concepts of romantic love are being discussed including the distinction between the prosaic notion of love and the idealistic notion of love. Romantic ideals that are being depicted in romantic comedies and are found in the discourses of heavy and non-heavy viewers are also been discussed. Romantic comedies in this thesis are valued as a global product and are being discussed in terms of global and American media culture.","['Cyprus', 'Heavy viewers', 'cultivation theory', 'romantic love', 'romantic comedies']"
SCRUM.,M. Hlubinová,2015-07-20,"['S.F. van der Land', 'J. Jansz']","Erasmus School of History, Culture and Communication","Innovation and creativity are essential for organization performance, especially in current highly competitive and rapidly changing environments (Shin et al., 2012). With this increasing competitive edge, the companies have searched for tools that would facilitate innovation, speed and flexibility of work. Agile methods, as a new flexible and responsive tool to enhance team productivity, have become a popular choice within product development companies. Scrum is the most popular method within agile with over 52% of companies implementing it (Chan, 2013). With the lack of empirical research on innovation aspect of Agile methods, this paper aimed to fill in the gap in the literature, focusing on how Scrum enhances the communication essential of collaborative innovation. We conducted a qualitative in-depth analysis of Scrum method of work, focusing on one case study complemented with two expert interviews and an observation. The case focused on the Scrum team of the company Funda, which works in the field of internet based real-estate. The results showed that Scrum could enhance the communication aspect of innovation in the following matters. The team heterogeneity could increase communication and innovation within the teams. The flexibility that Scrum facilitates might increase freedom of work which could further enhance spontaneous communication. The built-in interactivity of teams also seems to increase the creativity flow within the teams with the ultimate goal of innovation. The product owner was found to be the bridge between the team and stakeholders and became the push point of creativity. Being transparent when communicating with the team and stakeholders seems to facilitate the ease of communication and could enhance the clarity of information flow. The freedom over work might increase responsibility which further seems to enhance the motivation and productivity of the team. We found that within the Funda Scrum, responsibility did not need to be communicated, it rather happened naturally during the process. Finally, the flexibility facilitated by Scrum seems to increase spontaneous communication and interaction of team members. The social aspect seemed to be the most significant aspect of the team. The results have shown that transparency, responsibility, problem solving and team spirit are essential components of the social aspect of the Scrum teams. The implications for theory and practice are discussed.","['Scrum', 'Communication', 'Collaborative Innovation', 'Team', 'Creativity']"
"SMEs:
Joining the Online Conversation?",C. Smolders,2015-07-19,"['J.H. Pridmore', 'H.J.C.J. Hitters']","Erasmus School of History, Culture and Communication","Purpose: The purpose of this thesis is to add to the existing knowledge of digital
marketing adoption and management by Dutch SMEs. Digital media have extended
the array of possibilities for businesses and customers to interact with each other.
Yet, relatively limited research is done on how SMEs use digital media to attract,
maintain, and enhance customer relationships. Information technologies hold great
potential for smaller businesses due to idea that e-marketing and social media
marketing require a limited amount of financial and human resources as oppose to
traditional marketing incentives. Therefore, the aim of this thesis is to uncover how
Dutch SMEs operating in the service industry adopt and use digital media through
personal accounts of SME owners/managers.
Research question: Do service-based Dutch SMEs adopt and use digital media to
attract, maintain, and enhance customer relationships? And, if so, how?
Methodological approach: Data was gathered through semi-structured interviews
with SME owners/managers. Participants were recruited using purposive and
snowball sampling. The interview data was analyzed from a directed qualitative
approach using template analysis.
Findings: The findings indicate that Dutch SMEs do, in fact, employ different tactics
to leverage the possibilities of the Web 2.0 varying from integrated marketing
techniques to extending their service via digital media. It appears that SME
manager/owners are aware of their presence as commercial entity. They use those
channels not to promote their company, but to engage their customers by creating an
approachable social identity, ensuring consistency, and providing an extension of
their service. Moreover, the role of SME owners as end-user influences both SME
adoption process as well as its communications management.","['technology adoption', 'SME', 'relationship marketing', 'e-marketing']"
“The most important relationship is the one you have with yourself”,J.Peters,2015-07-14,"['S.R.J.M. van Bohemen', 'M.S.S.E. Janssen', 'S.Aupers']","Erasmus School of History, Culture and Communication","Authoritative cultural sociological theories on contemporary romantic relationships employ the grand narrative of a shift from “traditional” to “modern” societies, as a result of which relationships are now supposedly “individualized” and “fluid”. Much in the same spirit, the polyamorous philosophy, which allows individuals to be romantically involved with more than one person at a time, aims to let go of the traditional monogamous norm in order to “keep the options open” and “avoid fixation”. Based on 12 in-depth biographical interviews with polyamorists and fieldwork at non-monogamy meetings in The Netherlands, I argue that the link between individualization and polyamory is legitimate, but that 1) polyamory’s individualism is a meaningful and structured discourse rather than a random phenomenon, and 2) it is socialized within delineated social environments, namely “queer” and “holistic” culture, rather than established from scratch between idiosyncratic individuals. This paper urges current academic work on polyamory to broaden its too narrow focus on queer culture, but more chiefly, it aims to remind cultural sociologists of the fact that one cannot stop after attributing a phenomenon to “the individualization”, as it is a black box concept that needs to be further dissected.","['Polyamory', 'non-monogamy', 'individualism', 'queer culture', 'holism', 'identity', 'detraditionalization']"
Creating Space Together,W.M. van Baalen,2015-07-12,"['D. Trottier', 'I. Awad Cherit']","Erasmus School of History, Culture and Communication","This study explores how the Pauluskerk, in Rotterdam, aims to create a social space for those individuals who commonly find themselves in the margins of society. More specifically, this study investigates the role their community art initiative plays in the process of reaching this objective. In order to adequately study this phenomenon, the researcher spent 50 hours engaged in participant observations at various Pauluskerk settings and events. Also, twelve in-depth interviews were conducted with organizational members and visitors. The conceptual canvas of this study is primarily colored by Lefebvre’s work on the production of space. This perspective facilitates a better understanding of how the Pauluskerk ameliorates the experience of marginality by creating a place to be. The community arts initiative is highly influenced by the ambiguous organizational setting in which it is organized. As a result, it fulfills three main functions in the production of a social space. First of all, it adds Role Flexibility. It allows individuals to escape undesired social roles, they can experiment with different roles, and thus engage differently with the world around them. Secondly, it presents an additional means of communication as of which unnecessary silence is broken. And thirdly, the community arts initiative offers a choice. It assures more symmetrical relationships between organizational members and visitors. Altogether, this illustrates that the Pauluskerk does not create a social space for the marginalized. On the contrary, they succeed in producing a social space with the marginalized. The visitors are part of the production process; they become co-authors of space.","['Social Space', 'Community Art', 'Marginality', 'Faith-Based Organizations']"
"Geschiedenisles, kunst of vermaak?",S.F. van Riet,2015-07-09,"['B.C.M. Kester', 'A.F.M. Krijnen']","Erasmus School of History, Culture and Communication","De Nederlandse historische speelfilm doet goede zaken in de Nederlandse bioscopen. De film Michiel de Ruyter is hier het meest recente voorbeeld van. Ook films als Zwartboek en De storm hebben het in het nabije verleden goed gedaan in de Nederlandse bioscopen. Dat deze films goed bekeken worden staat buiten kijf, maar hoe deze films bekeken worden is veelal een raadsel. Deze films tonen, op hun eigen manier, een stukje van de Nederlandse geschiedenis, maar onderwerpen deze eerst aan de nodige dramatisering. Er is veel geschreven over wat deze dramatisering betekent voor de historische lading van de film en de potentiele educatieve waarde die deze films vervolgens kunnen hebben, maar niet over hoe de doorsnee kijker vervolgens kijkt naar deze historische lading, of welke culturele waarde deze films kunnen hebben buiten hun historische lading om. Voor dit thesisonderzoek is dan ook niet alleen onderzocht hoe historici, filmrecensenten of het doorsnee publiek naar deze films kijkt, maar is onderzoek gedaan naar alle drie deze publiekssegmenten, om een beeld te schetsen van welke elementen zij belangrijk vinden aan deze films en hoe zij de waarde van deze cultuurproducten bepalen. De onderzoeksvraag luidde dan ook: Hoe waarderen historici, filmrecensenten en het publiek Nederlandse historische speelfilms?
	Om deze onderzoeksvraag te beantwoorden is een kwalitatieve analyse uitgevoerd op drie verschillende soorten bronnen. Er zijn historici geïnterviewd en filmrecensies en publieksreacties verzameld op internetfora, welke allemaal zijn gebruikt om inzicht te verwerven in de manier waarop deze drie groepen naar deze films kijken. 
	Waar voorafgaand aan dit onderzoek verwacht werd dat er een duidelijk scheiding te zien zou zijn tussen hoe de drie publiekssegmenten historische speelfilms waarderen, bleek achteraf dat er veel overlap te vinden was tussen wat historici, recensenten en doorsnee kijkers van belang vinden in deze films. Historici vinden de historische lading van een speelfilm uiteraard van belang, maar begrijpen de noodzaak voor de filmmaker om bepaalde zaken aan te passen en te dramatiseren. Recensenten kunnen ook veel belang hechten aan het historische verhaal van een film, maar zullen uiteindelijk toch de kwaliteit van het product op zich het belangrijkst vinden. Afsluitend is het doorsnee publiek net zo kritisch over de kwaliteit van de films als een recensent, maar kan ook veel waarde hechten aan de manier waarop de geschiedenis in beeld gebracht wordt. Er blijken geen eenduidige manieren van filmkijken te zijn tussen deze drie groepen te zijn wanneer het om historische speelfilms gaat. Wanneer de aftiteling over het scherm rolt, iedereen in het publiek met vrijwel dezelfde ogen naar dezelfde film heeft gekeken.","['Historische speelfilms', 'filmpubliek', 'filmrecensenten', 'historici', 'receptieonderzoek']"
Willing to Talk?,I.V. Petkova,2015-07-08,"['K.E. Dilbeck', 'I. Awad Cherit']","Erasmus School of History, Culture and Communication","The number of international students following programs abroad has doubled in the last decade. This has led researchers to take interest in foreign students’ experiences in international educational environments in order to better understand and improve their international encounters. One of the leading reasons for stress and failure of international students was found to be the language barrier. This language barrier has been seen as strongly correlated with communication apprehension and perceptions of communication competence. More precisely, international students feel that their self-perceived communication competence and willingness to communicate are lower in their nonnative language compared to their native one. This also leads them to experience communication apprehension and essentially withdraw from talking altogether. Those three reasons have been researched in the past as communication traits which correlate and predict one another. In order to understand and help international students and instructors with the problems they face, a deeper understanding of those communication traits relating to language needs to be gained. Therefore, this study combines the common variables which are said to create problems for international students and explores how communication traits vary in the use of native and nonnative languages. In order to analyze a truly international environment, responses from students coming from 30 different countries were collected. Through the use of a quantitative survey which was then statistically analyzed it was discovered that students had higher mean scores in their native language compared to their nonnative ones for all three communication traits. All three communication traits had a statistically significant correlation which corroborated previous research. Additionally, their preferences for who they talk to and how in terms of context were found. Generally, international students felt most competent and were most willing to communicate in dyads or small groups with friends and acquaintances. Finally, the research explored the prediction powers of the three communication traits. It was discovered that between self-perceived communication competence and willingness to communicate the later was a better predictor of native language communication apprehension and that native language communication apprehension was the best predictor of nonnative communication apprehension. More research concentrating on an international educational environment needs to be done in order to gather information especially relating to language since it is the major problem international students face while following programs abroad.","['Communication traits', 'International Students', 'Nonnative Language']"
"""Vaak lost dat vanzelf op doordat diegene dan zelf het probleem is""","Glasz, M. (Magrite)",2015-07-06,"['Uitermark Prof.dr. J. (Justus)', 'Rijshouwer MSc. E. (Emiel)']",Erasmus School of Social and Behavioural Sciences,"Participatieprofessionals spelen een sleutelrol in de transitie van welzijnswerk naar commerciële maatschappelijke ondernemingen. Bij het aansturen van vrijwilligers gebruiken zij ondernemersstrategieën, afkomstig uit het teamwerk in flexibele organisaties en gekenmerkt door het ontkennen van reële verschillen in beperkingen. Hoewel zij hiërarchische verhoudingen vermijden en essentiële verschillen in risicoconsequenties, middelen en reserves bagatelliseren, markeren deze professionals desondanks moreel getinte grenzen tussen zichzelf en de doelgroepen van hun maatschappelijke projecten. Waar een deel van hen – veelal participatiemakelaars – de doelgroepen stigmatiseert, markeert een ander deel – vooral creatieve ondernemers – grenzen met het etaleren van de eigen kwaliteiten, waarbij een goede neus voor verdienmodellen in de praktijk de kernkwaliteit blijkt. In beide gevallen gaat het echter om waardeoordelen op het vlak van zelfredzaamheid: algehele gezondheid, (pro)activiteit, onafhankelijkheid, verantwoordelijkheid, ondernemingszin en vooral: een positieve basishouding. Zowel de sociale als de individuele veerkracht van kwetsbare groeperingen dreigt door het privatiseren van grootschalige maatschappelijke problemen af te nemen.","['morele grenzen', 'ongelijkheid', 'participatiesamenleving', 'precariaat', 'vrijwilligerswerk', 'wederkerigheid']"
Everything is intertwined,"Tongeren, Maria. van",2015-07-03,['Kersten A.'],"Erasmus School of History, Culture and Communication","In this study, it is examined what the motives and aesthetic preferences are of the
loyal visitors of art museums. By means of a case study performed at Museum
Boijmans Van Beuningen, where in-depth interviews have been conducted with
thirteen of its loyal visitors, insight has been given into this target group. The results
show that the loyal visitors like to be challenged emotionally as well as intellectually
by art. In addition, art plays a very important role in their lives, and they value various
functions of art like learning, inspiration, and escapism. Moreover, the results show
that the loyal visitors of Museum Boijmans Van Beuningen mostly prefer to
experience art on their own, while they are fully concentrated, but that they also
appreciate the social function that art has. This study is conducted to gain more
knowledge about the group of loyal visitors of art museums and to see if Museum
Boijmans Van Beuningen can use the results to improve the relationship that it has
with its audience.","['Art museums', 'loyal visitors', 'intrinsic motives', 'extrinsic motives', 'aesthetic', 'preferences', 'cultural participation', 'Museum Boijmans Van Beuningen']"
When the Arts meet the Crisis… Towards an Artistic Self-Transcendence of the Artists?,"Apostolakou, Maria Titsa",2015-07-02,['Reijnders S.L.'],"Erasmus School of History, Culture and Communication","At present, in the year 2015, Greece is confronted with an impending bankruptcy and faces one of the worst socio-political crises of the last decades. On account of these unfavourable conditions, young, not yet established artists encounter numerous hindrances in relation to their artistic creations and their careers. The addressed research question of this thesis explores whether these young artists have been influenced by the economic crisis and how they depict that influence in their artwork. In order to examine this phenomenon, this research utilises a qualitative approach, as it analyses the in-depth interviews of undergraduate students of the Athens School of Fine Arts. One of the key assumptions of this thesis is that young artists have indeed been influenced by the socio-political and economic crisis in terms of the materials they select and the opportunities which are offered to them. Another assumption is that the context of socio-political and economic instability motivates, if not forces, young artists to seek inventive alternative ways to exhibit their artwork, due to the currently limited access to the art market, and is also likely to lead to the emergence of a new artistic wave. Furthermore, it is argued in this thesis that artists depict this influence in their artwork either by using darker colours or through the artworks’ thematic which comments on the socio-political context. The scientific relevance of this research is based on the examination of the role of the arts within society and the importance of the role that artists play as active members of society. The analysis is based on the transcribed interviews with the undergraduate students and examines the four main themes which emerged along with several subcategories.","['Economic Crisis', 'Young', 'not yet established artists', 'Influence on the artwork', 'Gatekeepers', 'Market context', 'New artistic wave']"
