title,author,date,supervisor,faculty,abstract,keywords
INCOME AND EMPOWERMENT: (HOW) DOES IT WORK?,"Schoof, C.",2016-08-25,"['prof.dr. A.G. Dijkstra', 'prof.dr. H.J.M. Fenger']",Erasmus School of Social and Behavioural Sciences,,
Sanctions and al-Qaeda,"Nunen, W. van",2016-08-25,['dr. M. Onderco'],Erasmus School of Social and Behavioural Sciences,,
The Right to Food in Latin America and the Caribbean,"Ozbun, W.S.",2016-08-25,"['dr. M. Onderco', 'dr. A. Jungen']",Erasmus School of Social and Behavioural Sciences,,
A case study on the influence of boundary-spanning activities on the effectiveness of governance networks,"Bosma, J.",2016-08-25,"['dr.ir. J. Eshuis', 'dr. I.F. van Meerkerk']",Erasmus School of Social and Behavioural Sciences,,
Interest groups and information framing at the European Parliament,"Menne, B.",2016-08-25,"['prof.dr. M. Haverland', 'prof.dr. S. van der Walle']",Erasmus School of Social and Behavioural Sciences,,
What are the controversies between actors around the Água Espraiada Consortia Urban Operation social dimension and how effective is the municipality of São Paulo strategies to address these asymmetries?,"Gheneim de Camargo, R.",2016-08-25,['prof.dr. E.H. Klijn'],Erasmus School of Social and Behavioural Sciences,,
Success struggles and steering,"Lindeboom, I.F.",2016-08-25,['prof.dr. J. Edelenbos'],Erasmus School of Social and Behavioural Sciences,,
Democratische Economie,Eduard van Scheltinga,2016-08-24,"['dr. G.H. van Oenen', 'dr. H.A. Krop']",Erasmus School of Philosophy,"In deze scriptie bespreek ik democratische economie. De mogelijkheid hiervoor zijn de scheuren in de verbinding van democratische politiek en kapitalistische economie. De samenlevingen met democratische politiek en kapitalistische economie zijn na de Tweede Wereldoorlog tot stand gekomen met de sociaal-democratische consensus. Democratie werd in het politieke domein getolereerd en in de economie werd kapitalisme getolereerd. In de zestiger jaren werd met de afbraak van autoriteit ook democratie in het privé domein getolereerd. De sociaal-democratische consensus was een bijzondere onderneming: niet eerder gingen democratische politiek en kapitalistische economie op deze schaal samen. Maar deze consensus heeft aantoonbare problemen en het is lastig denkbaar dat deze in de huidige vorm nog lang blijft bestaan. In het eerste hoofdstuk bespreek ik de achtergrond om onderzoek te doen naar democratische economie. De afgelopen dertig jaar wordt democratische politiek steeds meer ingeperkt door kapitalistische economie. Daarmee lijkt het erop dat democratische politiek niet voldoende is om een samenleving democratisch te organiseren. Een mogelijke oplossing daarvoor is het democratiseren van de economie. Maar aan democratische economie is tot nu toe weinig theoretische invulling gegeven. In deze scriptie verken ik daarom democratische economie. Ik beargumenteer in hoofdstuk twee en drie dat werkers en betrokkenen tot de demos van een democratisch bedrijf kunnen behoren. In hoofdstuk vier bespreek ik een opvatting van democratie die in bedrijven bruikbaar is. Ik bespreek dat democratie opgevat kan worden als voor allen een gelijkwaardig aandeel in de oorzakelijkheid. Vervolgens bespreek ik in hoofdstuk vijf bestaande exemplaren van democratische bedrijven. Daarbij ga ik in op hoe democratie in deze bedrijven functioneert en wat er nodig is voor een democratisch bedrijf. In hoofdstuk zes bespreek ik dat een economie democratisch kan worden georganiseerd door democratie in de economie te verspreiden. Zo kan democratie universaliseren in de economie. Aangezien deze scriptie over democratische economie gaat, bespreek ik met name de economie. Alleen in hoofdstuk een en zes komt de bestaande democratische politiek aan de orde. Hoewel er veel in de democratische politiek kan veranderen, heb ik ervoor gekozen om me te richten op de economie. De reden daarvoor is dat er sinds de jaren 1970 weinig aandacht is voor democratische economie, terwijl het een rol kan spelen in het democratisch gehalte van de samenleving. Democratische economie is in deze scriptie geen vervanging voor democratische politiek, maar een aanvulling op de bestaande situatie.",
Finding a New Way to Guarantee Human Dignity: an Analysis of Arendt's Notion of the Right to Have Rights,Luuk van Rij,2016-08-23,,Erasmus School of Philosophy,,
Competentiegericht onderwijs in het hoger beroepsonderwijs,Muhammed Emin Akbas,2016-08-22,"['prof. dr. L.M. Huijer', 'dr. T.K.A.M. de Mey']",Erasmus School of Philosophy,"In deze masterscriptie wordt competentiegericht onderwijs geanalyseerd op basis van het raamwerk dat door onderwijsfilosoof Gert Biesta is ontwikkeld. Binnen dit raamwerk wordt onderscheid gemaakt tussen drie functies van onderwijs, namelijk kwalificatie, socialisatie en persoonsvorming. Geanalyseerd is in hoeverre en op welke wijze competentiegericht onderwijs invulling geeft aan deze drie functies van onderwijs. Uit de analyse komt naar voren dat deze onderwijsvorm doorschiet in het kwalificeren en socialiseren van studenten, en tekortschiet in de persoonsvorming. Dit betekent dat studenten gedisciplineerd en genormaliseerd worden om succesvol een beroep uit te voeren en onderdeel te zijn van een sociale sfeer en gemeenschap, maar dat ze geen ruimte krijgen om zich op een eigenstandige, unieke wijze te vormen. Geadviseerd wordt om competenties, de bouwstenen van deze onderwijsvorm, vanuit meerdere uitgangspunten en op een andere wijze te organiseren.",
Joods leven op Curaçao: Jossy Maduro,G. Hauck,2016-08-22,"['A.A. van Stipriaan Luiscius', 'G. Oonk']","Erasmus School of History, Culture and Communication","Vierhonderd jaar terug migreerden Sefardische joden via Nederland naar noordoost Brazilië en wat later ook naar Suriname en Curaçao. Tot op de dag van vandaag bestaan joodse gemeenschappen in deze gebieden. De blanke bevolking op Curaçao bestond voor een derde tot de helft uit Sefardische joden en zij hebben een grote bijdrage geleverd aan de bloeiende economie op het eiland. De moedergemeente in Amsterdam had een grote religieuze invloed op de joodse gemeente op Curaçao. De joodse gemeente werd georganiseerd volgens de reglementen van Portugees-Israëlitische moedergemeente uit Amsterdam en de rabbijnen werden opgeleid in Bets Haim te Amsterdam. Vanaf 1880 begon de groepsidentiteit binnen de Sefardische gemeenschap op Curaçao af te nemen als gevolgd van externe factoren, zoals de komst van de olieraffinaderij, de Tweede Wereldoorlog en versnelde communicatiemiddelen. Op Curaçao bestaat de joodse gemeenschap nog steeds voornamelijk uit een blanke elite. Uit recente onderzoeken is gebleken dat Sefardische joden zich bovenal Curaçaos voelen. Echter, hoe de Sefardische-Curaçaose identiteit in de periode tussen 1880 en 1950 eruitzag, is vooralsnog niet bekend.  In dit onderzoek wordt ingezoomd op een Sefardisch-Curaçaose identiteit in de eerste helft van de twintigste eeuw, namelijk van Jossy Maduro (1891-1964). Aan de hand van zo’n 700 brieven in de Collectie Maduro (CBG) wordt onderzocht hoe het leven van Sefardische joden op Curaçao in de tussenliggende tijd eruit heeft kunnen zien.","['Sefardisch-Curaçaose geschiedenis / joods-Caribische geschiedenis / Jewish Studies / Sephardic history / Caribbean Studies', 'Curaçao', 'Joodse diaspora', 'Micro-analyse / micro-analysis', 'Identiteitsstudie', 'Brievenonderzoek / Reading against the grain / Kwalitatieve inhoudsanalyse', 'Maduro-familie']"
Online Privacy Management,S.E. Comba,2016-08-17,"['H.J.C.J. Hitters', 'M.N.M. Verboord']","Erasmus School of History, Culture and Communication","Social media have become incredibly popular among youngsters all over the world.
Social media platforms have grown continually and have become parts of our daily
lives. Each of these social media platforms has their own guidelines, rules, goals and
purposes. For this research, the focus will be on the most popular social media
platform Facebook. Because of its popularity, it has been studied multiple times. This
study will only focus on one group of Facebook-users, namely youngsters, and more
specifically, Dutch youngsters. Dutch youngsters are using Facebook, but no study
yet has focused on this specific group. The aim of this research is to find out what
Dutch youngsters are exposing on their Facebook profile, why they choose to share
this information, and why they decide to not share other information. Moreover, this
research will gain knowledge on how Dutch youngsters protect themselves from
privacy issues, and how they build their own online privacy protection strategies. To
gain knowledge about the actual behavior of the Dutch youngsters, 10 in depth
interviews were held with boys and girls, between the ages of 13-18, born and raised
in the Netherlands. The results derived from the in depth interviews were very
interesting. The sample of Dutch youngsters seemed to be quite generous in sharing
their personal information online, while doing little to no adjustments to their standard
privacy settings on Facebook. However, while the standard settings were left
untouched, other privacy protection strategies were actively used. While the
participants did not completely understand the meaning and opportunities of the
standard Facebook settings, they did not feel that they needed to learn anything new
about privacy issues and privacy protection strategies.","['Social media', 'Facebook', 'information disclosure', 'privacy management', 'youngsters']"
Surfin’ U.S.A. or Surfin’ California?,M.B. Punt,2016-08-15,"['L.E. Braden', 'M.S.S.E. Janssen']","Erasmus School of History, Culture and Communication","This paper suggests and tests a ‘place-based aesthetics model’ in order to show the importance of place in the process of retrospective cultural consecration. By studying place as a social construct, two important dimensions of place are distinguished: ‘sense of location’ and ‘sense of locale’. In contrast to the more practical approach towards these dimensions of prior research, this study treats these dimensions in a ‘symbolic’ manner, in the sense that it makes the shift towards the social meanings and values attached to locale or location. In order to study this, a surf music dataset of 2.548 surf tracks was used. While taking into account the effects of more general predictors of retrospective consecration, the paper includes both dimensions of place in one model. The results suggest the existence of a ‘California-aesthetic’ in the genre of surf music, while associations with locale, or the material setting of social interaction, seem to be unimportant. By controlling for different forms of concurrent success, the paper concludes that this importance of ‘location’ cannot only be credited to the economical and production side advantages of the vibrant music scene of California but should partly be ascribed to certain symbolical effects of ‘place-based aesthetics’ in surf music.","['place-based aesthetics', 'retrospective consecration', 'surf music', 'location', 'locale', 'sense of place']"
Mobilizing strategies for environmental change,J. Valk,2016-08-14,"['J.S. Lee', 'M.N.M. Verboord']","Erasmus School of History, Culture and Communication","In recent years, there has been shift in the ways in which people support charities and non-profits. While
environmental groups and non governmental organizations (NGO) earlier depended on traditional
media and grassroots campaigns to get their messages heard, nowadays social media offers an additional
distribution method for their messages. However, up to now, the potential of online activism to bring
about social or political change has been debated. Advocates contend its positive contribution to
participatory democracy. Critics however, deride it as being so-called “slacktivist” activity that bear
minimal societal gain. The term ‘slacktivist’ is often used by critical scholars and practitioners who
describe a new type of activist whose participation solely entails partaking online and whose activity
bear minimal societal gain. As the act of ‘slacktivism’ becomes more and more commonplace, there is
much concern amongst charities and non-profits that this would conflict with or even replace traditional
forms of activism or political participation, such as donating money or partaking in a rally or protest.
This study contributes to this discussion amongst scholars and practitioners by analyzing the
mobilizing effects of efficacy messages on behavioral intent of environmental political participation.
The positive mobilizing effects of efficacy messages on political participation have been discussed in
the literature; however, minimal attention has been given to its specific effects on environmental
political participation. By means of an online experiment with a Dutch national sample (N = 215), this
study examines whether a fear-inducing or efficacy (internal, external, response) frame in (newspaper)
messages is a better predictor for environmental political participation. Furthermore, the mediating
effects of three discrete emotions (hope, fear, and anger) and the moderating effects of being considered
a mere slacktivist or activist are included in the conceptual model.
The findings of this study indicate that emotions fear and anger have a positive effect on
environmental political participation. When evaluating the effect of efficacy information on
environmental political participation, it appeared that such messaging had no significant effect on
perceived efficacy. Yet, the most important finding of this study is the existence of an indirect mediation
effect, meaning that the experiment reduces fear but then the reduction in fear overall reduces
participation level, despite fear’s positive contribution towards participation. Moreover, this indirect
mediation effect only happened significantly for slacktivists. The results of this study can serve as a
foundation for future studies that aim to research the effectiveness of efficacy information and emotions
on environmental political participation. As well as for practitioners in the field of environmental
communication in their mobilization strategies.","['environmental political participation', 'mobilization', 'internal efficacy', 'external efficacy', 'response efficacy', 'slacktivism', 'activism', 'mediation effects', 'hope', 'fear', 'anger']"
It takes two to tango,B.E.L. Korver,2016-08-14,"['F.M.M. de Goey', 'G. Oonk']","Erasmus School of History, Culture and Communication","The United States is in a curious relationship with the Commonwealth of Puerto Rico, a
U.S. unincorporated territory. Historiography concerning the political status of Puerto
Rico indicates a clearly distinguishable debate between critics (mostly non-U.S. scholars)
on the one hand who argue that the relationship between the continental States and
Puerto Rico resembles that of a colonial relation and U.S. scholars on the other hand that
avoid addressing the subject matter or put forth official, but ambiguous terms to defend
the relationship. The first group desires that the ambiguous relationship that has existed
since the U.S. acquisition of the island in 1898 should undergo a change so that Puerto
Rico’s status becomes internationally accepted. However, U.S. Congress, which has the
final jurisdiction over Puerto Rico’s status, seems to ignore the many requests regarding a
change in Puerto Rico’s status. The situation seems in sharp contrast with the way the
United States desires to globally present itself as a supporter of self-determination.
I assume that, despite the fact that U.S. Congress did not prioritize a status
change for Puerto Rico, Puerto Ricans have had beneficial interests in their unique
relationship with the United States and that this has had a role in why the territorial
commonwealth situation as it was constructed in 1952 is still intact. This thesis explores
the underlying interests that both the United States and Puerto Rico have in their
relationship and thereby focuses on three periods in history: 1898, the acquisition period;
1950s, the post-war era; and the 2000s, for recent developments.","['Puerto Rico', 'United States', 'status', 'twentieth century', 'debate']"
Playing to Lose?,T. Rijnberg,2016-08-11,"['C.R. Ribbens', 'M.C.R. Grever']","Erasmus School of History, Culture and Communication","In this thesis the author sets out to establish how WWII video games represent Wehrmacht soldiers when these games feature the German side as a playable faction. Because German soldiers in WWII video games are still often relegated to the role of ‘evil cannon fodder’ it is important to look at how games represent the Wehrmacht when they feature protagonists who are members of the Wehrmacht. By looking at the playable German narratives of Red Orchestra II – Heroes of Stalingrad (2011) and Company of Heroes – Opposing Fronts/Tales of Valor (2007/2009) using concepts from narratology and game studies several representative strategies emerge. The games are analysed on focalisation of the narrative, their use of historical sources, archival footage, propaganda and myths, and on the conditions set in-game which allow the German side to win a video game set in WWII. In looking at the focalisation of both German narratives it becomes apparent that focalisation does not always equate the point of view of the playable characters. Historical inaccuracies are compensated by presenting the narrative through use of propaganda and unreliable narrators. Elements of the ‘clean Wehrmacht myth’ as formulated by Alexander Pollak appear in both narratives but often work to counteract this myth. By studying the use of propaganda and symbols it becomes clear that accurate historical representation of Wehrmacht soldiers in video games suffers due to censorship laws concerning the use of National-Socialist symbols in the medium. Both games place a heavy emphasis on the psychological impact of the War on German soldiers, either through the use of embedded historical texts or through fictional personal narratives. By examining the games’ victory conditions the author establishes two victory paradigms applicable to a playable Wehrmacht, called: ‘quitting while you’re ahead’ and ‘postponing the inevitable’. The author concludes that, in representing the Wehrmacht in video games, game developers seem to prioritise psychological immersion over historical fidelity, although both games utilise historical source material throughout their respective narratives.","['game studies', 'Wehrmacht', 'World War II', 'representation', 'focalisation', 'historical fiction', 'historical semiotics', 'video games', 'history']"
Onverschillig verschil,Robert van Raffe,2016-08-11,,Erasmus School of Philosophy,,
Hard Choices,Akshath Jitendranath,2016-08-08,"['prof. dr. M.V.B.P.M. Hees', 'dr. C. Binder', 'prof. dr. J.J. Vromen']",Erasmus School of Philosophy,,
Populisme,Fabian van Dijk,2016-08-08,"['dr. G.H. van Oenen', 'dr. S. van Tuinen']",Erasmus School of Philosophy,,
De psychische malaise van de 21e-eeuwse westerse mens vanuit filosofisch perspectief,Robert van Helden,2016-08-07,"['dr. G.A.M. de Groot', 'drs. F.H.H. Schaeffer']",Erasmus School of Philosophy,"Hoewel de burgers van westerse samenlevingen in het algemeen aangeven tevreden te zijn met hun leven, blijken veel van hen het leven niet of nauwelijks aan te kunnen, met psychisch lijden als gevolg. In deze thesis wordt onderzocht wat de oorzaken zijn van het psychische lijden van de hedendaagse westerse mens. 

Aan de hand de analyses van Taylor en Verbrugge komen de (culturele en historische) ontwikkelingen aan de orde die hebben geleid tot de hedendaagse verhouding tussen het subject en de heersende cultuur. Het werk van Verhaeghe vormt de basis voor het leggen van de verbinding tussen de culturele ontwikkelingen van de afgelopen eeuw(en) en de hedendaagse psychische problematiek. 

De conclusie is dat de hoofdoorzaak van de psychische malaise van de hedendaagse westerse mens het gebrek aan gemeenschap is. Het is te simplistisch om te stellen dat het neoliberalisme hiervoor verantwoordelijk is. Wel heeft het neoliberalisme de individualisering van de westerse samenlevingen, die feitelijk al eeuwen aan de gang was, versneld.",
Ervaringsverhalen in beeld,L.C. Feenstra,2016-08-01,"['A.G. Fokkema', 'B.C.M. Kester']","Erasmus School of History, Culture and Communication","In de periode van 1946 tot 1968 komen ongeveer 300.000 repatrianten uit Nederlands-Indië naar Nederland. Tot deze groep behoren ook de Indische Nederlanders, de personen die na de Tweede Wereldoorlog in Nederlands-Indië de Nederlandse nationaliteit kregen. Bij hun aankomst in Nederland namen zij hun ervaringen, opgedaan tijdens de dekolonisatieoorlog, mee. Uit verschillende onderzoeken blijkt echter dat deze herinneringen verzwegen zijn gebleven. Er lijkt een ‘vergeven en vergeten’ houding te zijn die typerend is voor het postkoloniale tijdperk. Waarschijnlijk is er om die reden tussen 1969, het jaar waarin Indië-veteraan Joop Hueting getuigt over de geweldpleging van de Nederlandse troepen tijdens de politionele acties, en 2011 weinig media-aandacht geweest voor het koloniale verleden van Nederland. Deze maatschappelijke stilte lijkt de laatste jaren steeds meer te verdwijnen, zoals blijkt uit het feit dat er meer boeken uitkomen over de gebeurtenissen en vergeten verhalen en verzwegen herinneringen naar buiten komen.
Die verschuiving van stilzwijgen naar aandacht voor en discussie over de periode van de dekolonisatieoorlog en de repatriëring komt ook naar voren in de media. Media spelen namelijk, met hun berichtgeving als grootste bron voor informatie in de samenleving, een belangrijke rol bij beeldvorming. Zeker documentaires dragen met hun kijk op de dekolonisatieoorlog en de daaropvolgende repatriëring bij aan de beeldvorming in de samenleving. Dit onderzoek richt zich op de beeldvorming in documentaires die zijn uitgezonden op de publieke omroep, waarin ervaringsverhalen van Indische Nederlanders aan bod komen. De hoofdvraag luidt daarbij als volgt: Wat is de beeldvorming over de dekolonisatie van Nederlands-Indië en de daaropvolgende repatriëring van Indische Nederlanders, aan de hand van oral history in recente documentaires?
Met behulp van een kwalitatieve inhoudsanalyse is de beeldvorming in documentaires geproduceerd na 2011 achterhaald. Uit de analyse kwam naar voren dat de documentaires over het algemeen observerend en verklarend van aard zijn. Dat wil zeggen dat de documentaires de kijker thuis iets willen vertellen, iets willen uitleggen. De ervaringsverhalen van de Indische Nederlanders ondersteunen daarbij het argument over de werkelijkheid. Bovendien kwamen er in de documentaires verschillende perspectieven van Indische Nederlanders aan bod. In hun verhalen zijn er twee belangrijke thema’s te onderscheiden. De genocide die plaatsvond tijdens de dekolonisatieoorlog, waarbij een gehele bevolkingsgroep werd bedreigd om hun afkomst, en de Indisch Nederlandse identiteit. Het niet-Nederlands en het niet-Indonesisch zijn, heeft impact gehad op de Indische Nederlander. Ook de aankomst in Nederland heeft de Indisch Nederlandse identiteit bepaald. Om zo min mogelijk op te vallen en zich aan te passen aan de situatie besloten de Indische Nederlanders zichzelf het zwijgen op te leggen.","['Nederlands-Indië', 'dekolonisatieoorlog', 'Bersiap', 'repatriëring', 'documentaires', 'beeldvorming', 'oral history', 'ervaringsverhalen', 'Indische Nederlanders', 'Indisch zwijgen']"
